2020-11-12,"   《HKEx》- 01569 MINSHENG EDU - MAJOR TRANSACTION
COMPLETION OF PAYMENT OF TRANSFER PRICE IN RELATION TO
THE ACQUISITION OF THE REMAINING 50% EQUITY INTEREST IN
OPEN UNIVERSITY ONLINE TO OWN 100% EQUITY
INTEREST IN OPEN UNIVERSITY ONLINE "
2020-10-19,   《HKEx》- 01569 MINSHENG EDU - Monthly Return of Equity Issuer on Movements in Securities for the month ended 31 December 2020 
2020-09-02,"   《HKEx》- 01569 MINSHENG EDU - MAJOR TRANSACTION
ACQUIRING 50% EQUITY INTEREST IN
OPEN UNIVERSITY ONLINE WHICH WILL HOLD 100% EQUITY
INTEREST IN OPEN UNIVERSITY ONLINE "
