2021-01-12,"   《HKEx》- 06881 CGS - ANNOUNCEMENT
COMPLETION OF ISSUANCE OF 2021 FIRST TRANCHE
OF SHORT-TERM COMMERCIAL PAPER "
2020-12-31,"   《HKEx》- 06881 CGS - ANNOUNCEMENT
CHANGE OF OFFICE ADDRESS "
2020-12-08," CN Brokers, Insurers Echo A Shrs to Rally; Citic Series, EB Sec, China Taiping Up Over 8-11% "
2020-12-04,   《HKEx》- 06881 CGS - Monthly Return of Equity Issuer on Movements in Securities for the Month Ended 31 December 2020 
2020-12-04, CN Brokers Broadly Mirror A Shrs to Spike about 3.5%-7%  
2020-12-04,"   《HKEx》- 06881 CGS - An announcement has just been published by the issuer in the Chinese section of this website, a corresponding version of which may or may not be published in this section "
