2020-12-21,   《HKEx》- 06196 BANKOFZHENGZHOU - Monthly Return of Equity Issuer on Movements in Securities for the month ended 31 December 2020 
2020-11-30,"   《HKEx》- 06196 BANKOFZHENGZHOU - An announcement has just been published by the issuer in the Chinese section of this website, a corresponding version of which may or may not be published in this section "
2020-11-18," <Research Report>CICC Restates Optimism on CN Banks, Policy Tailwind Favours Financial Statement Recovery "
2020-10-22,   《HKEx》- 06196 BANKOFZHENGZHOU - Monthly Return of Equity Issuer on Movements in Securities for the month ended 30 November 2020 
2020-10-16, <Research Report>C Suisse: Bullish on CN Bank Outlook for Ongoing Econ Recovery 
2020-10-16,"   《HKEx》- 06196 BANKOFZHENGZHOU - An announcement has just been published by the issuer in the Chinese section of this website, a corresponding version of which may or may not be published in this section "
