2021-01-04,b'New 52 Week High today: $EMGF $JEF $BR $MT $TPR $BDEC $NDMO $BBEU $BLK $ICE $XME $WMS $CAT $EDU $ANEW $FDLO $ADI $FHLC $TPCO $INVE ... https://t.co/4Iw0QeR3p8'
2020-12-31,b'Rose Above Upper Bollinger Band today: $SYPR $SVACU $AOD $BTO $KR $GSY $SDPI $AGG $AIR $PXH $GVI $VTC $NTES $ESSC $CAMT $PALL $VWO $INVE $NDMO $WWD ... https://t.co/AyIukUGmib'
2020-12-30,b'New 52 Week High today: $NDMO $VNMC ... https://t.co/4Iw0QeR3p8'
2020-12-30,b'Reversed from Down today: $NDMO $HNRG $KALV $VTAQU ... https://t.co/uuYYhupj1A'
2020-12-29,"b""Rose Above Previous Day's High today: $PFLT $IKNX $CYRN $BRID $SKLZ $LMAT $RYU $TEO $IBMM $QUS $AQNB $NDMO $BBDC $NEA $IHTA $LINX $KOIN $EMIF $RAACU $KRUS ... https://t.co/TBYRpvrFqi"""
2021-01-08,b'20 DMA Support today: $CVGI $NEO $ACNB $CHFS $UNL $CRSA $SOLO $DFIN $ALYA $NDMO $CACC $HYMC $AXU $AMCR $GRNV ... https://t.co/deOpbNqdR6'
2021-01-08,b'Zero shares available to short currently in $NDMO.\nhttps://t.co/4Ea9p64wbN'
