2021-01-07,Minaurum Announces Option with Fortuna Silver
2021-01-07,"Zacks Industry Outlook Highlights: First Majestic Silver, Pan American Silver, Hecla Mining and Fortuna Silver Mines"
2021-01-06,4 Stocks to Watch as Silver Gains on Higher Industrial Activity
2020-12-13,Is FSM A Good Stock To Buy Now?
2020-12-10,Top Silver Stocks for Q1 2021
2020-12-01,Fortuna provides update on status of disputed royalty at the San Jose Mine
2020-11-16,4 Silver Mining Stocks to Escape the Industry Weakness
2020-11-14,Fortuna Silver Mines (FSM) Q3 2020 Earnings Call Transcript
2020-11-12,Fortuna reports consolidated financial results for the third quarter 2020
2020-11-11,Preview: Fortuna Silver Mines's Earnings
2020-11-09,First Majestic (AG) Stock Up 1% as Q3 Earnings Rise Y/Y
2020-11-05,Is Fortuna Silver Mines (FSM) Stock Outpacing Its Basic Materials Peers This Year?
2020-11-02,"Fortuna to Release Third Quarter 2020 Financial Results on November 12, 2020; Conference Call at 12 p.m. Eastern Time on November 13, 2020"
2020-10-29,"Agnico Eagle's (AEM) Q3 Earnings Top Estimates, Revenues Up Y/Y"
2020-10-20,Fortuna announces first gold pour at its Lindero Mine in Argentina
2020-10-16,Fortuna Files Early Warning Report
2020-10-14,"Fortuna reports production of 2.1 million ounces of silver and 12,791 ounces of gold for the third quarter of 2020"
2020-09-30,"Zacks Industry Outlook Highlights: Pan American Silver, Hecla Mining, Fortuna Silver Mines, Avino Silver & Gold Mines and Great Panther Mining"
2020-09-23,Why Silver and Gold Miners Are Dropping Today
2020-09-21,"Why Fortuna Silver, Coeur Mining, Endeavour Silver, and Great Panther Mining All Dropped Today"
2020-09-17,Top Silver Stocks for Q4 2020
2020-09-14,Fortuna launches new sustainability section on website
2020-09-03,"Fortuna initiates irrigation and leaching of ore at the Lindero gold Project, Argentina"
2020-08-28,Penny Stocks to Watch for September 2020
2020-08-15,Fortuna Silver Mines (FSM) Q2 2020 Earnings Call Transcript
2020-08-13,Fortuna reports consolidated financial results for the second quarter 2020
2020-08-12,A Preview Of Fortuna Silver Mines's Earnings
2020-08-12,Is a Surprise Coming for Fortuna Silver (FSM) This Earnings Season?
2020-08-07,10 Biggest Silver Mining Companies
2020-08-04,"Fortuna to release second quarter 2020 financial results on August 13, 2020; Conference call at 12 p.m. Eastern time on August 14, 2020"
2020-07-29,"The Zacks Analyst Blog Highlights: Fresnillo, Alexco, First Majestic  and Fortuna"
2020-07-28,"Fortuna announces resumption of production at the Caylloma Mine, Peru"
2020-07-27,"Why Silver Miners Like Coeur Mining, Endeavour Silver, and Fortuna Silver Mines Took Off Today"
2020-07-20,"Why Fortuna Silver, Endeavour Silver, and Americas Gold and Silver All Jumped 10% or More on July 20"
2020-07-16,"Fortuna commences stacking ore on the heap leach pad at the Lindero gold Project, Argentina"
2020-07-15,"Fortuna reports production of 1.3 million ounces of silver and 7,099 ounces of gold for the second quarter of 2020"
2020-07-06,"Fortuna reports death of contractor employee at the Caylloma Mine, Peru"
2020-06-22,Hedge Funds Are Dumping Fortuna Silver Mines Inc. (FSM)
2020-06-19,Fortuna reports results of Annual General Meeting
2020-06-02,Endeavour Silver (EXK) Soars: Stock Adds 9.4% in Session
2020-05-27,Fortuna Silver's Mexican unit says will restart San Jose mine
2020-05-26,"Fortuna announces resumption of production at the San Jose Mine, Mexico"
2020-05-20,Fortuna Silver Mines Closes US$69 Million Bought Deal Equity Financing Including Full Exercise of Over-Allotment Option
2020-05-15,Fortuna Silver Mines (FSM) Q1 2020 Earnings Call Transcript
2020-05-15,Here's Why Silver Stocks Rose Today
2020-05-14,Fortuna reports consolidated financial results for the first quarter 2020
2020-05-08,"Fortuna provides update on the resumption of construction activities at the Lindero gold Project, Argentina"
2020-05-06,Fortuna releases 2019 Sustainability Report
2020-05-05,Fortuna announces proposed amendments to financial covenants in credit facility
2020-05-04,"Fortuna to release first quarter 2020 financial results on May 14, 2020; Conference call at 12 p.m. Eastern time on May 15, 2020"
2020-04-27,Fortuna provides an update on its operations at the Caylloma Mine in Peru
2020-04-24,Should Value Investors Buy Fortuna Silver Mines (FSM) Stock?
2020-04-14,"Fortuna reports production of 1.8 million ounces of silver and 10,101 ounces of gold for the first quarter of 2020"
2020-04-08,Are Investors Undervaluing Fortuna Silver Mines (FSM) Right Now?
2020-04-08,Silver to Beat Coronavirus Blues: 4 Stocks to Buy
2020-04-02,Fortuna provides an update on its response to the worldwide spread of COVID-19
2020-03-30,"Fortuna files Form 40-F, Annual Report"
2020-03-26,Fortuna Updates Mineral Reserves and Mineral Resources
2020-03-25,Fortuna announces resumption of operations at its San Jose Mine in Oaxaca
2020-03-24,Fortuna reports illegal road blockades affecting its San Jose Mine in Oaxaca
2020-03-21,Fortuna announces temporary suspension of activities at the Lindero Project
2020-03-19,"Panic Selling Creates a ""Golden"" Opportunity"
2020-03-17,Fortuna provides an update on the status of its operations in response to the worldwide spread of COVID-19
2020-03-13,"How Does Fortuna Silver Mines's (TSE:FVI) P/E Compare To Its Industry, After The Share Price Drop?"
2020-03-11,Fortuna reports consolidated financial results for full year 2019
2020-03-05,Fortuna Provides an Update on the Status of Disputed Royalty at the San Jose Mine
2020-03-04,Does Fortuna Silver Mines Inc. (TSE:FVI) Have A Particularly Volatile Share Price?
2020-02-26,"Fortuna to release fourth quarter and full year 2019 financial results on March 11, 2020; Conference call at 12 p.m. Eastern time on March 12, 2020"
2020-02-20,Fortuna Issues 2020 Production and Cost Guidance
2020-02-13,Fortuna provides update on its Lindero gold Project in Argentina
2020-01-31,Read This Before Judging Fortuna Silver Mines Inc.'s (TSE:FVI) ROE
2020-01-30,"Medgold Announces Maiden Mineral Resource Estimate and Initial Metallurgical Testwork Results from the Tlamino Project, Serbia"
2020-01-29,Fortuna Provides an Update on the Status of Disputed Royalty at the San Jose Mine
2020-01-16,Fortuna reports 2019 full year production of 12.4 million silver equivalent ounces
2020-01-13,"Fortuna reports positive reconciliation of reserves for the fourth quarter 2019 at the Lindero Mine, Argentina"
2020-01-01,Is Fortuna Silver Mines Inc.'s (TSE:FVI) CEO Salary Justified?
2019-12-23,Fortuna update on pre-commissioning and commissioning activities at its Lindero gold Project in Argentina
2019-12-19,Is Fortuna Silver Mines (FSM) a Great Value Stock Right Now?
2019-12-13,Is Fortuna Silver Mines Inc. (FSM) Going to Burn These Hedge Funds?
2019-12-03,Should Value Investors Buy Fortuna Silver Mines (FSM) Stock?
2019-12-02,How Much Are Fortuna Silver Mines Inc. (TSE:FVI) Insiders Spending On Buying Shares?
2019-11-28,"Medgold announces results of metallurgical testwork and final drilling at the Tlamino Project, Serbia"
2019-11-14,Fortuna reports consolidated financial results for the third quarter 2019
2019-11-13,Is Fortuna Silver Mines (FSM) a Great Value Stock Right Now?
2019-11-06,"Fortuna to release third quarter 2019 financial results on November 14, 2019; Conference call at 12 p.m. Eastern time on November 18, 2019"
2019-10-30,Fortuna's Fortunes from Argentina to Peru
2019-10-29,Near-Term Outlook for Silver Mining Industry Shines Bright
2019-10-28,New Strong Buy Stocks for October 28th
2019-10-25,Is Fortuna Silver Mines (FSM) a Great Value Stock Right Now?
2019-10-23,What Kind Of Investor Owns Most Of Fortuna Silver Mines Inc. (TSE:FVI)?
2019-10-15,"Fortuna reports production of 1.9 million ounces of silver and 11,436 ounces of gold for the third quarter of 2019"
2019-10-08,Fortuna Silver Mines Announces Closing of Convertible Debenture Over-Allotment Option
2019-10-04,Fortuna's Silver Lining in Argentina
2019-10-02,Fortuna Silver Mines Closes US$40 Million Bought Deal Financing of 4.65% Convertible Debentures
2019-09-30,Fortuna Silver Mines Inc. (TSE:FVI) Earns A Nice Return On Capital Employed
2019-09-13,"Fortuna announces the start of pre-production mining at the Lindero Project, Argentina"
2019-09-10,Fortuna announces US$40 million bought deal financing
2019-09-10,What You Must Know About Fortuna Silver Mines Inc.'s (TSE:FVI) Beta Value
2019-08-23,Did Changing Sentiment Drive Fortuna Silver Mines's (TSE:FVI) Share Price Down A Worrying 51%?
2019-08-19,Fortuna Reports Fatality at San Jose Mine
