2021-01-11,Top Prospect Aflac Joins NCAA's Roster as Official Corporate Partner
2021-01-03,2020 Portfolio Review: What a Year
2020-12-23,Is Aflac (AFL) Stock Undervalued Right Now?
2020-12-22,Is AFL A Good Stock To Buy According To Hedge Funds?
2020-12-21,Top Financial Stocks for January 2021
2020-12-18,Unum (UNM) Enters Into $7.1B Reinsurance Deal With Global Atlantic
2020-12-18,Aflac (AFL) Down 13% in 2020: Will It Bounce Back in 2021?
2020-12-18,3 High-Growth Stocks That'll Make You Richer in 2021 and Beyond
2020-12-11,Entertainer and Children's Miracle Network Hospitals® Co-Founder Marie Osmond Helps Celebrate 20th Year of the Aflac Holiday Duck Helping Kids with Cancer
2020-12-10,Aflac Incorporated Announces $25 Million Commitment to Invest in LISC's Black Economic Development Fund
2020-12-09,Insider Sells Aflac's Shares
2020-12-09,Aflac Pledges $1 Million to Morehouse School of Medicine
2020-12-07,Is Aflac (AFL) a Great Value Stock Right Now?
2020-12-02,3 Stocks Trading Below Their Earnings Power Values
2020-12-01,Aflac Incorporated to Present at the Virtual Goldman Sachs U.S. Financial Services Conference 2020
2020-11-26,Why Is Aflac (AFL) Up 33.6% Since Last Earnings Report?
2020-11-24,Charts Suggest That Insurance Stocks Are Headed Higher
2020-11-23,Rising Medical Costs in COVID-19 Era Threaten Holiday Spending
2020-11-22,Aflac Looks Even More Attractive Following Massive Dividend Increase
2020-11-20,Statement from Aflac Incorporated
2020-11-20,Is Aflac (AFL) a Great Value Stock Right Now?
2020-11-20,Aflac (AFL) Rewards Shareholders With 17.9% Dividend Hike
2020-11-18,Aflac Incorporated Announces 17.9% Increase in the First Quarter 2021 Dividend
2020-11-18,"Aflac (AFL) Rides on U.S. Business Growth, Cost-Control Moves"
2020-11-18,A Look Into Aflac's Price Over Earnings
2020-11-18,Analyzing Aflac's Unusual Options Activity
2020-11-12,Aflac Incorporated to Webcast 2020 Financial Analysts Briefing
2020-11-10,Was The Smart Money Wrong About AFLAC Incorporated (AFL)?
2020-11-04,What Makes Aflac (AFL) a New Buy Stock
2020-11-04,Should Value Investors Buy Aflac (AFL) Stock?
2020-11-02,Aflac Completes Acquisition of Group Benefits
2020-10-30,Trupanion Inc (TRUP) Q3 2020 Earnings Call Transcript
2020-10-29,Aflac and Trupanion Announce Distribution Alliance and Investment
2020-10-29,Aflac Employees Honored for Doing Good and Giving Back
2020-10-28,Aflac Inc (AFL) Q3 2020 Earnings Call Transcript
2020-10-28,"Aflac's (AFL) Q3 Earnings Beat Estimates, Revenues Up Y/Y"
2020-10-27,Aflac (AFL) Q3 Earnings and Revenues Top Estimates
2020-10-27,Recap: Aflac Q3 Earnings
2020-10-27,"Aflac Incorporated Announces Third Quarter Results, Reports Third Quarter Net Earnings of $2.5 Billion, Results Reflect a Benefit from New Tax Regulations, Declares Fourth Quarter Cash Dividend"
2020-10-26,Earnings Preview for Aflac
2020-10-23,Will Aflac (AFL) Maintain its Beat Streak in Q3 Earnings?
2020-10-20,"Aflac Incorporated to Release Third Quarter Results on October 27, 2020"
2020-10-20,Aflac (AFL) Expected to Beat Earnings Estimates: Can the Stock Move Higher?
2020-10-17,Aflac Incorporated -- Moody's announces completion of a periodic review of ratings of Aflac Incorporated
2020-10-15,Why Aflac (AFL) Could Beat Earnings Estimates Again
2020-10-15,"Aflac Life Insurance Japan, Ltd. -- Moody's announces completion of a periodic review of ratings of Aflac Life Insurance Japan, Ltd."
2020-10-13,7 Insurers Poised to Beat Estimates This Earnings Season
2020-10-09,Aflac (AFL) Drops 28% YTD: Will It Make a Comeback Soon?
2020-10-08,Aflac Global Investments Celebrates 2 Industry Award Winners
2020-10-01,Aflac CEO Has No Plans for Layoffs
2020-10-01,'Investing Today for a Better Tomorrow': Aflac Releases 2019 Corporate Social Responsibility Report
2020-09-30,Aflac Contributes $1.5 Million to Sickle Cell Disease Program at the Aflac Cancer and Blood Disorders Center of Children's Healthcare of Atlanta
2020-09-28,Aflac Ranks No. 10 on LATINA Style's List of 50 Best Companies for Latinas to Work for in the U.S.
2020-09-21,"The Zacks Analyst Blog Highlights: AFL, UNM, AMSF and EIG"
2020-09-21,"Coronavirus Gives Workers Wake-up Call, Leads to Surge in Open Enrollment Research"
2020-09-18,4 Accident & Health Insurance Stocks to Watch Amid Pricing Pressure
2020-09-17,"Unum Rides on Solid Segmental Show, Expense Woes Linger"
2020-09-14,Hedge Funds Have Never Been This Bullish On AFLAC Incorporated (AFL)
2020-09-10,"In Latest Campaign, Aflac and Legendary Football Coach Nick Saban Reunite to Show How Aflac Helps Pay Expenses Health Insurance Doesn't Cover"
2020-09-09,Aflac (AFL) Moves to Buy: Rationale Behind the Upgrade
2020-09-07,Here's Why You Should Hold Aflac Stock in Your Portfolio
2020-09-06,"Aflac: Buy This Undervalued, Accidently High Yielder"
2020-09-04,Aflac Commemorates its 25-Year Commitment to Helping Families Facing Childhood Cancer During National Childhood Cancer Awareness Month
2020-09-02,Aflac Incorporated to Present at the Virtual KBW Insurance Conference
2020-09-01,Edited Transcript of AFL.N earnings conference call or presentation 25-Oct-19 1:00pm GMT
2020-08-27,Why Is Aflac (AFL) Down 0.1% Since Last Earnings Report?
2020-08-20,Insider Sells Aflac's Shares
2020-08-18,Insider Buys Aflac's Shares
2020-08-13,Aflac Boosts Shareholders' Value Through Share Buybacks
2020-08-11,Aflac Incorporated Board of Directors Increases Shares Authorized for Repurchase
2020-07-29,Aflac Inc (AFL) Q2 2020 Earnings Call Transcript
2020-07-28,Aflac: Q2 Earnings Insights
2020-07-28,Aflac (AFL) Q2 Earnings Surpass Estimates
2020-07-26,3 Top Dividend Stocks for a Better Retirement
2020-07-26,"Smead Value Fund Sells Berkshire, Occidental Petroleum"
2020-07-24,8 Dividend Aristocrat Stocks to Buy Now
2020-07-23,Will Depressed Revenues Mar Aflac (AFL) Q2 Earnings Potential?
2020-07-21,"Aflac Incorporated to Release Second Quarter Results on July 28, 2020"
2020-07-21,Earnings Preview: Aflac (AFL) Q2 Earnings Expected to Decline
2020-07-18,Statement from Aflac Chairman and CEO Daniel P. Amos on the Passing of Civil Rights Icon John Lewis
2020-07-12,Did Hedge Funds Make The Right Call On AFLAC Incorporated (AFL) ?
2020-07-10,Why the Earnings Surprise Streak Could Continue for Aflac (AFL)
2020-07-09,Why These Insurance Stocks Have Fallen by Double Digits So Far in 2020
2020-07-08,5 Insurance Companies Expanding Earnings
2020-07-07,The March to Freedom Fund 2nd-Quarter Review
2020-07-05,Lemonade Gains 139% on IPO Listing Date
2020-07-01,Should Value Investors Buy Aflac (AFL) Stock?
2020-06-30,Is Aflac Incorporated (AFL) A Worthy Stock To Pick  Now?
2020-06-29,Aflac Lands Top-20 Spot on IDG Insider Pro and Computerworld's 100 Best Places to Work in IT List
2020-06-26,"Aflac's (AFL) Ratings Get Affirmed by AM Best, Outlook Stable"
2020-06-25,AM Best Affirms Credit Ratings of Aflac Incorporated and Its Subsidiaries
2020-06-25,EXL Named as Aflac Outstanding Partner of the Year for 2019
2020-06-17,Edited Transcript of AFL.N earnings conference call or presentation 30-Apr-20 1:00pm GMT
2020-06-17,U.S.-Israel Israeli fintech firm Pagaya raises $102 mln in funds
2020-06-16,"Aflac (AFL) Rides on U.S. Segment, Elevated Costs Persist"
2020-06-12,3 Dividend Stocks You Can Safely Hold
2020-06-10,Aflac Named a Top 50 Civic-Minded Company in America
2020-06-05,AFLAC Incorporated (AFL): Hedge Funds Are Staying Put
2020-05-29,Aflac (AFL) Down 1.6% Since Last Earnings Report: Can It Rebound?
2020-05-26,Aflac Incorporated Donates $1 Million to Crisis Text Line to Assist Frontline Workers in U.S. Experiencing Emotional Distress
