2021-01-08,Phunware (PHUN) Surges: Stock Moves 9.9% Higher
2021-01-07,Phunware to Double Location Based Services Software Coverage at Baptist Health South Florida
2021-01-04,"Phunware to Present at the 23rd Annual Needham Growth Conference on Friday, January 15 at 10:00 a.m. ET"
2020-12-22,"Phunware Releases ""Healthy Spaces"" Mobile App Update for Android on Google Play"
2020-12-21,A Look At Phunware's (NASDAQ:PHUN) Share Price Returns
2020-12-10,"INVESTIGATION ALERT: Fields Kupka & Shukurov LLP Is Investigating Phunware, Inc. for Potential Breach of Fiduciary Duty Claims"
2020-12-08,Phunware Receives Privacy Shield Certification
2020-11-30,Phunware Sets December 2020 Financial Conference Schedule
2020-11-25,Phunware Engages Stout to Monetize Intellectual Property Portfolio
2020-11-19,Virginia Hospital Center Selects Phunware for Comprehensive Mobile Healthcare Solution
2020-11-17,"Phunware to Present at the Virtual Fall Investor Summit on November 18, 2020"
2020-11-09,Phunware Reports Third Quarter 2020 Financial Results
2020-11-09,"Phunware, Inc. to Host Earnings Call"
2020-11-05,Phunware Partners with Phynd Technologies to Deliver Enhanced Digital Front Door on Mobile
2020-10-30,"Phunware Sets Third Quarter 2020 Earnings Call for Monday, November 9, 2020 at 5:00 p.m. ET"
2020-10-29,Greater Baltimore Medical Center Selects Phunware for Comprehensive Mobile Healthcare Solution
2020-10-26,Phunware Appoints Gateway to Lead Expanded Investor Relations Program
2020-10-21,Phunware Launches Smart Residential Solution on Mobile for Largest Co-Living Development in the United States
2020-10-19,Phunware Wins Smart Workplace Mobile App Portfolio Contract with Norfolk Southern
2020-10-15,Phunware Launches MaaS Customer Data Platform
2020-10-08,Phunware Wins Contract Extension for Smart Shopper Solution on Mobile
2020-10-07,Honeywell Contracts Phunware for Mobile Integrated Smart Workplace Solution
2020-10-06,Cisco Meraki Adds Fourth Phunware Listing to Meraki Marketplace with Higher Education Smart Campus Mobile Solution
2020-10-05,Phunware Expands Baptist Health South Florida Contract Through Presidio Channel Partnership
2020-10-02,Phunware Launches Cisco Webex Collaboration Solution for Integrated Room Presence within Smart Workplace Mobile Applications
2020-10-01,Phunware Partners with GAIN Innovation for Government Contracts in Texas
2020-09-30,Phunware Recognized as Best Mobile-Driven Enterprise Cloud Platform for 2020
2020-09-28,Cisco Meraki Adds Phunware Smart Workplace Mobile Solution for Employers to Meraki Marketplace
2020-09-24,Phunware Announces Upward Revision to Third Quarter Net Revenues Guidance
2020-09-22,"Phunware Extends ""Healthy Spaces"" Mobile App to Google Play for Android"
2020-09-17,Phunware Launches Modular Mobile Application Framework
2020-09-15,KILL Phunware Wins Smart Workplace Mobile App Portfolio Contract with Norfolk Southern
2020-09-09,Phunware Announces MaaS Licensing Win with Leading Pediatric Hospital
2020-09-08,Phunware Launches Enhanced Mobile Loyalty Solutions for MaaS
2020-09-03,Phunware Receives Expertise Award as Top Mobile Application Developer
2020-08-26,Phunware Provides Upwardly Revised Financial Guidance for Application Transactions Business
2020-08-25,"Phunware Adds ""Big Four"" Customer for Mobile Corporate Campus Solution"
2020-08-21,Phunware Launches Comprehensive Channel Program to Activate Global Reseller Network
2020-08-20,Phunware Lands Contract Expansion Win with Parkview Health
2020-08-14,Phunware Announces Second Quarter 2020 Financial Results
2020-08-13,Phunware Announces Co-Sell Partnership with Tech Data to Provide its Channel Partners and Customers Mobile Solutions for Digital Transformation
2020-08-07,"Phunware to Announce Second Quarter 2020 Financial Results and Provide a Business Update on Friday, August 14, 2020"
2020-08-06,Phunware to Present at Canaccord Genuitys Annual Growth Conference
2020-07-28,"Phunware Enables Safer Gatherings with New ""Healthy Spaces"" Mobile App"
2020-07-24,Phunware Announces Issuance of U.S. Patent Covering Enterprise Branded Application Frameworks for Mobile and Other Environments
2020-07-15,Phunware Refinances Senior Convertible Note
2020-07-15,Cisco Meraki Adds Phunware COVID-19 Mobile Solutions to Meraki Marketplace
2020-06-29,Phunware (PHUN) Catches Eye: Stock Jumps 8.9%
2020-06-26,"Phunware Announces Joint Venture with AnyPlace MD to Provide an End-to-End, Tech-Enabled Solution to COVID-19"
2020-06-23,Phunware Partners with Sirius to Transform Medical Care through Mobile Experiences
2020-06-19,Phunware Tech-Enables a Safer Return to Higher Education Institutions with Smart Campus Solution
2020-06-12,Phunware Announces New Partnership Agreement with SALTO to Provide Customers a Comprehensive Mobile Experience
2020-06-03,Phunware to Deploy Smart City Mobile Solution for City of Pasadena to Improve Citizen Engagement and Emergency Management
2020-06-02,Phunware Adds HID Mobile Access Integration for MaaS Platform Deployments
2020-06-01,Phunware Announces Location Based Services Deployment at Baptist Health South Florida Through Presidio Channel Relationship
2020-05-29,Phunware Receives TRUSTe Data Collection Certification from TrustArc
2020-05-28,Phunware Launches RAPID - A Mobile Application Solution for Small and Midsize Businesses
2020-05-27,Phunware Announces Strategic Relationship with American Made Media Consultants for the Trump-Pence 2020 Reelection Campaigns Mobile Application Portfolio
2020-05-26,Phunware Executes Agreement with Humm Systems to Improve User Feedback and Real-Time Intervention on Mobile
2020-05-22,Phunware Launching Mobile Hospitality Solution at Atlantis Paradise Island The Bahamas
2020-05-21,Phunware Launches Next Generation Mobile Healthcare Solution at Parkview Health
2020-05-20,Phunware Partners with Hewlett Packard Enterprise on Mobile Healthcare Solution
2020-05-15,Phunware Announces First Quarter 2020 Financial Results
2020-05-14,"Phunware Partners with Noviant to Bring Pandemic Response Solutions to Cities, Health Systems and Small Businesses Impacted by Coronavirus Pandemic"
2020-05-13,"Phunware Launching ""Gather Safe"" to Help Existing Customers and Their Employees Return to Work"
2020-05-12,Phunware Partners with Diversified to Bring Mobile Digital Transformation to Businesses Globally
2020-05-08,"Phunware to Announce First Quarter 2020 Financial Results and Provide a Business Update on Friday, May 15, 2020"
2020-05-07,Phunware Partners with Red River to Distribute its Multiscreen-as-a-Service Platform to SLED Market
2020-05-05,"Did Phunware, Inc. (NASDAQ:PHUN) Insiders Buy Up More Shares?"
2020-05-04,Phunware Launches Mobile Healthcare Solution for Integrated Health System in New York to Address COVID-19 Challenges
2020-05-04,Phunware Retains BUYINS.NET to Surveil Short Sellers and Market Makers
2020-04-28,Phunware Receives Notice of Allowance for United States Patent Covering Enterprise Branded Application Frameworks for Mobile and Other Environments
2020-04-27,Phunware Addresses United States Small Business Administration Loan Under CARES Act
2020-04-23,Phunware Offers Free Mobile Engagement Software Development Kit to Small and Midsize Businesses to Address COVID-19 Challenges
2020-04-13,Phunware Receives United States Small Business Administration Loan Under CARES Act
2020-04-09,Phunware Applies for United States Small Business Administration Loan Under CARES Act
2020-04-09,Phunware Launches Smart City Solution on Mobile to Help City Officials Address COVID-19 Challenges
2020-04-09,Phunware Adds Global Multinational Customer for Mobile Corporate Campus Solution
2020-04-07,Phunware Launches Pandemic Response Solution on Mobile to Address COVID-19 Challenges
2020-03-31,Phunware furloughs 37 due to COVID-19
2020-03-30,Phunware Announces 2019 Financial Results
2020-03-30,Phunware Announces the Appointment of Wall Street Veteran Blythe Masters as Board Chair
2020-03-27,Phunware Launches National Ventilator Registry
2020-03-25,"Phunware to Announce 2019 Financial Results and Provide a Business Update on Monday, March 30, 2020"
2020-03-23,Phunware Announces Structured Financing Transaction for Issuance of Senior Convertible Notes
2020-03-19,Phunware Receives AVIAs Badge for Digital Front Door Mobile App
2020-03-13,Phunware Adds One of the Nations Largest Health Systems to Enable Digital Front Door Deployments on Mobile
2020-03-10,Phunware Engages Hayden IR to Launch Comprehensive Investor Relations Program
2020-03-05,Phunware Announces New Customer Wins for Application Transactions
2020-03-03,Phunware Appoints Wikipedia Co-Founder Larry Sanger to Advisory Board
2020-02-27,Phunware Adds Top US Cancer Center as Mobile Digital Front Door Customer
2020-02-25,Cisco Meraki Launches Phunware Location Based Services in Meraki Marketplace
2020-02-24,Phunware to Attend HIMSS20 Global Health Conference & Exhibition in Orlando
2020-02-20,Phunware Partners With Cisco Systems to Demonstrate Integrated Mobile Corporate Campus Solution at South by Southwest 2020
2020-02-18,Phunware Adds First National Railway Customer for Mobile Corporate Campus Solution
2020-02-14,CORRECTING and REPLACING Phunware Appoints Former CEO of T. Rowe Price's Global Investment Services Todd Ruppert to Advisory Board
2020-02-10,Phunware Adds Two Pediatric Healthcare Customers for Digital Front Door Deployments on Mobile
2020-02-10,Phunware Engages Regulation SHO Compliance Firm
2020-02-07,Phunware Knowledge Graph and Data Exchange Yield Strong Results for Ten Million User Mobile Application Portfolio
2020-02-06,Phunware Drives Digital Transformation for Global Destination Casino Resorts Operator
