2021-01-08,Wendy's (WEN) Strong on Efforts: Will the Stock Revive?
2021-01-07,"Wendy's franchisees, Flynn to buy bankrupt NPC's burger joints"
2021-01-07,Why One Analyst Likes McDonalds for the First Time in 9 Years
2021-01-04,Chipotle's newest food is anti-carb and it will cost you $2 extra
2020-12-31,"COVID-19 eating created a run on snack foods in 2020, and the trend isn't done yet"
2020-12-30,The power of McDonald's McRib might shock Wall Street in January
2020-12-30,Restaurant trends will get worse before they get better: UBS analyst
2020-12-30,Popeyes chicken sandwich domination faces headwinds in 2021
2020-12-28,Why Papa John's former CEO just bought a restaurant chain that serves 60 different wines
2020-12-27,"Data: Foot traffic at Dominos, Burger King, Pizza Hut tumble by more than half during COVID-19"
2020-12-18,Better Buy: McDonald's vs. Wendy's
2020-12-17,Wendy's Cooks Up Improved Price Strength With Drive-Thru Service
2020-12-14,Battered restaurant industry needs coronavirus stimulus help now: Dunkin' Brands chairman
2020-12-14,5 fast foods that made everyone excited during a dreadful 2020
2020-12-11,What Is Inflation And Why Does It Matter To The Fed  And You?
2020-12-07,Game On: Wendy's And Uber Eats Team Up To Launch Never Stop Gaming Menu Featuring Five Popular Twitch Streamers
2020-12-07,Why There Will Be Little Holiday Cheer for Restaurant Stocks This Year
2020-12-04,Why Is Wendy's (WEN) Down 1.7% Since Last Earnings Report?
2020-12-02,Here's Why Investors Should Hold on to Wendy's (WEN) Stock
2020-12-02,Bankrupt Wendy's and Pizza Hut Franchisee Cancels Auction Bidding
2020-12-02,Wendy's Announces New Community-based Giving Program
2020-12-01,Wendys to Open 250 Cloud Kitchens in India as Virus Hits
2020-11-27,Analyzing Wendy's Ex-Dividend Date
2020-11-27,15 Largest Fast Food Companies in the World
2020-11-19,Cake Boss: Even my business has been bossed around by COVID-19
2020-11-19,Wendy's Bids to Buy Its Largest Bankrupt Franchisee
2020-11-19,Wendy's submits bid for bankrupt NPC's restaurants with franchisee group
2020-11-19,Wendy's submits bid for bankrupt NPC's restaurants with franchisee group
2020-11-16,Beyond Meat moves closer to its perfect burger
2020-11-14,Are Drive-Thru-Only Restaurants the Future of Fast Food?
2020-11-13,The Chipotle of the future will revolve around your 5G iPhone
2020-11-12,Wendy's Announces Return of Two Fan-Favorite Promotions to Support National Adoption Month this November
2020-11-12,"Benzinga's Top Upgrades, Downgrades For November 12, 2020"
2020-11-12,6 Food Stocks to Buy Into 2021
2020-11-11,"Why the restaurant industry is set to face a long, uneven recovery"
2020-11-10,McDonald's McPlant could lead to a financial windfall for this plant-based meat maker
2020-11-09,"McDonald's unveils its own meatless burger McPlant, a year after Beyond Meat test"
2020-11-08,3 Takeaways From Wendy's Q3 Earnings
2020-11-07,"Uber, Lyft Rise After a Favorable Vote"
2020-11-07,"Rockwell Automation, Wendys, and Barrick Gold Raise Dividends"
2020-11-06,KKR Stock Looks Like a Bargain
2020-11-05,"Wendy's Strong Q3, Momentum Prompts Upgrade"
2020-11-05,"Benzinga's Top Upgrades, Downgrades For November 5, 2020"
2020-11-05,"Wendy's (WEN) Beats on Q3 Earnings, Lags Revenues, Stock Down"
2020-11-04,"Nasdaq, S&P Have Best Day After Election Performance on Record"
2020-11-04,The Wendy's Co (WEN) Q3 2020 Earnings Call Transcript
2020-11-04,Wendy's Falls on Q3 Revenue Miss
2020-11-04,Wendys Drops 4% In Pre-Market As Quarterly Sales Disappoint
2020-11-04,Wendy's (WEN) Beats Q3 Earnings Estimates
2020-11-04,Wendy's stock falls after revenue miss
2020-11-04,Wendy's: Q3 Earnings Insights
2020-11-04,The Wendy's Company Reports Third Quarter 2020 Results
2020-10-30,Why Taco Bell is testing something straight out of the 1950s hamburger scene
2020-10-28,Wendy's's Debt Overview
2020-10-28,Analysts Estimate Wendy's (WEN) to Report a Decline in Earnings: What to Look Out for
2020-10-27,"Here's why 10,000 Burger King drive-thrus are going digital"
2020-10-27,5 Stocks That Could Have Great Near-Term Growth Potential (1 Has Gained 127% Since June 30)
2020-10-25,3 Stocks You Can Buy and Hold Forever
2020-10-19,The Wendy's Company Names Kevin Vasconi Chief Information Officer
2020-10-14,The Wendy's Company to Report 2020 Third Quarter Results on November 4
2020-10-09,Burger Chain Shake Shack Sees Improved Relative Strength Rating
2020-10-09,Here's the Beef: How to Play Wendy's Upside Breakout
2020-10-08,McDonalds Boosts Dividend as U.S. Sales Turn Positive
2020-10-07,10 Fastest Growing Franchises in the US in 2020
2020-09-30,Former CEO of Taco Bell & Yum! Brands on how social media and technology will change the fast food industry
2020-09-29,Cleveland-area Wendy'sCelebrate National Coffee Day with a Month of Free* Hot Coffee with Breakfast Sandwich Purchase
2020-09-29,Boston-Area Wendy's Celebrate National Coffee Day with a Month of FREE* Hot Coffee with Breakfast Sandwich Purchase
2020-09-28,"Heres Why McDonalds, Wendys and Starbucks Stand Out in Fast Food"
2020-09-25,Darden Restaurants Earns 82 RS Rating; Earnings Rise Despite Pandemic
2020-09-24,The future of fast-food will include robots: former Sonic CEO
2020-09-17,This recycling giant just took a big step in the race to find the coffee cup of the future
2020-09-16,Better Buy: Beyond Meat vs. Wendy's
2020-09-15,Stocks With Rising Relative Strength: Dunkin' Brands
2020-09-14,Is The Wendys Company (WEN) Going to Burn These Hedge Funds?
2020-09-10,The Burger King of the future will revolve around drive-thrus and pick-up windows
2020-09-10,Wendy's Kicks-Off Back-To-School In Tampa With Breakfast For Football Fans And Educators
2020-09-09,Avoid Billionaire Nelson Peltzs Top 5 Stock Picks
2020-09-04,Wendy's (WEN) Down 1.4% Since Last Earnings Report: Can It Rebound?
2020-09-01,Wendy's Introduces Pretzel Bacon Pub Cheeseburger
2020-09-01,"Wendy's Introduces Unforgettable, Flavor-Packed Pretzel Bacon Pub Cheeseburger"
2020-09-01,Better Buy: McDonald's vs. Wendy's
2020-08-28,"Chipotle will have more than 6,000 restaurants in the future: CEO Brian Niccol"
2020-08-26,Spam-maker reveals stunning stat on employees wearing masks during COVID-19
2020-08-19,Why Krispy Kreme is opening a colossal doughnut-making store in nearly empty Times Square
2020-08-19,8 Cheap Restaurant Stocks That Are Worth the Risk
2020-08-13,Sonic sales are going bonkers during COVID-19  here's the major reason why
2020-08-12,Wendy's 4 For $4 Meal Deal Gets Hotter With The Introduction Of The New Spicy Crispy Chicken Sandwich
2020-08-10,Papa John's CEO: Franchisees think our brand is 'pandemic proof'
2020-08-07,Papa Johns CEO highlights resiliency of the pizza business as revenue reaches record level
2020-08-06,"Wendy's (WEN) Q2 Earnings Beat Estimates, Revenues Miss"
2020-08-05,IBD Rating Upgrades: Texas Roadhouse Shows Improved Price Strength
2020-08-05,Wendy's Returns to Higher Growth in July
2020-08-05,Wendys Stock Is Falling After Earnings Met Expectations but Sales Missed the Mark
2020-08-05,Wendy's (WEN) Beats Q2 Earnings Estimates
2020-08-05,Recap: Wendy's Q2 Earnings
2020-08-05,Is The Wendy's Company (NASDAQ:WEN) Potentially Undervalued?
2020-08-05,"Wendy's earnings beat expectations, declares quarterly dividend"
2020-08-05,The Wendy's Company Reports Second Quarter 2020 Results
2020-08-04,Wendy's (WEN) at Cusp of Historic Breakout
2020-07-30,Dunkin' Brands CEO: Our Q2 performance proves we are navigating through COVID-19
