2020-12-10,"Ramaco Resources, Inc. Announces Changes to Executive Leadership and Board of Directors"
2020-11-05,"The Ramaco Resources, Inc. (NASDAQ:METC) Third-Quarter Results Are Out And Analysts Have Published New Forecasts"
2020-11-04,"Ramaco Resources, Inc. to Host Earnings Call"
2020-11-03,"Ramaco (METC) Reports Q3 Loss, Lags Revenue Estimates"
2020-11-03,"Ramaco Resources, Inc. Reports Third Quarter 2020 Financial Results"
2020-10-30,5 Value Stocks In The Basic Materials Sector
2020-10-28,"Ramaco Resources, Inc. to Release Third Quarter 2020 Financial Results on Tuesday, November 3, 2020 and Host Conference Call and Webcast on Wednesday, November 4, 2020"
2020-10-14,We Like These Underlying Trends At Ramaco Resources (NASDAQ:METC)
2020-09-29,4 Coal Stocks Worth a Look in a Low-Demand Hit Industry
2020-09-04,"Ramaco Resources' Shares March Higher, Can It Continue?"
2020-09-02,"Ramaco Resources, Inc. Announces New Senior Vice President, General Counsel and Secretary"
2020-08-28,A Look Into Basic Materials Sector Value Stocks
2020-08-17,Will Ramaco Resources Continue to Surge Higher?
2020-08-06,RAMACO RESOURCS (METC) Surpasses Q2 Earnings Estimates
2020-07-30,Analysts Estimate RAMACO RESOURCS (METC) to Report a Decline in Earnings: What to Look Out for
2020-07-23,"Ramaco Resources, Inc. to Release Second Quarter 2020 Financial Results on Thursday, August 6, 2020 and Host Conference Call and Webcast on Friday, August 7, 2020"
2020-07-22,Ramaco Resources Inc. Announces New Marketing Arrangement with Square Resources
2020-07-13,Ramaco Resources Inc. Announces Reduced Operations At Berwind
2020-06-15,"Hedge Funds Nibbling On Ramaco Resources, Inc. (METC)"
2020-05-26,3 Strong Buy Penny Stocks That Could See Outsized Gains
2020-05-12,RAMACO RESOURCS (METC) Tops Q1 Earnings and Revenue Estimates
2020-05-12,"Ramaco Resources, Inc. Reports First Quarter 2020 Financial Results"
2020-05-12,"How Much is Ramaco Resources, Inc.'s (NASDAQ:METC) CEO Getting Paid?"
2020-05-05,Analysts Estimate RAMACO RESOURCS (METC) to Report a Decline in Earnings: What to Look Out for
2020-04-29,"Ramaco Resources, Inc. to Release First Quarter 2020 Financial Results on Tuesday, May 12, 2020 and Host Conference Call and Webcast on Wednesday, May 13, 2020"
2020-04-28,Earnings Preview: RAMACO RESOURCS (METC) Q1 Earnings Expected to Decline
2020-04-13,Ramaco Resources Inc. Announces New Senior VP and Chief Marketing Officer
2020-04-12,"How Does Ramaco Resources's (NASDAQ:METC) P/E Compare To Its Industry, After Its Big Share Price Gain?"
2020-03-13,"A Sliding Share Price Has Us Looking At Ramaco Resources, Inc.'s (NASDAQ:METC) P/E Ratio"
2020-02-23,"Ramaco Resources, Inc. Earnings Missed Analyst Estimates: Here's What Analysts Are Forecasting Now"
2020-02-20,"Ramaco Resources, Inc. Reports Fourth Quarter and Full Year 2019 Financial Results"
2020-02-13,"Ramaco Resources, Inc. to Release Fourth Quarter 2019 Financial Results on Thursday, February 20, 2020 and Host Conference Call and Webcast on Friday, February 21, 2020"
2020-02-03,"Ramaco Resources, Inc. (NASDAQ:METC) Insiders Increased Their Holdings"
2020-01-03,"Why You Should Like Ramaco Resources, Inc.s (NASDAQ:METC) ROCE"
2019-12-17,"Is Ramaco Resources, Inc. (METC) A Good Stock To Buy?"
2019-12-03,Ramaco Resources Receives Awards for Safety and Excellence at Multiple Sites
2019-11-27,"Does The Ramaco Resources, Inc. (NASDAQ:METC) Share Price Fall With The Market?"
2019-11-05,RAMACO RESOURCS (METC) Q3 Earnings and Revenues Lag Estimates
2019-11-05,"Ramaco Resources, Inc. Reports Third Quarter 2019 Financial Results"
2019-10-29,RAMACO RESOURCS (METC) Earnings Expected to Grow: Should You Buy?
2019-10-23,"Ramaco Resources, Inc. to Release Third Quarter 2019 Financial Results on Tuesday, November 5, 2019 and Host Conference Call and Webcast on Wednesday, November 6, 2019"
2019-10-21,Those Who Purchased Ramaco Resources (NASDAQ:METC) Shares A Year Ago Have A 54% Loss To Show For It
2019-09-26,"Could The Ramaco Resources, Inc. (NASDAQ:METC) Ownership Structure Tell Us Something Useful?"
2019-09-04,These 4 Measures Indicate That Ramaco Resources (NASDAQ:METC) Is Using Debt Reasonably Well
2019-08-26,"Ramaco Resources Inc (METC) President & CEO Michael Dale Bauersachs Bought $61,690 of Shares"
2019-08-22,"Ramaco Resources Inc (METC) President & CEO Michael Dale Bauersachs Bought $124,253 of Shares"
2019-08-15,Coals Last Healthy Market Fades as Trade Woes Weigh on Steel
2019-08-15,"Here's How P/E Ratios Can Help Us Understand Ramaco Resources, Inc. (NASDAQ:METC)"
2019-08-14,"Ramaco Resources, Inc. Common Stock (METC) Q2 2019 Earnings Call Transcript"
2019-08-13,RAMACO RESOURCS (METC) Q2 Earnings Meet Estimates
2019-08-13,"Ramaco Resources, Inc. Reports Second Quarter 2019 Financial Results"
2019-08-13,Earnings Preview For Ramaco Resources
2019-08-06,RAMACO RESOURCS (METC) Reports Next Week: Wall Street Expects Earnings Growth
2019-07-19,"Ramaco Resources, Inc. to Release Second Quarter 2019 Financial Results on Tuesday, August 13, 2019 and Host Conference Call and Webcast on Wednesday, August 14, 2019"
2019-07-19,"Should We Be Delighted With Ramaco Resources, Inc.'s (NASDAQ:METC) ROE Of 18%?"
2019-07-16,Top Ranked Value Stocks to Buy for July 16th
2019-07-09,Top Ranked Value Stocks to Buy for July 9th
2019-06-19,"Ramaco Resources, Inc. (NASDAQ:METC): Commentary On Fundamentals"
2019-05-07,"Ramaco Resources, Inc. Reports First Quarter 2019 Financial Results"
2019-05-03,Those Who Purchased Ramaco Resources (NASDAQ:METC) Shares A Year Ago Have A 7.5% Loss To Show For It
2019-05-01,"Ramaco Resources, Inc. to Release First Quarter 2019 Financial Results on Tuesday, May 7, 2019 and Host Conference Call and Webcast on Wednesday, May 8, 2019"
2019-04-29,"Ramaco Resources, Inc. Announces New Chief Financial Officer"
2019-04-03,"How Much Of Ramaco Resources, Inc. (NASDAQ:METC) Do Insiders Own?"
2019-03-26,"Yorktown Energy Partners Distributes One-Million Shares of Ramaco Resources, Inc. Common Stock"
2019-03-20,Ramaco Resources Inc (METC) Q4 2018 Earnings Conference Call Transcript
2019-03-19,"Ramaco Resources, Inc. Reports Fourth Quarter and Full Year 2018 Financial Results"
2019-03-12,ROMACO RESOURCS (METC) Earnings Expected to Grow: What to Know Ahead of Next Week's Release
2019-03-11,"Ramaco Resources, Inc. to Release Fourth Quarter 2018 Financial Results on Tuesday, March 19, 2019 and Host Conference Call and Webcast on Wednesday, March 20, 2019"
2019-03-08,"Is Ramaco Resources, Inc. (NASDAQ:METC) A Volatile Stock?"
2019-02-25,"Ramaco Resources, Inc. Announces Preliminary 2018 Financial Results and 2019 Guidance"
2019-02-06,"Are Ramaco Resources, Inc.s (NASDAQ:METC) High Returns Really That Great?"
2019-01-04,Top Picks 2019- Ramaco METC
2018-11-23,Should You Consider Ramaco Resources Inc (NASDAQ:METC)?
2018-11-07,"Ramaco Resources, Inc. Reports Third Quarter 2018 Financial Results"
2018-11-06,"Ramaco Resources, Inc. Announces a Partial Structural Failure at one of the storage silos at the Companys Elk Creek coal complex"
2018-09-12,Ramaco Resources Inc (NASDAQ:METC): Can It Deliver A Superior ROE To The Industry?
2018-09-11,"Ramaco Resources, Inc. Announces Updated Status of Mining Operations at Berwind Mine Complex and Domestic Sales Commitments for 2019"
2018-08-07,"Ramaco Resources, Inc. to Host Earnings Call"
2018-08-06,"Ramaco Resources, Inc. Reports Second Quarter 2018 Financial Results"
2018-08-01,"Ramaco Resources, Inc. to Release Second Quarter 2018 Financial Results on Monday, August 6, 2018 and Host Conference Call and Webcast on Tuesday, August 7, 2018"
2018-06-14,Ramaco Resources Announces Changes in Financial Officers and New Financing
2018-06-11,Wired News  Rio Tinto Forms JV with China Minmetals for Exploration of New Mineral Deposits in China and Globally
2018-06-01,"Ramaco Resources Holds 25% Upside Potential, Analyst Says In Bullish Initiation"
2018-05-16,Was Ramaco Resources Incs (NASDAQ:METC) Earnings Decline Part Of A Broader Industry Downturn?
2018-05-15,"Ramaco Resources, Inc. Reports First Quarter 2018 Financial Results"
2018-05-10,"Ramaco Resources, Inc. to Release First Quarter 2018 Financial Results on Tuesday, May 15, 2018 and Host Conference Call and Webcast on Wednesday, May 16, 2018"
2018-04-13,Why You Shouldn't Bet Against Ramaco Resources (METC) Stock
2018-03-21,"Ramaco Resources, Inc. Reports Fourth Quarter and Full Year 2017 Financial Results"
2018-03-19,"Ramaco Resources, Inc. to Release Fourth Quarter and Full Year 2017 Financial Results on Wednesday, March 21, 2018 and Host Conference Call and Webcast on Thursday, March 22, 2018"
2018-02-22,"Ramaco Resources, Inc. Announces Preliminary Fourth Quarter and Full Year Financial Results and Provides Initial 2018 Guidance"
2017-11-08,"Ramaco Resources, Inc. Announces Third Quarter 2017 Results"
2017-10-27,"Ramaco Resources, Inc. to Release Third Quarter 2017 Earnings on November 8, 2017 and Host Conference Call and Webcast on November 9, 2017"
2017-08-01,1st new Wyoming coal mine in decades faces strong opposition
2017-06-13,What Makes Ramaco Resources (METC) a Strong Sell?
2017-03-01,What The Sell Side Is Saying About Ramaco Resources
2017-02-05,IPO Market Fires Up 4 New Offerings This Week
