2020-12-16,Where Do Hedge Funds Stand On Loews Corporation (L)?
2020-12-16,"Boardwalk Pipelines, LP -- Moody's affirms Boardwalk Pipelines Baa3 rating; stable outlook"
2020-11-27,What Kind Of Shareholders Hold The Majority In Loews Corporation's (NYSE:L) Shares?
2020-11-23,Ex-Dividend Date Insight: Loews
2020-11-02,Loews Corporation Reports Net Income of $139 Million for the Third Quarter of 2020
2020-11-02,"Election Countdown, PMIs, Lockdowns and Ruble Crumbles - What's up in Markets"
2020-10-20,"Loews Corporation to Release Third Quarter 2020 Results on November 2, 2020"
2020-10-16,Continental Insurance Company of New Jersey -- Moody's announces completion of a periodic review of ratings of CNA Financial Corporation
2020-09-28,Loews Corporation (L): Hedge Funds Are Snapping Up
2020-09-28,Here's What We Think About Loews' (NYSE:L) CEO Pay
2020-09-16,Loews Hotels & Co Names Alex Tisch President
2020-08-11,CNA Financial Corporation -- Moodys rates CNAs senior notes Baa2; outlook stable
2020-08-07,"Gulf South Pipeline Company, LP -- Moody's announces completion of a periodic review of ratings of Boardwalk Pipelines, LP"
2020-08-04,Loews Corporation Announces Quarterly Dividend On Common Stock
2020-08-04,"Boardwalk Pipelines, LP -- Moody's rates new Boardwalk Pipeline senior notes Baa3"
2020-08-03,Did Hedge Funds Make The Right Call On Loews Corporation (L) ?
2020-08-03,Loews CEO Rails Against Absurd Valuation of Conglomerate
2020-08-03,Loews Corporation Reports Net Loss Of $835 Million For The Second Quarter Of 2020
2020-07-29,What Type Of Returns Would Loews'(NYSE:L) Shareholders Have Earned If They Purchased Their SharesYear Ago?
2020-07-16,T Rowe Price Equity Income Fund's Top 5 Buys in the 2nd Quarter
2020-07-16,"Loews Corporation to Release Second Quarter 2020 Results on August 3, 2020"
2020-06-19,Hedge Funds Ditching Loews Corporation (L)
2020-06-18,Edited Transcript of L.N earnings conference call or presentation 4-May-20 3:00pm GMT
2020-06-04,Why Loews Corporation (L) May Not Rebound After Coronavirus
2020-05-19,"Dow futures gain as investors watch for earnings from Target, Lowes and Fed minutes"
2020-05-15,Retail sales crater a record 16.4% in April amid coronavirus lockdowns and spending slump
2020-05-12,Loews Corporation Announces Quarterly Dividend On Common Stock
2020-05-06,Loews Corporation -- Moody's rates new Loews Corporation senior notes A3
2020-05-04,Loews (L) Q1 2020 Earnings Call Transcript
2020-05-04,Loews Corporation Reports Net Loss Of $632 Million For The First Quarter Of 2020
2020-04-28,"Loews Corporation to Release First Quarter 2020 Results on May 4, 2020"
2020-04-27,"Dow extends win streak to four sessions, as investors look forward to easing of coronavirus lockdowns"
2020-04-27,"Diamond Offshore Drilling, Inc. -- Moody's downgrades Diamond Offshore Drilling to D-PD on bankruptcy filing"
2020-04-27,Loews expects to book 'significant' non-cash loss in Q2 on its stake in Diamond Offshore Drilling
2020-04-27,PRESS DIGEST- Canada - April 27
2020-04-24,Investment Note: Loblaw Companies
2020-04-16,"Diamond Offshore Drilling, Inc. -- Moody's downgrades Diamond Offshore Drilling to Ca"
2020-04-02,"Diamond Offshore Drilling, Inc. -- Moody's announces completion of a periodic review of ratings of Diamond Offshore Drilling, Inc."
2020-04-02,"How Does Loews's (NYSE:L) P/E Compare To Its Industry, After The Share Price Drop?"
2020-03-18,Hedge Funds Were Dumping Loews Corporation (L) Before The Coronavirus
2020-03-13,A Sliding Share Price Has Us Looking At Loews Corporation's (NYSE:L) P/E Ratio
2020-03-11,City's deal with Loews rides wave of Mid-South hotel development
2020-03-09,"Diamond Offshore Drilling, Inc. -- Moody's downgrades Diamond Offshore's senior notes to Caa2"
2020-02-19,"Downtown Sheraton owners share details, renderings of redevelopment project"
2020-02-17,Does Loews Corporation's (NYSE:L) 47% Earnings Growth Reflect The Long-Term Trend?
2020-02-12,Edited Transcript of L earnings conference call or presentation 10-Feb-20 4:00pm GMT
2020-02-11,Loews Corporation Announces Quarterly Dividend on Common Stock
2020-02-10,Wall Street Opens Higher Monday
2020-02-10,"Loews (L) Q4 Earnings Beat Estimates, Revenues Rise Y/Y"
2020-02-10,Loews Corporation Reports Net Income Of $932 Million For 2019
2020-02-10,Diamond Offshore Announces Fourth Quarter 2019 Results
2020-02-07,"Altium Packaging, LLC -- Moody's assigns Altium Packaging's senior secured credit facility B2, B2 CFR unchanged; outlook stable"
2020-02-07,What's in the Cards for Loews (L) This Earnings Season?
2020-01-22,"Loews Corporation to Release Fourth Quarter 2019 Results on February 10, 2020"
2020-01-22,Diamond Offshore to Release Fourth Quarter 2019 Results on February 10
2020-01-02,"Despite Its High P/E Ratio, Is Loews Corporation (NYSE:L) Still Undervalued?"
2019-12-19,Cordish Cos. leader confident in office project at Texas Live!
2019-12-18,"First look: Office space atop Globe Life Park, convention center and more (Renderings)"
2019-12-17,"Arlington City Council Approves $810 Million Transformative Development Project, Anchored By The 888-Room Loews Arlington Hotel And New Arlington Convention Center"
2019-12-06,Hedge Funds Have Never Been More Bullish On Loews Corporation (L)
2019-11-27,Loews (L) Up 2.4% Since Last Earnings Report: Can It Continue?
2019-11-18,Loews seeks 30-year PILOT for 500-room hotel Downtown
2019-11-12,Loews Corporation Announces Quarterly Dividend On Common Stock
2019-11-11,MetLife and Oasis Petroleum Sell Below Book Value
2019-11-01,Did You Miss Loews's (NYSE:L) 17% Share Price Gain?
2019-10-30,Edited Transcript of L earnings conference call or presentation 28-Oct-19 3:00pm GMT
2019-10-28,US Indexes Close Higher Monday
2019-10-28,Global Markets Advance Monday
2019-10-28,"Loews (L) Q3 Earnings Miss Estimates, Revenues Rise Y/Y"
2019-10-28,Loews Corp. to Host Earnings Call
2019-10-28,"Loews reports slump in third-quarter profit as CNA charge, results weigh"
2019-10-28,Loews Corporation Reports Net Income Of $72 Million For The Third Quarter Of 2019
2019-10-28,Diamond Offshore Announces Third Quarter 2019 Results
2019-10-24,Loews (L) Gears Up to Report Q3 Earnings: What's in Store?
2019-10-15,Bleak Near-Term Outlook for Multiline Insurance Industry
2019-10-11,10 things to know about the $210M Loews hotel Downtown
2019-10-11,Is Loews Corporation (L) Going To Burn These Hedge Funds?
2019-10-10,City of Memphis signs development agreement with Loews for $210M hotel
2019-10-08,Continental Insurance Company of New Jersey -- Moody's announces completion of a periodic review of ratings of CNA Financial Corporation
2019-10-08,"Loews Corporation to Release Third Quarter 2019 Results on October 28, 2019"
2019-10-08,Diamond Offshore to Release Third Quarter 2019 Results on October 28
2019-09-26,Should You Worry About Loews Corporation's (NYSE:L) CEO Pay Cheque?
2019-09-13,"Gulf South Pipeline Company, LP -- Moody's announces completion of a periodic review of ratings of Boardwalk Pipelines, LP"
2019-09-12,Edited Transcript of L earnings conference call or presentation 5-Aug-19 3:00pm GMT
2019-09-10,A Look at Loews- The Sum of the Parts
2019-09-04,Loews (L) Down 6.9% Since Last Earnings Report: Can It Rebound?
2019-08-29,"The Zacks Analyst Blog Highlights: Costco, PayPal, NextEra, Southern Copper and Loews"
2019-08-28,"Top Analyst Reports for Costco, PayPal & NextEra"
2019-08-14,What Type Of Shareholder Owns Loews Corporation's (NYSE:L)?
2019-08-06,Key Takeaways From Loews' 2nd-Quarter Results
2019-08-06,Loews Corporation Announces Quarterly Dividend On Common Stock
2019-08-05,Loews (L) Q2 2019 Earnings Call Transcript
2019-08-05,US Indexes Close Lower With China Trade Worries
2019-08-05,"Loews (L) Q2 Earnings Surpass Estimates, Revenues Rise Y/Y"
2019-08-05,Market Futures Plunge Ahead
2019-08-05,Stock Futures Plunge as Trump Reignites Trade Tensions
2019-08-05,Loews Corporation Reports Net Income Of $249 Million For The Second Quarter Of 2019
2019-08-05,Diamond Offshore Announces Second Quarter 2019 Results
2019-08-02,What's in the Cards for Loews (L) This Earnings Season?
2019-08-01,Diamond Offshore Launches Stack-View Service
