2021-01-05,"Volaris reports December 2020 traffic results: 102% of 2019 capacity and 9% more passengers than previous month, positioning Volaris as the domestic market leader in 2020"
2020-12-12,Is VLRS A Good Stock To Buy Now?
2020-12-10,Mexicos Volaris Mounts New Offensive as Rival Airlines Struggle
2020-12-10,Spirit Airlines Starts Liftoff Toward Improved Relative Strength
2020-12-09,Volaris Announces Pricing of Upsized Offering of ADSs
2020-12-07,Volaris Announces Offering of ADSs
2020-12-07,Top Airline Stocks for Q1 2021
2020-12-02,"Volaris reports November 2020 traffic results: 80.5% load factor, 98% of 2019 capacity levels"
2020-11-25,"Volaris should make money in December, be profitable in Q2, CEO says"
2020-11-25,A Coronavirus Vaccine Could Send This Airline Stock Flying Even Higher
2020-11-23,Volaris announces it has been selected as an index component of the Dow Jones Sustainability MILA Pacific Alliance Index
2020-11-17,JetBlue Airways Shows Rising Relative Strength; Still Shy Of Key Benchmark
2020-11-04,Airinmar secures three-year warranty support services contract with Volaris
2020-11-03,"Volaris reports October 2020 traffic results: 82% load factor, ~8 pp above September 2020"
2020-11-02,Aircastle Announces the Delivery of One A320 NEO in a Sale Leaseback with Volaris
2020-10-27,1 Airline Is Already Recovering From COVID-19
2020-10-22,Volaris reports third quarter 2020 results: Increased capacity drives stronger revenues and lower CASM
2020-10-05,"Volaris reports September 2020 traffic results, operating at 84% of 2019 capacity levels, the fastest recovery among all carriers in North America"
2020-10-05,"Volaris announces adjustments in hedging relationships in respect of non-derivative financial instruments, which resulted in a benefit"
2020-09-09,Volaris announces summon for extraordinary shareholders meeting
2020-09-03,Volaris reports August 2020 traffic results: leading the Mexican aviation market
2020-08-24,"Dow Up 250 Points, Zoom Retreats; This Megacap Growth Stock Breaks Out"
2020-08-19,Volaris announces recovery to approximately 75% of its capacity for the month of September 2020
2020-08-05,Volaris reports July 2020 traffic results: 68% capacity increase vs. June 2020 and ~1 million passengers transported
2020-08-04,This Airline Could Become a COVID-19 Winner
2020-07-27,"Volaris Reports Second Quarter 2020 Results: Robust Liquidity Preservation Plan with Minimal Cash Burn, End Cash Balance of Ps.10 Billion"
2020-07-24,"Earnings Scheduled For July 24, 2020"
2020-07-07,Volaris Announces Second Quarter 2020 Earnings Release and Webcast Schedule
2020-07-06,Volaris Reports June 2020 Traffic Results: Gradual recovery of demand and capacity
2020-06-25,"Do Hedge Funds Love Controladora Vuela Compania de Aviacion, S.A.B. de C.V. (VLRS)?"
2020-06-25,Volaris announces recovery to 50% of its capacity for the month of July 2020
2020-06-15,Controladora Vuela (VLRS) Catches Eye: Stock Jumps 8.6%
2020-06-05,Why Latin American Airline Stocks Are Up Today
2020-06-04,Volaris Reports May 2020 Traffic Results: Schedule Reductions to Face COVID-19
2020-06-02,Can Flight Subscriptions Help Airlines Recover From an Unprecedented Drop in Demand?
2020-05-12,"Were Hedge Funds Right About Controladora Vuela Compania de Aviacion, S.A.B. de C.V. (VLRS)?"
2020-05-07,Volaris Reports April 2020 Traffic Results: Schedule Reductions to Face COVID-19
2020-04-24,Controladora Vuela Cia De Aviacion - Ordinary Shares - Class A to Host Earnings Call
2020-04-23,"Volaris Reports First Quarter 2020 Results: 3.9% Operating Margin, up 3.5 percentage points and 2.1% TRASM Increase year over year"
2020-04-15,Volaris Announces First Quarter 2020 Earnings Release and Webcast Schedule
2020-04-07,"Volaris Reports March 2020 Traffic Results, Load Factor of 82%"
2020-04-07,Is Controladora Vuela (VLRS) a Great Value Stock Right Now?
2020-04-01,"Volaris announces temporary reduction of capacity, as a result of the declaration of health emergency in Mexico"
2020-03-26,Controladora Vuela Compania de Aviacion Enters Oversold Territory
2020-03-24,Volaris announces temporary reduction of capacity and demand
2020-03-12,Copa Holdings' February Traffic and Load Factor Increase
2020-03-11,Azul's (AZUL) February Traffic and Load Factor Increase
2020-03-05,Air Lease's (AL) Shares Plunge 19% in 3 Months:  Here's Why
2020-03-04,Coronavirus Concerns May Deal a Blow to UPS' Q1 Results
2020-03-03,"Volaris Reports February 2020 Traffic Results, Passenger Growth of 17%, Load Factor of 85%"
2020-03-03,Ryanair to Cut Back Flights to Italy Amid Coronavirus Fears
2020-02-27,Spirit (SAVE) Launches International Service From Austin
2020-02-25,"Volaris Reports Fourth Quarter 2019 Results: 20.2% Operating Margin, up 10.4 percentage points and 7.2% TRASM Increase year over year"
2020-02-18,Allegiant's (ALGT) Traffic & Load Factor Rise in January
2020-02-14,"Controladora Vuela (VLRS) Hits 52-Week High, Can the Run Continue?"
2020-02-13,These Stocks' Sales Have Grown Fast
2020-02-10,Azul's (AZUL) Traffic &amp; Load Factor Increase in January
2020-02-10,FedEx Shares Rise on Plan to Maximize Residential Deliveries
2020-02-05,"Volaris Reports January 2020 Traffic Results, Passenger Growth of 17%, Load Factor of 87%"
2020-01-31,Volaris Announces Fourth Quarter 2019 Earnings Release and Webcast Schedule
2020-01-27,Mexican airline adds new destinations out of DFW Airport
2020-01-23,Controladora Vuela (VLRS) Hits Fresh High: Is There Still Room to Run?
2020-01-10,Hawaiian Airlines' Traffic &amp; Load Factor Rise in December
2020-01-09,Gol Linhas' (GOL) Q4 Unit Revenue &amp; Cost Guidance Upbeat
2020-01-08,New Strong Buy Stocks for January 8th
2020-01-06,"Volaris Reports December and Full Year 2019 Traffic Results, Solid Demand Positions Volaris as the Largest Mexican Airline by Passenger Volume"
2020-01-02,United Airlines to Cease Dayton-George Bush Airport Service
2019-12-17,Alaska Air Group's Traffic &amp; Load Factor Dips in November
2019-12-17,Copa Holdings' (CPA) Traffic &amp; Capacity Fall in November
2019-12-16,American Airlines Suspends Boeing 737 MAX Flights Until April
2019-12-16,"Is Controladora Vuela Compania de Aviacion, S.A.B. de C.V. (VLRS) A Good Stock To Buy ?"
2019-12-13,Is Controladora Vuela (VLRS) a Worthy Stock to Pick Now?
2019-12-09,"Gol Linhas' November Traffic Rises, Load Factor Declines"
2019-12-05,Ryanair Trims Summer 2020 Growth View Due to Delivery Delays
2019-12-04,Canadian National's 2019 Earnings View Bleak Due to Strike
2019-12-03,Volaris Reports November 2019 Traffic Results: 16% Passenger Growth and 89% Load Factor
2019-12-03,Gol Linhas Achieves Record Ticket Sales on Black Friday
2019-12-03,"Ryanair Posts Increase in November Traffic, Load Factor Flat"
2019-12-02,Gol Linhas' New Business Unit Offers Maintenance Services
2019-11-28,Canadian National Reaches Tentative Deal With Teamsters
2019-11-26,Rail Strike at Canadian National Calls for Lay-offs in Halifax
2019-11-25,Canadian Pacific to Build Multi-Commodity Transload Terminal
2019-11-21,Canadian National Stock Slips More Than 2% on Labor Row
2019-11-21,Canadian Pacific to Purchase Central Maine &amp; Quebec Railway
2019-11-19,"Robertson's Tiger Management Buys Adobe, Facebook"
2019-11-18,Canadian National to Face Strike Action From Union on Nov 19
2019-11-18,Here's Why Investors Should Steer Clear of Genesee &amp; Wyoming
2019-11-15,Spirit Airlines Expands in Tampa to Boost Winter Travel
2019-11-15,Alaska Air Group's (ALK) Load Factor Declines in October
2019-11-13,Allegiant (ALGT) Posts Impressive October Traffic Statistics
2019-11-13,"JetBlue's (JBLU) Traffic Rises, Load Factor Falls in October"
2019-11-12,Allegiant to Expand Domestic Base With Five New Flights
2019-11-07,Hawaiian Airlines' Traffic &amp; Load Factor Rise in October
2019-11-07,Azul's October Traffic &amp; Load Factor Up on Solid Demand
2019-11-07,"Controladora Vuela (VLRS) Hits 52-Week High, Can the Run Continue?"
2019-11-04,Volaris Reports October 2019 Traffic Results: 18% Passenger Growth and 86% Load Factor
2019-10-28,"Heres What Hedge Funds Think About Controladora Vuela Compania de Aviacion, S.A.B. de C.V.  (VLRS)"
2019-10-25,Controladora Vuela (VLRS) Q3 Earnings and Revenues Surpass Estimates
2019-10-25,"Volaris Reports Third Quarter 2019 Results: 17.9% Operating Margin, up 9.7 percentage points year over year"
2019-10-17,Controladora Vuela (VLRS) Earnings Expected to Grow: What to Know Ahead of Next Week's Release
