2021-01-07,Overstock to Participate in Needham & Co. 23rd Annual Growth Conference
2021-01-05,"Is Overstock.com, Inc. (NASDAQ:OSTK) Popular Amongst Institutions?"
2020-12-31,"The Zacks Analyst Blog Highlights: Riot Blockchain, Overstock, International Business Machines, Microsoft and Facebook"
2020-12-30,3 Blockchain Stocks That Could Explode in 2021
2020-12-29,E-commerce Boosts Holiday Retail Sales: 4 Solid Picks
2020-12-28,"Overstock.com's (OSTK) Shares March Higher, Can It Continue?"
2020-12-24,"The Zacks Analyst Blog Highlights: Nautilus, Trex, Deckers, Overstock.com and Veritone"
2020-12-24,Here Are the Five Best Retail Stocks of 2020. Amazons Not One of Them.
2020-12-23,"The Zacks Analyst Blog Highlights: JPM, OSTK, MSFT, DOCU and NVDA"
2020-12-23,Overstock.com Seeks Expansion Into Physical Retail
2020-12-23,Top-Performing E-Commerce ETFs & Stocks of 2020
2020-12-23,5 Russell 2000 Stocks That Have Crushed the Index in 2020
2020-12-22,2020 -- Best Tech Stocks
2020-12-22,Want to Ride the Bitcoin Wave to New Highs? Bet on These 5 Stocks
2020-12-20,Bearish Bets: 2 Stocks You Really Should Consider Shorting This Week
2020-12-19,Is OSTK A Good Stock To Buy Now According To Hedge Funds?
2020-12-16,I admit it  these are my 5 dumbest investment calls of 2020
2020-12-16,"Why Riot Blockchain, Overstock And Marathon Patent Are Trading Higher Today"
2020-12-16,ROCE Insights For Overstock.com
2020-12-14,Overstock Recognized for Employee Engagement and Tech Innovation in Seventh Annual Loyalty360 Awards
2020-12-11,7 Retail Stocks Getting Coal This Year
2020-12-10,4 E-commerce Stocks Set to Gain From Rising Coronavirus Cases
2020-12-10,tZERO Announces D.A. Davidson Is Live & Trading on the tZERO ATS
2020-12-08,Top Retail Stocks for Q1 2021
2020-12-04,"Overstock.com Is Ripe For A Bull Trade, Despite Slowing Tailwinds"
2020-12-04,Why Overstock.com Shares Jumped 20% in November
2020-12-03,Is Overstock.com (OSTK) Stock Outpacing Its Retail-Wholesale Peers This Year?
2020-12-03,"The Zacks Analyst Blog Highlights: Target, Overstock.com, L Brands and DICKS Sporting Goods"
2020-12-02,E-commerce Makes Cyber Monday Best Shopping Day Ever: 4 Picks
2020-12-01,IBD 50 Stock To Watch: Can Etsy Stock Make Good On Its Breakout?
2020-11-30,Overstock to Participate in Credit Suisse 24th Annual Technology Conference
2020-11-30,Online Sales Hit Record High on Black Friday: 5 Stocks to Buy
2020-11-30,Is Overstock.com (NASDAQ:OSTK) A Risky Investment?
2020-11-27,"The Zacks Analyst Blog Highlights: Target, Overstock.com, Systemax, Hibbett Sports and The Kroger"
2020-11-27,Here are some ETFs for Black Friday
2020-11-27,5 Top-Ranked Growth Stocks to Buy Instead of Bitcoin
2020-11-25,"The Zacks Analyst Blog Highlights: Wayfair, Target, Crocs and Overstock.com"
2020-11-25,Holiday Sales to Increase This Season: 5 Winners
2020-11-19,Billionaire Ken Griffin Bets on These 3 Strong Buy Stocks
2020-11-19,Online Holiday Sales to Hit Record High: 5 Must-Buy Stocks
2020-11-17,Why Overstock.com Stock Jumped as Much as 13% Today
2020-11-17,Is Overstock.com (OSTK) Stock Outpacing Its Retail-Wholesale Peers This Year?
2020-11-16,tZERO ATS Market Data Now Available on Financial Market Data Platform Refinitiv
2020-11-13,Dont Overlook Overstock.com  Its an E-Commerce Win
2020-11-10,Overstock Announces Annual Cash Dividend for Series A-1 and Series B Preferred Stock
2020-11-09,"Why B&G Foods, Camping World, and Overstock Plummeted Today Despite a Market Rally"
2020-11-09,Wayfair Earnings Skyrocket: Impacts on House Flipping and Staging
2020-11-06,Why Overstock.com Shares Fell 23% Last Month
2020-11-06,Unlock 10X Gains in this Small Online Retail Stock
2020-11-04,3 E-Commerce Stocks Trying To Retain Pandemic Customers
2020-11-04,Overstock to Participate in Wedbush Investor Event
2020-10-30,Overstock.com (OSTK) Q3 Earnings & Revenues Beat Estimates
2020-10-30,Overstock.com (OSTK) Q3 2020 Earnings Call Transcript
2020-10-30,Will Overstock.com (NASDAQ:OSTK) Multiply In Value Going Forward?
2020-10-29,Overstock Doubles Its Sales Thanks to Furniture Push
2020-10-29,Why Overstock.com Stock Jumped 15% at the Open Today
2020-10-29,Overstock Reports Q3 2020 Financial Results
2020-10-29,"Overstock.com, Inc. to Host Earnings Call"
2020-10-28,tZERO Forges Agreement with Tynton Capital to Digitize & Trade its Proposed Digital Infrastructure Fund with a Planned Offering Size of $300 Million USD
2020-10-28,Medici Ventures Makes Additional $8 Million Equity Purchase in Bitt
2020-10-27,"tZERO Announces Integration With Sterling Trading Tech, Powering Two New Third-Party Broker-Dealers That Are Live & Trading on the tZERO ATS"
2020-10-27,Overstock.com Reports Earnings This Week. Heres What to Expect.
2020-10-26,"Overstock: Signs Point to Another Strong Earnings Performance, Says Analyst"
2020-10-26,The Shine Is Coming Off the Boom Stocks of 2020
2020-10-22,Overstock.com Offers Unlimited Free Shipping on Everything
2020-10-22,"Overstock Announces Free Shipping on Everything, Delivering Permanent Savings for Customers"
2020-10-21,tZERO Announces the Launch of its Retail Broker-Dealer Subsidiary
2020-10-20,Overstock Scheduled to Release Q3 2020 Financial Results on October 29
2020-10-13,Amazon Prime Day 2020: 'The unofficial start' of the holiday shopping season
2020-10-09,A Covid Vaccine Wont Stop Online Shopping. 6 Stocks That Will Benefit.
2020-10-07,"The Zacks Analyst Blog Highlights: IBM, PYPL, OSTK and MA"
2020-10-06,4 Stocks to Watch on Growing Blockchain Proliferation
2020-10-02,Why Overstock Shares Fell 17% in September
2020-10-01,Why Overstock.com Stock Rallied as Much as 12.5% This Morning
2020-10-01,"Hot Stocks Like Tesla Score Triple-Digit Gains, But Can You Still Buy Them?"
2020-10-01,Overstock.com (OSTK) Rally May Not Be Over Yet
2020-10-01,"Overstocks 1,000% Rally Isnt Over Yet, Analyst Says"
2020-09-29,"Overstock Celebrates Customer Day on October 4, Kicking Off the Biggest Sale of the Year"
2020-09-29,Utah District Court Rules in Favor of Overstock in Class Action Securities Case
2020-09-21,tZERO Appoints Former Nasdaq EVP John Jacobs to its Board of Directors
2020-09-17,Overstock Expands One-Day Delivery Capabilities with New California Fulfillment Center
2020-09-16,"How Overstock Can Keep Its 1,001% Rally Going"
2020-09-16,"Overstock Piques Analysts Interest With 2,800% Rally in Shares"
2020-09-16,Overstock Initiated Outperform at Credit Suisse and Wedbush
2020-09-16,tZERO Achieves Record Results in August 2020
2020-09-15,Why Overstock Is Trading Lower Today
2020-09-14,Overstock Stock Is Up 975% This Year. How Much Higher Can It Go?
2020-09-14,Why Overstock.com Shares Are Up 15% Today
2020-09-14,Overstock.com Gets Buy Rating as Needham Initiates Coverage
2020-09-14,Overstock.Com Cut In Half After Big Rally
2020-09-14,Overstock Has Soared 900% in 2020. Why One Analyst Sees Even More Gains Ahead.
2020-09-11,"Company News for Sep 11, 2020"
2020-09-10,Why Overstock Jumped More Than 20% Today
2020-09-10,Overstock's tZero Cleared to Offer Retail Digital-Security Brokerage
2020-09-10,Overstock (OSTK) Soars After FINRA Approves tZERO
2020-09-10,tZERO Approved to Launch Retail Broker-Dealer Subsidiary
2020-09-10,Overstock to Participate in Piper Sandler Investor Event
2020-09-08,Blockchain Players Beat Gold and Bitcoin in the Pandemic
2020-09-08,Panicking about Tesla? These charts will make you feel a lot better
2020-09-05,"Blockchain's Back, But Not All Blockchain ETFs Are Created Equal"
