2021-01-05,"Mogo's (MOGO) Shares March Higher, Can It Continue?"
2021-01-05,Mogo to Participate in the 23rd Annual Needham Virtual Growth Conference
2021-01-04,Mogo Reports over 100% Increase in new Bitcoin Accounts in December
2020-12-31,Mogo Establishes ATM Equity Program
2020-12-23,Mogo to Make Corporate Investment in Bitcoin
2020-12-14,Mogo Receives Conditional TSX Approval Related to Acquisition of Carta Worldwide
2020-12-11,Mogo Announces Results of its Annual Meeting of Shareholders
2020-12-10,Mogo Announces Early Conversion of Convertible Debentures & Date of Special Shareholder Meeting to Approve Acquisition of Carta Worldwide
2020-12-01,Mogo Reports 135% Increase in Bitcoin Transaction Volume in November
2020-11-27,Mogo Launches New Interactive Rainforest Mode in its App
2020-11-17,Mogo Expands Into Global B2B Fintech Market with Acquisition of Digital Payments Technology Company Carta Worldwide
2020-11-10,Mogo Reports 346% increase in Q3 2020 Adjusted EBITDA and Accelerating Net Member Additions up 89%
2020-11-09,Mogo Announces Launch of Bitcoin Rewards Program
2020-11-06,Why Mogo's Stock Is Trading Higher Today
2020-11-06,"Mogo Announces that MogoSpend Now Supports Apple Pay, Google Pay and Samsung Pay"
2020-11-05,Mogo Moves Up Time of Q3 2020 Earnings Release & Conference Call
2020-10-13,Mogo Schedules Q3 2020 Earnings Conference Call
2020-10-02,Mogo Files Prospectus Supplement
2020-09-24,Mogo Announces Preliminary Q3 2020 Results & Financial Updates
2020-09-08,Mogo Reports 130% Growth in Daily New Member Additions as Canadians Increasingly Adopt Digital Financial Solutions
2020-08-31,Mogo to Launch Mobile Peer-to-Peer Payment Solution
2020-08-27,Mogo Establishes new Referral Agreement with EQ Bank for Savings Plus Account
2020-08-25,Mogo Establishes New Referral Agreement with Lendful for Unsecured Consumer Loans
2020-08-18,Mogo Helps Protect Canadians from Rising Risk of Identity Fraud
2020-08-14,"Mogo Inc (MOGO) Reports Q2 Loss, Beats Revenue Estimates (Revised)"
2020-08-11,"Mogo Inc (MOGO) Reports Q2 Loss, Lags Revenue Estimates"
2020-08-11,Mogo Announces Strong Second Quarter 2020 Financial Results
2020-08-04,Mogo Inc (MOGO) Expected to Beat Earnings Estimates: What to Know Ahead of Q2 Release
2020-07-27,Mogo Announces the Launch of MogoSpend
2020-07-22,Mogo to Participate in the Canaccord Genuity Growth Conference
2020-07-16,Mogo: The Square Cash App Of Canada
2020-07-15,Mogo Announces Preliminary Second Quarter 2020 Financial Results
2020-06-19,Mogo to Present at June 2020 Lytham Partners Virtual Investor Growth Conference
2020-06-05,Mogo Announces Shares for Debt Issuance
2020-06-03,"Mogo Inc (MOGO) Reports Q1 Loss, Tops Revenue Estimates"
2020-06-03,Mogo Announces First Quarter 2020 Financial Results
2020-06-01,Mogo Schedules Q1 2020 Earnings Conference Call
2020-05-25,The $8 Trillion Megatrend Taking Wall Street By Storm
2020-05-25,Mogo Announces Approval of Amendments to its Convertible Debentures including Extension of the Maturity Date to May 2022
2020-05-25,Mogo Announces Approval of Amendments to its Convertible Debentures including Extension of the Maturity Date to May 2022
2020-05-20,3 Strong Buy Penny Stocks With Substantial Upside Potential
2020-05-19,Mogo Provides Update Regarding Upcoming Meeting of Convertible Debentureholders
2020-05-15,Mogo Announces Update on its Upcoming Filings
2020-05-07,Mogo Provides Enhanced Terms to Proposed Convertible Debenture Amendments
2020-05-05,Analysts Estimate Mogo Inc (MOGO) to Report a Decline in Earnings: What to Look Out for
2020-04-27,Mogo Provides Business Updates
2020-03-27,Mogo Announces Fourth Quarter & Full-Year 2019 Financial Results & Provides Update Related to COVID-19
2020-03-12,Mogo Schedules Q4 & Fiscal Year-End 2019 Earnings Release and Conference Call
2020-02-28,goeasy Ltd. Announces Purchase of Mogo Incs $31.9 million Consumer Loan Portfolio and Forms Lending Partnership
2020-02-28,Mogo Forms Three-Year Lending Partnership with goeasy Ltd. and Announces Sale of $31.9 million Liquid Loan Portfolio
2020-02-06,Mogo Extends Innovative Marketing Agreement with Postmedia to 2023
2020-02-06,Mogo Extends Innovative Marketing Agreement with Postmedia to 2023
2020-01-16,"Introducing MogoSpend, a new way to help control spending and earn unlimited cashback, while having a positive impact on the planet"
2020-01-02,Mogo Lowers Interest Rate and Extends Credit Facility
2020-01-02,Mogo Lowers Interest Rate and Extends Credit Facility
2019-12-06,Mogo launches newly designed mobile app and introduces Canadians to the 4 habits of financial health
2019-12-05,Mogo Files Final Base Shelf Prospectus
2019-11-25,Mogo to Participate in the Raymond James Technology Investors Conference
2019-11-25,Mogo to Participate in the Raymond James Technology Investors Conference
2019-11-11,"MOGO: Following goeasy Partnership, Mogo Plans to Add Prime Loans Partner to Accelerate Growth"
2019-11-07,Mogo Announces Third Quarter 2019 Financial Results
2019-10-23,Mogo Schedules Q3 2019 Earnings Release and Conference Call
2019-10-09,MOGO: Mogo to Start Pilot Program with New Lending Partner This Month
2019-10-08,Mogo announces a digital lending pilot with goeasy Ltd.
2019-10-08,Mogo announces a digital lending pilot with goeasy Ltd.
2019-09-24,Mogo to Participate in B. Riley FBR Annual Consumer & Media Conference
2019-09-24,Mogo to Participate in B. Riley FBR Annual Consumer & Media Conference
2019-09-16,Mogo Appoints KPMG as the Company's Auditor
2019-08-26,Mogo to Participate in 2nd Annual Craig-Hallum FinTech Innovators Conference
2019-08-23,MOGO: STRONG QUARTER - KEY FOCUS NOW IS THE TRANSITION TO OFF BALANCE SHEET LENDING MODEL
2019-08-20,"Mogo Passes 900,000 Member Milestone"
2019-08-14,Mogo Announces Second Quarter 2019 Financial Results
2019-08-14,Mogo Announces Second Quarter 2019 Financial Results
2019-08-07,Mogo Schedules Q2 2019 Earnings Release and Conference Call
2019-08-07,Mogo Schedules Q2 2019 Earnings Release and Conference Call
2019-07-23,Mogo Named One of Canada's Top 50 Fintech Companies by the Digital Finance Institute
2019-07-23,Mogo Named One of Canada's Top 50 Fintech Companies by the Digital Finance Institute
2019-07-18,Mogo to Participate in the Canaccord Genuity 39th Annual Growth Conference
2019-07-18,Mogo to Participate in the Canaccord Genuity 39th Annual Growth Conference
2019-07-16,Mogo partners with League to bring MogoProtect identity fraud protection solution to League members
2019-07-16,Mogo partners with League to bring MogoProtect identity fraud protection solution to League members
2019-07-11,Tech Stocks To Watch Closely
2019-07-08,Watch These Fintech Stocks Closely
2019-07-02,Mogo Announces First Monetization Since Recently Completed Acquisition of Difference Capital Investment Portfolio
2019-06-21,Grit Capital's Live-Stream Virtual Investor Conference June 26th
2019-06-21,Mogo Finance Technology and Difference Capital Announce Completion of Business Combination and Formation of Mogo Inc.
2019-06-18,Mogo Announces Results of its Annual And Special Meeting of Shareholders
2019-06-18,Difference Capital Announces Results of Its Annual and Special Meeting of Shareholders
2019-06-12,Mogo Partners with Major Canadian Retailer - The Brick - to Battle Identity Fraud
2019-05-15,MOGO: Q1 2019 Results Beat Expectations Despite a Cut in Marketing Spend
2019-05-14,Mogo Announces First Quarter 2019 Financial Results
2019-05-14,Mogo Announces First Quarter 2019 Financial Results
2019-05-01,Mogo Finance Technology to Participate in B. Riley FBR Annual Investor Conference
2019-04-30,MOGO: A Rapidly Growing Canadian Fintech Provider
2019-04-26,Mogo Schedules Q1 2019 Earnings Release and Conference Call
2019-04-26,Mogo Schedules Q1 2019 Earnings Release and Conference Call
2019-04-25,Mogo Finance Technology to Present at the Planet MicroCap Showcase 2019
2019-04-24,5 Fintech Stocks to Watch Ahead
2019-04-22,Mogo Finance Technology (MOGO) Stock: A FinTech Play with Incredible Potential
2019-04-15,Mogo Announces Business Combination with Difference Capital Financial
