2021-01-11,Independent Bank Corp.s Announcement of Date of Fourth Quarter Conference Call
2020-12-19,Be Sure To Check Out Independent Bank Corp. (NASDAQ:INDB) Before It Goes Ex-Dividend
2020-12-11,Is INDB A Good Stock To Buy Now?
2020-12-10,Independent Bank Corp. Announces Quarterly Dividend
2020-11-05,"Independent Bank Corp. CEO Christopher Oddleifson, President Gerard Nadeau, COO Robert D. Cozzone, and CFO Mark J. Ruggiero to Participate in the 2020 Piper Sandler East Coast Financial Services Conference"
2020-10-24,Independent Bank Corp. Beat Analyst Estimates: See What The Consensus Is Forecasting For Next Year
2020-10-23,Independent Bank Corp (Mass) (INDB) Q3 2020 Earnings Call Transcript
2020-10-22,Independent Bank Corp. (INDB) Surpasses Q3 Earnings Estimates
2020-10-22,Recap: Independent Bank Q3 Earnings
2020-10-22,Independent Bank Corp. Reports Third Quarter Net Income of $34.9 Million
2020-10-16,Earnings Preview: Independent Bank Corp. (INDB) Q3 Earnings Expected to Decline
2020-10-05,Independent Bank Corp.s Announcement of Date of Third Quarter Conference Call
2020-09-21,Why You Might Be Interested In Independent Bank Corp. (NASDAQ:INDB) For Its Upcoming Dividend
2020-09-17,Independent Bank Corp. Announces Quarterly Dividend
2020-09-14,Rockland Trust Receives 'Outstanding' Community Reinvestment Act Rating
2020-07-26,Results: Independent Bank Corp. Exceeded Expectations And The Consensus Has Updated Its Estimates
2020-07-24,Independent Bank Corp (Mass) (INDB) Q2 2020 Earnings Call Transcript
2020-07-23,Independent Bank Corp. (INDB) Surpasses Q2 Earnings Estimates
2020-07-23,Independent Bank Corp. Reports Second Quarter Net Income of $24.9 Million
2020-07-16,Independent Bank Corp. (INDB) Expected to Beat Earnings Estimates: Should You Buy?
2020-07-06,Independent Bank Corp.s Announcement of Date of Second Quarter Conference Call
2020-06-18,Independent Bank Corp. Announces Quarterly Dividend
2020-06-11,Edited Transcript of INDB earnings conference call or presentation 24-Apr-20 2:00pm GMT
2020-06-01,Is Independent Bank Corp (INDB) A Good Stock To Buy?
2020-05-08,The Independent Bank (NASDAQ:INDB) Share Price Has Gained 50% And Shareholders Are Hoping For More
2020-04-27,"Independent Bank Corp. President and CEO Christopher Oddleifson, COO Robert D. Cozzone, and CFO Mark J. Ruggiero to Participate in the 2020 D.A. Davidson Financial Institutions Virtual Conference"
2020-04-24,Independent Bank Corp. Changes its Annual Shareholder Meeting to a Virtual Only Format
2020-04-24,Independent Bank Corp. (Massachusetts) to Host Earnings Call
2020-04-23,Independent Bank Corp. (INDB) Q1 Earnings and Revenues Lag Estimates
2020-04-23,Independent Bank Corp. Reports First Quarter Net Income of $26.8 Million
2020-04-16,Earnings Preview: Independent Bank Corp. (INDB) Q1 Earnings Expected to Decline
2020-04-08,One Thing To Remember About The Independent Bank Corp. (NASDAQ:INDB) Share Price
2020-04-06,Independent Bank Corp.s Announcement of Date of First Quarter Conference Call
2020-04-02,"The SBA's $350B stimulus program kicks off Friday, but banks still lack crucial details"
2020-03-28,Hedge Funds Have Never Been This Bullish On Independent Bank Corp (INDB)
2020-03-20,Independent Bank Rewards Investors With 4.5% Dividend Hike
2020-03-19,Independent Bank Corp. Announces a 5% Increase in the Quarterly Dividend
2020-03-13,What Is Independent Bank's (NASDAQ:INDB) P/E Ratio After Its Share Price Tanked?
2020-03-06,Five banks partner on seed fund to boost Brockton businesses
2020-02-03,"Independent Bank Corp. COO Robert D. Cozzone and CFO Mark J. Ruggiero to Attend the 2020 Keefe, Bruyette & Woods Winter Financial Services Symposium"
2020-01-29,"Blue Hills ex-CEO, CFO to take over at Envision Bank"
2020-01-23,Ex-Blue Hills CEO leaves Rockland Trust board after merger
2020-01-23,Edited Transcript of INDB earnings conference call or presentation 17-Jan-20 3:00pm GMT
2020-01-18,Is Independent Bank Corp.'s (NASDAQ:INDB) High P/E Ratio A Problem For Investors?
2020-01-16,Independent Bank Corp. Reports Fourth Quarter Net Income of $47.5 Million
2020-01-08,ACBI vs. INDB: Which Stock Is the Better Value Option?
2020-01-06,Independent Bank Corp.s Announcement of Date of Fourth Quarter Conference Call
2019-12-23,Independent Bank Corp. (NASDAQ:INDB)'s Could Be A Buy For Its Upcoming Dividend
2019-12-19,Hedge Funds Have Never Been This Bullish On Independent Bank Corp (INDB)
2019-12-12,Independent Bank Corp. Announces Quarterly Dividend
2019-12-04,Does Independent Bank Corp.'s (NASDAQ:INDB) CEO Pay Matter?
2019-11-11,Edited Transcript of INDB earnings conference call or presentation 18-Oct-19 2:00pm GMT
2019-11-06,Independent Bank Corp. President and CEO Christopher Oddleifson and COO Robert D. Cozzone to Attend the 2019 Sandler ONeill + Partners East Coast Financial Services Conference
2019-11-05,Is Now An Opportune Moment To Examine Independent Bank Corp. (NASDAQ:INDB)?
2019-10-23,Hedge Funds Have Never Been This Bullish On Independent Bank Corp (INDB)
2019-10-17,Independent Bank Corp. Reports Third Quarter Net Income of $51.8 Million
2019-10-16,What Kind Of Shareholder Appears On The Independent Bank Corp.'s (NASDAQ:INDB) Shareholder Register?
2019-10-07,Independent Bank Corp.s Announcement of Date of Third Quarter Conference Call
2019-09-26,Investors Who Bought Independent Bank (NASDAQ:INDB) Shares Five Years Ago Are Now Up 111%
2019-09-19,Independent Bank Corp. Announces Quarterly Dividend
2019-09-02,"How Many Independent Bank Corp. (NASDAQ:INDB) Shares Have Insiders Sold, In The Last Year?"
2019-08-13,How Does Independent Bank Corp. (NASDAQ:INDB) Affect Your Portfolio Volatility?
2019-07-24,Is Now The Time To Put Independent Bank (NASDAQ:INDB) On Your Watchlist?
2019-07-23,Edited Transcript of INDB earnings conference call or presentation 19-Jul-19 2:00pm GMT
2019-07-19,Independent Bank Corp (Mass) (INDB) Q2 2019 Earnings Call Transcript
2019-07-18,Independent Bank Corp. (INDB) Beats Q2 Earnings and Revenue Estimates
2019-07-18,Independent Bank Corp. Reports Second Quarter Net Income of $30.6 Million
2019-07-16,New acquisition fuels People's United expansion in Massachusetts
2019-07-11,Independent Bank Corp. (INDB) Reports Next Week: Wall Street Expects Earnings Growth
2019-07-08,Independent Bank Corp.s Announcement of Date of Second Quarter Conference Call
2019-07-04,Are You An Income Investor? Don't Miss Out On Independent Bank Corp. (NASDAQ:INDB)
2019-06-20,Independent Bank Corp. Announces Quarterly Dividend
2019-06-14,Don't Sell Independent Bank Corp. (NASDAQ:INDB) Before You Read This
2019-06-10,Rockland Trust Welcomes Blue Hills Bank Customers
2019-05-20,Rockland Trust Launches Ad Campaign through the Voice of the Customer
2019-05-06,"Independent Bank Corp. CEO Christopher Oddleifson, COO Robert D. Cozzone and CFO Mark J. Ruggiero to Attend the 2019 Piper Jaffray Eastern Bank Symposium"
2019-04-30,Heres What Hedge Funds Think About Independent Bank Corp (INDB)
2019-04-23,Edited Transcript of INDB earnings conference call or presentation 22-Apr-19 2:00pm GMT
2019-04-22,Independent Bank Corp (INDB) Q1 2019 Earnings Call Transcript
2019-04-18,Independent Bank Corp. (INDB) Misses Q1 Earnings and Revenue Estimates
2019-04-18,Independent Bank Corp.: 1Q Earnings Snapshot
2019-04-18,Independent Bank Corp. Reports First Quarter Net Income of $35.2 Million
2019-04-11,Independent Bank Corp. (INDB) Reports Next Week: Wall Street Expects Earnings Growth
2019-04-11,Are You Looking for a High-Growth Dividend Stock? Independent Bank Corp. (INDB) Could Be a Great Choice
2019-04-09,Independent Bank Corps Announcement of Revised Date of First Quarter Conference Call
2019-04-08,Independent Bank Corp.s First Quarter Earnings Press Release and Conference Call Announcement
2019-04-08,Rockland Trust Launches Fast Online Account Opening in Response to Customer Feedback
2019-04-02,Independent Bank (INDB) Completes Acquisition of Blue Hills
2019-04-01,"Independent Bank Corp. Announces Completion of Blue Hills Bancorp, Inc. Acquisition and Appointment of William M. Parent, David A. Powers, and Scott Smith as Directors"
2019-03-27,Rockland Trust to complete $727M Blue Hills deal next week
2019-03-27,Independent Bank Gets Regulatory Nod for Blue Hills Deal
2019-03-26,"Independent Bank Corp. and Blue Hills Bancorp, Inc. Report Receipt of Regulatory Approvals and Anticipated Closing Date"
2019-03-26,Rockland Trust Named Best Bank in New England by Global Finance
2019-03-26,This is Why Independent Bank Corp. (INDB) is a Great Dividend Stock
2019-03-14,Independent Bank Corp. Issues $50 Million in Subordinated Notes
2019-03-14,Independent Bank Announces 16% Dividend Hike: Worth a Look?
2019-03-13,Independent Bank Corp. Announces a 16% Increase in the Quarterly Dividend
2019-03-06,Rockland Trust Named Top Bank in Massachusetts and One of the Worlds Best by Forbes
2019-03-04,Independent Bank Corp. CFO Robert D. Cozzone and Controller & Chief Accounting Officer Mark Ruggiero to Attend the 2019 RBC Capital Markets Financial Institutions Conference
2019-02-28,"Rockland Trust Raises the Stakes in Second Edition of its Small Business, Big Dreams Contest"
