2020-12-16,Sprouts to Carry Alkaline88® Eco-Friendly Aluminum Bottles Nationwide
2020-12-11,Cannabis Industry Primed for Leaders to Offer Comprehensive Line of Products
2020-12-09,Alkaline Water Company (WTER) Surges: Stock Moves 6.7% Higher
2020-12-09,Growing Acceptance of Cannabis Sparks Explosion of CBD-Infused Offerings
2020-12-08,New Strong Sell Stocks for December 8th
2020-12-07,Alkaline88® to Participate in Multiple Investor Conferences in December
2020-12-02,New Strong Sell Stocks for December 2nd
2020-12-02,A88CBD Now Offered by KeHE
2020-11-27,Should I Buy The Alkaline Water Company Inc. (WTER)?
2020-11-24,"Cross Country, Alkaline Water, Enphase Energy, Canadian Solar and TOTAL as Zacks Bull and Bear of the Day"
2020-11-24,Bear Of The Day: Alkaline Water Company (WTER)
2020-11-19,Alkaline88® Adds IBA Foodservice to Accelerate Growth in the Hospitality Channel
2020-11-17,"Today, I'm Drowning in WTER"
2020-11-16,The Alkaline Water Company Reports Results for the 2021 Fiscal Second Quarter
2020-11-16,"The Alkaline Water Co., Inc. to Host Earnings Call"
2020-11-12,The Alkaline Water Company to Host Conference Call to Discuss Fiscal Second Quarter 2021 Results
2020-11-10,A88CBD Drops New Powder Packs on A88CBD.com
2020-11-06,Here's Why Alkaline Water Co Has Intrigued Me for Some Time
2020-11-04,Alkaline88® #1 Item by Cases Sold at The KeHE National Winter Show
2020-10-29,A88CBD Adds CBD Distributor BettermentRS
2020-10-22,Alkaline88® Official Vendor for Kampgrounds of America (KOA®) and Yogi Bears Jellystone Park Camp-Resorts
2020-10-21,A Look At Alkaline Water's (NASDAQ:WTER) Share Price Returns
2020-10-14,Alkaline88® Launches New 2-Liter Single-Serve and Six Pack to Meet Customer Demand
2020-10-08,The Alkaline Water Company Appoints Retail Industry Veteran Frank Lazaran to its Board of Directors
2020-10-06,A88 Infused Flavors Gain Share in the Fast-Growing Flavored Water Market
2020-10-06,The Alkaline Water Company President & CEO Discusses Companys Double-Digit 2020 Growth Despite COVID-19 Challenges
2020-10-01,DOT Foods to Offer A88 Infused as a Featured All-Natural Flavored Product
2020-09-28,Major Beverage Brands Looking for Ways to Capture Market Share
2020-09-24,A88CBD Introduces Highly-Anticipated Gummies Line and CBD Flavored Water
2020-09-24,M&A Offers Pathway for Beverage Companies to Strengthen Bottom Line
2020-09-23,Sidoti-Virtual Investor Conference.
2020-09-16,Alkaline88® Adds Additional Core-Mark Distribution Centers and Over 200 New C-Store Locations
2020-09-10,"Alkaline88® Adds New Natural and Organic Products Distributor, Valu Merchandisers Company (VMC); Provides Update on the Eco-Friendly Aluminum Bottles"
2020-09-09,Alkaline88® to Participate in Multiple Investor Conferences in September
2020-09-01,Alkaline88® Increases Midwest Supermarket Exposure with Fareway Stores
2020-08-26,The Alkaline Water Company Expands into Hospitality Channel
2020-08-20,"The Alkaline Water Company Adds Brand Marketing Leader, Rosie Cousino as Director of Corporate Marketing"
2020-08-18,The Alkaline Water Company Launches A88CBD in all 142 CBD Plus Retail Locations
2020-08-13,The Alkaline Water Company Delivers Record First Quarter Revenue of $14.2 million
2020-08-12,"The Alkaline Water Company Adds Direct-Store-Deliver (DSD) Distributor, Mahaska to Expand Midwest Footprint"
2020-08-10,The Alkaline Water Company to Host Conference Call to Discuss Fiscal First Quarter 2021 Results
2020-08-05,The Alkaline Water Companys A88CBD to Launch in Elevated Wellness CBD
2020-08-03,"49 Public Companies to Present at the SNN Network Virtual Conference on August 3-6, 2020"
2020-07-31,Registration for Sidoti's 2020 Fall Virtual Investor Conference is Open Now
2020-07-31,The Alkaline Water Company to Present at the SNN Network Virtual Investor Conference
2020-07-30,The Alkaline Water Company Launches A88CBD in CBD Emporium
2020-07-29,The Alkaline Water Company to Participate in the ECRM Beverage Program
2020-07-23,The Alkaline Water Company Delivers Record Full Year Fiscal 2020 Results
2020-07-16,A88CBD Announces Partnership with Leading National Natural CPG Agency C.A. Fortune
2020-07-14,The Alkaline Water Companys A88CBD to Launch on Direct CBD Onlines E-Commerce Shop
2020-07-09,The Alkaline Water Company to Host Conference Call to Discuss Fiscal Fourth Quarter and Full Year 2020 Results
2020-07-07,The Alkaline Water Company Selects Davis Elen as Agency of Record
2020-07-02,The Alkaline Water Company Strengthens its National Lifestyle Brand through UNFI
2020-06-30,The Alkaline Water Companys Full Line of A88CBD Products Now Available at Alchemists Kitchen Stores
2020-06-24,The Alkaline Water Company Announces National A88CBD Topical Distribution through UNFI
2020-06-22,The Alkaline Water Company® Launches Direct to Consumer E-Commerce Website
2020-06-17,Price Over Earnings Overview: Alkaline Water
2020-06-17,The Alkaline Water Company Achieves Record Fourth Quarter With Over 50% Growth
2020-06-16,Alkaline88® Ranked the #1 Best Selling National Brand at KeHE Holidays of Hope Show
2020-06-10,"Alkaline88® Eco-Friendly Aluminum Bottles to be Carried by National Distributor, KEHE with Support From Leading National Broker CA Fortune"
2020-06-05,The Alkaline Water Company Regains Compliance with NASDAQ Minimum Bid Price Listing Requirement
2020-06-04,"The Alkaline Water Company Receives Summer Commitments from 12,500 Retailers for Flavor Infused Products"
2020-05-27,The Alkaline Water Company Reports Record April Sales of $7.1 Million
2020-05-21,The Alkaline Water Company Names Nicholas Salimbene as Director of Operations
2020-05-20,The Alkaline Water Co. Launches New CBD Products Line
2020-05-19,The Alkaline Water Company Inc. Announces Listing on the Canadian Securities Exchange
2020-05-19,The Alkaline Water Company Launches A88CBD Ingestibles Product Line
2020-05-14,The Alkaline Water Company Expands Retail Channels for its A88CBD Topical Products
2020-05-12,Premier German Grocery Chain Currently Selling Alkaline88® Across U.S. Stores
2020-04-30,"Alkaline88® Launches in 2,400 Rite Aid Stores Nationwide"
2020-04-28,The Alkaline Water Company Receives Significant Orders for Eco-Friendly Aluminum Bottles and Increases Production to Service Demand
2020-04-26,The Alkaline Water Company Announces Non-brokered Private Placement of Subscription Receipts
2020-04-22,The Alkaline Water (NASDAQ:WTER) Share Price Is Down 73% So Some Shareholders Are Rather Upset
2020-04-22,The Alkaline Water Company Reports Record Monthly Sales of $6.2 Million; Exceeding the Previous Record by 63%
2020-04-20,The Alkaline Water Company Increases Production Capacity Significantly to Meet Demand
2020-03-12,Alkaline88® Begins Shipping Single-Serve 1-liter to National Specialty Discount Chain
2020-03-10,The Alkaline Water Company Announces New Marketing Initiatives and Brand Refresh for Alkaline88®
2020-03-05,The Alkaline Water Company to Participate in the 32nd Annual Roth Conference
2020-03-03,Alkaline88® Strengthens Convenience Store Footprint in the Northwest; Adds 366 Locations
2020-02-26,"The Alkaline Water Companys A88 Flavored-Infused Waters Receive Firm Commitments From Over 10,000 Stores Nationwide"
2020-02-20,The Alkaline Water Company Announces Dirt Track Racing Rising Stars as New Brand Ambassadors
2020-02-19,Edited Transcript of WTER earnings conference call or presentation 10-Feb-20 10:00pm GMT
2020-02-16,The Week In Cannabis: Stocks Finally Back In Green Despite Mixed Earnings Results
2020-02-11,"Alkaline Water To Launch CBD Topicals Line, E-Commerce Platform"
2020-02-10,"Alkaline Water Company Inc. (WTER) Reports Q3 Loss, Misses Revenue Estimates"
2020-02-10,The Alkaline Water Company Reports Record Third Quarter Results
2020-02-10,"The Alkaline Water Co., Inc. to Host Earnings Call"
2020-02-05,The Alkaline Water Company Launches E-Commerce Platform to Begin Selling CBD Topicals Immediately
2020-02-04,"Alkaline88® Extends Reach to 15,000 C-Stores with the Addition of Core-Mark to its Growing List of Partners"
2020-02-03,The Alkaline Water Company to Host Conference Call to Discuss Fiscal 2020 Third Quarter Results
2020-01-28,Alkaline88® to Showcase CBD Product Portfolio at the ECRM® CBD Health and Beauty Jacksonville Expo
2020-01-22,Does Alkaline Water (NASDAQ:WTER) Have A Healthy Balance Sheet?
2020-01-16,Alkaline88® Launches Eco-Friendly Aluminum Bottle
2020-01-09,Top Picks 2020- Alkaline Water Company WTER
2019-11-13,The Alkaline Water Company Reports Record Second Quarter Revenue and Reaffirms Fiscal 2020 Revenue Guidance of $46 million to $50 million
2019-11-05,The Alkaline Water Company to Present at the Southwest IDEAS Investor Conference on November 21st in Dallas
2019-11-04,Alkaline88® to Showcase CBD Product Portfolio at the ECRM® CBD Cape Coral Expo
2019-10-31,The Alkaline Water Company to Host Conference Call to Discuss Fiscal 2020 Second Quarter Results
2019-10-24,The Alkaline Water Company Continues Exponential Growth in Convenience Store Channel
2019-10-17,"Alkaline Water Co. Launches New CBD Balms, Oils And More"
