2021-01-04,5 Disruptive Biotech Stocks With Solid Long-Term Potential
2020-12-31,CymaBay Therapeutics (NASDAQ:CBAY) Is In A Good Position To Deliver On Growth Plans
2020-12-16,Is CBAY A Good Stock To Buy Now?
2020-11-16,CymaBay Therapeutics Announces Oral Late-Breaking Presentation of Positive Results from the ENHANCE Global Phase 3 Study Evaluating Seladelpar for Primary Biliary Cholangitis at The Liver Meeting® 2020
2020-11-11,CymaBay Therapeutics to Present at Upcoming Investor Conferences
2020-11-07,CymaBay Therapeutics Inc. (CBAY) Q3 2020 Earnings Call Transcript
2020-11-05,CymaBay Reports Third Quarter 2020 Financial Results and Provides Corporate Update
2020-11-05,"CymaBay Therapeutics, Inc. to Host Earnings Call"
2020-11-05,CymaBay Announces Study to Evaluate the Potential for GPR119 Agonists to Prevent Hypoglycemia in Type 1 Diabetes
2020-11-02,CymaBay Therapeutics Announces an Oral Late-Breaking Presentation of Results from the ENHANCE Global Phase 3 Study Evaluating Seladelpar for Primary Biliary Cholangitis at The Liver Meeting® 2020
2020-10-30,"CymaBay Therapeutics to Report Third Quarter 2020 Financial Results on Thursday, November 5, 2020"
2020-10-01,CymaBay Therapeutics to Present Data from its Phase 2 Study of Seladelpar in Patients with NASH at The Liver Meeting® 2020
2020-09-30,Implied Volatility Surging for CymaBay Therapeutics (CBAY) Stock Options
2020-09-29,CymaBay Therapeutics Inc (CBAY): Hedge Funds Are Snapping Up
2020-09-22,Milestone Pharmaceuticals Strengthens Board of Directors with Two New Appointments
2020-09-03,CymaBay Therapeutics to Present at Upcoming Investor Conferences
2020-08-27,CymaBay Therapeutics Presents Positive Final Results From 52-Week Phase 2 Study in Primary Biliary Cholangitis at The Digital International Liver Congress 2020
2020-08-20,CymaBay Therapeutics Announces Presentations During The Digital International Liver Congress 2020
2020-08-11,CymaBay Therapeutics Inc. (CBAY) Q2 2020 Earnings Call Transcript
2020-08-10,CymaBay Reports Second Quarter 2020 Financial Results and Provides Corporate Update
2020-08-05,"Oppenheimer: These 3 Strong Buy Stocks Could Double, If Not More"
2020-08-03,"CymaBay Therapeutics to Report Second Quarter 2020 Financial Results on Monday, August 10, 2020"
2020-08-03,CymaBay Announces Positive Topline Results from ENHANCE for Seladelpar in Patients with Primary Biliary Cholangitis
2020-07-23,FDA Lifts All Clinical Holds on Seladelpar
2020-07-13,Edited Transcript of CBAY earnings conference call or presentation 11-May-20 8:30pm GMT
2020-07-05,"Is CymaBay Therapeutics, Inc. (NASDAQ:CBAY) Popular Amongst Institutions?"
2020-06-28,Hedge Funds Keep Selling CymaBay Therapeutics Inc (CBAY)
2020-06-19,CymaBay Therapeutics Presents Data at Digestive Disease Week 2020 Online Education
2020-06-18,Is the Options Market Predicting a Spike in CymaBay (CBAY) Stock?
2020-06-09,Here's Why CymaBay Therapeutics Rose 109% in May
2020-06-05,"Notice of Change of Location of Annual Meeting of Stockholders to be Held on June 23, 2020"
2020-06-02,"The Zacks Analyst Blog Highlights: Aileron Therapeutics, Energy Focus, MicroVision, Mersana Therapeutics and CymaBay Therapeutics"
2020-06-01,5 Top Stocks Up 100%+ in May With More Room to Run
2020-05-26,Is CymaBays Seladelpar Back in the Saddle? 5-Star Analyst Weighs In
2020-05-21,Will Good News Boost This Small-Cap Drug Company's Stock Even Higher?
2020-05-15,Is CymaBay Therapeutics (CBAY) Stock a Solid Choice Right Now?
2020-05-13,Do Options Traders Know Something About CymaBay Therapeutics (CBAY) Stock We Don't?
2020-05-13,CymaBay (CBAY) Stock Is up 127% in a Day. How Much Higher Can It Go?
2020-05-12,A Look Into CymaBay Therapeutics Price Over Earnings
2020-05-12,CymaBay Therapeutics' stock more than doubles amid hopes FDA will lift hold on NASH treatment
2020-05-12,"The Daily Biotech Pulse: NASH Disappointment For Genfit, Novavax Lands $384M CEPI Funding For Coronavirus Vaccine, GW Pharma Earnings"
2020-05-12,CymaBay Doubles After-Hours On Positive NASH Trial Update
2020-05-12,CymaBay Therapeutics Inc (CBAY) Q1 2020 Earnings Call Transcript
2020-05-11,CymaBay Reports First Quarter 2020 Financial Results and Provides Corporate Update
2020-05-04,"CymaBay Therapeutics to Report First Quarter 2020 Financial Results on Monday, May 11"
2020-04-02,Edited Transcript of CBAY earnings conference call or presentation 12-Mar-20 8:30pm GMT
2020-03-20,13D Filings
2020-03-20,Generic Drugs Industry's Prospects Uncertain Amid Coronavirus
2020-03-20,We're Keeping An Eye On CymaBay Therapeutics's (NASDAQ:CBAY) Cash Burn Rate
2020-03-13,CymaBay Therapeutics Comments on Engine Capital Director Nominations
2020-03-12,CymaBay Reports Fourth Quarter and Fiscal Year End 2019 Financial Results and Provides Corporate Update
2020-03-12,"CymaBay Therapeutics, Inc. to Host Earnings Call"
2020-03-11,"HAGENS BERMAN, NATIONAL TRIAL ATTORNEYS, Urges CymaBay Therapeutics (CBAY) Investors Who Have Suffered Losses to Contact its Attorneys: Firm Investigation Possible Securities Fraud"
2020-03-10,"IMPORTANT INVESTOR ALERT: The Schall Law Firm Announces it is Investigating Claims Against CymaBay Therapeutics, Inc. and Encourages Investors with Losses to Contact the Firm"
2020-03-10,Is the Options Market Predicting a Spike in CymaBay Therapeutics (CBAY) Stock?
2020-03-09,"HAGENS BERMAN, NATIONAL TRIAL ATTORNEYS, Encourages CymaBay Therapeutics (CBAY) Investors Who Have Suffered Losses to Contact its Attorneys: Investigation Into Possible Securities Fraud Ongoing"
2020-03-09,"SHAREHOLDER NOTICE: The Schall Law Firm Announces it is Investigating Claims Against CymaBay Therapeutics, Inc. and Encourages Investors with Losses to Contact the Firm"
2020-03-09,"ROSEN, A LEADING LAW FIRM, Announces Investigation of Securities Claims Against CymaBay Therapeutics, Inc.  CBAY"
2020-03-06,"4 Smaller, Cash-Rich Biotech Stocks That Could Be Havens"
2020-03-05,"HAGENS BERMAN, NATIONAL TRIAL ATTORNEYS, Reminds CymaBay Therapeutics (CBAY) Investors Who Have Suffered Losses to Contact its Attorneys: Firm Investigating Possible Securities Fraud"
2020-03-05,"CymaBay Therapeutics to Report Fourth Quarter and Full Year 2019 Financial Results on Thursday, March 12"
2020-03-05,"SHAREHOLDER ALERT: The Schall Law Firm Announces it is Investigating Claims Against CymaBay Therapeutics, Inc. and Encourages Investors with Losses to Contact the Firm"
2020-03-04,"CYMABAY ALERT: Bragar Eagel & Squire, P.C. Is Investigating CymaBay Therapeutics, Inc. on Behalf of Stockholders and Encourages Investors to Contact the Firm"
2020-03-03,"INVESTIGATION REMINDER: The Schall Law Firm Announces it is Investigating Claims Against CymaBay Therapeutics, Inc. and Encourages Investors with Losses to Contact the Firm"
2020-03-03,"HAGENS BERMAN, NATIONAL TRIAL ATTORNEYS, Encourages CymaBay Therapeutics (CBAY) Investors Who Have Suffered Losses to Contact its Attorneys: Firm Investigating Possible Securities Fraud"
2020-03-03,"CBAY Shareholder Alert: Bronstein, Gewirtz & Grossman, LLC Notifies Shareholders of Investigation of CymaBay Therapeutics, Inc. and Encourages Investors to Contact the Firm"
2020-03-03,"IMPORTANT INVESTOR NOTICE: The Schall Law Firm Announces it is Investigating Claims Against CymaBay Therapeutics, Inc. and Encourages Investors with Losses to Contact the Firm"
2020-03-02,"CBAY Shareholder Alert: Bronstein, Gewirtz & Grossman, LLC Notifies Shareholders of Investigation of CymaBay Therapeutics, Inc. and Encourages Investors to Contact the Firm"
2020-03-02,"INVESTIGATION ALERT: The Schall Law Firm Announces it is Investigating Claims Against CymaBay Therapeutics, Inc. and Encourages Investors with Losses to Contact the Firm"
2020-03-02,"EQUITY ALERT: ROSEN, NATIONAL INVESTOR COUNSEL, Announces Investigation of Securities Claims Against CymaBay Therapeutics, Inc.  CBAY"
2020-03-02,CymaBay Therapeutics Investigated for Possible Securities Fraud by Block & Leviton
2020-02-28,"HAGENS BERMAN, NATIONAL TRIAL ATTORNEYS, Encourages CymaBay Therapeutics (CBAY) Investors Who Have Suffered Losses to Contact its Attorneys: Firm Investigating Possible Securities Fraud"
2020-02-05,Steven Cohen Renews His Interest in Verastem
2020-01-29,CymaBay Publishes Shareholder Letter
2020-01-15,Edited Transcript of CBAY earnings conference call or presentation 5-Nov-19 9:30pm GMT
2020-01-10,CymaBay Therapeutics Enters Oversold Territory
2019-12-31,These Falling Knives May Be Worth Catching
2019-12-17,Gilead (GILD) Announces Top-Line Results From NASH Study
2019-12-10,Genfit Hopes to Buck the Odds With NASH Drug
2019-12-09,"Should You Take Comfort From Insider Transactions At CymaBay Therapeutics, Inc. (NASDAQ:CBAY)?"
2019-12-08,Is CymaBay Therapeutics Inc (CBAY) Going To Burn These Hedge Funds ?
2019-11-29,"The Zacks Analyst Blog Highlights: Intercept, CymaBay, Amgen, Global Blood Therapeutics and ChemoCentryx"
2019-11-29,NASH Scorecard Year to Date: The Winners and the Losers
2019-11-27,"Biotech Stock Roundup: CBAY Falls, CCXI Gains, Amgen Acquires Otezla &amp; More"
2019-11-26,"Company News For Nov 26, 2019"
2019-11-26,Intercept's (ICPT) NDA for NASH Drug Gets Priority Review
2019-11-26,"The Daily Biotech Pulse: ChemoCentryx Triples On Data Readout, Global Blood Given FDA Nod, Positive Safety Review For Genfit's NASH Drug"
2019-11-25,This Biotech Popped After Its Rival Crashed 76% On A Scrapped Test
2019-11-25,UPDATE 2-CymaBay Therapeutics scraps two studies of liver drug; shares plunge
2019-11-25,CymaBay Therapeutics scraps liver disease studies; shares plunge
2019-11-25,CymaBay shares fall 77% on halted trial
2019-11-25,CymaBay Therapeutics Halts Clinical Development of Seladelpar
2019-11-22,3 Strong Buy Biotech Stocks to Watch After Stifel Healthcare Conference
2019-11-14,CymaBay Therapeutics to Present at Upcoming Investor Conferences
2019-11-05,CymaBay Reports Third Quarter 2019 Financial Results and Provides Corporate Update
2019-11-04,CymaBay Therapeutics Reaches Target Enrollment in the ENHANCE Global Phase 3 Study Evaluating Seladelpar for Primary Biliary Cholangitis
2019-11-03,"Is CymaBay Therapeutics, Inc.'s (NASDAQ:CBAY) CEO Salary Justified?"
2019-10-28,"CymaBay Therapeutics to Report Third Quarter 2019 Financial Results on Tuesday, November 5"
2019-10-18,These 24 Bay Area drug and diagnostics companies quietly raised nearly $3B this year
2019-10-14,CymaBay Therapeutics to Present at the H.C. Wainwright 3rd Annual NASH Investor Conference
