2021-01-06,Corvus Gold Drills 130.5 Metres @ 2.33 g/t Gold Including 27.7 Metres @ 4.46 g/t Gold & 9.26 g/t Silver with Expansion of the New Northern High-Grade Feeder Zone at the Mother Lode Deposit
2020-12-03,Corvus Gold Files Technical Report for the North Bullfrog Project and Technical Report for the Mother Lode Project
2020-11-29,Is Corvus Gold Inc. (KOR) A Good Stock To Buy?
2020-11-17,"Corvus Golds New Lynnda Strip Discovery Displays Multiple Vein Systems with 42.7 Metres @ 2.06 g/t Gold Including 12.2 Metres @ 4.88 g/t Gold, in the Eastern Bullfrog Mining District, Nevada"
2020-11-17,Is Corvus Gold (TSE:KOR) In A Good Position To Invest In Growth?
2020-11-12,Corvus Gold Identifies New High-Grade Center at Mother Lode Deposit with 83.9 Metres @ 2.7 g/t Gold Including 12.7 Metres @ 8.5 g/t Gold & 30.4 g/t Silver
2020-10-29,Corvus Golds New Oxide Discovery at the Lynnda Strip Drills 106.7 Metres @ 0.71 g/t Gold and 48.8 Metres @ 0.9 g/t Gold and Identifies a Potential Connected System 700 Metres West
2020-10-07,"North Bullfrog Projects, Preliminary Economic Assessment  Corvus Golds Detailed Phase-1, Standalone, Near-Term Mine Development Plan in the Bullfrog Mining District, Nevada"
2020-10-07,"Corvus Gold Announces Mother Lode Preliminary Economic Assessment Results for a Standalone Future Mining Expansion Project, in the Bullfrog Mining District, Nevada"
2020-10-06,Corvus Gold Reports 2020 Annual General Meeting Results
2020-08-19,What Is The Ownership Structure Like For Corvus Gold Inc. (TSE:KOR)?
2020-08-18,"Corvus Gold Drills 56.4 Metres @ 1.71 g/t Gold, 55.1 Metres @ 1.40 g/t Gold and 64.9 Metres @ 1.02 g/t Gold, Expands Discoveries at the Mother Lode Deposit, Nevada"
2020-08-12,Corvus Gold Begins Trading on Nasdaq Under Symbol KOR
