2021-01-11,The Dow Fell 89 Points Because Stocks Are Way Overextended
2021-01-11,Lilly Rockets On Alzheimer's News  And 3 Other Highlights From Key Health Care Meeting
2021-01-11,"Eli Lilly, Office Depot, Crocs: 5 Gainers for Monday"
2021-01-11,Here's Why Eli Lilly Broke to the Upside
2021-01-11,Lillys Alzheimer's Drug Isnt Worth $20 Billion Yet
2021-01-11,Biogen's stock is up 5% after Lilly reports positive data from an Alzheimer's study
2021-01-11,Return On Capital Employed Overview: Eli Lilly
2021-01-11,"Dow Off Lows as Energy, Healthcare Rise; Democrats Eye Trump Impeachment"
2021-01-11,Eli Lilly Surges On Positive Data From Key Trial of Alzheimer's Treatment
2021-01-11,Why Eli Lilly Stock Is Crushing It Today
2021-01-11,"Dow Jones Today, Stocks Slump As Trump Ban Slams Twitter, Lilly Soars On Alzheimer's News, Boeing Slips After 737 Crash"
2021-01-11,Eli Lilly Stock Gains as Drug Slows Decline in Alzheimers Patients
2021-01-11,"Eli Lilly, Boeing, Twitter, NIO - Monday's Premarket Movers"
2021-01-11,US FDA accepts supplemental New Drug Application for Jardiance® (empagliflozin) for adults with heart failure with reduced ejection fraction
2021-01-11,Lilly's stock jumps 15% after experimental Alzheimer's drug shows it can slow cognitive decline
2021-01-11,Lilly's Donanemab Slows Clinical Decline of Alzheimer's Disease in Positive Phase 2 Trial
2021-01-08,Don't Expect Covid-19 Research to Deliver Certainty
2021-01-07,Radius (RDUS) to Acquire Rights for Cannabidiol Oral Solution
2021-01-05,Eli Lilly (LLY) Gains But Lags Market: What You Should Know
2021-01-05,Spiros Segalas' Top Trades of the 4th Quarter
2021-01-05,A Look Into Eli Lilly's Price Over Earnings
2021-01-05,(PRVL Alert) Johnson Fistel Investigates Proposed Sale of Prevail; Are Shareholders Getting a Fair Deal?
2021-01-05,Get Ready for Health-Care Stocks to Go Wild. How to Play Them.
2021-01-04,Lilly to Participate in J.P. Morgan Healthcare Conference
2021-01-04,Outlook for biotech companies in 2021
2021-01-03,Why Aren't Doctors Prescribing Eli Lilly's and Regeneron's COVID-19 Treatments?
2020-12-30,Regeneron (REGN) Releases Initial Data on Cocktail for COVID-19
2020-12-30,Regenerons Antibodies Appear to Help Hospitalized Patientsand Could Help 2021 Revenue
2020-12-29,Eli Lilly (LLY) Gains As Market Dips: What You Should Know
2020-12-29,Amphastar Surges on FDA Approval of Generic Hypoglycemia Injection
2020-12-28,25 Safest Cities in America in 2020
2020-12-23,Eli Lilly (LLY) Stock Sinks As Market Gains: What You Should Know
2020-12-22,10 Best Healthcare Dividend Stocks
2020-12-22,(PRVL Alert) Johnson Fistel Investigates Proposed Sale of Prevail; Are Shareholders Getting a Fair Deal?
2020-12-21,Principle LTC's Tower Nursing & Rehabilitation Center Joins with Eli Lilly and Company on Phase 3 Drug Trial for COVID-19 Prevention
2020-12-21,Here's Why Lilly (LLY) Has Outperformed the Industry This Year
2020-12-19,"Eli Lilly, Amgen, and 2 Other Companies That Raised Their Dividends This Week"
2020-12-18,Lilly to begin pragmatic study of neutralizing antibody bamlanivimab (LY-CoV555) for COVID-19 in New Mexico
2020-12-18,3 Stocks Delivering Over 10% Dividend Increases
2020-12-18,"Pharma Stock Roundup: FDA Emergency Nod to PFE/BNTX COVID-19 Vaccine, AZN to Buy ALXN"
2020-12-17,Eli Lilly (LLY) Gains But Lags Market: What You Should Know
2020-12-17,"The Zacks Analyst Blog Highlights: Mastercard, Eli Lilly, Citigroup, Advanced Micro Devices and Square"
2020-12-17,"Bluebird Bio, Biomarin Tabbed as Top Acquisition Targets"
2020-12-16,"PREVAIL THERAPEUTICS INVESTOR ALERT BY THE FORMER ATTORNEY GENERAL OF LOUISIANA: Kahn Swick & Foti, LLC Investigates Adequacy of Price and Process in Proposed Sale of Prevail Therapeutics Inc. - PRVL"
2020-12-16,"U.S. hospital demand for Lilly, Regeneron COVID-19 antibody drugs  'disappointing'"
2020-12-16,"SHAREHOLDER ALERT: Rigrodsky & Long, P.A. Announces Investigation of Prevail Therapeutics Inc. Buyout"
2020-12-16,"Top Analyst Reports for Mastercard, Eli Lilly & Citigroup"
2020-12-16,"PREVAIL THERAPEUTICS ALERT: Bragar Eagel & Squire, P.C. Investigates Sale of PRVL and Encourages Investors to Contact the Firm"
2020-12-16,Lilly (LLY) to Acquire Prevail Therapeutics for Gene Therapies
2020-12-16,"Company News for Dec 16, 2020"
2020-12-16,"Lilly (LLY) Stock Up on Raised 2020 View, Upbeat 2021 Guidance"
2020-12-15,Christmas Came Early for Eli Lilly Shareholders
2020-12-15,This Gene Therapy Stock Is Ablaze On Eli Lilly's $1.04 Billion Takeover
2020-12-15,"US STOCKS-Nasdaq ends at record high on stimulus bets, Apple boost"
2020-12-15,Why Eli Lilly Stock Jumped Today
2020-12-15,Eli Lilly Acquiring Prevail Therapeutics in $880 Million Deal
2020-12-15,US STOCKS-Stimulus optimism and Apple spark Wall Street rally
2020-12-15,"US STOCKS-Wall St supported by Apple, stimulus bets as Fed takes center stage"
2020-12-15,Why Plug Power and Prevail Therapeutics Gave the Stock Market a Boost Tuesday Morning
2020-12-15,Why Prevail Therapeutics Stock Is Skyrocketing Today
2020-12-15,"Eli Lilly to Buy Prevail Therapeutics in $1.04 Billion Deal, Shares Soar"
2020-12-15,"Eli Lilly Lifts Sales Guidance, Enters Gene Therapy Field With Prevail Acquisition"
2020-12-15,Eli Lilly to Buy Prevail for $1 Billion in Parkinsons Push
2020-12-15,"US STOCKS-Wall Street gains on Apple, stimulus hopes as Fed takes center stage"
2020-12-15,"Dow Jones Rebounds, Stocks Climb On Stimulus Compromise; Baidu Looks Into EVs, Apple Boosts iPhone Output"
2020-12-15,P/E Ratio Insights for Eli Lilly
2020-12-15,Eli Lilly and Company -- Moody's announces completion of a periodic review of ratings of Eli Lilly and Company
2020-12-15,Return On Capital Employed Overview: Eli Lilly
2020-12-15,Lilly Sees Gains from Fighting Covid and Buys into Gene Therapy
2020-12-15,"Eli Lilly Boosts Profit Guidance, Buys Prevail Therapeutics For $1 Billion"
2020-12-15,US STOCKS-Wall Street set to rise on stimulus hopes; Fed meet in focus
2020-12-15,"Eli Lilly, Prevail Therapeutics, Boeing - Tuesday's Premarket Movers"
2020-12-15,Eli Lilly's stock rallies after raising full-year profit outlook
2020-12-15,"Lilly Announces 2021 Financial Guidance, Updates 2020 Guidance"
2020-12-15,Prevail Therapeutics stock nearly doubles after Eli Lilly buyout deal
2020-12-15,Lilly Announces Agreement to Acquire Prevail Therapeutics
2020-12-14,Eli Lilly Raises Dividend by 15%
2020-12-14,Eli Lilly raises dividend by 15%
2020-12-14,Lilly Announces 15 Percent Dividend Increase
2020-12-14,Lilly announces opening of patient enrollment for New IDEAS: Imaging Dementia - Evidence for Amyloid Scanning study
2020-12-13,"Nike, FedEx, Lennar, Eli Lilly, and Other Stocks for Investors to Watch This Week"
2020-12-11,Eli Lilly (LLY) Dips More Than Broader Markets: What You Should Know
2020-12-11,Thiel-Backed Developer of Covid-19 Therapy Surges in Debut
2020-12-11,COVID SCIENCE-Drug combination improves COVID-19 pneumonia outcomes; five genes linked to severe disease
2020-12-11,Data from ACTT-2 Trial of Baricitinib in Hospitalized COVID-19 Patients Supportive of the EUA Published in New England Journal of Medicine
2020-12-11,"Five key severe COVID-19 genes found, suggesting drug targets"
2020-12-11,"Pharma Stock Roundup: FDA Panel's Nod to PFE/BNTX Coronavirus Vaccine, Other Updates"
2020-12-10,Lilly's (LLY) Tirzepatide Meets Endpoints in Late-Stage Study
2020-12-10,"Company News for Dec 10, 2020"
2020-12-10,Thiel-backed antibody therapy developer AbCellera boosts IPO price range
2020-12-10,Eli Lilly (LLY) Soars: Stock Adds 5.8% in Session
2020-12-09,Why Eli Lilly Stock Jumped Today
2020-12-09,How Eli Lilly's Newest Drug Took Weight Off Patients  And Lilly Shares
2020-12-09,Lilly Jumps After Results From Next Generation Diabetes Drug
2020-12-09,"Roche (RHHBY), Moderna Ink Deal for Coronavirus Antibody Test"
2020-12-09,Eli Lilly Sees Positive Data From Late-Stage Trial of Diabetes Treatment Tirzepatide
2020-12-09,Lilly Presents Positive Primary Outcome Data from monarchE that Builds on Previous Definitive Analysis for Verzenio®
2020-12-09,Lilly's tirzepatide significantly reduced A1C and body weight in people with type 2 diabetes
2020-12-08,Vaccines Alone Arent Enough to Beat Covid-19
2020-12-08,Is LLY A Good Stock To Buy Now?
