2021-01-11,"Fiverr to Announce Fourth Quarter 2020 Results on February 18, 2021"
2021-01-11,My 3 Highest-Conviction Growth Stocks for 2021
2021-01-08,Here's How Fiverr Shares Flew 730% Higher in 2020
2021-01-08,2 Top Tech Stocks to Buy Right Now
2021-01-05,Fiverr to Present at the Goldman Sachs Technology and Internet Conference
2021-01-05,2 Stocks That Could Easily Double in 2021
2021-01-03,"Got $5,000? Here Are 3 Stocks to Buy and Hold For the Long Term"
2020-12-31,"100 Best Companies Of 2020: Agility Amid Covid Crisis Saw At-Home Plays, Biotechs Excel"
2020-12-31,Fiverr Stock Has Surged 740% So Far in 2020: Is It a Buy for 2021?
2020-12-31,Investing Your Stimulus Check? 3 Best Stocks to Buy Now
2020-12-23,Top-Performing E-Commerce ETFs & Stocks of 2020
2020-12-23,Is Fiverr International Lt. (FVRR) Stock Outpacing Its Retail-Wholesale Peers This Year?
2020-12-22,2020 -- Best Tech Stocks
2020-12-22,"Got $1,000? 3 Smart Stocks to Buy Right Now"
2020-12-21,Is FVRR A Good Stock To Buy According To Hedge Funds?
2020-12-21,"Benzinga's Top Upgrades, Downgrades For December 21, 2020"
2020-12-17,The 5 Best Stocks of 2020
2020-12-16,5 Trends the Pandemic Accelerated
2020-12-16,Why Fiverr's Stock Is Trading Lower Today
2020-12-16,68% of Remote Workers are Interested in Taking on Freelance Work Amid COVID-19 Pandemic
2020-12-16,3 Top E-Commerce Stocks to Buy Before 2021
2020-12-10,"Fiverr: Right Place, Right Model"
2020-12-10,All You Need to Know About Fiverr (FVRR) Rating Upgrade to Buy
2020-12-09,One of My Stocks Just Sold Off Big on No News. Now What?
2020-12-08,How Fiverr Shares Rose 37% Last Month
2020-12-08,Is Fiverr International (NYSE:FVRR) Using Too Much Debt?
2020-12-07,Has Fiverr International Lt. (FVRR) Outpaced Other Retail-Wholesale Stocks This Year?
2020-12-06,"Cramer Gives His Opinion On Boeing, Fiverr And More"
2020-11-27,5 Top-Ranked Growth Stocks to Buy Instead of Bitcoin
2020-11-19,Can Fiverr (FVRR) Run Higher on Rising Earnings Estimates?
2020-11-19,Is Fiverr International Lt. (FVRR) Outperforming Other Retail-Wholesale Stocks This Year?
2020-11-19,Online Holiday Sales to Hit Record High: 5 Must-Buy Stocks
2020-11-19,Fiverr Announces Expansion into Latin America with Launches in Brazil and Mexico
2020-11-13,Fiverr to Present at Upcoming Investor Conferences
2020-11-11,"Why Pinterest, Upwork, and Fiverr Stocks Surged Today"
2020-11-11,Here's the Stock Market's Next Winning Trend
2020-11-10,Investing in the Gig Economy
2020-11-10,Why Gig Economy Stocks Plunged on Monday
2020-11-06,"Zacks Investment Ideas feature highlights: Uber, Lyft, Upwork, GoDaddy and Fiverr"
2020-11-05,Election Win For The Gig Economy: Stocks To Watch
2020-11-03,Is Fiverr International Lt. (FVRR) Stock Outpacing Its Retail-Wholesale Peers This Year?
2020-10-29,Fiverr (FVRR) Tests Support Despite Price Target Boost
2020-10-29,Fiverr International Demolished Wall Street's Third-Quarter Targets
2020-10-28,Fiverr Reports 37 Pct Surge In Active Buyers Amid Rollout Of Payment Features
2020-10-28,Fiverr International (FVRR) Surpasses Q3 Earnings and Revenue Estimates
2020-10-28,Fiverr International: Q3 Earnings Insights
2020-10-28,"Fiverr Surges In Pre-Market On Earnings, Revenue Beat"
2020-10-28,Fiverr International Ltd to Host Earnings Call
2020-10-28,Fiverr Announces Third Quarter 2020 Results
2020-10-26,Fiverr (FVRR) to Report Q3 Earnings: What's in the Cards?
2020-10-21,Fiverr International (FVRR) Reports Next Week: Wall Street Expects Earnings Growth
2020-10-16,4 Biggest Consumer Goods Trends in 2020
2020-10-09,7 Innovative Stocks That Will Disrupt Their Sectors
2020-10-09,If You Had Bought Fiverr International (NYSE:FVRR) Shares A Year Ago You'd Have Earned 650% Returns
2020-10-08,Fiverr Announces Pricing of Private Offering of $400 Million of 0% Convertible Senior Notes Due 2025
2020-10-07,5 Stocks That Will Benefit From the Self-Employment Boom
2020-10-07,Fiverr to offer $400 million of convertible bonds due 2025
2020-10-07,Fiverr Announces Proposed Private Offering of $400 Million of Convertible Senior Notes Due 2025
2020-10-07,"Fiverr Releases Global Small Business Needs Index, With E-Commerce, Dropshipping, and Web Development Services Topping the List"
2020-10-06,Hedge Funds Keep Buying Fiverr International Ltd. (FVRR)
2020-10-06,Here's Why Fiverr International Shares Rose 15% in September
2020-10-05,Is Fiverr International Lt. (FVRR) Outperforming Other Retail-Wholesale Stocks This Year?
2020-10-05,"Fiverr to Announce Third Quarter 2020 Results on October 28, 2020"
2020-09-30,"Despite the Market Turmoil, Fiverr Is No Bubble Stock"
2020-09-24,"Fiverr's Shares March Higher, Can It Continue?"
2020-09-19,"Study: Freelancing surges in coronavirus era, workers find pay, flexibility attractive"
2020-09-18,Is Fiverr International Lt. (FVRR) Outperforming Other Retail-Wholesale Stocks This Year?
2020-09-16,5 Hot Stocks to Play the Sizzling E-commerce Industry
2020-09-16,Fiverr Launches A New Subscription Platform For Businesses
2020-09-15,Fiverr Business helps teams manage freelance projects
2020-09-15,"Introducing Fiverr Business, a New Platform Targeting Team Collaboration for The Future of Work"
2020-09-10,"Overstock, Nikola, DraftKings: Midday Tech Stock Movers"
2020-09-09,"Fiverr Unveils New Brand Campaign ""It Starts Here"", Spotlights Three Real Businesses on Their Path to Digital Transformation"
2020-09-04,Why Fiverr Stock Jumped 29% Last Month
2020-09-03,How This CEO is Shaping the Next Normal in Customer Care and Employee Onboarding
2020-09-02,Has Fiverr International Lt. (FVRR) Outpaced Other Retail-Wholesale Stocks This Year?
2020-09-01,3 Monster Stocks in the Making
2020-08-31,Here's Why Fiverr International (FVRR) is a Great Momentum Stock to Buy
2020-08-27,"The Zacks Analyst Blog Highlights: JD, STMP, FVRR and GRPN"
2020-08-27,"Benzinga's Top Upgrades, Downgrades For August 27, 2020"
2020-08-27,E-commerce Salvaging Retailers Amid Pandemic: 4 Winners
2020-08-26,"Fiverr's Shares March Higher, Can It Continue?"
2020-08-26,"For Small Businesses, the Time to Make ""The Shift"" is Now"
2020-08-25,"Fiverr International's Shares March Higher, Can It Continue?"
2020-08-19,Earnings Estimates Moving Higher for Fiverr (FVRR): Time to Buy?
2020-08-17,Is Fiverr International Lt. (FVRR) Outperforming Other Retail-Wholesale Stocks This Year?
2020-08-14,Fiverr International (FVRR) is a Great Momentum Stock: Should You Buy?
2020-08-13,A Look at 4 of the Best-Performing Tech Stocks of 2020
2020-08-10,Loss-Making Fiverr International Ltd. (NYSE:FVRR) Expected To Breakeven
2020-08-10,When Will Fiverr International Ltd. (NYSE:FVRR) Become Profitable?
2020-08-07,10 Stocks to Buy for Your 10-Year-Old
2020-08-05,Why Fiverr Stock Soared Today
2020-08-05,"5 Stock Gainers for Wednesday: Novavax, Fiverr, Overstock.com"
2020-08-05,Fiverr International (FVRR) Q2 Earnings and Revenues Beat Estimates
2020-08-05,Recap: Fiverr International Q2 Earnings
2020-08-05,Fiverr Pops 18% In Pre-Market On Upbeat 2Q Earnings And Raised Outlook
2020-08-05,Fiverr Announces Second Quarter 2020 Results
2020-08-04,"E-commerce Stocks' Aug 5 Q2 Earnings Roster: FVRR, W & CVNA"
2020-07-31,Fiverr (FVRR) to Report Q2 Earnings: What's in the Cards?
2020-07-31,How Top Fund Managers Spot Tomorrow's Stock Winners Early
