2020-12-11,Where Do Hedge Funds Stand On Atlantica Sustainable Infrastructure plc (AY)?
2020-11-30,Shareholders Of Atlantica Sustainable Infrastructure (NASDAQ:AY) Must Be Happy With Their 221% Total Return
2020-11-11,Atlantica Yield (AY) Q3 2020 Earnings Call Transcript
2020-11-06,Atlantica Sustainable Infrastructure Plc to Host Earnings Call
2020-11-05,Atlantica Yield's Earnings: A Preview
2020-11-01,What Did Atlantica Sustainable Infrastructure's (NASDAQ:AY) CEO Take Home Last Year?
2020-10-02,What Kind Of Investors Own Most Of Atlantica Sustainable Infrastructure plc (NASDAQ:AY)?
2020-09-14,10 Biggest Solar Companies
2020-09-02,Is Atlantica Sustainable Infrastructure plc (NASDAQ:AY) Trading At A 34% Discount?
2020-09-01,3 Top Infrastructure Stocks to Buy in September
2020-08-22,3 High-Yield Dividend Stocks I'd Buy Right Now
2020-08-07,What We Make Of Atlantica Sustainable Infrastructure's (NASDAQ:AY) Returns On Capital
2020-08-04,This High-Yielding Renewable Energy Stock Has Lots More Dividend Growth Ahead
2020-08-04,Atlantica Yield (AY) Q2 2020 Earnings Call Transcript
2020-07-08,"Based On Its ROE, Is Atlantica Sustainable Infrastructure plc (NASDAQ:AY) A High Quality Stock?"
2020-06-30,Hedge Funds Never Been Less Bullish On Atlantica Sustainable Infrastructure plc (AY)
2020-06-12,Stocks Showing Rising Market Leadership: Atlantica Yield Earns 81 RS Rating
2020-06-08,A first-of-its-kind racial empowerment ETF is flying under the radar. Maybe it shouldnt.
2020-05-18,Is Atlantica Yield (AY) a Great Value Stock Right Now?
2020-05-16,5 Renewable Energy Stocks to Buy Right Now
2020-05-15,Morgan Stanley Sticks to Their Hold Rating for Atlantica Yield plc
2020-05-13,This 6.8%-Yielding Renewable Energy Stock Has Lots of Growth Ahead
2020-05-13,RBC Capital Sticks to Their Hold Rating for Atlantica Yield plc
2020-05-09,Atlantica Yield plc (NASDAQ:AY) Just Reported First-Quarter Earnings: Have Analysts Changed Their Mind On The Stock?
2020-05-09,5 Under-the-Radar Energy Stocks to Buy Now
2020-05-08,Atlantica Yield plc (AY) Q1 2020 Earnings Call Transcript
2020-05-08,Expert Roundtable: Looking at Oil Stocks? Buy These Instead
2020-05-05,3 Top Infrastructure Stocks to Watch in May
2020-04-30,Atlantica Yield (NASDAQ:AY) Shareholders Have Felt Some Pain With A 4.4% Loss On Their Investment
2020-04-17,5 Utilities Outperforming the Market
2020-04-08,"Before You Buy Atlantica Yield plc (NASDAQ:AY), Consider Its Volatility"
2020-03-30,Hedge Funds Have Never Been Less Bullish On Atlantica Yield plc (AY)
2020-03-13,What Is Atlantica Yield's (NASDAQ:AY) P/E Ratio After Its Share Price Tanked?
2020-03-01,Is Atlantica Yield plc's (NASDAQ:AY) CEO Paid At A Competitive Rate?
2020-02-21,New Strong Sell Stocks for February 21st
2020-02-19,New Strong Sell Stocks for February 19th
2020-02-13,New Strong Sell Stocks for February 13th
2020-02-10,"Simple Market Timing Strategies That Work - February 10, 2020"
2020-01-24,"The Keys to Successfully Timing the Markets - January 24, 2020"
2020-01-10,Are Investors Undervaluing Atlantica Yield plc (NASDAQ:AY) By 49%?
2020-01-03,Should Value Investors Buy Atlantica Yield (AY) Stock?
2019-12-09,Is Atlantica Yield plc (AY) A Good Stock To Buy?
2019-12-09,"Yes, You Can Time the Market. Find out How - December 09, 2019"
2019-11-13,"Simple Market Timing Strategies That Work - November 13, 2019"
2019-11-11,These 4 Measures Indicate That Atlantica Yield (NASDAQ:AY) Is Using Debt Extensively
2019-10-26,Hedge Funds Are Selling Atlantica Yield plc (AY)
2019-10-24,"The Keys to Successfully Timing the Markets - October 24, 2019"
2019-10-08,Atlantica Yield (AY) Upgraded to Buy: What Does It Mean for the Stock?
2019-10-03,"How to Time the Markets Like an Investing Pro - October 03, 2019"
2019-09-12,"How to Time the Markets Like an Investing Pro - September 12, 2019"
2019-09-03,The High-Yield Renewable Energy Stock Most Investors Have Probably Overlooked
2019-08-23,The 10 Biggest Renewable Energy Stocks
2019-08-22,"How to Time the Markets Like an Investing Pro - August 22, 2019"
2019-08-13,Atlantica Yield plc (AY) Q2 2019 Earnings Call Transcript
2019-08-02,Top Ranked Income Stocks to Buy for August 2nd
2019-08-01,"The Truth About Market Timing - August 01, 2019"
2019-07-31,Top Ranked Income Stocks to Buy for July 31st
2019-07-30,Top Ranked Income Stocks to Buy for July 30th
2019-07-08,Top Ranked Income Stocks to Buy for July 8th
2019-07-03,Top Ranked Income Stocks to Buy for July 3rd
2019-07-02,Top Ranked Income Stocks to Buy for July 2nd
2019-07-02,Atlantica Yield (AY) Upgraded to Buy: Here's Why
2019-05-16,"David Tepper Exits Atlantica Yield, Allstate"
2019-05-14,"Blue Rock Advisors, LLC Buys Atlantica Yield PLC, Companhia De Saneamento Basico Do Estado De Sao Pa"
2019-05-10,Atlantica Yield plc (AY) Q1 2019 Earnings Call Transcript
2019-05-10,"Atlantica Yield (AY) Reports Q1 Loss, Misses Revenue Estimates"
2019-05-10,Atlantica Yield: 1Q Earnings Snapshot
2019-05-03,Will Atlantica Yield (AY) Report Negative Earnings Next Week? What You Should Know
2019-04-30,Heres What Hedge Funds Think About Atlantica Yield plc (AY)
2019-04-16,Factors That Make Southern Company an Enticing Stock Now
2019-04-02,What Makes Atlantica Yield (AY) a New Buy Stock
2019-03-01,Atlantica Yield plc (AY) Q4 2018 Earnings Conference Call Transcript
2019-02-28,Atlantica Yield plc to Host Earnings Call
2019-02-25,"Telephone and Data Systems (TDS) Q4 Earnings Miss, Up Y/Y"
2019-02-21,Is Atlantica Yield (AY) a Great Value Stock Right Now?
2019-02-04,Is Atlantica Yield (AY) Stock Undervalued Right Now?
2019-02-01,AY vs. UTL: Which Stock Should Value Investors Buy Now?
2019-01-17,Is Atlantica Yield (AY) Stock Undervalued Right Now?
2019-01-17,Atlantica Yield Sees Hammer Chart Pattern: Time to Buy?
2019-01-14,Top Ranked Growth Stocks to Buy for January 14th
2018-12-16,Do Hedge Funds Love Atlantica Yield plc (AY)?
2018-11-27,Algonquin Power & Utilities Corp. Completes Purchase of Additional Stake in Atlantica Yield plc
2018-11-14,"New Research: Key Drivers of Growth for WellCare Health Plans, Streamline Health Solutions, Aptose Biosciences, Houston Wire & Cable, RTI Surgical, and Atlantica Yield  Factors of Influence, Major Initiatives and Sustained Production"
2018-11-06,Atlantica Yield: 3Q Earnings Snapshot
2018-11-05,Atlantica Yield (AY) Q3 Earnings and Revenues Beat Estimates
2018-10-01,Top 4 Alternative Energy Companies for 2018
2018-09-06,Top 4 Alternative Energy Stocks as of September 2018
2018-08-06,Atlantica Yield plc to Host Earnings Call
2018-07-19,Buy 5 Defensive Stocks as US-China Trade Conflicts Intensify
2018-06-26,Is Atlantica Yield plcs (NASDAQ:AY) Balance Sheet A Threat To Its Future?
2018-05-31,Atlantica Yield plc -- Moody's upgrades Atlantica Yield's CFR to Ba3; outlook positive
2018-05-14,Atlantica Yield plc to Host Earnings Call
2018-05-14,Does Atlantica Yield plcs (NASDAQ:AY) Debt Level Pose A Problem?
2018-04-24,Atlantica Yield plc -- Moody's places Atlantica Yields's ratings on review for upgrade
2018-04-24,Algonquin Power & Utilities Corp. Announces Closing of Equity Financing
2018-03-09,Algonquin Power & Utilities Corp. Completes Formation of AAGES Joint Venture and Purchase of 25% Interest in Atlantica Yield plc
2018-03-07,Atlantica Yield plc to Host Earnings Call
2017-12-07,"Atlantica Yield Plc  Value Analysis (NASDAQ:AY) : December 7, 2017"
2017-12-06,"Atlantica Yield Plc breached its 50 day moving average in a Bullish Manner : AY-US : December 6, 2017"
