2020-12-12,Is HLI A Good Stock To Buy Now?
2020-12-07,Virtu Financial (VIRT) Adds Rule 606 Reporting Aggregation Tool
2020-12-03,Houlihan Lokey to Present at the Goldman Sachs 2020 US Financial Services Conference
2020-11-30,Understanding Houlihan Lokey's Ex-Dividend Date
2020-11-23,Houlihan Lokey Adds Experienced Tax Advisor to Its Financial and Valuation Advisory Business
2020-11-12,Why Houlihan Lokey (HLI) Stock is a Compelling Investment Case
2020-11-05,Houlihan Lokey Expands Its Board With Appointments of Pamay Bassey and Cyrus Walker
2020-10-30,Houlihan Lokey Inc (HLI) Q2 2021 Earnings Call Transcript
2020-10-29,Houlihan Lokey (HLI) Q2 Earnings and Revenues Beat Estimates
2020-10-29,Houlihan Lokey: Q2 Earnings Insights
2020-10-29,Houlihan Lokey Reports Second Quarter Fiscal 2021 Financial Results
2020-10-29,"Houlihan Lokey, Inc. to Host Earnings Call"
2020-10-22,Analysts Estimate Houlihan Lokey (HLI) to Report a Decline in Earnings: What to Look Out for
2020-10-16,Houlihan Lokey Announces Release Date for Second Quarter Results for Fiscal Year 2021
2020-10-15,Analysts Estimate Houlihan Lokey (HLI) to Report a Decline in Earnings: What to Look Out for
2020-10-14,Houlihan Lokey (HLI) is a Great Momentum Stock: Should You Buy?
2020-10-02,"What Kind Of Shareholders Hold The Majority In Houlihan Lokey, Inc.'s (NYSE:HLI) Shares?"
2020-09-29,Hedge Funds Have Never Been This Bullish On Houlihan Lokey Inc (HLI)
2020-09-21,Lebenthal Joins Houlihan to Guide Women-Owned Businesses on Growth Opportunities
2020-09-16,Houlihan Lokey Continues Expansion of Its Industrials Group With Key Hire
2020-09-09,Houlihan Lokey Hires Alexandra Lebenthal as a Senior Advisor
2020-09-03,Houlihan Lokey Hires Industry Veteran to Lead New Practice in Healthcare
2020-08-27,"Houlihan Lokey, Inc. (NYSE:HLI) Looks Interesting, And It's About To Pay A Dividend"
2020-07-29,Houlihan Lokey Inc (HLI) Q1 2021 Earnings Call Transcript
2020-07-28,Houlihan Lokey (HLI) Beats Q1 Earnings and Revenue Estimates
2020-07-28,Recap: Houlihan Lokey Q1 Earnings
2020-07-28,Houlihan Lokey Reports First Quarter Fiscal 2021 Financial Results
2020-07-23,Is Now The Time To Put Houlihan Lokey (NYSE:HLI) On Your Watchlist?
2020-07-21,Earnings Preview: Houlihan Lokey (HLI) Q1 Earnings Expected to Decline
2020-07-08,Houlihan Lokey Announces Release Date for First Quarter Results for Fiscal Year 2021
2020-06-26,Hedge Funds Are Piling Into Houlihan Lokey Inc (HLI)
2020-06-22,New Wirecard CEO Has Few Days to Calm Nervous Investors
2020-06-16,Andreas Dombret Joins Houlihan Lokey as an International Senior Advisor
2020-06-15,Warburg Pincus-Backed Group Nears 58.com Buyout Deal
2020-06-04,Medley Capital to Seek Buyer After Sierra Deal Collapses
2020-05-29,Houlihan Lokey Is the Investment Bank Built for Hard Times
2020-05-18,Houlihan Lokey Announces Pricing of Offering of HLI Class A Common Stock
2020-05-18,Houlihan Lokey Announces Offering of HLI Class A Common Stock
2020-05-14,Exclusive: Saudi Binladin seeks adviser for financial overhaul of Mecca complex
2020-05-12,Houlihan Lokey Inc (HLI) Q4 2020 Earnings Call Transcript
2020-05-12,Houlihan Lokey (HLI) Q4 Earnings and Revenues Top Estimates
2020-05-12,Houlihan Lokey Reports Fiscal Year and Fourth Quarter 2020 Financial Results
2020-05-07,"Neiman Goes Bankrupt, Idled by Virus and Crushed by Debt"
2020-05-05,Analysts Estimate Houlihan Lokey (HLI) to Report a Decline in Earnings: What to Look Out for
2020-04-30,Houlihan Lokey Further Builds Its Corporate Finance Capabilities in Australia
2020-04-21,Houlihan Lokey Announces Release Date for Fourth Quarter and Full Year Results for Fiscal Year 2020
2020-04-16,Houlihan Lokey Adds New Service Offering to Assist Financial Sponsor General Partners
2020-04-10,"The Consensus EPS Estimates For Houlihan Lokey, Inc. (NYSE:HLI) Just Fell Dramatically"
2020-04-07,Hedge Funds Are Dumping Houlihan Lokey Inc (HLI)
2020-04-06,Houlihan Lokey Hires Industry Veteran to Lead Its Transaction Advisory Services Practice
2020-04-03,TPG Mortgage REIT Taps Houlihan for Strategic Alternatives
2020-04-03,HNAs Swissport to Hire Houlihan Lokey to Advise on Debt
2020-03-26,"Should You Worry About Houlihan Lokey, Inc.'s (NYSE:HLI) CEO Pay?"
2020-03-26,Seadrill Re-Hires Houlihan
2020-03-26,Seadrill Re-Hires Houlihan in Fresh Debt Restructuring Effort
2020-03-12,Edited Transcript of HLI earnings conference call or presentation 3-Feb-20 10:00pm GMT
2020-03-10,Default-Bound Lebanon Readies Pitch to IMF That Avoids Pain
2020-02-28,"Houlihan Lokey, Inc. (NYSE:HLI)'s Could Be A Buy For Its Upcoming Dividend"
2020-02-26,Houlihan Lokey Grows Its Oil & Gas Group With Experienced Hire
2020-02-20,"NMC Parent Said to Hire Houlihan to Weigh Debt, M&A Options"
2020-02-13,Do Houlihan Lokey's (NYSE:HLI) Earnings Warrant Your Attention?
2020-02-03,Houlihan Lokey (HLI) Beats Q3 Earnings and Revenue Estimates
2020-02-03,Houlihan Hired to Advise FHFA on Fannie-Freddie Release Plan
2020-02-03,Houlihan Lokey Reports Third Quarter Fiscal 2020 Financial Results
2020-02-03,"Houlihan Lokey, Inc. to Host Earnings Call"
2020-01-31,Why Earnings Season Could Be Great for Houlihan Lokey (HLI)
2020-01-27,Houlihan Lokey (HLI) Expected to Beat Earnings Estimates: What to Know Ahead of Q3 Release
2020-01-18,"Before You Buy Houlihan Lokey, Inc. (NYSE:HLI), Consider Its Volatility"
2020-01-15,Will Houlihan Lokey (HLI) Beat Estimates Again in Its Next Earnings Report?
2020-01-14,Houlihan Lokey Adds Equity Capital Markets Advisory Capability in Europe
2020-01-13,Houlihan Lokey Announces Release Date for Third Quarter Results for Fiscal Year 2020
2019-12-19,"Does Houlihan Lokey, Inc. (NYSE:HLI) Have A Good P/E Ratio?"
2019-12-12,Is Houlihan Lokey Inc (HLI) A Good Stock To Buy?
2019-11-21,Two China Firms Dollar Bonds Sink in Shandong as Woes Grow
2019-11-19,"Is Now The Time To Look At Buying Houlihan Lokey, Inc. (NYSE:HLI)?"
2019-11-18,Houlihan Lokey Expands Board With Appointment of Gillian Zucker
2019-11-05,Houlihan Lokey buys Spain's Fidentiis in European expansion
2019-11-05,Houlihan Lokey Acquires Fidentiis Capital to Continue European Expansion
2019-10-26,"Houlihan Lokey Inc (HLI): Hedge Funds Are Buying, Should You?"
2019-10-26,Edited Transcript of HLI earnings conference call or presentation 24-Oct-19 9:00pm GMT
2019-10-24,Houlihan Lokey (HLI) Beats Q2 Earnings and Revenue Estimates
2019-10-24,Houlihan Lokey Reports Second Quarter Fiscal 2020 Financial Results
2019-10-23,Houlihan Lokey to Acquire Freeman & Co.
2019-10-20,Can You Imagine How Houlihan Lokey's (NYSE:HLI) Shareholders Feel About The 90% Share Price Increase?
2019-10-17,Earnings Preview: Houlihan Lokey (HLI) Q2 Earnings Expected to Decline
2019-10-15,SoftBank Taps Houlihan Lokey for WeWork Restructuring Advice
2019-10-15,Houlihan Lokey Expands Its Healthcare Group With Key Hires
2019-10-08,Houlihan Lokey Announces Release Date for Second Quarter Results for Fiscal Year 2020
2019-09-24,Houlihan Lokey Adds Experienced Senior Banker to Capital Markets Group
2019-09-23,Houlihan Lokey Expands Its Private Funds Group With New Hire and Practice Openings
2019-09-23,"Do Institutions Own Houlihan Lokey, Inc. (NYSE:HLI) Shares?"
2019-09-17,"Muted Lending, High Costs to Mar Hexindai (HX) Q1 Earnings"
2019-09-10,MoneyGram Eases Person-to-Person Money Transfer With Visa
2019-09-04,Treasury Discussed Hiring Houlihan to Advise on Fannie-Freddie
2019-08-31,"Houlihan Lokey, Inc. (NYSE:HLI) Passed Our Checks, And It's About To Pay A 0.7% Dividend"
2019-08-23,"Our Take On Houlihan Lokey, Inc.'s (NYSE:HLI) CEO Salary"
2019-08-05,"MoneyGram (MGI) Q2 Earnings Beat Estimates, Revenues Miss"
2019-07-31,Should You Be Adding Houlihan Lokey (NYSE:HLI) To Your Watchlist Today?
2019-07-29,Houlihan Lokey Announces Pricing of Secondary Offering of HLI Class A Common Stock by Selling Stockholder
2019-07-29,Houlihan Lokey Announces Secondary Offering of HLI Class A Common Stock by Selling Stockholder
