2021-01-07,"The Zacks Analyst Blog Highlights: Liquidity Services, Bassett Furniture, Hibbett Sports, Titan Machinery and Gogo"
2021-01-05,T-Mobile (TMUS) Inks Deal to Acquire BMU's Sprint Assets
2020-12-31,7 Cheap Stocks That Cant Wait for 2021
2020-12-30,"Verizon (VZ) Extends 5G Edge and MEC Platform in Seattle, Denver"
2020-12-29,Gogo Announces Board Leadership Transition
2020-12-21,Gogo to Finish 2020 with Growth in ATG Subscriber Base Despite Pandemic
2020-12-18,Are Gogo Inc. (NASDAQ:GOGO) Investors Paying Above The Intrinsic Value?
2020-12-15,Gogo AVANCE L3 Reaches 500 Business Aircraft Installations
2020-12-12,Is GOGO Stock A Buy Now?
2020-12-10,Implied Volatility Surging for Gogo (GOGO) Stock Options
2020-12-04,"Zacks Industry Outlook Highlights: United States Cellular, Gogo and Cambium Networks"
2020-12-03,Here's Why Gogo (GOGO) is a Great Momentum Stock to Buy
2020-12-03,3 Wireless Stocks Set to Transcend Coronavirus Adversities
2020-12-02,Gogo Unveils Upgraded Inflight Entertainment Service Gogo Vision 360
2020-12-01,Why Shares of Gogo Are Higher Today
2020-12-01,Shark Bites: Gogo Looks Ready to Fly
2020-12-01,Gogo Completes Sale of Commercial Aviation Business to Intelsat
2020-12-01,"Intelsat Completes Acquisition of Gogo Commercial Aviation, Announces Leadership Appointments"
2020-11-12,The Gogo (NASDAQ:GOGO) Share Price Is Up 53% And Shareholders Are Holding On
2020-11-09,Gogo Inc (GOGO) Q3 2020 Earnings Call Transcript
2020-11-09,"Gogo (GOGO) Reports Q3 Loss, Misses Revenue Estimates"
2020-11-09,Gogo: Q3 Earnings Insights
2020-11-09,Gogo Announces Third Quarter 2020 Financial Results
2020-11-02,Analysts Estimate Gogo (GOGO) to Report a Decline in Earnings: What to Look Out for
2020-10-27,"Gogo Inc. to Report Third Quarter 2020 Financial Results on Nov. 9, 2020"
2020-10-21,Gogo Intermediate Holdings LLC -- Moody's announces completion of a periodic review of ratings of Gogo Inc.
2020-10-16,Gogo Intermediate Holdings LLC -- Moody's changes Gogo's outlook to positive on announcement of planned CA business sale
2020-10-15,Gogo AVANCE L3 Becomes Factory Option for Beechcraft King Air 360
2020-10-14,Gogo Inc (GOGO): Hedge Funds Are Taking Some Chips Off The Table
2020-10-05,Implied Volatility Surging for Gogo (GOGO) Stock Options
2020-09-23,Gogo Adopts Shareholder Rights Plan to Protect Valuable Tax Assets
2020-09-18,Gogo Comments on U.S. Patent and Trademark Office Decision
2020-09-16,Gogo AVANCE L3 Factory Option for Pilatus PC-24 Super Versatile Jet
2020-09-10,Gogo and GTCR Comment on Investment by GTCR
2020-09-02,Why Gogo Stock Kept Soaring Today
2020-09-02,Roth Lifts Gogos PT After Commercial Aviation Unit Sale
2020-09-01,Bankrupt J.C. Penney Cant Find a Buyer. Why Bankrupt Intelsat Is Buying a Company.
2020-09-01,"4 Top Stock Trades for Wednesday: ZM, GOGO, CHWY, WMT"
2020-09-01,Gogo Selling Commercial Aviation Division to Intelsat
2020-09-01,Why Gogo Stock Just Popped 28%
2020-09-01,Gogo Stock Up After Accord to Sell Commercial Unit to Intelsat
2020-09-01,Why Gogo's Stock Is Trading Higher Today
2020-09-01,Return On Capital Employed Overview: Gogo
2020-09-01,Intelsat Boosts In-Flight Connectivity With Gogo Unit Buyout
2020-09-01,Are Options Traders Betting on a Big Move in Gogo (GOGO) Stock?
2020-09-01,Gogo shares soar 31% premarket on news to sell commercial aviation business to Intelsat for $400 million
2020-09-01,Gogo Pops 21% On $400M Intelsat Deal For Commercial Aviation Biz
2020-08-31,Gogo Announces Entry into Agreement to Sell its Commercial Aviation Business to Intelsat for $400 Million in Cash
2020-08-31,Intelsat to Acquire Commercial Aviation Business of Gogo
2020-08-26,Why Gogo Stock Flew Higher
2020-08-25,"Gogo AVANCE L5 Achieves Milestone Flying on 1,000 Business Jets; AVANCE L3 Nears 450 Installations"
2020-08-10,Gogo Inc (GOGO) Q2 2020 Earnings Call Transcript
2020-08-10,Did Hedge Funds Make The Right Call On Gogo Inc (GOGO) ?
2020-08-10,"Gogo (GOGO) Reports Q2 Loss, Tops Revenue Estimates"
2020-08-10,Recap: Gogo Q2 Earnings
2020-08-10,Gogo Announces Second Quarter 2020 Financial Results
2020-08-04,"Gogo Inc. to Report Second Quarter 2020 Financial Results on August 10, 2020"
2020-07-30,Gogo Announces Further Personnel Actions in Response to COVID-19 Impact on Commercial Air Travel
2020-07-07,Implied Volatility Surging for Gogo (GOGO) Stock Options
2020-07-07,"Gogo Now Providing Inflight Connectivity Beginning At 3,000 Feet"
2020-06-30,Why Gogo Flew 14% Higher on Tuesday
2020-06-29,"Gogo Business Aviation Showing Strong Recovery, Hits 3,000 Daily Flights"
2020-06-23,Hedge Funds Are Disconnecting From Gogo Inc (GOGO)
2020-06-21,Edited Transcript of GOGO.OQ earnings conference call or presentation 11-May-20 12:30pm GMT
2020-06-11,Why Gogo Stock Fell 23% Today
2020-06-11,Delta Trims Gogo Wi-Fi Pact to Open Way for New Suppliers
2020-06-10,Gogo Inc. to Participate in William Blair Growth Stock Conference on June 11
2020-06-04,Do Options Traders Know Something About Gogo (GOGO) Stock We Don't?
2020-05-26,"Gogo Inc. to Participate in the Cowen 2020 Virtual TMT Conference on May 26, 2020"
2020-05-16,Gogo Inc. (NASDAQ:GOGO) Analysts Are Way More Bearish Than They Used To Be
2020-05-11,Gogo Inc (GOGO) Q1 2020 Earnings Call Transcript
2020-05-11,"Gogo (GOGO) Reports Q1 Loss, Tops Revenue Estimates"
2020-05-11,Recap: Gogo Q1 Earnings
2020-05-08,Why Earnings Season Could Be Great for Gogo (GOGO)
2020-05-02,Did Gogo Inc. (NASDAQ:GOGO) Insiders Buy Up More Shares?
2020-05-01,"Gogo Inc. to Report First Quarter 2020 Financial Results on May 11, 2020"
2020-04-21,"Gogo to furlough 600 workers, cut salaries, seek CARES loan"
2020-04-21,"Gogo to furlough more than 600 employees, applies for CARES Act grant and loan"
2020-04-21,Gogo Announces Personnel Actions in Response to COVID-19-Related Decline in Airline Traffic
2020-04-16,Are Options Traders Betting on a Big Move in Gogo (GOGO) Stock?
2020-04-07,Edited Transcript of GOGO earnings conference call or presentation 13-Mar-20 12:30pm GMT
2020-04-01,Gogo Files Petition to Challenge Validity of SmartSky Patent
2020-03-14,"Coronavirus update: 147,838 cases,  5,539 deaths, the reality of COVID-19 hits home for Americans"
2020-03-13,Recap: Gogo Q4 Earnings
2020-03-13,"Gogo (GOGO) Reports Q4 Loss, Tops Revenue Estimates"
2020-03-13,Gogo Announces Fourth Quarter and Full-Year 2019 Financial Results
2020-03-12,Are Options Traders Betting on a Big Move in GOGO Stock?
2020-03-06,Will Gogo (GOGO) Report Negative Earnings Next Week? What You Should Know
2020-01-28,Gogo to Bring App-Free Digital Rights Management for Inflight Entertainment in partnership with castLabs
2020-01-16,Gogo and Hispasat Sign Capacity Deal to Meet Rising Inflight Connectivity Demand
2020-01-13,AT&T-Owned CNN to Resolve TVS Dispute With $76M Settlement
2020-01-10,Delta Has Tons of High-Tech Optimism. These Stocks Could Benefit.
2020-01-03,Does Gogo Inc. (NASDAQ:GOGO) Have A Volatile Share Price?
2019-12-30,"4 Top Stock Trades for Tuesday: AAPL, NIO, TSLA, GOGO"
2019-12-19,Implied Volatility Surging for Gogo (GOGO) Stock Options
2019-12-19,"AT&T, Deloitte Partner to Boost Edge Computing & 5G Solutions"
2019-12-16,"AT&T (T) Hikes Dividend, Issues Capital Allocation Update"
2019-12-12,AT&amp;T Boosts 5G and Public Safety in Missouri and Kansas
2019-12-10,Is Gogo Inc (GOGO) Going To Burn These Hedge Funds ?
2019-12-10,3 Cheap Tech Stocks Trading Under $10 to Buy for 2020
