2020-12-04,Where Do Hedge Funds Stand On The New Home Company Inc (NWHM)?
2020-11-19,The New Home Company Announces New Stock Repurchase Program
2020-11-02,The New Home Company Reports 2020 Third Quarter Results
2020-10-20,If You Had Bought New Home's (NYSE:NWHM) Shares Five Years Ago You Would Be Down 61%
2020-10-14,The New Home Company Inc. Announces Pricing of Offering of 7.25% Senior Notes Due 2025
2020-10-13,"New Home Company, Inc., The -- Moody's rates New Home's new notes B3"
2020-10-13,The New Home Company Inc. Announces Proposed Private Offering of Senior Notes Due 2025
2020-10-13,The New Home Company Reports Selected 2020 Third Quarter Preliminary Results
2020-10-12,The New Home Company Schedules Third Quarter 2020 Earnings Release and Conference Call
2020-09-28,"New Home Company, Inc., The -- Moody's announces completion of a periodic review of ratings of The New Home Company, Inc."
2020-09-25,"The New Home Company Wins ""Master-Planned Community of the Year"" and ""Attached Community of the Year"" at Prestigious Northern California Homebuilding Awards Show"
2020-09-21,The New Home Company Provides Business Update Ahead of Investor Meetings
2020-08-27,The New Home Company Names Matt Gibson as Corporate Vice President of Land Acquisition
2020-08-20,Should We Be Excited About The Trends Of Returns At New Home (NYSE:NWHM)?
2020-08-18,The New Home Company Enjoys Early Sales Success at Mosaic at Layton Lakes in Gilbert as Companys Arizona Expansion Continues
2020-08-14,The New Home Company Partners with Zillow Offers to Simplify Process for Buyers with Homes to Sell
2020-08-11,The New Home Company Celebrates Grand Debut of Russell Ranch as Community Rises in Hills Above Folsom
2020-07-30,The New Home Company Reports 2020 Second Quarter Results
2020-07-23,The New Home Company Returns to Irvine with Spacious Residences at Great Parks Rise Neighborhood
2020-06-30,The New Home Company Schedules Second Quarter 2020 Earnings Release and Conference Call
2020-06-22,Hedge Funds Are Warming Up To The New Home Company Inc (NWHM)
2020-06-04,Edited Transcript of NWHM earnings conference call or presentation 8-May-20 2:00pm GMT
2020-05-11,The New Home Company Reports Grand Opening Sellout at Sterling at Esencia in Rancho Mission Viejo
2020-05-08,The New Home Company Inc. Adopts Tax Benefit Preservation Plan for Net Operating Losses
2020-05-08,The New Home Company Reports 2020 first Quarter Results
2020-04-20,The New Home Company Schedules First Quarter 2020 Earnings Release and Conference Call
2020-03-13,Building Industry Spotlight: Changing demographics create diverse housing mix
2020-03-12,The New Home Company Set to Unveil Sterling at Esencia in Rancho Mission Viejo
2020-03-10,"New Home Company, Inc., The -- Moody's affirms New Home's CFR at B3, outlook stable"
2020-03-10,The New Home Company Provides Best Purchase and Ownership Experiences in the Country According to National Customer Satisfaction Eliant Awards
2020-03-04,Edited Transcript of NWHM earnings conference call or presentation 13-Feb-20 10:00pm GMT
2020-02-13,The New Home Company Reports 2019 Fourth Quarter and Full Year Results
2020-02-03,"The New Home Company Set to Open Nova, a Community of Attainably Priced Townhomes and Flats in Rancho Cucamonga"
2020-01-21,The New Home Company Unveils EVO Home Tech Program Powered by Partnerships with Brilliant and Savant
2020-01-15,The New Home Company Schedules Fourth Quarter 2019 Earnings Release and Conference Call
2020-01-06,How Much Are The New Home Company Inc. (NYSE:NWHM) Insiders Spending On Buying Shares?
2019-12-16,Hedge Funds Have Never Been More Bullish On The New Home Company Inc. (NWHM)
2019-12-02,The New Home Company Named Builder of the Year by Professional Builder
2019-11-15,Edited Transcript of NWHM earnings conference call or presentation 31-Oct-19 4:00pm GMT
2019-11-11,"The New Home Company Announces Major Milestones at Russell Ranch in Folsom, California"
2019-11-08,Real estate developers planning multiple housing projects in Folsom
2019-11-04,"New Home Company, Inc., The -- Moody's announces completion of a periodic review of ratings of New Home Company, Inc., The"
2019-10-31,The New Home Company Reports 2019 Third Quarter Results
2019-10-29,The New Home (NYSE:NWHM) Share Price Is Down 64% So Some Shareholders Are Wishing They Sold
2019-10-04,The New Home Company Announces Richmond American Homes as Latest Guest Builder at Bedford in South Corona as Sales Remain Brisk
2019-10-01,Sky Ranch by The New Home Company Earns Top Design Honors at 2019 SoCal Awards
2019-09-30,The New Home Company Schedules Third Quarter 2019 Earnings Release and Conference Call
2019-09-17,The New Home Company Introduces Sterling at Esencia in Rancho Mission Viejo
2019-09-12,The New Home Company Adds Two Neighborhoods to Brighton Landing in Vacaville
2019-08-26,The New Home Company Celebrates 10th Anniversary of Building Better Lives
2019-08-20,"The New Home Company Names Miek Harbur Senior Vice President, General Counsel"
2019-08-02,Edited Transcript of NWHM earnings conference call or presentation 30-Jul-19 3:00pm GMT
2019-07-30,The New Home Company Reports 2019 Second Quarter Results
2019-07-30,Larry Webb to Become Executive Chairman of The New Home Company; Leonard Miller Elected Chief Executive Officer
2019-07-11,Our Take On The New Home Company Inc.'s (NYSE:NWHM) CEO Salary
2019-07-01,The New Home Company Schedules Second Quarter 2019 Earnings Release and Conference Call
2019-06-24,The New Home Companys Commitment to Attainable Homeownership in the Inland Empire Expands to Nova Rancho Cucamonga
2019-06-11,California homebuilder eyes metro Phoenix with $325M investment
2019-06-05,Promontory at Civita by The New Home Company is the Nations Best Multi-Family Housing Community
2019-05-29,The New Home Company is the Nations First Homebuilder to Offer Savant® Breaker-Companion Modules as Ultimate Energy Management and Lighting Control Solution
2019-05-28,The New Home Company Continues Arizona Expansion with Construction Underway on Mosaic at Layton Lakes in Gilbert
2019-05-09,Edited Transcript of NWHM earnings conference call or presentation 3-May-19 3:00pm GMT
2019-05-03,The New Home Company Reports 2019 First Quarter Results
2019-04-25,Did You Manage To Avoid New Home's (NYSE:NWHM) Painful 63% Share Price Drop?
2019-04-12,Hundreds Attend 5th Annual Womens Leadership ConferencePresented by BIA/Orange County Chapter and The New Home CompanyFor Crucial Discussion on Diversity in the Workplace
2019-04-04,New Neighborhood Announced Within the Gated Village of Bedford in South Corona
2019-04-02,The New Home Company Schedules First Quarter 2019 Earnings Release and Conference Call
2019-03-18,The New Home Company is the Countrys Most Honored Builder at National Customer Satisfaction Eliant Awards
2019-03-13,Final Collection of Urban Residences Debuts at McKinley Village in East Sacramento
2019-03-11,"Seabluff at Playa Vista, The New Home Companys First Community in the Heart of Silicon Beach, Celebrates Grand Opening of Furnished Model and Sales Gallery"
2019-03-11,Does The The New Home Company Inc. (NYSE:NWHM) Share Price Fall With The Market?
2019-02-21,The New Home Company Wins Multifamily Community of the Year Award and Best Website at Building Industrys Premier Awards Show
2019-02-18,Edited Transcript of NWHM earnings conference call or presentation 15-Feb-19 4:00pm GMT
2019-02-15,New Home: 4Q Earnings Snapshot
2019-02-15,The New Home Company Reports 2018 Fourth Quarter and Full Year Results
2019-01-29,Leonard Miller Elected President of The New Home Company
2019-01-24,"The New Home Company Opens Two Furnished Models at ICON Silverleaf, a Collection of Luxurious Single-Story, Elevator-Served Residences at a Prestigious Golf and Residential Community in Scottsdale"
2019-01-16,Why Were Not Impressed By The New Home Company Inc.s (NYSE:NWHM) 3.9% ROCE
2019-01-15,The New Home Company Schedules Fourth Quarter and Full Year 2018 Earnings Release and Conference Call
2019-01-11,The New Home Company Announces Grand Opening of its First Two Neighborhoods at Brighton Landing in Vacaville
2018-12-19,The New Home Company Names Christopher Cady as President of Arizona Division
2018-12-04,Is The New Home Company Inc (NYSE:NWHM) A Financially Sound Company?
2018-11-30,"Toll Brothers, New Home Co. buy lots in Rocklin"
2018-11-20,"New Research: Key Drivers of Growth for New Home, Moelis, Global Ship Lease, Azure Power Global, GP Strategies, and Charah Solutions  Factors of Influence, Major Initiatives and Sustained Production"
2018-11-06,Folsom Ranch gets first designated retail proposal
2018-11-01,"The New Home Company Opens Unique Collection of Single-Story, Elevator-Served Residences at The Cannery in Davis, California"
2018-10-30,Edited Transcript of NWHM earnings conference call or presentation 25-Oct-18 4:00pm GMT
2018-10-25,New Home: 3Q Earnings Snapshot
2018-10-25,Is Now An Opportune Moment To Examine The New Home Company Inc (NYSE:NWHM)?
2018-10-25,The New Home Company Reports 2018 Third Quarter Results
2018-10-15,The New Home Company Reschedules Third Quarter 2018 Earnings Release and Conference Call
2018-10-12,Is The New Home Company Inc (NYSE:NWHM) An Industry Laggard Or Leader?
2018-10-08,"The New Home Company Offers Alternative to Bay Area Living with Single-Family, Attainably Priced Residences at Brighton Landing in Vacaville"
2018-10-03,The New Home Company Schedules Third Quarter 2018 Earnings Release and Conference Call
2018-09-20,The New Home Company Wins Community of the Year in Northern and Southern California at Prestigious Homebuilding Awards Shows
2018-09-17,Bedford Has Arrived; Highly Anticipated Master-Planned Community in South Corona Opens September 22
2018-09-12,Should You Be Holding The New Home Company Inc (NYSE:NWHM) Right Now?
2018-08-21,California homebuilder building homes adjacent to Mormon Temple in Gilbert
2018-08-17,Where The New Home Company Incs (NYSE:NWHM) Earnings Growth Stands Against Its Industry
2018-08-16,Edited Transcript of NWHM earnings conference call or presentation 3-Aug-18 3:00pm GMT
