2021-01-11,"Shuman, Glenn & Stecker Investigates JELD-WEN Holding, Inc."
2021-01-05,11 Easiest Countries to Adopt a Baby
2020-12-30,Jeld-Wen Scores Relative Strength Rating Upgrade; Hits Key Threshold
2020-12-21,"SHAREHOLDER ALERT: JELD-WEN Holding, Inc. (NYSE: JELD) Officers and Directors Under Investigation for Possible Breaches of Fiduciary Duty"
2020-12-21,"How Much Is JELD-WEN Holding, Inc. (NYSE:JELD) CEO Getting Paid?"
2020-12-16,Jeld-Wen Holding Earns Relative Strength Rating Upgrade; Hits Key Benchmark
2020-12-15,"NOTICE For Investors In NYSE: JELD Shareholder Notice: Update in Lawsuit against JELD-WEN Holding, Inc. announced by Shareholders Foundation"
2020-12-14,4 Low Price-to-Cash-Flow Stocks to Craft a Standout Portfolio
2020-12-11,5 Low Price-to-Book Value Stocks to Buy in December
2020-12-10,"ROSEN, A LEADING LAW FIRM, Continues its Investigation of Breaches of Fiduciary Duties by Management of JELD-WEN Holding, Inc.  JELD"
2020-12-02,15 Tallest Completed Buildings in the World
2020-11-30,"JELD-WEN ALERT: Bragar Eagel & Squire, P.C. Announces the Shareholder Class Action Against Jeld-Wen Holding, Inc. Survives Motion to Dismiss and Encourages Long-term Investors to Contact the Firm"
2020-11-27,4 Low Price-to-Cash Flow Stocks to Refine Your Portfolio
2020-11-25,10 Best Construction Materials Stocks To Buy Now
2020-11-20,"JELD-WEN INVESTIGATION INITIATED by Former Louisiana Attorney General: Kahn Swick & Foti, LLC Investigates the Officers and Directors of JELD-WEN Holding, Inc. - JELD"
2020-11-20,Top Ranked Growth Stocks to Buy for November 20th
2020-11-17,"ROSEN, A TOP RANKED LAW FIRM, Announces Investigation of Breaches of Fiduciary Duties by Management of JELD-WEN Holding, Inc. - JELD"
2020-11-11,"Shuman, Glenn & Stecker Investigates JELD-WEN Holding, Inc."
2020-11-10,"NYSE: JELD Investor Notice: Update in Lawsuit against JELD-WEN Holding, Inc. announced by Shareholders Foundation"
2020-11-09,"JELD-WEN Holding, Inc. to Participate in Upcoming Virtual Investor Conferences"
2020-11-09,"The Zacks Analyst Blog Highlights: JELD-WEN, Lennar Corp and Jabil"
2020-11-09,4 Low P/CF Stocks to Add Maximum Value to Your Investment
2020-11-06,"JELD-WEN INVESTIGATION INITIATED BY FORMER LOUISIANA ATTORNEY GENERAL:  Kahn Swick & Foti, LLC Investigates the Officers and Directors of JELD-WEN Holding, Inc. - JELD"
2020-11-04,"INVESTIGATION ALERT: The Schall Law Firm Announces it is Investigating Claims Against JELD-WEN Holding, Inc. and Encourages Investors with Losses in Excess of $100,000 to Contact the Firm"
2020-11-04,"EQUITY ALERT: Rosen Law Firm Announces Investigation of Breaches of Fiduciary Duties by Management of JELD-WEN Holding, Inc.  JELD"
2020-11-04,Top Ranked Growth Stocks to Buy for November 4th
2020-11-03,"JELD-WEN Holding, Inc. (JELD) Q3 2020 Earnings Call Transcript"
2020-11-03,"Pzena Investment Trims Stanley,  Black & Decker Position"
2020-11-03,"JELD-WEN Holding, Inc. to Host Earnings Call"
2020-11-03,JELD-WEN Delivers Third Quarter 2020 Revenue Growth and Margin Expansion Through Continued Disciplined Execution in a Challenging Environment
2020-11-02,Top Ranked Growth Stocks to Buy for November 2nd
2020-11-02,Why Earnings Season Could Be Great for JELD-WEN (JELD)
2020-11-01,Wells Fargo: 3 Stocks to Snap up Now
2020-10-31,"SHAREHOLDER ALERT: Kaskela Law LLC Announces Stockholder Investigation of JELD-WEN Holding, Inc. (JELD) and Encourages Long-Term JELD Stockholders to Contact the Firm"
2020-10-30,"JELD-WEN ALERT: Bragar Eagel & Squire, P.C. Announces the Shareholder Class Action Against Jeld-Wen Holding, Inc. Survives Motion to Dismiss and Encourages Long-term Investors to Contact the Firm"
2020-10-28,"The Zacks Industry Rank Highlights: BlueLinx, Boise Cascade and JELD-WEN"
2020-10-27,3 HOT Wood Building Product Picks to Grab Now
2020-10-21,Top Ranked Value Stocks to Buy for October 21st
2020-10-21,Top Ranked Growth Stocks to Buy for October 21st
2020-10-16,"JELD-WEN INVESTIGATION INITIATED by Former Louisiana Attorney General: Kahn Swick & Foti, LLC Investigates the Officers and Directors of JELD-WEN Holding, Inc. - JELD"
2020-10-16,"JELD-WEN, Inc. -- Moody's announces completion of a periodic review of ratings of JELD-WEN, Inc."
2020-10-15,Does JELD-WEN Holding's (NYSE:JELD) Share Price Gain of 45% Match Its Business Performance?
2020-10-05,JELD-WEN Announces Date of Earnings Release and Conference Call for Third Quarter 2020 Results
2020-10-05,Top Ranked Growth Stocks to Buy for October 5th
2020-10-01,Top Ranked Growth Stocks to Buy for October 1st
2020-09-18,Top Ranked Growth Stocks to Buy for September 18th
2020-09-16,Top Ranked Growth Stocks to Buy for September 16th
2020-09-15,Top Ranked Growth Stocks to Buy for September 15th
2020-09-11,Top Ranked Growth Stocks to Buy for September 11th
2020-09-10,"The Zacks Analyst Blog Highlights: DHI, JELD, BXC, LPX and DOOR"
2020-09-09,"Should JELD-WEN Holding, Inc. (NYSE:JELD) Focus On Improving This Fundamental Metric?"
2020-09-09,"JELD, OTRK, BR, G and CNDT as Zacks Bull and Bear of the Day"
2020-09-09,Bull Of The Day: Jeldwen Holding (JELD)
2020-08-21,Top Ranked Growth Stocks to Buy for August 21st
2020-08-18,"Platinum Equity Advisors, LLC Buys JELD-WEN Holding Inc"
2020-08-17,"JELD-WEN (JELD): Strong Industry, Solid Earnings Estimate Revisions"
2020-08-14,"The Zacks Analyst Blog Highlights: Celestica, Graphic Packaging, JELD-WEN, Lifetime Brands and Tecnoglass"
2020-08-14,Top Ranked Growth Stocks to Buy for August 14th
2020-08-12,Top Ranked Growth Stocks to Buy for August 12th
2020-08-12,"JELD-WEN's Shares March Higher, Can It Continue?"
2020-08-11,Top Ranked Growth Stocks to Buy for August 11th
2020-08-04,"JELD-WEN Holding, Inc. (JELD) Q2 2020 Earnings Call Transcript"
2020-08-04,JELD-WEN: Q2 Earnings Insights
2020-08-04,"Investors Still Waiting For A Pull Back In JELD-WEN Holding, Inc. (NYSE:JELD)"
2020-08-04,JELD-WEN Announces Second Quarter 2020 Margin Expansion From Strong Price Realization and Improved Operational Performance
2020-07-28,Is JELD-WEN Holding (NYSE:JELD) Likely To Turn Things Around?
2020-07-28,"Did Hedge Funds Make The Right Call On JELD-WEN Holding, Inc. (JELD) ?"
2020-07-22,"JELD-WEN Holding, Inc. to Participate in Upcoming Barclays and Jefferies Virtual Investor Conferences"
2020-07-20,"JELD-WEN Holding, Inc. (JELD) Shares March Higher, Can It Continue?"
2020-07-08,JELD-WEN Announces Date of Earnings Release and Conference Call for 2020 Second Quarter Results and Provides Business Update
2020-06-22,"Hedge Funds Are Dumping JELD-WEN Holding, Inc. (JELD)"
2020-06-09,"NOTICE For Investors In NYSE: JELD Shares: Lawsuit against JELD-WEN Holding, Inc. announced by Shareholders Foundation"
2020-05-11,"JELD-WEN Holding, Inc. to Participate in Upcoming Goldman Sachs and J.P. Morgan Virtual Investor Conferences"
2020-05-05,"JELD-WEN Holding, Inc. (JELD) Q1 2020 Earnings Call Transcript"
2020-05-05,"JELD-WEN Holding, Inc. (JELD) Q1 Earnings Beat, Revenues Lag Estimates (Revised)"
2020-05-05,JELD-WEN Holding: Q1 Earnings Insights
2020-05-05,"JELD-WEN Holding, Inc. (JELD) Q1 Earnings and Revenues Beat Estimates"
2020-05-05,JELD-WEN Announces First Quarter 2020 Results
2020-04-28,"Analysts Estimate JELD-WEN Holding, Inc. (JELD) to Report a Decline in Earnings: What to Look Out for"
2020-04-27,"JELD-WEN, Inc. -- Moody's changes outlook for JELD-WEN to negative; rates new notes Ba2"
2020-04-21,Local door maker's supply issue winds its way through federal court
2020-04-21,"Lawsuit for Investors in shares of JELD-WEN Holding, Inc. (NYSE: JELD) announced by Shareholders Foundation"
2020-04-20,SHAREHOLDER ALERT: HPQ JELD BDX: The Law Offices of Vincent Wong Reminds Investors of Important Class Action Deadlines
2020-04-20,"JELD FINAL DEADLINE -Bronstein, Gewirtz & Grossman, LLC Reminds JELD-WEN Holding, Inc. Investors With Losses Exceeding $100K of Class Action and Lead Plaintiff Deadline: April 20, 2020"
2020-04-20,"DEADLINE TODAY: The Schall Law Firm Announces the Filing of a Class Action Lawsuit Against JELD-WEN Holding, Inc. and Encourages Investors with Losses in Excess of $100,000 to Contact the Firm"
2020-04-19,"JELD-WEN 24 HOUR DEADLINE ALERT: Former Louisiana Attorney General and Kahn Swick & Foti, LLC Remind Investors with Losses in Excess of $100,000 of Deadline in Class Action Lawsuit Against JELD-WEN Holding, Inc. - JELD"
2020-04-19,"The Gross Law Firm Announces Class Actions on Behalf of Shareholders of JELD, TVTY and VMW"
2020-04-19,"MONDAY DEADLINE ALERT: The Schall Law Firm Announces the Filing of a Class Action Lawsuit Against JELD-WEN Holding, Inc. and Encourages Investors with Losses in Excess of $100,000 to Contact the Firm"
2020-04-19,"CLASS ACTION UPDATE for JELD, LBRT and EHTH: Levi & Korsinsky, LLP Reminds Investors of Class Actions on Behalf of Shareholders"
2020-04-18,"SHAREHOLDER ALERT: Pomerantz Law Firm Investigates Claims On Behalf of Investors of JELD-WEN Holding, Inc. - JELD"
2020-04-18,"JELD-WEN Shareholder Notice: Faruqi & Faruqi, LLP Encourages Investors Who Suffered Losses Exceeding $50,000 In JELD-WEN Holding, Inc. To Contact The Firm"
2020-04-17,"JELD-WEN 72 HOUR DEADLINE ALERT: Former Louisiana Attorney General and Kahn Swick & Foti, LLC Remind Investors With Losses in Excess of $100,000 of Deadline in Class Action Lawsuit Against JELD-WEN Holding, Inc. - JELD"
2020-04-17,"FINAL DEADLINE TUESDAY: The Schall Law Firm Announces the Filing of a Class Action Lawsuit Against JELD-WEN Holding, Inc. and Encourages Investors with Losses in Excess of $100,000 to Contact the Firm"
2020-04-17,"The Klein Law Firm Reminds Investors of Class Actions on Behalf of Shareholders of JELD, AAN and ANAB"
2020-04-17,"INVESTOR ALERT: April Deadline Approaching for Jen-Weld Holdings, Inc. (JELD) Class Action"
2020-04-17,"The Gross Law Firm Announces Class Actions on Behalf of Shareholders of JELD, ANAB and VMW"
2020-04-17,"MONDAY DEADLINE ALERT: The Schall Law Firm Announces it is Investigating Claims Against JELD-WEN Holding, Inc. and Encourages Investors with Losses to Contact the Firm"
2020-04-16,"The Klein Law Firm Reminds Investors of Class Actions on Behalf of Shareholders of JELD, INO and ANAB"
2020-04-16,"JELD-WEN Shareholder Alert: Faruqi & Faruqi, LLP Encourages Investors Who Suffered Losses Exceeding $50,000 In JELD-WEN Holding, Inc. To Contact The Firm"
2020-04-15,"SHAREHOLDER ALERT: CLAIMSFILER REMINDS HPQ, JELD, OXY INVESTORS of Lead Plaintiff Deadline in Class Action Lawsuits"
