2021-01-11,"CEVA, Inc. Schedules Fourth Quarter and Full Year 2020 Earnings Release and Conference Call"
2021-01-06,"CEVA, Inc. to Present at the 23rd Annual Needham Virtual Growth Conference"
2021-01-05,CEVA and DARPA Establish Partnership for Technology Innovation
2020-12-21,Retune DSP's Wake Word Engine Now Available for CEVA Audio/Voice DSPs
2020-12-13,The CEVA (NASDAQ:CEVA) Share Price Has Gained 64% And Shareholders Are Hoping For More
2020-12-11,Is CEVA A Good Stock To Buy Now?
2020-11-23,CEVA's Bluetooth® Low Energy 5.2 Platform is First IP to Receive Bluetooth SIG Qualification
2020-11-11,CEVA's High-Performance DSP Solution to Power Renesas' Next-Generation Automotive SoC
2020-11-09,"CEVA, Inc. to Present at Upcoming Virtual Investor Conferences"
2020-11-06,CEVA SenslinQ Platform Wins 2020 ASPENCORE World Electronics Achievement Award
2020-11-05,CEVA Inc (CEVA) Q3 2020 Earnings Call Transcript
2020-11-05,Ceva (CEVA) Tops Q3 Earnings and Revenue Estimates
2020-11-05,"CEVA, Inc. Announces Third Quarter 2020 Financial Results"
2020-11-04,"CEVA, Inc. Third Quarter 2020 Earnings Release and Conference Call Scheduled for November 5"
2020-10-30,What Can We Conclude About CEVA's (NASDAQ:CEVA) CEO Pay?
2020-10-29,Analysts Estimate Ceva (CEVA) to Report a Decline in Earnings: What to Look Out for
2020-10-08,"CEVA, Inc. Schedules Third Quarter 2020 Earnings Release and Conference Call"
2020-09-24,The Coming 5G Boom Is Not Fully Priced in These 2 Stocks
2020-09-24,Has CEVA (NASDAQ:CEVA) Got What It Takes To Become A Multi-Bagger?
2020-09-23,CEVA and VisiSonics Bring 3D Spatial Audio to True Wireless Earbuds and Headphones for the Ultimate Hearing Experience
2020-09-22,CEVA Enhances the User Experience and Extends the Use Cases for TWS Earbuds and Hearables with New MotionEngine Hear Sensor Fusion Software
2020-09-16,CEVA Partners with Fluent.ai to Offer Multilingual Speech Understanding Solutions for Intelligent Edge Devices
2020-08-19,"CEVA, Inc.'s (NASDAQ:CEVA) Stock Is Rallying But Financials Look Ambiguous: Will The Momentum Continue?"
2020-08-19,CEVA's Wi-Fi 6 Solution Becomes World's First IP to Achieve Wi-Fi CERTIFIED 6 Status from the Wi-Fi Alliance®
2020-08-12,CEVA NB-IoT IP Achieves Monumental Milestone; Awarded Full Certification from Deutsche Telekom
2020-08-10,CEVA Inc (CEVA) Q2 2020 Earnings Call Transcript
2020-08-10,Ceva (CEVA) Beats Q2 Earnings and Revenue Estimates
2020-08-10,CEVA: Q2 Earnings Insights
2020-08-10,"CEVA, Inc. Announces Second Quarter 2020 Financial Results"
2020-08-07,"REMINDER: CEVA, Inc. Second Quarter 2020 Earnings Release and Conference Call Scheduled for August 10"
2020-08-03,Ceva (CEVA) Reports Next Week: What You Should Expect
2020-07-28,Dolby MS12 Multistream Decoder Now Supported and Approved on CEVA's Audio DSP
2020-07-14,"What Kind Of Shareholders Hold The Majority In CEVA, Inc.'s (NASDAQ:CEVA) Shares?"
2020-07-09,"CEVA, Inc. Schedules Second Quarter 2020 Earnings Release and Conference Call"
2020-07-05,"Do Hedge Funds Love CEVA, Inc. (CEVA)?"
2020-06-16,"CEVA, Inc. to Present at Upcoming Virtual Investor Conferences"
2020-06-09,Why CEVA (CEVA) Stock Might be a Great Pick
2020-06-04,"CEVA's Shares March Higher, Can It Continue?"
2020-06-03,ASX vs. CEVA: Which Stock Should Value Investors Buy Now?
2020-05-26,Edited Transcript of CEVA earnings conference call or presentation 11-May-20 12:30pm GMT
2020-05-26,CEVA to Host Online Seminar Series for Wireless Connectivity and Smart Sensing Technologies
2020-05-11,CEVA Inc (CEVA) Q1 2020 Earnings Call Transcript
2020-05-11,Ceva (CEVA) Surpasses Q1 Earnings and Revenue Estimates
2020-05-11,CEVA: Q1 Earnings Insights
2020-05-11,"CEVA, Inc. Announces First Quarter 2020 Financial Results"
2020-05-08,"REMINDER: CEVA, Inc. First Quarter 2020 Earnings Release and Conference Call Scheduled for May 11"
2020-05-01,ASX vs. CEVA: Which Stock Should Value Investors Buy Now?
2020-04-25,"Calculating The Intrinsic Value Of CEVA, Inc. (NASDAQ:CEVA)"
2020-04-14,CEVA Wins 2019 CEM Editor's Choice Award for its Bluetooth 5 IP
2020-04-07,CEVA Announces Industry's First High Performance Sensor Hub DSP Architecture
2020-04-07,"CEVA, Inc. Schedules First Quarter 2020 Earnings Release and Conference Call"
2020-03-24,CEVA Announces DSP and Voice Neural Networks Integration with TensorFlow Lite for Microcontrollers
2020-03-20,"How Does CEVA, Inc. (NASDAQ:CEVA) Affect Your Portfolio Volatility?"
2020-03-17,Bragi and CEVA Collaborate to Redefine Hearable Devices
2020-03-10,Ambiq Micro's Next-Generation Subthreshold Power-Optimized Technology (SPOT) Platform Features CEVA's Bluetooth Low Energy IP
2020-03-04,CEVA Unveils World's Most Powerful DSP Architecture
2020-02-24,Edited Transcript of CEVA earnings conference call or presentation 18-Feb-20 1:30pm GMT
2020-02-24,"Goodix License and Deploy CEVA Bluetooth Low Energy IP in SoCs Targeting Wearables, Mobile Devices, the Internet of Things"
2020-02-19,CEVA NB-IoT IP Completes Release 14 GCF Certification with Rohde & Schwarz
2020-02-18,"CEVA, Inc. Announces Fourth Quarter and Year End 2019 Financial Results"
2020-02-18,"CEVA, Inc. to Host Earnings Call"
2020-02-14,"REMINDER: CEVA, Inc. Fourth Quarter and Full Year 2019 Earnings Release and Conference Call Scheduled for February 18"
2020-02-13,"Does CEVA, Inc.'s (NASDAQ:CEVA) CEO Pay Compare Well With Peers?"
2020-02-11,Analysts Estimate Ceva (CEVA) to Report a Decline in Earnings: What to Look Out for
2020-02-07,Insight (NSIT) Gears Up for Q2 Earnings: What's in Store?
2020-02-07,Diodes (DIOD) to Report Q4 Earnings: What's in the Offing?
2020-02-07,Cisco (CSCO) to Report Q2 Earnings: What's in the Offing?
2020-02-07,What's in Store for Applied Materials (AMAT) Q1 Earnings?
2020-02-07,"DXC Technology (DXC) Q3 Earnings Surpass Estimates, Down Y/Y"
2020-02-07,"VeriSign's (VRSN) Q4 Earnings Lag Estimates, Revenues Up Y/Y"
2020-02-07,"Teradata (TDC) Q4 Earnings Beat Estimates, Revenues Fall Y/Y"
2020-02-06,"Cognizant (CTSH) Q4 Earnings Beat, Revenues Increase Y/Y"
2020-02-06,"Twitter (TWTR) Q4 Earnings Miss, User Growth Aids Top Line"
2020-02-06,FireEye (FEYE) Q4 Earnings &amp; Revenues Surpass Estimates
2020-02-05,Model N (MODN) Q1 Earnings and Revenues Surpass Estimates
2020-02-04,Synaptics (SYNA) to Post Q2 Earnings: What's in the Cards?
2020-02-04,"Check Point (CHKP) Q4 Earnings Top, Revenues Meet Estimates"
2020-02-04,Take Two (TTWO) to Report Q3 Earnings: What's in the Cards?
2020-02-04,"Fabrinet (FN) Q2 Earnings Beat Estimates, Revenues Rise Y/Y"
2020-02-03,CDW to Report Q4 Earnings: Is a Beat in Store for the Stock?
2020-01-31,Paycom (PAYC) to Post Q4 Earnings: What's in the Cards?
2020-01-31,Cognizant (CTSH) to Report Q4 Earnings: What's in Store?
2020-01-30,"MSCI Q4 Earnings Beat, Recurring Subscription Revenues Rise"
2020-01-30,"Cree (CREE) Q2 Loss In Line With Estimates, Revenues Fall Y/Y"
2020-01-30,"Service Now's (NOW) Q4 Earnings Beat, Revenues Rise Y/Y"
2020-01-30,"CACI International (CACI) Q2 Earnings Top Estimates, View Up"
2020-01-29,"MKS Instruments' (MKSI) Q4 Earnings Beat, Revenues Rise Y/Y"
2020-01-28,"SAP SE (SAP) Q4 Earnings Beat Estimates, Revenues Rise Y/Y"
2020-01-28,Apple & Other Tech Stocks to Buy Ahead of Earnings
2020-01-27,Moving Average Crossover Alert: CEVA
2020-01-27,MSCI (MSCI) to Report Q4 Earnings: What's in the Cards?
2020-01-27,Cirrus Logic (CRUS) to Post Q3 Earnings: What's in the Cards?
2020-01-27,Qorvo (QRVO) Set to Report Q3 Earnings: What's in the Cards?
2020-01-24,"The Zacks Analyst Blog Highlights: AAPL, CEVA, FIVN, SIMO and MKSI"
2020-01-24,TE Connectivity (TEL) to Post Q1 Earnings: What's in Store?
2020-01-23,"Plexus (PLXS) Q1 Earnings Beat Estimates, Revenues Rise Y/Y"
2020-01-23,"Texas Instruments (TXN) Q4 Earnings Beat, Revenues Down Y/Y"
2020-01-23,5 Top Tech Stocks Are Up to Bat This Earnings Season
2020-01-20,Why Ceva (CEVA) Could Beat Earnings Estimates Again
2020-01-17,CEVA Restructuring Includes CEO Switch
