2021-01-11,CureVac Covid Vaccine Candidate Shows Progress in Animal Trial
2021-01-11,"CureVac's COVID-19 Vaccine Candidate, CVnCoV, Demonstrated Efficient Protection of Non-Human Primates During SARS-CoV-2 Challenge Infection"
2021-01-09,"mRNA Vaccines Could Vanquish Covid Today, Cancer Tomorrow"
2021-01-08,Biotech IPOs Cullinan and Gracell Surge on Trading Debuts
2021-01-08,"Germany secured 50 mln vaccine doses from CureVac, BioNTech on top of EU supplies - document"
2021-01-08,CureVac (CVAC) Up on Deal With Bayer for COVID-19 Vaccine
2021-01-07,Why Coronavirus Stock CureVac Crushed It on Thursday
2021-01-07,This Covid Vaccine Stock Just Rocketed On A Deal With Pharma Giant Bayer
2021-01-07,CureVac Secures Bayer as a Partner for Its Coronavirus Vaccine
2021-01-07,CureVac Forms Covid-19 Vaccine Alliance With Bayer. The Stock Is Surging.
2021-01-07,CureVac Shares Surge on Covid Vaccine Partnership With Bayer
2021-01-07,"The Daily Biotech Pulse: CureVac COVID-19 Vaccine Deal, Argenx Out-Licenses Neuromuscular Disorder Drug, Xencor's Oncology Collaboration"
2021-01-07,CureVac : CureVac and Bayer Join Forces on COVID-19 Vaccine Candidate CVnCoV
2021-01-06,CureVac strikes COVID-19 vaccine alliance deal with Bayer -Bild
2020-12-29,Germany says it needs third COVID vaccine to make inoculation universal
2020-12-21,CureVac Launches Specialized Phase 3 Clinical Trial of Coronavirus Vaccine Candidate
2020-12-21,"CureVac and the University Medical Center Mainz Start Phase 3 Clinical Trial for COVID-19 Vaccine Candidate, CVnCoV, in Healthcare Workers"
2020-12-18,Modernas Vaccine Is Close to Getting a Thumbs-Up. Its Stock Is Taking a Hit.
2020-12-18,4 Small COVID-19 Vaccine Makers to Look Out for in 2021
2020-12-14,Dow books worst day in two weeks as COVID lockdowns intensify amid U.S. vaccine rollout
2020-12-14,CureVac starts Phase 3 clinical trial of its COVID-19 vaccine candidate
2020-12-14,"CureVac : CureVac Commences Global Pivotal Phase 2b/3 Trial for COVID-19 Vaccine Candidate, CVnCoV"
2020-12-12,Is CVAC A Good Stock To Buy Now?
2020-12-04,CureVac Appoints Antony Blanc as Chief Business Officer and Chief Commercial Officer
2020-12-01,Bullish: Analysts Just Made A Huge Upgrade To Their CureVac N.V. (NASDAQ:CVAC) Forecasts
2020-11-30,CureVac Announces Financial Results and Business Updates for the Third Quarter and First Nine Months of 2020
2020-11-26,"CureVac to Report Third Quarter and First Nine Months 2020 Financial Results and Business Updates on November 30, 2020"
2020-11-24,EU strikes deal with Moderna to supply up to 160 million COVID vaccine shots
2020-11-20,Pfizer and partner BioNTech to seek emergency-use authorization for COVID-19 vaccine Friday
2020-11-17,German vaccine maker CureVac ramps up capacity to 300 million COVID-19 doses in 2021
2020-11-17,"CureVac Establishes European-Based Network to Ramp Up Manufacturing of its COVID-19 Vaccine Candidate, CVnCoV"
2020-11-16,Modernas Covid-19 Vaccine Appears to Work. What It Means for Its Stock  and Pfizers.
2020-11-16,"European Commission Announces That Tomorrow It Will Authorize the Agreement with CureVac for the Supply of up to 405 Million Doses of mRNA-Based COVID-19 Vaccine Candidate, CVnCoV"
2020-11-16,Covid Vaccine Could Be a Drug Industry Game Changer
2020-11-15,What Kind Of Shareholders Hold The Majority In CureVac N.V.'s (NASDAQ:CVAC) Shares?
2020-11-12,"CureVac's COVID-19 Vaccine Candidate, CVnCoV, Suitable for Standard Fridge Temperature Logistics"
2020-11-10,Pfizers Covid-19 Vaccine Just Might Work. What That Means for Moderna and Other Vaccine Stocks.
2020-11-10,CureVac's stock is up 8% as it shares additional Phase 1 data about its COVID-19 vaccine candidate
2020-11-10,"CureVac Publishes Detailed Interim Phase 1 Data of its COVID-19 Vaccine Candidate, CVnCoV"
2020-11-02,CureVac Posts Positive Early Data For Its Covid-19 Vaccine Candidate
2020-11-02,CureVacs COVID-19 vaccine shows immune response in Phase 1 trial
2020-11-02,"CureVac Reports Positive Interim Phase 1 Data for its COVID-19 Vaccine Candidate, CVnCoV"
2020-10-28,Drug Giant GSK Will Meet Pre-Pandemic Guidance. But Heres Why the Stock Fell.
2020-10-23,"CureVac Reports Positive Preclinical Data for its COVID-19 Vaccine Candidate, CVnCoV"
2020-09-30,"Covid Report: Regeneron, Moderna, CureVac Up As Possible Coronavirus Cures Advance"
2020-09-29,CureVac: CureVac Initiates Phase 2a Clinical Trial of COVID-19 Vaccine Candidate
2020-09-18,Germany Makes a $299 Million Bet on CureVac
2020-09-17,Coronavirus Stocks: Can mRNA From Covid Fight Be Used To Cure Cancer?
2020-09-04,CureVac Expected to Receive up to 252 million Euros from the German Federal Ministry of Research for Further COVID-19 Vaccine Development and Production Capacity Expansion
2020-09-03,Is CureVac a Buy on the Pullback? It Depends
2020-08-28,CureVac Stock Soars After Talks of Supplying Vaccines for the EU
2020-08-20,A Tidal Wave of Vaccine News Is Hitting the Market
2020-08-20,"Coronavirus Latest: Thursday, August 20"
2020-08-20,Stocks Hold Their Ground Despite Jobs News
2020-08-20,CureVac Stock Jumps on News of EU Talks to Supply Covid-19
2020-08-20,CureVac and EU in advanced talks for 225 million Covid-19 vaccine doses
2020-08-17,"Stocks on the Move: Curevac gains 249% on first day of trading, Nvidia stock rises on Susquehanna target boost"
2020-08-17,CureVac Stock Soared 249% on Its First Day of Trading. Heres What Its Doing for an Encore.
2020-08-16,New Zealand Delays Elections; U.S. Cases Slow: Virus Update
2020-08-16,"U.S. Cases Slow as Deaths Pass 1,000 for Fifth Day: Virus Update"
2020-08-14,Covid Vaccine Contender CureVac More Than Triples in Debut
2020-08-14,COVID-19 vaccine maker CureVac pops 200% in debut
2020-08-14,CureVac's stock debuts at nearly triple the IPO price
2020-08-14,"CureVac raises $213.3 million in IPO after pricing at $16 a share, high end of proposed range"
2020-08-14,Vaccine Contender CureVac Raises $213 Million in IPO
