2021-01-11,ReneSola Power Announces Closing of $40.0 Million Registered Direct Offering
2021-01-08,ReneSola (SOL) Jumps: Stock Rises 7%
2021-01-08,ReneSola Power Announces Sale of 12.3 MW of Projects in Hungary
2021-01-07,ReneSola Announces $40.0 Million Registered Direct Offering
2021-01-05,Why ReneSola Stock Just Spiked 19% Higher
2021-01-05,ReneSola Power and Eiffel Investment Group Announce MOU for Joint Venture to Fund Solar Development in Europe
2020-12-28,Why Renewable Energy Stocks Jumped and Dropped Today
2020-12-28,ReneSola (SOL) to Sell 15.4MW Worth Solar Parks in Romania
2020-12-23,Why ReneSola Stock Got Crushed Today
2020-12-23,ReneSola (SOL) Wins 38 MW Solar Projects at Poland's Auction
2020-12-23,ReneSola Power Announces $20.0 Million Registered Direct Offering
2020-12-23,ReneSola Power Announces Sale of 15.4 MW of Solar Assets in Romania
2020-12-21,ReneSola Power Announces Results of Annual General Meeting
2020-12-21,ReneSola Power Awarded 38MW of Solar Projects in Poland's Electricity Auction
2020-12-18,5 Solar Stocks That Have Gained More Than 200% in 2020
2020-12-17,Implied Volatility Surging for ReneSola (SOL) Stock Options
2020-12-14,Why ReneSola's Shares Jumped 38.1% on Monday
2020-12-08,ReneSola Power to Present at the 13th Annual LD Micro Main Event Conference
2020-12-08,"The Zacks Analyst Blog Highlights: SunPower, Ameresco, Azure Power Global and ReneSola"
2020-12-08,ReneSola (SOL) Sells 16-MW Solar Projects in Poland to Modus Asset
2020-12-08,What Does ReneSola's Debt Look Like?
2020-12-08,ReneSola Power China DG Projects Approved for Incentive Payments
2020-12-07,COVID-19 Accelerates Reduction of GHG Emissions in US: 4 Picks
2020-12-07,ReneSola Power Announces Sale of 16 MW Solar Projects in Poland
2020-12-03,Top Solar Stocks for Q1 2021
2020-12-03,ReneSola (SOL) Inks Solar-Plus-Storage PPA in Northern California
2020-12-02,Why ReneSola's Shares Plunged 36% on Wednesday
2020-12-02,"ReneSola (SOL) Beats on Q3 Earnings, Misses on Revenues"
2020-12-01,ReneSola Power Announces Third Quarter 2020 Financial Results
2020-12-01,ReneSola Power Inks Solar-Plus-Storage Power Purchase Agreement with Valley Clean Energy
2020-11-30,Where Do Hedge Funds Stand On ReneSola Ltd. (SOL)?
2020-11-30,ReneSola Ltd. (SOL) to Post Q3 Earnings: What's in Store?
2020-11-25,ReneSola Sells 4.3-MW Solar Project to Atmosclear Investments
2020-11-24,ReneSola Power Announces Closing of Sale of 4.3 MW Solar Projects in the UK
2020-11-19,ReneSola (SOL) Acquires Selected Assets of Nova Development
2020-11-19,ReneSola Power and Innova to Form Joint Venture to Develop Solar Projects in the UK
2020-11-18,ReneSola Power Closes Previously Announced Acquisition of Selected Assets of Nova Development
2020-11-16,Can You Imagine How Jubilant ReneSola's (NYSE:SOL) Shareholders Feel About Its 253% Share Price Gain?
2020-11-14,Top 5 Stock Gainers on Friday: Urovant Sciences Rises
2020-11-13,Why ReneSola Stock Soared 24% This Morning
2020-11-13,"ReneSola (SOL) Reports Q3 Preliminary Results, Stock Rallies"
2020-11-13,"ReneSola Power to Release Third Quarter 2020 Financial Results on December 1, 2020"
2020-11-12,ReneSola Power Announces Preliminary Third Quarter 2020 Result
2020-11-11,"ReneSola Power to Participate at the Benchmark Company Discovery Virtual One on One Investor Conference on November 18, 2020"
2020-11-06,ReneSola Announces Notice of Annual General Meeting
2020-10-26,ReneSola Power and Novergy to Form Joint Venture to Develop Solar Projects in the UK
2020-10-12,ReneSola Announces $5.0 Million Registered Direct Offering
2020-10-08,4 Stocks Poised to Gain on Expanding European Solar Market
2020-10-08,Implied Volatility Surging for ReneSola (SOL) Stock Options
2020-09-28,ReneSola Power and Vodasun to Form Joint Venture to Develop Solar Projects in Germany
2020-09-24,Should Value Investors Buy ReneSola (SOL) Stock?
2020-09-23,ReneSola Power Announces $5 Million Registered Direct Offering
2020-09-22,Here's What ReneSola Ltd's (NYSE:SOL) Shareholder Ownership Structure Looks Like
2020-09-22,"ReneSola's Shares March Higher, Can It Continue?"
2020-09-17,Why ReneSola's Stock Is Trading Higher Today
2020-09-17,"Benzinga's Top Upgrades, Downgrades For September 17, 2020"
2020-09-17,ReneSola Power to Present on the UBS Global Energy Transition Call Series
2020-09-16,"The Zacks Analyst Blog Highlights: Vestas Wind Systems, Azure Power, Bloom Energy, Equinor and ReneSola"
2020-09-10,"ReneSola Power to Participate at the H.C. Wainwright 22nd Annual Global Investment Conference on September 15, 2020"
2020-08-28,ReneSola's (SOL) Earnings & Revenues Beat Estimates in Q2
2020-08-27,ReneSola to Buy Solar Assets Worth $8M in the United States
2020-08-27,ReneSola (SOL) Looks Good: Stock Adds 5.7% in Session
2020-08-27,ReneSola Announces Second Quarter 2020 Financial Results
2020-08-25,ReneSola Power to Acquire Certain Assets in All-Stock Transaction
2020-08-24,ReneSola Power to Participate in the LD 500 Virtual Conference
2020-08-18,ReneSola Power Completes Development Transaction of 21 MWp Operational Community Solar Projects in Minnesota
2020-08-06,"ReneSola Power to Release Second Quarter 2020 Financial Results on August 27, 2020"
2020-08-06,LD Micro: Announces Preliminary List of Presenters for the LD-500.
2020-08-06,ReneSola Power Announces Preliminary Second Quarter 2020 Revenue; Exceeds Previously Announced Guidance
2020-07-24,ReneSola Power Secures US$12 Million Bridge Financing
2020-06-30,Havens Help Johannesburg Stocks Post Best Quarter Since 2001
2020-06-11,ReneSola Enters Consortium to Build 30MW Solar Plant in France
2020-06-10,ReneSola Power to Develop a 30-hectare Ground-mounted Solar Project in France
2020-06-08,ReneSola Sells 10.4-MW Solar Portfolio to Nautilus Solar
2020-06-05,Edited Transcript of SOL earnings conference call or presentation 29-May-20 12:30pm GMT
2020-06-03,ReneSola Power and Nautilus Solar Energy Announce the Sale of a 10.4 MW Minnesota Community Solar Portfolio
2020-06-03,Nautilus Solar Energy Acquires 10.4 MW Community Solar Portfolio In Minnesota From ReneSola Energy
2020-06-01,"ReneSola (SOL) Q1 Earnings Miss Estimates, Revenues Rise Y/Y"
2020-05-29,ReneSola Power Announces First Quarter 2020 Financial Results
2020-05-27,Is ReneSola Ltd. (SOL) A Good Stock To Buy Now?
2020-05-19,"ReneSola Power to Participate at Cowen 2020 Virtual Industrial Technology, Robotics & Sustainability Summit"
2020-05-18,"ReneSola Power to Release First Quarter 2020 Financial Results on May 29, 2020"
2020-04-29,"Gemini HDPE LLC -- Moody's downgrades Gemini HDPE's senior secured debt to Ba3, outlook negative"
2020-04-29,ReneSola Power Files 2019 Annual Report on Form 20-F
2020-04-22,ReneSola (SOL) Reduces Q1 Guidance Due to Coronavirus Impacts
2020-04-21,ReneSola Power Discusses Recent COVID-19 Impact
2020-04-08,Rapid Rebound in Johannesburg Stocks a Sign to Tread Carefully
2020-04-07,ReneSola Power Announces Closing of Sale of 15 MW Portfolio in Hungary to Obton
2020-04-02,ReneSola Power Announces Purchase of Shares by Its Chief Executive Officer
2020-04-02,Half of All Jobs in Africa Imperiled by Virus Fallout
2020-03-31,Bearish: Analysts Just Cut Their ReneSola Ltd (NYSE:SOL) Revenue and EPS estimates
2020-03-28,Edited Transcript of SOL earnings conference call or presentation 13-Mar-20 12:30pm GMT
2020-03-26,ReneSola (SOL) Divests 7MW Projects to Canada-Based Developer
2020-03-25,ReneSola Power Announces Sale of 6.8 MW of Projects in Canada
2020-03-16,"ReneSola's (SOL) Q4 Earnings Beat Estimates, Revenues Up Y/Y"
2020-03-13,ReneSola Power Announces Fourth Quarter and Full Year 2019 Financial Results
2020-03-12,Johannesburg Stocks Fall Most Since 1997 in Panic Sell-Off
2020-03-10,ReneSola Power Seeks Shovel-ready Projects in Poland
2020-03-06,SOL: Sasol Limited: Update on Sasol's Credit Rating
2020-03-05,"SOL: Sasol Limited: Grant of Conditional Share Awards to Directors and Prescribed Officers of Sasol, and Directors of Major Subsidiaries of Sasol"
