2021-01-05,"Probe Metals Intersects 7.3 g/t Au over 10.4 metres on the Monique Mining Lease, Val-dOr East Project"
2020-12-21,"Travelzoo Wins ""Best Travel Deals Finder"" for Ninth Consecutive Year at British Travel Awards"
2020-12-10,Probe Metals Advances Val-dOr East Project Development Studies with the Completion of Environmental Characterization Program
2020-12-07,Is TZOO A Good Stock To Buy Now?
2020-12-04,TripAdvisor Earns IBD Rating Upgrade As Summer Vacation Planning Begins
2020-12-02,Probe Metals Completes $10 Million Private Placement
2020-11-25,"The Zacks Analyst Blog Highlights: Brinker, Constellation Brands, Travelzoo, Kraft Heinz and ODP"
2020-11-17,What Kind Of Shareholders Hold The Majority In Travelzoo's (NASDAQ:TZOO) Shares?
2020-11-09,"U.S. treasury yields surge over Covid-19 vaccine progress, Biden victory"
2020-10-21,"Travelzoo (TZOO) Reports Q3 Loss, Tops Revenue Estimates"
2020-10-21,Travelzoo Reports Third Quarter 2020 Results
2020-10-14,Travelzoo (TZOO) Expected to Beat Earnings Estimates: Can the Stock Move Higher?
2020-10-02,Travelzoo Q3 2020 Earnings Conference Call on October 21 at 11:00 AM ET
2020-10-01,"Travelzoo® Wins ""Germany's Best Deal"" Award"
2020-09-25,The UK's Most Experienced Travelers Rely on Travelzoo®
2020-08-12,Exactly What Logic Are You Applying to This Market?
2020-08-11,Travelzoo Awarded Highest Ranking for Consumer Satisfaction in Germany for the Second Year in a Row
2020-07-30,Travelzoo Reports Second Quarter 2020 Results
2020-07-29,Travelzoo Q2 2020 Earnings Conference Call on July 30 at 11:00 AM ET
2020-07-07,Edited Transcript of TZOO earnings conference call or presentation 25-Jun-20 3:00pm GMT
2020-07-05,Were Hedge Funds Right About Piling Into Travelzoo (TZOO)?
2020-06-30,One Travelzoo (NASDAQ:TZOO) Analyst Just Slashed Their 2020 Revenue Estimates
2020-06-25,Travelzoo Reports First Quarter 2020 Results
2020-06-25,"Earnings Scheduled For June 25, 2020"
2020-06-23,Travelzoo Q1 2020 Earnings Conference Call on June 25 at 11:00 AM ET
2020-06-17,Is Travelzoo's (NASDAQ:TZOO) Recent Stock Performance Influenced By Its Fundamentals In Any Way?
2020-06-08,Price Over Earnings Overview: Travelzoo
2020-05-14,Travelzoo® Members Embrace Flexible Deals Amid Lockdowns: Purchases Increase by 165% Year-over-Year in May
2020-05-12,Travelzoo® to Hold Virtual Annual Meeting of Stockholders
2020-03-25,Edited Transcript of TZOO earnings conference call or presentation 2-Mar-20 4:00pm GMT
2020-03-24,Travelzoo to Exit Asia-Pacific as Coronavirus Proves Too Much
2020-03-11,Travelzoo U.S. Survey Reveals Flexible Travelers Find Opportunity in Current Crisis Climate
2020-03-10,Travelzoo Exits Loss-Making Asia Pacific Business / Focuses on Highly Profitable Business in North America and Europe
2020-03-02,Travelzoo Reports Fourth Quarter 2019 Results and Discusses Impact of Acquisition of Jacks Flight Club on 2020 Results
2020-02-26,Travelzoo Teams Up with Sony Pictures Home Entertainment on CHARLIE'S ANGELS Release
2020-02-25,Travelzoo Wins Two Silvers at the 2020 Canadian Online Publishing Awards
2020-02-24,"UPDATE: Travelzoo Q4 2019 Earnings Conference Call on Monday, March 2 at 11:00 AM ET"
2020-02-20,"UPDATE: Travelzoo Q4 2019 Earnings Conference Call on Tuesday, February 25 at 11:00 AM ET"
2020-02-14,"Travelzoo Q4 2019 Earnings Conference Call on Friday, February 21 at 11:00 AM ET"
2020-02-12,Travelzoo (NASDAQ:TZOO) Earns Among The Best Returns In Its Industry
2020-01-23,Travelzoo Selected as Travel Deals Provider for NEC's New Tablet Products in Japan
2020-01-17,One Thing To Remember About The Travelzoo (NASDAQ:TZOO) Share Price
2020-01-13,Travelzoo Awarded Highest Ranking for Consumer Satisfaction in Germany
2020-01-08,Justin Soffer Joins FoundersCard as Chief Marketing Officer
2019-12-20,Travelzoo (NASDAQ:TZOO) Delivered A Better ROE Than Its Industry
2019-12-16,Is Travelzoo Inc. (TZOO) A Good Stock To Buy?
2019-12-03,"Travelzoo Wins ""Best Travel Deal Provider"" in Germany for Third Year in a Row"
2019-11-28,"Travelzoo Wins ""Best Online Deals Provider"" for 8th Consecutive Year at British Travel Awards"
2019-11-26,Do You Know What Travelzoo's (NASDAQ:TZOO) P/E Ratio Means?
2019-11-19,Travelzoo Survey Shows Culinary Culture Feeds Today's Destination Inspiration
2019-11-12,"Travelzoo Appoints Julian Rembrandt as General Manager, South East Asia"
2019-11-07,"Travelzoo Provides Update on Project ""Asia Pacific 2020"""
2019-10-31,Are Insiders Selling Travelzoo (NASDAQ:TZOO) Stock?
2019-10-24,Edited Transcript of TZOO earnings conference call or presentation 23-Oct-19 3:00pm GMT
2019-10-23,Travelzoo Places Bet on Social Media Marketing in China
2019-10-23,Travelzoo Reports Third Quarter 2019 Results
2019-10-09,What Does Travelzoo's (NASDAQ:TZOO) Share Price Indicate?
2019-10-09,"Travelzoo Q3 2019 Earnings Conference Call Wednesday, October 23 at 11:00 AM ET"
2019-09-30,Travelzoo Clarifies the Importance of Sustainable Tourism at PHIST Forum 2019
2019-09-17,A Look At The Intrinsic Value Of Travelzoo (NASDAQ:TZOO)
2019-09-10,Travelzoo and Deutsche Bahn Incentivize Sustainable Travel by Offering Irresistible Deals to Consumers in Germany
2019-08-28,Travelzoo Partners with UnionPay International to Make Purchasing Smooth for Members in China
2019-08-27,Is Travelzoos (NASDAQ:TZOO) 43% ROCE Any Good?
2019-08-09,Is Travelzoo (NASDAQ:TZOO) Potentially Underrated?
2019-07-31,Consumers Vote Travelzoo One of Germany's Fairest Companies
2019-07-26,Edited Transcript of TZOO earnings conference call or presentation 24-Jul-19 3:00pm GMT
2019-07-24,Travelzoo Inc (TZOO) Q2 2019 Earnings Call Transcript
2019-07-24,What You Must Know About Travelzoo's (NASDAQ:TZOO) Beta Value
2019-07-24,Travelzoo Reports Second Quarter 2019 Results
2019-07-18,"Travelzoo Q2 2019 Earnings Conference Call Wednesday, July 24 at 11:00 AM ET"
2019-07-04,Could Travelzoo's (NASDAQ:TZOO) Investor Composition Influence The Stock Price?
2019-06-28,Travelzoo Celebrates Pride Month by Campaigning for Equal Rights for All Travelers
2019-06-27,Travelzoo Partners with Lean In Canada to Advance Diversity and Inclusion in the Workplace
2019-06-07,Should You Worry About Travelzoo's (NASDAQ:TZOO) CEO Pay?
2019-05-31,Travelzoo Study Confirms Holiday Travel Boosts Mental Health
2019-05-29,Top 10 summer destinations where your dollar will go the farthest
2019-05-08,Can Travelzoo (NASDAQ:TZOO) Maintain Its Strong Returns?
2019-05-07,Travelzoo Announces Share Repurchase Program
2019-04-27,Edited Transcript of TZOO earnings conference call or presentation 25-Apr-19 3:00pm GMT
2019-04-25,Travelzoo Inc (TZOO) Q1 2019 Earnings Call Transcript
2019-04-25,39 million Americans cant afford a summer vacation
2019-04-25,Travelzoo: 1Q Earnings Snapshot
2019-04-25,Travelzoo Reports First Quarter 2019 Results
2019-04-18,"Travelzoo Q1 2019 Earnings Conference Call Thursday, April 25 at 11:00 AM ET"
2019-04-17,Travelzoo Reveals the Key to Happiness: Travel More Spontaneously
2019-04-15,"At US$14.23, Is Travelzoo (NASDAQ:TZOO) Worth Looking At Closely?"
2019-03-28,More Vacation Options Published by Travelzoo Boost Incremental Trips to Help Address Overcrowding
2019-03-27,Should You Be Worried About Insider Transactions At Travelzoo (NASDAQ:TZOO)?
2019-03-18,"Travelzoo Appoints Scott Wang as Head of Strategy, Asia Pacific, and General Manager, Greater China"
2019-03-08,Only U.S. Listed Company with an 80% Female Board Shows a 54% Increase in Average Share Price
2019-03-07,Can You Imagine How Travelzoos Shareholders Feel About The 97% Share Price Increase?
2019-03-06,"Travelzoo's Global Head of Brand, Sharry Sun, to Present Consumer Survey on ""Overcrowding"" at ITB Berlin"
2019-02-27,Travelzoo Celebrates the Successful Debut of its Global Sustainability Campaign
2019-02-18,Travelzoo (NASDAQ:TZOO) Is Employing Capital Very Effectively
2019-02-07,Edited Transcript of TZOO earnings conference call or presentation 6-Feb-19 4:00pm GMT
2019-02-06,Why Does Travelzoo Have a Big China Problem?
2019-02-06,Travelzoo: 4Q Earnings Snapshot
2019-02-06,Travelzoo Reports Fourth Quarter 2018 Results
2019-02-05,A Preview Of Travelzoo's Q4 Earnings
2019-02-01,"Travelzoo Q4 2018 Earnings Conference Call Wednesday, February 6, 2019 at 11:00 AM ET"
