2020-12-30,"Zacks.com featured highlights include: Sprouts Farmers Market, MarineMax, Boise Cascade, D.R. Horton and Cooper Tire & Rubber Co"
2020-12-29,Buy These 5 Low Leverage Stocks to Shield Your Portfolio
2020-12-28,"Zacks Value Trader Highlights: OneWater, MarineMax, Ryder System, Amkor and Stewart Information"
2020-12-24,"Should You Investigate MarineMax, Inc. (NYSE:HZO) At US$37.23?"
2020-12-23,"The Zacks Analyst Blog Highlights: Tapestry, MarineMax, ODP, DKS and Target"
2020-12-21,Are Investors Undervaluing MarineMax (HZO) Right Now?
2020-12-19,Is HZO A Good Stock To Buy Now According To Hedge Funds?
2020-12-16,MarineMax Stock Hits The High C's With 96 Composite Rating
2020-12-15,Overview Of Value Stocks In The Consumer Cyclical Sector
2020-12-14,5 Top-Ranked Small-Cap Stocks to Boost Your Portfolio in 2021 (revised)
2020-12-14,"The Zacks Analyst Blog Highlights: Strattec Security, MarineMax, Smith & Wesson Brands, Schnitzer Steel and Titan Machinery"
2020-12-11,5 Top-Ranked Small-Cap Stocks to Boost Your Portfolio in 2021
2020-12-09,3 Strong Buy Stocks That Could Reach New Highs
2020-12-09,Scoop Up These 4 Stocks From the Promising Miscellaneous Retail Industry
2020-12-02,Is MarineMax (HZO) a Great Value Stock Right Now?
2020-11-28,"Is MarineMax, Inc.'s (NYSE:HZO) Latest Stock Performance A Reflection Of Its Financial Health?"
2020-11-25,3 Reasons Why Growth Investors Shouldn't Overlook MarineMax (HZO)
2020-11-24,These 8 Small Stocks Are Still Cheap After Giant 100%-Plus Gains
2020-11-20,"Zacks.com featured highlights include: Amkor Technology, MarineMax, TRI Pointe Group, Century Communities and Advanced Energy Industries"
2020-11-19,"Dow, S&P Drop Over 1% on Second Straight Day of Losses"
2020-11-19,6 Stocks Near 52-Week Highs Poised to Carry the Momentum Further
2020-11-16,Are Investors Undervaluing MarineMax (HZO) Right Now?
2020-11-16,Has MarineMax (HZO) Outpaced Other Retail-Wholesale Stocks This Year?
2020-11-11,"MarineMax's (HZO) Shares March Higher, Can It Continue?"
2020-11-10,5 Value Stocks In The Consumer Cyclical Sector
2020-11-06,Here is Why Growth Investors Should Buy MarineMax (HZO) Now
2020-11-06,Should Value Investors Pick MarineMax (HZO) Stock Now?
2020-11-04,"The Zacks Analyst Blog Highlights: Mohawk Industries, Ethan Allen Interiors, Rocky Brands, Standard Motor Products and MarineMax"
2020-11-03,5 Election-Proof Stocks to Pick Up Now
2020-11-03,A Look Into Consumer Cyclical Sector Value Stocks
2020-11-02,"Top Stock Picks for Week of November 2, 2020"
2020-11-02,Top Ranked Momentum Stocks to Buy for November 2nd
2020-11-02,"Forecast: Analysts Think MarineMax, Inc.'s (NYSE:HZO) Business Prospects Have Improved Drastically"
2020-10-31,"MarineMax, Inc. Just Recorded A 20% EPS Beat: Here's What Analysts Are Forecasting Next"
2020-10-30,Are Investors Undervaluing MarineMax (HZO) Right Now?
2020-10-30,Is MarineMax (HZO) Outperforming Other Retail-Wholesale Stocks This Year?
2020-10-28,Price Over Earnings Overview: MarineMax
2020-10-28,Top Ranked Value Stocks to Buy for October 28th
2020-10-28,MarineMax (HZO) Q4 Earnings and Revenues Beat Estimates
2020-10-28,MarineMax: Q4 Earnings Insights
2020-10-28,MarineMax Reports Record Fourth Quarter and Fiscal Year Results
2020-10-26,Top Ranked Value Stocks to Buy for October 26th
2020-10-26,New Strong Buy Stocks for October 26th
2020-10-22,MarineMax to Webcast Fiscal Fourth Quarter and Full Year 2020 Results
2020-10-21,"MarineMax's (HZO) Shares March Higher, Can It Continue?"
2020-10-20,New Strong Buy Stocks for October 20th
2020-10-15,Why the Earnings Surprise Streak Could Continue for MarineMax (HZO)
2020-10-15,6 Stocks Near 52-Week Highs Poised to Carry the Momentum Ahead
2020-10-14,Is MarineMax (HZO) a Great Value Stock Right Now?
2020-10-14,Is MarineMax (HZO) Stock Outpacing Its Retail-Wholesale Peers This Year?
2020-10-08,We Like These Underlying Trends At MarineMax (NYSE:HZO)
2020-10-06,"Hedge Funds Have Never Been This Bullish On MarineMax, Inc. (HZO)"
2020-10-01,MarineMax Expands Great Lakes and West Coast Presence Adding 20 Locations
2020-09-23,"Benzinga's Top Upgrades, Downgrades For September 23, 2020"
2020-09-16,Is MarineMax (HZO) Stock Undervalued Right Now?
2020-09-16,Has MarineMax (HZO) Outpaced Other Retail-Wholesale Stocks This Year?
2020-09-08,Should You Be Adding MarineMax (NYSE:HZO) To Your Watchlist Today?
2020-08-31,Is MarineMax (HZO) a Great Value Stock Right Now?
2020-08-31,Has MarineMax (HZO) Outpaced Other Retail-Wholesale Stocks This Year?
2020-08-27,Stock Upgrades: Hibbett Sports Shows Rising Relative Strength
2020-08-17,MarineMax and 3 Other Stocks Shine on Price-Cash Flow
2020-08-14,"The Zacks Analyst Blog Highlights: Superior Group of Companies, MarineMax, Sterling Construction, Hamilton Beach Brands and International Money Express"
2020-08-13,Here is Why Growth Investors Should Buy MarineMax (HZO) Now
2020-08-13,Is MarineMax (HZO) a Great Value Stock Right Now?
2020-08-13,Is MarineMax (HZO) Stock Outpacing Its Retail-Wholesale Peers This Year?
2020-08-10,"MarineMax (HZO) Hits 52-Week High, Can the Run Continue?"
2020-08-09,"Market Cool On MarineMax, Inc.'s (NYSE:HZO) Earnings"
2020-07-31,"The Zacks Analyst Blog Highlights: Meritage Homes, MarineMax, PulteGroup, Clearfield and CyberOptics"
2020-07-30,Top Ranked Momentum Stocks to Buy for July 30th
2020-07-28,3 Reasons Growth Investors Will Love MarineMax (HZO)
2020-07-28,Are Investors Undervaluing MarineMax (HZO) Right Now?
2020-07-26,"MarineMax, Inc. Just Beat Earnings Expectations: Here's What Analysts Think Will Happen Next"
2020-07-23,MarineMax (HZO) Hits Fresh High: Is There Still Room to Run?
2020-07-23,"MarineMax, Inc.'s (NYSE:HZO) Share Price Not Quite Adding Up"
2020-07-23,MarineMax (HZO) Q3 Earnings and Revenues Beat Estimates
2020-07-23,MarineMax: Q3 Earnings Insights
2020-07-23,MarineMax Reports Record Third Quarter Results
2020-07-22,A Trio of Potential Bargains
2020-07-21,Is MarineMax (HZO) Stock Outpacing Its Retail-Wholesale Peers This Year?
2020-07-20,Factors to Know Ahead of MarineMax's (HZO) Q3 Earnings
2020-07-16,MarineMax to Webcast Fiscal Third Quarter 2020 Results
2020-07-16,MarineMax (HZO) Expected to Beat Earnings Estimates: What to Know Ahead of Q3 Release
2020-07-16,"The Zacks Analyst Blog Highlights: Nautilus, Rite Aid, EXFO, MarineMax and Strattec Security"
2020-07-10,3 US Small-Cap Stocks to Consider for Market Recovery
2020-07-09,"The Zacks Analyst Blog Highlights: Kroger, SpartanNash Company, Big Lots and MarineMax"
2020-07-08,Why the Earnings Surprise Streak Could Continue for MarineMax (HZO)
2020-07-08,4 Retail Value Bets to Shrug Off Coronavirus-Induced Volatility
2020-07-08,Why MarineMax (HZO) Could Be Positioned for a Surge
2020-07-08,MarineMax Expands Financial Services Business
2020-07-07,"MarineMax (HZO) Hits 52-Week High, Can the Run Continue?"
2020-07-05,"Hedge Funds Are Buying MarineMax, Inc. (HZO)"
2020-07-01,MarineMax Further Expands Worldwide Yacht Services with Acquisition of Northrop & Johnson
2020-06-23,Moving Average Crossover Alert: MarineMax
2020-06-18,New Strong Buy Stocks for June 18th
2020-06-12,Why MarineMax (HZO) Stock Might be a Great Pick
2020-06-11,Five Below (FIVE) Catches Eye: Stock Jumps 9.4%
2020-06-11,Edited Transcript of HZO earnings conference call or presentation 23-Apr-20 2:00pm GMT
2020-06-08,Bed Bath & Beyond (BBBY) Catches Eye: Stock Jumps 6.8%
2020-06-01,3 Brick-and-Mortar Retail Stocks Bucking Downward Tide
2020-05-21,MarineMax Expands Financial Capacity
