2021-01-11,KORU Medical Systems to Present at H.C. Wainwright BioConnect 2021 Conference
2020-12-21,The Returns At Repro Med Systems (NASDAQ:KRMD) Provide Us With Signs Of What's To Come
2020-12-15,Is KRMD A Good Stock To Buy Now?
2020-11-16,KORU Medical Systems Announces Stock Repurchase Program
2020-11-13,2 Strong Buy Penny Stocks With Massive Upside Potential Ahead
2020-11-04,"Repro-Med Systems, Inc. to Host Earnings Call"
2020-11-03,KORU Medical Systems Announces Financial Results for Third Quarter 2020
2020-10-29,"Here's What Repro Med Systems, Inc.'s (NASDAQ:KRMD) Shareholder Ownership Structure Looks Like"
2020-10-27,KORU Medical Systems Schedules Release of Third Quarter 2020 Financial Results and Conference Call
2020-09-14,Is Repro Med Systems (NASDAQ:KRMD) Using Too Much Debt?
2020-08-10,KORU Medical Systems to Present at Canaccord Genuity 40th Annual Growth Conference
2020-08-04,KORU Medical Systems Announces 2020 Second Quarter Financial Results
2020-07-31,"Calculating The Intrinsic Value Of Repro Med Systems, Inc. (NASDAQ:KRMD)"
2020-07-27,KORU Medical Systems Schedules Release of Second Quarter 2020 Financial Results and Conference Call
2020-07-08,"Hedge Funds Keep Buying Repro Med Systems, Inc. (KRMD)"
2020-07-08,KORU Medical Systems Appoints Josh Bennett VP Global Commercialization
2020-06-19,KORU Medical Prices Public Offering of Common Stock
2020-06-18,"KORU Medical Systems to Join Russell 3000®, Russell 2000®, and Russell Microcap® Indexes"
2020-06-18,KORU Medical Commences Public Offering of Common Stock
2020-06-16,Should You Be Adding Repro Med Systems (NASDAQ:KRMD) To Your Watchlist Today?
2020-05-26,KORU Medical Systems and EMED Technologies Corporation Announce Settlement of All Pending Litigation
2020-05-04,KORU Medical Systems Announces 2020 First Quarter Financial Results
2020-04-20,KORU Medical Systems Schedules Release of First Quarter 2020 Financial Results and Conference Call
2020-04-13,United States Federal Court of Appeals Rules in Favor of KORU Medical Systems
2020-02-25,KORU Medical Systems Announces Record 2019 Fourth Quarter and Full Year Financial Results
2020-02-11,KORU Medical Systems Schedules 2019 Fourth Quarter and Full Year Financial Results and Conference Call
2020-02-10,"KORU Medical Systems to Ring Nasdaq Closing Bell on February 12, 2020"
2019-11-25,"Alta Fox Bearish on Keywords Studios, Bullish on One Group Hospitality"
2019-11-14,Magistrate Judge Issues Report and Recommendation to Award KORU Medical Systems $1.0 Million in Attorneys Fees and Costs
2019-11-07,KORU Medical Systems to Present at November Investor Conferences
2019-11-05,KORU Medical Systems Announces Record 2019 Third Quarter Financial Results
2019-10-28,KORU Medical Systems Schedules 2019 Third Quarter Financial Results and Conference Call
2019-10-25,KORU Medical Systems to Present Poster Featuring HIgH-Flo Super26 Needle Set at IgNS 2019 National Conference
