2020-12-21,We're Keeping An Eye On Pieris Pharmaceuticals' (NASDAQ:PIRS) Cash Burn Rate
2020-12-15,Is PIRS A Good Stock To Buy Now?
2020-11-24,25 Best U.S. Cities to Live With Asthma
2020-11-10,Pieris Pharmaceuticals to Participate in Upcoming Investor Conferences
2020-11-06,"Analyst Estimates: Here's What Brokers Think Of Pieris Pharmaceuticals, Inc. (NASDAQ:PIRS) After Its Third-Quarter Report"
2020-11-04,"Pieris Pharmaceuticals (PIRS) Reports Q3 Loss, Misses Revenue Estimates"
2020-11-04,Pieris Pharmaceuticals: Q3 Earnings Insights
2020-11-04,Pieris Pharmaceuticals Reports Third Quarter 2020 Financial Results and Provides Corporate Update
2020-11-04,"Pieris Pharmaceuticals, Inc. to Host Earnings Call"
2020-10-28,"Pieris Pharmaceuticals to Host Third Quarter 2020 Investor Call and Corporate Update on November 4, 2020"
2020-10-05,"Hedge Funds Are Crazy About Pieris Pharmaceuticals, Inc. (PIRS)"
2020-09-28,"Here's What Pieris Pharmaceuticals, Inc.'s (NASDAQ:PIRS) Shareholder Ownership Structure Looks Like"
2020-09-20,Pieris Pharmaceuticals Presents Updated Data from Phase 1 Monotherapy and Atezolizumab Combination Studies of 4-1BB/HER2 Bispecific PRS-343 at the European Society for Medical Oncology (ESMO) Virtual Congress 2020
2020-09-03,Pieris Pharmaceuticals to Participate in Upcoming Investor Conferences
2020-08-12,How Should Investors React To Pieris Pharmaceuticals' (NASDAQ:PIRS) CEO Pay?
2020-08-12,How Is Pieris Pharmaceuticals' (NASDAQ:PIRS) CEO Paid Relative To Peers?
2020-08-10,Recap: Pieris Pharmaceuticals Q2 Earnings
2020-08-10,Pieris Pharmaceuticals Reports Second Quarter 2020 Financial Results and Provides Corporate Update
2020-08-10,Pieris and Lilly Enter Into a Clinical Trial Collaboration to Evaluate Combination of PRS-343 With Ramucirumab and Paclitaxel in Gastric Cancer
2020-08-04,"Did Hedge Funds Make The Right Call On Pieris Pharmaceuticals, Inc. (PIRS) ?"
2020-08-03,"Pieris Pharmaceuticals to Host Second Quarter 2020 Investor Call and Corporate Update on August 10, 2020"
2020-07-28,"Bronstein, Gewirtz & Grossman, LLC Notifies Shareholders of Pieris Pharmaceuticals, Inc. (PIRS) Investigation"
2020-07-23,Pieris Pharmaceuticals Announces Oral Presentation of Phase 1 Data for 4-1BB/HER2 Bispecific PRS-343 at European Society for Medical Oncology (ESMO) Virtual Congress 2020
2020-07-22,"Bronstein, Gewirtz & Grossman, LLC Notifies Investors of Pieris Pharmaceuticals, Inc. (PIRS) Investigation"
2020-07-21,"SHAREHOLDER ALERT: Pomerantz Law Firm Investigates Claims On Behalf of Investors of Pieris Pharmaceuticals, Inc. - PIRS"
2020-07-21,"SHAREHOLDER ALERT: Pomerantz Law Firm Investigates Claims On Behalf of Investors of Pieris Pharmaceuticals, Inc. - PIRS"
2020-07-21,"The Daily Biotech Pulse: Opko Wins CDC Contract, Novartis Lowers Guidance, Pieris Study Placed On Partial Clinical Hold"
2020-07-20,Pieris Pharmaceuticals Announces Partial Clinical Hold On PRS-343
2020-06-23,"Is Pieris Pharmaceuticals, Inc. (PIRS) A Good Stock To Buy?"
2020-06-08,Pieris Pharmaceuticals Announces Virtual 2020 Annual Meeting of Stockholders
2020-06-08,Edited Transcript of PIRS earnings conference call or presentation 11-May-20 12:00pm GMT
2020-05-28,Pieris Pharmaceuticals to Present at the Jefferies 2020 Virtual Healthcare Conference
2020-05-14,"Earnings Update: Pieris Pharmaceuticals, Inc. (NASDAQ:PIRS) Just Reported And Analysts Are Boosting Their Estimates"
2020-05-11,"Pieris Pharmaceuticals (PIRS) Reports Q1 Loss, Tops Revenue Estimates"
2020-05-11,Pieris Pharmaceuticals: Q1 Earnings Insights
2020-05-11,Pieris Pharmaceuticals Reports First Quarter 2020 Financial Results and Provides Corporate Update
2020-05-04,"Pieris Pharmaceuticals to Host First Quarter 2020 Investor Call and Corporate Update on May 11, 2020"
2020-05-01,Pieris Pharmaceuticals (PIRS) May Report Negative Earnings: Know the Trend Ahead of Q1 Release
2020-04-28,Here's Why We're Watching Pieris Pharmaceuticals's (NASDAQ:PIRS) Cash Burn Situation
2020-03-30,Edited Transcript of PIRS earnings conference call or presentation 12-Mar-20 12:00pm GMT
2020-03-24,Biotech stocks have held up better than the broader market  and these five are potential winners
2020-03-24,Solebury Trout Announces Virtual Conference Series with Presentations from Life Science Companies
2020-03-23,Pieris Pharmaceuticals Provides Update on Servier Collaboration
2020-03-14,"Pieris Pharmaceuticals, Inc. Reported Earnings Last Week And Analysts Are Already Upgrading Their Estimates"
2020-03-12,Pieris Pharmaceuticals Reports Full-Year 2019 Financial Results And Provides Corporate Update
2020-03-09,Earnings Preview: Pieris Pharmaceuticals (PIRS) Q4 Earnings Expected to Decline
2020-03-05,"Pieris Pharmaceuticals to Host Full-Year 2019 Investor Call and Corporate Update on March 12, 2020"
2020-02-25,Pieris Pharmaceuticals to Participate in Upcoming Scientific and Investor Conferences
2020-01-20,The Pieris Pharmaceuticals (NASDAQ:PIRS) Share Price Is Up 95% And Shareholders Are Holding On
2020-01-08,Pieris Pharmaceuticals Announces Leadership Update
2019-12-19,"Here is What Hedge Funds Think About Pieris Pharmaceuticals, Inc. (PIRS)"
2019-12-05,Gene Therapy the Next Best Thing: Here's Why (Revised)
2019-12-04,Gene Therapy the Next Best Thing: Here's Why
2019-11-27,Edited Transcript of PIRS earnings conference call or presentation 11-Nov-19 1:00pm GMT
2019-11-19,"Does Pieris Pharmaceuticals, Inc.'s (NASDAQ:PIRS) CEO Pay Matter?"
2019-11-19,"The Daily Biotech Pulse: Therapix To Reverse Merge With CBD Company, Crispr Gene Editing Therapy Readout"
2019-11-17,The Week Ahead In Biotech: Clinical Readouts In Focus As Earnings Wind Down
2019-11-15,Pieris Pharmaceuticals Announces Asthma-focused Translational Research Collaboration with the University of Pittsburgh
2019-11-14,Pieris Pharmaceuticals to Participate in Upcoming Investor Conferences
2019-11-11,"Pieris Pharmaceuticals (PIRS) Reports Q3 Loss, Tops Revenue Estimates"
2019-11-11,Pieris Pharmaceuticals Reports Third Quarter 2019 Financial Results and Provides Corporate Update
2019-11-09,Pieris Pharmaceuticals Presents Data Demonstrating Monotherapy Clinical Benefit with 4-1BB/HER2 Bispecific PRS-343 in Phase 1 Escalation Study at the Society for Immunotherapy of Cancer (SITC) 2019 Annual Meeting
2019-11-07,Pieris Pharmaceuticals to Host R&D Event
2019-11-06,3 Names Making the Case That Investing in Small Biotech Is Never Dull
2019-11-05,Pieris Pharmaceuticals to Present Phase 1 Data for 4-1BB/HER2 Bispecific PRS-343 at the Society for Immunotherapy of Cancer (SITC) Annual Meeting
2019-11-04,Pieris Pharmaceuticals Announces $32 Million Private Placement and Potential Funding Mechanism for PRS-060 Co-development Opt-in
2019-11-04,"Pieris Pharmaceuticals to Host Third Quarter 2019 Investor Call and Corporate Update on November 11, 2019"
2019-10-24,How to invest in biotech stocks like a Nobel Prize winner
2019-10-02,Will Pieris Pharmaceuticals (NASDAQ:PIRS) Spend Its Cash Wisely?
2019-09-26,Pieris Pharmaceuticals and AstraZeneca Present Multiple Ascending Dose Phase 1b Data for Inhaled IL4-R Antagonist AZD1402/PRS-060 at the 2019 European Respiratory Society International Congress
2019-09-03,Pieris Pharmaceuticals Announces Changes to Senior Management Team
2019-08-29,Pieris Pharmaceuticals to Participate in Upcoming Investor Conferences
2019-08-27,Edited Transcript of PIRS earnings conference call or presentation 1-Aug-19 12:00pm GMT
2019-08-27,"Pieris Pharmaceuticals, Inc. (NASDAQ:PIRS): What Does Its Beta Value Mean For Your Portfolio?"
2019-08-01,Pieris Pharmaceuticals Reports Second Quarter 2019 Cash Position and Provides Corporate Update
2019-08-01,Pieris Pharmaceuticals Appoints Dr. Maya Said to its Board of Directors
2019-07-29,PIRS Stock Surges on Promising Drug Data Ahead of Earnings
2019-07-25,"Pieris Pharmaceuticals To Host Second Quarter 2019 Investor Call And Corporate Update On August 1, 2019"
2019-07-11,"Do Institutions Own Shares In Pieris Pharmaceuticals, Inc. (NASDAQ:PIRS)?"
2019-06-23,"Did Hedge Funds Drop The Ball On Pieris Pharmaceuticals, Inc. (PIRS)?"
2019-06-12,These 4 Charts Are Looking Better And Better
2019-05-31,Implied Volatility Surging for Pieris Pharmaceuticals (PIRS) Stock Options
2019-05-30,Pieris Pharmaceuticals to Present at the Jefferies 2019 Healthcare Conference
2019-05-22,Pieris Pharmaceuticals and AstraZeneca Present Single- Ascending Dose Phase 1a Data for Inhaled IL-4R Antagonist AZD1402/PRS-060 at the American Thoracic Society (ATS) 2019 International Conference
2019-05-22,Edited Transcript of PIRS earnings conference call or presentation 10-May-19 12:00pm GMT
2019-05-14,Pieris Pharmaceuticals to Present at the 2019 RBC Capital Markets Global Healthcare Conference
2019-05-10,Pieris Pharmaceuticals Reports First Quarter 2019 Financial Results and Provides Corporate Update
2019-05-03,"Pieris Pharmaceuticals to Host First Quarter 2019 Investor Call and Corporate Update on May 10, 2019"
2019-05-02,Analysts Estimate Pieris Pharmaceuticals (PIRS) to Report a Decline in Earnings: What to Look Out for
2019-04-28,Did You Miss Pieris Pharmaceuticals's (NASDAQ:PIRS) 56% Share Price Gain?
2019-04-03,Pieris Pharmaceuticals to Present at the 2019 H.C. Wainwright Global Life Sciences Conference
2019-04-02,Pieris Pharmaceuticals Presents Preclinical Data for GPC3/4-1BB Bispecific PRS-342 at the 2019 American Association for Cancer Research (AACR) Annual Meeting
2019-04-01,Edited Transcript of PIRS earnings conference call or presentation 12-Mar-19 12:00pm GMT
2019-03-12,Pieris Pharmaceuticals Reports 2018 Year-End Cash Position and Provides Corporate Update
2019-03-12,"Pieris Pharmaceuticals, Inc. to Host Earnings Call"
2019-03-06,Pieris Pharmaceuticals to Present at the Cowen and Company 39th Annual Health Care Conference
2019-03-05,"Pieris Pharmaceuticals to Host Full-Year 2018 Investor Call and Corporate Update on March 12, 2019"
2019-02-26,"Factors of Influence in 2019, Key Indicators and Opportunity within Conagra Brands, Pieris Pharmaceuticals, ArQule, MoneyGram International, Internap, and TIM Participacoes S.A  New Research Emphasizes Economic Growth"
2019-02-21,"Does Pieris Pharmaceuticals, Inc. (NASDAQ:PIRS) Have A Particularly Volatile Share Price?"
2019-01-09,"What Kind Of Shareholder Appears On The Pieris Pharmaceuticals, Inc.s (NASDAQ:PIRS) Shareholder Register?"
