2021-01-11,How Costco Makes Money: Merchandise Sales and Membership Fees
2021-01-11,Costco's December Sales: Another Double-Digit Gain
2021-01-09,Costco (COST) Down 0.8% Since Last Earnings Report: Can It Rebound?
2021-01-08,Costco (COST) Stock Moves 0.55%: What You Should Know
2021-01-08,Bed Bath & Beyond 'seeing good early signs in January' despite disappointing quarter: CEO
2021-01-07,Costco Stock Eyes New Buy Point Amid Softer Sales Trend
2021-01-07,Better Buy: McDonald's vs. Costco
2021-01-07,Better Buy: Amazon vs. Costco
2021-01-07,Costcos Same-Store Sales Rose by Double Digits. Its Still a Slowdown.
2021-01-07,Will Costco Beat the Market in 2021?
2021-01-07,Costco's (COST) Sturdy Sales Run Continues in December
2021-01-07,"Zacks Earnings Trends Highlights: Costco, Nike, FedEx and Oracle"
2021-01-07,Costcos December Sales Slowdown But Beat Estimates; Street Stays Bullish
2021-01-06,Costcos December sales top $19 billion
2021-01-06,Costco Wholesale Corporation Reports December Sales Results
2021-01-06,Better Buy: Costco vs. Clorox
2021-01-06,Better Buy: Costco vs. Dollar General
2021-01-05,3 Things to Expect from Costco in 2021
2021-01-05,3 Top Retail Stocks to Buy Now
2021-01-05,10 Top Stocks That Will Make You Richer in 2021
2021-01-04,"Costco, Walgreens, Constellation, and Other Stocks to Watch This Week"
2021-01-04,Fashion Companies Legal Issues and Cases in 2021
2021-01-02,3 Things to Watch in the Stock Market This Week
2021-01-01,Buy These 3 Stocks Before the Market Corrects in 2021
2021-01-01,2 Retailers That Can Keep Their Pandemic-Era Gains
2020-12-31,Calculating The Intrinsic Value Of Costco Wholesale Corporation (NASDAQ:COST)
2020-12-31,Best Stocks For 2021: Disney (DIS)
2020-12-31,Better Buy: Costco vs. Nordstrom
2020-12-30,"Tesco Britains worst minimum wage offender, BEIS says"
2020-12-30,This Is Why 2021 Will Be Another Great Year for Costco
2020-12-30,The 3 Safest Stocks to Buy With Your Stimulus Money
2020-12-29,3 Great Stocks Under $50 to Buy for 2021
2020-12-29,Heres What to Expect From Major Retailers in the New Year
2020-12-28,Grocery Outlet CMO: The eat-at-home trend 'isn't going to change'
2020-12-28,What Happened to Walmart Stock in 2020?
2020-12-28,Best Dividend Stocks for January 2021
2020-12-28,Costco Will Report December Sales Soon. Heres What to Expect.
2020-12-26,3 Stocks I'm Never Selling
2020-12-24,15 Biggest Retailers In The World Heading Into 2021
2020-12-24,"Beyond Meat, Impossible Foods, Oatly: The alternative food brands that defined COVID-19 era eating"
2020-12-24,2 Best Retail Stocks to Buy for the Next Decade
2020-12-24,Better Buy: Costco vs. Starbucks
2020-12-23,"Meats and cheeses: Charcuterie boards, specialty boxes spike during COVID-19 'with no signs of slowing down'"
2020-12-23,"IPO Stocks to Trade: 2 to Buy, 1 to Sell"
2020-12-23,Better Buy: Costco vs. Walmart
2020-12-22,Three Retailers Set for Sales Growth Regardless of Vaccine Timing
2020-12-22,"Is Costco Stock A Buy Right Now? Here's What Earnings, Chart Say"
2020-12-22,Better Buy: Costco vs. Best Buy
2020-12-22,Bottlenecks Wear Down World Economys Fleet of Container Ships
2020-12-21,Better Buy: Costco vs. Unilever
2020-12-21,4 Discount Retailers Set to Maintain Winning Streak in 2021
2020-12-16,These major retailers are spending millions of dollars to show employees appreciation
2020-12-16,Costco (COST) Poised to Tap Rising Demand Amid COVID-19
2020-12-16,Where Will Costco Be in 5 Years?
2020-12-15,10 Best Large-Cap Stocks To Buy According to Ray Dalio
2020-12-15,"If You Put $10,000 Into Costco Stock Last January, Here's How Much You'd Have Now"
2020-12-15,FedEx and UPS Are Limiting Package Pickups. What That Means for Retailers.
2020-12-15,Why Is Everyone Talking About Costco Stock?
2020-12-15,Costco's Big Earnings Beat Points to Further Upside
2020-12-15,Its Going to Rain Dividends and Buybacks Next Year. What to Expect for Markets and Consumer Stocks in 2021.
2020-12-14,"The Zacks Analyst Blog Highlights: Oracle, Adobe, Costco, AutoZone, Regeneron Pharmaceuticals and Bank of New York Mellon"
2020-12-14,"Company News for Dec 14, 2020"
2020-12-14,Morning Bell With Jim Cramer: How to Buy Bitcoin
2020-12-14,Better Buy: Nike vs. Costco
2020-12-14,3 Things Investors Might Have Missed From Costco's Q1 Report
2020-12-13,Better Buy: Beyond Meat vs. Costco
2020-12-12,Here's how Beyond Meat can 'hit the jackpot' after Costco meatball rollout
2020-12-12,Costco Wholesale Corporation Beat Analyst Estimates: See What The Consensus Is Forecasting For This Year
2020-12-11,PreMarket Prep Stock Of The Day: Costco Wholesale
2020-12-11,"Jim Cramer Says Take Gains, Raise Capital In Stock Market Friday"
2020-12-11,Stock Market Today With Jim Cramer: Don't Sell Disney
2020-12-11,Costco First-Quarter Earnings: What Wall Street Is Saying
2020-12-11,"The Zacks Analyst Blog Highlights: Lululemon, Oracle, Costco and Broadcom"
2020-12-11,"Costco's Executing at a High Level, and Here's How I'm Playing the Stock"
2020-12-11,"Costco's (COST) Q1 Earnings Beat, E-commerce Sales Surge"
2020-12-11,"Pfizer Covid Vaccine, Disney, Costco, Airbnb - 5 Things You Must Know Friday"
2020-12-11,Costco Wholesale (COST) Q1 2021 Earnings Call Transcript
2020-12-10,Costco Trounces Q1 Estimates
2020-12-10,"Stock Markets Finish Mixed; Costco, Lululemon Weigh In After Hours"
2020-12-10,"Big Afternoon for Earnings Reports: LULU, ORCL, COST & More"
2020-12-10,Costco (COST) Tops Q1 Earnings and Revenue Estimates
2020-12-10,Costco Wavers After Adjusted Profit and Revenue Beat Estimates
2020-12-10,"Costco Reports Q1 Sales Beat, Sees 86% E-Commerce Growth"
2020-12-10,"Costcos fiscal Q1 sales rise 17%, but miss heightened expectations"
2020-12-10,Costco Beats But Covid-19 Costs Weigh On Earnings
2020-12-10,Costco Wholesale Corporation Reports First Quarter Fiscal Year 2021 Operating Results
2020-12-10,Better Buy: Costco vs. Hilton
2020-12-10,"Best Stocks of the Year: Walmart, Apple, Nvidia"
2020-12-10,Grace Capital's Catherine Faddis Is Bullish On Costco
2020-12-09,Bull Signal Shows Costco Stock Has Room to Run
2020-12-09,Can Costco Muster Up a Post-Earnings Rally?
2020-12-09,"Got $1,000? Stock Up on Costco Before 2021"
2020-12-09,Earnings Outlook For Costco Wholesale
2020-12-09,Why Earnings Season Could Be Great for Costco (COST)
2020-12-08,"Jim Cramer: In the Game of Business and Money, Go With the Pros Over Amateurs"
2020-12-08,Costco (COST) Q1 Earnings to Benefit From E-commerce Strength
2020-12-07,Has the Costco Good News Already Been Discounted?
2020-12-07,Costco (COST) at Technical Crossroads Ahead of Earnings
2020-12-07,Factors Likely to Decide Costco's (COST) Fate in Q1 Earnings
2020-12-06,"Earnings Reports for the Week of Dec. 7-11 (CHWY, COST, GME)"
