2021-01-06,Axcelis To Participate In The 23rd Annual Needham Virtual Growth Conference
2020-12-22,Is There More Growth In Store For Axcelis Technologies' (NASDAQ:ACLS) Returns On Capital?
2020-12-18,Is ACLS A Good Stock To Buy Now?
2020-12-17,Axcelis (ACLS) Upgraded to Buy: Here's Why
2020-12-08,Moving Average Crossover Alert: Axcelis Technologies (ACLS)
2020-12-02,Axcelis (ACLS) is an Incredible Growth Stock: 3 Reasons Why
2020-12-02,Axcelis Stock Sees Its Composite Rating Rise To 96
2020-12-02,Axcelis To Participate In The 12th Annual CEO Investor Summit 2020
2020-12-01,Here's Why Axcelis Technologies (ACLS) is a Great Momentum Stock to Buy
2020-12-01,"Axcelis Announces Participation In The D.A. Davidson Semicap, Laser And Optical Conference"
2020-11-29,"Axcelis Technologies, Inc. (NASDAQ:ACLS) Shares Could Be 44% Below Their Intrinsic Value Estimate"
2020-11-26,Wall Street Set to Close the Year Higher: 5 Top Growth Picks
2020-11-16,3 Reasons Growth Investors Will Love Axcelis (ACLS)
2020-11-10,Axcelis (ACLS) Upgraded to Buy: Here's Why
2020-11-07,"Axcelis Technologies, Inc. Beat Analyst Estimates: See What The Consensus Is Forecasting For Next Year"
2020-11-06,Axcelis Technologies Inc (ACLS) Q3 2020 Earnings Call Transcript
2020-11-06,"Axcelis Technologies, Inc. to Host Earnings Call"
2020-11-05,Axcelis Technologies (ACLS) Surpasses Q3 Earnings and Revenue Estimates
2020-11-05,Axcelis Announces Financial Results For Third Quarter 2020
2020-11-03,Axcelis To Participate In The Benchmark Technology Conference
2020-11-02,Factors Setting the Tone for Axcelis' (ACLS) Q3 Earnings
2020-10-29,Axcelis Technologies (ACLS) Reports Next Week: Wall Street Expects Earnings Growth
2020-10-27,Axcelis Ships Multiple Purion High Energy Systems To Leading CMOS Image Sensor Manufacturers
2020-10-25,Did You Miss Axcelis Technologies' (NASDAQ:ACLS) Impressive 106% Share Price Gain?
2020-10-15,Axcelis Announces Timing And Availability Of Third Quarter 2020 Results And Conference Call
2020-10-09,Hedge Funds Are Dipping Their Toes Into Axcelis Technologies Inc (ACLS)
2020-09-30,Axcelis Ships First Purion H200 High Current Implanter And Follow On Purion M SiC Medium Current Implanter To Leading Power Device Manufacturers
2020-09-29,"Axcelis Technologies, Inc.'s (NASDAQ:ACLS) Fundamentals Look Pretty Strong: Could The Market Be Wrong About The Stock?"
2020-09-16,Axcelis Announces Multiple Shipments Of 'Purion H' Evaluation Systems For Advanced Logic And 3D NAND Applications
2020-09-09,All You Need to Know About Axcelis (ACLS) Rating Upgrade to Strong Buy
2020-09-03,"What Kind Of Shareholders Own Axcelis Technologies, Inc. (NASDAQ:ACLS)?"
2020-08-28,Why This Under-the-Radar Stock Is a Hidden Buy in Today's Stock Market
2020-08-14,Axcelis Technologies' Charts Are Showing Mixed Signals
2020-08-12,How Axcelis (ACLS) Stock Stands Out in a Strong Industry
2020-08-10,"Is Axcelis Technologies, Inc. (NASDAQ:ACLS) Potentially Undervalued?"
2020-08-10,"Why Axcelis Technologies, Inc. (NASDAQ:ACLS) Could Be Worth Watching"
2020-08-07,Axcelis (ACLS) is an Incredible Growth Stock: 3 Reasons Why
2020-08-07,What Makes Axcelis (ACLS) a New Buy Stock
2020-08-06,Axcelis to Participate in the Needham Virtual SemiCap and EDA Investor Conference
2020-08-05,Advanced Energy Industries Powers Second-Quarter Earnings Beat
2020-08-05,Axcelis Technologies Inc (ACLS) Q2 2020 Earnings Call Transcript
2020-08-04,Axcelis Technologies (ACLS) Q2 Earnings and Revenues Beat Estimates
2020-08-04,Axcelis Announces Financial Results For Second Quarter 2020
2020-07-28,Axcelis Technologies (ACLS) Reports Next Week: Wall Street Expects Earnings Growth
2020-07-16,Axcelis Announces Timing And Availability Of Second Quarter 2020 Results And Conference Call
2020-07-13,What Can The Trends At Axcelis Technologies (NASDAQ:ACLS) Tell Us About Their Returns?
2020-06-30,Were Hedge Funds Right About Buying Axcelis Technologies Inc (ACLS)?
2020-06-17,Axcelis Announces Shipments of 'Purion Dragon' and 'Purion XEmax'
2020-06-08,Edited Transcript of ACLS earnings conference call or presentation 6-May-20 12:30pm GMT
2020-06-05,A Trio of Stocks Growing Capex Fast
2020-06-01,Axcelis Announces Participation In Stifel 2020 Cross Sector Insight Conference
2020-05-19,Axcelis Announces Participation in Upcoming Investor Conferences
2020-05-07,"Results: Axcelis Technologies, Inc. Exceeded Expectations And The Consensus Has Updated Its Estimates"
2020-05-06,Axcelis Technologies Inc (ACLS) Q1 2020 Earnings Call Transcript
2020-05-05,Axcelis Technologies (ACLS) Q1 Earnings and Revenues Beat Estimates
2020-05-05,Axcelis Announces Financial Results For First Quarter 2020
2020-04-29,What Is Axcelis Technologies's (NASDAQ:ACLS) P/E Ratio After Its Share Price Rocketed?
2020-04-28,Axcelis Technologies (ACLS) Earnings Expected to Grow: What to Know Ahead of Next Week's Release
2020-04-28,Axcelis Announces Orders For 'Purion Dragon' Including Successful Closure Of An Evaluation
2020-04-16,"Timing the Market, Is it Possible? - April 16, 2020"
2020-04-15,What Is Axcelis Technologies's (NASDAQ:ACLS) P/E Ratio After Its Share Price Rocketed?
2020-04-14,Axcelis Beats Guidance for First Quarter 2020
2020-04-12,"Does Axcelis Technologies, Inc. (NASDAQ:ACLS) Have A High Beta?"
2020-04-02,Axcelis Announces First Order For Purion In Japan
2020-03-23,Stocks to Buy When the Bear Market Is Finally Over
2020-03-19,"Applied Materials, Lam Research among 10 stocks getting downgrades at B. Riley"
2020-03-13,"How Does Axcelis Technologies's (NASDAQ:ACLS) P/E Compare To Its Industry, After The Share Price Drop?"
2020-02-27,Axcelis To Participate In The Susquehanna Financial Group Ninth Annual Technology Conference
2020-02-26,"At US$23.26, Is It Time To Put Axcelis Technologies, Inc. (NASDAQ:ACLS) On Your Watch List?"
2020-02-11,Edited Transcript of ACLS earnings conference call or presentation 6-Feb-20 1:30pm GMT
2020-02-05,Axcelis Technologies (ACLS) Tops Q4 Earnings and Revenue Estimates
2020-01-31,Can You Imagine How Chuffed Axcelis Technologies's (NASDAQ:ACLS) Shareholders Feel About Its 138% Share Price Gain?
2020-01-29,Analysts Estimate Axcelis Technologies (ACLS) to Report a Decline in Earnings: What to Look Out for
2020-01-20,"The Truth About Market Timing - January 20, 2020"
2020-01-14,Axcelis Announces Timing And Availability Of Fourth Quarter And Full Year 2019 Results And Conference Call
2020-01-03,Axcelis (ACLS) Upgraded to Strong Buy: Here's What You Should Know
2020-01-02,Axcelis to Participate in the 22nd Annual Needham Growth Conference
2020-01-01,"Axcelis Technologies, Inc. (NASDAQ:ACLS) Might Not Be A Great Investment"
2019-12-31,"Yes, You Can Time the Market. Find out How - December 31, 2019"
2019-12-11,Is Axcelis Technologies Inc (ACLS) A Good Stock To Buy ?
2019-12-04,"The Truth About Market Timing - December 04, 2019"
2019-12-03,Axcelis Announces Expansion and Extension of Share Repurchase Program
2019-12-02,"Is Axcelis Technologies, Inc.'s (NASDAQ:ACLS) ROE Of 3.9% Concerning?"
2019-11-19,Axcelis To Participate In The 8th Annual NYC Investor Summit 2019
2019-11-14,Axcelis Announces Participation In Upcoming Investor Conferences
2019-11-12,"Timing the Market, Is it Possible? - November 12, 2019"
2019-11-04,Edited Transcript of ACLS earnings conference call or presentation 1-Nov-19 12:30pm GMT
2019-10-31,Axcelis Technologies (ACLS) Surpasses Q3 Earnings Estimates
2019-10-31,Axcelis Announces Financial Results For Third Quarter 2019
2019-10-30,Do Hedge Funds Love Axcelis Technologies Inc (ACLS)?
2019-10-30,"Who Has Been Selling Axcelis Technologies, Inc. (NASDAQ:ACLS) Shares?"
2019-10-24,Earnings Preview: Axcelis Technologies (ACLS) Q3 Earnings Expected to Decline
2019-10-23,"Simple Market Timing Strategies That Work - October 23, 2019"
2019-10-23,Axcelis (ACLS) Upgraded to Buy: What Does It Mean for the Stock?
2019-10-10,Axcelis Announces Timing And Availability Of Third Quarter 2019 Results And Conference Call
2019-10-08,"Does Axcelis Technologies, Inc. (NASDAQ:ACLS) Have A Particularly Volatile Share Price?"
2019-09-26,"How to Time the Markets Like an Investing Pro - September 26, 2019"
2019-09-19,Axcelis Announces Next Wave Of Purion Innovation With The Introduction Of Three New Products
2019-09-18,"Why Fundamental Investors Might Love Axcelis Technologies, Inc. (NASDAQ:ACLS)"
2019-09-05,"The Market Timing Secrets No One Talks About - September 05, 2019"
