2020-12-29,"Have Insiders Been Buying White Mountains Insurance Group, Ltd. (NYSE:WTM) Shares This Year?"
2020-12-21,Top Financial Stocks for January 2021
2020-12-16,Is WTM A Good Stock To Buy Now?
2020-11-27,Does White Mountains Insurance Group (NYSE:WTM) Deserve A Spot On Your Watchlist?
2020-11-18,Ranger Investment Management Consolidates Ownership Interest With Capital From Kudu Investment Management
2020-11-09,Channel Capital Undertakes Management Buyout Supported by Kudu Investment Management
2020-11-06,White Mountains Reports Third Quarter Results
2020-10-28,MediaAlpha Stock Rockets 64% as Root Insurance and Other IPOs Fall Flat
2020-10-28,"White Mountains Insurance Group, Ltd.'s (NYSE:WTM) Stock Has Seen Strong Momentum: Does That Call For Deeper Study Of Its Financial Prospects?"
2020-10-28,MediaAlpha and Biodesix Stock Will Make Their Trading Debuts Today
2020-10-27,MediaAlpha Prices Initial Public Offering
2020-10-05,MediaAlpha Files Registration Statement for Initial Public Offering
2020-10-01,White Mountains to Significantly Expand Capitalization of Ark Insurance Holdings; Will Acquire Majority Interest
2020-09-22,What Can We Learn About White Mountains Insurance Group's (NYSE:WTM) CEO Compensation?
2020-08-07,White Mountains Reports Second Quarter Results
2020-07-07,Sequoia Financial Group Partners With Kudu Investment Management To Buttress Continued Growth
2020-07-07,The 3 Greatest Stocks You've Never Heard Of
2020-06-30,S&P Global Ratings Affirms BAMs AA Rating and Stable Outlook
2020-06-26,White Mountains Insurance Group Ltd (WTM): Hedge Funds Sticking Around
2020-05-08,White Mountains Reports First Quarter Results
2020-05-07,"BAM Elects New Chairman, Adds Clarence Anthony as Independent Director"
2020-03-31,Kudu Makes Minority Investment in Private Equity Firm Creation Investments
2020-03-27,Hedge Funds Are Dumping White Mountains Insurance Group Ltd (WTM)
2020-03-27,"Our Take On White Mountains Insurance Group, Ltd.'s (NYSE:WTM) CEO Salary"
2020-03-23,NSM Insurance Group To Acquire Kingsbridge Group
2020-02-28,White Mountains Declares Annual Dividend
2020-01-22,"With A 6.2% Return On Equity, Is White Mountains Insurance Group, Ltd. (NYSE:WTM) A Quality Stock?"
2019-12-16,"Pacific Current, Kudu Invest in Pennybacker Capital Management"
2019-12-11,Heres What Hedge Funds Think About White Mountains Insurance Group Ltd (WTM)
2019-11-22,S&P Affirms Build America Mutuals AA Rating and Stable Outlook Under New Methodology
2019-11-15,Embrace Pet Insurance Selects New President
2019-11-15,ANALYSIS: Sirius International Insurance Group May be Worth $20 a Share
2019-11-06,White Mountains Reports Third Quarter Results
2019-10-24,Should You Buy White Mountains Insurance Group Ltd (WTM)?
2019-10-23,Smart Car Insurance Company Arrives in Texas
2019-10-04,"Is White Mountains Insurance Group, Ltd. (NYSE:WTM) Overpaying Its CEO?"
2019-09-04,EJF Capital Receives Strategic Minority Investment From Kudu
2019-08-06,White Mountains Reports Second Quarter Results
2019-07-29,"Should You Be Concerned About White Mountains Insurance Group, Ltd.'s (NYSE:WTM) ROE?"
2019-07-29,Kudu Investment Management Acquires Minority Stake In Wealth Manager First Long Island Investors
2019-06-28,Build America Mutual Announces S&P Global Ratings Affirms BAMs AA Rating and Stable Outlook
2019-06-24,Heres What Hedge Funds Think About White Mountains Insurance Group Ltd (WTM)
2019-06-20,"Noblr, the New Car Insurance Company, Launches in Colorado"
2019-06-12,Asset Management Market Research Executive Quinn Keeler Joins Kudu Investment Management
2019-06-03,"White Mountains Makes Minority Investment in Elementum Advisors, LLC"
2019-05-06,White Mountains: 1Q Earnings Snapshot
2019-05-06,White Mountains Reports First Quarter Results
2019-05-03,"White Mountains to Hold 2019 Annual Investor Information Meeting on June 7, 2019"
2019-05-01,Frank Bazos To Join White Mountains As Executive Vice President And Head Of M&A
2019-04-29,"Should You Be Worried About Insider Transactions At White Mountains Insurance Group, Ltd. (NYSE:WTM)?"
2019-04-26,Is White Mountains Insurance Group Ltd (WTM) A Good Stock To Buy ?
2019-04-02,"Third Avenue Value Fund Swaps Ocean Rig for Transocean, Sells 3 Other Stocks"
2019-04-01,NSM Insurance Group Acquires Embrace Pet Insurance
2019-03-19,6 Poorly Performing Stocks
2019-03-04,"Kudu Announces Minority Investment In Versus, A Leading Real Assets Fund Manager"
2019-03-01,White Mountains Declares Annual Dividend
2019-03-01,Peter Carlson Elected To The White Mountains Board
2019-02-27,3 Stocks Warren Buffett Would Love
2019-02-14,"White Mountains Boosts Capital Commitment To $250 Million In Kudu Investment Management, Fueling Kudu's Stakes In Boutique Asset And Wealth Managers"
2019-02-06,White Mountains: 4Q Earnings Snapshot
2019-02-06,White Mountains Reports Fourth Quarter Results
2019-02-04,MediaAlpha To Sell Significant Minority Stake To Insignia Capital
2019-01-07,"White Mountains Makes Minority Investment in Noblr, Inc."
2018-12-20,"Kudu Makes Minority Investment In Fair Oaks, Leading Credit Manager"
2018-12-19,Do Hedge Funds Love White Mountains Insurance Group Ltd (WTM)?
2018-12-03,NSM Insurance Group Acquires Assets Of KBK Insurance Group
2018-11-23,"Detailed Research: Economic Perspectives on Whirlpool, GrafTech International, Thermon Group, White Mountains Insurance Group, Air Industries Group, and Heat Biologics  What Drives Growth in Today's Competitive Landscape"
2018-11-05,White Mountains: 3Q Earnings Snapshot
2018-11-05,White Mountains Reports Third Quarter Results
2018-11-05,"NSM MGA Holdings Ltd Launch Second Underwriting Brand, First Specialty"
2018-10-22,NSM Insurance Group Acquires Xpekt Ltd.
2018-10-17,"Bingham, Osborn & Scarborough (B|O|S) Regains Ownership from Boston Private"
2018-08-24,David Tanner Elected To The White Mountains Board
2018-08-21,"NSM Insurance Group Announces New Excess & Surplus Lines Program, Specialty E&S"
2018-08-07,White Mountains: 2Q Earnings Snapshot
2018-08-07,White Mountains Reports Second Quarter Results
2018-06-25,Build America Mutual Announces S&P Global Ratings Affirms BAMs AA Rating and Stable Outlook
2018-06-20,White Mountains Insurance's Investment Portfolio -- Is This a Mini-Berkshire?
2018-06-20,White Mountains Insurance's Investment Management Side
2018-06-20,Two Insurance-Adjacent Businesses in White Mountains Insurance's Portfolio
2018-06-20,Could Travel Medical Insurance Drive White Mountains Insurance's Profits Higher?
2018-06-20,White Mountains Insurance's Core Insurance Business
2018-06-20,White Mountains Insurance's Business Model
2018-06-19,White Mountains Insurance -- a Baby Berkshire or Something Else?
2018-06-01,Assurant Braces Vehicle Protection With Warranty Group Buy
2018-05-25,"White Mountains to Hold 2018 Annual Investor Information Meeting on June 8, 2018"
2018-05-21,NSM Insurance Group Acquires Fresh Insurance
2018-05-11,White Mountains Announces Final Results Of Its Tender Offer
2018-05-08,White Mountains Announces Preliminary Results Of Its Tender Offer
2018-05-02,White Mountains: 1Q Earnings Snapshot
2018-05-02,White Mountains Reports First Quarter Results
2018-04-19,Is It Time To Sell White Mountains Insurance Group Ltd (NYSE:WTM) Based Off Its PE Ratio?
2018-04-16,BAM Announces Agreement to Expand Claims-Paying Resources by $100 Million
2018-04-10,"White Mountains To Commence Self-Tender Offer To Purchase Up To 500,000 Of Its Common Shares"
2018-04-02,[$$] White Mountains to Buy Majority Stake in NSM Insurance
2018-04-02,White Mountains to Acquire a Majority Stake in NSM Insurance Group
2018-03-02,White Mountains Declares Annual Dividend
2018-03-02,Philip Gelston Elected To The White Mountains Board
2018-02-28,"White Mountains Insurance Group Ltd (WTM) Files 10-K for the Fiscal Year Ended on December 31, 2017"
2018-02-07,White Mountains posts 4Q profit
