2021-01-07,Digimarc to Present at Needham Virtual Growth Conference and Participate in NRF 2021 - Chapter One
2020-12-16,What Did Digimarc's (NASDAQ:DMRC) CEO Take Home Last Year?
2020-12-02,Where Do Hedge Funds Stand On Digimarc Corp (DMRC)?
2020-11-11,Digimarc Drives Exclusive Toy Catalog Content for the Second Year Running
2020-11-01,Earnings Update: Here's Why Analysts Just Lifted Their Digimarc Corporation (NASDAQ:DMRC) Price Target To US$23.00
2020-10-29,Digimarc Corp (DMRC) Q3 2020 Earnings Call Transcript
2020-10-28,Digimarc: Q3 Earnings Insights
2020-10-28,Digimarc Reports Third Quarter 2020 Financial Results
2020-10-27,Digimarc Welcomes Noted Venture Capitalist and Advisor Alicia Syrett to its Board of Directors
2020-10-14,"Digimarc Sets Third Quarter 2020 Conference Call for Wednesday, October 28 at 5:00 p.m. ET"
2020-09-29,TCM|Strategic Comments on its Agreement to Acquire $53.5 Million of Digimarc Corporation Common and Convertible Preferred Equity
2020-09-29,TCM|Strategic Comments on its Agreement to Acquire $53.5 Million of Digimarc Corporation Common and Convertible Preferred Equity
2020-09-29,TCM|Strategic Partners Invests $53.5 million in Digimarc
2020-09-29,TCM|Strategic Partners Invests $53.5 million in Digimarc
2020-09-08,Digimarc at Center of Pan-European Development of Digital Watermarking for Improved Plastic Sortation and Recycling
2020-09-08,What Type Of Returns Would Digimarc's(NASDAQ:DMRC) Shareholders Have Earned If They Purchased Their SharesYear Ago?
2020-09-01,Digimarc Promotes Platform at Industry & Investor Events this Fall
2020-07-30,Digimarc Corp (DMRC) Q2 2020 Earnings Call Transcript
2020-07-29,Recap: Digimarc Q2 Earnings
2020-07-29,Digimarc Reports Second Quarter 2020 Financial Results
2020-07-15,"Digimarc Sets Second Quarter 2020 Conference Call for Wednesday, July 29 at 5:00 p.m. ET"
2020-07-10,What Type Of Shareholders Own The Most Number of Digimarc Corporation (NASDAQ:DMRC) Shares?
2020-06-17,Edited Transcript of DMRC earnings conference call or presentation 29-Apr-20 9:00pm GMT
2020-06-12,Hedge Funds Are Nibbling On Digimarc Corp (DMRC)
2020-06-05,"Digimarc Joins Upcoming Webinars on Sustainability, Grocery During COVID-19 & Packaging Print Quality"
2020-06-03,Digimarc Appoints D.J. Vogt as Senior Director of Corporate Communications
2020-05-29,Digimarc Sets June 2020 Financial Conference Schedule
2020-05-11,Flower One Announces Appointment of Bern Whitney to Board of Directors
2020-05-07,Digimarc Sets May 2020 Financial Conference Schedule
2020-05-03,Digimarc Corporation (NASDAQ:DMRC) Just Reported And Analysts Have Been Cutting Their Estimates
2020-04-30,Digimarc Corp (DMRC) Q1 2020 Earnings Call Transcript
2020-04-29,Digimarc Reports First Quarter 2020 Financial Results
2020-04-28,Is Digimarc (NASDAQ:DMRC) In A Good Position To Invest In Growth?
2020-04-24,"Some U.S. companies will keep small business loans, defying backlash"
2020-04-15,"Digimarc Sets First Quarter 2020 Conference Call for Wednesday, April 29 at 5:00 p.m. ET"
2020-03-24,Edited Transcript of DMRC earnings conference call or presentation 26-Feb-20 10:00pm GMT
2020-02-28,"Digimarc Corporation Just Reported Earnings, And Analysts Cut Their Target Price"
2020-02-26,Digimarc Reports Fourth Quarter and Full Year 2019 Financial Results
2020-02-26,Digimarc Reports Fourth Quarter and Full Year 2019 Financial Results
2020-02-24,Does Digimarc Corporation's (NASDAQ:DMRC) CEO Salary Compare Well With Others?
2020-02-18,Digimarc and German Retailer Netto Marken-Discount win 'Top Supplier Retail 2020' Award for Netto's 'Connected Packaging'
2020-02-12,Digimarc Platform Innovations Showcased at Industry Events
2020-02-12,"Digimarc Sets Fourth Quarter and Full Year 2019 Conference Call for Wednesday, February 26 at 5:00 p.m. ET"
2020-02-06,P&G to launch packaging with digital watermarks
2020-01-27,Digimarc Describes System for Mitigating Problem of Deepfake News Videos Using Digital Watermarking
2020-01-20,Digimarc Participates in Procter & Gamble's HolyGrail 2.0 Pavilion Session at World Economic Forum
2020-01-09,Digimarc Highlights Sustainable & Efficient Retail Applications at NRF 2020
2020-01-08,NewPoint Media Partners with Digimarc to Personalize the Real Estate Shopping Experience
2020-01-06,"Digimarc to Present at the 22nd Annual Needham Growth Conference on January 15, 2020"
2019-12-24,"The Digimarc (NASDAQ:DMRC) Share Price Has Gained 129%, So Why Not Pay It Some Attention?"
2019-12-20,Hedge Funds Staying Clear Of Digimarc Corp (DMRC)
2019-11-15,Edited Transcript of DMRC earnings conference call or presentation 30-Oct-19 9:00pm GMT
2019-11-14,Digimarc Brings Scan & Shop Technology to Walmart's Toy Catalog
2019-11-07,Digimarc and HP Host Packaging Innovation Event at HP Graphic Arts Experience Center
2019-11-05,New Microsoft Industry Experience Center Showcases Digimarc Platform
2019-11-04,Digimarc to 'Dress Up Your Design' at Adobe MAX 2019
2019-10-30,Hedge Funds Are Buying Digimarc Corp (DMRC)
2019-10-30,Digimarc Reports Third Quarter 2019 Financial Results
2019-10-25,Who Has Been Selling Digimarc Corporation (NASDAQ:DMRC) Shares?
2019-10-16,"Digimarc Sets Third Quarter 2019 Conference Call for Wednesday, October 30 at 5:00 p.m. ET"
2019-10-10,Digimarc to Speak at HolyGrail 2.0 Circular Plastic Economy Event
2019-09-26,New Survey Reveals 80 Percent of Manufacturers Mislabel Products Annually
2019-09-19,When Will Digimarc Corporation (NASDAQ:DMRC) Come Back To Market?
2019-08-19,"Digimarc to Present at the 8th Annual Gateway Conference on September 4, 2019"
2019-08-08,Is Digimarc Corporation's (NASDAQ:DMRC) CEO Paid Enough Relative To Peers?
2019-07-31,"Digimarc to Present at the Oppenheimer 22nd Annual Technology, Internet & Communications Conference on August 7, 2019"
2019-07-31,Edited Transcript of DMRC earnings conference call or presentation 24-Jul-19 9:00pm GMT
2019-07-24,Digimarc Corp (DMRC) Q2 2019 Earnings Call Transcript
2019-07-24,Digimarc Reports Second Quarter 2019 Financial Results
2019-07-16,Adobe and Digimarc Advance the Fight Against Digital Piracy in Upcoming Webinar
2019-07-10,"Digimarc Sets Second Quarter 2019 Conference Call for Wednesday, July 24 at 5:00 p.m. ET"
2019-06-26,"Digimarc Corporation's (NASDAQ:DMRC) Earnings Dropped -19%, How Did It Fare Against The Industry?"
2019-06-07,Could The Digimarc Corporation (NASDAQ:DMRC) Ownership Structure Tell Us Something Useful?
2019-06-05,How Brands Develop Trust with Consumers
2019-05-29,Digimarc Barcode Scores High on Recycling
2019-05-29,Digimarc Barcode Scores High on Recycling
2019-05-20,"Digimarc to Host Business Update Presentation on Wednesday, May 29, 2019 at 1:00 p.m. ET"
2019-05-16,Digimarc to Present at the B. Riley FBR Investor Conference on May 22 and the Stifel 2019 Cross Sector Insight Conference on June 10
2019-05-06,Edited Transcript of DMRC earnings conference call or presentation 1-May-19 9:00pm GMT
2019-05-06,Digimarc Quality Management System Improvements Target Print Industry Professionals
2019-05-03,Stocks Still Angry at the Fed
2019-05-02,Shares of Beaverton-based Digimarc jump on Walmart contract
2019-05-02,"Why Alteryx, Digimarc, and Sprouts Farmers Market Jumped Today"
2019-05-02,Is Digimarc Corporation (NASDAQ:DMRC) A Volatile Stock?
2019-05-02,Why Digimarc Stock Skyrocketed Today
2019-05-01,"Digimarc (DMRC) Reports Q1 Loss, Tops Revenue Estimates"
2019-05-01,Digimarc: 1Q Earnings Snapshot
2019-05-01,Digimarc Reports First Quarter 2019 Financial Results
2019-04-30,Digimarc Aims to Reduce Food Waste and Provide Savings to Consumers with New Generation of Fresh Product Labels
2019-04-30,Digimarc Aims to Reduce Food Waste and Provide Savings to Consumers with New Generation of Fresh Product Labels
2019-04-29,Digimarc Showcases Latest Platform Innovations at Industry Events
2019-04-24,Digimarc (DMRC) May Report Negative Earnings: Know the Trend Ahead of Next Week's Release
2019-04-23,"Digimarc Supports International Recycling Initiatives, Explores Plastic Waste Sorting Challenges"
2019-04-18,Digimarc (DMRC) Moves to Strong Buy: Rationale Behind the Upgrade
2019-04-17,Will Digimarc (DMRC) Report Negative Q1 Earnings? What You Should Know
2019-04-17,"Digimarc Sets First Quarter 2019 Conference Call for Wednesday, May 1 at 5:00 p.m. ET"
2019-04-04,Moving Average Crossover Alert: Digimarc
2019-04-02,Stocks Jump More Than 1% to Begin the Second Quarter
2019-03-12,"Digimarc Unveils New, Faster Piracy Reporting Portal at London Book Fair"
2019-03-05,Digimarc Demonstrates Support for New GS1 Digital Link Standard
