2021-01-09,Bank OZK (NASDAQ:OZK) Could Be A Buy For Its Upcoming Dividend
2021-01-06,Bank OZK (OZK) Hikes Dividend: Is the Stock Worth Betting on?
2021-01-04,Bank OZK Announces Increased Regular Quarterly Dividend
2020-12-30,Bank OZK Announces Date for Fourth Quarter and Full Year 2020 Earnings Release and Conference Call
2020-12-24,5 Bank Stocks Set to Rebound With Vaccine-Driven Economic Recovery
2020-12-24,What Type Of Returns Would Bank OZK's(NASDAQ:OZK) Shareholders Have Earned If They Purchased Their SharesFive Years Ago?
2020-12-19,Is OZK A Good Stock To Buy According To Hedge Funds?
2020-12-15,"Bank OZK Names Jake Shapiro Managing Director, Digital Banking"
2020-11-21,Bank OZK (OZK) Up 15.4% Since Last Earnings Report: Can It Continue?
2020-11-19,Moving Average Crossover Alert: Bank OZK (OZK)
2020-11-11,Top Ranked Income Stocks to Buy for November 11th
2020-11-03,Bank OZK Lead Independent Director Peter Kenny Recognized as an NACD Board Leadership Fellow
2020-10-26,Bank OZK Names Terri Bunten Guthrie Division President for Metro Atlanta
2020-10-25,Bank OZK Just Beat Earnings Expectations: Here's What Analysts Think Will Happen Next
2020-10-23,Bank OZK (OZK) Q3 2020 Earnings Call Transcript
2020-10-23,"Bank OZK (OZK) Q3 Earnings Beat, Revenues & Expenses Rise"
2020-10-22,Bank OZK (OZK) Q3 Earnings and Revenues Surpass Estimates
2020-10-22,Bank OZK: Q3 Earnings Insights
2020-10-22,Bank OZK Third Quarter and First Nine Months of 2020 Management Comments
2020-10-22,Bank OZK Announces Third Quarter 2020 Earnings
2020-10-15,Earnings Preview: Bank OZK (OZK) Q3 Earnings Expected to Decline
2020-10-14,4 Bank Stocks Increasing Their Dividends
2020-10-06,Bank OZK Hikes Dividend: Is the Stock Worth Holding on to?
2020-10-05,Bank OZK (NASDAQ:OZK) Could Be A Buy For Its Upcoming Dividend
2020-10-01,Bank OZK Announces Increased Regular Quarterly Dividend
2020-09-30,Bank OZK Announces Date for Third Quarter 2020 Earnings Release and Conference Call
2020-09-25,How Much Is Bank OZK's (NASDAQ:OZK) CEO Getting Paid?
2020-09-25,Here's Why Bank OZK Stock is an Attractive Pick Right Now
2020-09-15,Loan Growth to Aid Bank OZK's (OZK) Top Line Amid Low Rates
2020-08-22,Bank OZK (OZK) Down 5.8% Since Last Earnings Report: Can It Rebound?
2020-07-27,Bank OZK Beat Analyst Estimates: See What The Consensus Is Forecasting For This Year
2020-07-24,Bank OZK (OZK) Q2 2020 Earnings Call Transcript
2020-07-24,Bank OZK (OZK) Beats on Q2 Earnings Despite Higher Provisions
2020-07-23,Bank OZK: Q2 Earnings Insights
2020-07-23,Bank OZK (OZK) Q2 Earnings and Revenues Surpass Estimates
2020-07-23,Bank OZK Second Quarter and First Six Months  of 2020 Management Comments
2020-07-23,Bank OZK Announces Second Quarter 2020 Earnings
2020-07-18,Did Hedge Funds Make The Right Call On Bank OZK (OZK) ?
2020-07-16,Bank OZK (OZK) Expected to Beat Earnings Estimates: Can the Stock Move Higher?
2020-07-16,Bank OZK (OZK) to Exit South Carolina by Selling 2 Branches
2020-07-15,Bank OZK Announces Sale of its South Carolina Branches
2020-07-02,"Bank OZK to Exit Alabama by Selling Branches, Hikes Dividend"
2020-07-01,Bank OZK Announces Sale of its Alabama Branches
2020-07-01,Bank OZK Announces Increased Regular Quarterly Dividend
2020-06-29,Bank OZK Announces Date for Second Quarter 2020 Earnings Release and Conference Call
2020-06-25,Forbes Names Bank OZK Best Bank in Georgia
2020-06-15,Hedge Funds Are Done Buying Bank OZK (OZK)?
2020-06-10,"Bank OZK Releases Inaugural Environmental, Social and Governance (ESG) Report"
2020-06-02,2 Strong Sell Banking Stocks with Massive Downside Potential
2020-05-27,Is Bank OZK (OZK) a Profitable Stock for Value Investors?
2020-05-23,Bank OZK (OZK) Up 18.3% Since Last Earnings Report: Can It Continue?
2020-05-21,These bank stocks trade at discounts of up to 54%  and Wall Street loves them
2020-05-18,"Bank OZK Contributes $220,000 to 25 Food Banks in Eight States"
2020-05-15,"Zacks Value Investor Highlights: JPMorgan, Wells Fargo, Comerica, PNC and Bank OZK"
2020-05-04,What Is Bank OZK's (NASDAQ:OZK) P/E Ratio After Its Share Price Rocketed?
2020-04-27,Earnings Miss: Bank OZK Missed EPS By 85% And Analysts Are Revising Their Forecasts
2020-04-24,Bank OZK to Host Earnings Call
2020-04-24,"Bank OZK (OZK) Q1 Earnings Lag Estimates, Revenues Decline Y/Y"
2020-04-23,Bank OZK (OZK) Lags Q1 Earnings Estimates
2020-04-23,Bank OZK First Quarter 2020 Management Comments
2020-04-23,Bank OZK Announces First Quarter 2020 Earnings
2020-04-23,"Tampa Bay bankers expect second round of PPP funding to dry up in 'days, not weeks'"
2020-04-17,Bank OZK Announces Virtual Participation and Location Change for 2020 Annual Meeting of Shareholders
2020-04-16,Analysts Estimate Bank OZK (OZK) to Report a Decline in Earnings: What to Look Out for
2020-04-07,Kaskela Law LLC Announces Stockholder Investigation of Bank OZK (OZK) and Encourages Long-Term OZK Stockholders to Contact the Firm
2020-04-04,"Bank OZK (NASDAQ:OZK) Looks Interesting, And It's About To Pay A Dividend"
2020-04-02,Bank OZK Announces Date for First Quarter 2020 Earnings Release and Conference Call
2020-04-02,Bank OZK Ups Dividend by 3.8%: Is the Stock Worth Betting on?
2020-04-01,Bank OZK Announces Increased Regular Quarterly Dividend
2020-03-27,Hedge Funds Have Never Been This Bullish On Bank OZK (OZK)
2020-03-27,A Sliding Share Price Has Us Looking At Bank OZK's (NASDAQ:OZK) P/E Ratio
2020-03-25,Broadwest development secures massive construction loan
2020-03-25,"Margin Pressure, High Costs Hurt Bank OZK: Time to Sell?"
2020-03-13,"How Does Bank OZK's (NASDAQ:OZK) P/E Compare To Its Industry, After The Share Price Drop?"
2020-02-26,Bank OZK to Present at the Raymond James 41st Annual Institutional Investors Conference
2020-02-25,Fifth Third (FITB) Rewards Investors With 12.5% Dividend Hike
2020-02-18,Did You Manage To Avoid Bank OZK's (NASDAQ:OZK) 49% Share Price Drop?
2020-02-15,Why Is Bank OZK (OZK) Down 8.8% Since Last Earnings Report?
2020-02-03,HP and Progressive Show Value and Momentum
2020-01-24,SVB Financial (SIVB) Q4 Earnings & Revenues Beat Estimates
2020-01-24,"Associated Banc-Corp (ASB) Q4 Earnings Beat, Revenues Down"
2020-01-19,Bank OZK Just Released Its Annual Earnings: Here's What Analysts Think
2020-01-17,"Bank OZK (OZK) Q4 Earnings Beat Estimates, Provisions Down"
2020-01-16,Bank OZK (OZK) Surpasses Q4 Earnings and Revenue Estimates
2020-01-16,Bank OZK Fourth Quarter and Full Year 2019 Management Comments
2020-01-16,Bank OZK Announces Fourth Quarter and Record Full Year 2019 Earnings
2020-01-15,5 Bellwether Earnings Charts to Watch This Week
2020-01-10,Popular (BPOP) Announces Capital Deployment Plan for 2020
2020-01-09,Analysts Estimate Bank OZK (OZK) to Report a Decline in Earnings: What to Look Out for
2020-01-09,Does Bank OZK (NASDAQ:OZK) Have A Particularly Volatile Share Price?
2020-01-08,Top Picks 2020- Bank OZK OZK
2020-01-06,15 storylines to watch in the '20s: Banking consolidation
2020-01-03,Bank OZK Announces 4% Dividend Hike: Is it Worth a Look?
2020-01-02,Bank OZK Announces Increased Regular Quarterly Dividend
2019-12-30,Bank OZK Promotes Carmen McClennon to Chief Retail Banking Officer
2019-12-27,Bank OZK Announces Date for Fourth Quarter and Full Year 2019 Earnings Release and Conference Call
2019-12-27,6 Stocks Trading at Discounted Prices
2019-12-27,3 Market-Beating Bank Stocks That Might Lose Steam in 2020
2019-12-18,Money names Bank OZK Best Bank in the South
2019-12-12,Franklin (BEN) Rewards Shareholders With 4% Dividend Hike
