2021-01-07,Ex-Dividend Date Insight: Universal
2020-12-30,25 Tallest Rollercoasters in the World
2020-12-22,Here Are 8 Promising Small-Cap Stocks That Offer Income
2020-12-17,What Can We Conclude About Universal's (NYSE:UVV) CEO Pay?
2020-12-11,Income Investors Should Consider These 3 Tobacco Stocks
2020-12-11,Is UVV A Good Stock To Buy Now?
2020-11-16,10 Most Profitable Movies of All Time
2020-11-11,What are the highest-grossing movie franchises?
2020-11-11,How Much Did Universal's(NYSE:UVV) Shareholders Earn From Share Price Movements Over The Last Three Years?
2020-11-06,Universal Corp (UVV) Q2 2021 Earnings Call Transcript
2020-11-05,Universal Corporation Reports Six Month Results
2020-11-05,Universal Corporation Announces Quarterly Dividend and Share Repurchase Program
2020-10-26,Universal Corporation Announces Conference Call
2020-10-03,It Might Not Be A Great Idea To Buy Universal Corporation (NYSE:UVV) For Its Next Dividend
2020-10-01,Universal Corporation Completes Acquisition of Silva International
2020-09-22,Top Tobacco Stocks for Q4 2020
2020-09-22,Top Tobacco Stocks for Q4 2020
2020-09-08,What Kind Of Shareholders Own Universal Corporation (NYSE:UVV)?
2020-09-08,"Universal Corporation to Acquire Silva International, a Market-Leading Provider of Natural, Specialty Dehydrated Vegetable, Fruit and Herb Ingredients"
2020-08-07,Universal Corporation Obtains U.S. Customs Modification for Malawi Tobacco
2020-08-05,Universal Corporation Reports First Quarter Results
2020-08-05,Universal Corporation Announces Quarterly Dividend
2020-07-29,Universal Corporation Announces Conference Call
2020-07-08,Tobacco Stocks Rise Amid IQOS Decision
2020-06-25,Hedge Funds Are Falling Out Of Love With Universal Corp (UVV)
2020-06-23,Edited Transcript of UVV.N earnings conference call or presentation 27-May-20 9:00pm GMT
2020-05-27,Universal Corporation Reports Annual Results
2020-05-27,Universal Corporation Announces 50th Annual Dividend Increase and Sets Annual Meeting Date
2020-05-19,Universal Corporation Announces Conference Call
2020-05-04,Is Universal Corporation (NYSE:UVV) A Risky Dividend Stock?
2020-04-29,Trolls World Tour grosses nearly $100 million on demand  biggest digital movie debut ever
2020-04-04,Why It Might Not Make Sense To Buy Universal Corporation (NYSE:UVV) For Its Upcoming Dividend
2020-03-31,"Universal Corporation Appoints J. Patrick O'Keefe as Senior Vice President of Universal Global Ventures, Inc."
2020-03-19,Where Universal Corporation's (NYSE:UVV) Earnings Growth Stands Against Its Industry
2020-02-24,Tobacco Stocks Gain Amid Heat-Not-Burn Product Growth
2020-02-18,Is Universal Corporation (NYSE:UVV) Investing Your Capital Efficiently?
2020-02-08,Edited Transcript of UVV earnings conference call or presentation 4-Feb-20 10:00pm GMT
2020-02-04,Universal Corporation Appoints Jacqueline T. Williams to Board of Directors
2020-02-04,Universal Corporation Reports Nine Month Results
2020-02-04,Universal Corporation Announces Quarterly Dividend
2020-01-24,Universal Corporation Announces Conference Call
2020-01-20,Calculating The Fair Value Of Universal Corporation (NYSE:UVV)
2020-01-16,Universal Pictures Dolittle draws brutal reviews
2020-01-03,Universal Corporation Completes Acquisition of FruitSmart
2019-12-20,How Should Investors Feel About Universal Corporation's (NYSE:UVV) CEO Pay?
2019-12-19,Were Hedge Funds Right About Souring On Universal Corp (UVV)?
2019-12-12,"A Better Dividend Stock Than Exxon Mobil, Altria, Universal and National Fuel"
2019-12-02,Edited Transcript of UVV earnings conference call or presentation 12-Nov-19 1:30pm GMT
2019-11-23,Should We Worry About Universal Corporation's (NYSE:UVV) P/E Ratio?
2019-11-20,Tobacco merchant Universal Corp. to buy fruit supplier FruitSmart
2019-11-20,"Universal Corporation to Acquire FruitSmart, a Premier Fruit and Vegetable Processor and Supplier"
2019-11-12,Universal Corporation Reports Six Month Results
2019-11-12,Universal Corporation Announces Quarterly Dividend
2019-11-11,Trump to meet with vaping industry officials
2019-11-01,Universal Corporation Announces Conference Call
2019-10-26,Hedge Funds Have Never Been This Bullish On Universal Corporation (UVV)
2019-10-24,Universal (NYSE:UVV) Shareholders Have Enjoyed A 28% Share Price Gain
2019-09-29,4 Days To Buy Universal Corporation (NYSE:UVV) Before The Ex-Dividend Date
2019-09-26,"Juul should be 'ashamed' of role in vaping epidemic, congresswoman says"
2019-09-11,Trump admin. considers ban on flavored e-cigarettes
2019-09-09,3 Top Tobacco Stocks Still Burning Strong
2019-09-09,Universal Corporation (NYSE:UVV) Is Yielding 5.9% - But Is It A Buy?
2019-08-30,Edited Transcript of UVV earnings conference call or presentation 7-Aug-19 9:00pm GMT
2019-08-22,Why Were Not Impressed By Universal Corporations (NYSE:UVV) 9.6% ROCE
2019-08-07,Universal Corporation Reports First Quarter Results
2019-08-07,Universal Corporation Announces Quarterly Dividend
2019-08-06,Calculating The Fair Value Of Universal Corporation (NYSE:UVV)
2019-07-30,Universal Corporation Announces Conference Call
2019-07-22,"How Many Universal Corporation (NYSE:UVV) Shares Have Insiders Sold, In The Last Year?"
2019-07-12,This little-known tobacco stock is a big winner from e-cigarette bans
2019-07-05,Hedge Funds Have Never Been More Bullish On Universal Corp (UVV)
2019-07-03,Does Universal Corporation's (NYSE:UVV) CEO Pay Compare Well With Peers?
2019-06-25,3 Tobacco Stocks Quietly Rising
2019-06-21,Universal Corporation Updates Record Date and Annual Meeting Date
2019-06-04,Edited Transcript of UVV earnings conference call or presentation 22-May-19 9:00pm GMT
2019-05-31,How Has Universal Corporation's (NYSE:UVV) Performed Against The Industry?
2019-05-24,"Universal Corp (UVV) Files 10-K for the Fiscal Year Ended on March 31, 2019"
2019-05-23,"Why L Brands, Universal, and Maxar Technologies Jumped Today"
2019-05-22,Universal Corp.: Fiscal 4Q Earnings Snapshot
2019-05-13,Universal Corporation Announces Conference Call
2019-05-08,Universal Corporation (NYSE:UVV) Has Attractive Fundamentals
2019-05-03,Heres What Hedge Funds Think About Universal Corp (UVV)
2019-04-15,Do You Know What Universal Corporation's (NYSE:UVV) P/E Ratio Means?
2019-03-26,Could Universal Corporation's (NYSE:UVV) Investor Composition Influence The Stock Price?
2019-03-07,Is Universal Corporation (NYSE:UVV) A Smart Choice For Dividend Investors?
2019-02-17,Read This Before Judging Universal Corporations (NYSE:UVV) ROE
2019-02-12,"New Research: Key Drivers of Growth for ON Semiconductor, Entegris, Universal, MarineMax, Epizyme, and Merrimack Pharmaceuticals  Factors of Influence, Major Initiatives and Sustained Production"
2019-02-11,Edited Transcript of UVV earnings conference call or presentation 7-Feb-19 10:00pm GMT
2019-02-07,Universal Corp.: Fiscal 3Q Earnings Snapshot
2019-02-07,Universal Corporation Reports Nine Month Results
2019-02-07,Universal Corporation Announces Quarterly Dividend
2019-02-06,Universal Corporation Announces Agreement with Philip Morris International Inc. to Supply Philippine Tobaccos
2019-01-31,Universal Corporation Announces Conference Call
2019-01-27,"Before You Buy Universal Corporation (NYSE:UVV), Consider Its Volatility"
2019-01-01,Need To Know: Universal Corporation (NYSE:UVV) Insiders Have Been Selling Shares
2018-12-04,"News on the move: Government plans to sentence Michael Flynn, Prince music to star in new film by Universal"
2018-11-29,Is Universal Corporations (NYSE:UVV) CEO Salary Justified?
2018-11-13,Edited Transcript of UVV earnings conference call or presentation 8-Nov-18 10:00pm GMT
2018-11-12,Hedge Fund Sentiment Continues to Swell Behind Universal Corp (UVV)
2018-11-08,Universal Corp.: Fiscal 2Q Earnings Snapshot
