2021-01-11,EBay (EBAY) Dips More Than Broader Markets: What You Should Know
2021-01-08,Jack Ma Hasnt Been Seen for Months. Thats Reason Enough to Be Wary of Alibaba Stock.
2021-01-08,Harry Potter and Michael Bublé fuel UK online reselling boom
2021-01-08,Can eBay (EBAY) Keep the Earnings Surprise Streak Alive?
2021-01-08,Roku Buys Quibis Library to Boost Free Streaming Service
2021-01-07,Why PayPal Stock Climbed 116% in 2020
2021-01-07,2 Value Stocks to Buy With Your $600 Stimulus Check That Can Make You Rich
2021-01-05,EBay (EBAY) Outpaces Stock Market Gains: What You Should Know
2021-01-05,eBay's Debt Overview
2020-12-31,PayPal (PYPL) Closing Out Historic Year
2020-12-31,The Five Worst PR Disasters of 2020
2020-12-30,Here's How Solving a Customer Pain Point Became a Multi-Billion Dollar Business
2020-12-30,What Happened to eBay Stock in 2020?
2020-12-29,EBay (EBAY) Gains As Market Dips: What You Should Know
2020-12-23,Poshmark IPO: 5 things to know about the online marketplace before it goes public
2020-12-22,EBay (EBAY) Gains As Market Dips: What You Should Know
2020-12-22,eBay and Anthony Davis Surprise Sneakerheads with Last Minute Christmas Drop
2020-12-21,Top Consumer Discretionary Stocks for January 2021
2020-12-18,"Already Profitable, Apparel Marketplace Poshmark Files for IPO"
2020-12-17,BarkBox Has More Than a Million Subscribers. Now Its Going Public Via a SPAC.
2020-12-16,Retailer Wish Drops in Trading Debut After IPO Spree
2020-12-16,"Dow Slips, but Stimulus Progress Feeds Risk Appetite"
2020-12-16,"Dow Flat on Retail Sales Miss, But Stimulus Progress, Fed Offer Hope"
2020-12-16,'An online buy left our home destroyed by fire'
2020-12-15,Several U.S. tech firms launch coalition to promote key internet law
2020-12-14,EBay (EBAY) Gains As Market Dips: What You Should Know
2020-12-14,Facebook Investors Don't Need to Fear a Breakup
2020-12-14,Did You Miss eBay's (NASDAQ:EBAY) 79% Share Price Gain?
2020-12-10,Shopify Is The Poster Child Of New E-Commerce
2020-12-10,"Forget eBay, Amazon Is a Better E-Commerce Stock"
2020-12-08,New Orders of Apples $550 Headphones Wont Arrive for Christmas
2020-12-08,EBay (EBAY) Stock Sinks As Market Gains: What You Should Know
2020-12-08,Is EBAY A Good Stock To Buy Heading Into 2021?
2020-12-08,eBay Introduces More Affordable Shipping Solution for Selling Trading Cards $20 and Under
2020-12-07,A Look Into eBay's Price Over Earnings
2020-12-07,Looking Into eBay's Return On Capital Employed
2020-12-06,"Second-Largest U.S. Pension Bought PG&E, Slack, D.R. Horton, and EBay Stock"
2020-12-04,Novembers Jobs Report Was Disappointing. Decembers Could Be Worse
2020-12-04,Maxim Truck & Trailer Donates $100K to Harvest Manitoba
2020-12-02,EBay (EBAY) Outpaces Stock Market Gains: What You Should Know
2020-12-01,eBay Names Julie Loeger Global Chief Growth Officer
2020-11-30,Is eBay Stock a Buy?
2020-11-30,3 Pandemic Rallying Stocks I'd Buy Right Now
2020-11-29,"Forget eBay, Shopify Is a Better E-Commerce Stock"
2020-11-28,"New PlayStation No-Nos: Profane Tweets, Rogue PS Plus Collection Deals, Scammer eBay Photos"
2020-11-25,A $100 Billion Valuation Poses Risk For Fintech Star
2020-11-25,How Does eBay's Debt Look?
2020-11-25,eBay's Seller-Poaching Allegations Against Amazon Get Dismissed By Arbitration Panel
2020-11-24,Why Ford Stock Is Roaring Higher Today
2020-11-23,7 Most Profitable Businesses With Least Investment in 2020
2020-11-23,10 Best Selling Products Online in 2020
2020-11-23,"eBay Launches ""Up & Running Grants"" to Set Small Business Sellers Up for Success in 2021"
2020-11-21,Shopify Sees Paradigm Shift as Black Friday Approaches
2020-11-20,EBay Holds First Drive-Thru Luxury Authentication in L.A.
2020-11-20,eBay Lights Up a Virtual Holiday Market to Bring Unique Gifts from Small Businesses to Shoppers at Home
2020-11-20,eBay Opens First-Ever Drive-Thru 'Authentication Station' in LA
2020-11-19,"eBay and Optoro Announce Exclusive Partnership to Streamline Resale of Returned & Excess Inventory, Support eBay Seller Community"
2020-11-18,7 Most Profitable Etsy Shops in 2020
2020-11-18,The 4 Largest E-Commerce Stocks in 2020
2020-11-18,"MercadoLibre, Bill.com, and Green Dot: 3Q Earnings Rundown"
2020-11-16,Elliott exits AT&T after waging a fight in 2019; Starboard exits eBay
2020-11-16,Elliott exits AT&T after waging a fight in 2019; Starboard exits eBay
2020-11-16,Buy This Stock Before Another Market Rally
2020-11-16,15 Largest Ecommerce Companies in the World
2020-11-16,"Activist Hedge Fund Starboard Value Offloads eBay, Buys Corteva"
2020-11-13,Where Will MercadoLibre Be in 5 Years?
2020-11-13,LinkedIn Co-founder: the number of tech giants will double in 5 years
2020-11-12,eBay's Nike Air Jordan Auction Is Part of a Bigger Goal
2020-11-12,Trumps refusal to concede hurts the economy: LinkedIn Co-Founder
2020-11-12,Sony Kicks Off Crucial Product Cycle with PlayStation 5 Launch
2020-11-12,Influencers with Andy Serwer: Reid Hoffman
2020-11-11,Tesla No. 1 in Survey of Most Attractive Companies for Engineering Students
2020-11-10,A Covid Vaccine Doesnt Mean the Beginning of the End for Digital-Payments Stocks. Heres Why.
2020-11-05,Here's Why Wayfair Stock Is Soaring Today
2020-11-05,Don't Dismiss This Weird Business eBay Is Embracing
2020-11-04,Why eBay Is Targeting the Used and Refurbished Markets
2020-11-04,Why Etsy Stock Is Down After Reporting Robust Growth
2020-11-04,3 E-Commerce Stocks That Had a Record Year and Are Just Getting Started
2020-11-03,PayPals Earnings Disappointed Investors. It Looks Like a Buying Opportunity.
2020-11-03,Return On Capital Employed Overview: eBay
2020-11-03,eBay Earnings: Another Profitability Spike
2020-11-03,Prosus Finally Admits the Obvious; Will Buy Back Shares at Half Price
2020-11-03,PayPal Holdings (PYPL) Q3 2020 Earnings Call Transcript
2020-11-02,"Here's How Much Investing $1,000 In PayPal's 2015 Spinoff Would Be Worth Today"
2020-10-30,Automatic Data Processing Stock Looks Like a Winner
2020-10-30,3 Stocks for Beginners to Put Their Trust In
2020-10-30,eBay Inc. Just Beat Earnings Expectations: Here's What Analysts Think Will Happen Next
2020-10-30,Prosus Targets $5 Billion Buyback in Plan to Cut Tencent Gap
2020-10-29,Ex-eBay employees admit to cyber stalking campaign targeting couple
2020-10-29,EBay Stock Is Plunging Despite Earnings Beat. Why Some Analysts Say Buy the Dip.
2020-10-29,Why eBay Is Falling Today
2020-10-29,"eBay (EBAY) Q3 Earnings Beat Estimates, Revenues Rise Y/Y"
2020-10-29,Ebay Shares Drop on Analyst Remarks About Guidance
2020-10-29,Analyzing eBay's Unusual Options Activity
2020-10-29,EBay Stock Is Dropping After an Earnings Miss. Why Results Were Better Than They Looked.
2020-10-29,Sonys PlayStation 5 Is Beating Xbox in the Online Black Market
2020-10-29,Wall Street Opens Mixed as Market Looks Through Q3 GDP Surge; Dow Flat
2020-10-28,eBay Inc (EBAY) Q3 2020 Earnings Call Transcript
2020-10-28,Alibabas Co-Founder Lucy Peng to Get $5 Billion Richer on Ant IPO
2020-10-28,"EBay Growth Ebbs, Sparking Concern Pandemic Boost Is Over"
