2020-12-10,Is ALX A Good Stock To Buy Now?
2020-11-05,New Strong Sell Stocks for November 5th
2020-11-05,Ex-Dividend Date Insight: Alexander's
2020-11-02,Alexander's (ALX) Q3 FFO and Revenues Miss Estimates
2020-11-02,Alexanders Announces Third Quarter Financial Results
2020-10-28,Alexanders Declares Quarterly $4.50 Dividend on Common Shares
2020-10-26,Alexanders Completes $94 Million Financing of a Residential Building
2020-10-26,"Is Alexander's, Inc. (NYSE:ALX) A High Quality Stock To Own?"
2020-10-16,"Vornado Realty L.P. -- Moody's confirms Vornado Realty's Baa2 senior unsecured rating, outlook is negative"
2020-10-15,Alexanders Announces Vornado Realty Trust Quarterly Conference Call
2020-09-14,Alexanders Amends Retail Loan at 731 Lexington Avenue
2020-08-03,Alexanders Announces Second Quarter Financial Results
2020-07-29,Alexanders Declares Quarterly $4.50 Dividend on Common Shares
2020-07-28,Would Shareholders Who Purchased Alexander's'(NYSE:ALX) Stock Three Years Be Happy With The Share price Today?
2020-07-15,Vornado Realty Trust -- Moody's has placed Vornado Realty's Baa2 debt rating on review for downgrade
2020-07-14,Alexanders Announces Vornado Realty Trust  Quarterly Conference Call
2020-07-13,"If You Own Alexanders (ALX) Stock, Should You Sell It Now?"
2020-07-13,3 Low Shiller Price-Earnings Ratio Picks
2020-06-22,"Hedge Funds Are Dumping Alexanders, Inc. (ALX)"
2020-05-04,Alexanders Announces First Quarter Financial Results
2020-05-01,Alexanders Announces Virtual 2020 Annual Meeting of Stockholders
2020-04-29,Alexanders Declares Quarterly $4.50 Dividend on Common Shares
2020-04-19,"Can Alexander's, Inc.'s (NYSE:ALX) ROE Continue To Surpass The Industry Average?"
2020-04-15,Alexanders Announces Vornado Realty Trust Quarterly Conference Call
2020-04-15,"Hedge Funds Have Never Been This Bullish On Alexanders, Inc. (ALX)"
2020-02-19,Volatility 101: Should Alexander's (NYSE:ALX) Shares Have Dropped 28%?
2020-02-18,Alexanders Announces Fourth Quarter Financial Results
2020-01-29,Alexanders Announces Vornado Realty Trust Quarterly Conference Call
2020-01-15,Alexanders Declares Quarterly $4.50 Dividend on Common Shares
2019-12-21,"How Much Did Alexander's, Inc.'s (NYSE:ALX) CEO Pocket Last Year?"
2019-12-14,"Hedge Funds Have Never Been This Bullish On Alexanders, Inc. (ALX)"
2019-10-28,Alexanders Announces Third Quarter Financial Results
2019-10-24,Alexanders Declares Quarterly $4.50 Dividend on Common Shares
2019-10-22,"Can Alexander's, Inc.'s (NYSE:ALX) ROE Continue To Surpass The Industry Average?"
2019-10-16,Alexanders Announces Vornado Realty Trust Quarterly Conference Call
2019-09-24,"Alexander's Leases 112,500 Square Feet to IKEA at its Rego Park I Shopping Center"
2019-09-04,"Is Alexander's, Inc. (NYSE:ALX) A Good Dividend Stock?"
2019-07-30,Alexander's Inc. (ALX) Q2 2019 Earnings Call Transcript
2019-07-29,Alexanders Announces Second Quarter Financial Results
2019-07-29,"Here's Why We're Wary Of Buying Alexander's, Inc.'s (NYSE:ALX) For Its Upcoming Dividend"
2019-07-24,Alexanders Declares Quarterly $4.50 Dividend on Common Shares
2019-07-16,Alexanders Announces Vornado Realty Trust Quarterly Conference Call
2019-07-15,Did You Manage To Avoid Alexander's's (NYSE:ALX) 10% Share Price Drop?
2019-05-17,"You May Have Been Looking At Alexander's, Inc. (NYSE:ALX) All Wrong"
2019-05-02,"Heres What Hedge Funds Think About About Alexanders, Inc. (ALX)"
2019-05-01,Alexander's Inc. (ALX) Q1 2019 Earnings Call Transcript
2019-04-29,Alexander's: 1Q Earnings Snapshot
2019-04-29,Alexanders Announces First Quarter Financial Results
2019-04-24,Alexander's Declares Quarterly $4.50 Dividend on Common Shares
2019-04-17,Alexanders Announces Vornado Realty Trust Quarterly Conference Call
2019-04-09,"Why Alexander's, Inc. (NYSE:ALX) Looks Like A Quality Company"
2019-02-12,Edited Transcript of ALX earnings conference call or presentation 12-Feb-19 3:00pm GMT
2019-02-11,Alexander's: 4Q Earnings Snapshot
2019-02-11,Alexanders Announces Fourth Quarter Financial Results
2019-01-24,Alexanders Announces Vornado Realty Trust Quarterly Conference Call
2019-01-16,Alexanders Declares Quarterly $4.50 Dividend on Common Shares
2018-12-14,Alexanders Completes $252.5 Million Refinancing of Rego Park II
2018-11-29,"Detailed Research: Economic Perspectives on American Tower Corporation (REIT), Ligand Pharmaceuticals, Teva Pharmaceutical Industries, Cummins, Alexander's, and Korea Electric Power  What Drives Growth in Today's Competitive Landscape"
2018-10-30,Is Alexanders Incs (NYSE:ALX) CEO Paid Enough Relative To Peers?
2018-10-29,Alexander's: 3Q Earnings Snapshot
2018-10-29,Alexanders Announces Third Quarter Financial Results
2018-10-29,You May Have Been Looking At Alexanders Inc (NYSE:ALX) All Wrong
2018-10-24,Alexanders Declares Quarterly $4.50 Dividend on Common Shares
2018-10-19,"Research Report Identifies Loxo Oncology, Atrion, Alexander's, Broadridge Financial Solutions, International Flavors & Fragrances, and Conagra Brands with Renewed Outlook  Fundamental Analysis, Calculating Forward Movement"
2018-10-16,Alexanders Announces Vornado Realty Trust Quarterly Conference Call
2018-10-11,Did Alexanders Inc (NYSE:ALX) Create Value For Shareholders?
2018-07-30,Alexanders Announces Second Quarter Financial Results
2018-07-25,Alexanders Declares Quarterly $4.50 Dividend on Common Shares
2018-07-16,Alexanders Announces Vornado Realty Trust Quarterly Conference Call
2018-07-05,[$$] Years & Years: Palo Santo  coherent listening experience
2018-05-24,"Recent Analysis Shows Alexander's, American National Insurance, VAREX IMAGING, Banner, Instructure, and Heska Market Influences  Renewed Outlook, Key Drivers of Growth"
2018-05-23,Free Post Earnings Research Report: Simon Property's Revenues Grew 4%; FFO Climbed 5%
2018-04-30,Interested In Alexanders Inc (NYSE:ALX)s Upcoming $4.5 Dividend? You Have 3 Days Left
2018-04-30,Alexanders Announces First Quarter Results
2018-04-30,Alexander's: 1Q Earnings Snapshot
2018-04-25,Alexanders Declares Quarterly $4.50 Dividend on Common Shares
2018-04-19,Alexanders Announces Vornado Realty Trust Quarterly Conference Call
2018-04-02,"New Research Coverage Highlights TOCAGEN INC, Acer Therapeutics, DMC Global, The Providence Service, WEX, and Alexander's  Consolidated Revenues, Company Growth, and Expectations for 2018"
2018-02-12,Alexander's reports 4Q results
2018-02-12,Alexanders Announces Fourth Quarter Results
2018-02-01,"Market Trends Toward New Normal in Alexander's, Atrion, FS, Gilead Sciences, Abbott Laboratories, and Johnson & Johnson  Emerging Consolidated Expectations, Analyst Ratings"
2018-01-29,Alexanders Announces Vornado Realty Trust Quarterly Conference Call
2018-01-24,"EX-Dividend Schedule: Alexander's Raised its Dividend by 6%; Will Trade Ex-Dividend on January 26, 2018"
2018-01-09,See what the IHS Markit Score report has to say about Alexander's Inc.
2018-01-01,See what the IHS Markit Score report has to say about Alexander's Inc.
2017-12-21,See what the IHS Markit Score report has to say about Alexander's Inc.
2017-12-12,"ETFs with exposure to Alexanders, Inc. : December 12, 2017"
2017-12-08,See what the IHS Markit Score report has to say about Alexander's Inc.
2017-11-30,See what the IHS Markit Score report has to say about Alexander's Inc.
2017-11-28,See what the IHS Markit Score report has to say about Alexander's Inc.
2017-11-27,"Alexanders, Inc. breached its 50 day moving average in a Bullish Manner : ALX-US : November 27, 2017"
2017-11-16,Earnings Review and Free Research Report: Kimcos Revenue Grew 3.4%; NAREIT FFO More than Doubled
2017-11-15,Featured Company News - Whitestone Executes Three New Tenant Leases at its Mercado at Scottsdale Ranch Property in Arizona
2017-11-13,See what the IHS Markit Score report has to say about Alexander's Inc.
2017-11-10,See what the IHS Markit Score report has to say about Alexander's Inc.
2017-11-07,"Alexanders, Inc. : ALX-US: Dividend Analysis : November 06th, 2017 (record date) : By the numbers : November 7, 2017"
2017-10-30,Alexander's reports 3Q results
2017-10-30,Alexanders Announces Third Quarter Results
2017-10-25,Alexanders Declares Quarterly $4.25 Dividend on Common Shares
2017-10-24,"Alexanders, Inc. breached its 50 day moving average in a Bearish Manner : ALX-US : October 24, 2017"
