2021-01-08,Why Cracker Barrel Old Country Store's Shares Popped 11.2% in 2020
2020-12-17,4 Restaurant Stocks to Buy That Will Thrive After the Pandemic
2020-12-15,Here's How Darden (DRI) Looks Just Ahead of Q2 Earnings
2020-12-14,Cracker Barrel Old Country Store® Announces CFO Retirement
2020-12-10,Top Restaurant Stocks for Q1 2021
2020-12-09,Here's Why Investors Should Retain Cracker Barrel (CBRL) Now
2020-12-09,Cracker Barrel Investors Really Don't Want What This Activist Investor is Selling
2020-12-08,2 Top Restaurant Stocks to Buy in December
2020-12-04,Cracker Barrel (CBRL) Stock up as Q1 Earnings Beat Estimates
2020-12-03,Cracker Barrel Old Country Store Inc (CBRL) Q1 2021 Earnings Call Transcript
2020-12-03,Cracker Barrel Old Country Store (CBRL) Beats Q1 Earnings and Revenue Estimates
2020-12-03,Cracker Barrel: Q1 Earnings Insights
2020-12-03,Cracker Barrel Reports First Quarter Fiscal 2021 Results
2020-12-02,Here's Why Investors Should Hold on to Wendy's (WEN) Stock
2020-12-02,Jack in the Box (JACK) Rides on Robust Comps & Digitalization
2020-12-02,Earnings Outlook For Cracker Barrel Old
2020-12-02,"Carrie Underwood, Maddie & Tae, and Runaway June To Appear in 'Cracker Barrel Sounds of the Season' Holiday Feature"
2020-12-02,Why Earnings Season Could Be Great for Cracker Barrel (CBRL)
2020-11-26,Cracker Barrel Old Country Store (CBRL) Expected to Beat Earnings Estimates: Can the Stock Move Higher?
2020-11-26,"Red Robin Gourmet (RRBG) Outruns Peers, Soars 118% in 3 Months"
2020-11-20,Cracker Barrel Fiscal 2021 First Quarter Conference Call On The Internet
2020-11-19,Can Cracker Barrel (CBRL) Run Higher on Rising Earnings Estimates?
2020-11-19,Cracker Barrel (CBRL) Upgraded to Buy: Here's Why
2020-11-19,Cracker Barrel Shareholders Overwhelmingly Support All Company Director Nominees At Annual Meeting Per Preliminary Results
2020-11-19,Cracker Barrel Shareholders Demand Change At Annual Meeting
2020-11-17,Cracker Barrel Old Country Store (CBRL) Expected to Beat Earnings Estimates: Can the Stock Move Higher?
2020-11-16,Biglari Capital Corp. Issues Statement On Why It Is Urgent To Add An Independent Nominee To Cracker Barrel Board Of Directors
2020-11-13,"How Much Is Cracker Barrel Old Country Store, Inc. (NASDAQ:CBRL) Paying Its CEO?"
2020-11-11,Cracker Barrel Old Country Store® Teams up with Global Superstar Dolly Parton to Give Away Ultimate VIP Macy's Thanksgiving Day Parade® Viewing Experience
2020-11-10,Glass Lewis Recommends Shareholders Vote for ALL of Cracker Barrel Old Country Store's Highly Qualified Directors
2020-11-09,On the M&A Takeout Menu: Small and Mid-Size Restaurants
2020-11-09,"ISS Calls for Addition of ""Relevant Restaurant Expertise"" to Board of Directors of Cracker Barrel Old Country Store, Inc."
2020-11-09,Leading Independent Proxy Advisory Firm ISS Recommends Cracker Barrel Shareholders Vote the Company's WHITE Proxy Card
2020-11-06,Cracker Barrel (CBRL) Preliminary Q1 Results Show Sales Recovery
2020-11-05,Cracker Barrel Announces Preliminary First Quarter Fiscal 2021 Results
2020-11-05,"Biglari Capital Corp. Issues Letter To Shareholders Of Cracker Barrel Old Country Store, Inc."
2020-11-02,Cracker Barrel Old Country Store Offers New Options to Enjoy Thanksgiving Traditions Safely
2020-10-27,Cracker Barrel Old Country Store® Kicks Off Military Family Appreciation Month by Honoring Those Who Have Served
2020-10-26,Cracker Barrel Old Country Store® Sends Second Letter to Shareholders
2020-10-20,Cracker Barrel Old Country Store Celebrates the Gift of Shared Traditions this Holiday Season
2020-10-18,"Is Cracker Barrel Old Country Store, Inc. (NASDAQ:CBRL) Popular Amongst Institutions?"
2020-10-15,Cracker Barrel (CBRL) Down 5.6% Since Last Earnings Report: Can It Rebound?
2020-10-13,"Cramer Gives His Opinion On Wingstop, Cracker Barrel And More"
2020-10-12,3 Top Restaurant Stocks to Watch in October
2020-10-08,"Biglari Capital Corp. Issues Letter To Shareholders Of Cracker Barrel Old Country Store, Inc."
2020-10-06,"Cracker Barrel Old Country Store, Inc. (CBRL): Hedge Funds Taking Some Chips Off The Table"
2020-10-01,Cracker Barrel Old Country Store® Files Definitive Proxy and Sends Letter to Shareholders
2020-09-22,"Is Cracker Barrel Old Country Store, Inc. (NASDAQ:CBRL) Potentially Undervalued?"
2020-09-18,Scientific Games and Cracker Barrel See Activist Action
2020-09-16,"With Only 100 Days Left Until Christmas, Cracker Barrel Old Country Store Kicks Off the Holiday Season with Real and Virtual Decorations"
2020-09-16,Cracker Barrel (CBRL) Post Wider-Than-Expected Loss in Q4
2020-09-15,"Market Digest: AAPL, CBRL, AVB"
2020-09-15,Analyst Report: Cracker Barrel Old Country Sto
2020-09-15,Cracker Barrel Old Country Store Inc (CBRL) Q4 2020 Earnings Call Transcript
2020-09-15,"Cracker Barrel Old Country Store (CBRL) Reports Q4 Loss, Tops Revenue Estimates"
2020-09-15,"Biglari Capital Corp. Issues Letter To Shareholders Of Cracker Barrel Old Country Store, Inc."
2020-09-15,Recap: Cracker Barrel Q4 Earnings
2020-09-15,Cracker Barrel Reports Fourth Quarter And Full Year Fiscal 2020 Results
2020-09-14,Cracker Barrel Old Country Store® Elects Gisel Ruiz to Board of Directors
2020-09-14,Preview: Cracker Barrel Old's Earnings
2020-09-14,Cracker Barrel (CBRL) to Post Q4 Earnings: What's in Store?
2020-09-11,"Kiplinger's Weekly Earnings Calendar (9/14-9/18): ADBE, FDX, LEN"
2020-09-03,Cracker Barrel (CBRL) Down 11% YTD: What's Hurting the Stock?
2020-09-02,Biglari Holdings Still Has a Lot to Prove
2020-09-01,Cracker Barrel Fiscal 2020 Fourth Quarter Conference Call On The Internet
2020-08-26,Cracker Barrel is getting boozy and analysts say millennials will come for the mimosas
2020-08-26,Cracker Barrel (CBRL) Enhances Menu to Attract Customers
2020-08-25,Cracker Barrel Old Country Store Offers 'Homestyle Comfort' with Menu Enhancements to Kick Off Fall Season
2020-08-19,8 Cheap Restaurant Stocks That Are Worth the Risk
2020-08-17,"Calculating The Fair Value Of Cracker Barrel Old Country Store, Inc. (NASDAQ:CBRL)"
2020-08-04,"Cracker Barrel Old Country Store Launches Simplified Menu Offering New Signature, Craveable Dinner Classics"
2020-07-18,Is Cracker Barrel Stock a Buy?
2020-07-17,"Did Hedge Funds Make The Right Call On Cracker Barrel Old Country Store, Inc. (CBRL)?"
2020-07-14,Has Cracker Barrel Old Country Store (NASDAQ:CBRL) Got What It Takes To Become A Multi-Bagger?
2020-07-12,Bearish Bets: 2 Notable Stocks You Should Consider Shorting This Week
2020-07-10,Cracker Barrel Old Country Store® Elects Gilbert Dávila to Board of Directors
2020-07-03,Jobs Market Strengthening Fast: 4 Sector ETFs & Stocks to Buy
2020-07-02,Cracker Barrel (CBRL) Down 8% Since Last Earnings Report: Can It Rebound?
2020-07-01,How Cracker Barrel (CBRL) Stock Stands Out in a Strong Industry
2020-06-23,Edited Transcript of CBRL earnings conference call or presentation 2-Jun-20 3:00pm GMT
2020-06-19,"Do Hedge Funds Love Cracker Barrel Old Country Store, Inc. (CBRL)?"
2020-06-18,Restaurant Industry Banks on Off-Premise Sales Amid Pandemic
2020-06-16,"Cracker Barrel Misses on Earnings, but Stock Rebounds"
2020-06-16,Restaurant Brands' Burger King Launches Plant-Based Sandwich
2020-06-16,Here's Why Cracker Barrel Rose 67% in 3 Months Amid Pandemic
2020-06-15,Red Robin Stock Soars 104% in 3 Months: More Upside Left?
2020-06-12,BJ's Restaurants Provides Business Update Amid Coronavirus
2020-06-11,Starbucks Provides Business Update Amid Coronavirus Pandemic
2020-06-11,Red Robin (RRGB) Stock Down on Wider-than-Expected Q1 Loss
2020-06-10,Brinker Provides Business Update Amid Coronavirus Pandemic
2020-06-08,3 Reasons Why You Should Dig into These Restaurant Stocks
2020-06-08,"'Overwhelmingly Positive': Cracker Barrel Tests Alcohol Sales in Florida, Tennessee"
2020-06-08,Why Many Restaurant Stocks Surged in May
2020-06-08,4 Sector ETFs & Stocks to Buy on Record Jobs Gain in May
2020-06-05,"Earnings Update: Here's Why Analysts Just Lifted Their Cracker Barrel Old Country Store, Inc. (NASDAQ:CBRL) Price Target To US$117"
2020-06-03,Why Cheesecake Factory Sales Data Sent Restaurant Stocks Soaring
2020-06-03,Cracker Barrel stock soars after upgrade on rising dine-in sales momentum
2020-06-03,Cracker Barrel Suffers Punch to the Gut from Punch Bowl Social Investment
2020-06-03,Cracker Barrel (CBRL) Post Wider-Than-Expected Loss in Q3
2020-06-02,Cracker Barrel Old Country Store Inc (CBRL) Q3 2020 Earnings Call Transcript
