2021-01-05,Venus Concept Inc. to Present at Two Upcoming Investor Conferences in January
2020-12-22,Venus Concept Inc. Announces Pricing of $22.5 Million Public Offering
2020-12-21,Venus Concept Inc. Announces Proposed Public Offering
2020-12-10,Venus Concept Announces Debt Refinancing
2020-12-01,Venus Concept to Host Virtual Aesthetic & Hair Restoration Technology Event on December 10th
2020-11-16,Venus Concept Announces Third Quarter and First Nine Months of 2020 Financial Results
2020-11-16,Venus Concept Inc to Host Earnings Call
2020-11-03,Venus Concept Inc. to Present at the Stifel 2020 Virtual Healthcare Conference
2020-10-15,"Venus Concept to Release Third Quarter of Fiscal Year 2020 Financial Results on November 16, 2020"
2020-09-17,Have Insiders Been Buying Venus Concept Inc. (NASDAQ:VERO) Shares This Year?
2020-09-14,"These 3 Penny Stocks Could Double (Or More), Says BTIG"
2020-08-13,Venus Concept Announces Second Quarter and First Six Months of 2020 Financial Results
2020-07-16,Venus Concept Reports Preliminary Revenue Results for Second Quarter 2020
2020-07-01,Venus Concept Inc. Announces FDA 510(k) Clearance for Venus Viva MD
2020-06-26,"Venus Concept Inc. Joins Russell 2000®, Russell 3000® and Russell Microcap® Indexes"
2020-06-25,"Venus Concept to Release Second Quarter of Fiscal Year 2020 Financial Results on August 13, 2020"
2020-06-16,"Venus Concept Inc. Announces Common Stock Purchase Agreement for up to $31 Million with Lincoln Park Capital Fund, LLC"
2020-06-15,Venus Concept Inc. Announces FDA 510(k) Clearance for Venus Epileve
2020-05-14,Venus Concept Announces First Quarter of 2020 Financial Results
2020-04-15,"Venus Concept to Release First Quarter of Fiscal Year 2020 Financial Results on May 14, 2020"
2020-03-30,Venus Concept Announces Fourth Quarter and Fiscal Year 2019 Financial Results; Provides Preliminary First Quarter of 2020 Revenue Results and Updates Fiscal Year 2020 Revenue Guidance
2020-03-30,Venus Concept Inc to Host Earnings Call
2020-03-18,Venus Concept Inc. Announces $22.25 Million Equity Financing
2020-03-10,"Venus Concept to Release Fourth Quarter and Fiscal Year 2019 Financial Results on March 30, 2020"
2020-03-03,Venus Concept Expands Executive Team
2020-02-14,Venus Concept Inc. Announces New Regulatory Clearances
2020-01-13,Venus Concept Announces Preliminary Fourth Quarter and Fiscal Year 2019 Revenue Results; Introduces Fiscal Year 2020 Revenue Guidance
2019-12-05,"Venus Concept Inc. Announces CE Mark and Australian Regulatory Approval for NeoGraft 2.0, A Trusted Name in Hair Restoration"
