2021-01-06,Did You Miss Cutera's (NASDAQ:CUTR) Impressive 113% Share Price Gain?
2020-12-18,Is CUTR A Good Stock To Buy Now?
2020-11-24,Cutera to Participate in the Piper Sandler Virtual Healthcare Conference
2020-11-12,Cutera to Participate in Two Virtual Fireside Chats at Investor Conferences in November
2020-11-07,"Cutera, Inc. (NASDAQ:CUTR) Just Reported And Analysts Have Been Lifting Their Price Targets"
2020-11-04,Cutera (CUTR) Beats Q3 Earnings and Revenue Estimates
2020-11-04,Cutera: Q3 Earnings Insights
2020-11-04,"Cutera, Inc. Announces Third Quarter 2020 Financial Results"
2020-11-04,"Cutera, Inc. to Host Earnings Call"
2020-11-03,Earnings Outlook for Cutera
2020-10-28,Analysts Estimate Cutera (CUTR) to Report a Decline in Earnings: What to Look Out for
2020-10-19,Power Couple Becomes First to Flex Muscles in Calgary
2020-10-15,"Cutera, Inc. to Announce Third Quarter Results on November 4, 2020"
2020-09-10,Cutera to Participate in a Virtual Fireside Chat at the Cantor Global Healthcare Conference
2020-09-01,Industry Leading truSculpt® flex Launches Its Muscle in Canada
2020-08-24,"Cutera Reverses Aging, Unveils Powerful Technology"
2020-08-07,Cutera to Present at the Canaccord Genuity Growth Conference
2020-08-06,"Cutera (CUTR) Reports Q2 Loss, Tops Revenue Estimates"
2020-08-06,Cutera Appoints Rohan Seth as Chief Financial Officer
2020-08-06,"Cutera, Inc. Announces Second Quarter 2020 Financial Results"
2020-07-30,Earnings Preview: Cutera (CUTR) Q2 Earnings Expected to Decline
2020-07-29,"Cutera, Inc. to Announce Second Quarter Results on August 6, 2020"
2020-07-14,"Cutera to Participate in Maxim Groups ""Re-Engaging Medical Practices in an Era of COVID-19"" Webinar"
2020-07-08,"Were Hedge Funds Right About Selling Cutera, Inc. (CUTR)?"
2020-06-15,"Faruqi & Faruqi, LLP is Investigating Cutera, Inc. (CUTR) on Behalf of its Shareholders"
2020-05-18,Cutera to Present at the UBS Global Healthcare Conference
2020-05-09,Cutera (CUTR) Q1 2020 Earnings Call Transcript
2020-05-08,"Bearish: Analysts Just Cut Their Cutera, Inc. (NASDAQ:CUTR) Revenue and EPS estimates"
2020-05-07,"Cutera, Inc. Announces First Quarter 2020 Financial Results"
2020-05-04,"truSculpt® flex From Cutera, Inc. Wins 2020 Good Housekeeping Award"
2020-05-01,GCP Applied Tech and Net 1 UEPS See Activist Actions
2020-04-30,"Cutera, Inc. to Announce First Quarter Results on May 7, 2020"
2020-04-28,"Non-Executive Director Gregory Barrett Just Bought 45% More Shares In Cutera, Inc. (NASDAQ:CUTR)"
2020-04-21,"Cutera, Inc. Announces Closing of Public Stock Offering and Full Exercise of Underwriters Option to Purchase Additional Stock"
2020-04-16,"Cutera, Inc. Announces Pricing of Public Offering of Common Stock"
2020-04-16,"Cutera, Inc. Announces Proposed Public Offering of Common Stock"
2020-04-10,"The Consensus EPS Estimates For Cutera, Inc. (NASDAQ:CUTR) Just Fell Dramatically"
2020-03-11,Edited Transcript of CUTR earnings conference call or presentation 26-Feb-20 9:30pm GMT
2020-02-28,"Cutera, Inc. Just Reported Earnings, And Analysts Cut Their Target Price"
2020-02-13,"Cutera, Inc. to Announce Fourth Quarter and Full-Year 2019 Results on February 26, 2020"
2020-01-19,"When Should You Buy Cutera, Inc. (NASDAQ:CUTR)?"
2020-01-18,These stocks soared even as the companies lost money  heres why thats not as crazy as it sounds
2020-01-13,These Stocks' Sales Have Been Growing Fast
2020-01-12,Cutera Announces Preliminary Financial Results for Fourth Quarter and Full-Year 2019
2019-12-13,"Were Hedge Funds Right About Buying Back Cutera, Inc. (CUTR) Shares?"
2019-12-05,"The Cutera (NASDAQ:CUTR) Share Price Has Gained 275%, So Why Not Pay It Some Attention?"
2019-12-02,Cutera to Present at the Piper Jaffray 31st Annual Healthcare Conference
2019-11-24,Edited Transcript of CUTR earnings conference call or presentation 7-Nov-19 9:30pm GMT
2019-11-18,Cutera Appoints Fuad Ahmad as Interim CFO
2019-11-08,"Dow Lags Despite Disney's Gains; Top Breakouts In Healthcare, Industrials"
2019-11-07,Cutera (CUTR) Beats Q3 Earnings and Revenue Estimates
2019-11-07,Cutera Reports Third Quarter 2019 Financial Results
2019-11-05,"Did Hedge Funds Drop The Ball On Cutera, Inc. (CUTR) ?"
2019-11-04,Factors to Consider Ahead of Cutera's (CUTR) Q3 Earnings
2019-10-31,Cutera (CUTR) Gains As Market Dips: What You Should Know
2019-10-31,Earnings Preview: Cutera (CUTR) Q3 Earnings Expected to Decline
2019-10-24,U.S. Laser Stocks Run as China Watches
2019-10-22,"Cutera, Inc. to Announce Third Quarter 2019 Results"
2019-10-17,"Is There An Opportunity With Cutera, Inc.'s (NASDAQ:CUTR) 50% Undervaluation?"
2019-10-15,Has Cutera (CUTR) Outpaced Other Computer and Technology Stocks This Year?
2019-09-25,"The Zacks Industry Rank Highlights: Lumentum, Cuter and Iridex"
2019-09-24,Laser Firms Blast Q2 Earnings Marks: Zacks Industry Rank Analysis
2019-09-24,"Cutera, Party City, Micron, Perficient and CACI highlighted as Zacks Bull and Bear of the Day"
2019-09-24,Bull of the Day: Cutera (CUTR)
2019-09-23,"Zacks.com featured highlights include: ACM Research, GAIN Capital, Cutera, Columbus McKinnon and Minerva"
2019-09-19,5 Stocks to Buy on New Analyst Coverage
2019-09-12,Cutera Receives Additional Approval from Health Canada for its truSculpt® iD Body Sculpting Technology
2019-09-10,Cutera Sees Hammer Chart Patteern: Time to Buy?
2019-09-09,Cutera to Present at Upcoming Investor Conferences
2019-09-06,Edited Transcript of CUTR earnings conference call or presentation 8-Aug-19 8:30pm GMT
2019-08-30,New Strong Buy Stocks for August 30th
2019-08-28,Laser Systems & Components Industry Outlook: Prospects Bright
2019-08-26,New Strong Buy Stocks for August 26th
2019-08-22,"What Kind Of Share Price Volatility Should You Expect For Cutera, Inc. (NASDAQ:CUTR)?"
2019-08-12,"Cutera Announces Planned Retirement of David B. Apfelberg, M.D., as Member of the Board of Directors"
2019-08-09,"Why Appian, Chuy's Holdings, and Cutera Jumped Today"
2019-08-08,Cutera (CUTR) Q2 2019 Earnings Call Transcript
2019-08-08,Cutera (CUTR) Beats Q2 Earnings and Revenue Estimates
2019-08-08,Cutera Reports Second Quarter 2019 Financial Results
2019-08-01,Analysts Estimate Cutera (CUTR) to Report a Decline in Earnings: What to Look Out for
2019-07-23,Cutera Receives ANVISA Approval of truSculpt® Body Sculpting Systems in Brazil
2019-07-22,"Cutera, Inc. to Announce Second Quarter 2019 Results"
2019-07-09,Cutera Announces Appointment of David Mowry as Chief Executive Officer
2019-07-08,"Is Now The Time To Look At Buying Cutera, Inc. (NASDAQ:CUTR)?"
2019-06-26,Cutera Redefines the Muscle Sculpting Market with US Commercial Launch of truSculpt® flex
2019-06-25,"Heres What Hedge Funds Think About Cutera, Inc. (CUTR)"
2019-05-31,7 Stocks for You to Profit From (Legal) Insider Trading
2019-05-24,"If You Had Bought Cutera (NASDAQ:CUTR) Stock Five Years Ago, You Could Pocket A 76% Gain Today"
2019-05-19,Edited Transcript of CUTR earnings conference call or presentation 9-May-19 8:30pm GMT
2019-05-10,Cutera to Provide truSculpt® iD and Laser Genesis® Aesthetic Treatments at the DPA Cannes Gift Lounge During the 72nd Festival de Cannes
2019-05-09,"Cutera (CUTR) Reports Q1 Loss, Tops Revenue Estimates"
2019-05-09,Cutera: 1Q Earnings Snapshot
2019-05-09,Cutera Reports First Quarter 2019 Financial Results
2019-05-02,Earnings Preview: Cutera (CUTR) Q1 Earnings Expected to Decline
2019-04-18,"Cutera, Inc. to Announce First Quarter 2019 Results"
2019-04-17,Cutera Announces Regulatory Approval of Secret RF Microneedling System in Canada
2019-03-18,"Cutera Inc (CUTR) Files 10-K for the Fiscal Year Ended on December 31, 2018"
2019-02-28,New Strong Sell Stocks for February 28th
2019-02-26,Cutera Announces Global Commercial Launch Of the excel V+® the Next Generation Laser Platform
2019-02-26,"Market Trends Toward New Normal in Infinera, Alliant Energy, Galectin Therapeutics, DexCom, Cutera, and Care  Emerging Consolidated Expectations, Analyst Ratings"
