2021-01-11,"LG Envisions a Future Made Better, Safer and Easier with its Advanced Solutions at CES 2021"
2021-01-11,Accenture Positioned as a Leader in Microsoft Azure Systems Integrators by Everest Group
2021-01-11,"Accenture Acquires Real Protect, Brazil-Based Information Security Company"
2021-01-09,Accenture (NYSE:ACN) Seems To Use Debt Rather Sparingly
2021-01-07,NVEE or ACN: Which Is the Better Value Stock Right Now?
2021-01-06,Why Accenture Stock Rose 24% in 2020
2021-01-05,Accenture Named a Leader for Application and Digital Services in Life & Annuities Insurance by Analyst Firm Everest Group
2021-01-05,15 Largest IT Services Companies in the World
2021-01-04,"RPT-In Canada, shippers race to move cancer treatments as COVID-19 grounds flights"
2021-01-03,"In Canada, shippers race to move cancer treatments as COVID-19 grounds flights"
2020-12-31,"Accenture (ACN): Strong Industry, Solid Earnings Estimate Revisions"
2020-12-28,Here's Why Investors Should Retain Accenture (ACN) Stock Now
2020-12-23,The Technology Sector's 2020 and What It Means for 2021
2020-12-22,"A Look at Stock Market News From Boeing, Twitter, Accenture, and More"
2020-12-22,"The Zacks Analyst Blog Highlights: GOOGL, CMCSA, ACN, BA and TOT"
2020-12-21,"Top Analyst Reports for Alphabet, Comcast & Accenture"
2020-12-21,NVEE vs. ACN: Which Stock Is the Better Value Option?
2020-12-20,"Accenture plc Just Beat Analyst Forecasts, And Analysts Have Been Updating Their Predictions"
2020-12-18,Accenture Is Set to Climb to New Heights
2020-12-18,"Company News for Dec 18, 2020"
2020-12-17,Stock Cheer: Cramer's 'Mad Money' Recap (Thursday 12/17/20)
2020-12-17,Jim Cramer: These Two Surprise Stocks Would Fit Any Portfolio
2020-12-17,Epam Stock Touches Buy Point As Accenture Earnings Boost Tech Services Firms
2020-12-17,"Accenture Stock Pops As Earnings Top Views, Revenue Outlook Raised"
2020-12-17,US STOCKS-Wall Street ends at record highs as investors eye fiscal stimulus
2020-12-17,"Rite Aid, Accenture, Jabil: 5 Top Stock Gainers for Thursday"
2020-12-17,US STOCKS-Wall Street ends at record highs as investors eye fiscal stimulus
2020-12-17,Accenture's Quarterly Results Surpass All Expectations
2020-12-17,"US STOCKS-S&P 500, Nasdaq hit record as investors eye fiscal stimulus"
2020-12-17,"S&P 500, Nasdaq Hit Record Highs As These Indexes Outperform"
2020-12-17,Why Accenture Stock Popped Today
2020-12-17,Accenture PLC (ACN) Q1 2021 Earnings Call Transcript
2020-12-17,A Look Into Accenture's Price Over Earnings
2020-12-17,"Accenture's (ACN) Q1 Earnings & Revenues Top, 2021 View Up"
2020-12-17,"In a Strong Sign for IT Spending, Accenture Earnings Top Estimates"
2020-12-17,"Dow Jones, Stocks Climb Amid Vaccine, Stimulus Expectations; Accenture, Cerence Score Breakouts"
2020-12-17,ROCE Insights For Accenture
2020-12-17,"CFOs Need Greater Real Time Data to Pivot from Measuring to Creating Value Amid COVID-19, Accenture Report Finds"
2020-12-17,CORRECTING and REPLACING Accenture Reports Very Strong First-Quarter Results and Raises Business Outlook for Fiscal 2021
2020-12-17,"Accenture Surges on Earnings Beat, Raised Outlook"
2020-12-17,Accenture (ACN) Q1 Earnings and Revenues Beat Estimates
2020-12-17,Recap: Accenture Q1 Earnings
2020-12-17,"Accenture's stock surges toward a record after profit and revenue beats, raised outlook"
2020-12-17,Accenture Plc to Host Earnings Call
2020-12-16,Is Accenture's Dividend Safe?
2020-12-16,Accentures Holiday Shipping Study Names Top-performing Retailers
2020-12-16,A Preview Of Accenture's Earnings
2020-12-16,Generali Group and Accenture Form Joint Venture to Accelerate the Insurers Digital Transformation Strategy
2020-12-16,Medable Named Life Sciences Innovation Champion in the Accenture HealthTech Innovation Challenge
2020-12-16,Accenture Federal Services Wins Contract to Help the Department of the Navy with Organizational Transformation Support to Increase Readiness
2020-12-16,Accenture Named a Leader for Application and Digital Services in Capital Markets by Analyst Firm Everest Group
2020-12-16,Accenture and CereProc Introduce and Open Source the Worlds First Comprehensive Non-Binary Voice Solution
2020-12-16,"Accenture to Host Conference Call Tomorrow, Dec. 17, to Discuss First-Quarter Fiscal Year 2021 Results"
2020-12-15,"2021 Will Redefine the 21st Century, According to ""Fjord Trends 2021"" Report from Accenture Interactive"
2020-12-15,A Preview Of The Biggest Earnings Reports This Week
2020-12-15,"2021 Will Redefine the 21st Century, According to ""Fjord Trends 2021"" Report from Accenture Interactive"
2020-12-15,Is a Beat in the Cards for Accenture (ACN) in Q1 Earnings?
2020-12-15,Is a Surprise Coming for Accenture (ACN) This Earnings Season?
2020-12-15,Christie Smith Joins Accenture to Lead the CEO Transformational Change Journey Agenda
2020-12-15,Accenture Makes Strategic Investment in Reactive Technologies
2020-12-14,Is ACN A Good Stock To Buy Now?
2020-12-14,Sweden Takes Another Step Toward a Digital Currency
2020-12-14,Accenture Helps Rakuten Mobile Launch Fully Virtualized Cloud-Native Mobile Network
2020-12-10,Accenture (ACN) Expected to Beat Earnings Estimates: Can the Stock Move Higher?
2020-12-10,Accenture Recognized as a Leader in Everest Groups PEAK Matrix for System Integrator Capabilities on AWS 2021
2020-12-10,Accenture Named a Leader in ServiceNow Services by Analyst Firm Everest Group
2020-12-10,Efma and Accenture Launch 6th Annual Innovation in Insurance Awards
2020-12-09,3 'Magic Formula' Stocks Popular Among Gurus
2020-12-08,BCSC alleges that Surrey investment management firm failed to carry out its duties and to ensure investments were suitable for clients
2020-12-08,Appian and Accenture Federal Services Team to Accelerate Acquisition Modernization for Government and Defense Organizations
2020-12-08,"Accenture to Host Conference Call Thursday, Dec. 17, to Discuss First-Quarter Fiscal Year 2021 Results"
2020-12-08,Is Accenture plc's (NYSE:ACN) Recent Performance Tethered To Its Attractive Financial Prospects?
2020-12-07,Accenture Federal Services Wins Contract to Modernize Client Case-Management System for the Administrative Office of the US Courts
2020-12-07,"Rapid Shift to Digital Banking in Canada During COVID-19 Accelerating Erosion in Consumer Trust, Accenture Report Finds"
2020-12-07,"Rapid Shift to Digital Banking During COVID-19 Accelerating Erosion in Consumer Trust, Accenture Report Finds"
2020-12-04,Accenture (ACN) to Help Accelerate Halliburton's Digitalization
2020-12-04,Halliburton Partners Accenture to Enhance Digital Revolution
2020-12-03,Googles Co-Head of Ethical AI Says She Was Fired for Email
2020-12-03,"Accenture Nominates Beth E. Mooney, Former Chairman and CEO of KeyCorp, to Join Its Board of Directors"
2020-12-03,"Most Canadian Companies Continue to Struggle to Realize Full Business Value from their Cloud Initiatives, Accenture Report Finds"
2020-12-03,A silver lining to 2020? Building genuine virtual relationships
2020-12-02,Accenture (ACN) Announces Completion of OpusLine Buyout
2020-12-02,Microsoft (MSFT) to Boost CNH Industrial's Digital Capabilities
2020-12-02,Halliburton Teams with Accenture to Accelerate Digital Supply Chain Transformation
2020-12-02,"Less than One-Third of Wealth Managers in North America are Scaling AI Across Their Businesses, Accenture Report Finds"
2020-12-02,"Companies with a Digitally Fluent Workforce Lead their Peers in Revenue Growth and Better Worker Satisfaction, Accenture Report Finds"
2020-12-01,"New Consumer Behaviors Accelerate Need for Companies to Focus on Experience for Long-Term Growth, According to Research from Accenture Interactive"
2020-12-01,Accenture Promotes 605 New Managing Directors and Appoints 63 New Senior Managing Directors
2020-12-01,"Two-Thirds of U.S. Consumers Likely to Switch Healthcare Providers If COVID-19 is Poorly Managed, Accenture Report Reveals"
2020-12-01,Accenture Helps Blueair Raise Manufacturing Productivity and Add New Services to its Connected Air Purifiers
2020-12-01,CNH Industrial (CNHI) Ties Up With Tech Giants for Digital Revamp
2020-12-01,nCino and Accenture Help Vancity Transform Its Commercial Lending Operations
2020-12-01,"CNH Industrial, Accenture and Microsoft Collaborate to Develop Connected Industrial Vehicles"
2020-12-01,Accenture Completes Acquisition of OpusLine
2020-11-30,"CNH Industrial to work with Microsoft, Accenture on 'smart' vehicles"
2020-11-25,Accenture (ACN) Set to Gain From End-to-End Analytics Buyout
2020-11-24,Accenture (ACN) Snaps Up Arca to Strengthen 5G Capacities
2020-11-24,"COVID-19 Increases Urgency for Banks to Transform Payment Systems as Digital Payments Soar, Finds Research from Accenture"
2020-11-23,Accenture Positioned as Leader in Digital Business Transformation Services by Independent Research Firm
2020-11-23,Accenture to Acquire End-to-End Analytics
