2021-01-06,Renalytix AI (RNLX) Catches Eye: Stock Jumps 7%
2021-01-06,"The Daily Biotech Pulse: Aerpio Reviews Strategic Options, Hologic Goes Shopping"
2021-01-05,"Early Risk Identification at Core of Innovative Kidney Care Partnership Between Renalytix, DaVita"
2021-01-04,RenalytixAI to Present at the 39th Annual J.P. Morgan Healthcare Conference
2020-11-29,Do Hedge Funds Love Renalytix AI plc (RNLX)?
2020-11-25,Kantaro Receives FDA Emergency Use Authorization for Semi-Quantitative COVID-19 Antibody Test Kit that Detects the Presence and Level of SARS-CoV-2 IgG Antibodies
2020-11-25,RenalytixAI Reports Financial Results for First Quarter of Fiscal Year 2021
2020-11-13,RenalytixAI to Participate in the Stifel 2020 Healthcare Conference
2020-11-06,Renalytix AI plc (RenalytixAI or the Company) Change of adviser
2020-11-02,Posting of Annual Report & Accounts and Notice of AGM
2020-10-28,EKF and Kantaro Partner to Market Quantitative COVID-19 Antibody Testing in the UK and Europe
2020-10-27,Renalytix AI plc (RenalytixAI or the Company) Full Year Report
2020-10-26,CE Mark Approval Granted to Kantaro COVID-SeroKlir and COVID-SeroIndex Quantitative Antibody Test Kits
2020-09-22,RenalytixAI Receives California Commercial Laboratory Certification
2020-09-18,RenalytixAI Reaches Milestone of KidneyIntelX Commercial Testing with Mount Sinai Health System
2020-08-26,RenalytixAI Files Submission Seeking U.S. FDA Clearance of KidneyIntelX
2020-08-21,RenalytixAI to Collaborate with AstraZeneca to Improve Outcomes for Patients with Chronic Disease
2020-08-03,KidneyIntelX in Multi-Center Study to Monitor and Predict Kidney Risk in COVID-19 Patients
2020-07-27,RenalytixAI Announces Over Allotment Option Exercise Raises an Additional US$10.9M
2020-07-21,RenalytixAI Announces Closing of Global Offering and Resulting Total Voting Rights
2020-07-16,RenalytixAI Announces Pricing of Global Offering and Approval to List on the Nasdaq Global Market
