2020-10-21,Barings Participation Investors Hold October 2020 Board Meeting
2020-07-30,5 Undervalued Insurance Stocks Boosting Earnings
2020-04-23,Barings Participation Investors Holds April 2020 Annual Meeting
2020-04-10,"Barings Corporate Investors And Barings Participation Investors: Change Of Location Of The Joint Annual Meeting Of Shareholders To Be Held On April 23, 2020"
2019-12-17,Barings Participation Investors Declares $0.27 Cent Dividend
2019-10-30,We're Keeping An Eye On MPV Exploration's (CNSX:MPV) Cash Burn Rate
2019-10-25,Barings Participation Investors Holds October 2019 Board Meeting
2019-07-24,Barings Participation Investors Holds July 2019 Board Meeting
2019-01-25,Barings Participation Investors Holds January 2019 Board Meeting
2018-12-12,Barings Participation Investors Holds December 2018 Board Meeting
2018-10-19,Barings Participation Investors Holds October 2018 Board Meeting
2018-04-25,Barings Participation Investors Holds April 2018 Board Meeting
2018-04-04,Barings Announces Agreement to Become Investment Adviser to Triangle Capital Corporation
2018-01-19,Barings Participation Investors Holds January 2018 Board Meeting
2017-12-15,Barings Participation Investors Declares Quarterly Dividend of $0.27 per Share
2017-11-13,Does Barings Participation Investorss (MPV) 137.6% Earnings Growth Make It An Outperformer?
2017-10-20,Barings Participation Investors Declares Quarterly Dividend of $0.27 per Share
2017-07-19,Barings Participation Investors Declares Quarterly Dividend of $0.27 per Share
2017-07-06,Montford multifamily project next up for Crescent Communities
2017-06-22,12 startups pitch at Queen City Fintech's annual demo day (PHOTOS)
2017-05-09,Report: Jump in Charlotte's office vacancy rates expected to be temporary
2017-04-24,UPDATE -- Barings Participation Investors Holds April 2017 Board Meeting
2017-04-21,Barings Participation Investors Holds April 2017 Board Meeting
2017-01-20,Barings Participation Investors Holds January 2017 Board Meeting
2016-12-16,Barings Participation Investors Declares Quarterly Dividend of $0.27 per Share
2016-10-28,Barings Participation Investors Declares Quarterly Dividend of $0.27 per Share
2016-09-15,BARINGS PARTICIPATION INVESTORS Financials
2016-09-07,"Babson Capital Participation Investors Will Change its Name to Barings Participation Investors Effective on September 12, 2016"
2016-06-01,"Mountain Province Diamonds, Inc. :MPV-CA: Earnings Analysis: Q1, 2016 By the Numbers : June 1, 2016"
2016-01-22,Babson Capital Participation Investors Holds January 2016 Board Meeting
2015-12-11,Babson Capital Participation Investors Declares Quarterly Dividend of $0.27 per Share
2015-11-03,Millennials Cleaning Up Another Boomer Mess -- This Time Healthcare
2015-11-02,The 7 Organizations That Will Turn Healthcare Upside Down In 2016
2015-10-28,/C O R R E C T I O N -- Babson Capital Management LLC/
2015-10-23,Babson Capital Participation Investors Declares Quarterly Dividend of $0.27 per Share
2015-07-22,Babson Capital Participation Investors Declares Quarterly Dividend of $0.27 per Share
2015-04-17,Babson Capital Participation Investors 2015 Annual Meeting
2014-07-29,"Ex-Dividends To Watch: 3 Stocks Going Ex-Dividend Tomorrow: MPV, CQP, BMO"
2012-07-19,Canada's Role In The Global Diamond Industry
2012-03-21,Nissan Motor CEO says Datsun brand to return to Nissan
2012-03-20,Nissan revives Datsun brand to return to Nissan
2012-03-20,Nissan Motor CEO says Datsun brand to return to Nissan
2012-01-16,CEF Weekly Review: Ending Week On A Sour Note
2010-09-22,NYSE stocks posting largest volume increases
2010-08-23,NYSE stocks posting largest percentage increases
2010-08-17,NYSE stocks posting largest percentage decreases
2010-08-17,NYSE stocks posting largest percentage decreases
2010-08-11,NYSE stocks posting largest percentage increases
2010-07-16,NYSE stocks posting largest percentage increases
2010-07-15,NYSE stocks posting largest volume decreases
2010-06-24,NYSE stocks posting largest volume decreases
2009-08-11,"EchoStar, ShengdaTech and Brigham Exploration lead small-cap percentage gainers"
2008-10-13,"American Independence, A Power Energy Generation Systems and Tortoise Energy Infrastructure lead small-cap percentage gainers"
2008-08-15,"Mountain Province Diamonds files its first quarter results for June 30, 2008"
2008-08-06,Mountain Province Diamonds Reports Preliminary Results from the Tuzo Large Diameter Bulk Sampling Program
2008-07-16,Mountain Province Diamonds Reports Results of the 5034 North Lobe Large Diameter Core Program
2008-06-04,Mountain Province Reviewing Strategic Alternatives
