2021-01-09,Four REITS Flagged As Overbought By News Sentiment Model
2021-01-07,Camden Property Trust Announces Fourth Quarter 2020 Earnings Release and Conference Call Dates
2020-12-19,What Does Camden Property Trust's (NYSE:CPT) CEO Pay Reveal?
2020-12-06,3 High-Yield REITs to Buy in December
2020-12-01,Camden Property Trust Announces Fourth Quarter 2020 Dividend
2020-11-27,"SHAREHOLDER ACTION ALERT: The Schall Law Firm Announces the Filing of a Class Action Lawsuit Against Intercept Pharmaceuticals, Inc. and Encourages Investors with Losses in Excess of $100,000 to Contact the Firm"
2020-11-16,Camden Property Trust Announces Participation in Nareits REITworld 2020 Annual Conference
2020-11-10,3 High-Dividend Real Estate Stocks to Buy in November
2020-11-04,"With EPS Growth And More, Camden Property Trust (NYSE:CPT) Is Interesting"
2020-10-30,Camden Property Trust (CPT) Q3 2020 Earnings Call Transcript
2020-10-30,Camden Property Trust to Host Earnings Call
2020-10-29,Camden (CPT) Tops Q3 FFO and Revenue Estimates
2020-10-29,Camden Property Trust Announces Third Quarter 2020 Operating Results
2020-10-24,3 Dividend Stocks Perfect for Retirees
2020-10-17,"2 Best Dividend Stocks to Invest $1,000 in Right Now"
2020-10-01,Camden Property Trust Announces Third Quarter 2020 Earnings Release and Conference Call Dates
2020-09-28,Should I Avoid Camden Property Trust (CPT)?
2020-09-26,3 Dividend Stocks That Should Pay You for the Rest of Your Life
2020-09-15,Camden Property Trust Announces Third Quarter 2020 Dividend
2020-09-14,Camden Property Trust Announces Participation in BofA Securities Global Real Estate Virtual Conference 2020
2020-09-14,Are Poor Financial Prospects Dragging Down Camden Property Trust (NYSE:CPT Stock?
2020-09-09,Camden Property Trust Announces Participation in Evercore ISI 2020 Real Estate Conference
2020-08-18,A Conversation with a Short Seller
2020-07-31,Camden Property Trust (CPT) Q2 2020 Earnings Call Transcript
2020-07-30,Camden (CPT) Q2 FFO and Revenues Miss Estimates
2020-07-30,Camden Property Trust Announces Second Quarter 2020 Operating Results
2020-07-15,What Type Of Returns Would Camden Property Trust's(NYSE:CPT) Shareholders Have Earned If They Purchased Their SharesYear Ago?
2020-07-12,Did Hedge Funds Make The Right Call On Camden Property Trust (CPT) ?
2020-07-06,Camden Property Trust Announces Second Quarter 2020 Earnings Release and Conference Call Dates
2020-06-21,Edited Transcript of CPT.N earnings conference call or presentation 8-May-20 3:00pm GMT
2020-06-16,A Trio of Long-Term Payers Announces Dividends
2020-06-15,Camden Property Trust Announces Second Quarter 2020 Dividend
2020-06-05,Hedge Funds Arent Done Buying Camden Property Trust (CPT)
2020-05-12,Camden Property Trust Earnings Missed Analyst Estimates: Here's What Analysts Are Forecasting Now
2020-05-09,Camden Property Trust (CPT) Q1 2020 Earnings Call Transcript
2020-05-09,The Woman Who Foresaw the 2008 Housing Crash Is Bullish on These Home-building Stocks
2020-05-07,Camden (CPT) Q1 FFO and Revenues Top Estimates
2020-05-07,Camden Property Trust Announces First Quarter 2020 Operating Results
2020-04-17,Is Camden Property Trust's (NYSE:CPT) CEO Paid Enough Relative To Peers?
2020-04-16,Camden Property Trust Prices $750 Million 2.800% Senior Unsecured Notes Due 2030
2020-04-16,Camden Property Withdraws 2020 Guidance on Coronavirus Scare
2020-04-15,Camden Property Trust Provides COVID-19 Updates
2020-04-10,Charlotte's multifamily industry sees dip in renters paying on time  but bigger impacts lie ahead
2020-04-09,Camden Property Trust to Hold Virtual Annual Meeting of Shareholders
2020-04-07,Houston apartment co.'s $5M resident relief fund goes fast. But efforts don't stop there
2020-04-06,Camden Property Trust Announces First Quarter 2020 Earnings Release and Conference Call Dates
2020-04-02,Houston-based apartment co. launches $5M fund for residents without income due to coronavirus
2020-04-02,Camden Property Trust Establishes Resident Relief Fund for COVID-19 Pandemic
2020-03-26,Camden Property Trust -- Moody's announces completion of a periodic review of ratings of Camden Property Trust
2020-03-25,Camden Property Trust Announces Actions to Support Residents and Employees During COVID-19 Pandemic
2020-03-19,Hedge Funds Have Never Been This Bullish On Camden Property Trust (CPT)
2020-03-18,"Coronavirus marks a new, if familiar, challenge for Camden CEO Ric Campo"
2020-02-28,Camden Property Trust Announces Participation in Citis 2020 Global Property CEO Conference
2020-02-20,Camden Property Trust Appoints Mark D. Gibson to Board of Trust Managers
2020-02-18,Camden Property Trust Named One of Fortunes 100 Best Companies to Work For®
2020-02-11,Raleigh market earns high praise from national developers
2020-02-11,NoDa apartment project with coworking space to break ground this spring
2020-02-07,Edited Transcript of CPT earnings conference call or presentation 31-Jan-20 4:00pm GMT
2020-02-02,Camden Property Trust Beat Analyst Estimates: See What The Consensus Is Forecasting For Next Year
2020-01-30,Camden (CPT) Lags Q4 FFO Estimates
2020-01-30,"Camden Property Trust Announces 2019 Operating Results, 2020 Financial Outlook, and First Quarter 2020 Dividend"
2020-01-29,Equity Residential (EQR) Tops Q4 FFO and Revenue Estimates
2020-01-22,What's in Store for Boston Properties' (BXP) Q4 Earnings?
2020-01-21,3 Buy-Ranked REITs to Help Investors Add Income to Their Portfolios
2020-01-21,Camden Property Trust Announces Tax Characteristics of 2019 Distributions
2020-01-21,Key Factors to Impact Prologis (PLD) This Earnings Season
2020-01-20,4 Top REITs Buoying Investors' Optimism This Earnings Season
2020-01-16,Camden (CPT) Upgraded to Buy: Here's Why
2020-01-14,Developer preps for new Thornton Park high-rise
2020-01-06,Camden Property Trust Announces Fourth Quarter 2019 Earnings Release and Conference Call Dates
2019-12-31,Houston-based apartment co. buys 552-unit community near Highland Village
2019-12-31,Camden Announces Property Buyouts and Disposition for December
2019-12-30,Camden Property Trust Announces Recent Acquisition and Disposition Activity
2019-12-20,Real Estate Notebook: Freight startup Convoy doubling its Atlanta space
2019-12-19,Is Camden Property Trust's (NYSE:CPT) 4.6% ROE Worse Than Average?
2019-12-11,Buckhead's largest remaining undeveloped site will soon hit the market
2019-12-11,"Camden Property Trust Honored as One of the Best Places to Work in 2020, a Glassdoor Employees Choice Award Winner"
2019-12-11,Luxury apartments in Raleigh go for $400K+ per unit (Photos)
2019-12-08,Is Camden Property Trust (CPT) A Good Stock To Buy?
2019-12-04,New Thornton Park tower initially wants to offer some 'hotel apartments'
2019-12-02,Camden Property Trust Announces Fourth Quarter 2019 Dividend
2019-11-19,Downtown Orlando property now under contract may be redeveloped
2019-11-06,Edited Transcript of CPT earnings conference call or presentation 1-Nov-19 3:00pm GMT
2019-11-02,"Luxury Apartment REITs Are Doing Great, for Now"
2019-10-31,Camden (CPT) Surpasses Q3 FFO and Revenue Estimates
2019-10-31,Camden Property Trust Announces Third Quarter 2019 Operating Results
2019-10-24,Sam Zells Apartment REIT Had Good News for Rivals AvalonBay and Camden
2019-10-22,Should You Avoid Camden Property Trust (CPT)?
2019-10-09,Update: Camden Property Trust (NYSE:CPT) Stock Gained 57% In The Last Five Years
2019-10-01,Camden Property Trust Announces Third Quarter 2019 Earnings Release and Conference Call Dates
2019-09-23,Camden Property Trust Prices $300 Million 3.350% Senior Unsecured Notes Due 2049
2019-09-16,Camden Property Trust Announces Third Quarter 2019 Dividend
2019-09-11,4 Residential REITs to Buy as U.S. Apartment Occupancy Shoots Up
2019-09-09,Camden Property Trust Announces Participation in Bank of America Merrill Lynch 2019 Global Real Estate Conference
2019-09-03,Did Camden Property Trust (NYSE:CPT) Insiders Sell Shares?
2019-08-28,Are You Looking for a Top Momentum Pick? Why Camden (CPT) is a Great Choice
2019-08-23,Camden (CPT) Upgraded to Buy: Here's What You Should Know
2019-08-14,3 REITs to Buy Amid U.S.-China Trade War Worries & Market Volatility
2019-08-12,3 High-Forward Dividend Yield Stocks
2019-08-08,Is Camden Property Trust's (NYSE:CPT) CEO Pay Justified?
