2020-12-17,Is NTB A Good Stock To Buy Now?
2020-11-24,Butterfield Announces Board Changes
2020-11-05,Why You Might Be Interested In The Bank of N.T. Butterfield & Son Limited (NYSE:NTB) For Its Upcoming Dividend
2020-10-30,The Bank of N.T. Butterfield & Son Limited (NTB) Q3 2020 Earnings Call Transcript
2020-10-29,The Bank of N.T. Butterfield & Son Ltd. to Host Earnings Call
2020-10-28,Bank of NT Butterfield & Son (NTB) Q3 Earnings and Revenues Top Estimates
2020-10-28,Butterfield Reports Third Quarter 2020 Results
2020-10-28,A Look At Bank of N.T. Butterfield & Son's (NYSE:NTB) Share Price Returns
2020-10-21,Analysts Estimate Bank of NT Butterfield & Son (NTB) to Report a Decline in Earnings: What to Look Out for
2020-10-15,3 Strong Buy Stocks With at Least 6% Dividend Yield
2020-10-08,"Butterfield to Announce Third Quarter 2020 Financial Results on October 28, 2020 and Host Quarterly Earnings Conference Call on October 29, 2020"
2020-09-09,Butterfield Announces Senior Management Appointments
2020-08-13,Butterfield 2020 Annual General Meeting Voting Results
2020-08-07,Did Hedge Funds Make The Right Call On The Bank of N.T. Butterfield & Son Limited (NTB)?
2020-08-06,5 Value Stocks To Watch In The Financial Services Sector
2020-07-30,Should You Buy The Bank of N.T. Butterfield & Son Limited (NYSE:NTB) For Its Upcoming Dividend?
2020-07-28,Butterfield Annual General Meeting to Be Virtual Only
2020-07-27,"Earnings Beat: The Bank of N.T. Butterfield & Son Limited Just Beat Analyst Forecasts, And Analysts Have Been Updating Their Models"
2020-07-23,The Bank of N.T. Butterfield & Son Limited (NTB) Q2 2020 Earnings Call Transcript
2020-07-22,Bank of NT Butterfield & Son (NTB) Q2 Earnings Top Estimates
2020-07-22,Butterfield Reports Second Quarter 2020 Results
2020-07-15,Earnings Preview: Bank of NT Butterfield & Son (NTB) Q2 Earnings Expected to Decline
2020-07-02,"Butterfield to Announce Second Quarter 2020 Financial Results on July 22, 2020"
2020-06-23,Hedge Funds Are Nibbling On The Bank of N.T. Butterfield & Son Limited (NTB)
2020-06-13,Bank of N.T. Butterfield Is a Finance Stock You Should Know
2020-06-08,Edited Transcript of NTB earnings conference call or presentation 1-May-20 2:00pm GMT
2020-06-04,"Butterfield Announces Pricing of Registered Offering of $100,000,000 5.250% Fixed to Floating Rate Subordinated Notes Due 2030"
2020-05-25,What Kind Of Share Price Volatility Should You Expect For The Bank of N.T. Butterfield & Son Limited (NYSE:NTB)?
2020-05-01,The Bank of N.T. Butterfield & Son Limited (NTB) Q1 2020 Earnings Call Transcript
2020-04-30,Butterfield Reports First Quarter 2020 Results
2020-04-30,Butterfield Announces Board Changes
2020-04-23,Earnings Preview: Bank of NT Butterfield & Son (NTB) Q1 Earnings Expected to Decline
2020-04-09,Is Now An Opportune Moment To Examine The Bank of N.T. Butterfield & Son Limited (NYSE:NTB)?
2020-04-08,"Butterfield to Announce First Quarter 2020 Financial Results on April 30, 2020"
2020-04-07,Should You Buy Bank of N.T. Butterfield & Son Limited (The) (NTB)?
2020-03-31,Butterfield (NTB) Surges: Stock Moves 6.4% Higher
2020-02-20,"The Bank of N.T. Butterfield & Son Limited (NYSE:NTB) Passed Our Checks, And It's About To Pay A US$0.44 Dividend"
2020-02-20,Edited Transcript of NTB earnings conference call or presentation 13-Feb-20 3:00pm GMT
2020-02-18,Metro Bank mess looks too much for its new broom to clear up
2020-02-12,Butterfield Reports Fourth Quarter and Full Year 2019 Results
2020-02-06,Is The Bank of N.T. Butterfield & Son Limited (NYSE:NTB) The Right Choice For A Smart Dividend Investor?
2020-02-05,PennyMac (PFSI) to Report Q4 Earnings: What's in the Offing?
2020-01-28,"Butterfield Names New Group Head of Trust, Announces Management Appointments"
2020-01-13,"Butterfield to Announce Fourth Quarter and Full Year 2019 Financial Results on February 12, 2020"
2019-12-23,Bank of N.T. Butterfield & Son (NYSE:NTB) Shareholders Booked A 23% Gain In The Last Year
2019-12-11,Is The Bank of N.T. Butterfield & Son Limited (NTB) A Good Stock To Buy ?
2019-12-04,"Butterfield Rewards Shareholders, Unveils Share-Buyback Plan"
2019-12-03,Butterfield Announces New $125 Million Share Repurchase Program
2019-11-08,What You Must Know About The Bank of N.T. Butterfield & Son Limited's (NYSE:NTB) Beta Value
2019-10-28,Edited Transcript of NTB earnings conference call or presentation 23-Oct-19 2:00pm GMT
2019-10-27,Were Hedge Funds Right About Ditching The Bank of N.T. Butterfield & Son Limited (NTB)?
2019-10-22,Mark Lynch Appointed Independent Director of Butterfield
2019-10-22,Butterfield Reports Third Quarter 2019 Results
2019-10-03,New Strong Sell Stocks for October 3rd
2019-10-03,Is Now The Time To Put Bank of N.T. Butterfield & Son (NYSE:NTB) On Your Watchlist?
2019-10-01,"Butterfield to Announce Third Quarter 2019 Financial Results on October 22, 2019"
2019-09-17,New Strong Sell Stocks for September 17th
2019-09-11,New Strong Sell Stocks for September 11th
2019-09-03,"At US$27.56, Is The Bank of N.T. Butterfield & Son Limited (NYSE:NTB) Worth Looking At Closely?"
2019-07-28,There's A Lot To Like About The Bank of N.T. Butterfield & Son Limited's (NYSE:NTB) Upcoming 1.4% Dividend
2019-07-26,Edited Transcript of NTB earnings conference call or presentation 24-Jul-19 2:00pm GMT
2019-07-24,The Bank of N.T. Butterfield & Son Limited (NTB) Q2 2019 Earnings Call Transcript
2019-07-23,Bank of NT Butterfield &amp; Son (NTB) Q2 Earnings Surpass Estimates
2019-07-23,Butterfield Reports Second Quarter 2019 Results
2019-07-18,Is It Worth Buying The Bank of N.T. Butterfield & Son Limited (NYSE:NTB) For Its 5.4% Dividend Yield?
2019-07-16,Analysts Estimate Bank of NT Butterfield &amp; Son (NTB) to Report a Decline in Earnings: What to Look Out for
2019-07-15,Butterfield Completes Acquisition of ABN AMRO (Channel Islands) Limited
2019-07-11,New Strong Sell Stocks for July 11th
2019-07-01,"Butterfield to Announce Second Quarter 2019 Financial Results on July 23, 2019"
2019-06-23,Is The Bank of N.T. Butterfield & Son Limited (NTB) A Good Stock To Buy ?
2019-06-12,"Introducing Bank of N.T. Butterfield & Son (NYSE:NTB), The Stock That Dropped 25% In The Last Year"
2019-05-16,Butterfield Announces Management Changes as COO Steps Down
2019-05-15,Results of Vote at Butterfield AGM
2019-05-08,UBS Group to Face $93M Penalty for German Tax Evasion Case
2019-05-03,UBS Shareholders Retain Right to Legal Action Against Board
2019-05-02,Deutsche Bank's US Stress Test Worries European Regulators
2019-05-01,Heres What Hedge Funds Think About The Bank of N.T. Butterfield & Son Limited (NTB)
2019-04-27,Edited Transcript of NTB earnings conference call or presentation 25-Apr-19 2:00pm GMT
2019-04-25,The Bank of N.T. Butterfield & Son Limited (NTB) Q1 2019 Earnings Call Transcript
2019-04-25,Bank of NT Butterfield &amp; Son (NTB) Tops Q1 Earnings Estimates
2019-04-25,Bank of NT Butterfield & Son: 1Q Earnings Snapshot
2019-04-25,Butterfield to Acquire ABN AMRO (Channel Islands) Limited
2019-04-25,Butterfield Reports First Quarter 2019 Results and Announces Agreement to Acquire ABN AMRO (Channel Islands) Limited
2019-04-20,What Makes The Bank of N.T. Butterfield & Son Limited (NYSE:NTB) A Great Dividend Stock?
2019-04-18,Bank of NT Butterfield &amp; Son (NTB) Earnings Expected to Grow: What to Know Ahead of Next Week's Release
2019-04-17,Butterfield Streamlines Group Operations
2019-04-16,"Butterfield to Announce First Quarter 2019 Financial Results on April 25, 2019"
2019-04-15,Bank of NT Butterfield &amp; Son (NTB) Earnings Expected to Grow: Should You Buy?
2019-03-31,One Thing To Remember About The The Bank of N.T. Butterfield & Son Limited (NYSE:NTB) Share Price
2019-03-07,What Kind Of Shareholders Own The Bank of N.T. Butterfield & Son Limited (NYSE:NTB)?
2019-02-21,Edited Transcript of NTB earnings conference call or presentation 20-Feb-19 3:00pm GMT
2019-02-20,The Bank of N.T. Butterfield & Son Limited (NTB) Q4 2018 Earnings Conference Call Transcript
2019-02-19,Bank of NT Butterfield & Son: 4Q Earnings Snapshot
2019-02-19,Butterfield Reports Fourth Quarter and Full Year 2018 Results
2019-01-17,"Butterfield to Announce Full Year and Fourth Quarter 2018 Financial Results on February 19, 2019"
2018-12-19,Here is What Hedge Funds Think About Bank of N.T. Butterfield & Son Limited (The) (NTB)
2018-12-10,Butterfield (NTB) Unveils Share Buyback Plan: Worth a Look?
2018-12-06,Butterfield Announces Share Repurchase Program
2018-11-09,3 Top Dividend Stocks With Yields Over 3%
2018-10-28,The Bank of NT Butterfield & Son Limited (NYSE:NTB): 4 Days To Buy Before The Ex-Dividend Date
