2020-11-16,Iconix Reports Financial Results for the Third Quarter 2020
2020-08-12,Iconix Reports Financial Results for the Second Quarter 2020
2020-07-14,Iconix Brand Group Is Open to Selling Itself as It Looks to Tidy Balance Sheet
2020-07-13,Iconix Puts Itself Up For Sale
2020-07-13,Iconix Brand Weighs Strategic Options Including Potential Sale
2020-06-25,Iconix Selling Starter China
2020-05-12,Iconix Reports Financial Results for the First Quarter 2020
2020-04-06,"The Consensus EPS Estimates For Iconix Brand Group, Inc. (NASDAQ:ICON) Just Fell A Lot"
2020-04-01,"Earnings Update: Iconix Brand Group, Inc. (NASDAQ:ICON) Just Reported And Analysts Are Trimming Their Forecasts"
2020-03-30,Iconix Reports Financial Results for the Fourth Quarter & Full Year 2019
2019-12-05,Iconix Brands Ex-CEO Neil Cole Charged by U.S. in Accounting Fraud
2019-12-05,UPDATE 4-Former Iconix Brand CEO charged with accounting fraud in U.S.
2019-12-05,Iconix Brand former CEO charged with accounting fraud
2019-12-05,Edited Transcript of ICON earnings conference call or presentation 12-Nov-19 10:00pm GMT
2019-11-15,"Iconix Brand Group, Inc. Just Reported And Analysts Have Been Cutting Their Estimates"
2019-11-13,"Jay-Z, Iconix settle lawsuits over licensing, alleged fraud"
2019-11-12,Iconix Reports Financial Results For The Third Quarter 2019
2019-11-12,"Could Iconix Brand Group, Inc.'s (NASDAQ:ICON) Investor Composition Influence The Stock Price?"
2019-11-07,"Iconix Brand Group to Announce Third Quarter 2019 Financial Results on November 12, 2019"
2019-08-29,Edited Transcript of ICON earnings conference call or presentation 8-Aug-19 9:00pm GMT
2019-08-14,Trump Brings Holiday Cheer for Consumer & Tech Stocks & ETFs
2019-08-08,Iconix Reports Financial Results For The Second Quarter 2019
2019-08-07,"Iconix Brand Group to Announce Second Quarter 2019 Financial Results on August 8, 2019"
2019-05-25,Edited Transcript of ICON earnings conference call or presentation 14-May-19 2:00pm GMT
2019-05-14,Iconix: 1Q Earnings Snapshot
2019-05-14,Iconix Reports Financial Results For The First Quarter 2019
2019-05-13,Ed Hardy is making a comeback in the U.S. and Canada
2019-05-08,"Iconix Brand Group to Announce First Quarter 2019 Financial Results on May 14, 2019"
2019-04-01,Edited Transcript of ICON earnings conference call or presentation 27-Mar-19 2:00pm GMT
2019-03-28,"Iconix Brand Group Inc (ICON) Files 10-K for the Fiscal Year Ended on December 31, 2018"
2019-03-27,Iconix: 4Q Earnings Snapshot
2019-03-27,Iconix Reports Financial Results For The Fourth Quarter & Full Year 2018
2019-03-21,"Iconix Brand Group to Announce Fourth Quarter and Full Year 2018 Financial Results on March 27, 2019"
2019-03-08,Billionaire Ashley's Investments Could Fill a Department Store
2019-03-01,"Iconix Brand Group, Inc. Names John T. McClain as CFO"
2019-01-30,Jay-Z wins fight for African-American arbitrators in trademark case
2019-01-29,"Investor Expectations to Drive Momentum within EOG Resources, Flowserve, Church & Dwight Co., Fitbit, Qudian Inc. Sponsored ADR, and Iconix Brand Group  Discovering Underlying Factors of Influence"
2018-11-28,"[$$] Lack of Black Arbitrators Discriminatory, Jay-Z Says in New Filing"
2018-11-28,"[$$] Lack of Black Arbitrators Discriminatory, Jay-Z Says in New Filing"
2018-11-28,"Citing racial bias, Jay-Z seeks to halt arbitration against Iconix"
2018-11-28,"Market Trends Toward New Normal in Amarin, BioSpecifics Technologies, Cavco Industries, Iconix Brand Group, A-Mark Precious Metals, and Core-Mark Holding  Emerging Consolidated Expectations, Analyst Ratings"
2018-11-28,"Alliance of American Football will clad Atlanta players in purple, gold and white"
2018-11-21,Edited Transcript of ICON earnings conference call or presentation 9-Nov-18 3:00pm GMT
2018-11-09,Iconix Brands shares slip as Sears weighs on performance
2018-11-09,Iconix: 3Q Earnings Snapshot
2018-11-09,Iconix Reports Financial Results For The Third Quarter 2018
2018-11-08,Iconix Brand's Q3 Earnings Preview
2018-10-25,"Iconix Brand Group to Announce Third Quarter 2018 Financial Results on November 9, 2018"
2018-10-17,"Market Trends Toward New Normal in Halozyme Therapeutics, Fitbit, Iconix Brand Group, Leap Therapeutics, LightPath Technologies, and Capricor Therapeutics  Emerging Consolidated Expectations, Analyst Ratings"
2018-10-15,Sears Bankruptcy 'Another Blow' To Apparel Supplier Iconix
2018-10-15,"Iconix Brand Group, Inc. Announces Hiring Of Robert Galvin As CEO"
2018-09-08,Edited Transcript of ICON earnings conference call or presentation 8-Aug-18 2:00pm GMT
2018-09-05,Iconix Launches Direct To Consumer Ocean Pacific Website
2018-08-23,"Factors of Influence in 2018, Key Indicators and Opportunity within Qurate Retail Group, Bellicum Pharmaceuticals, CannTrust, Iconix Brand Group, Maxwell Technologies, and AZUL SA  New Research Emphasizes Economic Growth"
2018-08-15,[$$] Brand-Licensing Company Iconix Looks to Pare Debt
2018-08-09,"Iconix (ICON) Crashes on Soft Q2 Earnings, Women's Unit Hurts"
2018-08-08,"Iconix Starting Talks With Investors, Reviews Financing Options"
2018-08-08,"Iconix Reviewing Financing Options, Starts Investor Talks"
2018-08-08,Iconix: 2Q Earnings Snapshot
2018-08-08,Iconix Reports Financial Results For The Second Quarter 2018
2018-08-07,Will Weak Segments Weigh Upon Iconix's (ICON) Q2 Earnings?
2018-08-01,"Iconix Brand Group to Announce Second Quarter 2018 Financial Results on August 8, 2018"
2018-07-26,Iconix Brand Group Announces Cooperation Agreement with Sports Direct International
2018-07-19,Free Stock Performance Review on Skechers USA and Three Additional Textile Stocks
2018-07-09,Top Ranked Value Stocks to Buy for July 9th
2018-07-09,"Deckers Banks on Omni-Channel Expansion, Strategic Plans"
2018-07-05,Top Ranked Value Stocks to Buy for July 5th
2018-06-28,Top Ranked Value Stocks to Buy for June 28th
2018-06-27,Top Ranked Value Stocks to Buy for June 27th
2018-06-25,Top Ranked Value Stocks to Buy for June 25th
2018-06-22,Deckers (DECK) Crafts 52-Week High on Strategic Initiatives
2018-06-15,Top Ranked Value Stocks to Buy for June 15th
2018-06-15,Iconix Brand Group Announces Leadership Transition
2018-06-13,Top Ranked Value Stocks to Buy for June 13th
2018-06-13,"Analysis: Positioning to Benefit within Cars, Iconix Brand Group, NRG Yield, Aramark, CBS, and Live Nation Entertainment  Research Highlights Growth, Revenue, and Consolidated Results"
2018-06-11,Top Ranked Value Stocks to Buy for June 11th
2018-06-05,Top Ranked Value Stocks to Buy for June 5th
2018-06-04,Iconix Key Growth Catalysts: Offshore Unit & Cost Savings
2018-06-04,Iconix (ICON) Up 8.3% Since Earnings Report: Can It Continue?
2018-06-01,Iconix Brand Group Confirms Receipt of Director Nominations from Sports Direct International
2018-06-01,Sports Direct Nominates Four Directors to the Board of Iconix
2018-05-29,Deckers' Omni Channel Expansion to Keep Stock on Growth Path
2018-05-15,"DHX Media Ltd. -- Moody's affirms DHX Media's B2 rating, maintains stable outlook"
2018-05-15,Jay-Z subpoenaed by SEC to testify on sale of Roc to Iconix
2018-05-08,Jay-Z is a no-show in federal court
2018-05-08,Jay-Z Ordered to Testify in SEC's Accounting Probe of Retailer
2018-05-08,Edited Transcript of ICON earnings conference call or presentation 4-May-18 2:00pm GMT
2018-05-08,Rapper Jay-Z seeks to limit testimony in U.S. SEC probe
2018-05-07,Jay-Z's lawyers: The government is fascinated with rapper's celebrity
2018-05-07,Jay-Zs Attorneys Say SEC Subpoena Is Weapon in Celebrity Hunt
2018-05-07,"Iconix (ICON) Up 26% Despite Y/Y Fall in Q1 Earnings, Sales"
2018-05-07,Top Ranked Value Stocks to Buy for May 7th
2018-05-04,Jay Z subpoenaed by SEC in Iconix investigation
2018-05-04,"NEW INVESTIGATION ALERT: The Schall Law Firm Announces it is Investigating Claims Against Iconix Brand Group, Inc. and Encourages Investors with Losses in Excess of $100,000 to Contact the Firm"
2018-05-04,"EQUITY ALERT: Rosen Law Firm Announces Investigation of Securities Claims Against Iconix Brand Group, Inc.  ICON"
2018-05-04,Iconix: 1Q Earnings Snapshot
2018-05-04,Iconix Reports Financial Results For The First Quarter 2018
2018-05-03,Judge orders Jay-Z to explain why he's dodging a subpoena
2018-05-03,[$$] SEC Probes Sale of Jay-Z's Clothing Brand
2018-05-03,SEC wants to force Jay-Z to testify after apparel deal soured
