2021-01-11,"Buying Airline Stocks Now Takes Leap of Faith, Analyst Says"
2021-01-11,United Airlines (UAL) Revises Emotional Support Animals Policy
2021-01-09,FAA chief vows tough line after some Trump supporters disrupt flights
2021-01-08,Now Is the Time to Pick Up American Airlines Stock
2021-01-08,"Lots of Good News Baked into Boeing, But Risks Remain"
2021-01-08,American Airlines Has Room to Climb in 2021
2021-01-08,Airline Stocks Are No Longer Cheap. Wall Street Still Says Buy.
2021-01-08,4 Ultra-Popular Robinhood Stocks to Avoid Like the Plague in 2021
2021-01-07,"Ban D.C. riot participants, flight attendants union urges airlines"
2021-01-06,American Airlines (AAL) Outpaces Stock Market Gains: What You Should Know
2021-01-06,"Airline Stock Roundup: DAL's Cash Flow Prediction, AAL, RYAAY in Focus"
2021-01-06,5 Stock Dividends That Aren't Coming Back in 2021
2021-01-06,"Amazon, American Airlines Execs To Advise FAA On Drone Regulation"
2021-01-06,American Airlines (AAL) Alters Emotional Support Animals Policy
2021-01-05,Why Shares of American Airlines Gained Altitude in December
2021-01-05,Will United Or American Airlines Stock Grow More By 2022?
2021-01-05,These 2 big airlines may shock everyone and merge in a bid to survive COVID-19 pandemic: analyst
2021-01-05,Why Airline Stocks Are Trading Higher Today
2021-01-05,Airline sector will recover in 3 to 7 years: analyst
2021-01-05,Southwest Airlines May Be Kicking Off a Fare War Ahead of a Tough Winter
2021-01-04,"The Zacks Analyst Blog Highlights: American Airlines, Boeing, Ryanair, Alaska Air, United Airlines and Southwest Airlines"
2020-12-31,"Airline Stock Roundup: AAL Resumes Boeing 737 Max Operations, RYAAY in Focus"
2020-12-31,How flying will change in 2021
2020-12-31,"Zacks Industry Outlook Highlights: American Airlines, JetBlue Airways, Allegiant Travel Co, Southwest Airlines and Alaska Air"
2020-12-31,Raymond James Places Bet on These 5 Airline Stocks
2020-12-31,5 Stocks to Sell Right Now
2020-12-30,3 Airline Stocks to Watch out for Amid Coronavirus Woes
2020-12-30,American Airlines (AAL) Resumes Boeing 737 Max Flight Services
2020-12-30,AstraZenecas Covid-19 Vaccine Just Got U.K. Approval. Why the Stock Market Shrugged.
2020-12-30,Boeing 737 Max returns to the skies in the US
2020-12-29,Markets Can't Sustain Record Highs; 737 MAX Flies Without Incident
2020-12-29,Boeing 737 Max Begins Its U.S. Comeback As First Flight Lands
2020-12-29,Boeing 737 MAX Takes First Commercial Trip Since Grounding
2020-12-29,Boeing 737 MAX Returns to U.S. Skies
2020-12-29,"Boeing 737 Max Returns To Skies With American Airlines, 2 Years After Deadly Crashes"
2020-12-29,Boeing Could Circle Around a Bit Longer
2020-12-29,Boeing Shares Gain As American Airlines Readies 737 MAX For First U.S. Flight Since Grounding
2020-12-29,American Airlines to restart U.S. commercial Boeing 737 MAX flights
2020-12-26,10 Best Airline Stocks To Buy For 2021
2020-12-26,Benzinga Survey: Will American Airlines Stock Reach $30 By 2022?
2020-12-25,"Is American Airlines Stock A Buy On Covid Vaccine Rollout, Boeing 737 Max Flights?"
2020-12-24,American Airlines (AAL) Stock Sinks As Market Gains: What You Should Know
2020-12-24,2 Must-Own Stocks in 2021
2020-12-24,American Airlines Shoots Itself in the Foot Again
2020-12-23,"Mark Tepper Weighs In On General Electric, Under Armour And More"
2020-12-22,15 Largest Transportation Companies in the World
2020-12-22,Airline Stocks Are Sliding Because Another Bailout Wont Bring Back Travelers
2020-12-22,Why Airlines Outrank Restaurants in Relief Money
2020-12-22,Wrong Time to Buy Airline Stocks
2020-12-22,United Airlines (UAL) to Recall Workers Banking on More Aid
2020-12-22,4 Popular Robinhood Stocks That May Lose 50% (or More) in 2021
2020-12-21,"American, United prepare to recall thousands of employees as relief nears"
2020-12-21,Airline Stocks Fall As Coronavirus Mutates While U.S. Readies More Aid
2020-12-21,81% of luxury passengers plan to take a cruise in 2021: Rpt
2020-12-21,Is AAL A Good Stock To Buy According To Hedge Funds?
2020-12-21,4 Airline Stocks Took Off on Vaccine Hopes: Can They Keep Flying in 2021?
2020-12-21,Travel Stocks Slammed as Virus Mutation Cordons Off U.K.
2020-12-18,"Boeing Stock Is Recovering, But Its Not a Buy Yet"
2020-12-18,"Its Time to Do Selective Profit-Taking in Airline Stocks, JPMorgan Says"
2020-12-17,U.S. airlines closing in on new government assistance package
2020-12-16,"Airline Stock Roundup: UAL's Bleak Q4 Forecast, JBLU's Expansion Update & More"
2020-12-16,A Look Into American Airlines Group's Debt
2020-12-15,Southwest (LUV) CEO Sees a Cloud Cast Over Travel Recovery
2020-12-15,Are Options Traders Betting on a Big Move in American Airlines Group (AAL) Stock?
2020-12-14,Aviation marketplace FLYJETS sees interest double amid pandemic
2020-12-14,Airlines could take at least 3 years to fully recover from COVID-19: Portfolio Manager
2020-12-12,"4 Ultra-Popular Robinhood Stocks That Could Drop 16% to 41%, According to Wall Street"
2020-12-11,You Need More Than Patience to Buy American Airlines
2020-12-11,Wall Street Is Starting to Sour on Airline Stocks. Heres Why.
2020-12-11,Airline stocks get downgraded at Deutsche Bank
2020-12-10,Why Airline Stocks Are Trading Higher Today
2020-12-10,"Airline Stock Roundup: AAL's Dull Cash Burn Update, LUV's Job-Cut Alert & More"
2020-12-10,"Airline Stock Roundup: AAL's Dull Cash Burn Update, LUV's Job-Cut Alert & More"
2020-12-10,Delta (DAL) Scraps Change Fees for International Travel
2020-12-10,3 Hard-Hit Companies Doing Brilliant Things in Their Darkest Hour
2020-12-09,"Boeing 737 Max Commercial Flights, Deliveries Resume After 20 Months"
2020-12-09,"United, Delta join American Airlines in scrapping change fees on international tickets"
2020-12-09,United and Other Airlines Have Racked Up Heavy Losses. That Could Help Them in a Recovery.
2020-12-09,American Airlines (AAL) Expands Coronavirus Tests for U.S. Travel
2020-12-09,Why American Airlines Stock Popped 5% This Morning
2020-12-09,Analyzing American Airlines Group's Unusual Options Activity
2020-12-09,Global supply chain tested as COVID-19 vaccines roll out
2020-12-09,Gol Linhas (GOL) to Resume Operations on Boeing 737 MAX Jets
2020-12-08,Airlines Mired in Multiple Headwinds: Any Silver Lining Ahead?
2020-12-08,American Air to Offer Preflight Passenger Tests for Domestic Travel
2020-12-08,American Airlines Should Dump Its Swanky A321T Jets
2020-12-08,Doug Parker: cargo has been a bright spot for American Airlines
2020-12-08,American Airlines Offers Home COVID-19 Tests So Travelers Can Avoid Quarantine
2020-12-08,American expands preflight testing to all U.S. destinations with travel restrictions
2020-12-08,American expands preflight testing to all U.S. destinations with travel restrictions
2020-12-07,Flight attendant union president on the need for additional stimulus
2020-12-07,Will American Airlines Or Delta Stock Grow More By 2025?
2020-12-07,Why Shares of American Airlines Are Up Today
2020-12-07,'Vaccine passports' may be required for traveling in the future
2020-12-07,Southwest Gets an Upgrade as Outlook for Airlines Brightens
2020-12-07,American Airlines (AAL) Sees Demand Slowdown Amid COVID-19 Spike
2020-12-07,Is It Smart to Sell Airline Stocks as Cash Burn Forecasts Rise?
2020-12-07,Why the COVID-19 vaccine is part of American Airlines flight plan to recovery
2020-12-04,American Airlines (AAL) Outpaces Stock Market Gains: What You Should Know
2020-12-04,Boeing Open To Stock Sale As 737 Max Deliveries Face Airline Uncertainty
