2021-01-11,"SKB finalizes new lease agreement with Twist Bioscience Corporation (""Twist"") at recently repositioned mixed-use campus, ParkWorks Industrial Center"
2021-01-07,Twist Bioscience Supplies Centers for Disease Control and Prevention with Custom SARS-CoV-2 Synthetic RNA Controls
2021-01-04,Twist Bioscience to Present at the 39th Annual J.P. Morgan Healthcare Conference
2020-12-31,The Best Stock Picker of 2020 Wins With Disruptive DNA
2020-12-23,Twist Bioscience to Offer Synthetic RNA Control for UK Variant Strain of SARS-CoV-2
2020-12-22,Twist Bioscience to Expand Commercial Capabilities with Factory of the Future
2020-12-21,How a Relentless Dealmaker Cracked Silicon Valleys Bros Club
2020-12-18,Is TWST A Good Stock To Buy Now According To Hedge Funds?
2020-12-10,Twist Bioscience Expands Gene Product Line with Launch of Clonal-Ready Gene Fragments
2020-12-07,Twist Bioscience Announces Closing of Upsized Public Offering of Common Stock and Full Exercise of Underwriters Option to Purchase Additional Shares
2020-12-02,Twist Bioscience Announces Pricing of a $300 Million Upsized Public Offering of Common Stock
2020-12-01,Twist Bioscience Announces Proposed Public Offering of Common Stock
2020-11-26,Earnings Update: Here's Why Analysts Just Lifted Their Twist Bioscience Corporation (NASDAQ:TWST) Price Target To US$110
2020-11-24,Twist Bioscience to Present at Upcoming Virtual Investor Conferences
2020-11-23,Twist Bioscience Corp (TWST) Q4 2020 Earnings Call Transcript
2020-11-23,Twist Bioscience: Q4 Earnings Insights
2020-11-23,Twist Bioscience Reports Fourth Quarter and Full Year Fiscal 2020 Financial Results
2020-11-23,Twist Bioscience Announces Positive Preclinical Data for SARS-CoV-2 Antibodies
2020-11-23,Twist Bioscience Corp. to Host Earnings Call
2020-11-20,Earnings Preview for Twist Bioscience
2020-11-19,Twist Bioscience and Biotia Announce Research Use Only Availability of First Hybridization Capture-Based Next-Generation Sequencing SARS-CoV-2 Assay for Characterization and Surveillance of the Virus
2020-11-18,Twist Bioscience Ranked 60th Fastest Growing Company in North America on Deloittes 2020 Fast 500
2020-11-16,Will Twist Bioscience (TWST) Report Negative Earnings Next Week? What You Should Know
2020-11-16,Twist Bioscience Expands Infectious Disease Product Line Adding Comprehensive Viral Panel
2020-11-16,Twist Bioscience Continues Support for Next Generation of Synthetic Biologists Through Work with iGEM Competition
2020-11-12,"Twist Bioscience, Illumina and Western Digital Form Alliance with Microsoft to Advance Data Storage in DNA"
2020-11-10,Twist Bioscience to Present at the Stifel 2020 Virtual Healthcare Conference
2020-11-02,"Twist Bioscience to Report Fiscal 2020 Fourth Quarter and Full Year Financial Results on Monday, November 23, 2020"
2020-10-29,Twist Bioscience Showcases Next-Generation Sequencing Presentations at Virtual American Society for Human Genetics 2020 Annual Meeting
2020-10-27,Twist Bioscience Collaborates With Beyond Earth to Launch Artwork Stored in DNA Into Space
2020-10-20,"Benzinga's Top Upgrades, Downgrades For October 20, 2020"
2020-10-13,Hedge Funds Cant Stop Buying Twist Bioscience Corporation (TWST)
2020-10-13,"Twist Bioscience to Host Virtual Biopharma Analyst & Investor Event on October 23, 2020"
2020-10-13,Twist Bioscience and Neogene Announce Broad Strategic Partnership for Next Generation Personalized T Cell Therapies
2020-09-18,"Emily Leproust, Ph.D., to Receive 2020 Rosalind Franklin Award"
2020-09-16,Shareholders Are Thrilled That The Twist Bioscience (NASDAQ:TWST) Share Price Increased 107%
2020-09-03,Twist Bioscience to Present at Upcoming Virtual Investor Conferences
2020-09-02,Twist Bioscience Announces Potent SARS-CoV-2 Neutralizing Data from COVID-19 Therapeutic Antibody Program
2020-08-20,Twist Bioscience Synthetic DNA Stores New Netflix Original Series BIOHACKERS
2020-08-13,Twist Bioscience Is Rapidly Growing Its Customer Base. Can It Turn a Profit?
2020-08-06,"Twist Bioscience (TWST) Reports Q3 Loss, Tops Revenue Estimates"
2020-08-06,Twist Bioscience Reports Third Quarter Fiscal 2020 Financial Results
2020-08-04,Seismic Bio Partners With Twist Bioscience for Discovery and Optimization of Antibodies
2020-07-30,Will Twist Bioscience (TWST) Report Negative Q3 Earnings? What You Should Know
2020-07-30,"Twist Bioscience to Report Fiscal 2020 Third Quarter Financial Results on Thursday, August 6, 2020"
2020-07-28,Twist Bioscience Launches Two SARS-CoV-2 Antibody Panels to Expedite Research for COVID-19
2020-07-23,"Twist Bioscience Appoints Erin Smith Senior Vice President, Government Affairs and Public Policy"
2020-07-22,Twist Bioscience Has Gained 186% in 2020. Is the Synbio Stock a Buy?
2020-07-22,Twist Bioscience Launches Synthetic Controls for Respiratory Viruses
2020-07-16,Twist Bioscience Partners with Invetx to Deliver Best-in-Class Antibody Therapeutics for Dogs and Cats
2020-07-15,Twist Bioscience Customer Vanderbilt University Medical Center (VUMC) Announces Publication of Positive Preclinical Results on Neutralizing Antibodies as a Potential Therapy for Preventing and Treating COVID-19
2020-07-08,Takeda Partners with Twist Bioscience to Expand Biologics Discovery Capabilities
2020-07-01,"The Daily Biotech Pulse: T2 Biosystems Launches COVID-19 Test, Akero Aces Midstage NASH Study, Aravive Added to Russell Indexes"
2020-06-30,Twist Bioscience Adds Respiratory Virus Panel to Infectious Disease Product Line
2020-06-28,Hedge Funds Keep Buying Twist Bioscience Corporation (TWST)
2020-06-11,Twist Bioscience Expands Offering of Synthetic SARS-CoV-2 RNA Controls
2020-06-09,Twist Bioscience Partners with Serimmune to Identify SARS-CoV-2 Therapeutic Antibody Candidates
2020-06-08,Twist Bioscience Announces Closing of Public Offering of Common Stock and Full Exercise of Underwriters Option to Purchase Additional Shares
2020-06-03,Twist Bioscience Announces Pricing of a $100 Million Public Offering of Common Stock
2020-06-03,Twist Bioscience Announces Proposed Public Offering of Common Stock
2020-06-01,Twist Bioscience to Join Proteona in Global Alliance to Protect Immunocompromised Patients From COVID-19 Infection
2020-05-26,Twist Bioscience to Present at the Jefferies Virtual Healthcare Conference
2020-05-17,Schrodinger Shares Have More Than Tripled Since IPO
2020-05-12,Twist Bioscience to Participate in the UBS Virtual Global Healthcare Conference
2020-05-08,Twist Bioscience Corp (TWST) Q2 2020 Earnings Call Transcript
2020-05-07,"Twist Bioscience (TWST) Reports Q2 Loss, Tops Revenue Estimates"
2020-05-07,Twist Bioscience Reports Second Quarter Fiscal 2020 Financial Results
2020-05-06,Twist Bioscience Identifies Competitive Antibodies for SARS-CoV-2
2020-04-30,"Twist Bioscience to Report Fiscal 2020 Second Quarter Financial Results on Thursday, May 7, 2020"
2020-04-28,Twist Bioscience (TWST) May Report Negative Earnings: Know the Trend Ahead of Q2 Release
2020-04-20,"Twist Bioscience's Shares March Higher, Can It Continue?"
2020-04-20,"Twist Bioscience Expands Flexibility of Clonal Genes for Pharmaceutical, Biotechnology and Industrial Chemical Research"
2020-04-13,Why Twist Bioscience (TWST) Stock Might be a Great Pick
2020-03-26,Twist Bioscience Partners with Vanderbilt University Medical Center to Supply Critical Products and Identify Antibody Therapeutics for COVID-19
2020-03-25,Twist Bioscience Synthetic SARS-CoV-2 RNA Controls Added to FDA Website as Reference Materials
2020-03-24,Biotech stocks have held up better than the broader market  and these five are potential winners
2020-03-16,Twist Announces Availability of Next-Generation Sequencing Target Enrichment Panel for SARS-CoV-2/COVID-19 Research
2020-03-12,Twist Bioscience Announces Availability of Synthetic SARS-CoV-2 RNA Controls
2020-02-26,Twist Bioscience and SOPHiA GENETICS Collaborate to Offer Optimized Genomic Solutions
2020-02-26,Twist Bioscience to Present at the Cowen 40th Annual Health Care Conference
2020-02-25,Twist Bioscience and Miroculus Agree to Collaborate on Next-Generation Sequencing Target Enrichment and Library Preparation Tools for Clinical Research
2020-02-24,Twist Bioscience Announces Closing of Upsized Public Offering of Common Stock and Full Exercise of Underwriters Option to Purchase Additional Shares
2020-02-24,"Twist Bioscience Launches New NGS Solutions, Highlights Customers at 2020 Advances in Genome Biology and Technology Conference"
2020-02-24,GenapSys Partners With Twist Bioscience to Bring Next-Generation Sequencing Target Enrichment and Library Preparation to Worlds Most Accessible Highly Accurate Sequencer
2020-02-19,Twist Bioscience Announces Pricing of Upsized $130.0 Million Public Offering of Common Stock
2020-02-18,Twist Bioscience Announces Proposed Public Offering of Common Stock
2020-02-12,Twist Bioscience Now ISO 27001:2013 Certified for Information Security Management System
2020-02-06,Twist Bioscience Corp. to Host Earnings Call
2020-02-06,"The Daily Biotech Pulse: Tonix Slumps On Failed Study, Applied Genetic Announces Offering, Beam Therapeutics, PPD Price IPOs"
2020-01-31,CORRECTING and REPLACING Twist Bioscience Announces Completion of $50 Million Offering Priced At-The-Market
2020-01-23,Inovio Selected by CEPI to Develop Vaccine Against New Coronavirus
2020-01-23,Inovio Selected by CEPI to Develop Vaccine Against New Coronavirus
2020-01-23,"Twist Bioscience to Report Fiscal 2020 First Quarter Financial Results on Thursday, February 6, 2020"
2020-01-15,Twist Bioscience Selected as DNA Synthesis Provider for DNA Data Storage Project Under Intelligence Advanced Research Projects Activity (IARPA) Molecular Information Storage (MIST) Program
2020-01-15,Twist Bioscience Announces Strategic Collaboration With Schrödinger for Drug Discovery
2020-01-13,Twist Bioscience Promotes Patrick Weiss to Chief Operating Officer Setting Stage for Future Growth
2020-01-06,Twist Bioscience to Present at the 38th Annual J.P. Morgan Healthcare Conference
2019-12-17,Hedge Funds Have Never Been This Bullish On Twist Bioscience Corporation (TWST)
2019-12-12,"The Daily Biotech Pulse: European Nod For Amgen, miRagen Overhauls Clinical Pipeline, Tonix Snags Patent Win"
2019-12-11,Twist Bioscience Reports Fourth Quarter and Full Year Fiscal 2019 Financial Results
