2021-01-11,Foresight to Present at CES 2021 Virtual Conference
2020-12-28,Foresight Autonomous Holdings Prices $26 Million Registered Direct Offering
2020-12-23,FRSX Stock: 6 Things to Know About AV Play Foresight Autonomous
2020-12-16,Foresight Partners with University of Michigan's TechLab at Mcity to Enhance Vision Systems for Autonomous Vehicles
2020-12-11,Foresight: Rail Vision Enters Electrically Powered Light Rail Vehicle Multi-Billion Dollar Market with Order from Knorr-Bremse
2020-12-04,Foresight to Take Part in Automation of Future Heavy-Duty Vehicles European Project
2020-12-03,Foresight to Showcase Its Mass Screening COVID-19 Symptom Detection Solution in the United Arab Emirates
2020-11-12,Foresight Announces Third Quarter 2020 Financial Results
2020-11-04,Foresight Completes Integration of NVIDIA Platforms for Use in Autonomous Machines and Vehicles
2020-10-21,Foresight to Launch Its COVID-19 Symptom Detection Solution in Japan at SEECAT 2020 Exhibition
2020-10-13,Knorr-Bremse Makes Additional $10 Million Investment in Rail Vision
2020-10-02,Foresight: Eye-Net Mobile Signs Distribution Agreement with Leading Japanese Trading House Cornes Technologies
2020-09-04,Foresight: Rail Vision Signs Commercial Agreement with Knorr-Bremse Affiliate to Supply Shunting Yard Systems to Leading European Train Operator
2020-09-02,Foresight Completes Development of Commercial Version of its Groundbreaking Automatic Calibration Software
2020-08-31,LD Micro -- 360 Companies Set to Present this Week
2020-08-28,Foresight: Eye-Net Mobile to Begin Pilot Project with Second Japanese Multinational Company
2020-08-25,Foresight Autonomous Holdings: Letter to Shareholders
2020-08-21,Foresight: Eye-Net Mobile and Global Japanese Technology Company to Start Pilot Project
2020-08-20,Foresight Announces Second Quarter 2020 Financial Results
2020-08-17,Foresight to Present at LD Micro 500 Virtual Conference
2020-08-05,LD Micro Announces Preliminary List of Presenters for the LD 500.
2020-07-31,7 Penny Stocks for the Valiant Investor
2020-07-31,Foresight Subsidiary Eye-Net Mobile Receives Notice of Allowance for Patent Application from U.S. Patent and Trademark Office
2020-07-27,Foresight Receives Order from Leading Multi-Billion Dollar Global Chinese Technology Company
2020-07-19,Foresight to begin pilot for its COVID-19 symptom detection system
2020-07-17,Foresight to Initiate First Pilot Project for Its COVID-19 Symptom Detection Solution
2020-07-02,Foresight Receives Two Orders from Elbit Systems Ltd. for Product Development and Customization
2020-06-24,Foresight Appoints Alain Charlois as Vice President of Strategic Partnerships in North America and Europe
2020-06-22,Foresight Regains Compliance with Nasdaq Minimum Bid Price Requirement
2020-06-09,Foresight Autonomous Holdings Prices $6.4 Million Registered Direct Offering
2020-06-05,"Foresight's stock more than doubles, after patent application filed for COVID-19 symptoms detection system"
2020-06-05,Foresight to Enable Mass Screening for Detection of COVID-19 Pandemic Symptoms Using Thermal Cameras and Artificial Intelligence Expertise
2020-05-21,Foresight Announces First Quarter 2020 Financial Results
2020-05-19,Foresight Autonomous Holdings Prices $5 Million Registered Direct Offering
2020-05-15,Foresight Joins Leading Global Industry Consortium for Development of Autonomous Heavy-Duty Vehicles
2020-05-07,Foresight Announces QuadSight® Sale to Leading European Tier One Supplier of Commercial Vehicles in $1 Billion USD Autonomous Truck Market
2020-04-28,Foresight Autonomous Holdings Ltd. Prices $2.65 Million Registered Direct Offering
2020-04-27,"Foresight Affiliate Rail Vision Receives First Order of 500,000 Euro from Leading European Train Operator"
2020-04-22,Foresight Continues to Progress During COVID-19 Pandemic
2020-04-16,Foresight Receives Nasdaq Notification Regarding Minimum Bid Requirements
2020-04-06,Foresight Subsidiary Eye-Net Mobile Announces Technological Developments to Enhance Protection for Cyclists and Motorists in Its Accident Prevention Solution
2020-04-01,"FLIR Systems, Inc. and Foresight Sign Agreement to Develop, Market and Distribute QuadSight® Vision System"
2020-03-30,Foresight Subsidiary Eye-Net Mobile Signs Agreement with Smart City Company NoTraffic Ltd.
2020-03-12,Foresight Announces Fourth Quarter and Full Year 2019 Financial Results
2020-03-03,Foresight to Present at 32nd Annual ROTH Conference
2020-02-18,Foresight Receives Order of QuadSight® Prototype from a Multi-Billion Dollar Japanese Vehicle Manufacturer
2020-02-03,Foresight Subsidiary Eye-Net Mobile Selected as Finalist in GSMAs MWC Barcelona 2020 Global Mobile Awards
2020-01-30,Foresight Affiliate Rail Vision in Advanced Negotiations with Leading European Train Operator for First Commercial Agreement
2020-01-14,Foresight to Hold Annual Investor Conference in Israel
2020-01-06,Foresight Announces Major New Technological Features for QuadSight® Vision System
2019-12-23,Foresight Selects Cognata as Simulation Partner for Camera Vision Systems
2019-12-20,Foresights QuadSight® Vision System Goes Live at CES 2020
2019-12-18,"Foresights Subsidiary, Eye-Net Mobile, to Launch SDK Configuration of Cellular-Based Accident Prevention Solution at CES 2020"
2019-11-20,Foresight to Present at 12th Annual LD Micro Main Event
2019-11-18,Foresight Announces Third Quarter 2019 Financial Results
2019-11-14,Frost & Sullivan Begins Coverage of Foresight Autonomous Holdings (FRSX): A Game Changing Company Targeting Autonomous Vehicles
2019-11-12,Foresight Receives Order of QuadSight Prototype from American Division of Leading South Korean Vehicle Manufacturer
2019-10-16,Foresight Successfully Completes Technological Demonstrations for Leading Vehicle Manufacturers and Tier One Suppliers in Germany
2019-09-13,Foresight Signs Agreement with Leading Chinese Infrared Camera Manufacturer
2019-08-14,Eye-Net Mobile Successfully Completes Controlled-Environment Trial for the Connected Car Division of a Leading Global Vehicle Manufacturer
2019-08-12,Eye-Net Mobile Completes Successful Large-Scale Trial of Cellular-Based Accident Prevention Solution
2019-08-09,Foresight Announces Second Quarter and First Half 2019 Financial Results
2019-07-25,CORRECTING and REPLACING Foresights Successful U.S. Technological Demonstrations Lead to Sale of QuadSight Prototype
2019-07-19,Foresight Receives Order of QuadSight Prototype from Leading Japanese Tier One Supplier
2019-07-11,Eye-Net Mobile Announces Large-Scale Trial of Cellular-Based Accident Prevention Solution
2019-07-08,Foresight Successfully Completes Technological Demonstrations for Leading Vehicle Manufacturers and Tier One Suppliers in United States
2019-06-28,Foresight Signs Agreement with Chinese Tier One Automotive Supplier
2019-06-20,"A Look At Benzinga Pro's Most-Searched Tickers For June 20, 2019"
2019-06-19,Foresight in deal with Elbit Systems for image processing software
2019-06-19,Foresight Signs First Commercial Agreement with Elbit Systems
2019-06-05,Foresight Opens Demonstration Center to Investors
2019-05-22,Foresight Successfully Completes Technological Demonstrations for Leading Vehicle Manufacturers in France
2019-05-15,Foresight Announces First Quarter 2019 Financial Results
2019-05-14,Foresight Signs Exclusive Distribution Agreement in Japan
2019-05-13,Foresight to Participate at TU-Automotive Detroit Exhibition
2019-04-08,Foresight Wins Gold at 2019 Edison Awards
2019-04-01,Foresight Receives Notice of Allowance for First Patent Application from U.S. Patent and Trademark Office
2019-03-20,Foresight Announces Fourth Quarter and Full Year 2018 Financial Results
2019-03-19,"Foresight Autonomous Holdings Ltd. Closes Offering of 4,100,000 American Depositary Shares Including Partial Exercise of Over-Allotment Option"
2019-03-15,"Foresight Autonomous Holdings Ltd. Prices Offering of 4,000,000 American Depositary Shares"
2019-03-14,Foresight Autonomous Holdings Ltd. Announces Proposed Public Offering of American Depositary Shares
2019-03-14,"Foresight: Rail Vision Receives $10 Million Strategic Investment from Knorr-Bremse, a Leading Global Supplier of Rail Braking Systems"
2019-03-06,Eye-Net Mobile Successfully Completes Additional Trial of its Accident Prevention Solution in Collaboration with One of Israel's Largest Cities
2019-03-04,Foresight Completes Additional Sale of QuadSight Prototype
2019-02-19,Foresights QuadSight Vision System Selected as Finalist in 2019 Edison Awards
2019-01-30,Foresight Receives $1 Million Investment from RH Electronics at $4.08 per ADS
2019-01-07,Eye-Net Mobile Successfully Completes Initial Integration with the Assistance of a Leading Israeli Cellular Provider
2018-12-19,Foresights QuadSight Makes the Invisible Visible for Drivers in All Weather and Lighting Conditions at CES 2019
2018-12-17,Foresight and RH Electronics to Join Forces for a Strategic Alliance
2018-12-03,Foresight Vision System Installed in Leading Automotive OEMs Vehicle
2018-11-19,Foresight to Present at 11th Annual LD Micro Main Event
2018-11-15,Foresight Announces Third Quarter 2018 Financial Results
2018-11-09,Foresights QuadSight Vision System Wins Prestigious 2019 CES Innovation Award
2018-11-05,Foresight Increases Stake in RailVision Following Successful Technological and Commercial Developments
2018-11-01,Foresight to Hold Investor Conference and Live Demonstration of QuadSight Quad-Camera Vision System
2018-08-28,Foresight Secures Additional Sale of QuadSight Prototype
2018-08-24,NetworkNewsAudio Announces Audio Press Release (APR) on Foresight Autonomous Holdings (NASDAQ: FRSX) (TASE: FRSX) Technology Key to Safer Driving Future
2018-08-23,"NetworkNewsWire Announces Publication on Innovative Technology Advancements Paving the Way for Safety, Opportunities in Future of Self-Driving"
2018-08-21,"Foresight Selected as Finalist for NMW Startup Challenge, the Innovation Platform of the IAA Commercial Vehicles"
2018-08-17,Foresight Announces Second Quarter 2018 Financial Results
