2021-01-05,"Kymera Therapeutics to Present at the 39th Annual J.P. Morgan Healthcare Conference on Thursday, January 14, 2021"
2020-12-19,Is KYMR A Good Stock To Buy Now According To Hedge Funds?
2020-12-16,Kymera Therapeutics Announces Key Leadership Appointments
2020-12-07,Kymera Therapeutics Presents Preclinical Data on IRAKIMiD and STAT3 Programs at Virtual 62nd American Society of Hematology (ASH) Annual Meeting
2020-11-26,"Analysts Are Betting On Kymera Therapeutics, Inc. (NASDAQ:KYMR) With A Big Upgrade This Week"
2020-11-23,Kymera Therapeutics to Present at the Piper Sandler 32nd Annual Healthcare Conference
2020-11-21,"What You Need To Know About Kymera Therapeutics, Inc.'s (NASDAQ:KYMR) Investor Composition"
2020-11-11,Kymera Therapeutics to Present at the Stifel 2020 Virtual Healthcare Conference
2020-11-05,Kymera Therapeutics Announces Third Quarter 2020 Financial Results and Provides Business Update
2020-11-04,Kymera Therapeutics to Present Data on Novel IRAKIMiD and STAT3 Protein Degraders  at Virtual 62nd American Society of Hematology (ASH) Annual Meeting
2020-10-12,Kymera Therapeutics to Deliver Two Podium Presentations at 3rd Annual Targeted Protein Degradation Summit
2020-10-12,Kymera Therapeutics Pops 10% On Positive Skin Disorder Data
2020-10-09,Kymera Therapeutics to Present Interim Results from a Non-Interventional Study Characterizing IRAK4 Expression and Demonstrating Proof of Mechanism of an IRAK4 Degrader in Patients with Hidradenitis Suppurativa
2020-09-14,Kymera Therapeutics to Present at Morgan Stanley 18th Annual Global Healthcare Conference
2020-09-09,Kymera Therapeutics Appoints Biopharma Veterans  Pamela Esposito and Jeff Albers to its Board of Directors
2020-08-27,Kymera Therapeutics Appoints Dr. Richard Chesworth as Chief Scientific Officer
2020-08-25,Kymera Therapeutics Announces Closing of Initial Public Offering with Exercise in Full of the Underwriters Option to Purchase Additional Shares and Concurrent Private Placement
2020-08-20,Kymera Therapeutics Announces Pricing of Upsized Initial Public Offering
