2021-01-11,The Trends At NiSource (NYSE:NI) That You Should Know About
2020-12-17,NiSource's (NI) Arm to Buy 280MW Energy From Capital Dynamics
2020-12-16,NIPSCO and Capital Dynamics Sign 280MW Solar Energy Power Purchase Agreement
2020-12-02,Why Is NiSource (NI) Up 1.9% Since Last Earnings Report?
2020-11-18,NiSource Named to 2020 Dow Jones Sustainability Index
2020-11-17,NiSource Joins the Asset to Vendor Network in Push to Secure US Utilities
2020-11-04,Did You Participate In Any Of NiSource's (NYSE:NI) Respectable 45% Return?
2020-11-02,"NiSource's (NI) Q3 Earnings Beat Estimates, Revenues Miss"
2020-11-02,NiSource: Q3 Earnings Insights
2020-11-02,NiSource (NI) Surpasses Q3 Earnings Estimates
2020-11-02,NiSource Reports Third Quarter 2020 Results
2020-10-30,PPL Corp (PPL) to Report Q3 Earnings: What's in the Cards?
2020-10-30,Is a Surprise Coming for NiSource (NI) This Earnings Season?
2020-10-28,NiSource (NI) to Report Q3 Earnings: What's in the Offing?
2020-10-23,NiSource Announces Leadership Changes in Legal and Federal Government Affairs
2020-10-21,"NIPSCO Announces New Indiana-Based Solar Projects To Power 270,000 Homes By 2023"
2020-10-20,Atmos Energy and Xcel Energy Set to Join Dow Jones Utility Average
2020-10-12,NiSource Announces Earnings Release and Conference Call for Nov. 2
2020-10-07,Northern Indiana Public Service Company -- Moody's announces completion of a periodic review of ratings of NiSource Inc.
2020-10-06,Hedge Funds Are Dumping NiSource Inc. (NI)
2020-09-30,NiSource Expands Long-Term Infrastructural Investment Plan
2020-09-29,NiSource Outlines Progress on Long-term Growth Strategy at Virtual Investor Day
2020-09-16,A Trio of High Yield Stock Picks for the Dividend Income Investor
2020-09-16,"NiSource to Host Virtual Investor Day on September 29, 2020"
2020-09-07,"Market Update: AVGO, COST, NI"
2020-09-07,Analyst Report: Nisource Inc. (Holding Co.)
2020-09-04,NiSource (NI) Down 7.9% Since Last Earnings Report: Can It Rebound?
2020-09-02,Utilities sector in broad rally as Treasury yields extend declines after downbeat economic data
2020-08-28,"NiSource (NI) Prices Maximum Tender Offer, To Cut Capital Cost"
2020-08-26,NiSource Inc. Announces Pricing of its Maximum Tender Offer
2020-08-26,NiSource Inc. Announces the Early Tender Results of its Tender Offer for its Maximum Tender Offer Notes
2020-08-18,NiSource Inc. Announces Pricing and Preliminary Results of its Any and All Tender Offer
2020-08-14,NiSource (NI) Prices $2B Senior Notes to Refinance Debts
2020-08-12,"NiSource Inc. Announces Pricing of $1,250,000,000 of 0.950% Senior Notes due 2025 and $750,000,000 of 1.700% Senior Notes due 2031"
2020-08-12,NiSource Inc. Announces Cash Tender Offers for Certain Outstanding Series of Notes
2020-08-11,NiSource Declares Common and Preferred Stock Dividends
2020-08-06,How Is NiSource's (NYSE:NI) CEO Compensated?
2020-08-05,"NiSource's (NI) Q2 Earnings Beat Estimates, Revenues Miss"
2020-08-05,NiSource (NI) Q2 Earnings Top Estimates
2020-08-05,NiSource: Q2 Earnings Insights
2020-08-05,NiSource Reports Second Quarter 2020 Results
2020-07-31,What's in the Cards for NiSource (NI) This Earnings Season?
2020-07-29,NiSource (NI) Earnings Expected to Grow: What to Know Ahead of Next Week's Release
2020-07-17,NIPSCO Announces Addition Of Two Indiana-Grown Solar Projects
2020-07-15,NiSource Announces Earnings Release and Conference Call for Aug. 5
2020-07-12,Did Hedge Funds Make The Right Call On NiSource Inc. (NI) ?
2020-07-02,Utility NiSource to pay $56 mln to resolve Massachusetts gas explosions probe
2020-06-16,6 Utilities Trading With Low Price-Sales Ratios
2020-06-15,Edited Transcript of NI.N earnings conference call or presentation 6-May-20 1:00pm GMT
2020-06-08,Here is What Hedge Funds Think About NiSource Inc. (NI)
2020-06-05,NiSource (NI) Up 7.5% Since Last Earnings Report: Can It Continue?
2020-06-04,Robbins LLP Reminds Investors It Is Investigating the Officers and Directors of NiSource Inc. (NI) on Behalf of Shareholders
2020-05-29,NiSource's (NI) Systematic Capital Investments Bode Well
2020-05-21,NiSource Announces Repositioning of Executive Leadership Team Roles and Responsibilities
2020-05-20,A Trio of Loyal Payers Announces Dividends
2020-05-19,NiSource Declares Common and Preferred Stock Dividends
2020-05-18,NiSource's (NI) Unit Files for Rate Hike to Maryland PSC
2020-05-17,Billionaire George Soros Bets on These 3 High-Yield Dividend Stocks
2020-05-15,Major US Indexes Gain on Friday
2020-05-15,Columbia Gas of Maryland Files Request for Investment in Safety Through Replacing and Upgrading Aging Infrastructure
2020-05-11,Robbins LLP Reminds Investors It Is Investigating the Officers and Directors of NiSource Inc. (NI) on Behalf of Shareholders
2020-05-08,NiSource Inc. Just Missed Earnings And Its EPS Looked Sad - But Analysts Have Updated Their Models
2020-05-06,NiSource (NI) Q1 2020 Earnings Call Transcript
2020-05-06,NiSource's (NI) Earnings and Revenues Miss Estimates in Q1
2020-05-06,NiSource (NI) Q1 Earnings and Revenues Lag Estimates
2020-05-05,"Utility Stock Earnings Roster for May 6: AEP, NI & More"
2020-05-04,What's in the Cards for NiSource (NI) This Earnings Season?
2020-04-29,Analysts Estimate NiSource (NI) to Report a Decline in Earnings: What to Look Out for
2020-04-24,Columbia Gas of Pennsylvania Files Request for Investment in Safety Through Replacing and Upgrading Aging Infrastructure
2020-04-24,Looking For Steady Income For Your Dividend Portfolio? Is NiSource Inc. (NYSE:NI) A Good Fit?
2020-04-16,NiSource Announces Earnings Release and Conference Call for May 6
2020-04-15,NiSource renews commitments in 2019 Integrated Annual Report
2020-03-27,NiSource (NI) Down 10.1% Since Last Earnings Report: Can It Rebound?
2020-03-27,NiSource Charitable Foundation Donates $1 million to COVID-19 Relief Supporting the Safety of Our Communities
2020-03-24,NiSource's (NI) Long-Term Modernization Program Bodes Well
2020-03-19,Hedge Funds Have Never Been This Bullish On NiSource Inc. (NI)
2020-03-19,NiSource (NYSE:NI) Shares Have Generated A Total Return Of 63% In The Last Five Years
2020-03-17,NiSource Declares Common and Preferred Stock Dividends
2020-03-10,Lloyd Yates Appointed to NiSource Board of Directors
2020-03-09,Edited Transcript of NI earnings conference call or presentation 27-Feb-20 2:00pm GMT
2020-03-03,WeissLaw LLP: NiSource Inc. is the Subject of a Legal Investigation
2020-02-27,"NiSource's (NI) Q4 Earnings Beat Estimates, Revenues Miss"
2020-02-26,NiSource Reports 2019 Results
2020-02-26,Eversource to buy assets of Columbia Gas of Massachusetts
2020-02-26,NiSource Announces Sale of Columbia Gas of Massachusetts to Eversource
2020-02-26,NiSource unit to plead guilty after U.S. probe into Massachusetts gas explosions
2020-02-25,NiSource Announces Change to Earnings Release Schedule
2020-02-25,Is a Surprise Coming for NiSource (NI) This Earnings Season?
2020-02-21,Dunkin is more popular than Tom Brady in this Bay State poll
2020-02-19,NiSource (NI) Earnings Expected to Grow: Should You Buy?
2020-02-18,How Did NiSource Inc.'s (NYSE:NI) 8.7% ROE Fare Against The Industry?
2020-02-12,NiSource (NI) Earnings Expected to Grow: What to Know Ahead of Q4 Release
2020-02-12,What's in the Cards for NiSource (NI) This Earnings Season?
2020-02-12,NiSource Schedules Earnings Release and Conference Call for Feb. 26
2020-01-31,NiSource Declares Common and Preferred Stock Dividends
2020-01-28,Analyst: 3 Dividend Stocks to Own in a Volatile Market
2020-01-13,Is NiSource Inc. (NYSE:NI) Excessively Paying Its CEO?
2019-12-17,Here's Why You Should Add NiSource (NI) in Your Portfolio Now
2019-12-13,Is NiSource Inc. (NYSE:NI) Worth US$26.7 Based On Its Intrinsic Value?
2019-12-07,Is NiSource Inc. (NI) A Good Stock To Buy?
