2020-12-23,"Peoples Bancorp Inc. to Announce 4th Quarter 2020 Earnings and Conduct Conference Call on January 26, 2021"
2020-12-22,Our View On Peoples Bancorp's (NASDAQ:PEBO) CEO Pay
2020-12-04,Is Peoples Bancorp (PEBO) A Good Stock To Buy Now?
2020-10-27,Peoples Bancorp Inc. Announces Planned Retirement Of David L. Mead From Board Of Directors; Susan D. Rector Elected Chairman Of The Board
2020-10-23,Peoples Bancorp Inc. Just Beat Earnings Expectations: Here's What Analysts Think Will Happen Next
2020-10-20,Peoples Bancorp Inc (PEBO) Q3 2020 Earnings Call Transcript
2020-10-20,"Peoples Bancorp, Inc. (Ohio) to Host Earnings Call"
2020-10-20,Peoples Bancorp (PEBO) Surpasses Q3 Earnings and Revenue Estimates
2020-10-20,Recap: Peoples Bancorp Q3 Earnings
2020-10-20,Peoples Bancorp Inc. Declares Quarterly Dividend
2020-10-13,Peoples Bancorp (PEBO) Expected to Beat Earnings Estimates: Can the Stock Move Higher?
2020-09-28,Here's Why Peoples Bancorp (PEBO) Stock is a Solid Pick Now
2020-09-25,"Peoples Bancorp Inc. To Announce 3rd Quarter 2020 Earnings And Conduct Conference Call On October 20, 2020"
2020-09-24,A Look At Peoples Bancorp's (NASDAQ:PEBO) Share Price Returns
2020-08-24,Peoples Bancorp Inc. Announces Retirement Of Chief Financial Officer John Rogers And Promotion Of Katie Bailey To Chief Financial Officer
2020-07-26,Peoples Bancorp Inc. (NASDAQ:PEBO) Will Pay A US$0.34 Dividend In Four Days
2020-07-24,Peoples Bancorp Inc. Just Beat EPS By 123%: Here's What Analysts Think Will Happen Next
2020-07-21,Peoples Bancorp Inc (PEBO) Q2 2020 Earnings Call Transcript
2020-07-21,Peoples Bancorp (PEBO) Tops Q2 Earnings Estimates
2020-07-21,What Type Of Shareholders Own The Most Number of Peoples Bancorp Inc. (NASDAQ:PEBO) Shares?
2020-07-21,Peoples Bancorp Inc. Declares Quarterly Dividend
2020-07-21,Peoples Bancorp Inc. Reports Quarterly Net Income
2020-07-14,Earnings Preview: Peoples Bancorp (PEBO) Q2 Earnings Expected to Decline
2020-07-04,Do Hedge Funds Like Peoples Bancorp Inc. (PEBO)?
2020-06-30,Associated Banc-Corp (ASB) Looks Good: Stock Adds 6% in Session
2020-06-23,Why Peoples Bancorp (PEBO) Should be Added to Your Portfolio
2020-06-23,"Regions Financial Cost Control Strong, Diversification a Woe"
2020-06-10,Edited Transcript of PEBO earnings conference call or presentation 21-Apr-20 3:00pm GMT
2020-04-21,"Peoples Bancorp (PEBO) Reports Q1 Loss, Tops Revenue Estimates"
2020-04-21,"Peoples Bancorp, Inc. (Ohio) to Host Earnings Call"
2020-04-21,Recap: Peoples Bancorp Q1 Earnings
2020-04-21,Peoples Bancorp Inc. Declares Quarterly Dividend
2020-04-21,Peoples Bancorp Inc. Reports Quarterly Net Loss
2020-04-20,Is There Now An Opportunity In Peoples Bancorp Inc. (NASDAQ:PEBO)?
2020-04-20,Why Peoples Bancorp (PEBO) Might Surprise This Earnings Season
2020-04-16,Peoples Bank helps clients obtain SBA authorization for $422 million in Paycheck Protection Program loans
2020-04-14,Analysts Estimate Peoples Bancorp (PEBO) to Report a Decline in Earnings: What to Look Out for
2020-04-01,"Peoples Bancorp Inc. to Announce 1st Quarter 2020 Earnings and Conduct Conference Call on April 21, 2020"
2020-03-31,Peoples Bancorp Inc. Announces Virtual Annual Meeting
2020-03-19,"How Does Peoples Bancorp's (NASDAQ:PEBO) P/E Compare To Its Industry, After The Share Price Drop?"
2020-03-11,Why Peoples Bancorp (PEBO) is a Great Dividend Stock Right Now
2020-03-11,Imagine Owning Peoples Bancorp (NASDAQ:PEBO) And Wondering If The 21% Share Price Slide Is Justified
2020-02-28,Peoples Bancorp Inc. Announces Share Repurchase Program
2020-02-24,Why Peoples Bancorp (PEBO) is a Great Dividend Stock Right Now
2020-02-07,Peoples Bancorp (PEBO) is a Top Dividend Stock Right Now: Should You Buy?
2020-01-26,Here's What We Like About Peoples Bancorp Inc. (NASDAQ:PEBO)'s Upcoming Dividend
2020-01-23,Edited Transcript of PEBO earnings conference call or presentation 21-Jan-20 4:00pm GMT
2020-01-22,Are You Looking for a High-Growth Dividend Stock? Peoples Bancorp (PEBO) Could Be a Great Choice
2020-01-21,Peoples Bancorp Inc. Declares Quarterly Dividend
2020-01-15,Here's Why I Think Peoples Bancorp (NASDAQ:PEBO) Might Deserve Your Attention Today
2020-01-14,Peoples Bancorp (PEBO) Reports Next Week: What Awaits?
2019-12-23,Do Hedge Funds Love Peoples Bancorp Inc. (PEBO)?
2019-12-18,"Peoples Bancorp Inc. To Announce 4th Quarter 2019 Earnings And Conduct Conference Call On January 21, 2020"
2019-12-10,Here's How P/E Ratios Can Help Us Understand Peoples Bancorp Inc. (NASDAQ:PEBO)
2019-11-14,Is Peoples Bancorp (PEBO) A Great Stock for Value Investors?
2019-10-30,Heres What Hedge Funds Think About Peoples Bancorp Inc. (PEBO)
2019-10-23,Does Peoples Bancorp Inc.'s (NASDAQ:PEBO) CEO Salary Compare Well With Others?
2019-10-23,"Powerful Proof Anyone Can Invest for an Early Retirement - October 23, 2019"
2019-10-22,Edited Transcript of PEBO earnings conference call or presentation 22-Oct-19 3:00pm GMT
2019-10-22,Peoples Bancorp Inc. Declares Quarterly Dividend
2019-10-22,Peoples Bancorp Inc. Reports Quarterly Net Income
2019-10-10,"Simple Secrets Anyone Can Use to Reach Early Retirement - October 10, 2019"
2019-09-26,Peoples Bancorp Inc. Elects New Director
2019-08-26,Are You An Income Investor? Don't Miss Out On Peoples Bancorp Inc. (NASDAQ:PEBO)
2019-07-29,Peoples Bancorp Inc. (NASDAQ:PEBO)'s Could Be A Buy For Its Upcoming Dividend
2019-07-24,Edited Transcript of PEBO earnings conference call or presentation 23-Jul-19 3:00pm GMT
2019-07-23,Peoples Bancorp Inc (PEBO) Q2 2019 Earnings Call Transcript
2019-07-23,Peoples Bancorp (PEBO) Surpasses Q2 Earnings and Revenue Estimates
2019-07-23,Peoples Bancorp Inc. Declares Quarterly Dividend
2019-07-23,Peoples Bancorp Inc. Reports Quarterly Net Income
2019-07-16,Peoples Bancorp (PEBO) Earnings Expected to Grow: What to Know Ahead of Next Week's Release
2019-07-08,Does Peoples Bancorp (NASDAQ:PEBO) Deserve A Spot On Your Watchlist?
2019-06-06,Edited Transcript of PEBO earnings conference call or presentation 23-Apr-19 3:00pm GMT
2019-05-21,Do Directors Own Peoples Bancorp Inc. (NASDAQ:PEBO) Shares?
2019-05-09,Were Hedge Funds Right About Dumping Peoples Bancorp Inc. (PEBO)  ?
2019-04-25,What Are Analysts Saying About Peoples Bancorp Inc.'s (NASDAQ:PEBO) Future?
2019-04-23,Peoples Bancorp Inc (PEBO) Q1 2019 Earnings Call Transcript
2019-04-23,Peoples Bancorp (PEBO) Q1 Earnings and Revenues Top Estimates
2019-04-23,Peoples Bancorp: 1Q Earnings Snapshot
2019-04-23,Peoples Bancorp Inc. Declares Quarterly Dividend
2019-04-23,Peoples Bancorp Inc. Reports Record Quarterly Net Income
2019-04-16,Peoples Bancorp (PEBO) Reports Next Week: Wall Street Expects Earnings Growth
2019-04-12,Peoples Bancorp Completes Acquisition Of First Prestonsburg Bancshares Inc.
2019-04-02,Is Peoples Bancorp Inc.'s (NASDAQ:PEBO) P/E Ratio Really That Good?
2019-03-27,Peoples Bancorp Inc. To Announce 1st Quarter 2019 Earnings And Conduct Conference Call On April 23
2019-03-05,Did You Miss Peoples Bancorps 68% Share Price Gain?
2019-03-02,"Peoples Bancorp Inc (Marietta OH) (PEBO) Files 10-K for the Fiscal Year Ended on December 31, 2018"
2019-03-01,Peoples Bancorp Inc. Receives Regulatory Approval Of Its Merger With First Prestonsburg Bancshares Inc.
2019-02-06,What Makes Peoples Bancorp Inc. (NASDAQ:PEBO) A Great Dividend Stock?
2019-01-23,Edited Transcript of PEBO earnings conference call or presentation 22-Jan-19 4:00pm GMT
2019-01-23,Why Peoples Bancorp (PEBO) is a Top Dividend Stock for Your Portfolio
2019-01-22,Peoples Bancorp Inc (PEBO) Q4 2018 Earnings Conference Call Transcript
2019-01-22,Peoples Bancorp: 4Q Earnings Snapshot
2019-01-22,Peoples Bancorp Inc. Declares Quarterly Dividend
2019-01-22,Peoples Bancorp Inc. Announces 4th Quarter Earnings And Full Year Net Income For 2018
2019-01-15,Peoples Bancorp (PEBO) Earnings Expected to Grow: What to Know Ahead of Next Week's Release
2019-01-11,Peoples Bancorp Inc. (NASDAQ:PEBO) Insiders Have Been Selling
2018-12-23,Peoples Bancorp Inc. (PEBO): Hedge Funds Are Snapping Up
2018-12-21,Peoples Bancorp Inc. to Announce 4th Quarter 2018 Earnings and Conduct Conference Call on January 22
2018-12-20,PEBO vs. CBSH: Which Stock Is the Better Value Option?
