2021-01-08,10 Best Chemical Stocks To Buy For 2021
2021-01-04,Tronox Provides Update on TiZir Titanium and Iron Acquisition
2020-12-27,Tronox Chairman Takes Leave of Absence Amid SEC Complaints
2020-12-27,Tronox Appoints John D. Romano and Jean-François Turgeon co-Chief Executive Officers on Interim Basis
2020-12-17,Is TROX A Good Stock To Buy Now?
2020-11-09,Why You Might Be Interested In Tronox Holdings plc (NYSE:TROX) For Its Upcoming Dividend
2020-11-03,Tronox Declares Quarterly Dividend
2020-10-30,Tronox Holdings (NYSE:TROX) Has Gifted Shareholders With A Fantastic 106% Total Return On Their Investment
2020-10-29,Tronox Holdings Plc to Host Earnings Call
2020-10-28,Tronox Reports Third Quarter 2020 Financial Results
2020-10-13,Tronox Announces Dates for Third Quarter 2020 Earnings Release & Webcast Conference Call
2020-10-07,Tronox UK Holdings Ltd. -- Moody's announces completion of a periodic review of ratings of Tronox Holdings Plc
2020-10-05,Hedge Funds Are Betting On Tronox Holdings Plc (TROX) Again
2020-09-15,"Based On Its ROE, Is Tronox Holdings plc (NYSE:TROX) A High Quality Stock?"
2020-08-11,Did Hedge Funds Make The Right Call On Tronox Holdings Plc (TROX) ?
2020-08-07,Tronox Declares Quarterly Dividend
2020-07-29,Tronox Reports Second Quarter 2020 Financial Results
2020-07-22,Earnings Preview: Tronox (TROX) Q2 Earnings Expected to Decline
2020-07-07,Tronox Announces Dates For Second Quarter 2020 Earnings Release & Webcast Conference Call
2020-06-24,Is Tronox Holdings Plc (TROX) A Good Stock To Buy?
2020-06-23,Doubling of Gold Mineral Resources Confirmed
2020-06-17,Gold Production Started At Buckreef Oxide Project
2020-05-28,Read This Before Selling Tronox Holdings plc (NYSE:TROX) Shares
2020-05-27,"Why Alcoa, Century Aluminum, and Tronox Stocks Jumped at Least 10% Today"
2020-05-14,Tronox to Acquire Norwegian Titanium Smelting Facility
2020-05-11,"Tronox (TROX) Q1 Earnings Beat Estimates, Revenues In Line"
2020-05-08,Tronox (TROX) Q1 2020 Earnings Call Transcript
2020-05-06,Tronox (TROX) Surpasses Q1 Earnings Estimates
2020-05-06,Tronox Reports First Quarter 2020 Financial Results
2020-05-05,PwC to assist project financing for gold mining at Buckreef
2020-04-29,Tronox (TROX) Reports Next Week: Wall Street Expects Earnings Growth
2020-04-24,Tronox Announces Pricing of $500 Million Aggregate Principal Amount of 6.500 Percent Senior Secured Notes
2020-04-24,Tanzanian Gold announces SGS-Lakefield metallurgical testing will confirm design of larger sulphide plant following previous announcement doubling Mineral Resources
2020-04-24,Tronox Finance LLC -- Moody's assigns Ba3 to Tronox' new senior secured notes
2020-04-23,Tronox Announces Proposed Offering of Senior Secured Notes
2020-04-20,"Company News for Apr 20, 2020"
2020-04-18,Were Hedge Funds Right About Tronox Limited (TROX)?
2020-04-08,Tanzanian Gold provides additional updates on its Buckreef Project  following previous announcement doubling Mineral Resources
2020-04-01,Do Options Traders Know Something About Tronox (TROX) Stock We Don't?
2020-03-27,Tronox Blocked Borrower LLC -- Moody's affirms Tronox's subsidiaries ratings; changes outlook to stable from positive
2020-03-26,Tronox Emphasizes Strong Financial Position
2020-03-06,Moving Average Crossover Alert: Tronox
2020-02-28,Tronox Holdings plc Just Released Its Yearly Results And Analysts Are Updating Their Estimates
2020-02-26,"Tronox (TROX) Q4 Earnings In Line, Revenues Lag Estimates"
2020-02-25,Tronox Reports Fourth Quarter and Full Year 2019 Financial Results
2020-02-18,Does Tronox Holdings plc (NYSE:TROX) Have A Place In Your Dividend Portfolio?
2020-02-05,Tronox Announces Dates For Fourth Quarter 2019 Earnings Release & Webcast Conference Call
2020-01-13,New Strong Buy Stocks for January 13th
2020-01-07,Global Chemical Production Rebounds in November: 5 Top Picks
2019-12-17,The Tronox Holdings (NYSE:TROX) Share Price Is Down 52% So Some Shareholders Are Wishing They Sold
2019-12-10,Hedge Funds Cashed Out Of Tronox Holdings plc (TROX) Too Early
2019-11-12,Tronox Blocked Borrower LLC -- Moody's announces completion of a periodic review of ratings of Tronox Limited
2019-11-11,"Tronox (TROX) Earnings Beat, Revenues Lag Estimates in Q3"
2019-11-07,Tronox Reports Third Quarter 2019 Financial Results
2019-11-06,"Chemical Stock Earnings Due on Nov 7: APD, ESI, TROX &amp; ICL"
2019-10-31,Analysts Estimate Tronox (TROX) to Report a Decline in Earnings: What to Look Out for
2019-10-29,INEOS ENTERPRISES HOLDINGS US FINCO LLC -- Moody's announces completion of a periodic review of ratings of INEOS Enterprises Holdings Limited
2019-10-25,Here is What Hedge Funds Think About Tronox Holdings plc (TROX)
2019-10-15,Tronox Announces Dates For Third Quarter 2019 Earnings Release & Webcast Conference Call
2019-10-09,Does Tronox Holdings (NYSE:TROX) Have A Healthy Balance Sheet?
2019-08-25,Only 4 Days Left To Cash In On Tronox Holdings plc (NYSE:TROX) Dividend
2019-08-19,Tronox Declares Quarterly Dividend
2019-08-08,Tronox (TROX) Q2 2019 Earnings Call Transcript
2019-08-06,Tronox (TROX) Q2 Earnings Surpass Estimates
2019-08-06,Tronox Reports Second Quarter 2019 Financial Results
2019-07-30,Earnings Preview: Tronox (TROX) Q2 Earnings Expected to Decline
2019-07-26,Estimating The Fair Value Of Tronox Holdings plc (NYSE:TROX)
2019-07-12,Tronox Announces Dates For Second Quarter 2019 Earnings Release & Webcast Conference Call
2019-07-09,Ineos Enterprises Holdings Limited -- Moody's assigns Ba3 ratings to INEOS Enterprises
2019-06-20,Why Tronox Holdings plcs (NYSE:TROX) Use Of Investor Capital Doesnt Look Great
2019-06-05,"Tronox Holdings Plc (TROX) Chairman and CEO Jeffry N Quinn Bought $100,320 of Shares"
2019-06-03,Tronox to Hold Investor Call to Discuss Legacy Cristal Business Performance and Reiterate Outlook for 2019 and 2020
2019-06-03,Tronox board approves $100 million stock buyback
2019-06-03,Tronox Announces $100 Million Share Repurchase Program
2019-05-31,6 Stocks With Rare Earth Exposure
2019-05-30,Tronox Announces Webcast Details for Investor Day Event
2019-05-20,Trade War Takes Its Toll on Tech Stocks
2019-05-17,5 Top Chemical Stocks to Buy
2019-05-17,Tronox's (TROX) Earnings &amp; Revenues Lag Estimates in Q1
2019-05-14,Three Things You Should Check Before Buying Tronox Holdings plc (NYSE:TROX) For Its Dividend
2019-05-14,Market Drops as China Retaliates
2019-05-10,Tronox (TROX) Q1 2019 Earnings Call Transcript
2019-05-10,Tronox: 1Q Earnings Snapshot
2019-05-09,Tronox Reports First Quarter 2019 Financial Results
2019-05-09,Tronox Announces Repurchase of 14 Million Shares of its Common Stock from Exxaro
2019-05-03,Did Hedge Funds Drop The Ball On Tronox Holdings plc (TROX) ?
2019-05-02,Tronox (TROX) Earnings Expected to Grow: Should You Buy?
2019-05-01,Tronox Completes Sale of Former Cristal North American Titanium Dioxide Business
2019-04-26,Tronox Completes Divestiture of 8120 Paper-Laminate Product Grade to Venator
2019-04-24,"Tronox Holdings plc (TROX) Shares March Higher, Can It Continue?"
2019-04-23,Slow Start to Busy Earnings Week
2019-04-17,3 Chemical Stocks Worth Betting on Before Their Q1 Earnings
2019-04-15,Tronox Announces Dates For First Quarter 2019 Earnings Release & Webcast Conference Call
2019-04-11,Tronox to Discuss Cristal Acquisition
2019-04-10,Tronox Completes Cristal Acquisition
2019-04-10,U.S. FTC settles with Tronox over purchase of Cristal titanium dioxide business
2019-04-10,U.S. FTC settles fight with Tronox over purchase of Cristal's titanium dioxide business
2019-03-28,Tronox Appoints Vanessa Guthrie and Stephen Jones to Board of Directors
2019-03-27,"US Specialty Chemicals Lose Steam in February, Volumes Down"
2019-03-26,Dow Manages Slight Gain Despite Anxious Market
