2020-12-17,What Kind Of Investors Own Most Of American Superconductor Corporation (NASDAQ:AMSC)?
2020-12-07,Is AMSC A Good Stock To Buy Now?
2020-12-03,Top Wind Stocks for Q1 2021
2020-11-18,American Superconductor CEO on the renewable energy market
2020-11-04,"American Superconductor (AMSC) Reports Q2 Loss, Tops Revenue Estimates"
2020-11-04,AMSC Reports Second Quarter Fiscal Year 2020 Financial Results and Provides Business Outlook
2020-11-03,AMSC Announces $15 Million of  New Energy Power System Orders
2020-10-28,"AMSC to Report Second Quarter Fiscal Year 2020 Financial Results on November 4, 2020"
2020-10-26,Here's Why American Superconductor (AMSC) is a Great Momentum Stock to Buy
2020-10-22,Why American Superconductor's Shares Plunged 15.1% on Thursday
2020-10-22,American Superconductor's stock sinks after share offering prices at 12% discount
2020-10-22,AMSC Prices $55 Million Public Offering of Common Stock
2020-10-21,AMSC Announces Proposed Public Offering of Common Stock
2020-10-19,Brokers Are Upgrading Their Views On American Superconductor Corporation (NASDAQ:AMSC) With These New Forecasts
2020-10-13,Are Options Traders Betting on a Big Move in American Superconductor (AMSC) Stock?
2020-10-09,Here's Why Momentum Investors Will Love American Superconductor (AMSC)
2020-10-09,All You Need to Know About American Superconductor (AMSC) Rating Upgrade to Buy
2020-10-05,"AMSC Accelerates toward Profitability with the Acquisition of Northeast Power Systems, Inc."
2020-09-30,American Superconductor (AMSC) Jumps: Stock Rises 7.1%
2020-09-06,Is American Superconductor's (NASDAQ:AMSC) Share Price Gain Of 211% Well Earned?
2020-08-05,AMSC Reports First Quarter Fiscal Year 2020 Financial Results and Provides Business Outlook
2020-07-31,"AMSC to Report First Quarter Fiscal Year 2020 Financial Results on August 5, 2020"
2020-07-28,American Superconductor (AMSC) May Report Negative Earnings: Know the Trend Ahead of Q1 Release
2020-07-14,AMSC Awarded Contract for Ship Protection System on LPD 31
2020-07-11,Edited Transcript of AMSC earnings conference call or presentation 3-Jun-20 2:00pm GMT
2020-07-09,AMSC and ComEd Break Ground on Chicagos REG System to Enhance Resiliency
2020-07-07,What Type Of Shareholders Make Up American Superconductor Corporation's (NASDAQ:AMSC) Share Registry?
2020-07-02,Best Stocks for 2020: Hercules Capital Stock Returned 41.5% in Q2 and Is Still Cheap
2020-06-03,American Superconductor Corp. to Host Earnings Call
2020-06-03,UPDATE - AMSC Reports Fourth Quarter and Full Fiscal Year 2019 Financial Results and Provides Business Outlook
2020-06-02,"American Superconductor (AMSC) Reports Q4 Loss, Tops Revenue Estimates"
2020-06-02,AMSC Reports Fourth Quarter and Full Fiscal Year 2019 Financial Results and Provides Business Outlook
2020-06-01,"AMSC to Report Fourth Quarter and Full Fiscal Year 2019 Financial Results on June 2, 2020"
2020-05-27,Earnings Preview: American Superconductor (AMSC) Q4 Earnings Expected to Decline
2020-04-07,Is American Superconductor Corporation (NASDAQ:AMSC) Excessively Paying Its CEO?
2020-04-06,What Makes American Superconductor (AMSC) a New Buy Stock
2020-04-03,Best Stocks for 2020: Hercules Capital Stock Is a Steal for $7
2020-02-18,Edited Transcript of AMSC earnings conference call or presentation 6-Feb-20 3:00pm GMT
2020-02-14,Canaccord: These 3 Stocks Are Poised to Surge by at Least 50%
2020-02-05,"American Superconductor (AMSC) Reports Q3 Loss, Tops Revenue Estimates"
2020-02-05,AMSC Reports Third Quarter Fiscal Year 2019 Financial Results and Provides Business Outlook
2020-02-05,Read This Before Judging American Superconductor Corporation's (NASDAQ:AMSC) ROE
2020-02-03,What's in Store for American Superconductor (AMSC) Q3 Earnings?
2020-02-03,"AMSC to Report Third Quarter Fiscal Year 2019 Financial Results on February 5, 2020"
2020-01-29,Relief Rally Snaps the Dow's 5-Day Losing Skid
2020-01-28,Analysts Estimate American Superconductor (AMSC) to Report a Decline in Earnings: What to Look Out for
2020-01-15,American Superconductor (AMSC) Stock Sinks As Market Gains: What You Should Know
2020-01-07,American Superconductor (AMSC) Dips More Than Broader Markets: What You Should Know
2020-01-06,Those Who Purchased American Superconductor (NASDAQ:AMSC) Shares A Year Ago Have A 30% Loss To Show For It
2019-12-27,American Superconductor (AMSC) Stock Moves -1.6%: What You Should Know
2019-12-24,New Strong Buy Stocks for December 24th
2019-12-23,American Superconductor Sees Hammer Chart Pattern: Time to Buy?
2019-12-19,AMSC Announces $11 Million of D-VAR® System Orders
2019-12-17,American Superconductor (AMSC) Stock Sinks As Market Gains: What You Should Know
2019-12-17,American Superconductor (AMSC) Upgraded to Strong Buy: Here's What You Should Know
2019-12-13,Edited Transcript of AMSC earnings conference call or presentation 6-Nov-19 3:00pm GMT
2019-12-13,American Superconductor Corporation (AMSC): Are Hedge Funds Right About This Stock?
2019-12-12,New Strong Buy Stocks for December 12th
2019-12-07,"Despite Its High P/E Ratio, Is American Superconductor Corporation (NASDAQ:AMSC) Still Undervalued?"
2019-12-06,"The Zacks Analyst Blog Highlights: American Superconductor, Cardtronics, Foundation Building Materials, Lithia Motors and Shoe Carnival"
2019-12-05,"Deal or No Deal, the Case for Investing in US Stocks Looks Good"
2019-12-04,"Forget FANG, FAANG, &amp; Even FMAANG, Here Are 6 Tech Stocks with Strong Prospects"
2019-11-25,"Stocks Rise on Friday, but Cant Extend Weekly Winning Streaks"
2019-11-19,3 Top-Ranked Cheap Tech Stocks Under $10 to Buy Before Thanksgiving
2019-11-19,AMSC Announces $20 Million of D-VAR® System Orders
2019-11-15,New Strong Buy Stocks for November 15th
2019-11-15,What Makes American Superconductor (AMSC) a New Strong Buy Stock
2019-11-08,AMSC to deliver innovation in the electric utility space
2019-11-07,Have Insiders Been Selling American Superconductor Corporation (NASDAQ:AMSC) Shares?
2019-11-05,AMSC Reports Second Quarter Fiscal Year 2019 Financial Results and Provides Business Outlook
2019-11-01,"AMSC to Report Second Quarter Fiscal Year 2019 Financial Results on November 5, 2019"
2019-10-29,Analysts Estimate American Superconductor (AMSC) to Report a Decline in Earnings: What to Look Out for
2019-10-22,AMSC and ComEd Proceed on Engineering Assessment for Second Superconductor-based REG System in Chicago
2019-10-10,Is Now The Time To Look At Buying American Superconductor Corporation (NASDAQ:AMSC)?
2019-09-10,What Kind Of Shareholders Own American Superconductor Corporation (NASDAQ:AMSC)?
2019-08-30,Edited Transcript of AMSC earnings conference call or presentation 7-Aug-19 2:00pm GMT
2019-08-15,AMSC Announces $9 Million Wind Turbine Electrical Control System Order from Doosan Heavy Industries
2019-08-08,Should You Be Excited About American Superconductor Corporation's (NASDAQ:AMSC) 36% Return On Equity?
2019-08-08,American Superconductor (AMSC) Q1 2019 Earnings Call Transcript
2019-08-06,"American Superconductor (AMSC) Reports Q1 Loss, Tops Revenue Estimates"
2019-08-06,AMSC Reports First Quarter Fiscal Year 2019 Financial Results and Provides Business Outlook
2019-08-05,"AMSC to Report First Quarter Fiscal Year 2019 Financial Results on August 7, 2019"
2019-07-23,Analysts Estimate American Superconductor (AMSC) to Report a Decline in Earnings: What to Look Out for
2019-07-13,The Same Technology Used in Power Grids Will Cloak Navy Ships
2019-07-09,Does American Superconductor Corporation (NASDAQ:AMSC) Have A Volatile Share Price?
2019-06-27,Hedge Funds Have Never Been This Bullish On American Superconductor Corporation (AMSC)
2019-06-26,Department of Homeland Security Signs Contract Modification to Install Resilient Electric Grid System in Chicago
2019-06-13,Edited Transcript of AMSC earnings conference call or presentation 1-Aug-18 2:00pm GMT
2019-06-08,Edited Transcript of AMSC earnings conference call or presentation 6-Jun-19 2:00pm GMT
2019-06-07,American Superconductor (AMSC) Q4 2018 Earnings Call Transcript
2019-06-06,American Superconductor Corp. to Host Earnings Call
2019-06-05,"American Superconductor (AMSC) Reports Q4 Loss, Misses Revenue Estimates"
2019-06-05,AMSC Reports Fourth Quarter and Full Fiscal Year 2018 Financial Results and Provides Business Outlook
2019-06-04,"AMSC to Report Fourth Quarter and Full Fiscal Year 2018 Financial Results on June 5, 2019"
2019-06-04,3 Small-Cap Stocks to Buy
2019-05-29,American Superconductor (AMSC) May Report Negative Earnings: Know the Trend Ahead of Q4 Release
2019-05-22,Does American Superconductor Corporation's (NASDAQ:AMSC) CEO Pay Reflect Performance?
2019-05-13,AMSC Awarded Delivery Contract for Ship Protection System on LPD 30
2019-04-18,If You Had Bought American Superconductor (NASDAQ:AMSC) Shares A Year Ago You'd Have Made 91%
2019-04-09,AMSC Announces Additional D-VAR® System Orders Totaling $10 Million
