2021-01-11,Is Now The Time To Put Oppenheimer Holdings (NYSE:OPY) On Your Watchlist?
2020-12-22,MFDA Hearing Panel issues Reasons for Decision in the matter of Aparna Prabhune
2020-12-21,Cub Cadet helps Canadians prepare for the toughest months of the winter season with the ultimate snow blower guide
2020-12-10,Is OPY A Good Stock To Buy Now?
2020-12-09,Oppenheimer Holdings Inc. Declares Special Dividend
2020-12-02,"Oppenheimer Continues Strategic Buildout Of Debt Capital Markets Group With Appointment Of Guillaume Petitgas As Managing Director, Based In London, United Kingdom"
2020-11-25,Update: Oppenheimer Holdings (NYSE:OPY) Stock Gained 70% In The Last Five Years
2020-11-19,Oppenheimer Holdings Inc. Extends Exchange Offer
2020-11-16,"Oppenheimer Accelerates Growth of Consumer Investment Banking Group with Appointment of James Murray as Managing Director, Based in London, United Kingdom"
2020-11-16,"Oppenheimer Accelerates Growth of Consumer Investment Banking Group with Appointment of James Murray as Managing Director, Based in London, United Kingdom"
2020-11-10,Oppenheimer & Co. Inc. Announces Recruitment Of The Mercado Group To Private Client Division
2020-11-02,Oppenheimer Composite Rating Boosted To 96
2020-10-29,Oppenheimer Holdings Inc. Reports Third Quarter 2020 Earnings
2020-10-27,"New Jean Nouvel concept designs unveil a new era in architecture: a world-first 'masterpiece' resort hidden within the rock dwellings of AlUla, Northwest Arabia"
2020-10-21,"Buy the Dip on Netflix Shares, Analysts Advise"
2020-10-20,Is Oppenheimer Holdings Inc. (NYSE:OPY) Popular Amongst Insiders?
2020-10-17,"Oppenheimer Holdings, Inc. -- Moody's affirms Oppenheimer's B1 ratings, outlook remains stable"
2020-10-17,"Oppenheimer Holdings, Inc. -- Moody's announces completion of a periodic review of ratings of Oppenheimer Holdings, Inc."
2020-10-14,MassMutuals Credit Rating Could Be Hurt by Invesco Stake
2020-10-12,Snowflake Stock Gains as Street Starts Coverage. Hopes for Growth Top Doubts on Valuation.
2020-10-09,The Bull Case for Bank of America
2020-09-23,Oppenheimer & Co. Inc. Announces Successful Conclusion Of Virtual 2020 Fall Healthcare Life Sciences And Medtech Summit
2020-09-21,Can Home Depot and Lowes Stock Continue Rallying?
2020-09-21,Oppenheimer & Co. Inc. Continues Growth Of Its Global Fixed Income Group With Seven Experienced Hires Added To The Team
2020-09-17,Oppenheimer Announces Pricing of Senior Secured Notes Offering
2020-09-16,Oppenheimer & Co. Inc. Builds Out Digital Experience Platform For Financial Advisors And Clients Through New Strategic Alliance With InvestCloud
2020-09-14,How Should Investors Feel About Oppenheimer Holdings' (NYSE:OPY) CEO Remuneration?
2020-09-10,Oppenheimer Announces Proposed Senior Secured Notes Offering
2020-08-31,"Oppenheimer & Co. Inc. Launches ""Let's Talk Future"" Podcast Series In Continued Buildout Of Multimedia Thought Leadership Resources"
2020-08-28,"Oppenheimer & Co. Inc. Welcomes New First-Year Investment Banking Analysts, Reflecting Firm's Commitment To Cultivating Next Generation Talent"
2020-08-26,"Oppenheimer & Co. Inc. Names Doron Barness Senior Managing Director, Reflecting Growth Of Cash Equities Trading And Distribution Team"
2020-08-12,Oppenheimer & Co. Inc. Successfully Concludes Virtual 23rd Annual Technology Conference
2020-08-09,"Oppenheimer Holdings Inc. (NYSE:OPY) Looks Like A Good Stock, And It's Going Ex-Dividend Soon"
2020-08-09,Be Sure To Check Out Oppenheimer Holdings Inc. (NYSE:OPY) Before It Goes Ex-Dividend
2020-08-06,Oppenheimer Holdings Inc. (NYSE:OPY) Doing What It Can To Lift Shares
2020-08-03,Oppenheimer & Co. Inc. Accelerates Growth Of Investment Bank's Financial Institutions Group With Continued Build-Out Of Leadership Team
2020-07-30,Oppenheimer Holdings Inc. Reports Second Quarter 2020 Earnings
2020-07-23,Oppenheimer & Co. Inc. Congratulates Five Financial Advisors Named To 2020 Forbes / Shook List Of Top Next-Generation Wealth Advisors
2020-07-14,Oppenheimer & Co. Inc. Appoints Jarl Berntzen As Managing Director In The Technology Investment Banking Group
2020-07-10,Time to Hop Aboard the Union Pacific
2020-06-25,Oppenheimer Holdings Inc. (OPY): Are Hedge Funds Right About This Stock?
2020-06-03,Oppenheimer & Co. Inc. Expands Life Sciences Research Team With Addition Of Frank Brisebois As Managing Director And Senior Analyst
2020-06-01,Oppenheimer & Co. Inc. Announces Agreement To Acquire Brandis Tallman LLC To Accelerate Growth Of Public Finance Investment Banking Business
2020-05-20,Oppenheimer & Co. Inc. Announces Gary Domoracki Joins The Boston Office As Branch Manager And Managing Director Of Investments
2020-05-15,Oppenheimer's stock rallies after announcing new repurchase program for up to 4.2% of shares outstanding
2020-05-15,Oppenheimer Holdings Inc. Announces Share Repurchase Program
2020-05-11,Is Oppenheimer Developing Markets Y (ODVYX) a Strong Mutual Fund Pick Right Now?
2020-05-08,Is Oppenheimer Global Fund A (OPPAX) a Strong Mutual Fund Pick Right Now?
2020-05-06,Oppenheimer & Co. Inc. Builds Dedicated Insurance Team For Financial Institutions Investment Banking Group With Addition Of Seasoned Industry Leaders
2020-05-01,Oppenheimer Holdings Inc. Reports First Quarter 2020 Earnings and Announces Quarterly Dividend
2020-04-27,Is Oppenheimer Developing Markets A (ODMAX) a Strong Mutual Fund Pick Right Now?
2020-04-23,Oppenheimer Holdings Inc. Announces That Its 2020 Annual Stockholders Meeting Will Be Held In Virtual Format
2020-04-23,Oppenheimer Holdings Inc. (NYSE:OPY): What Does Its Beta Value Mean For Your Portfolio?
2020-04-16,Is Oppenheimer Gold & Special Mineral A (OPGSX) a Strong Mutual Fund Pick Right Now?
2020-03-18,If You Like EPS Growth Then Check Out Oppenheimer Holdings (NYSE:OPY) Before It's Too Late
2020-03-18,"Oppenheimer Holdings- ""Rock Solid"""
2020-02-10,Be Sure To Check Out Oppenheimer Holdings Inc. (NYSE:OPY) Before It Goes Ex-Dividend
2020-02-03,"Oppenheimer Announces David Roth As Branch Manager Of Stamford, CT Office"
2020-01-31,Oppenheimer Holdings Inc. Reports Fourth Quarter and Full Year 2019 Earnings and Announces Quarterly Dividend
2020-01-24,Oppenheimer Holdings (NYSE:OPY) Shareholders Have Enjoyed A 44% Share Price Gain
2020-01-20,Top Picks 2020- Oppenheimer Holdings OPY
2019-12-19,Hedge Funds Staying Clear Of Oppenheimer Holdings Inc. (OPY)
2019-12-10,Is Oppenheimer Holdings Inc. (NYSE:OPY) Overpaying Its CEO?
2019-12-03,Oppenheimer initiates Beyond Meat at perform
2019-12-03,Beyond Meat Stock Takes a Hit as Yet Another Analyst Wont Recommend It
2019-11-20,Oppenheimer & Co. Inc. Continues Expansion of Technology Investment Banking Practice with New Managing Director
2019-11-11,"Oppenheimer To Host Disruptive Innovation Summit: FinTech, Blockchain & AI"
2019-11-07,Is Oppenheimer Holdings Inc. (OPY) A Good Stock To Buy?
2019-10-28,Hubble Telescope for markets attracts new criticism
2019-10-25,Oppenheimer Holdings Inc. Reports Third Quarter 2019 Earnings and Announces Quarterly Dividend
2019-10-25,Oppenheimer Holdings Inc. Reports Third Quarter 2019 Earnings and Announces Quarterly Dividend
2019-10-22,Does Oppenheimer Holdings Inc. (NYSE:OPY) Have A Volatile Share Price?
2019-10-10,Oppenheimer To Host Houston Oncology Summit At The University of Texas MD Anderson Cancer Center
2019-10-08,"Oppenheimer Holdings, Inc. -- Moody's announces completion of a periodic review of ratings of Oppenheimer Holdings, Inc."
2019-10-07,Oppenheimer Hires Suraj Kalia As Managing Director And Senior Analyst In Medical Technology And Devices
2019-10-01,Oppenheimer Hires Fernando Losada As Head Of Emerging Markets Research
2019-09-20,"Oppenheimer to Gather Leaders, Scientists and Investors for Fall Summit Focused on Specialty Pharma and Rare Disease Companies"
2019-09-16,Oppenheimer To Host Security Summit In Partnership With TetherView And Columbia University
2019-09-10,How Does Oppenheimer Holdings Inc. (NYSE:OPY) Fare As A Dividend Stock?
2019-09-06,Casualties are emerging in the US leveraged loan market
2019-09-05,Several Oppenheimer Financial Advisors Appear On 2019 Forbes Next-Gen Wealth Advisor List
2019-08-13,"Oppenheimer Holdings, Inc. -- Moody's upgrades Oppenheimer's corporate family rating to B1 and affirms senior debt at B1"
2019-08-06,Oppenheimer Financial Advisor Justin Gelbman Named to 2019 Forbes Top 250 Next-Gen Wealth Advisor List
2019-08-05,Oppenheimer Financial Advisor Christopher Lazos Named To 2019 Forbes Top 250 Next-Gen Wealth Advisor List
2019-08-05,Takeover Talk for Oppenheimer
2019-08-03,Here's What We Like About Oppenheimer Holdings Inc. (NYSE:OPY)'s Upcoming Dividend
2019-08-01,"Oppenheimer Commences 22nd Annual Technology, Internet & Communications Conference"
2019-07-26,Oppenheimer Holdings Inc. Announces Share Repurchase Program
2019-07-26,Oppenheimer Holdings Inc. Reports Second Quarter 2019 Earnings and Announces Increase of Quarterly Dividend and Intent to Redeem $50 million of 6.75% Senior Secured Notes Due 2022
2019-07-25,Invesco Ltd (IVZ) Q2 2019 Earnings Call Transcript
2019-07-24,"Introducing Oppenheimer Holdings (NYSE:OPY), A Stock That Climbed 81% In The Last Three Years"
2019-06-29,Heres What Hedge Funds Think About Oppenheimer Holdings Inc. (OPY)
2019-06-26,Invesco Moves Swiftly After Its Acquisition of OppenheimerFunds
2019-06-25,Oppenheimer Gathers Life Science Leaders And Investors For Montauk Emerging Life Sciences Summit
2019-06-18,What Kind Of Investor Owns Most Of Oppenheimer Holdings Inc. (NYSE:OPY)?
2019-06-13,Oppenheimer & Co. To Host 19th Annual Consumer Growth and E-Commerce Conference
2019-06-03,The 2019 Class Arrives At Oppenheimer For Their Internship Program
2019-05-23,Leading Medical Companies And Investors Gather In San Francisco For Oppenheimer's MedTech Day
2019-05-17,Woodstock 50 festival announces new funding to get show back on
2019-05-16,These are the 3 stocks to play as a catch-up to the retail rally: Technician
