2021-01-06,"DraftKings, MGM, Other Gaming Stocks Rise As New York Gov. Cuomo Eyes Legalizing Online Sports Betting"
2020-12-30,Casino Stocks Could Make a Comeback
2020-12-17,Youre going to see thousands of hotels go out of business: AHLA CEO on need for immediate assistance
2020-12-17,Biden campaign made decisions on probability of a polling error: Annie Duke
2020-12-17,Influencers with Andy Serwer: Annie Duke
2020-12-16,Former poker champion says this common mistake is a huge problem in business
2020-12-14,Is WYNN A Good Stock To Buy Now?
2020-12-14,"Wynn Resorts Finance, LLC -- Moody's: Wynn Macau Ltd's proposed $650 million sr unsecured notes add-on has no impact on B1 notes rating"
2020-12-14,Wynn Las Vegas Introduces New Customer Loyalty Program 'Wynn Rewards'
2020-12-11,3 of the Best Breakout Stocks to Buy Now
2020-12-10,"Why Wynn, MGM Resorts Are Trading Higher Today"
2020-12-05,Why Is Wynn (WYNN) Up 41.6% Since Last Earnings Report?
2020-12-02,Macau gambling revenue has tanked 80% in 2020 due to pandemic
2020-12-02,Why Would Anyone Want to Buy Wynn Resorts Stock?
2020-12-01,82% of families already have travel plans for 2021: Vrbo
2020-11-27,DraftKings Rises On Hopes This New Market Could Open Up
2020-11-24,Casino Stocks Find Buyers After Nevada Order
2020-11-19,The Charts Say This Could Be a Wynn-ing Strategy
2020-11-16,"Cruise, Travel Stocks Jump as Vaccine News Buoys Reopen Bets"
2020-11-16,Las Vegas will lead post COVID-19 live entertainment recovery: former MGM CEO
2020-11-12,Bidens Coronavirus Advisor Wants to Shut Down the Economy. Heres What That Might Mean for the Stock Market.
2020-11-12,Reopen Trade Stumbles as Lockdown Winners Bounce on Virus Spike
2020-11-11,"Earnings Update: Wynn Resorts, Limited (NASDAQ:WYNN) Just Reported Its Third-Quarter Results And Analysts Are Updating Their Forecasts"
2020-11-09,Why Investors Are Rolling the Dice With Casinos Today
2020-11-06,How to Position Your Investment Portfolio for Transition Uncertainty and Gridlock in Government
2020-11-06,Wynn Resorts Misses Even Analysts' Subdued Expectations for Q3
2020-11-06,"Wynn, Caesars Report Latest Brutal Casino Earnings"
2020-11-06,Wynn Resorts (WYNN) Q3 Earnings & Revenues Miss Estimates
2020-11-06,Wynn Resorts (WYNN) Q3 2020 Earnings Call Transcript
2020-11-05,"Wynn Resorts (WYNN) Reports Q3 Loss, Misses Revenue Estimates"
2020-11-05,"Wynn Resorts, Limited Reports Third Quarter 2020 Results"
2020-11-05,Wynn Resorts Ltd. to Host Earnings Call
2020-11-03,Wynn Resorts (WYNN) to Report Q3 Earnings: What's in Store?
2020-11-03,"Leisure Stocks to Watch for Earnings: H, HLT, WYNN, VAC"
2020-11-03,'Fast Money' Traders Discuss Morgan Stanley's Bullish Wynn Call
2020-11-02,Wynn Resorts Announces Third Quarter Earnings Release Date
2020-11-02,"Wynn Resorts Analyst: Macau Concerns Overblown, Biden Positive For Casino Stock"
2020-10-30,Insiders Behind Sports Betting IPO Gan Get First Chance to Sell
2020-10-30,NASCAR and Wynn Resorts Announce National Multi-Year Sports Betting Partnership
2020-10-28,Earnings Preview: Wynn Resorts (WYNN) Q3 Earnings Expected to Decline
2020-10-28,"Tempur Sealy, Wynn Resorts, Spotify, Aptiv and Republic Services highlighted as Zacks Bull and Bear of the Day"
2020-10-28,"Bear of the Day: Wynn Resorts, Limited (WYNN)"
2020-10-27,Las Vegas Sands Seeks To Be 'Sans Vegas' By Selling Vegas Strip Casino Resorts
2020-10-27,"Hilton CEO: 'We need additional stimulus to the economy, period'"
2020-10-27,Sheldon Adelsons Last Roll of the Dice May Be His Boldest
2020-10-26,"Were Hedge Funds Right About Embracing Wynn Resorts, Limited (WYNN)?"
2020-10-26,Hilton CEO: 'There's a huge amount of pent-up demand'  even for business travel
2020-10-21,Casino Stocks Hold Support Heading Into Q3 Earnings
2020-10-21,New Strong Sell Stocks for October 21st
2020-10-20,Better Buy: Disney vs. Wynn Resorts
2020-10-19,Wynn Resorts Announces New Appointment To Board Of Directors
2020-10-19,Macao Casinos Still Tarnished After Soft Golden Week Holiday
2020-10-16,Wynn Downgraded to Hold at Jefferies on Macau Concern
2020-10-14,Which Casino Stock Will Grow The Most By 2025?
2020-10-14,"Forget Wynn, MGM Resorts Is a Better Value Stock"
2020-10-09,Analyzing Wynn Resorts's Unusual Options Activity
2020-10-08,City Office REIT Announces Third Quarter 2020 Earnings Release and Conference Call
2020-10-08,Wynn Resorts Says It's the First Bringing Big Entertainment Back to Vegas
2020-10-07,Wynn Resorts Stock Can Double: Fund Manager
2020-10-07,Wynn Las Vegas Brings Entertainment Back To The Strip With Debut Of The New Lake of Dreams
2020-10-06,Las Vegas: Bubble City
2020-10-05,Why Wynn Resorts' Stock Price Declined 17.9% in September
2020-10-05,Why GAN Limited Jumped 12% Today
2020-10-05,"Gan Shares Surge On Sports Betting, iGaming Partnership With Wynn In Michigan"
2020-10-02,Casino Stocks Could Test March Lows
2020-10-01,U.S. Casinos With Presence in Macau Trade Mixed After Weak Data
2020-10-01,Wynn Resorts CEO Offers Vision To Accelerate The Return Of Events And Entertainment To Las Vegas
2020-09-29,Will hotels ever return to pre-pandemic levels?
2020-09-27,"Coronavirus fuels MGM's embrace of online sports bets, taking on 'formidable' DraftKings, FanDuel"
2020-09-22,"RPT-As cash flees Macau junkets, gambling hub faces long odds of quick recovery"
2020-09-22,"Trade Alert: The CEO & Director Of City Office REIT, Inc. (NYSE:CIO), James Farrar, Has Just Spent US$86k Buying 3.0% More Shares"
2020-09-22,"As cash flees Macau junkets, gambling hub faces long odds of quick recovery"
2020-09-21,Wynn Resorts Could Test 1st Quarter Low
2020-09-21,"US STOCKS-Dow futures shed 600 points on lockdown fears, stimulus uncertainty"
2020-09-18,Las Vegas Sands and Wynn Resorts Have Weak Hands
2020-09-17,Casino Stocks Could Test First Quarter Lows
2020-09-16,"Could The Wynn Resorts, Limited (NASDAQ:WYNN) Ownership Structure Tell Us Something Useful?"
2020-09-14,"Sell MGM Stock, Goldman Sachs Says. The Recovery for Las Vegas Will Be Slow."
2020-09-08,"Hedge Funds Are Coming Back To Wynn Resorts, Limited (WYNN)"
2020-09-07,Goldman Downgrades Wynn Resorts On Challenges At Its Macau Unit
2020-09-03,"Why Casino Operators Caesars, MGM, and Wynn Rocketed Higher in August by as Much as 47%"
2020-09-03,Wynn (WYNN) Up 25.3% Since Last Earnings Report: Can It Continue?
2020-08-27,"Disney, Casino Stocks Rise As NBA Playoffs Set To Resume"
2020-08-24,S&P Hits Record as Positive Virus News Fuels Bets on Pandemic Stocks
2020-08-19,"Zacks Industry Outlook Highlights: Wynn Resorts, Las Vegas Sands, MGM Resorts, International Game Technology, Monarch Casino & Resort and Red Rock Resorts"
2020-08-18,"Wynn Resorts Finance, LLC -- Moody's assigns B1 to Wynn Macau Ltd's proposed sr unsecured notes offering"
2020-08-18,The Disneyland of football is coming to Ohio
2020-08-17,RPT-BUZZ-U.S. stocks weekly: High level flirting
2020-08-14,Penn Stock Keeps Breaking Out. Can It Continue Higher?
2020-08-14,Ante Into These 7 Gambling Stocks
2020-08-12,2020 Laggards Charge Higher in Summer Rally
2020-08-11,Why Wynn Resorts' Shares Popped 9.7% on Tuesday
2020-08-11,"Stocks on the move: Wynn Resorts up on Macau tourist visas, Southwest rises on upbeat TSA data"
2020-08-07,3 Gambling Stocks to Buy After Penn National Gamings Earnings Pop
2020-08-06,The Chips Are Down for Wynn Resorts
2020-08-06,Analyzing Wynn Resorts's Unusual Options Activity
2020-08-05,Elon Musks Las Vegas Loop Clears Last Major Hurdle for Expansion
2020-08-05,Wynn Resorts Stock Is Falling After a Bleak Quarter for Gambling
2020-08-05,Wynn Resorts (WYNN) Q2 Earnings & Revenues Miss Estimates
2020-08-05,Wynn Resorts (WYNN) Q2 2020 Earnings Call Transcript
