2020-12-11,Is TSLX A Good Stock To Buy Now?
2020-11-25,4 Big Dividends to Be Thankful For
2020-11-04,Sixth Street (TSLX) Beats Q3 Earnings and Revenue Estimates
2020-11-04,"Sixth Street Specialty Lending, Inc. Reports Third Quarter 2020 Earnings Results; Declares Fourth Quarter Base Dividend Per Share of $0.41 and Third Quarter Supplemental Dividend Per Share of $0.10"
2020-10-28,Sixth Street (TSLX) Expected to Beat Earnings Estimates: Should You Buy?
2020-10-14,"Sixth Street Specialty Lending, Inc. Provides Dividend Payment Notification"
2020-10-09,3 Strong Buy Dividend Stocks Yielding Over 9%
2020-10-02,"Sixth Street Specialty Lending, Inc. Schedules Earnings Release and Conference Call to Discuss its Third Quarter Ended September 30, 2020 Financial Results"
2020-08-04,"Sixth Street Specialty Lending, Inc. Reports Second Quarter 2020 Earnings Results; Declares Third Quarter Base Dividend Per Share of $0.41"
2020-07-23,"Sixth Street Specialty Lending, Inc. Provides a Business Update and Preliminary Q2 2020 Financial Results"
2020-07-10,Stay Invested in eBay to Benefit From its Growth
2020-07-02,"Sixth Street Specialty Lending, Inc. Schedules Earnings Release and Conference Call to Discuss its Second Quarter Ended June 30, 2020 Financial Results"
2020-06-29,Is Sixth Street Specialty (TSLX) a Suitable Stock Now?
2020-06-23,3 Big Dividend Stocks Yielding at Least 6%; SunTrust Says Buy
2020-06-05,"TPG Specialty Lending, Inc. Announces Corporate Name Change to Sixth Street Specialty Lending, Inc."
2020-05-15,"TPG Specialty Lending, Inc. Announces Change to Virtual Annual and Special Meeting of Stockholders"
2020-05-07,Edited Transcript of TSLX earnings conference call or presentation 6-May-20 12:30pm GMT
2020-05-06,TPG Specialty Lending Inc (TSLX) Q1 2020 Earnings Call Transcript
2020-05-06,TPG Specialty Lending Inc (TSLX): Were Hedge Funds Right About This Stock?
2020-05-05,TPG Specialty (TSLX) Q1 Earnings Meet Estimates
2020-05-05,"TPG Specialty Lending, Inc. Reports First Quarter 2020 Earnings Results; Declares Second Quarter Base Dividend Per Share of $0.41"
2020-04-28,TPG Specialty (TSLX) Earnings Expected to Grow: What to Know Ahead of Next Week's Release
2020-04-16,"TPG Specialty Lending, Inc. Provides a Business Update and Preliminary Q1 2020 Financial Results"
2020-04-07,"Oaktree Specialty Lending Corporation -- Moody's affirms the ratings of nine business development companies, revises industry outlook to negative from stable"
2020-04-03,"TPG Specialty Lending, Inc. Schedules Earnings Release and Conference Call to Discuss its First Quarter Ended March 31, 2020 Financial Results"
2020-04-02,Wells Fargo: 2 Big 11% Dividend Stocks to Buy (And 1 to Avoid)
2020-03-26,"TPG Specialty Lending, Inc. Provides an Update on its Funding Model, Rollforward of Key Balance Sheet Items, Valuation Framework and Liquidity"
2020-03-20,B. Riley Is the Top Company Cashing in on the Retail Apocalypse
2020-03-19,Is TPG Specialty Lending (TSLX) Stock a Solid Choice Right Now?
2020-03-18,3 Stocks Flashing Signs of Strong Insider Buying
2020-03-16,TPG Specialty Lending Inc. Provides Business and Portfolio Update
2020-03-16,Top Ranked Income Stocks to Buy for March 16th
2020-02-21,Edited Transcript of TSLX earnings conference call or presentation 20-Feb-20 1:00pm GMT
2020-02-20,"TPG Specialty Lending, Inc. to Host Earnings Call"
2020-02-19,TPG Specialty (TSLX) Q4 Earnings and Revenues Top Estimates
2020-02-19,"TPG Specialty Lending, Inc. Reports Full Year and Q4 2019 Earnings Results; Declares Aggregate Special Dividends Per Share of $0.50, a 5% Increase in Q1 Base Dividend Per Share to $0.41, and a Q4 Supplemental Dividend Per Share of $0.06"
2020-02-19,"The Zacks Analyst Blog Highlights: Jack in the Box, TPG Specialty Lending, Nordson, Hormel Foods and Builders FirstSource"
2020-02-17,Buy 5 Top Stocks Poised to Beat Earnings Estimates This Week
2020-02-12,TPG Specialty (TSLX) Expected to Beat Earnings Estimates: Should You Buy?
2020-01-31,"TPG Specialty Lending, Inc. Increases and Extends Its Revolving Credit Facility"
2020-01-31,Why the Earnings Surprise Streak Could Continue for TPG (TSLX)
2020-01-29,"TPG Specialty Lending, Inc. Prices Public Offering of $50 million 3.875% Unsecured Notes due 2024"
2020-01-21,"TPG Specialty Lending, Inc. Announces Time Change for its Conference Call to Discuss its Fourth Quarter Ended December 31, 2019 Financial Results"
2020-01-17,"TPG Specialty Lending, Inc. Schedules Earnings Release and Conference Call to Discuss its Fourth Quarter Ended December 31, 2019 Financial Results"
2020-01-09,3 Buy-Rated Dividend Stocks With Over 7% Yield
2019-12-16,Should You Avoid TPG Specialty Lending Inc (TSLX)?
2019-12-11,3 High-Yield Stocks for the Dividend Investor
2019-11-25,"4 Small-Cap, Big-Dividend Stocks"
2019-11-06,Edited Transcript of TSLX earnings conference call or presentation 6-Nov-19 1:30pm GMT
2019-11-05,TPG Specialty (TSLX) Q3 Earnings and Revenues Beat Estimates
2019-11-05,"TPG Specialty Lending, Inc. Reports Third Quarter 2019 Earnings Results; Declares a Third Quarter 2019 Supplemental Dividend Per Share of $0.08 and a Fourth Quarter 2019 Base Dividend Per Share of $0.39"
2019-10-30,5 Excellent Dividend Stocks to Buy for the Holiday Season
2019-10-29,Earnings Preview: TPG Specialty (TSLX) Q3 Earnings Expected to Decline
2019-10-28,Heres What Hedge Funds Think About TPG Specialty Lending Inc (TSLX)
2019-10-25,"TPG Specialty Lending, Inc. Prices Public Offering of $300 Million 3.875% Unsecured Notes Due 2024"
2019-10-17,Lender Spat Could Push Barbecue Fuel Retailer into Debt Restructuring
2019-10-04,"TPG Specialty Lending, Inc. Schedules Earnings Release and Conference Call to Discuss its Third Quarter Ended September 30, 2019 Financial Results"
2019-09-23,"TPG Specialty Lending, Inc. -- Moody's affirms TPG Specialty Lending's senior unsecured rating at Baa3, stable outlook"
2019-09-13,"TPG Specialty Lending, Inc. Expands its Board of Directors and Elects Judy Slotkin and David Stiepleman to the Board"
2019-09-11,"TPG Specialty Lending, Inc. -- Moody's announces completion of a periodic review of ratings of TPG Specialty Lending, Inc."
2019-09-04,4 Fintech Alternatives to Square & Fiserv with Big Dividends
2019-08-06,Barneys Files for Bankruptcy As Rents Rise and Visitors Fall
2019-08-02,Edited Transcript of TSLX earnings conference call or presentation 1-Aug-19 12:30pm GMT
2019-08-01,TPG Specialty Lending Inc (TSLX) Q2 2019 Earnings Call Transcript
2019-08-01,PFSI vs. TSLX: Which Stock Should Value Investors Buy Now?
2019-07-31,TPG Specialty (TSLX) Surpasses Q2 Earnings and Revenue Estimates
2019-07-31,"TPG Specialty Lending, Inc. Reports Second Quarter 2019 Earnings Results; Declares a Second Quarter 2019 Supplemental Dividend Per Share of $0.04 and a Third Quarter 2019 Base Dividend Per Share of $0.39"
2019-07-24,Analysts Estimate TPG Specialty (TSLX) to Report a Decline in Earnings: What to Look Out for
2019-07-22,Moving Average Crossover Alert: TPG Specialty Lending
2019-06-28,"TPG Specialty Lending, Inc. Schedules Earnings Release and Conference Call to Discuss its Second Quarter Ended June 30, 2019 Financial Results"
2019-06-26,Heres What Hedge Funds Think About TPG Specialty Lending Inc (TSLX)
2019-05-06,Edited Transcript of TSLX earnings conference call or presentation 3-May-19 12:30pm GMT
2019-05-03,TPG Specialty Lending Inc (TSLX) Q1 2019 Earnings Call Transcript
2019-05-02,TPG Specialty (TSLX) Misses Q1 Earnings and Revenue Estimates
2019-05-02,"TPG Specialty Lending, Inc. Reports First Quarter 2019 Earnings Results; Declares a First Quarter 2019 Supplemental Dividend Per Share of $0.01 and a Second Quarter 2019 Base Dividend Per Share of $0.39"
2019-05-02,Is TPG Specialty Lending Inc (TSLX) A Good Stock To Buy?
2019-04-25,Earnings Preview: TPG Specialty (TSLX) Q1 Earnings Expected to Decline
2019-04-05,"TPG Specialty Lending, Inc. Schedules Earnings Release and Conference Call to Discuss its First Quarter Ended March 31, 2019 Financial Results"
2019-02-22,Edited Transcript of TSLX earnings conference call or presentation 21-Feb-19 1:30pm GMT
2019-02-21,TPG Specialty Lending Inc (TSLX) Q4 2018 Earnings Conference Call Transcript
2019-02-20,TPG: 4Q Earnings Snapshot
2019-02-20,TPG Specialty (TSLX) Q4 Earnings and Revenues Surpass Estimates
2019-02-20,"TPG Specialty Lending, Inc. Reports Full Year and Fourth Quarter 2018 Earnings Results; Declares a Fourth Quarter 2018 Supplemental Dividend Per Share of $0.12 and a First Quarter 2019 Base Dividend Per Share of $0.39"
2019-02-13,TPG Specialty (TSLX) Earnings Expected to Grow: What to Know Ahead of Next Week's Release
2019-02-01,"TPG Specialty Lending, Inc. Expands its Board of Directors and Elects Hurley Doddy and Jennifer Gordon to the Board"
2019-01-23,"Detailed Research: Economic Perspectives on Shell Midstream Partners, Interface, National Western Life Group, TPG Specialty Lending, Francesca's, and Cytosorbents  What Drives Growth in Today's Competitive Landscape"
2019-01-18,"TPG Specialty Lending, Inc. Schedules Earnings Release and Conference Call to Discuss its Fourth Quarter Ended December 31, 2018 Financial Results"
2019-01-14,3 Dividend Stocks That Pay You More Than Exxon Does
2018-12-27,Mortgage & Related Services Outlook: Growth to Continue
2018-11-08,Edited Transcript of TSLX earnings conference call or presentation 7-Nov-18 1:30pm GMT
2018-11-06,TPG Specialty (TSLX) Q3 Earnings and Revenues Surpass Estimates
2018-11-06,TPG: 3Q Earnings Snapshot
2018-11-06,"TPG Specialty Lending, Inc. -- Moody's assigns Baa3 issuer and senior unsecured ratings to TPG Specialty Lending, Inc."
2018-11-06,"TPG Specialty Lending, Inc. Reports Third Quarter NII Per Share of $0.50 and NAV Per Share of $16.47; Declares a Third Quarter Supplemental Dividend Per Share of $0.05 and a Fourth Quarter Base Dividend Per Share of $0.39"
2018-11-02,Why the Earnings Surprise Streak Could Continue for TPG (TSLX)
2018-10-22,"Consolidated Research: 2018 Summary Expectations for Vuzix, BCE, Tetraphase Pharmaceuticals, T2 Biosystems, TPG Specialty Lending, and Jianpu Technology  Fundamental Analysis, Key Performance Indications"
2018-10-05,"TPG Specialty Lending, Inc. Schedules Earnings Release and Conference Call to Discuss its Third Quarter Ended September 30, 2018 Financial Results"
2018-09-20,3 Top Stocks Under $20
2018-08-28,What Is Private Equity? What to Know Before Investing
2018-08-03,Edited Transcript of TSLX earnings conference call or presentation 2-Aug-18 12:30pm GMT
