2020-12-23,"'Call Of Duty,' 'World Of Warcraft' Game Sales Boost Activision Stock"
2020-12-14,Gravity Launches an Idle Casual RPG Poring Merge for the First Time in Brazil
2020-12-09,Is Gravity (NASDAQ:GRVY) The Next Multi-Bagger?
2020-11-27,"Should I Avoid Gravity Co., LTD. (GRVY)?"
2020-11-16,Gaming Stock Gravity Clears A Key Technical Rating
2020-11-13,GRAVITY REPORTS THIRD QUARTER OF 2020 RESULTS AND BUSINESS UPDATES
2020-11-12,Ragnarok X: Next Generation ranked No.1 on Google Play in Taiwan and Hong Kong followed by Apple App Store
2020-10-25,"What Kind Of Shareholders Own Gravity Co., Ltd. (NASDAQ:GRVY)?"
2020-10-22,"Successful Launching of Ragnarok X: Next Generation in Taiwan, Hong Kong and Macau"
2020-10-15,"The Labyrinth of Ragnarok, Gravitys New Idle MMORPG, Releases in the Philippines, Singapore, and Malaysia on the 14th"
2020-09-16,How to Find Insider Ownership of Foreign Companies
2020-09-11,"Ragnarok X: Next Generation Official Launch in Taiwan, Hong Kong and Macau on October 15, 2020"
2020-09-10,"Investors Still Waiting For A Pull Back In Gravity Co., Ltd. (NASDAQ:GRVY)"
2020-08-25,"Ragnarok X: Next Generation Available for Pre-registration and CBT in Taiwan, Hong Kong and Macau"
2020-08-22,"Gravity Co., Ltd.'s (NASDAQ:GRVY) P/E Is On The Mark"
2020-08-08,"Gravity Co., Ltd. (NASDAQ:GRVY) Not Lagging Market On Growth Or Pricing"
2020-08-07,Gravity Reports Second Quarter of 2020 Results and Business Updates
2020-07-30,A Joint Publishing Contract with ByteDance Ltd. for Ragnarok X: Next Generation
2020-07-23,"A Look At The Fair Value Of Gravity Co., Ltd. (NASDAQ:GRVY)"
2020-07-13,Ragnarok Origin Hits Top 4 on Google Play and Apple App Store in Korea
2020-06-24,"Ragnarok Origin Official Launch in Korea on July 7, 2020"
2020-06-17,"Is Gravity Co., Ltd.'s(NASDAQ:GRVY) Recent Stock Performance Tethered To Its Strong Fundamentals?"
2020-06-04,"Ragnarok Online Successful Launching in Thailand with Over 100,000 Concurrent Users"
2020-05-31,"Hedge Funds Are Selling Gravity Co., LTD.  (GRVY)"
2020-05-29,GRAVITY REPORTS FIRST QUARTER OF 2020 RESULTS AND BUSINESS UPDATES
2020-05-19,Casino giant Caesars challenges go far beyond coronavirus and social distancing
2020-04-29,GRAVITY ANNOUNCES FILING OF ANNUAL REPORT ON FORM 20-F FOR FISCAL YEAR 2019
2020-04-28,Ragnarok Origin (Mobile) Available for Pre-Registration and CBT in Korea and Ragnarok Online (PC) CBT in Thailand
2020-04-18,Wish You Were Here: How Gravity (NASDAQ:GRVY) Shareholders Made A Stonking Gain Of 1604%
2020-03-02,"Gravity Co., Ltd. (NASDAQ:GRVY) Earns Among The Best Returns In Its Industry"
2020-02-13,Gravity Reports Preliminary Unaudited 4Q 2019 Result and Business Updates
2019-12-10,Ragnarok Tactics Available for Pre-Registration in Southeast Asia on December 9
2019-12-03,"A Closer Look At Gravity Co., Ltd.'s (NASDAQ:GRVY) Impressive ROE"
2019-11-29,"Is Gravity Co., LTD. (GRVY) A Good Stock To Buy?"
2019-11-14,GRAVITY Announces Third Quarter 2019 Financial Results and Business Updates
2019-11-14,Gravity Internationally Launches Mobile Game RO: Click H5 on November 13th
2019-11-12,Ragnarok Tactics Successful Launching in Thailand on November 8
2019-11-03,Gravity Opens its Official Website for G-STAR 2019
2019-10-17,Mobile Game Ragnarok M: Eternal Love Officially Launches in Europe and Russian Region on October 16th
2019-09-27,"Ragnarok M: Eternal Love Launches in Europe, Turkey, and Russia on October 16, 2019"
2019-09-27,Ragnarok M: Eternal Love Sets to Release on October 16 for the European Users
2019-09-04,If You Had Bought Gravity (NASDAQ:GRVY) Shares Three Years Ago You'd Have Made 998%
2019-08-22,Gravity Unveils its Future Plans During Gamescom 2019
2019-08-08,GRAVITY REPORTS SECOND QUARTER OF 2019 RESULTS AND BUSINESS UPDATES
2019-07-17,"Why You Should Like Gravity Co., Ltd.s (NASDAQ:GRVY) ROCE"
2019-06-20,"Low Price-Earnings Stocks: Goldman Sachs, Gravity"
2019-06-04,"Ragnarok M: Eternal Love Launching in Japan on June 5, 2019"
2019-05-27,The Client Connection Test for Ragnarok M: Eternal Love in Japan
2019-05-22,"Brief Commentary On Gravity Co., Ltd.'s (NASDAQ:GRVY) Fundamentals"
2019-05-13,Gravity Reports First Quarter of 2019 Results and Business Updates
2019-04-26,GRAVITY ANNOUNCES FILING OF ANNUAL REPORT ON FORM 20-F FOR FISCAL YEAR 2018
2019-04-03,"Is Gravity Co., Ltd.'s (NASDAQ:GRVY) ROE Of 52% Impressive?"
2019-02-15,Preliminary Unaudited Fourth Quarter 2018 Financial Results
2019-02-06,"Is Gravity Co., Ltd.s (NASDAQ:GRVY) 36% ROCE Any Good?"
2019-02-01,Ragnarok M: Eternal Love in Collaboration with Neon Genesis Evangelion and Preliminary Unaudited 4Q 2018 Revenue
2019-01-11,"Ragnarok M: Eternal Love launches in 43 countries across North America, South America and Oceania"
2018-12-18,"Ragnarok M: Eternal Love Official Launch in North America, South America and Oceania on 9 January 2019"
2018-11-27,"Ragnarok M: Eternal Love Available for Pre-Registration in North America, South America, and Oceania"
2018-11-23,"Factors of Influence in 2018, Key Indicators and Opportunity within Document Security, American Realty Investors, Digirad, GRAVITY Co., Ampco-Pittsburgh, and ChinaNet Online  New Research Emphasizes Economic Growth"
2018-11-06,Ragnarok M: Eternal Love marks No.1 on Google Play in Three Countries followed by Apple Store
2018-11-01,Ragnarok M: Eternal Love Becomes a Hit in Southeast Asia! Grossing Rank No. 1 in iOS in 4 Countries on the Launching Day!
2018-10-31,Gravity Reports Third Quarter of 2018 Results and Business Updates
2018-10-25,"Ragnaork M: Eternal Love Southeast Asia Version Launching on October 31, 2018"
2018-10-22,3 Technology Stocks To Watch This Week
2018-10-22,Is Gravity Co Ltd (NASDAQ:GRVY) A High Quality Stock To Own?
2018-10-16,"Ragnaork M: Attracting over 1,000,000 Pre-Registration Signups For Southeast Asia Version as of October 15, 2018."
2018-09-19,Gravity Announces Pre-Registration for Ragnaork M in Southeast Asia
2018-09-05,Should You Be Tempted To Buy Gravity Co Ltd (NASDAQ:GRVY) Because Of Its PE Ratio?
2018-08-27,Gravity to Effect 2-for-1 American Depositary Shares(ADS) Split
2018-08-27,Gravity Announces Listing Transfer to the NASDAQ Global Market
2018-07-27,Gravity Reports Second Quarter of 2018 Results and Business Update
2018-06-27,Top NasdaqCM Companies To Buy For Cheap
2018-05-25,7 Triple-A Stocks to Buy for the Summer
2018-05-05,Top Undervalued NasdaqCM Stocks This Month
2018-04-27,Gravity Reports First Quarter of 2018 Results and Business Updates
2018-04-27,GRAVITY ANNOUNCES FILING OF ANNUAL REPORT ON FORM 20-F FOR FISCAL YEAR 2017
2018-03-07,Gravity Issues a Business Update
2018-03-02,Gravity Provides an Investor Presentation
2018-02-02,Gravity Reports Preliminary 4Q 2017 Results and Business Updates
2017-11-02,What You Must Know About Gravity Co Ltds (GRVY) Risks
2017-11-01,"Gravity Co., Ltd. :GRVY-US: Earnings Analysis: Q3, 2017 By the Numbers : November 1, 2017"
2017-10-30,Gravity Reports Third Quarter of 2017 Results and Business Updates
2017-10-16,"At $36.97, Is Gravity Co Ltd (GRVY) A Buy?"
2017-08-21,Earnings Review and Free Research Report: Activision Blizzard Beat Revenues Estimates
2017-08-10,"Gravity Co., Ltd.: Strong price momentum but will it sustain?"
2017-08-09,Gravity Reports Second Quarter of 2017 Results and Business Updates
2017-05-05,"Gravity Co., Ltd. :GRVY-US: Earnings Analysis: Q1, 2017 By the Numbers : May 5, 2017"
2017-04-28,Gravity Reports FIRST Quarter of 2017 Results and Business Update
2017-04-28,Gravity Announces Filing of Annual Report on Form 20-F for Fiscal Year 2016
2017-03-09,Gravity Issues Business Updates
2017-01-25,Gravity Issues Business Updates
2016-11-02,"Gravity Co., Ltd. :GRVY-US: Earnings Analysis: Q3, 2016 By the Numbers : November 2, 2016"
2016-10-31,Trending Stocks to Watch with Upcoming Presidential Election
2016-10-28,Gravity Reports Third Quarter of 2016 Results
2016-08-24,Gravity Reports Second Quarter of 2016 Results
2016-06-01,"Gravity Co., Ltd. :GRVY-US: Earnings Analysis: Q1, 2016 By the Numbers : June 1, 2016"
2016-05-25,GRAVITY Reports First Quarter of 2016 Results
2016-04-26,"GRAVITY CO., LTD. Financials"
2016-04-26,"GRAVITY CO., LTD. Financials"
2016-04-20,GRAVITY Announces Filing of Annual Report on Form 20-F for Fiscal Year 2015
