2020-12-17,"Brazil ethanol company Cosan eyes reorganization, ADS listing"
2020-12-17,U.S. Pension Fund TIAA Embroiled in Brazil Land-Buying Probe
2020-12-12,Is CZZ A Good Stock To Buy Now?
2020-12-09,Cosan (NYSE:CZZ) Has Rewarded Shareholders With An Exceptional 439% Total Return On Their Investment
2020-10-25,Should You Be Impressed By Cosan Limited's (NYSE:CZZ) ROE?
2020-09-18,Cosan (CZZ) Down 3.4% Since Last Earnings Report: Can It Rebound?
2020-09-10,Investors Aren't Buying Cosan Limited's (NYSE:CZZ) Earnings
2020-08-24,Should Value Investors Buy Cosan (CZZ) Stock?
2020-08-19,Cosan (CZZ) Q2 2020 Earnings Call Transcript
2020-08-09,3 Potential Bargains for the Value Investor
2020-07-27,Is There More Growth In Store For Cosan's (NYSE:CZZ) Returns On Capital?
2020-07-07,"Will Cosan's Shares March Higher, Can It Continue?"
2020-07-07,Brazil's Cosan says reorganization may entail capitalization of all operating units
2020-07-02,2019 Sustainability Report And Commitments To Sustainable Development
2020-06-26,Here is What Hedge Funds Think About Cosan Limited (CZZ)
2020-06-15,5 Energy Stocks Beating the Market
2020-06-11,Analysts Just Made A Major Revision To Their Cosan Limited (NYSE:CZZ) Revenue Forecasts
2020-06-10,Cosan Limited informs approval of dividend payment to its shareholders
2020-06-03,Cosan Limited Announces the Filing of Its Annual Report on Form 20-F for Fiscal Year 2019
2020-06-01,Cosan Ltd (CZZ) Q1 2020 Earnings Call Transcript
2020-04-25,Need To Know: Analysts Are Much More Bullish On Cosan Limited (NYSE:CZZ) Revenues
2020-04-24,Moving Average Crossover Alert: Cosan
2020-04-17,A Trio of High Earnings Yield Stocks
2020-04-15,Cosan Overseas Limited -- Moody's announces completion of a periodic review of ratings of Cosan group of companies.
2020-03-26,Cosan Limited (CZZ): Hedge Fund Sentiment Is Near All Time Low
2020-03-19,Top Alternative Energy Stocks for Q2 2020
2020-03-14,Can Cosan Limited's (NYSE:CZZ) ROE Continue To Surpass The Industry Average?
2020-02-13,Cosan (CZZ) Dips More Than Broader Markets: What You Should Know
2020-02-12,"Rains, currency paint rosy outlook for Brazil sugar industry"
2020-02-07,Cosan (CZZ) Upgraded to Strong Buy: Here's Why
2020-02-07,Is Cosan (CZZ) a Great Value Stock Right Now?
2020-02-07,New Strong Buy Stocks for February 7th
2020-01-28,Is Cosan Limited (NYSE:CZZ) A Volatile Stock?
2020-01-22,Are Investors Undervaluing Cosan (CZZ) Right Now?
2020-01-21,"Brazilian energy, logistic companies Cosan and Raízen appoint new CEOs"
2020-01-16,"Exclusive: U.S. firm GIP, Shell-Cosan venture plan to bid on Brazil refineries- sources"
2020-01-14,Is Cosan (CZZ) Stock Outpacing Its Basic Materials Peers This Year?
2020-01-14,New Records Ahead of New Trade Deal and New Earnings Season
2020-01-06,Is Cosan (CZZ) Stock Undervalued Right Now?
2020-01-03,Here's Why Momentum Investors Will Love Cosan (CZZ)
2019-12-30,Can The Uptrend Continue for Cosan?
2019-12-26,Can Cosan (CZZ) Stock Continue to Grow Earnings?
2019-12-24,Is Cosan Limited (CZZ) a Good Value Investor Stock Now?
2019-12-24,Rallying Into the Holiday
2019-12-20,Should Value Investors Buy Cosan (CZZ) Stock?
2019-12-16,Can The Uptrend Continue for Cosan?
2019-12-12,Cosan (CZZ) Upgraded to Buy: What Does It Mean for the Stock?
2019-12-12,Is Cosan (CZZ) Outperforming Other Basic Materials Stocks This Year?
2019-12-11,Is Cosan Limited (CZZ) A Good Stock To Buy ?
2019-12-08,What Does Cosan Limiteds (NYSE:CZZ) 7.4% ROCE Say About The Business?
2019-12-04,Are Investors Undervaluing Cosan (CZZ) Right Now?
2019-12-01,5 Renewable Stocks To Watch In 2020
2019-11-21,Cosan's (CZZ) Net Income & Sales Rise Y/Y on Margin Expansion
2019-11-18,Are Investors Undervaluing Cosan (CZZ) Right Now?
2019-10-31,Are Investors Undervaluing Cosan (CZZ) Right Now?
2019-10-30,Are Investors Undervaluing Cosan (CZZ) Right Now?
2019-10-29,Brazil antitrust agency clears Raizen Energia purchase of Cosan Biomassa
2019-10-24,"The Cosan (NYSE:CZZ) Share Price Has Gained 100%, So Why Not Pay It Some Attention?"
2019-10-23,Did Hedge Funds Drop The Ball On Cosan Limited (CZZ)?
2019-10-14,Are Investors Undervaluing Cosan (CZZ) Right Now?
2019-10-01,Cosan (CZZ) Stock Moves -0.4%: What You Should Know
2019-09-30,Cosan Limited Announces Final Results Of Its Tender Offer
2019-09-26,Cosan Limited Announces Preliminary Results Of Its Tender Offer
2019-09-23,Cosan (CZZ) Gains As Market Dips: What You Should Know
2019-09-18,New Strong Sell Stocks for September 18th
2019-09-18,Why Cosan Limited (NYSE:CZZ) Looks Like A Quality Company
2019-09-16,Cosan (CZZ) Gains As Market Dips: What You Should Know
2019-09-12,"Cosan Limited Announces The Adjusted Price Range Of Its Tender Offer To Repurchase Up To U.S.$357,500,000 Of Its Class A Common Shares At A Price Not Greater Than U.S.$15.50 Nor Less Than U.S.$13.05 Per Share"
2019-09-11,Cosan Could Rally Further With Strong Charts and a Quant Recommendation
2019-09-06,Is Cosan (CZZ) Stock Undervalued Right Now?
2019-08-28,"Cosan Limited Announces Commencement Of Tender Offer To Repurchase Up To U.S.$357,500,000 Of Its Class A Common Shares At Price Not Greater Than U.S.$14.10 Nor Less Than U.S.$12.00 Per Share"
2019-08-23,Has Cosan (CZZ) Outpaced Other Basic Materials Stocks This Year?
2019-08-21,Is Cosan (CZZ) Stock Undervalued Right Now?
2019-08-20,Cosan Ltd (CZZ) Q2 2019 Earnings Call Transcript
2019-08-19,Does Cosan (NYSE:CZZ) Have A Healthy Balance Sheet?
2019-08-16,Cosan's (CZZ) Net Income Improves Y/Y on Solid Sales in Q2
2019-08-13,CORRECTED-Brazil's Cosan says JV with Mexico's FEMSA to open 500 stores
2019-08-07,Is Cosan (CZZ) Stock Outpacing Its Basic Materials Peers This Year?
2019-08-05,Should Value Investors Buy Cosan (CZZ) Stock?
2019-07-29,Cosan (CZZ) Dips More Than Broader Markets: What You Should Know
2019-07-23,Cosan (CZZ) Stock Sinks As Market Gains: What You Should Know
2019-07-22,Has Cosan (CZZ) Outpaced Other Basic Materials Stocks This Year?
2019-07-18,New Strong Buy Stocks for July 18th
2019-07-18,Here's Why Cosan (CZZ) is a Great Momentum Stock to Buy
2019-07-18,Is Cosan (CZZ) Stock Undervalued Right Now?
2019-07-17,Cosan (CZZ) Stock Moves -0.49%: What You Should Know
2019-07-17,How Does Cosan Limited (NYSE:CZZ) Affect Your Portfolio Volatility?
2019-07-15,"Brazil plan to open gas sector seen luring Naturgy, Engie, others"
2019-07-11,Cosan (CZZ) Gains But Lags Market: What You Should Know
2019-07-04,Is Cosan (CZZ) Stock Outpacing Its Basic Materials Peers This Year?
2019-07-03,Cosan (CZZ) Stock Sinks As Market Gains: What You Should Know
2019-07-01,Is Cosan (CZZ) Stock Undervalued Right Now?
2019-06-28,Cosan (CZZ) Upgraded to Strong Buy: What Does It Mean for the Stock?
2019-06-24,Heres What Hedge Funds Think About Cosan Limited (CZZ)
2019-06-24,New Strong Buy Stocks for June 24th
2019-06-18,New Strong Buy Stocks for June 18th
2019-06-16,Top Sugar Stocks for 20192020
2019-06-14,Cosan (CZZ) Up 14% Since Last Earnings Report: Can It Continue?
2019-06-13,Is Cosan (CZZ) Stock Undervalued Right Now?
2019-06-11,Are Cosan Limiteds Returns On Capital Worth Investigating?
