2021-01-08,Chartwell reaches agreement with SEIU Local 1 (Ontario) and SQEES 298 (Quebec)
2021-01-06,Why Shares of BlackBerry Soared in December
2021-01-05,BlackBerry to Participate in Upcoming Investor Conferences
2021-01-05,BlackBerry Is the Turnaround Story of 2020
2020-12-28,10 Biggest Phone Companies in the World
2020-12-26,Why Teslas Rivals Are Looking Better Than TSLA Shares
2020-12-25,Has BlackBerry (BB) Outpaced Other Computer and Technology Stocks This Year?
2020-12-23,"BlackBerry Receives Eleven ""Employer of Choice"" and ""Best Place to Work"" Awards in 2020"
2020-12-21,"BlackBerry Stock Remains a Show Me Story, Says Analyst"
2020-12-18,"4 Top Stock Trades for Monday: DRI, CRWD, WGO, BB"
2020-12-18,BlackBerry (BB) Beats on Q3 Earnings Despite Lower Revenues
2020-12-18,BlackBerry Limited (BB) Q3 2021 Earnings Call Transcript
2020-12-17,"BlackBerry Reports Sequential Software and Services Revenue Growth, Non-GAAP Profitability and Positive Free Cash Flow for Fiscal 2021 Third Quarter"
2020-12-17,"BlackBerry Reports Sequential Software and Services Revenue Growth, Non-GAAP Profitability and Positive Free Cash Flow for Fiscal 2021 Third Quarter"
2020-12-17,/R E P E A T -- Media Advisory: Infrastructure Announcement in B.C./
2020-12-16,BlackBerry (BB) May Have Entered New Uptrend
2020-12-16,A Preview Of BlackBerry's Earnings
2020-12-14,VOD or BB: Which Is the Better Value Stock Right Now?
2020-12-14,BlackBerry (BB) to Report Q3 Earnings: What's in Store?
2020-12-11,BlackBerry Prevails Against MobileIron's Baseless Extortion Claims
2020-12-07,Should Slack Shareholders Be Happy With This Deal?
2020-12-07,Are Investors Overreacting to BlackBerry's Deal with Amazon?
2020-12-04,Blackberry (BB) Stock Is Running Away  but Can It Continue?
2020-12-04,Why Shares of BlackBerry Soared on Friday
2020-12-04,"Cramer Weighs In On BlackBerry, PayPal And More"
2020-12-03,"BlackBerry to Announce Third Quarter Fiscal Year 2021 Results on December 17, 2020"
2020-12-03,"Telecom Stock Roundup: BB Inks Transformative Deal, ERIC Wins Contract & More"
2020-12-03,BlackBerry (BB) in Focus: Stock Moves 6.4% Higher
2020-12-02,Why BlackBerry Stock Jumped Again Today
2020-12-02,BlackBerry (BB) Stock Soars on AWS Deal for Smart Vehicle Data
2020-12-01,"BlackBerry to Host Investor Fireside Chat to Discuss New Intelligent Vehicle Data Platform, BlackBerry IVY"
2020-12-01,"BlackBerry to Host Investor Fireside Chat to Discuss New Intelligent Vehicle Data Platform, BlackBerry IVY"
2020-12-01,BlackBerry Teams Up With Amazon Web Services to Manage Vehicle Sensor Data
2020-12-01,"AdaptHealth, BlackBerry: 5 Top Stock Gainers for Tuesday"
2020-12-01,BlackBerry Surges Most Since 2015 on Amazon Collaboration
2020-12-01,Why BlackBerry Stock Is Skyrocketing Today
2020-12-01,You'll Never Guess the 2 Stocks Leading the Market Higher Tuesday
2020-12-01,BlackBerry Stock Jumps 50% on Deal With Amazon Web Services for Connected Car Software
2020-12-01,BlackBerrys stock rockets toward best day in 17 years after development deal with Amazons AWS
2020-12-01,BlackBerry Leaps After Deal With Amazon Cloud Business
2020-12-01,"Media Invitation - December 6, 1989 Commemorations"
2020-12-01,BlackBerry shares rocket upwards on AWS deal to integrate sensor data in vehicles
2020-12-01,BlackBerry's stock soars after development agreement with Amazon's AWS
2020-12-01,BlackBerry and Amazon team up on vehicle data and software platform
2020-12-01,AWS and BlackBerry Join Forces to Accelerate Innovation with New Intelligent Vehicle Data Platform
2020-11-27,Fineqia Announces Votes at Its 2020 Annual General Meeting
2020-11-25,Why BlackBerry Limited (TSE:BB) Could Be Worth Watching
2020-11-20,Nikola Looks Like a Good Longer-Term Bet
2020-11-18,BlackBerry (BB) QNX Software to Boost Plus' Self Driving Trucks
2020-11-18,BlackBerry Achieves NSA Approval for BlackBerry UEM
2020-11-18,BlackBerry Achieves NSA Approval for BlackBerry UEM
2020-11-17,Plus Chooses BlackBerry to Power Its Class 8 Truck Automated Driving System  First Self-Driving Truck Developer to Leverage Safety-Certified BlackBerry QNX Operating System
2020-11-05,BlackBerry QNX Adds Another Certification to its Embedded Software Portfolio
2020-11-02,"AEM Canada's, Cap Chat Plant, Commences High Purity Alumina Production"
2020-10-28,Shopifys 175% Rally Sets Up Key Test on How Long Boom Can Last
2020-10-21,Should You Take Comfort From Insider Transactions At BlackBerry Limited (TSE:BB)?
2020-10-20,BlackBerry QNX to Power ARCFOX T Innovative Digital Cockpit
2020-10-19,The RCMP lays charges against an individual for making and uttering false documents
2020-10-14,"The Government of Ontario, Canadian Manufacturers & Exporters (CME), and BlackBerry Partner on Ontario's Economic Recovery"
2020-10-14,"The Government of Ontario, Canadian Manufacturers & Exporters (CME), and BlackBerry Partner on Ontario's Economic Recovery"
2020-10-13,"Red Apple Store's Customers Donate Over $150,000 in Annual 2020 Food Drive!"
2020-10-08,What Makes BlackBerry (BB) a Promising Investment Option?
2020-10-08,"Telecom Stock Roundup: Ericsson, Nokia Extend 5G Commercial Deals & More"
2020-10-08,BlackBerry AtHoc and ServiceNow Partner to Deliver Secure and Reliable Incident Response Management
2020-10-07,BlackBerry report on Bahamut links hack-for-hire group to 'a variety of unsolved cases'
2020-10-07,BlackBerry AtHoc Integrates with Microsoft Teams for Critical Event Management
2020-10-07,BlackBerry AtHoc Integrates with Microsoft Teams for Critical Event Management
2020-10-07,"'Mercenary' hacker group runs rampant in Middle East, cybersecurity research shows"
2020-10-07,"'Mercenary' hacker group runs rampant in Middle East, cybersecurity research shows"
2020-10-07,"BlackBerry Uncovers Massive Hack-For-Hire Group Targeting Governments, Businesses, Human Rights Groups and Influential Individuals"
2020-10-06,Here is What Hedge Funds Really Think About BlackBerry Limited (BB)
2020-10-06,BlackBerry (BB) Ups the Ante With Converged Partner Program
2020-10-06,BlackBerry Launches New AI-Powered Mobile Threat Defense (MTD) Solution to Protect Against Mobile Malware and Phishing Attacks
2020-10-06,BlackBerry Launches New AI-Powered Mobile Threat Defense (MTD) Solution to Protect Against Mobile Malware and Phishing Attacks
2020-10-06,BlackBerry Persona Delivers Industry's First User Behavior AI Technology for Cybersecurity
2020-10-06,BlackBerry Persona Delivers Industry's First User Behavior AI Technology for Cybersecurity
2020-10-06,BlackBerry Unveils Industry's First Unified Endpoint Security (UES) Solution for AI-powered Cybersecurity
2020-10-05,BlackBerry Launches New Unified Partner Program
2020-10-04,Best Investment Strategies for a 401(k) or IRA
2020-10-02,Why BlackBerry Stock Declined 10% in September
2020-09-29,KT vs. BB: Which Stock Should Value Investors Buy Now?
2020-09-29,BlackBerry's $1.4 Billion Cylance Acquisition Will Continue to Cause Problems
2020-09-28,4 Underrated Tech Stocks
2020-09-28,BlackBerry Turns a Corner as the Automotive Market Revs Up Again
2020-09-25,BlackBerry Limited (BB) Q2 2021 Earnings Call Transcript
2020-09-24,Why DocuSign and Zoom Video Stocks Are Down Today -- but BlackBerry Stock Is Up
2020-09-24,How to Trade BlackBerry as the Stock Pops on Earnings
2020-09-24,"BlackBerry (BB) Has Fallen 14% in Last One Year, Underperforms Market"
2020-09-24,"BlackBerry posts surprise revenue rise on higher software, licensing demand"
2020-09-24,BlackBerry's (BB) Q2 Earnings & Revenues Beat Estimates
2020-09-24,"BlackBerry reports second-quarter loss, revenue up from year ago"
2020-09-24,"BlackBerry posts surprise revenue rise on higher software, licensing demand"
2020-09-24,Recap: BlackBerry Q2 Earnings
2020-09-24,"BlackBerry Reports Strong Fiscal 2021 Second Quarter Results, Beating Both Revenue And EPS Expectations"
2020-09-24,"BlackBerry Reports Strong Fiscal 2021 Second Quarter Results, Beating Both Revenue And EPS Expectations"
2020-09-24,BlackBerry Ltd. to Host Earnings Call
2020-09-23,Earnings Outlook for BlackBerry
2020-09-23,BlackBerry AtHoc Public Safety Edition Provides Local Governments and Universities Ability to Securely Communicate Critical Information Directly to their Community
2020-09-22,The United States Air Force Chooses BlackBerry Spark for Secure Productivity
2020-09-22,BlackBerry and TELUS Partner on Critical Event Management Across Canada
