2020-12-17,Galmed to add Open Label Part to ARMOR Study; First Read-out Expected in Q4 2021
2020-12-04,Is Galmed Pharmaceuticals Ltd (GLMD) A Good Stock To Buy?
2020-11-12,Galmed Pharmaceuticals Reports Third Quarter 2020 Financial Results
2020-11-12,Galmed Pharmaceuticals Ltd. to Host Earnings Call
2020-11-10,"The Daily Biotech Pulse: Lilly's COVID-19 Antibody Treatment Approved For Emergency Use, Supernus Faces Twin Regulatory Setbacks, Revance, Arena Flunk Midstage Studies"
2020-11-09,Galmed and MyBiotics to Collaborate in Development of Bespoke Microbiome Signature for Aramchol
2020-11-05,Galmed Pharmaceuticals to Report Third Quarter 2020 Financial Results and Provide Business Update on Thursday November 12
2020-10-20,We're Hopeful That Galmed Pharmaceuticals (NASDAQ:GLMD) Will Use Its Cash Wisely
2020-09-10,Galmed and Gannex Expand Development Programs For NASH Through Research Collaboration of Aramchol and ASC41 (THR-beta Agonist)
2020-08-06,Galmed Pharmaceuticals Provides Business Update and Reports Second Quarter 2020 Financial Results
2020-08-06,Galmed Pharmaceuticals Announces Acceleration of its New Clinical Amilo-5MER program
2020-07-30,Galmed Pharmaceuticals to Report Second Quarter 2020 Financial Results and Provide Business Update on Thursday August 6
2020-07-22,How Is Galmed Pharmaceuticals' (NASDAQ:GLMD) CEO Paid Relative To Peers?
2020-07-14,3 Healthcare Stocks Under $5 With Triple-Digit Upside Potential
2020-07-06,Here is What Hedge Funds Think About Galmed Pharmaceuticals Ltd (GLMD)
2020-06-26,Edited Transcript of GLMD earnings conference call or presentation 14-May-20 12:30pm GMT
2020-06-10,How Galmed (GLMD) Stock Stands Out in a Strong Industry
2020-05-14,"After Drug Failure, Genfit's Cupboard Is Nearly Bare"
2020-05-14,Galmed Pharmaceuticals Provides Business Update and Reports First Quarter 2020 Financial Results
2020-05-07,Galmed Pharmaceuticals to Report First Quarter 2020 Financial Results and Provide Business Update on Thursday May 14
2020-05-02,Such Is Life: How Galmed Pharmaceuticals (NASDAQ:GLMD) Shareholders Saw Their Shares Drop 54%
2020-03-26,Edited Transcript of GLMD earnings conference call or presentation 12-Mar-20 12:30pm GMT
2020-03-12,Galmed Pharmaceuticals Provides Business Update and Reports Fourth Quarter and Year End 2019 Financial Results
2020-03-05,Galmed Pharmaceuticals to Report Fourth Quarter and Year End 2019 Financial Results and Provide Business Update on Thursday March 12
2020-02-28,BioCryst Pharmaceuticals (BCRX) in Focus: Stock Moves 8.5% Higher
2020-02-05,13 Key NASH Drug Candidates To Watch For In A Potential $30-Billion Market
2020-01-03,Is Galmed Pharmaceuticals Ltd.'s (NASDAQ:GLMD) CEO Overpaid Relative To Its Peers?
2019-12-14,Do Hedge Funds Love Galmed Pharmaceuticals Ltd (GLMD)?
2019-12-04,Top Ranked Momentum Stocks to Buy for December 4th
2019-11-29,NASH Scorecard Year to Date: The Winners and the Losers
2019-11-08,Edited Transcript of GLMD earnings conference call or presentation 6-Nov-19 1:30pm GMT
2019-11-06,Galmed Pharmaceuticals Provides Business Update and Reports Third Quarter 2019 Financial Results
2019-11-04,Such Is Life: How Galmed Pharmaceuticals (NASDAQ:GLMD) Shareholders Saw Their Shares Drop 60%
2019-10-31,"Galmed Pharmaceuticals to Present New Data on Aramchol Effect on Glucose Metabolism, MoA and Clinical Results at AASLD 2019"
2019-10-30,"Galmed Pharmaceuticals to Report Third Quarter 2019 Financial Results and Provide Business Update on Wednesday, November 6"
2019-09-26,"Galmed Pharmaceuticals Initiated ARMOR, a Phase 3/4 Registrational Study of Aramchol in Subjects With NASH and Fibrosis"
2019-09-19,Should You Buy Galmed Pharmaceuticals Ltd. (NASDAQ:GLMD) For This Reason?
2019-08-12,Edited Transcript of GLMD earnings conference call or presentation 5-Aug-19 12:30pm GMT
2019-08-05,Galmed Pharmaceuticals Provides Business Update and Reports Second Quarter 2019 Financial Results
2019-07-29,"Galmed Pharmaceuticals to Report Second Quarter 2019 Financial Results and Provide Business Update on Monday, August 5"
2019-07-24,Could The Galmed Pharmaceuticals Ltd. (NASDAQ:GLMD) Ownership Structure Tell Us Something Useful?
2019-05-23,Is Galmed Pharmaceuticals Ltd.'s (NASDAQ:GLMD) CEO Being Overpaid?
2019-05-07,"Galmed Pharmaceuticals (GLMD) Reports Q1 Loss, Misses Revenue Estimates"
2019-05-07,Galmed Pharmaceuticals: 1Q Earnings Snapshot
2019-05-07,Galmed Pharmaceuticals Provides Business Update and Reports First Quarter 2019 Financial Results
2019-04-30,"Galmed Pharmaceuticals to Report First Quarter 2019 Financial Results and Provide Business Update on Tuesday, May 7"
2019-04-09,Galmed Pharmaceuticals Announces Successful Completion of End of Phase 2 Meeting With FDA and Plan for Start of Phase 3
2019-03-13,"Galmed Pharmaceuticals (GLMD) Reports Q4 Loss, Misses Revenue Estimates"
2019-03-13,Galmed Pharmaceuticals Reports Fourth Quarter and Full Year 2018 Financial Results and Provides Business Update
2019-03-12,Update: Galmed Pharmaceuticals (NASDAQ:GLMD) Stock Gained 95% In The Last Three Years
2019-03-12,Galmed Reports Positive Results From Pharmacokinetic Split Dose Study of Aramchol
2019-03-06,"Galmed Pharmaceuticals to Report Fourth Quarter and Year End 2018 Financial Results and Provide Business Update on Wednesday, March 13"
2018-12-28,Intercept (ICPT) Benefits from Ocaliva's Recovery in 2018
2018-12-12,What does Galmed Pharmaceuticals Ltd.s (NASDAQ:GLMD) Balance Sheet Tell Us About Its Future?
2018-12-11,Novan Announces Top-Line Data From Mid-Stage Molluscum Study
2018-11-20,Galmed Pharmaceuticals (GLMD) in Focus: Stock Moves 6.2% Higher
2018-11-14,"Recent Analysis Shows COUPA SOFTWARE, Galmed Pharmaceuticals, Sunworks, Murphy, Diversicare Healthcare Services, and Pro-Dex Market Influences  Renewed Outlook, Key Drivers of Growth"
2018-11-13,Phase 2 Data for Galmed Pharmaceutical's Aramchol in Non-Alcoholic Steatohepatitis (NASH) Presented During Late-Breaking Abstract Oral Session of The Liver Meeting® 2018
2018-11-13,Galmed Pharmaceuticals Sees Hammer Chart Pattern: Time to Buy?
2018-11-05,"Galmed Pharmaceuticals (GLMD) Reports Q3 Loss, Tops Revenue Estimates"
2018-11-05,Galmed Pharmaceuticals: 3Q Earnings Snapshot
2018-11-05,Galmed Pharmaceuticals Provides Business Update and Reports Third Quarter 2018 Financial Results
2018-10-31,"Nantahala Capital Managements Returns, AUM, and Holdings"
2018-10-29,"Galmed Pharmaceuticals to Report Third Quarter 2018 Financial Results and Provide Business Update on Monday, November 5"
2018-10-12,Who Really Owns Galmed Pharmaceuticals Ltd (NASDAQ:GLMD)?
2018-10-02,Galmed Pharmaceuticals Announces a Late-Breaking Abstract on Aramchol to be Presented at the American Association for the Study of Liver Diseases (AASLD) - The Liver Meeting®
2018-09-27,"Galmed Pharmaceuticals to Present at the Cantor Global Healthcare Conference, ROTH Battle of the NASH Thrones Investor Conference and Stifel Healthcare Conference"
2018-08-02,Medical-Drugs Stock Outlook: No Respite from Near-Term Pain
2018-08-02,Galmed Pharmaceuticals (GLMD) Reports Q2 Loss
2018-08-02,Galmed Pharmaceuticals: 2Q Earnings Snapshot
2018-08-02,Galmed Pharmaceuticals Provides Business Update and Reports Second Quarter 2018 Financial Results
2018-07-26,"Galmed Pharmaceuticals to Report Second Quarter 2018 Financial Results and Provide Business Update on Thursday, August 2"
2018-07-20,What's in Store for Universal Health's (UHS) Q2 Earnings?
2018-07-20,What's in the Cards for HCA Healthcare (HCA) in Q2 Earnings?
2018-07-13,Here's Why Galmed Pharmaceuticals Ltd. Was Up 19% Today and 33% for the Week
2018-07-13,Galmed Notches Second Bullish Rating On Aramchol Opportunity
2018-07-13,Today's Research Reports on Stocks to Watch: Galmed Pharmaceuticals and Zogenix
2018-07-12,Cantor Fitzgerald Makes An Uber-Bullish Call On Galmed Pharmaceuticals
2018-07-12,Today's Research Reports on Trending Tickers: Galmed Pharmaceuticals and Akcea Therapeutics
2018-06-26,"This Is the Most Undervalued NASH Drug Stock, and Wall Street Is Ignoring It"
2018-06-25,Upcoming FDA Catalyst and Disruptive Drug Candidate Indicate Big Near-Term Upside For This Unknown Healthcare Stock
2018-06-20,"Benzinga's Daily Biotech Pulse: Sarepta's DMD Gene Therapy, Anika's Flunked Trial, Eidos To Commence Trading"
2018-06-19,Galmed Pharmaceuticals Ltd. Announces Pricing of Public Offering of Ordinary Shares
2018-06-18,Galmed Pharmaceuticals Ltd. Announces Proposed Public Offering of Ordinary Shares
2018-06-16,3 Biotech Stocks That Soared This Week: Are They Buys?
2018-06-15,"Pharma Stock Roundup: LLY/AZN Alzheimer's Drug Fails, MRK's Keytruda Wins Approvals"
2018-06-15,3 NASH Stocks That Could Soar in the Second Half of 2018
2018-06-15,Hacking the Human Brain: This Unknown Stock (With 1 Very Prominent Shareholder) Could Change The Game & Make Shareholders Unheard of Returns
2018-06-14,Are These Red-Hot NASH Stocks Still a Buy?
2018-06-14,NASH Space in Focus as Galmed (GLMD) Posts Positive Data
2018-06-13,Galmed (GLMD) Soars on Positive NASH Data on Aramchol
2018-06-13,"Comprehensive Research Report, Galmed Pharmaceuticals Soars on Clinical Trial Results in Liver Disease Study"
2018-06-13,Todays Research Reports on Stocks to Watch: Sage Therapeutics and Galmed Pharmaceuticals
2018-06-12,Why Galmed Pharmaceuticals Ltd Stock Is Going Gangbusters Today
2018-06-12,Galmed's 200% Jump Leads Biotechs Higher
2018-06-12,Why Galmed Pharmaceuticals Ltd. Stock Is Skyrocketing Today
2018-06-12,"Benzinga's Daily Biotech Pulse: Galmed Rips Higher On Positive NASH Data, Enzo Biochem Falls On Earnings, Pfenex Licenses Osteoporosis Candidate"
2018-06-12,Galmed Pharmaceuticals' stock rockets 161% after trial results support FDA marketing application
2018-06-12,Israeli company Galmed gets positive trial results for liver drug
2018-06-12,"Galmed's 600 mg Aramchol Achieved a Regulatory Approvable Endpoint Showing NASH Resolution Without Worsening of Fibrosis, in NASH Patients, in the Global Phase 2b ARREST 52-Week Study"
