2021-01-11,"8K TVs, See-Through Displays, Home Robots Debut At CES 2021"
2021-01-11,"8K TVs, See-Through Displays, Home Robots Debut At CES 2021"
2021-01-06,CANON HELPS REDEFINE THE LIMITS AT CES® 2021
2021-01-06,"Canon U.S.A., Inc., Earns Prestigious Center of Excellence Recognition from BenchmarkPortal"
2021-01-05,"Canon U.S.A., Inc., is Honored with Two 2020 'ASTORS' Homeland Security Awards"
2020-12-17,Canon Inc. Makes Carbon Disclosure Project's (CDP) 'A-List' in Two Categories
2020-12-08,"Canon U.S.A., Inc. Receives Two BLI 2021 Awards in the Document Imaging Software Category"
2020-12-07,Is CAJ A Good Stock To Buy Now?
2020-12-04,Price Over Earnings Overview: Canon
2020-12-03,Canon U.S.A.'s PRISMAsync Color Print Server v7 for imagePRESS Receives G7® Certification from Idealliance
2020-12-02,"Ideal For Convenient, Low Maintenance Printing, Canon U.S.A. Strengthens The PIXMA G-series MegaTank Printer Family"
2020-12-01,"Canon U.S.A., Inc., Announces New Feeding Accessory and Fiery-powered Controllers for the imagePRESS C910 Series"
2020-12-01,"Canon to commence sales of the FPA-3030i5a Semiconductor Lithography System in March 2021, Supporting Reduced Cost-of-Ownership Manufacturing for Small Substrates"
2020-12-01,Canon (CAJ) Moves to Strong Buy: Rationale Behind the Upgrade
2020-12-01,3 Office Equipment Stocks to Watch in a Challenging Industry
2020-11-25,Canon Identifies and Addresses Data Security Incident
2020-11-19,"Keypoint Intelligence Names Canon U.S.A., Inc., Recipient of a Buyers Lab PaceSetter Award in Healthcare: Visionary Leader"
2020-11-05,Canon U.S.A. Receives The U.S. EPA SmartWay Excellence Award For The Second Consecutive Year
2020-11-04,New Industrial Machine Vision Cameras From Canon Utilize Next-Gen 19 Micron Sensor Technology For Color Low-Light Image Capture
2020-11-03,Canon Adds Two RF Lenses And PIXMA PRO Printer Ideal For The Enthusiast Photographer
2020-10-26,Canon: Q3 Earnings Insights
2020-10-23,Earnings Preview: Canon
2020-10-21,Canon Receives Three Keypoint Intelligence Awards in Buyers Lab Round-Up
2020-10-19,Canon U.S.A. Announces Three New Industrial Imaging Sensors
2020-10-17,Canon Inc. -- Moody's announces completion of a periodic review of ratings of Canon Inc.
2020-10-14,Photographers: Expand Your Creativity And Versatility To Another Dimension With New Speedlite EL-1
2020-10-14,Improved Eye Autofocus Paired With New Video And Streaming Functions Make The New Canon EOS M50 Mark II Camera A Strong Imaging Tool For Content Creators And Imaging Storytellers
2020-10-14,"Canon Debuts The Company's First-Ever, Compact Telephoto Monocular, The PowerShot ZOOM"
2020-10-08,"Keypoint Intelligence Recognizes Canon U.S.A., Inc. for its High-Quality Service and Support with BLI PaceSetter Award"
2020-10-05,Canon Office Cloud Print Management Solution Achieves Moderate Level FedRAMP Authorization
2020-10-01,Five New Photographers Added to Famed Canon Explorers of Light Program
2020-09-24,Analyst Report: Canon Inc.
2020-09-24,Canon Further Strengthens Its UHDxs Broadcast Lens Lineup With New CJ20ex5B 4K UHD Portable Zoom Lens
2020-09-24,Ready For Action:  The Canon EOS C70 4K Digital Cinema Camera Packs Cinema EOS Imaging Features Into Still Camera Ergonomics
2020-09-17,Canon U.S.A. Helps Bridge the Document Workflow Divide between the Corporate Office and the Home Office
2020-09-16,"Direct From Canon Customers, The Next Chapter In The EOS Webcam Utility Software Story Has Arrived With The Launch Of The Full Production Version For Windows"
2020-09-16,"The Next Generation Of Canon's Instant Camera Printer, IVY CLIQ+2 And IVY CLIQ2, Encourage Snap And Print Stickable Memories - In An Instant"
2020-09-15,"Japan stocks edge higher, markets nervous before Fed meeting"
2020-09-15,Canon U.S.A. Introduces New Line Of Cable ID Printers With Outstanding Performance And Flexibility
2020-09-15,"Japanese shares slip on firmer yen, profit-taking after election"
2020-09-14,"Japan shares fall on profit-taking after election, firmer yen"
2020-09-09,"Canon U.S.A., Inc. Announces New End-to-End Large Format Solutions"
2020-09-06,"Thousands Evacuate in Japan, Factories Shutter Ahead of Typhoon"
2020-09-03,Canon U.S.A. Offers New Solution to Help Organizations with Control and Tracking Documents that are Scanned to Email
2020-09-02,"Canon U.S.A. and I.R.I.S. Announce Flexible, Customizable Platform to Support Customers in Paper-Intensive Industries"
2020-09-02,Canon Receives Four Keypoint Intelligence - Buyers Lab Summer 2020 Pick Awards
2020-09-02,Now Is The Ideal Time To Refresh Your Home Or Small Business Office Setup With A New Canon PIXMA Printer
2020-09-02,New Strong Sell Stocks for September 2nd
2020-09-01,"New imagePRESS C10010VP / C9010VP Digital Presses Designed to Drive Productivity, Versatility and High Image Quality"
2020-09-01,INTRODUCING THE NEW ARIZONA 2300 SERIES: Improved Flatbed Production and Productivity
2020-08-28,Canon Inc. -- Moody's announces completion of a periodic review of ratings of Canon Inc.
2020-08-26,Many Canon cameras can now automatically back up pictures to Google Photos
2020-08-18,A Conversation with a Short Seller
2020-08-06,New Strong Sell Stocks for August 6th
2020-08-01,Stocks That Fell to 3-Year Lows in the Week of July 31
2020-07-31,Toshiba Repels Activist Challenge With Sweep of Board Vote
2020-07-29,"Nikkei dips to 2-1/2-week low as yen firms, earnings disappoint"
2020-07-29,Asian markets mixed amid gloomy earnings and pandemic concerns
2020-07-28,"Nikkei dips as yen firms, earnings disappoint"
2020-07-28,Canon Plunges Most in Eight Years After First Quarterly Loss
2020-07-28,Canon: Q2 Earnings Insights
2020-07-28,"Canon reports first ever quarterly loss, cuts dividend"
2020-07-21,Canon and NT-ware Announce Support for Microsoft's Universal Print
2020-07-16,"Investing In The Future Of 4K Broadcasting, Game Creek Video Adds Canon UHD-DIGISUPER 111 And 122 4K Field Box Zoom Lenses To Their Arsenal"
2020-07-15,Canon U.S.A. Brings the ProStream 1800 to the U.S.
2020-07-10,How Chip-Equipment Maker ASML Is Powering Past the Pandemic
2020-07-09,"Canon's new R5 and R6 mirrorless cameras offer big video upgrades, bird eye autofocus and more"
2020-07-09,Dear Image Makers: Canon's New ImagePROGRAF PRO-300 Provides Exceptional Quality Prints And Offers Newly Updated Software Solutions
2020-07-09,"The Secret Is Out: Canon Officially Announces The Canon EOS R5 And R6, The Company's Most Advanced Full-Frame Mirrorless Cameras Ever"
2020-07-08,"Google, Amazon Funnel Money to Virus Conspiracy Sites: Study"
2020-07-07,Canon To Commence Sales Of The FPA-8000iW Semiconductor Lithography System Which Is Capable Of 1 Micron Resolution With Support For Large Panels
2020-06-30,"If 2020 Weren't Strange Enough, Printers Are Staging a Comeback"
2020-06-29,New Strong Sell Stocks for June 29th
2020-06-24,NEP Group Invests in the Future of 4K Broadcasting by Adding Canon UHD-DIGISUPER 111 and 122 4K Field Box Zoom Lenses to Their Fleet
2020-06-24,New Strong Sell Stocks for June 24th
2020-06-19,New Strong Sell Stocks for June 19th
2020-06-15,Create and Print Informational COVID-19 Related Signage Through Canon's PosterArtist Software and imagePROGRAF Large Format Printers
2020-06-15,Canon U.S.A. Sponsored and Participated In the Virtual 15th Annual Japan Center Essay Competition Awards Program
2020-06-13,Hedge Funds Arent Interested In Canon Inc. (CAJ)
2020-06-08,Here's Why You Should Retain Genpact (G) in Your Portfolio
2020-06-01,Canon U.S.A. Announces Crowd People Counter Software To Capture Crowd Sizes In Real Time
2020-05-27,"You Asked, Canon Delivers: The EOS Webcam Utility Beta Software* Now Available For macOS[1] Users"
2020-05-26,A Trio of Low Price-Book Ratio Stocks to Consider
2020-05-24,Stocks That Fell to 3-Year Lows in the Week of May 22
2020-05-18,Panasonic reports 29% drop in annual operating profit
2020-05-16,Stocks That Fell to 3-Year Lows in the Week of May 15
2020-05-14,Canon's New imagePROGRAF TA-20 MFP L24ei Expands Printing Capabilities for Small Businesses
2020-05-11,Canon U.S.A. Announces System Integrator Program Opening Doors To A Multitude Of Benefits And New Opportunities
2020-05-05,Were Hedge Funds Right About Canon Inc. (CAJ)?
2020-04-28,"New Canon U.S.A., Inc. Software Solution Allows Select EOS Interchangeable Lens Cameras To Function As High-Quality USB Webcam*"
2020-04-26,Stocks That Fell to 3-Year Lows in the Week of April 24
2020-04-20,The Excitement Builds: Canon Announces Additional In-Demand Specifications Of The EOS R5 Full-Frame Mirrorless Camera
2020-04-20,Family Tradition: The New EOS C300 Mark III Cinema Camera Is A Super 35mm Modular Workhorse
2020-04-20,Canon U.S.A. Introduces New CINE-SERVO 25-250mm T2.95-3.95 Cinema Lens Available In Both EF And PL Mount
2020-04-20,Canon U.S.A. Announces a Host of Firmware Updates for Professional Imaging Products
2020-04-20,Canon Introduces New CJ18ex7.6B KASE S UHDgc Portable Zoom Lens Designed For 4K UHD Broadcast 2/3-inch Cameras
2020-04-06,New Strong Sell Stocks for April 6th
2020-04-02,Canon U.S.A. Awarded Energy Star® Partner Of The Year - Sustained Excellence Award For 2020
2020-04-01,"New varioPRINT iX-Series Sheetfed Press Offers Offset Quality, Digital Flexibility and Inkjet Productivity"
2020-04-01,"Kazuto Ogawa Assumes Role as President and CEO of Canon U.S.A., Inc."
