2021-01-11,Intercorp Financial Services (IFS) Enters Overbought Territory: Is A Drop Coming?
2020-10-13,"Intercorp Financial Services, Inc. To Host Third Quarter 2020 Earnings Conference Call & Audio Webcast Presentation"
2020-08-19,INTERCORP FINANCIAL SERVICES INC.: IFS Confirmed to Remain Part of Lima Stock Exchange's Good Corporate Governance Index for Third Consecutive Year
2020-07-21,"Intercorp Financial Services, Inc. to Host Second Quarter 2020 Earnings Conference Call & Audio Webcast Presentation"
2020-05-14,Intercorp Financial Services (IFS) Q1 2020 Earnings Call Transcript
2020-04-27,Filing of 2019 Annual Report on Form 20-F
2020-04-06,Is Intercorp Financial Services Inc. (IFS) A Good Stock To Buy?
2019-12-22,Is Intercorp Financial Services Inc. (NYSE:IFS) A Good Stock To Buy?
2019-07-18,Intercorp Financial Services IPO: What You Need To Know
2019-07-15,"IPO Outlook For The Week: Biotechs, Financial Advisers, Medical Services And The Twitch Of China"
