2021-01-11,Luther Burbank Corporation Announces Fourth Quarter 2020 Earnings Release and Conference Call Dates
2020-12-22,Renu Agrawal Joins Luther Burbank Corporation Board of Directors
2020-11-29,Is Luther Burbank Corporation (LBC) A Good Stock To Buy?
2020-10-28,Luther Burbank Corporation (LBC) Q3 2020 Earnings Call Transcript
2020-10-28,Luther Burbank Corp. to Host Earnings Call
2020-10-27,Luther Burbank (LBC) Tops Q3 Earnings and Revenue Estimates
2020-10-27,"Luther Burbank Corporation Reports Earnings for the Quarter and Nine Months Ended September 30, 2020"
2020-10-20,Analysts Estimate Luther Burbank (LBC) to Report a Decline in Earnings: What to Look Out for
2020-10-09,Luther Burbank Corporation Announces Third Quarter 2020 Earnings Release and Conference Call Dates
2020-09-25,"Luther Burbank Savings Secures $55,000 in AHEAD Grants to Benefit Pandemic Relief Projects"
2020-08-01,Luther Burbank Corporation (NASDAQ:LBC) Stock Goes Ex-Dividend In Just Four Days
2020-07-29,Luther Burbank Corporation (LBC) Q2 2020 Earnings Call Transcript
2020-07-28,Luther Burbank (LBC) Tops Q2 Earnings and Revenue Estimates
2020-07-28,Recap: Luther Burbank Q2 Earnings
2020-07-28,"Luther Burbank Corporation Reports Earnings for the Quarter and Six Months Ended June 30, 2020"
2020-07-21,Earnings Preview: Luther Burbank (LBC) Q2 Earnings Expected to Decline
2020-07-10,Luther Burbank Corporation Announces Second Quarter 2020 Earnings Release and Conference Call Dates
2020-06-10,Should You Avoid Luther Burbank Corporation (LBC)?
2020-05-06,Luther Burbank Corporation Just Missed EPS By 33%: Here's What Analysts Think Will Happen Next
2020-05-05,Luther Burbank Corporation (LBC) Q1 2020 Earnings Call Transcript
2020-05-04,Luther Burbank (LBC) Q1 Earnings and Revenues Lag Estimates
2020-05-04,"Luther Burbank Corporation Reports Earnings for the Quarter Ended March 31, 2020"
2020-05-01,A Rising Share Price Has Us Looking Closely At Luther Burbank Corporation's (NASDAQ:LBC) P/E Ratio
2020-04-27,Luther Burbank (LBC) Q1 Earnings Preview: What's in the Cards?
2020-04-17,Does The Luther Burbank Corporation (NASDAQ:LBC) Share Price Tend To Follow The Market?
2020-04-10,LUTHER BURBANK CORPORATION ANNOUNCES FIRST QUARTER 2020 EARNINGS RELEASE AND CONFERENCE CALL DATES
2020-03-12,Did Changing Sentiment Drive Luther Burbank's (NASDAQ:LBC) Share Price Down By 16%?
2020-02-01,There's A Lot To Like About Luther Burbank Corporation's (NASDAQ:LBC) Upcoming US$0.058 Dividend
2020-01-28,Luther Burbank (LBC) Misses Q4 Earnings and Revenue Estimates
2020-01-28,"Luther Burbank Corporation Reports Earnings for the Quarter and Year Ended December 31, 2019"
2020-01-10,Luther Burbank Corporation Announces Fourth Quarter 2019 Earnings Release and Conference Call Dates
2020-01-10,Do You Like Luther Burbank Corporation (NASDAQ:LBC) At This P/E Ratio?
2019-12-30,New Strong Buy Stocks for December 30th
2019-12-24,Do Hedge Funds Love Luther Burbank Corporation (LBC)?
