2020-09-16,SGOCO Group (NASDAQ:SGOC) Share Prices Have Dropped 21% In The Last Five Years
2019-11-13,"What Percentage Of SGOCO Group, Ltd. (NASDAQ:SGOC) Shares Do Insiders Own?"
2019-10-25,"SGOCO Group, Ltd. announces the holding of Annual Shareholders Meeting"
2018-12-20,Nasdaq Minimum Bid Price Deficiency Letter
2018-06-08,"SGOCO Group, Ltd. announces the holding of Annual Shareholders Meeting"
2018-04-13,SGOCO Group Ltd (NASDAQ:SGOC): Does The -25.31% Earnings Drop Reflect A Longer Term Trend?
2018-03-02,Should You Be Concerned About SGOCO Group Ltds (NASDAQ:SGOC) Investors?
2018-01-02,Was SGOCO Group Ltds (NASDAQ:SGOC) Earnings Decline A Part Of Broader Industry Downturn?
2017-12-01,"SGOCO Group, Ltd. Announces 2017 Unaudited Interim Financial Results"
2017-11-30,"SGOCO Group, Ltd. announces the holding of Annual Shareholders Meeting"
2017-11-28,"SGOCO Group, Ltd. Nominates New Director for Annual Meeting"
2017-10-23,"SGOCO Group, Ltd. Appoints New Director"
2017-09-22,NasdaqCM Consumer Industry: A Deep Dive Into SGOCO Group Ltd (SGOC)
2017-08-31,"SGOCO Group, Ltd. Appoints New Directors"
2017-06-20,"SGOCO Group, Ltd. Signed a contract with Hong Kong Aircraft Engineering Company Limited"
2017-05-08,"SGOCO Group, Ltd. Announces Acquisition of Century Skyway Limited"
2017-04-12,"SGOCO Group, Ltd. Announces Closing of US$1,000,000 Registered Direct Offering"
2017-04-06,"SGOCO Group, Ltd. Announces US$1,000,000 Registered Direct Offering"
2017-03-15,"SGOCO Group, Ltd. Signed a letter of intent with Hong Kong Aircraft Engineering Company Limited"
2016-12-23,"SGOCO Group, Ltd. Announces 2016 Unaudited Interim Financial Results"
2016-12-19,"SGOCO Group, Ltd. Signed a Project Development Agreement with Nano and Advanced Materials Institute, Ltd"
2016-11-11,"SGOCO Group, Ltd. Signed a BocaPCM-TES Contract with Differ Commercial Management Ltd."
2016-11-10,*** DATA NOT AVAILABLE ***
2016-10-20,"SGOCO GROUP, LTD. Financials"
2016-09-21,"SGOCO Group, Ltd. Appoints DCAW (CPA) Limited as Its New Independent Registered Public Accounting Firm"
2016-08-19,"SGOCO Group, Ltd. Announces Increase In Its Authorized Share Capital and Authorized Ordinary Shares"
2016-07-15,"SGOCO Group, Ltd. announces the holding of Annual Shareholders Meeting"
2016-05-23,"SGOCO Group Ltd. :SGOC-US: Earnings Analysis: For the six months ended December 31, 2015 : May 23, 2016"
2016-05-23,"SGOCO Group Ltd. :SGOC-US: Earnings Analysis: 2015 By the Numbers : May 23, 2016"
2016-05-11,SGOCO Announces Entry Into Agreement for Private Placement of $7 Million of Unregistered Ordinary Shares of the Company
2016-02-10,SGOCO Regains Compliance with NASDAQ Bid Price Requirement
2016-02-09,"SGOCO Group, Ltd. (NASDAQ: SGOC) Cooperative Agreement Signed; Analyst Comments"
2016-02-03,"SGOCO Group, Ltd. signed a cooperative agreement with a Korean company -- Blue F.I. Group"
2016-01-26,"SGOCO Group, Ltd. Signed an Exclusive Agency Agreement in Macau"
2016-01-26,"SGOCO Group, Ltd. Signed an Exclusive Agency Agreement in Macau"
2016-01-25,Splits Calendar: SGOCO splits before market open today (1:4 ratio)
2016-01-22,"SGOCO Group, Ltd. Announces the Reverse Stock Split of its Ordinary Shares"
2016-01-06,"Value Strategies in 2015: NCAV up 30%, Destruction for the others"
2015-12-30,"SGOCO Group, Ltd. Announces Acquisition of Boca International Limited"
2015-12-24,"SGOCO Group, Ltd. Announces 2015 Unaudited Interim Financial Results"
2015-12-22,"SGOCO Group, Ltd. Appoints New Directors"
2015-11-20,"SGOCO Group, Ltd. announces the holding of Annual Shareholders Meeting"
2015-10-12,"SGOCO Group, Ltd. Held a Strategic Cooperation Conference with AMD Radeon in ShenZhen"
2015-09-28,"SGOCO Group, Ltd. Announces it has retained a NASDAQ Member Firm as the Company's Strategic"
2015-09-14,"SGOCO Group, Ltd. Announces the Holding of Special Meeting of Shareholders"
2015-08-18,"SGOCO Group, Ltd. Appoints Mr. Xiao-Ming Hu as Interim Chief Financial Officer"
2015-08-13,"SGOCO Group, Ltd. Announces Extension of Time to Cure Deficiency"
2015-05-15,"SGOCO Group, Ltd. Announces 2014 Annual Financial Results and Unaudited Second Half Financial Results"
2015-05-01,NT 20-F
2015-02-20,"SGOCO Group, Ltd. Announces Notice of Nasdaq Deficiency"
2015-02-20,"SGOCO Group, Ltd. Announces Notice of Nasdaq Deficiency"
2015-01-01,Report of foreign issuer rules 13a-16 and 15d-16 of the Securities Exchange Act
2015-01-01,"SGOCO Group, Ltd. Announces Sale of SGOCO (Fujian) Electronic Co., Ltd."
2014-12-31,"SGOCO Group, Ltd. Announces Sale of SGOCO (Fujian) Electronic Co., Ltd."
2014-12-29,SkyPeople Fruit Juice Announces Changes in Management and its Board of Directors
2014-12-19,"SGOCO Group, Ltd. Announces 2014 Interim Financial Results"
2014-11-17,"SGOCO Group, Ltd. Announces the Holding of Annual Shareholders Meeting"
2014-11-17,"SGOCO Group, Ltd. Announces the Holding of Annual Shareholders Meeting"
2014-11-03,"SGOCO Group, Ltd. Appoints Mr. Shi-Bin Xie as President and Chief Executive Officer"
2014-08-28,Why SGOCO Group (SGOC) Stock Is Skyrocketing Today
2014-08-28,"SGOCO Group, Ltd. launches online sales platform on JD.com"
2014-07-07,"SGOCO Group, Ltd. Announces Appointment of Director"
2014-04-23,SGOCO Group's CEO Discusses Q4 2013 Results - Earnings Call
2014-04-22,"SGOCO Group, Ltd. Announces Full Fiscal Year 2013 and Fourth Quarter 2013 Financial Results and Announce the Upcoming Launch of e-Commerce Business Line"
2014-04-09,SGOCO Unveils New Products for the High-end Market
2014-04-03,Why SGOCO Group (SGOC) Stock Is Plunging Today
2014-04-02,"SGOCO Group, Ltd. Announces Unaudited Preliminary Results for Fourth Quarter 2013"
2014-04-02,SGOCO Group - A Turnaround Story With All Eyes On Q4 Results
2014-03-13,"SGOCO GROUP, LTD. Financials"
2014-03-10,SGOCO Announces Three Management Promotions
2014-01-03,SGOCO Announces Management And Board Changes
2013-12-09,"SGOCO Group, Ltd. Investor Presentation Now Available for On-demand Viewing at RetailInvestorConferences.com"
2013-12-03,"NYSE, OTC and Nasdaq Companies Webcast to Online Investors: December 5th at RetailInvestorConferences.com"
2013-11-25,"SGOCO Group, Ltd. to Webcast, Live, at RetailInvestorConferences.com on December 5th"
2013-11-21,SGOCO Group's Management Discusses Q3 2013 Results - Earnings Call Transcript
2013-11-20,Nasdaq stocks posting largest percentage increases
2013-11-20,"SGOCO Group, Ltd. Announces Third Quarter 2013 Financial Results"
2013-11-20,Q3 2013 SGOCO Group Ltd Earnings Release - After Market Close
2013-11-19,SGOCO Group Poised To Join InterCloud In Orbit Following A Probable Earnings Blowout
2013-11-08,"SGOCO Group to Announce Financial Results for 2013 Third Quarter on November 20, 2013"
2013-08-28,"CCG Investor Relations and MarcumBP Announces Final Line-up for China Best Ideas Investment Conference, September 10th in Beijing"
2013-08-26,SGOCO Group to Attend 2013 China Best Ideas Investment Conference in Beijing
2013-08-21,SGOCO Group's Management Discusses Q2 2013 Results - Earnings Call Transcript
2013-08-21,SGOCO Group Management Discusses Q2 2013 Results - Earnings Call Transcript
2013-08-21,On The Fly: Pre-market Movers
2013-08-20,On The Fly: After Hours Movers
2013-08-20,"SGOCO Group, Ltd. Announces Second Quarter 2013 Financial Results"
2013-08-14,5 Stocks Under $10 in Breakout Territory
2013-08-06,"SGOCO Group to Announce Financial Results for 2013 Second Quarter on August 20, 2013"
2013-07-02,"CFO Moves: Celsion, First Acceptance, SGOCO Group"
2013-07-02,InPlay: SGOCO appoints Johnson Lau as CFO; fomer CFO Xu now COO
2013-07-02,SGOCO Group appoints Johnson Lau as CFO
2013-07-02,"SGOCO Group, Ltd. Appoints Johnson Lau As Chief Financial Officer"
2013-06-17,SGOCO Group's Management Discusses Q1 2013 Results - Earnings Call Transcript
2013-06-17,SGOCO Group's CEO Discusses Q1 2013 Results - Earnings Call Transcript
2013-06-14,Nasdaq stocks posting largest volume increases
2013-06-10,"SGOCO Group, Ltd. Announces Solid Growth in Revenues and Earnings for First Quarter 2013"
2013-06-08,"SGOCO Group to Announce Financial Results for its First Quarter 2013 Ended March 31, 2013 and Host Earnings Conference Call"
2013-04-29,"SGOCO Group, Ltd. Appoints New Director"
2013-04-24,SGOCO Group: Firing On All Cylinders
