2021-01-11,10 Biggest Newspapers In The US
2021-01-08,Is News Corp (NWS) Stock a Buy For 2021?
2021-01-07,Realtor.com® December Housing Report: Number of Homes for Sale Hits an All-Time Low
2021-01-05,YouTube Reinstates News Corp. Radio Station Following Ban
2021-01-05,15 Biggest Media Companies in the World
2021-01-05,The New York Post Pulls Top Editor From The Sun
2021-01-05,YouTube Restores News Corp-Owned TalkRadios Channel After Brief Suspension
2021-01-05,The New York Post Group names The Sun's Keith Poole as editor-in-chief
2021-01-05,Keith Poole Named Editor in Chief of the New York Post Group
2020-12-21,Is NWSA A Good Stock To Buy According To Hedge Funds?
2020-12-18,News Corp's Rupert Murdoch has received COVID-19 vaccine
2020-12-17,Statement By News Corp Regarding Multistate Litigation Against Google
2020-12-17,Realtor.com® Survey: More than a Third of Young Americans are More Interested in Smart Home Technology Due to the Pandemic
2020-12-15,Realtor.com® Acquires Avail
2020-12-14,Realtor.com® Analysis: Risk of Flood and Wildfire Damage Likely to Impact Home Prices in 2021 and Beyond
2020-12-14,Is NWS A Good Stock To Buy Now?
2020-12-09,PubMatic IPO Set to Open After Adtech Company Raises $118 Million
2020-12-07,Realtor.com® Top Housing Markets: Tech Hubs and State Capitals Will Dominate 2021
2020-12-05,Why Is News Corp. (NWSA) Up 33.4% Since Last Earnings Report?
2020-12-03,Is It Too Late To Consider Buying News Corporation (NASDAQ:NWSA)?
2020-12-02,News Corp to Participate in UBS Global TMT Virtual Conference
2020-12-02,Realtor.com® 2021 Housing Forecast: Sellers Will Get Top Dollar As Buyers Struggle with Affordability
2020-11-25,ViacomCBS Is Selling Its Book Publisher for $2.2 Billion. What It Means for the Stock.
2020-11-25,"Statement of Robert Thomson, Chief Executive of News Corp, Regarding the Sale of Simon & Schuster to Bertelsmann"
2020-11-19,Realtor.com® Weekly Housing Report: Buyers and Sellers Jump Back in Post Election
2020-11-17,"At Home More Than Ever, Americans Crave More Space"
2020-11-17,This $3.6 Billion Search for Relevance Wont Bring Much Joyy
2020-11-13,Realtor.com® October Rental Report: Rent Declines Accelerate in Tech Hubs as Remote Work Prompts the Desire for More Space
2020-11-12,"Donald Trump is hatching a plan to wreck Fox News, insiders tell Axios"
2020-11-12,News Corp (NWSA) in Focus: Stock Moves 5.7% Higher
2020-11-12,Realtor.com® Weekly Housing Report: New Listings Decline Even Further as Buyers and Sellers Hit Pause During Election Week
2020-11-08,"News Corporation (NWSA) Q1 Earnings Top Estimates, Sales Down"
2020-11-06,"News Corporation (NWSA) Q1 Earnings Top Estimates, Sales Down"
2020-11-05,News Corp. (NWSA) Beats Q1 Earnings and Revenue Estimates
2020-11-05,News Corporation Reports First Quarter Results for Fiscal 2021
2020-11-05,Realtor.com® October Housing Report: Homes Sell Even Faster While Buyers Pay Summer Prices
2020-11-04,"Media Stocks' Nov 5 Earnings Roster: DISCA, NWSA & More"
2020-10-30,News Corp Statement On The New York Post And Twitter
2020-10-30,"World Wrestling (WWE) Q3 Earnings Beat Estimates, Surge Y/Y"
2020-10-29,News Corp. (NWSA) Reports Next Week: What You Should Expect
2020-10-29,"Comcast's (CMCSA) Q3 Earnings Beat, Internet User Base Rises"
2020-10-29,Realtor.com® Weekly Housing Report: Home Buyers Stand to Benefit from New Listings Trend Improvement
2020-10-27,News Corp to Report Fiscal 2021 First Quarter Earnings
2020-10-27,3 Stocks to Buy From the Prospering Entertainment Industry
2020-10-26,News'(NASDAQ:NWSA) Share Price Is Down 11% Over The Past Five Years.
2020-10-23,Factors Likely to Influence Ralph Lauren (RL) in Q2 Earnings
2020-10-22,Extra! New York Times Stock Makes Headlines With Rating Upgrade
2020-10-22,"Realtor.com® Weekly Housing Report: Housing Market Shows Signs of Stabilizing, But Will it Relieve Weary Buyers?"
2020-10-21,Crocs (CROX) to Report Q3 Earnings: What Awaits the Stock?
2020-10-21,Realtor.com® Survey: More than One Third Of Americans Would Consider Relocating if their Candidate Doesn't Win the Election
2020-10-15,Realtor.com® Weekly Housing Report: Sellers Inch Their Way Back into the Market
2020-10-14,Realtor.com® Survey Finds Ghosts and Goblins Don't Have Homeowners Hanging a For Sale Sign
2020-10-11,Australian ex-PM Rudd calls for inquiry into Murdoch media dominance
2020-10-11,Australian ex-PM Rudd calls for inquiry into Murdoch media dominance
2020-10-09,News Corporation Sees Hammer Chart Pattern: Time to Buy?
2020-10-08,Realtor.com® Weekly Housing Report: Stubbornly High Home Prices Refuse to Come Down From Their Summer Peak
2020-10-07,Google Gets Mixed Reception in Supreme Court Clash With Oracle
2020-10-07,FOX News Media Signs Three Book Deal With HarperCollins to Launch New Publishing Platform FOX News Books
2020-10-07,Who is Today's Millennial Home Buyer? Realtor.com® Unveils New Research on the Largest Generation in the U.S.
2020-10-06,Roku CMO Matthew Anderson Will Exit to Join James Murdochs Lupa Systems
2020-10-06,5 Stocks Set to Soar on New Analyst Coverage
2020-10-06,Realtor.com®  Red Versus Blue Report: Blue State Americans Are Searching For Homes In Swing States; What Does That Mean For The Presidential Election?
2020-10-01,"Statement of Robert Thomson, Chief Executive of News Corp, On Googles Announcement Regarding Partnerships With News Publishers"
2020-10-01,Realtor.com® Monthly Housing Report: September is No Longer the Best Time to Buy a Home
2020-09-29,Google Sees Deal Within Reach on World-First Law to Pay for News
2020-09-29,Hedge Funds Arent Crazy About News Corp (NWSA) Anymore
2020-09-25,Realtor.com® Deurbanization Report: The Grass is Greener in the Suburbs
2020-09-24,"Realtor.com® Weekly Housing Report: Nearly 400,000 Fewer Homes Have Been Listed Since the Start of the Pandemic"
2020-09-21,"As wildfires burn the West Coast, residents face another challenge: High prices pushing people out of urban centers"
2020-09-18,"REMINDER: News Corp to Hold Virtual Dow Jones Investor Day on September 21, 2020"
2020-09-17,Realtor.com® Weekly Housing Report: Home Price Growth Hits Two-Year High as Wildfires and Hurricanes Put the Brakes on New Listings
2020-09-16,News Corp Announces Plan to Shift New York Printing
2020-09-10,News Corp to Participate in Goldman Sachs 29th Annual Communacopia Conference
2020-09-10,It Might Not Be A Great Idea To Buy News Corporation (NASDAQ:NWSA) For Its Next Dividend
2020-09-10,Realtor.com® Weekly Recovery Report: Summer Buying Season Resists The Usual Fall Slowdown
2020-09-10,Realtor.com® Appoints Chris Patalano as Chief Technology Officer
2020-09-10,Netflix's Reed Hastings credits co-CEO with landing Prince Harry/Meghan Markle deal
2020-09-05,Why Is News Corp. (NWSA) Up 10.7% Since Last Earnings Report?
2020-09-04,News Corp to Host Virtual Dow Jones Investor Day
2020-09-04,"News Corporation Clears Technical Benchmark, Hitting 80-Plus RS Rating"
2020-09-03,Frenzied Buyer Demand and Low Inventory Ignite Double-Digit Growth in Home Prices
2020-09-01,Facebook Sends World a Warning With Threat to Australian News
2020-09-01,"EXPLAINER-Facebook, Google battle Australia over proposed revenue-share law"
2020-09-01,Facebook Threatens to Cut Off Australians From Sharing News
2020-08-27,Realtor.com® Weekly Recovery Report: Housing's Supply and Demand Imbalance Enters Uncharted Territory
2020-08-26,Realtor.com® Helps Home Shoppers Understand a Property's Flood Risk
2020-08-24,"Murdochs Dow Jones Gets $140,000 From Zero Hedge in Settlement"
2020-08-20,Publishers Ask Apple CEO for Same App Store Deal Given to Amazon
2020-08-20,New York Post Announces Multi-Platform Partnership With Jalen Rose
2020-08-20,Realtor.com® Weekly Recovery Report: Listing Prices Surprise with Fastest Growth Since January 2018
2020-08-18,"West Coast, Best Coast, No More?"
2020-08-13,Realtor.com® Weekly Recovery Report: Final Piece of Recovery Puzzle Falls into Place with New Listings Growth
2020-08-10,People Are Searching in the Suburbs More Than Ever Before
2020-08-07,News Corporation (NWSA) Posts Narrower-Than-Expected Q4 Loss
2020-08-07,News Corporation Posts 22% Decline in Q4 Revenue as COVID-19 Pandemic Hits Business; Target Price $10
2020-08-06,News Corp beats revenue estimates on strong online subscriptions
2020-08-06,"MEDIA-News Corp has considered alternatives for Storyful unit, including possible sale - WSJ"
2020-08-06,News Corporation Reports Fourth Quarter and Full Year Results for Fiscal 2020
2020-08-06,Realtor.com® Weekly Recovery Report: Peak Home Buying Season Shifts from May to August This Year
2020-08-05,Will the Promising Trends At News (NASDAQ:NWSA) Continue?
