2021-01-11,5 Stocks with Great Bounce-back Potential In 2021
2021-01-05,A Trio of High-Return Stock Picks
2021-01-04,Is WestRock (WRK) a Profitable Stock for Value Investors?
2020-12-31,Why the Earnings Surprise Streak Could Continue for WestRock (WRK)
2020-12-23,WestRock (WRK) Gains From Solid Packaging Demand & Buyouts
2020-12-21,Is WRK A Good Stock To Buy According To Hedge Funds?
2020-12-14,Brandi Colander Joins WestRock as Chief Sustainability Officer
2020-12-11,WestRock Announces Conference Call to Discuss First Quarter Fiscal 2021 Results
2020-12-05,WestRock (WRK) Up 13.4% Since Last Earnings Report: Can It Continue?
2020-11-27,Here's Why You Should Hold On to WestRock (WRK) Stock for Now
2020-11-24,WestRock Announces Participation in Upcoming Investor Conference
2020-11-17,WestRock Named to 2020 Dow Jones Sustainability North America and World Indices
2020-11-11,WestRock (WRK) Gains on Solid Packaging Demand Amid Cost Woes
2020-11-10,WestRock Recognized for Excellence in Merchandising Displays
2020-11-10,WestRock Announces Participation in Upcoming Investor Conference
2020-11-06,"Company News for Nov 6, 2020"
2020-11-05,WestRock (WRK) Q4 2020 Earnings Call Transcript
2020-11-05,WestRock (WRK) Earnings & Revenues Top Estimates in Q4
2020-11-05,WestRock: Q4 Earnings Insights
2020-11-05,WestRock (WRK) Surpasses Q4 Earnings and Revenue Estimates
2020-11-05,WestRock Reports Fiscal 2020 Fourth Quarter Results
2020-11-04,Is a Surprise Coming for WestRock Company (WRK) This Earnings Season?
2020-11-03,Why the Earnings Surprise Streak Could Continue for WestRock (WRK)
2020-11-03,Jim Porter to Retire from WestRock
2020-11-02,WestRock (WRK) to Report Q4 Earnings: What's in the Cards?
2020-10-30,WestRock Announces Quarterly Dividend of $0.20 Per Share
2020-10-29,WestRock (WRK) Expected to Beat Earnings Estimates: What to Know Ahead of Q4 Release
2020-10-20,Ingevity Corporation -- Moody's assigns Ba3 to Ingevity's new senior unsecured notes
2020-10-20,WestRock Honored for Design Excellence by Paperboard Packaging Council
2020-10-19,Wait for a Dip in International Paper Before Going Long
2020-10-16,WestRock Company's (NYSE:WRK) Stock On An Uptrend: Could Fundamentals Be Driving The Momentum?
2020-10-16,WestRock Is Set to Continue Its Rise Through Resistance
2020-10-15,Gladstone Expands Presence in Alabama With $14.25M Buyout
2020-10-07,Ingevity Corporation -- Moody's announces completion of a periodic review of ratings of Ingevity Corporation
2020-10-07,WestRock to Cut Production Capacity to Align With Demand
2020-10-06,WestRock Announces Conference Call to Discuss Fourth Quarter and Full Year Fiscal 2020 Results
2020-10-06,"WestRock to Reduce SBS Capacity by Approximately 200,000 Tons"
2020-09-28,Packaging Stocks Box Gains in Recent Months
2020-09-22,Mead Corporation (The) -- Moody's announces completion of a periodic review of ratings of WRKCo Inc.
2020-09-15,How Much Is WestRock Company (NYSE:WRK) Paying Its CEO?
2020-09-14,Hedge Funds Are Betting On WestRock Company (WRK)
2020-09-03,Why Is WestRock (WRK) Up 9.5% Since Last Earnings Report?
2020-08-25,Top Consumer Discretionary Stocks for September 2020
2020-08-24,Is WestRock Breaking Out of Its Triangle Pattern?
2020-08-17,Investment Note: WestRock Looks Like a Bargain
2020-08-09,Just Three Days Till WestRock Company (NYSE:WRK) Will Be Trading Ex-Dividend
2020-08-04,WestRock (WRK) Q3 2020 Earnings Call Transcript
2020-08-04,Consumer packaging business exceeds expectations in WestRock earnings report
2020-08-04,"WestRock's (WRK) Earnings Beat Estimates in Q3, Down Y/Y"
2020-08-04,WestRock (WRK) Beats Q3 Earnings Estimates
2020-08-04,Recap: WestRock Q3 Earnings
2020-08-04,WestRock Reports Fiscal 2020 Third Quarter Results
2020-07-30,WestRock Announces Quarterly Dividend of $0.20 Per Share
2020-07-29,WestRock (WRK) to Report Q3 Earnings: What's in the Cards?
2020-07-28,Analysts Estimate WestRock (WRK) to Report a Decline in Earnings: What to Look Out for
2020-07-20,Don't Trash the Box: Domino's® and WestRock Partner to Encourage Customers to Recycle Their Pizza Boxes
2020-07-12,Did Hedge Funds Make The Right Call On WestRock Company (WRK) ?
2020-07-10,WestRock's Situation Is Not Very Attractive
2020-07-01,WestRock Announces Conference Call to Discuss Third Quarter Fiscal 2020 Results
2020-06-29,WestRock Honored for Outstanding Merchandising Achievement
2020-06-10,Should You Avoid WestRock Company (WRK)?
2020-06-04,Why Is WestRock (WRK) Up 20.9% Since Last Earnings Report?
2020-06-01,WestRock Prices $600 Million of Senior Notes
2020-06-01,WRKCo Inc. -- Moody's rates WestRock's new senior unsecured notes Baa2
2020-05-26,Did You Manage To Avoid WestRock's (NYSE:WRK) Painful 60% Share Price Drop?
2020-05-12,"Cramer Gives His Opinion On Cisco, Uber And More"
2020-05-07,WestRock Announces Participation in Upcoming Investor Conference
2020-05-05,WestRock Co (WRK) Q2 2020 Earnings Call Transcript
2020-05-05,WestRock Cuts Dividend 75% to Protect Balance Sheet During Pandemic
2020-05-05,"WestRock (WRK) Beats on Q2 Earnings, Scraps '20 Guidance"
2020-05-05,"WestRock Reports Quarterly Sales Miss, Slashes Dividend Payout By 57%"
2020-05-05,WestRock Reports Fiscal 2020 Second Quarter Results
2020-05-01,Covid-19 Is Creating a Different Kind of Debt Crisis. But Some Stocks Look Like Buys.
2020-04-30,What's in the Offing for WestRock's (WRK) Q2 Earnings?
2020-04-28,Earnings Preview: WestRock (WRK) Q2 Earnings Expected to Decline
2020-04-28,Does WestRock Company's (NYSE:WRK) -5.3% Earnings Drop Reflect A Longer Term Trend?
2020-04-14,10 Stocks Leading the Rally in the S&P 500 ETF
2020-04-06,WestRock Announces Conference Call to Discuss Second Quarter Fiscal 2020 Results
2020-04-01,Should You Worry About WestRock Companys (NYSE:WRK) ROCE?
2020-03-23,These Georgia public companies were slammed in the latest coronavirus selloff
2020-03-17,Should You Buy WestRock Company (WRK)?
2020-03-12,6 Guru Stocks Expected to Boost Earnings
2020-03-11,Ingevity Corporation -- Moody's changed Ingevity's outlook to stable from negative and affirmed its Ba2 CFR
2020-03-11,"High Volumes, KapStone Buyout Aid WestRock Amid Weak Pricing"
2020-02-29,Why Is WestRock (WRK) Down 16.9% Since Last Earnings Report?
2020-02-25,Atlanta packaging giant adds familiar face to its new-look board
2020-02-18,WestRock Announces Participation in Upcoming Investor Conference
2020-02-14,Is WestRock (WRK) a Suitable Stock for Value Investors Now?
2020-02-09,"WestRock Company (NYSE:WRK) Is About To Go Ex-Dividend, And It Pays A 4.5% Yield"
2020-02-07,Former Delta Air Lines exec lands as president of IBM
2020-02-03,Edited Transcript of WRK.N earnings conference call or presentation 30-Jan-20 1:30pm GMT
2020-01-31,WestRock Announces Quarterly Dividend of $0.465 Per Share
2020-01-31,WestRock Announces Election of Suzan Harrison to Board of Directors
2020-01-30,WestRock (WRK) Earnings and Revenues Surpass Estimates in Q1
2020-01-30,WestRock (WRK) Beats Q1 Earnings and Revenue Estimates
2020-01-30,WestRock Reports Fiscal 2020 First Quarter Results
2020-01-24,What's in the Offing for WestRock's (WRK) Q1 Earnings?
2020-01-23,Analysts Estimate WestRock (WRK) to Report a Decline in Earnings: What to Look Out for
2020-01-21,WestRock Named to FORTUNEs List of Worlds Most Admired Companies
2020-01-21,Is WestRock Company (NYSE:WRK) A Great Dividend Stock?
