2021-01-11,Staples Seeks $2.1 Billion Deal for Parent of Office Depot
2021-01-11,ODP's stock soars to more than 3-year high after confirming Staples' buyout bid
2021-01-11,The ODP Corporation Confirms Receipt of Acquisition Proposal From Staples
2021-01-11,Why ODP Stock Popped 17% Monday Morning
2021-01-11,Office Depot Parent Soars on Staples $2.1 Billion Takeover Offer
2021-01-11,"USR Parent, Inc. Proposes To Acquire ODP"
2021-01-08,"Zacks Value Trader Highlights: Everest Re Group, KB Home, Manulife Financial, ODP Corp and Sanmina Corp"
2021-01-07,Top Classic Value Stocks to Start 2021
2021-01-07,Are Options Traders Betting on a Big Move in The ODP Corporation (ODP) Stock?
2021-01-07,Is Office Depot (ODP) a Great Value Stock Right Now?
2021-01-07,"ODP Corporation's (ODP) Shares March Higher, Can It Continue?"
2021-01-07,5 Best Value Picks Based on Discounted PEG
2021-01-06,"The ODP Clears Technical Benchmark, Hitting 80-Plus RS Rating"
2021-01-06,ODP or FIVE: Which Is the Better Value Stock Right Now?
2021-01-05,ODP Well-Positioned to Maintain Momentum This Year
2021-01-04,Top Ranked Growth Stocks to Buy for January 4th
2021-01-04,Top Ranked Value Stocks to Buy for January 4th
2020-12-31,Top Ranked Growth Stocks to Buy for December 31st
2020-12-30,"Zacks.com featured highlights include: LabCorp, Honda Motor, Boise Cascade, ODP Corp and General Motors"
2020-12-29,Top Ranked Value Stocks to Buy for December 29th
2020-12-29,5 Low Price-to-Book Value Stocks to Buy in the New Year
2020-12-23,"The Zacks Analyst Blog Highlights: Tapestry, MarineMax, ODP, DKS and Target"
2020-12-23,Top Ranked Growth Stocks to Buy for December 23rd
2020-12-18,ODP or DKS: Which Is the Better Value Stock Right Now?
2020-12-18,"Zacks.com featured highlights include: ODP Corp, LabCorp, Boise Cascade, Koppers Holdings and Greif"
2020-12-16,Is ODP A Good Stock To Buy Now?
2020-12-15,"Zacks.com featured highlights include: ODP Corp, Spectrum Brands, JELD-WEN and Boise Cascade"
2020-12-15,Top Ranked Growth Stocks to Buy for December 15th
2020-12-14,"Zacks.com featured highlights include: Spectrum Brands, JELD-WEN, Boise Cascade, ODP Corp and General Motors"
2020-12-14,"Zacks.com featured highlights include: ODP Corp, CAI International, Triton International and Monarch Casino & Resort"
2020-12-11,5 Low Price-to-Book Value Stocks to Buy in December
2020-12-11,4 Stocks Promising Stellar Returns as Analysts Initiate Coverage
2020-12-09,Scoop Up These 4 Stocks From the Promising Miscellaneous Retail Industry
2020-12-09,Top Ranked Growth Stocks to Buy for December 9th
2020-12-08,Find Strong Stocks with this New Analyst Coverage Screener
2020-12-07,Office Depot Survey Reveals Top Home Office Essentials That Lead to Productive Employees
2020-12-05,ODP Corp. (ODP) Up 13.1% Since Last Earnings Report: Can It Continue?
2020-12-04,Why ODP Corp. (ODP) Might be Well Poised for a Surge
2020-12-04,Top Ranked Value Stocks to Buy for December 4th
2020-12-03,Top Ranked Growth Stocks to Buy for December 3rd
2020-12-03,7 Valuable Low Price-to-Sales Stocks With Potential to Grow
2020-12-02,ODP vs. TSCO: Which Stock Is the Better Value Option?
2020-11-30,"Zacks.com featured highlights include: ODP, Spectrum Brands, JELD-WEN and Boise Cascade"
2020-11-27,"Zacks.com featured highlights include: Spectrum Brands, Laboratory Corporation, Boise Cascade, ODP and Honda"
2020-11-27,"Zacks.com featured highlights include: ODP, Myers, Catalyst, Vicor and Bally's"
2020-11-27,4 Low Price-to-Cash Flow Stocks to Refine Your Portfolio
2020-11-27,5 High Earnings Yield Stocks to Add to Your Portfolio
2020-11-27,Top Ranked Value Stocks to Buy for November 27th
2020-11-25,"The Zacks Analyst Blog Highlights: Brinker, Constellation Brands, Travelzoo, Kraft Heinz and ODP"
2020-11-25,"Tiffany's (TIF) Q3 Earnings Top Estimates, Online Sales Surge"
2020-11-25,5 Stocks to Keep an Eye on as Analysts Initiate Coverage
2020-11-25,"Tiffany's (TIF) Q3 Earnings Top Estimates, Online Sales Surge"
2020-11-25,Top Ranked Growth Stocks to Buy for November 25th
2020-11-25,5 Valuable Low Price-to-Book Stocks for Solid Profits
2020-11-24,"The Zacks Analyst Blog Highlights: ODP, WESCO, General Motors, Laboratory Corp and Knight-Swift"
2020-11-24,Bet on These 5 Low Leverage Stocks to Avoid Portfolio Losses
2020-11-24,Top Ranked Value Stocks to Buy for November 24th
2020-11-24,5 Stocks to Feast On This Thanksgiving Week
2020-11-19,Top Ranked Growth Stocks to Buy for November 19th
2020-11-19,"ODP Corp, RealReal, Boeing, Lowe's and NVIDIA highlighted as Zacks Bull and Bear of the Day"
2020-11-19,Bull of the Day: Office Depot (ODP)
2020-11-18,New Jersey Government Awards CompuCom a Class D Electronic Waste Recycling Permit
2020-11-18,Moving Average Crossover Alert: ODP Corp (ODP)
2020-11-17,"Zacks.com featured highlights include: ODP Corp, United Natural Foods, Covenant Logistics, Boise Cascade and Mr. Cooper Group"
2020-11-16,Are Investors Undervaluing ODP Corp. (ODP) Right Now?
2020-11-16,ODP vs. TSCO: Which Stock Is the Better Value Option?
2020-11-16,7 Stocks With Low Price-to-Sales That Are Worth Betting On
2020-11-16,New Strong Buy Stocks For November 16th
2020-11-16,Top Ranked Growth Stocks to Buy for November 16th
2020-11-09,Keep Business and School Going with Office Depots Black Friday and Cyber Monday Deals
2020-11-06,ODP Earnings and Revenues Surpass Estimates in Third Quarter
2020-11-05,Why The ODP Corporation Stock Soared on Thursday
2020-11-05,ODP (NASDAQ:ODP) Takes On Some Risk With Its Use Of Debt
2020-11-05,ODP Corp. (ODP) Beats Q3 Earnings and Revenue Estimates
2020-11-05,The ODP Corporation Announces Third Quarter 2020 Results
2020-11-02,Factors to Note Ahead of ODP Corporation's (ODP) Q3 Earnings
2020-10-30,ODP Corp. (ODP) Stock Moves -0.91%: What You Should Know
2020-10-27,"Office Depots Charitable Programs Provide Over $3.5 Million in Educational Supplies to Students, Teachers and Title I Schools"
2020-10-22,"The ODP Corporation to Announce Third Quarter 2020 Earnings Results Thursday, November 5, 2020"
2020-10-14,Do Hedge Funds Love The ODP Corporation (ODP)?
2020-09-22,Sidoti Virtual Investor Conference
2020-09-22,Sidoti: Virtual Investor Conference
2020-09-22,"The ODP Corporation to Participate in the Sidoti & Company Fall Investor Conference Wednesday, September 23, 2020"
2020-09-17,"Office Depot and Brit + Co Team Up to Launch Selfmade, a New Online Startup School for Women"
2020-09-04,ODP Corp. (ODP) Up 23.2% Since Last Earnings Report: Can It Continue?
2020-09-01,"ODP Corporation (ODP) Looks Troubled, Hurt by Soft BSD Sales"
2020-08-21,"Whirlpool, ODP Corp. and Best Buy highlighted as Zacks Bull and Bear of the Day"
2020-08-21,Bear of the Day: Office Depot (ODP)
2020-08-12,Office Depot Releases 12th Annual Diverse Supplier Catalog
2020-08-10,Office Depot Unveils powered by CompuCom to Provide SMBs with Scalable Technology and Service Solutions
2020-08-06,"ODP Q2 Earnings and Revenues Miss Estimates, Decline Y/Y"
2020-08-05,Why The ODP Corporation Stock Fell as Much as 10% on Aug. 5
2020-08-05,Office Depot Inc (ODP) Q2 2020 Earnings Call Transcript
2020-08-05,"Zacks.com featured highlights include: Office Depot, Graphic Packaging, Canadian Solar and Owens & Minor"
2020-08-05,"ODP Corp. (ODP) Reports Q2 Loss, Misses Revenue Estimates"
2020-08-05,The ODP Corporation Announces Second Quarter 2020 Results
2020-08-04,Is a Surprise Coming for Office Depot (ODP) This Earnings Season?
2020-08-03,How ODP Corporation (ODP) Looks Just Ahead of Q2 Earnings
2020-07-30,Top Ranked Income Stocks to Buy for July 30th
2020-07-29,ODP Corp. (ODP) Earnings Expected to Grow: Should You Buy?
