2021-01-08,argenx Announces 2021 Corporate Priorities and Highlights Recent Achievements Across Immunology Pipeline
2021-01-07,"The Daily Biotech Pulse: CureVac COVID-19 Vaccine Deal, Argenx Out-Licenses Neuromuscular Disorder Drug, Xencor's Oncology Collaboration"
2021-01-06,argenx and Zai Lab Announce Strategic Collaboration for Efgartigimod in Greater China
2021-01-04,argenx to Present at 39th Annual J.P. Morgan Healthcare Conference
2020-12-19,Is ARGX A Good Stock To Buy Now According To Hedge Funds?
2020-12-14,AstraZenecas $39 Billion Takeout of Alexion Wins Tepid Wall Street Approval
2020-11-23,argenx Enters Into Agreement To Acquire Priority Review Voucher
2020-11-17,"argenx Premieres A Mystery to Me, a Docuseries Inspired by the Myasthenia Gravis Patient Experience"
2020-11-09,argenx to Participate in Upcoming Virtual Investor Conferences
2020-11-03,Halozyme Therapeutics Deals With Drug Giants Spark Stock To New High
2020-11-03,"Halozyme (HALO) Q3 Earnings Top, 2020 View Up, Stock Rises"
2020-10-22,argenx SE to Host Earnings Call
2020-10-22,Recap: argenx Q3 Earnings
2020-10-22,argenx Reports Third Quarter 2020 Financial Results and Provides Business Update
2020-10-15,"argenx to Report Third Quarter 2020 Financial Results and Business Update on October 22, 2020"
2020-10-06,"The Daily Biotech Pulse: Pfizer, BioNTech Begin European Filing For Coronavirus Vaccine, Y-mAbs BLA Rejected, GlycoMimetics Granted Rare Pediatric Disease Designation"
2020-10-06,argenx Expands Capabilities In Antibody Engineering Through Key Technology Partnerships
2020-10-05,argenx Presents Additional Efgartigimod Data from Global Phase 3 ADAPT Trial at the Myasthenia Gravis Foundation of America 2020 Scientific Session
2020-09-16,argenx SE (ARGX): Hedge Fund Interest Inching Up
2020-09-02,argenx Management to Present at Upcoming Virtual Investor Conferences
2020-08-04,argenx to Present at 2020 Wedbush PacGrow Healthcare Virtual Conference
2020-07-30,argenx reports half year 2020 financial results and provides second quarter business update
2020-07-29,Earnings Preview: argenx
2020-07-20,Did Hedge Funds Make The Right Call On argenx SE (ARGX) ?
2020-07-01,"argenx (ARGX): Strong Industry, Solid Earnings Estimate Revisions"
2020-06-15,Is argenx SE (ARGX) A Good Stock To Buy?
2020-06-01,argenx announces closing of global offering
2020-05-29,argenx announces full exercise of underwriters option to purchase additional ADSs
2020-05-28,argenx raises $750 million in gross proceeds in a global offering
2020-05-27,"Biotech Stock Roundup: REGN's Stake Buyback, INO, NVAX's Coronavirus Updates & More"
2020-05-27,argenx Up on Positive Data from Pivotal Efgartigimod Study
2020-05-27,"The Daily Biotech Pulse: Cumberland's Positive Anti-Bacterial Readout, FDA Nods For Bristol-Myers, Astellas"
2020-05-26,argenx announces launch of proposed global offering
2020-05-26,Here's Why argenx Stock Is Soaring Today
2020-05-26,argenx Announces Positive Topline Results from Phase 3 ADAPT Trial of Efgartigimod in Patients with Generalized Myasthenia Gravis
2020-05-14,argenx SE (ARGX) Q1 2020 Earnings Call Transcript
2020-05-14,argenx reports first quarter 2020 financial results and provides business update
2020-05-12,Halozyme (HALO) Q1 Earnings and Revenues Miss Estimates
2020-05-11,The argenx (EBR:ARGX) Share Price Gained 1374% And Shareholders Are Jubilant
2020-05-08,7 Strong Buy Healthcare Stocks to Buy Now
2020-03-22,argenx SE (ARGX): Hedge Funds In Wait-and-See Mode
2020-02-27,Top Ranked Momentum Stocks to Buy for February 27th
2020-02-27,argenx reports full year 2019 financial results and provides fourth quarter business update
2020-02-26,Why Earnings Season Could Be Great for argenx (ARGX)?
2020-02-09,Our Take On argenx SE's (EBR:ARGX) CEO Salary
2020-01-07,"These 3 Healthcare Stocks Are Set to Soar in 2020, Says Cowen"
2019-12-29,"Week Ahead In Biotech: PDUFA Date Ahead For Astra Zeneca, Merck's Lynparza, Pending Clinical Readouts In Focus"
2019-12-07,Hedge Funds Are Warming Up To argenx SE (ARGX)
2019-11-22,3 Strong Buy Biotech Stocks to Watch After Stifel Healthcare Conference
2019-11-12,argenx announces closing of global offering
2019-11-10,"If You Had Bought argenx (EBR:ARGX) Stock Five Years Ago, You Could Pocket A 1527% Gain Today"
2019-11-08,argenx announces full exercise of underwriters option to purchase additional ADSs
2019-11-06,argenx raises $484 million in gross proceeds in a global offering
2019-10-24,argenx reports third quarter 2019 financial results and provides business update
2019-10-14,Hedge Funds Are Dumping argenx SE (ARGX)
2019-09-25,Read This Before Buying argenx SE (EBR:ARGX) Shares
2019-09-03,argenx to Present at Morgan Stanley 17th Annual Global Healthcare Conference
2019-08-07,Is argenx SE's (EBR:ARGX) CEO Paid Enough Relative To Peers?
2019-08-06,argenx to Present at 2019 Wedbush PacGrow Healthcare Conference
2019-08-01,argenx reports half year 2019 financial results and second quarter business update
2019-07-25,"argenx to report half year 2019 financial results and second quarter business update on August 1, 2019"
2019-07-08,Here's Why Momentum Investors Will Love ARGENX SE-ADR (ARGX)
2019-06-20,Heres What Hedge Funds Think About argenx SE (ARGX)
2019-06-05,How Does argenx SE (EBR:ARGX) Affect Your Portfolio Volatility?
2019-05-22,"The Daily Biotech Pulse: Tocagen Tumbles, OncoSec Offering, Novartis Asthma Combo Drug Study"
2019-05-22,argenx announces pipeline expansion and argenx 2021 vision to build integrated immunology company at 2019 R&D Day
2019-05-02,Eaton Vance Worldwide Health Sciences Fund Buys 5 New Stocks
2019-04-25,Did Hedge Funds Drop The Ball On argenx SE (ARGX) ?
2019-04-13,Want an insiders way to play IPOs? This fund has had outsize success with its strategy
2019-04-03,Has argenx SE (EBR:ARGX) Got Enough Cash?
2019-02-28,argenx SE ADR to Host Earnings Call
2019-02-04,argenx and Halozyme Enter Global Collaboration and License Agreement for ENHANZE® Technology
2019-02-04,argenx and Halozyme enter global collaboration and license agreement for ENHANZE® technology
2019-01-23,Today's Research Reports on Trending Tickers: Editas Medicine and argenx
2019-01-22,Who Has Been Selling argenx SE (EBR:ARGX) Shares?
2018-12-26,6 Valuable Pipeline Drugs With Upcoming Catalysts
2018-12-03,"Dutch firm argenx, J&J affiliate to collaborate on cancer therapy"
2018-12-03,argenx Provides Detailed Data from Phase 2 Clinical Trial of Efgartigimod in Immune Thrombocytopenia and Phase 1/2 Clinical Trial of Cusatuzumab in Acute Myeloid Leukemia
2018-12-03,"argenx enters exclusive global collaboration and license agreement with Cilag GmbH International, an affiliate of Janssen, for cusatuzumab (ARGX-110)"
2018-11-01,argenx announces new cusatuzumab (ARGX-110) AML data in abstracts published in connection with 60th American Society of Hematology Annual Meeting and Exposition
2018-10-25,Is argenx SEs (EBR:ARGX) Liquidity Good Enough?
2018-10-25,argenx reports third quarter 2018 financial results and provides business update
2018-10-09,argenx awarded 2.6 million VLAIO grant to explore new applications of ABDEG technology
2018-09-21,argenx announces closing of U.S. public offering for gross proceeds of approximately $300.6 million
2018-09-18,argenx raises approximately $300.6 million in gross proceeds in a U.S. public offering
2018-09-18,"The Daily Biotech Pulse: Morphosys Expands Collaboration, Osiris Announces Product Launch, Argenx To Offer Shares"
2018-09-17,argenx announces launch of proposed public offering in the United States
2018-09-17,argenx reports positive topline results from Phase 2 proof-of-concept trial of efgartigimod in primary immune thrombocytopenia
2018-09-06,argenx doses first patient in global Phase 3 registration trial of efgartigimod for the treatment of generalized myasthenia gravis
2018-08-29,argenx receives feedback from Japan's PMDA on Phase 3 clinical trial and regulatory pathway for efgartigimod in generalized myasthenia gravis
2018-08-22,Argenx Shares Up After AbbVie Exercises Option To License Immuno-Oncology Drug
2018-08-22,AbbVie doubles down on cancer project with biotech group Argenx
2018-08-22,"argenx announces that AbbVie has exercised its exclusive option to license ARGX-115, a novel immuno-oncology antibody"
2018-08-09,argenx to Present at 2018 Wedbush PacGrow Healthcare Conference
2018-08-02,argenx reports second quarter business update and half-year 2018 financial results
2018-07-26,"argenx to host conference call & webcast to report second quarter business update and half year 2018 financial results on August 2, 2018"
2018-07-24,argenx announces publication of full data from Phase 1 healthy volunteer study of efgartigimod in Journal of Clinical Investigation
2018-07-17,argenx receives milestone payment from strategic collaboration with Shire
2018-06-28,argenx receives second preclinical milestone payment under its development agreement with AbbVie
2018-06-28,argenx receives second preclinical milestone payment under its development agreement with AbbVie
