2021-01-08,3 Megatrends (and 9 Stocks) to Buy for the Blue Wave
2021-01-06,Why Solar Energy Stocks Popped Double Digits Today
2021-01-06,"Georgia Senate Runoff Is Boosting Energy, Especially Oil and Solar"
2021-01-06,Solar Stocks Jump As Senate Race Boosts Prospect Of Green Energy Boom
2021-01-06,Sunrun CFO on the solar innovators stellar 2020 performance
2021-01-03,Why Shares of SolarEdge Technologies Rose 15% in December
2021-01-02,3 Things to Watch in Renewable Energy in 2021
2020-12-30,"JPMorgan, Playa Hotels & Resorts, SolarEdge, Canadian Solar and Clearway Energy highlighted as Zacks Bull and Bear of the Day"
2020-12-30,Is SolarEdge Technologies (NASDAQ:SEDG) A Risky Investment?
2020-12-29,3 Clean Energy Bigwigs That Might Lose Steam in 2021
2020-12-28,Is Solar Edge Stock a Buy?
2020-12-28,Enphase Energy vs. SolarEdge Technologies: Which One Is Overvalued Today?
2020-12-26,Enphase Stock Surged 554% in 2020 -- Is It a Buy for 2021?
2020-12-24,SolarEdge Stock Surged 230% in 2020 -- Is It a Buy for 2021?
2020-12-23,SolarEdge Announces Two New Appointments: Chief Marketing Officer for SolarEdge and Chief Executive Officer for Kokam
2020-12-22,Renewable Energy Stocks Should Thrive on Stimulus Boost
2020-12-21,Is SEDG A Good Stock To Buy According To Hedge Funds?
2020-12-18,Solar Stocks Enter Secular Uptrend
2020-12-15,Why Solar Energy Stocks Jumped Today
2020-12-15,Solaredge Shines
2020-12-12,"AMD, SolarEdge, Twilio Lead Top Stocks That Are Buys Now"
2020-12-11,Dow Jones Leads Market As Stocks Close Near Highs Of The Day; These Stocks Break Out
2020-12-11,Why SolarEdge Stock Popped 12% This Morning
2020-12-11,Price Over Earnings Overview: SolarEdge Technologies
2020-12-06,"Got $5,000? Here Are 5 Energy Stocks to Buy and Hold for the Long Term"
2020-12-05,"Apple, Twilio Lead Stocks Near Buy Points After Finding Bullish Support"
2020-12-05,"SolarEdge Stock Is Falling, While Enphase Shares Are Going Up: Here's What One Investor Is Doing"
2020-11-27,Best Growth Stocks for December 2020
2020-11-13,Why SolarEdge Technology's Stock Could Have Dark Days Ahead
2020-11-13,Is SolarEdge Technologies a Great Growth Stock?
2020-11-12,Solar ETF Shines on Biden's Potential Win and Solid Q3 Earnings
2020-11-11,3 Takeaways from SolarEdge's Earnings Report
2020-11-09,3 Energy Stocks to Buy Right Now
2020-11-09,Why Enphase Energy's Stock Popped 18.8% in October
2020-11-06,"Down 26% From Its 52-Week High, Is SolarEdge Technologies Stock a Buy?"
2020-11-06,Forget First Solar: SolarEdge Is a Better Renewable Energy Stock
2020-11-05,"Why SolarEdge, Canadian Solar, and SunPower Stocks All Jumped at Least 12% on Thursday"
2020-11-04,Solar Stocks Drop As Biden Election Uncertainty Dims Investment Plans
2020-11-04,Alternative-Energy Stocks Slide Amid Uncertain Election Result
2020-11-03,Nasdaq Soars Despite PayPal Pullback; SolarEdge Loses Its Shine
2020-11-03,"Dow Jones Surges 650 Points On U.S. Election Day; Apple, Tesla Rally, But SolarEdge Plunges 24% On Sales Miss"
2020-11-03,Why SolarEdge Technologies Stock Is Trading Lower Today
2020-11-03,Why SolarEdge Technologies Shares Crashed Today
2020-11-03,"SolarEdge (SEDG) Q3 Earnings Top Estimates, Revenues Down Y/Y"
2020-11-03,SolarEdge Shares Dimmer as Sales Trail Expectations
2020-11-03,Dow Jones Futures Signal Election 2020 Stock Market Rally As Trump Vs Biden Race Ends
2020-11-03,SolarEdge Sinks 16% In Pre-Market On Disappointing Sales Outlook
2020-11-03,SolarEdge Technologies Dives as Revenue Outlook Disappoints
2020-11-02,SolarEdge Technologies (SEDG) Q3 Earnings Top Estimates
2020-11-02,"SolarEdge stock falls 15% on Q3 sales miss, weaker Q4 sales guidance"
2020-11-02,SolarEdge Reports Mixed Third Quarter That Falls Short On Revenue
2020-11-02,SolarEdge Technologies: Q3 Earnings Insights
2020-11-02,SolarEdge Announces Third Quarter 2020 Financial Results
2020-11-02,"SolarEdge Technologies, Inc. to Host Earnings Call"
2020-10-30,7 Clean Energy Stocks To Watch Ahead Of The U.S. Election
2020-10-30,SolarEdge Technologies's Earnings: A Preview
2020-10-29,SolarEdge (SEDG) to Report Q3 Earnings: What's in the Cards?
2020-10-29,"NXP Semiconductors, Six Flags Entertainment, First Solar, Canadian Solar and SolarEdge highlighted as Zacks Bull and Bear of the Day"
2020-10-28,SolarEdge Technologies (SEDG) Gains As Market Dips: What You Should Know
2020-10-28,Analyzing SolarEdge Technologies's Unusual Options Activity
2020-10-27,These solar stocks are now a sell at UBS given post-election uncertainty
2020-10-27,Four Solar Stocks Cut by UBS on Potential Election Volatility
2020-10-27,Enphase Energy: Buy the Dip?
2020-10-26,Earnings Preview: SolarEdge Technologies (SEDG) Q3 Earnings Expected to Decline
2020-10-23,Wait for a Post-Election Pullback to Buy Array Technologies Stock
2020-10-22,"Is SolarEdge Technologies, Inc.'s(NASDAQ:SEDG) Recent Stock Performance Tethered To Its Strong Fundamentals?"
2020-10-22,Has SolarEdge Technologies (SEDG) Outpaced Other Oils-Energy Stocks This Year?
2020-10-21,3 Solar Stocks Making Big Oil Obsolete
2020-10-16,"SolarEdge Technologies Shines, But Can It Continue?"
2020-10-16,"SolarEdge to Announce Financial Results for the Third Quarter 2020 on Monday, November 2, 2020"
2020-10-12,Sunrun Acquires Vivint Solar Creating a Valuation of $22B
2020-10-08,4 Stocks Poised to Gain on Expanding European Solar Market
2020-10-06,Is SolarEdge Technologies (SEDG) Stock Outpacing Its Oils-Energy Peers This Year?
2020-10-01,Better Buy: SolarEdge Technologies vs. Enphase Energy
2020-09-29,Should I Avoid Solaredge Technologies Inc (SEDG)?
2020-09-28,First Solar Sees Composite Rating Rises To 97
2020-09-28,5 Big Issues at Stake in This Election  and How to Invest for Each
2020-09-27,3 Cheap Stocks to Buy After the Market Sell-Off
2020-09-23,Top Alternative Energy Stocks for Q4 2020
2020-09-23,Top Alternative Energy Stocks for Q4 2020
2020-09-23,"SolarEdge Technologies, Inc. Announces Pricing of Private Offering of $550 Million of 0.00% Convertible Senior Notes due 2025"
2020-09-22,"SolarEdge Technologies, Inc. Announces Proposed Private Offering of $500 Million of Convertible Senior Notes"
2020-09-21,3 Companies Tesla Should Be Worried About
2020-09-20,3 Companies Tesla Should Be Worried About in 2021
2020-09-15,Top Solar Stocks for Q4 2020
2020-09-14,10 Biggest Solar Companies
2020-09-09,Is SolarEdge Technologies (NASDAQ:SEDG) The Next Multi-Bagger?
2020-09-09,Looking Into SolarEdge Technologies's Return On Capital Employed
2020-09-08,Why Solar Stocks Jumped Double Digits in August
2020-09-05,Is SolarEdge Technologies Stock a Buy?
2020-09-04,Why Solar Power Stocks Are Crashing Again Friday
2020-09-03,Why Solar Power Stocks Are Crashing Thursday
2020-08-21,Green-Energy Shares Rise Along With Joe Bidens Polling
2020-08-17,"Zacks Industry Outlook Highlights: Enphase Energy, SolarEdge and First Solar"
2020-08-11,CSIQ or SEDG: Which Is the Better Value Stock Right Now?
2020-08-10,"Why We're Not Concerned About SolarEdge Technologies, Inc.'s (NASDAQ:SEDG) Share Price"
2020-08-05,Why SolarEdge Technologies' Shares Popped 12.1% on Wednesday
2020-08-05,"Dow Jones Futures Signal Stock Market Rally: Teladoc To Buy Livongo, Square Earnings Are Double Surprise, Novavax Whipsaws On Coronavirus Vaccine News"
2020-08-05,Oppenheimer Lifts SolarEdges PT After Strong 2Q Results
2020-08-04,Why Solar Energy Stocks are Jumping on Tuesday
