2021-01-06,Ocwen Financial Comments on Conclusion of Mediation With the Consumer Financial Protection Bureau
2020-12-22,Ocwen Financial Accelerates Growth Trajectory With Strategic Relationship With Oaktree and New Servicing Contracts
2020-12-15,K2 & Associates Investment Management Inc. Requisitions Shareholder Meeting of GT Gold Corp.
2020-12-10,"Moneta Reports 2,144,200 oz Gold Indicated and 3,335,300 oz Gold Inferred Resources in NI 43-101 Golden Highway Resource Update"
2020-12-08,Stonegate Capital Partners Updates Coverage On Ocwen Financial Corporation (NYSE:OCN)
2020-12-07,Is OCN A Good Stock To Buy Now?
2020-12-03,PHH Mortgage Launches New Customer Mobile App
2020-10-30,Canadian families to benefit from call for proposals to identify innovative early learning and child care practices - Applications accepted until December 3
2020-10-22,"Moneta Files NI 43-101 Technical Report on the Preliminary Economic Assessment Study of the South West Deposit, Golden Highway Project"
2020-10-20,Ocwen Financial Provides Business Update and Preliminary Third Quarter Results
2020-10-15,Ocwen Financial Corporation Comments on Settlement With State of Florida Office of the Attorney General and Office of Financial Regulation
2020-10-15,Moneta Commences Drill Program at Golden Highway
2020-10-15,Ocwen Financial Schedules Conference Call  Preliminary Third Quarter 2020 Results and Business Update
2020-10-08,Reflecting on Ocwen Financial's (NYSE:OCN) Share Price Returns Over The Last Five Years
2020-10-01,Moneta Appoints New CFO and Corporate Secretary
2020-09-15,Ocwen Financial Delivers Strong Originations Results in July and August
2020-09-09,Moneta Announces Positive Results from Preliminary Economic Assessment Study on South West Deposit
2020-09-03,Moneta Confirms Extensions of New South Basin Target with 2.20 m @ 15.76 g/t Gold Including 0.60 m @ 39.60 g/t Gold
2020-08-31,Moneta Announces Resignation of President and Chief Financial Officer
2020-08-24,Stonegate Capital Partners Initiates Coverage On Ocwen (NYSE:OCN)
2020-08-05,What Kind Of Shareholders Hold The Majority In Ocwen Financial Corporation's (NYSE:OCN) Shares?
2020-08-05,"Lehman Brothers Small Balance Commercial Mortgage Pass-Through Certificates, Series 2007-3 -- Moody's downgrades five classes of small balance commercial loan ABS issued by Lehman Brothers"
2020-08-03,Edited Transcript of OCN.N earnings conference call or presentation 17-Jul-20 12:30pm GMT
2020-08-03,Ocwen Financial Announces Reverse Stock Split
2020-07-27,The K2 Principal Fund L.P. Holdings Update for Moneta Porcupine Mines Inc.
2020-07-23,PHH Mortgage Expands Partnership With the NAACP to Help COVID-19 Impacted Homeowners Through Virtual Borrower Outreach Series
2020-07-16,Ocwen Financial Provides Business Update and Preliminary Second Quarter Results
2020-07-13,Ocwen Financial Schedules Conference Call  Preliminary Second Quarter 2020 Results and Business Update
2020-07-05,Hedge Funds Still Like Ocwen Financial Corporation (OCN)
2020-06-04,Edited Transcript of OCN earnings conference call or presentation 8-May-20 12:30pm GMT
2020-05-13,"Moneta Porcupine Mines Inc., Canada's Most Prolific Gold Mining Camp, CEO Clip Video"
2020-05-08,Recap: Ocwen Financial Q1 Earnings
2020-05-08,Ocwen Financial Announces Operating Results for First Quarter 2020
2020-05-05,"Lehman Brothers Small Balance Commercial Mortgage Pass-Through Certificates, Series 2007-2 -- Moody's places two classes of small balance commercial loan ABS issued by Lehman Brothers on review for possible downgrade"
2020-05-01,Ocwen Financial Schedules Conference Call  First Quarter 2020 Results
2020-04-13,Ocwen Financial Responds to Notice of Non-Compliance with NYSE Trading Share Price Continued Listing Standard Rule
2020-04-06,Ocwen Financial provides thousands of forbearance plans due to coronavirus
2020-04-05,"Coronavirus update: 1.22 million diagnosed cases worldwide, 65,884 deaths; glimmer of hope for Spain as death rate slows"
2020-04-03,Mortgage Firms Teeter Near Crisis That Regulators Saw Coming
2020-04-03,Ocwen Financial pulls guidance due to uncertainty created by coronavirus
2020-04-03,OCWEN FINANCIAL PROVIDES COMPANY UPDATE
2020-03-11,Edited Transcript of OCN earnings conference call or presentation 26-Feb-20 1:30pm GMT
2020-03-08,"Trade Alert: The CEO, President & Director Of Ocwen Financial Corporation (NYSE:OCN), Glen Messina, Has Just Spent US$139k Buying Shares"
2020-02-26,Ocwen Financial Announces Strong Results for the Fourth Quarter
2020-02-19,Ocwen Financial Schedules Conference Call  Fourth Quarter 2019 Results
2020-02-06,Ocwen Financial Announces Preliminary Fourth Quarter 2019 Financial and Operating Results
2020-01-27,Ocwen Financial Announces Amendment to Senior Secured Term Loan
2020-01-20,Investors Who Bought Ocwen Financial (NYSE:OCN) Shares Five Years Ago Are Now Down 77%
2020-01-13,Ocwen Financial Corporation -- Moody's assigns a B2 rating to PHH Mortgage Corp.'s senior secured term loan
2019-12-14,Hedge Funds Are Dumping Ocwen Financial Corporation (OCN)
2019-12-06,Ocwen Financial Corporation (NYSE:OCN): When Will It Breakeven?
2019-11-21,Edited Transcript of OCN earnings conference call or presentation 5-Nov-19 1:30pm GMT
2019-11-08,Ocwen Financial reports $43M loss in third quarter
2019-11-05,Hedge Funds Arent Crazy About Ocwen Financial Corporation (OCN) Anymore
2019-11-05,Ocwen Financial Announces Operating Results For Third Quarter 2019
2019-10-28,Ocwen Financial Schedules Conference Call  Third Quarter 2019 Results
2019-10-24,PHH Mortgage Expands Correspondent Lending After Successful Launch
2019-10-11,Read This Before Selling Ocwen Financial Corporation (NYSE:OCN) Shares
2019-10-01,Ocwen Financial Corporation Comments on Court Ruling Related to Motion to Dismiss Florida Complaint
2019-09-20,Altisource S.a.r.l. -- Moody's announces completion of a periodic review of ratings of Altisource S.a.r.l.
2019-09-19,Ocwen Financial Receives Top Award From HomeFree-USA at the Reaching Millions Housing Conference
2019-09-11,CPFB given deadline to amend lawsuit against Ocwen Financial
2019-09-11,Ocwen Financial Corporation -- Moody's affirms Ocwen's ratings; assigns negative outlook
2019-09-05,Ocwen Financial Corporation Comments on Court Ruling Related to Motion to Dismiss CFPB Complaint
2019-08-18,Weekly CFO Buys Highlight
2019-08-13,"Ocwen Financial Corp (OCN) President & CEO Glen A. Messina Bought $198,000 of Shares"
2019-08-13,Edited Transcript of OCN earnings conference call or presentation 6-Aug-19 12:30pm GMT
2019-08-06,Ocwen Financial (OCN) Q2 2019 Earnings Call Transcript
2019-08-06,Ocwen Financial Announces Operating Results for Second Quarter 2019
2019-07-29,Ocwen Financial Schedules Conference Call  Second Quarter 2019 Results
2019-07-19,"Altisource S.a.r.l. -- Moody's affirms Altisource's B3 ratings, revises outlook to stable"
2019-07-11,Imagine Owning Ocwen Financial (NYSE:OCN) And Trying To Stomach The 94% Share Price Drop
2019-06-24,PHH Mortgage Partners With the NAACP and NID to Host Help and Hope for Homeowners Event
2019-06-23,Heres What Hedge Funds Think About Ocwen Financial Corporation (OCN)
2019-06-10,Ocwen Financial Announces Updates on Key Business Initiatives
2019-06-01,Edited Transcript of OCN earnings conference call or presentation 7-May-19 12:30pm GMT
2019-05-08,Ocwen Financial (OCN) Q1 2019 Earnings Call Transcript
2019-05-07,Ocwen: 1Q Earnings Snapshot
2019-05-07,Ocwen Financial Announces Operating Results for First Quarter 2019
2019-05-03,New Residential Mortgage Loan Trust 2016-1 -- Moody's: Servicing transfer to PMC from OLS due to Merger has no negative ratings impact on 192 RMBS
2019-04-30,Ocwen Financial Schedules Conference Call  First Quarter 2019 Results
2019-04-29,How Much Of Ocwen Financial Corporation (NYSE:OCN) Do Insiders Own?
2019-04-16,Ocwen Financial Awarded Top Servicing Performance Ratings From Fannie Mae for 2018
2019-03-29,Ocwen Financial Corporation Comments on Settlement With Massachusetts Office of the Attorney General
2019-03-12,Moody's: PMC appointed subservicer to OLS has no negative ratings impact on 158 RMBS transactions
2019-03-06,"Exclusive: Ocwen closing Fort Washington facility, 125 employees impacted"
2019-03-05,Edited Transcript of OCN earnings conference call or presentation 27-Feb-19 1:30pm GMT
2019-02-27,"Ameriquest Mortgage Securities Inc., Series 2005-R11 -- Moody's: Servicing transfer to PMC from HRI due to Merger has no negative ratings impact on 39 RMBS"
2019-02-27,Ocwen Financial Corporation (OCN) Q4 2018 Earnings Conference Call Transcript
2019-02-27,Ocwen Financial Announces Operating Results for Fourth Quarter and Full Year 2018
2019-02-27,Ocwen Financial Corporation Announces Senior Leadership Appointments
2019-02-26,Ocwen Financial Q4 Earnings Preview
2019-02-25,Ocwen Financial Corporation Announces Appointment of Two New Directors
2019-02-20,Ocwen Financial Corporation Schedules Conference Call - 4th Quarter 2018 Results
2019-02-06,PHH pays $750K to settle federal probe into unlawful foreclosure of active military members
2019-02-01,Specialized Mortgage Product Growth Summit To Deliver New Revenue Opportunities To Originators
2019-01-25,Liberty Home Equity Solutions Named One of the Best Mortgage Companies to Work for by National Mortgage News
2019-01-24,How Does Investing In Ocwen Financial Corporation (NYSE:OCN) Impact The Volatility Of Your Portfolio?
2019-01-16,Planned Folsom condo project going to bankruptcy auction
2018-12-11,"Mobile Mini, Inc. -- Moody's takes rating actions on a number of finance companies upon application of new Finance Company Rating Methodology"
