2021-01-07,"Digi International to Release First Fiscal Quarter 2021 Earnings Results and Host Conference Call on February 3, 2021"
2021-01-06,Dow Jones Pares Earlier Gains As Trump Rioters Storm Capitol; These Stocks Break Out
2021-01-04,5 Little-Known Stocks Under $20 Analysts Recommend Buying
2020-12-24,Will Digi International (DGII) Continue to Surge Higher?
2020-12-16,4 Breakout Stocks for Explosive Returns
2020-12-12,Is DGII A Good Stock To Buy Now?
2020-12-11,"Tech Recovers, but Dow, S&P Remain Under Pressure"
2020-12-11,Digi International to Participate in NDR Investor Calls via Colliers International Securities
2020-12-08,"Hugo's Family Marketplace Chooses Solutions from SmartSense by Digi to Expand, Automate, and Modernize Food-Safety Efforts"
2020-12-01,"Zacks Industry Outlook Highlights: NETGEAR, Lantronix, Extreme Networks and Digi International"
2020-11-30,Grab These 4 Stocks From Promising Computer Networking Industry
2020-11-27,New Strong Buy Stocks for November 27th
2020-11-26,Digi International (DGII) Moves to Strong Buy: Rationale Behind the Upgrade
2020-11-20,Ortho's CE-Marked VITROS® SARS-CoV-2 Antigen Test Detects Asymptomatic COVID-19 Individuals
2020-11-12,Digi International Inc (DGII) Q4 2020 Earnings Call Transcript
2020-11-12,Recap: Digi International Q4 Earnings
2020-11-12,Digi International Reports Fourth Fiscal Quarter and Full Fiscal 2020 Results
2020-11-12,"Digi International, Inc. to Host Earnings Call"
2020-11-11,Preview: Digi International's Earnings
2020-11-10,Digi International Unveils Industrial-Grade Digi IX10 Router
2020-11-10,Digi International Unveils Industrial-Grade Digi IX10 Router
2020-11-06,Digi International Announces Schedule for November Investor Conferences
2020-11-05,Analysts Estimate Digi International (DGII) to Report a Decline in Earnings: What to Look Out for
2020-10-21,Nation's Largest Retail Pharmacies to Leverage SmartSense by Digi for Government-Mandated Continuous Monitoring of Forthcoming COVID-19 Vaccine
2020-10-09,"Digi International to Release Fourth Fiscal Quarter and Year-End 2020 Earnings Results and Host Conference Call on November 12, 2020"
2020-10-07,Digi International and Assured Wireless to Deliver Integrated Wireless Solutions for First Responders
2020-10-05,Digi International and Convergia Announce Strategic Relationship for Enterprise-Class Cellular Connectivity
2020-09-29,Schwan's Home Delivery selects SmartSense by Digi monitoring to protect critical inventory across its delivery fleet and depot locations
2020-09-29,Schwan's Home Delivery selects SmartSense by Digi monitoring to protect critical inventory across its delivery fleet and depot locations
2020-09-28,Moving Average Crossover Alert: Digi International
2020-09-08,Digi International Transforms Digi Remote Manager to Empower IoT Network Success
2020-09-04,Digi International to Participate in Multiple Upcoming Investor Conferences in September
2020-08-19,"Digi International's Shares March Higher, Can It Continue?"
2020-08-14,Canaccord Says These 3 Stocks Will Surge Over 70% From Current Levels
2020-08-13,Surging Earnings Estimates Signal Upside for Digi International (DGII) Stock
2020-08-12,Looking for Digi International's Long Trading Range to End
2020-08-06,Digi International (DGII) Q3 Earnings and Revenues Top Estimates
2020-08-06,Digi International Reports Third Fiscal Quarter 2020 Results
2020-08-05,Earnings Preview: Digi International
2020-07-30,Analysts Estimate Digi International (DGII) to Report a Decline in Earnings: What to Look Out for
2020-07-14,SmartSense by Digi Selects Steve Habermas as Chief Technology Officer
2020-07-09,"Digi International to Release Third Fiscal Quarter 2020 Earnings Results and Host Conference Call on August 6, 2020"
2020-07-05,Hedge Funds Are Dumping Digi International Inc. (DGII)
2020-06-29,"Digi International Introduces Versatile Digi IX20 Router for Industrial, Remote Location Monitoring and for Unattended Retail and Digital Signage Applications"
2020-06-06,52 Super Deals and Discounts for 2020
2020-06-03,Digi XBee Tools Winner of the 8th Edition of Connected World IoT Innovations Awards
2020-05-27,"Opengear Adds NetOps to Out-of-Band Management, With Launch of Operations Manager Appliances"
2020-05-27,"Opengear Adds NetOps to Out-of-Band Management, With Launch of Operations Manager Appliances"
2020-05-21,Edited Transcript of DGII earnings conference call or presentation 7-May-20 9:00pm GMT
2020-05-18,Digi International to Attend the Virtual Craig-Hallum Investor Conference
2020-05-13,SmartSense by Digi Introduces Digital Health Screening Solution to Bolster Employee Safety as Businesses Reopen
2020-05-08,Digi International Inc (DGII) Q2 2020 Earnings Call Transcript
2020-05-07,Digi International (DGII) Meets Q2 Earnings Estimates
2020-05-07,Digi International Reports Second Fiscal Quarter 2020 Results
2020-04-30,Digi International (DGII) Earnings Expected to Grow: Should You Buy?
2020-04-21,"Digi International Introduces New Routers and Software to Address Next-Generation IoT Connectivity and 5G Needs of Retail, Digital Signage, Transportation, Smart Cities and Beyond"
2020-04-21,"Digi International Introduces New Routers and Software to Address Next-Generation IoT Connectivity and 5G Needs of Retail, Digital Signage, Transportation, Smart Cities and Beyond"
2020-04-19,"How Does Digi International's (NASDAQ:DGII) P/E Compare To Its Industry, After Its Big Share Price Gain?"
2020-04-13,Digi XBee Tools Named IoT App Dev/Platform of the Year in the 8th Annual Compass Intelligence Tech Awards
2020-04-12,Those Who Purchased Digi International (NASDAQ:DGII) Shares A Year Ago Have A 20% Loss To Show For It
2020-04-09,Digi International Offers Networking Solutions to Enable Enterprise-level Security in Work-from-Home Environments
2020-04-07,"Digi International to Release Second Fiscal Quarter 2020 Earnings Results and Host Conference Call on May 7, 2020"
2020-03-13,"How Does Digi International's (NASDAQ:DGII) P/E Compare To Its Industry, After The Share Price Drop?"
2020-02-25,Is Digi International Inc. (NASDAQ:DGII) A Volatile Stock?
2020-02-17,Digi International Withdraws from Embedded World
2020-02-11,"Digi International to Showcase Latest IoT Connectivity, Edge Computing Solutions and Customer Applications at Embedded World 2020"
2020-02-03,Edited Transcript of DGII earnings conference call or presentation 30-Jan-20 10:00pm GMT
2020-02-02,Digi International Inc. Just Beat Earnings Expectations: Here's What Analysts Think Will Happen Next
2020-01-30,Digi International (DGII) Surpasses Q1 Earnings and Revenue Estimates
2020-01-30,Digi International Reports Fiscal First Quarter 2020 Results
2020-01-23,Analysts Estimate Digi International (DGII) to Report a Decline in Earnings: What to Look Out for
2020-01-21,"Zacks.com featured highlights include: The Buckle, The TJX Companies, Digi International and Pure Storage"
2020-01-20,Buy These 4 Stocks for Solid Earnings Acceleration
2020-01-17,"Zacks.com featured highlights include: Air Transport, Digi International, America's Car-Mart and Zumiez"
2020-01-16,Explore These 4 Momentum Stocks Using Driehaus Strategy
2020-01-09,Is Digi International Inc. (NASDAQ:DGII) Potentially Undervalued?
2020-01-07,"Digi International to Release First Fiscal Quarter 2020 Earnings Results and Host Conference Call on January 30, 2020"
2020-01-03,"From flying selfie cameras to smart mattresses, 15 Minnesota companies bring their tech to CES"
2019-12-31,"Zacks.com featured highlights include: Boot Barn, Digi International, America???s Car-Mart and Target"
2019-12-30,4 Top-Ranked Momentum Picks Using Driehaus Strategy
2019-12-17,New Highs All Around on Delayed Reaction to Trade Deal
2019-12-16,Digi International Completes Opengear Acquisition
2019-12-14,Is Digi International Inc.'s (NASDAQ:DGII) ROE Of 2.9% Concerning?
2019-12-13,Digi International Inc. (DGII): Are Hedge Funds Right About This Stock?
2019-12-13,"Zacks.com featured highlights include: Aspen, TopBuild, Digi International and Target"
2019-12-12,Explore These 4 Momentum Stocks Using Driehaus Strategy
2019-12-06,Hedge Funds Love Unisys Corporation (UIS) Way More Than These 4 Stocks
2019-12-05,Top Ranked Momentum Stocks to Buy for December 5th
2019-12-04,Digi Expands its SOM Portfolio with the Introduction of Digi ConnectCore 8M Nano
2019-12-04,Digi Expands its SOM Portfolio with the Introduction of Digi ConnectCore 8M Nano
2019-12-04,Edited Transcript of DGII earnings conference call or presentation 14-Nov-19 10:00pm GMT
2019-11-27,"Digi International Inc. (DGII) Shares March Higher, Can It Continue?"
2019-11-18,"HP Rejects Xerox Offer, But Remains Open to Persuasion"
2019-11-18,"Company News For Nov 18, 2019"
2019-11-18,What Makes Digi International (DGII) a New Strong Buy Stock
2019-11-18,Results: Digi International Inc. Beat Earnings Expectations And Analysts Now Have New Forecasts
2019-11-15,Infinera (INFN) Catches Eye: Stock Jumps 6%
2019-11-14,Digi International (DGII) Tops Q4 Earnings and Revenue Estimates
2019-11-14,Digi International Reports Fiscal Fourth Quarter and Full Fiscal Year 2019 Results
2019-11-14,Digi International's Named Finalist for the 2020 Engineers' Choice Awards
