2021-01-04,"Magellan Health, FLIR Systems: 5 Top Stock Gainers for Monday"
2021-01-04,Pandion Therapeutics Announces Positive Top-Line Phase 1a Clinical Data Showing PT101 was Well-Tolerated and Selectively Expanded Regulatory T cells
2020-12-12,Is PAND A Good Stock To Buy Now?
2020-12-03,Pandion Therapeutics Appoints Katina Dorton to its Board of Directors
2020-11-23,"Independent Director Daniel Becker Just Bought 1.1% More Shares In Pandion Therapeutics, Inc. (NASDAQ:PAND)"
2020-11-16,Pandion Therapeutics Reports Third Quarter 2020 Financial Results and Provides Business Update
2020-11-10,Pandion Therapeutics to Present at the Stifel 2020 Virtual Healthcare Conference
2020-10-31,"Kaskela Law LLC Announces Stockholder Investigation of Pandion Therapeutics, Inc. - PAND"
2020-10-28,Pandion Therapeutics Highlights Potential of Modular Biologics Pipeline for the Treatment of Autoimmune Diseases at FOCIS 2020
2020-10-20,"Did Pandion Therapeutics, Inc. (NASDAQ:PAND) Insiders Buy Up More Shares?"
2020-09-24,Pandion Therapeutics to Participate in Panel Discussion at Stifel 2020 Immunology & Inflammation Virtual Summit
2020-09-10,Pandion Therapeutics to Present at Morgan Stanley Global Healthcare Conference
2020-08-31,Pandion Reports Second Quarter 2020 Financial Results and Provides Business Update
2020-08-23,Morgan Stanley Is Getting Bullish About Biotech; Here Are 2 Stocks to Buy
2020-08-16,Goldman Sachs: These 3 Stocks Can Deliver Big Returns for Investors
2020-08-07,"Qiagen, Pandion See Activist Actions"
2020-07-17,Pandion Therapeutics stock shot up 50% at its open
2020-07-17,Pandion Therapeutics' upsized IPO priced at the top of the expected range
2020-07-16,"Pandion Therapeutics upsizes planned IPO, to offer 7 million shares priced at $16 to $18 each"
