2020-12-28,"Is Heartland Express, Inc.'s (NASDAQ:HTLD) Recent Price Movement Underpinned By Its Weak Fundamentals?"
2020-12-17,Is HTLD A Good Stock To Buy Now?
2020-12-04,Understanding Heartland Express's Ex-Dividend Date
2020-11-28,The Returns At Heartland Express (NASDAQ:HTLD) Provide Us With Signs Of What's To Come
2020-11-23,"Heartland Express, Inc. Declares Regular Quarterly Dividend"
2020-11-10,Are Investors Undervaluing Heartland Express (HTLD) Right Now?
2020-11-06,"Heartland Express, Inc. Announces Participation in Upcoming Conferences"
2020-11-05,"Heartland Express, Inc. Receives US EPA 2020 SmartWay Excellence Award"
2020-11-04,Heartland Express Inc. Announces Increase to Driver Pay Package With 5th Driver Pay Increase in Last 6 Years
2020-10-29,"Trade Alert: The Independent Director Of Heartland Express, Inc. (NASDAQ:HTLD), James Pratt, Has Just Spent US$188k Buying 333% More Shares"
2020-10-19,How Much Did Heartland Express' (NASDAQ:HTLD) CEO Pocket Last Year?
2020-10-16,Heartland Express (HTLD) Meets Q3 Earnings Estimates
2020-10-16,"Heartland Express, Inc. Reports Revenues and Earnings for the Third Quarter of 2020"
2020-10-08,How Heartland Express (HTLD) Stock Stands Out in a Strong Industry
2020-10-08,New Strong Buy Stocks For October 8th
2020-09-11,"Heartland Express, Inc. Declares Regular Quarterly Dividend"
2020-09-08,A Look At Heartland Express' (NASDAQ:HTLD) Share Price Returns
2020-07-29,Heartland Express Inc. Earns Carrier of the Year and Platinum Award for On-Time Service From FedEx Express
2020-07-24,"Unpleasant Surprises Could Be In Store For Heartland Express, Inc.'s (NASDAQ:HTLD) Shares"
2020-07-21,Heartland Express Announces Pricing of Secondary Public Offering of Common Stock
2020-07-21,"Heartland Express, Inc. Announces Public Secondary Offering"
2020-07-21,"Heartland Express, Inc. Announces Public Secondary Offering"
2020-07-17,"Marten, Heartland Stock Prices Get Boost After Strong Quarters"
2020-07-17,The Daily Dash: Heartland's Good Quarter; Focusing On Driver Health
2020-07-17,Dow Jones Futures: Netflix Earnings Miss Is Warning For Coronavirus Stock Market Rally
2020-07-16,J.B. Hunt Earnings Top As Trucking Firms Signal Recovery
2020-07-16,Heartland Express Numbers For The Second Quarter Beat Projections
2020-07-16,A Look Into Heartland Express's Price Over Earnings
2020-07-16,Heartland Express (HTLD) Q2 Earnings and Revenues Top Estimates
2020-07-16,Recap: Heartland Express Q2 Earnings
2020-07-16,"Heartland Express, Inc. Reports Revenues and Earnings for the Second Quarter of 2020"
2020-07-15,Why Earnings Season Could Be Great for Heartland Express (HTLD)
2020-07-09,Heartland Express (HTLD) Expected to Beat Earnings Estimates: Should You Buy?
2020-07-05,"Were Hedge Funds Right About Souring On Heartland Express, Inc. (HTLD)?"
2020-06-09,"Heartland Express, Inc. Declares Regular Quarterly Dividend"
2020-05-25,"Heartland Express, Inc. Announces Participation in Upcoming Conferences"
2020-05-01,"Heartland Express, Inc. Announces Teleconference for 2020 Annual Meeting of Stockholders"
2020-04-24,"Heartland Express, Inc. Beat Analyst Estimates: See What The Consensus Is Forecasting For This Year"
2020-04-23,A Trio of High-Quality Stocks for the Value Investor
2020-04-21,Heartland Express (HTLD) Q1 Earnings and Revenues Beat Estimates
2020-04-21,Lower Gains On Sale Weigh On Results At Heartland Express
2020-04-21,"Heartland Express, Inc. Reports Revenues and Earnings for the First Quarter of 2020"
2020-04-18,Were Hedge Funds Right About Heartland Express (HTLD)?
2020-04-17,"Why Heartland Express, Inc.'s (NASDAQ:HTLD) CEO Pay Matters To You"
2020-04-17,Coronavirus has hit the trucking industry like a brick wall
2020-04-09,Earnings Preview: Heartland Express (HTLD) Q1 Earnings Expected to Decline
2020-03-10,"Heartland Express, Inc. Declares Regular Quarterly Dividend"
2020-03-09,"Heartland Express, Inc. Announces a Change to an Upcoming Conference"
2020-03-06,Solving The Trucking Profitability Paradox
2020-03-04,Imagine Owning Heartland Express (NASDAQ:HTLD) And Wondering If The 27% Share Price Slide Is Justified
2020-03-02,"Heartland Express, Inc. Announces Participation in Upcoming Conference"
2020-02-06,"Heartland Express, Inc. Announces Participation in Upcoming Conference"
2020-01-28,"Heartland Express, Inc. Just Missed EPS By 7.7%: Here's What Analysts Think Will Happen Next"
2020-01-23,Heartland Express Earnings Miss Partly Related To Recent Acquisition
2020-01-23,Heartland Express (HTLD) Q4 Earnings and Revenues Lag Estimates
2020-01-23,"Heartland Express, Inc. Reports All-Time Records for Total Assets and Stockholders' Equity in 2019 and Provides Historical Financial Review"
2020-01-10,New Strong Sell Stocks for January 10th
2020-01-08,New Strong Sell Stocks for January 8th
2020-01-01,"A Note On Heartland Express, Inc.'s (NASDAQ:HTLD) ROE and Debt To Equity"
2019-12-10,"Hedge Funds Have Never Been This Bullish On Heartland Express, Inc. (NASDAQ:HTLD)"
2019-12-04,"An Intrinsic Calculation For Heartland Express, Inc. (NASDAQ:HTLD) Suggests It's 26% Undervalued"
2019-11-25,"Heartland Express, Inc. Declares Regular Quarterly Dividend"
2019-11-01,"Heartland Express, Inc. Announces Participation in Upcoming Conferences"
2019-11-01,"Have Insiders Been Selling Heartland Express, Inc. (NASDAQ:HTLD) Shares?"
2019-10-30,"Heartland Express Posts A Clean Quarter Amid ""Softer Freight Demand"""
2019-10-30,"Heartland Express, Inc. Reports Revenues and Earnings for the Third Quarter of 2019"
2019-10-29,Why it is Time to Dump Knight-Swift (KNX) From Your Portfolio
2019-10-26,"Did Hedge Funds Drop The Ball On Heartland Express, Inc. (HTLD) ?"
2019-10-24,Heartland Express (HTLD) Hits Fresh High: Is There Still Room to Run?
2019-10-18,Bear of the Day: ArcBest (ARCB)
2019-10-16,"Knight-Swift (KNX) Stock Dips on Q3, Q4 EPS Guidance Cut"
2019-10-09,Heartland Express (HTLD) Earnings Expected to Grow: Should You Buy?
2019-10-09,"Don't Sell Heartland Express, Inc. (NASDAQ:HTLD) Before You Read This"
2019-10-07,"Heartland Express, Inc. Receives US EPA 2019 SmartWay Excellence Award"
2019-09-24,Top Ranked Momentum Stocks to Buy for September 24th
2019-09-19,Heartland Express Inc. Earns 16th Quest for Quality Award
2019-09-16,"Heartland Express, Inc. Announces Grand Re-Opening of Terminal in Tacoma, Washington"
2019-09-16,"Should You Worry About Heartland Express, Inc.'s (NASDAQ:HTLD) CEO Pay?"
2019-09-16,"Copa Holdings Posts Dismal August Traffic Data, Shares Down"
2019-09-13,New Strong Buy Stocks for September 13th
2019-09-12,Moving Average Crossover Alert: Heartland Express
2019-09-11,Are You Looking for a Top Momentum Pick? Why Heartland Express (HTLD) is a Great Choice
2019-09-11,Heartland Express (HTLD) Hits Fresh High: Is There Still Room to Run?
2019-09-10,"Analysts More Bullish On TLs, Valuation A Key Reason"
2019-09-10,"Heartland Express, Inc. Declares Regular Quarterly Dividend"
2019-08-27,Heartland Express Flexes Its Balance Sheet Again With Millis Acquisition
2019-08-26,"Heartland Express Acquires Millis Transfer, Inc. and Related Companies"
2019-08-21,"Is Heartland Express, Inc. (NASDAQ:HTLD) Creating Value For Shareholders?"
2019-07-22,I Built A List Of Growing Companies And Heartland Express (NASDAQ:HTLD) Made The Cut
2019-07-18,Heartland's Clean Balance Sheet Could Bring Acquisitions Back Into Play
2019-07-18,Heartland Express (HTLD) Q2 Earnings Surpass Estimates
2019-07-18,"Heartland Express, Inc. Reports Revenues and Earnings for the Second Quarter of 2019"
2019-07-17,"Heartland Express, Inc. Earns Carrier of the Year and Platinum Award for On-Time Service From FedEx Express"
2019-07-11,Heartland Express (HTLD) to Report Q2 Results: Wall Street Expects Earnings Growth
2019-07-11,New Strong Sell Stocks for July 11th
2019-06-25,"Here is What Hedge Funds Think About Heartland Express, Inc. (HTLD)"
2019-06-24,"Does Heartland Express, Inc. (NASDAQ:HTLD) Create Value For Shareholders?"
2019-06-12,2 Companies Announce Quarterly Dividends
2019-06-11,"Heartland Express, Inc. Declares Regular Quarterly Dividend"
2019-06-04,"An Intrinsic Calculation For Heartland Express, Inc. (NASDAQ:HTLD) Suggests It's 42% Undervalued"
