2021-01-11,Its Going Be a Tougher Year for Cloud Stocks. But Here Are 10 You Can Buy.
2021-01-11,CrowdStrike announces $750 million bond offering
2021-01-11,CrowdStrike Announces Proposed Public Offering of $750 Million of Senior Unsecured Notes
2021-01-09,3 Top Cybersecurity Stocks to Buy for 2021
2021-01-08,CrowdStrike to Participate in Upcoming Investor Conferences
2021-01-08,6 Stocks Riding Unstoppable Trends That Will Make You Richer in 2021 (and Beyond)
2021-01-07,Why CrowdStrike Stock Just Popped 5%
2021-01-05,'Time to avoid WFH stocks': Jefferies strategist
2021-01-05,"CrowdStrike Holdings' (CRWD) Shares March Higher, Can It Continue?"
2021-01-04,3 Red-Hot Stocks to Buy With Your Second Stimulus Check
2021-01-03,"Why CrowdStrike, FireEye, and Zscaler Surged as Much as 48.7% in December"
2021-01-01,Has CrowdStrike Holdings (CRWD) Outpaced Other Computer and Technology Stocks This Year?
2021-01-01,CrowdStrike (CRWD) Up 31.4% Since Last Earnings Report: Can It Continue?
2021-01-01,"Got $10,000 and 10 Years to Wait? These 3 Stocks Could Make You a Fortune"
2021-01-01,Is Crowdstrike Holdings (CRWD) Stock a Buy For 2021?
2020-12-31,CrowdStrike Holdings (CRWD) Is Up 8.53% in One Week: What You Should Know
2020-12-31,GAN Limited (GAN) Surges: Stock Moves 5.5% Higher
2020-12-31,"The Zacks Analyst Blog Highlights: MACOM Tech, CrowdStrike, Zscaler, CareDx and Medifast"
2020-12-31,"The Zacks Analyst Blog Highlights: Dropbox, CrowdStrike, DocuSign and Microsoft"
2020-12-31,"The Zacks Analyst Blog Highlights: NVIDIA, IPG Photonics, CrowdStrike, Zendesk and Dynatrace"
2020-12-31,3 Top Cloud Computing Stocks to Buy in 2021
2020-12-30,Check Point (CHKP) Aids Cybersecurity for OMNIQ's Customers
2020-12-30,"The Zacks Analyst Blog Highlights: Tesla, L Brands, NVIDIA, CrowdStrike and Zscaler"
2020-12-30,IBD 50 Stocks To Watch: Cybersecurity Leader Fortinet Eyes New Buy Point
2020-12-30,5 Internet Software Stocks Up More Than 200% in 2020
2020-12-30,5 Stocks With Unstoppable Growth to Buy in 2021
2020-12-30,These 4 Work-from-Home Stocks Should Keep Soaring in 2021
2020-12-30,A Silent Revolution by Technology Sector Amid Pandemic: 6 Picks
2020-12-29,"Why Chevron, CrowdStrike are stocks to watch in 2021"
2020-12-29,Tech Tops in 2020: ETFs & Stocks That More Than Doubled
2020-12-29,5 Top Stocks for 2021 That Have Surged More Than 100% YTD
2020-12-24,Wall Street Seeks the Upside in an Historic Hack
2020-12-24,"Zoom, Slack, and DocuSign: COVID-19 put these companies on the map in 2020"
2020-12-24,4 Software Stocks That Could Replicate Zoom's 2020 Rally in 2021
2020-12-24,6 Tech Stocks That Have Crushed Nasdaq in 2020
2020-12-23,3 Soaring Tech Stocks to Buy for More Growth in 2021
2020-12-23,Russia's Unprecedented Attack Boosts Cybersecurity Stocks
2020-12-23,Crowdstrike Stock Is a Great Buy as Cybersecurity Concerns Mount
2020-12-23,3 Revolutionary Stocks to Invest $500 in Right Now
2020-12-22,These 2 Top Companies Are Heating Up the Stock Market Tuesday
2020-12-22,"The Zacks Analyst Blog Highlights: TTD, Zscaler, CrowdStrike, Pinterest and Wayfair"
2020-12-21,Wall Street Scrambles to Find Security Plays Amid Unfolding SolarWinds Hack
2020-12-21,JCOM vs. CRWD: Which Stock Should Value Investors Buy Now?
2020-12-21,5 Nasdaq Stocks That Helped the Index Score Big in 2020
2020-12-21,Fortinet Joins Rank Of Stocks With 95-Plus Composite Rating
2020-12-19,Why Russia's massive cyberattack is especially insidious
2020-12-19,"Got $1,000? Here Are 3 Stocks to Consider Buying Right Now"
2020-12-18,"FireEye, Crowdstrike enjoy record days as SolarWinds hack leads to soaring security stocks"
2020-12-18,"4 Top Stock Trades for Monday: DRI, CRWD, WGO, BB"
2020-12-18,"CrowdStrike, Magnite Soar Despite Nasdaq Drop"
2020-12-18,Why CrowdStrike Stock Rallied to All-Time Highs Today
2020-12-18,"Dow Jones Falls, But Small Caps Rise; McConnell Says Stimulus Deal Is Close"
2020-12-18,3 Stocks (Not Named Zoom) to Zoom Your Portfolio Returns in 2021
2020-12-17,Why CrowdStrike Now Matters More Than Ever
2020-12-16,Software Stocks to Buyand Ones to Avoidfor 2021
2020-12-16,Looking Into CrowdStrike Holdings's Return On Capital Employed
2020-12-16,Cybersecurity Stocks To Watch: Varonis Hacks Into New Breakout
2020-12-15,3 Tech Stocks to Buy for 2021 Not Named Apple or Amazon
2020-12-15,Are You Looking for a Top Momentum Pick? Why CrowdStrike Holdings (CRWD) is a Great Choice
2020-12-15,"The Zacks Analyst Blog Highlights: L Brands, The Trade Desk, IDEXX Laboratories, NVIDIA and CrowdStrike"
2020-12-15,3 Cybersecurity Stocks to Focus On Amid Reports Of Russian Hacking
2020-12-15,3 Recent IPOs to Add to Your Watch List
2020-12-15,Wall Street Braces for 2021 Oddity: Tech Stocks in the Back Seat
2020-12-14,Top Cybersecurity Stocks for Q1 2021
2020-12-14,All You Need to Know About CrowdStrike (CRWD) Rating Upgrade to Buy
2020-12-14,"Stimulus or No Stimulus, These Large Caps Are Must Buys"
2020-12-11,30 stocks of companies expected to increase sales the most in 2021
2020-12-11,CrowdStrike (CRWD) Jumps: Stock Rises 8.3%
2020-12-10,"Why CrowdStrike, Okta, and Cloudflare Stocks Surged Today"
2020-12-10,This Cloud Pioneer Is Ushering in a New Cybersecurity Trend in 2021
2020-12-10,Forget NIO: 3 Hypergrowth Stocks to Buy Instead
2020-12-08,Why CrowdStrike Holdings Soared 23.8% in November
2020-12-08,"Dollar General Saw Improvement, but the Stock Dropped. What's Going On?"
2020-12-08,3 reasons why the Nasdaq Composite is soaring again
2020-12-08,Earnings Estimates Moving Higher for CrowdStrike (CRWD): Time to Buy?
2020-12-08,CrowdStrike Services Cyber Front Lines Report Reveals Widespread Remote Work Has Broad-Reaching Effects on Cybersecurity
2020-12-05,"Dow Jones Futures: Stock Market Rally Outlook Pros And Cons; Apple, Google, PayPal, FedEx, Etsy Are Buys Now"
2020-12-05,"Analysts Are Upgrading CrowdStrike Holdings, Inc. (NASDAQ:CRWD) After Its Latest Results"
2020-12-04,"Stock Market Rally Hits New Highs On Stimulus Deal Hopes; Salesforce, Zoom Video, Snowflake, Zscaler, CrowdStrike Are Big Weekly Movers"
2020-12-04,"Dow Jones, S&P 500, Nasdaq Score Fresh Highs; Small Caps Surge, Snowflake Rips Higher, DocuSign Fades"
2020-12-04,CrowdStrike's George Kurtz on why the company has been successful throughout the pandemic
2020-12-04,CrowdStrike Is Headed to the Round Number of $200
2020-12-04,"Company News for Dec 4, 2020"
2020-12-04,Dow Jones Futures Rise On Stimulus Deal Hopes With Jobs Report In Focus; DocuSign Eyes Buy Points
2020-12-04,Dow Jones Futures: Coronavirus Vaccine Rollout Woes Stall Stock Market Rally; DocuSign Earnings Strong
2020-12-03,"CrowdStrike: A Unique Long-Term Investment, Says 5-Star Analyst"
2020-12-03,"CrowdStrike Stock Pops As Recurring Revenue, Subscriber Momentum Builds"
2020-12-03,The Two Most Important Numbers From CrowdStrike's Blowout Quarter
2020-12-03,"Dow Jones Rises On Stimulus Hopes, Falling Unemployment Claims; These Stocks Trade In Buy Zones"
2020-12-03,Why CrowdStrike Stock Jumped Today
2020-12-03,CrowdStrike Expands Routes to Market for CrowdStrike Services with AWS Marketplace
2020-12-03,CrowdStrike Hits New Highs on Earnings - Where From Here?
2020-12-03,"Dow Jones Jumps Above 30,000 As Stock Market Rises On Stimulus Deal Hopes"
2020-12-03,"Dow Jones Rallies Amid McConnell Stimulus Comments; Tesla Upgraded, While CrowdStrike, Snowflake Surge On Earnings"
2020-12-03,Splunk Results Look Even Worse Against Blowouts From Peers
2020-12-03,JCOM vs. CRWD: Which Stock Is the Better Value Option?
2020-12-03,CrowdStrike Rises as Analysts Boost Share-Price Targets
2020-12-03,"Goldman Sachs, Hexcel Corp, Pfizer, CrowdStrike and Snowflake highlighted as Zacks Bull and Bear of the Day"
2020-12-03,CrowdStrike Surges as Work From Home Boosts Security Demand
2020-12-03,"Dow Industrials, Stocks Open Higher; Tesla Stock Upgraded, Boeing Pops On 737 Max Flight News"
