2021-01-05,Children's Place (PLCE) Digitization Endeavor is Paying Off
2020-12-19,Why Is The Children's Place (PLCE) Up 12% Since Last Earnings Report?
2020-12-16,Children's Place Shows Rising Relative Strength. From Holiday Shopping?
2020-12-16,"Zacks Industry Outlook Highlights: The Children's Place, Zumiez, Stitch Fix and The Gap"
2020-12-15,Is PLCE A Good Stock To Buy Now?
2020-12-15,4 Apparel Players Well Poised to Tap Rising Online Demand
2020-11-23,Black Friday 2020 will be a smaller event as retailers spread promotions across the holiday season
2020-11-20,"Children's Place (PLCE) Up on Q3 Earnings Beat, Sales Drop Y/Y"
2020-11-19,The Children's Place (PLCE) Q3 2020 Earnings Call Transcript
2020-11-19,Why The Children's Place Stock Popped Today
2020-11-19,Childrens Place says fourth-quarter margins will be under pressure due to delivery costs and constraints
2020-11-19,The Children's Place (PLCE) Tops Q3 Earnings and Revenue Estimates
2020-11-19,Recap: Children's Place Q3 Earnings
2020-11-19,The Childrens Place Reports Third Quarter 2020 Results
2020-11-17,Factors to Know Ahead of Children's Place (PLCE) Q3 Earnings
2020-11-16,The Childrens Place to Webcast Review of Third Quarter 2020 Financial Results
2020-11-09,Why Clothing Stocks Popped Today
2020-10-26,"Mattel, PLCE, Gilead, Vertex and Horizon as Zacks Bull and Bear of the Day"
2020-10-26,Bear of the Day: The Children's Place (PLCE)
2020-10-20,Be Wary Of Children's Place (NASDAQ:PLCE) And Its Returns On Capital
2020-10-12,New Strong Sell Stocks for October 12th
2020-10-07,Is The Childrens Place Inc. (PLCE) A Good Stock To Invest In?
2020-10-06,The Children's Place enters $80 million term loan agreement
2020-10-06,The Childrens Place Appoints Tracey R. Griffin  to Its Board of Directors
2020-10-06,The Children's Place Enters Into $80 Million Term Loan Agreement
2020-10-02,New Strong Sell Stocks for October 2nd
2020-09-28,Amazons Pandemic Prime Day Adds to Retailers' Scary October
2020-09-14,"Is The Children's Place, Inc. (NASDAQ:PLCE) Potentially Undervalued?"
2020-08-26,"Childrens Place is in a good place for a comeback, analysts say -- right behind Walmart, Target and Kohls"
2020-08-26,FL vs. PLCE: Which Stock Is the Better Value Option?
2020-08-26,Childrens Place Slides 19% As Back-To-School Headwind To Hit 3Q Sales
2020-08-25,PreMarket Prep Stock Of The Day: Children's Place
2020-08-25,The Children's Place (PLCE) Q2 2020 Earnings Call Transcript
2020-08-25,"Children's Place stock plunges 17% after wider-than-expected losses, back-to-school slowdown"
2020-08-25,"The Children's Place Stock Plummets, With Net Sales Down 25% in 2020"
2020-08-25,"J.M. Smucker, Hormel Foods, Best Buy and Children's Place report quarterly earnings"
2020-08-25,The Children's Place (PLCE) Catches Eye: Stock Jumps 7.1%
2020-08-25,"The Children's Place (PLCE) Reports Q2 Loss, Misses Revenue Estimates"
2020-08-25,Recap: Children's Place Q2 Earnings
2020-08-25,The Childrens Place Reports Second Quarter 2020 Results
2020-08-18,Analysts Estimate The Children's Place (PLCE) to Report a Decline in Earnings: What to Look Out for
2020-08-17,The Childrens Place to Webcast Review of Second Quarter 2020 Financial Results
2020-08-17,"ANGI Homeservices, The Children's Place, Hanesbrands, Crocs and Activision Blizzard highlighted as Zacks Bull and Bear of the Day"
2020-08-17,Factors Likely to Impact Children's Place (PLCE) Q2 Earnings
2020-08-17,Bear Of The Day: Children's Place (PLCE)
2020-08-12,Earnings Preview: The Children's Place (PLCE) Q2 Earnings Expected to Decline
2020-08-05,Did Hedge Funds Make The Right Call On The Childrens Place Inc. (PLCE)?
2020-07-11,The Children's Place (PLCE) Down 28% Since Last Earnings Report: Can It Rebound?
2020-07-05,Edited Transcript of PLCE earnings conference call or presentation 11-Jun-20 12:00pm GMT
2020-06-25,Children's Place Digitization Effort Key to Future Growth
2020-06-23,These Hedge Funds Have No Place For The Childrens Place Inc. (PLCE) In Their Portfolios
2020-06-22,Children's Place & Other Retailers Catch Up With Online Trend
2020-06-19,Why Lululemons Stores Can Help Lift the Stock
2020-06-15,Why Children's Place Can Overcome the COVID-19 Pandemic
2020-06-12,"Children's Place to close 300 stores, reduce mall presence"
2020-06-12,"LivePerson, Children's Place, Limelight Networks, DouYu International and Mitek Systems highlighted as Zacks Bull and Bear of the Day"
2020-06-12,"Children's Place (PLCE) Stock Falls on Q1 Loss, Sales Decline"
2020-06-12,Bear Of The Day: Children's Place (PLCE)
2020-06-11,"Dow plunges 7%, marks worst day since March as Feds grim outlook and rising cases of coronavirus unsettle bulls"
2020-06-11,Coronavirus update: U.S. case tally passes 2 million mark and 21 states are still seeing increases in infections
2020-06-11,Thursday Morning Market Highlights
2020-06-11,Morning Market Stats in 5 Minutes
2020-06-11,"The Children's Place (PLCE) Reports Q1 Loss, Tops Revenue Estimates"
2020-06-11,"Children's Place stock falls after sales miss, plans to shutter 300 stores by next year"
2020-06-11,The Childrens Place Reports First Quarter 2020 Results
2020-06-04,The Childrens Place to Webcast Review of First Quarter 2020 Financial Results
2020-06-04,Earnings Preview: The Children's Place (PLCE) Q1 Earnings Expected to Decline
2020-06-03,5 Popular Retail Stocks
2020-05-18,Coronavirus update: Global case tally reaches 4.8 million; Chinas Xi supports WHO-backed probe of origins of pandemic  once the crisis is over
2020-05-18,"Children's Place issues sales warning, will reopen stores across 10 states on Tuesday"
2020-05-18,The Childrens Place Provides Business Update and Details on Phased Store Reopening Plan
2020-05-14,Likely Coronavirus Impact on Children's Place (PLCE) Q1 Earnings
2020-05-13,Earnings Preview: The Children's Place (PLCE) Q1 Earnings Expected to Decline
2020-04-30,J.Crew prepares to file for bankruptcy: report
2020-04-16,Why Is The Children's Place (PLCE) Up 81.2% Since Last Earnings Report?
2020-04-14,Children's Place (PLCE) Surges: Stock Moves 7% Higher
2020-04-02,Here's How Children's Place (PLCE) is Tackling Coronavirus Scares
2020-04-01,"Coronavirus update: 911,308 cases, 44,497 deaths, Americans urged to brace for two painful weeks"
2020-04-01,"Childrens Place Extends Store Closures, Suspends Dividends to Cope With Virus Pandemic"
2020-03-31,"Children's Place furloughs salespeople, halts dividend"
2020-03-31,THE CHILDRENS PLACE EXTENDS TEMPORARY STORE CLOSURES AND PROVIDES AN UPDATE RELATED TO THE COVID-19 PANDEMIC
2020-03-20,Tricia Griffith
2020-03-18,Children's Place (PLCE) Tumbles 29% Despite Q4 Earnings Beat
2020-03-17,How Children's Place (PLCE) is Placed Ahead of Q4 Earnings
2020-03-17,The Children's Place (PLCE) Q4 Earnings and Revenues Surpass Estimates
2020-03-17,"Benzinga Pro's Top 5 Stocks To Watch For Tues., Mar. 17, 2020: VOO, BNTX, PLCE, MDT, NIO"
2020-03-17,"DUE TO THE ONGOING UNCERTAINTY REGARDING THE COVID-19 PANDEMIC, THE CHILDRENS PLACE HAS DEFERRED FISCAL 2020 GUIDANCE AND IS CANCELLING ITS CONFERENCE CALL AND WEBCAST REVIEW"
2020-03-17,THE CHILDRENS PLACE REPORTS FOURTH QUARTER AND FULL YEAR 2019 RESULTS
2020-03-12,The Children's Place (PLCE) Earnings Expected to Grow: What to Know Ahead of Next Week's Release
2020-03-10,"How Does Children's Place's (NASDAQ:PLCE) P/E Compare To Its Industry, After The Share Price Drop?"
2020-03-03,The Childrens Place to Webcast Review of Fourth Quarter and Full Year 2019 Financial Results
2020-03-01,A Trio of High-Yield Payers for Dividend Investors
2020-02-24,The Children's Place (PLCE) Earnings Expected to Grow: What to Know Ahead of Q4 Release
2020-02-21,Will The Children's Place (PLCE) Beat Estimates Again in Its Next Earnings Report?
2020-02-07,"What Did The Children's Place, Inc.'s (NASDAQ:PLCE) CEO Take Home Last Year?"
2020-01-29,Gymboree to Relaunch in February 2020
2020-01-15,"Would The Children's Place, Inc. (NASDAQ:PLCE) Be Valuable To Income Investors?"
2020-01-14,Bear Of The Day: Bed Bath & Beyond (BBBY)
2020-01-10,The Children's Place (PLCE) Up 10.8% Since Last Earnings Report: Can It Continue?
2020-01-07,"Stifel hires three from BB&T, extends consumer franchise"
