2021-01-08,Entravision Marks Fifth Season as the NFLs Exclusive Nationwide Spanish Radio Broadcaster
2021-01-04,Entravision Announces Participation in Citis 2021 Global TMT West Virtual Conference
2020-12-29,How Much Of Entravision Communications Corporation (NYSE:EVC) Do Insiders Own?
2020-12-12,Is EVC A Good Stock To Buy Now?
2020-12-07,Entravision Announces Participation in the Singular Research Best of the Uncovered Webinar
2020-12-04,"The Zacks Analyst Blog Highlights: ArcBest Corp, Entravision Communications Corp, Tesla, Wayfair and Party City Holdco"
2020-12-04,Entravision Raises Over $2.2 Million for Childrens Miracle Network Hospitals
2020-12-03,Stocks to Track in December as Markets Peak
2020-11-23,"Entravision Launches New Audio Streaming Hub, El Botón"
2020-11-10,"Entravisions Shoboy Show Now Syndicated in Salt Lake City, Utah"
2020-11-09,"Entravision Announces the Appointment of Juan Saldívar as Chief Digital, Strategy and Accountability Officer"
2020-11-05,Entravision Communications (EVC) Q3 Earnings and Revenues Beat Estimates
2020-11-05,Entravision Communications Corporation Reports Third Quarter 2020 Results
2020-11-05,Entravision Communications Corp. to Host Earnings Call
2020-10-29,Entravision Communications (EVC) Reports Next Week: Wall Street Expects Earnings Growth
2020-10-22,Entravision Communications Corporation Schedules Third Quarter 2020 Earnings Release and Conference Call
2020-10-19,"Entravisions Shoboy Show Now Syndicated in Albuquerque, New Mexico"
2020-10-17,Entravision Communications Corporation -- Moody's announces completion of a periodic review of ratings of Entravision Communications Corporation
2020-10-15,"Entravision Communications Corporation Acquires a Majority Stake in Cisneros Interactive, a Leading Digital Advertising Company Serving U.S. and Latin American Markets"
2020-10-15,How Much Did Entravision Communications' (NYSE:EVC) CEO Pocket Last Year?
2020-09-28,4 Broadcast Radio & TV Stocks to Tap in a Prospering Industry
2020-09-21,Are Investors Undervaluing Entravision Communications (EVC) Right Now?
2020-09-15,Entravision Launches Juntas Votamos Civic Engagement Campaign
2020-09-09,We Wouldn't Be Too Quick To Buy Entravision Communications Corporation (NYSE:EVC) Before It Goes Ex-Dividend
2020-09-08,Is the Options Market Predicting a Spike in Entravision (EVC) Stock?
2020-09-03,If You Had Bought Entravision Communications' (NYSE:EVC) Shares Five Years Ago You Would Be Down 79%
2020-09-02,Entravision Communications Corporation Announces Participation In Noble Capital Markets C-Suite Interview Series
2020-08-25,"Entravision Partners with Edgar ""Shoboy"" Sotelo to Launch the ""Shoboy Show"""
2020-08-13,Entravision Washington D.C. News Team Wins 23 Regional Emmy® Awards in 9 Categories
2020-08-04,Entravision Communications Corporation Reports Second Quarter 2020 Results
2020-07-29,Entravision Colorado News Team Wins 31 Emmy Awards in 10 Categories
2020-07-29,Entravision Communications Corporation Schedules Second Quarter 2020 Earnings Release And Teleconference
2020-07-20,Estimating The Fair Value Of Entravision Communications Corporation (NYSE:EVC)
2020-07-14,Entravision Appoints Stephen Chung as Chief Revenue Officer for Its International Digital Business
2020-07-08,Is Entravision Communications Corporation (EVC) A Good Stock To Buy?
2020-06-15,Entravision Colorado News Team Nominated for 14 Emmy Awards
2020-06-08,Edited Transcript of EVC earnings conference call or presentation 7-May-20 9:00pm GMT
2020-06-03,Entravision Appoints Chris Munoz to Executive Vice President of National Sales
2020-05-21,Entravision Named Winner of the Colorado Top Workplaces 2020 Award by The Denver Post
2020-05-07,Entravision Communications Corporation Reports First Quarter 2020 Results
2020-05-05,Entravision Announces Launch of Entravision Digital
2020-05-04,Entravision Communications Corporation Schedules First Quarter 2020 Earnings Release And Teleconference
2020-04-28,Downgrade: What You Need To Know About The Latest Entravision Communications Corporation (NYSE:EVC) Forecasts
2020-04-13,"Entravision Announces New Radio Format Changes in the Harlingen, Brownsville and McAllen, TX Markets"
2020-03-15,"Trade Alert: The Independent Director Of Entravision Communications Corporation (NYSE:EVC), Gilbert Vasquez, Has Just Spent US$122k Buying Shares"
2020-03-13,Edited Transcript of EVC earnings conference call or presentation 5-Mar-20 10:00pm GMT
2020-03-09,"Entravision Announces New Sales Leadership in Harlingen - Brownsville - McAllen, TX"
2020-03-08,Earnings Release: Here's Why Analysts Cut Their Entravision Communications Corporation Price Target To US$4.50
2020-03-06,"Entravision Communications Corporation To Present At The Deutsche Bank 28th Annual Media, Internet & Telecom Conference"
2020-03-05,Entravision Communications Corporation Reports Fourth Quarter And Full Year 2019 Results
2020-03-05,Entravision Communications Corp. to Host Earnings Call
2020-03-04,Entravision Communications Corporation Schedules Fourth Quarter And Full Year 2019 Earnings Release And Teleconference
2020-02-12,Imagine Owning Entravision Communications (NYSE:EVC) And Trying To Stomach The 71% Share Price Drop
2020-02-10,"Entravision Extends Partnerships with ""El Show de Erazno y La Chokolata"" and ""El Show de Piolín"""
2020-01-07,Are Insiders Buying Entravision Communications Corporation (NYSE:EVC) Stock?
2020-01-06,Entravision Communications Corporation Appoints Laura Saldivar to Senior Vice President of Integrated Marketing Solutions Los Angeles
2020-01-06,Entravision Communications Corporation Announces Promotion of Crystal Gomez to Vice President Local Agency and National Sales for Los Angeles
2019-12-19,Entravision Communications Corporation Announces Partial Debt Repayment
2019-12-14,Hedge Funds Are Dumping Entravision Communication Corporation (EVC)
2019-12-08,Here's Why We're Wary Of Buying Entravision Communications Corporation's (NYSE:EVC) For Its Upcoming Dividend
2019-11-25,Edited Transcript of EVC earnings conference call or presentation 7-Nov-19 10:00pm GMT
2019-11-12,Entravision Communications Corporation Names Jose Mateo III and Erika M. Marrero as Vice Presidents of Audio Network Sales
2019-11-11,Could The Entravision Communications Corporation (NYSE:EVC) Ownership Structure Tell Us Something Useful?
2019-11-07,Were Hedge Funds Right About Snapping Up Entravision Communication Corp (EVC)?
2019-11-07,Entravision Communications Corporation Reports Third Quarter 2019 Results
2019-11-05,Entravision Announces Expansion of 2019-2020 NFL Season Coverage to Five Additional Top Ten U.S. Hispanic Markets
2019-10-31,Entravision Communications Corporation Schedules Third Quarter 2019 Earnings Release And Teleconference
2019-10-30,Entravision Communications (EVC) to Report Q3 Results: Wall Street Expects Earnings Growth
2019-10-21,Entravision Communications Corporation -- Moody's announces completion of a periodic review of ratings of Entravision Communications Corporation
2019-10-18,Is Entravision Communications (EVC) a Great Value Stock Right Now?
2019-10-08,"Entravision Partners with The James Irvine Foundation to Launch a New Educational Initiative to Promote Census 2020 Participation in Monterey, CA"
2019-10-07,Entravision to Encourage Latino Participation in Elections Through Vota Conmigo 2020 Campaign
2019-09-25,Entravision Communications Corporation To Present At Deutsche Bank 27th Annual Leveraged Finance Conference
2019-09-17,Entravision to Host Hazte Ciudadano Phone Bank Across its Television News Stations in 17 Markets
2019-09-16,Entravision Communications Corporation Appoints Robert McCauley as Senior Vice President of Integrated Marketing Solutions in the Palm Springs Market
2019-09-16,"Entravision Communications Corporation Appoints Erin Voden as Senior Vice President of Integrated Marketing in Washington, D.C."
2019-09-05,Edited Transcript of EVC earnings conference call or presentation 6-Aug-19 9:00pm GMT
2019-08-29,Entravision Communications Corporation Launches Integrated TV and Facebook Live Morning Show in Orlando - Despierta Orlando
2019-08-29,Entravision Delivers Exclusive and Most Extensive National Spanish Language Radio Broadcast Coverage of the 2019 NFL Centennial Season
2019-08-20,"Entravision's El Paso Strong Telethon Raises over $200,000"
2019-08-08,Entravision Communications Corporation (EVC) Q2 2019 Earnings Call Transcript
2019-08-06,Entravision Communications Corporation Reports Second Quarter 2019 Results
2019-08-06,Entravision Communications Corp. to Host Earnings Call
2019-08-06,Entravision Announces Local Sales Organization Changes to Strengthen Alignment with its Platform of Omnichannel Marketing Solutions and Enhance its Service to Advertisers
2019-08-01,Entravision Communications Corporation Schedules Second Quarter 2019 Earnings Release And Teleconference
2019-07-31,Entravision to Host 12th Annual Radiothon to Raise Funds for Children's Miracle Network Hospitals
2019-07-30,Entravision Communications Corporation's Colorado News Team Wins 24 Emmy Awards
2019-07-29,"Entravision Communications Corporation Launches Fuego Hot Hits 103.5 FM Radio Station in Sacramento and Modesto, CA"
2019-07-03,5 Top-Ranked Media Stocks to Enrich Your Portfolio in 2H19
2019-07-01,Is Entravision Communications (EVC) Stock Undervalued Right Now?
2019-06-28,Heres What Hedge Funds Think About Entravision Communications Corporation (EVC)
2019-06-18,Headway Elevates Luis Barrague to Chief Executive Officer
2019-06-11,Should Value Investors Buy Entravision Communications (EVC) Stock?
2019-06-05,Edited Transcript of EVC earnings conference call or presentation 16-May-19 9:00pm GMT
2019-06-04,"The Zacks Analyst Blog Highlights: Flexible Solutions International, Qiwi, Cumberland Pharmaceuticals, CECO Environmental and Entravision Communications"
2019-06-03,5 Stocks That Survived May's Market Mayhem
2019-05-30,Top Ranked Momentum Stocks to Buy for May 30th
2019-05-22,Should Value Investors Buy Entravision Communications (EVC) Stock?
2019-05-19,Edited Transcript of EVC earnings conference call or presentation 7-May-19 9:00pm GMT
2019-05-17,Esteban Lopez Blanco Steps Down as Chief Strategy Officer at Entravision Communications Corporation
