2021-01-04,"Calculating The Fair Value Of Transcat, Inc. (NASDAQ:TRNS)"
2020-12-16,"Transcat, Inc. Expands Life Science Market Penetration with BioTek Services, Inc. Acquisition"
2020-12-08,"What You Need To Know About Transcat, Inc.'s (NASDAQ:TRNS) Investor Composition"
2020-12-07,Is TRNS A Good Stock To Buy Now?
2020-12-02,A $1B Stock Fund Sees Big Returns by Investing in the Smallest Companies
2020-11-17,"Transcat, Inc. Increases Shelf Registration to $75 million"
2020-11-12,"Do Its Financials Have Any Role To Play In Driving Transcat, Inc.'s (NASDAQ:TRNS) Stock Up Recently?"
2020-11-11,Sensata (ST) Pledges Support for EV Charging Standardization
2020-11-10,Transcat Appoints Mark A. Doheny as Chief Financial Officer
2020-11-05,Watts Water's (WTS) Q3 Earnings Beat on Cost Reductions
2020-11-04,Badger Meter Boosts Smart Water Solutions With s::can Buyout
2020-10-28,Transcat Inc (TRNS) Q2 2021 Earnings Call Transcript
2020-10-28,"Transcat, Inc. to Host Earnings Call"
2020-10-27,Transcat Reports Record Second Quarter Operating Income of $3.1 Million on Strong Service Gross Margin
2020-10-14,Transcat Announces Second Quarter Fiscal Year 2021 Conference Call and Webcast
2020-10-13,How Is Transcat's (NASDAQ:TRNS) CEO Paid Relative To Peers?
2020-09-23,Sidoti -- Virtual Investor Conference
2020-09-15,"Transcat, Inc. to Present at Sidoti Fall 2020 Virtual Conference"
2020-09-15,Our Take On The Returns On Capital At Transcat (NASDAQ:TRNS)
2020-09-10,"Gary J. Haseley Appointed Chairman of the Board at Transcat, Inc."
2020-08-19,Edited Transcript of TRNS earnings conference call or presentation 22-Jul-20 3:00pm GMT
2020-07-31,Registration for Sidoti's 2020 Fall Virtual Investor Conference is Open Now
2020-07-29,Transcat Announces Management Changes
2020-07-27,"Some Confidence Is Lacking In Transcat, Inc.'s (NASDAQ:TRNS) P/E"
2020-07-22,Transcat Inc (TRNS) Q1 2021 Earnings Call Transcript
2020-07-21,Transcat: Q1 Earnings Insights
2020-07-21,Transcat Reports Operating Income of $1.0 Million from Service Segment Revenue and Margin Growth for Fiscal 2021 First Quarter
2020-07-08,Transcat Announces First Quarter Fiscal Year 2021 Conference Call and Webcast
2020-06-28,Edited Transcript of TRNS earnings conference call or presentation 20-May-20 3:00pm GMT
2020-06-14,"Is Transcat, Inc. (TRNS) Going to Burn These Hedge Funds?"
2020-05-29,New Strong Sell Stocks for May 29th
2020-05-25,"Earnings Beat: Transcat, Inc. Just Beat Analyst Forecasts, And Analysts Have Been Updating Their Models"
2020-05-20,Transcat Inc (TRNS) Q4 2020 Earnings Call Transcript
2020-05-20,"Transcat, Inc. to Host Earnings Call"
2020-05-19,Transcat Reports Fourth Quarter and Full Year 2020 Results
2020-05-14,"Will Weakness in Transcat, Inc.'s (NASDAQ:TRNS) Stock Prove Temporary Given Strong Fundamentals?"
2020-05-06,Transcat Announces Fourth Quarter and Full Fiscal Year 2020 Conference Call and Webcast
2020-03-30,"Transcat, Inc. Provides Business Update Due to COVID-19"
2020-03-19,"A Sliding Share Price Has Us Looking At Transcat, Inc.'s (NASDAQ:TRNS) P/E Ratio"
2020-03-17,Here's Why We Think Transcat (NASDAQ:TRNS) Is Well Worth Watching
2020-03-11,The MFA Companies Advises TTE Laboratories in Sale to Transcat
2020-02-27,"Is Transcat, Inc.'s (NASDAQ:TRNS) CEO Being Overpaid?"
2020-02-26,"Transcat, Inc. to Present at the 2020 LD Micro Virtual Conference"
2020-02-24,"Transcat Expands Service and Distribution Business with Acquisition of TTE Laboratories, Inc."
2020-02-10,Edited Transcript of TRNS earnings conference call or presentation 5-Feb-20 4:00pm GMT
2020-02-07,"Earnings Miss: Transcat, Inc. Missed EPS By 20% And Analysts Are Revising Their Forecasts"
2020-02-06,"Here's What Transcat, Inc.'s (NASDAQ:TRNS) ROCE Can Tell Us"
2020-02-04,Transcat Reports Record Third Quarter Revenue in Fiscal 2020
2020-01-22,Transcat Announces Third Quarter Fiscal Year 2020 Conference Call and Webcast
2020-01-17,"Should You Be Concerned About Transcat, Inc.'s (NASDAQ:TRNS) Historical Volatility?"
2019-12-20,"Despite Its High P/E Ratio, Is Transcat, Inc. (NASDAQ:TRNS) Still Undervalued?"
2019-12-16,"Transcat, Inc. (TRNS): Hedge Funds In Wait-and-See Mode"
2019-12-06,Renewed Trade Talks Boost Tech Stocks: 5 Solid Buys
2019-11-28,"Did Transcat, Inc.'s (NASDAQ:TRNS) Recent Earnings Growth Beat The Trend?"
2019-11-19,"Woodward (WWD) Q4 Earnings Miss Estimates, Revenues Up Y/Y"
2019-11-07,Top Ranked Momentum Stocks to Buy for November 7th
2019-10-28,Transcat Strengthens Board of Directors with Appointment of Oksana S. Dominach
2019-10-27,Edited Transcript of TRNS earnings conference call or presentation 23-Oct-19 3:00pm GMT
2019-10-22,Transcat Reports Consolidated Operating Income Growth of 40% and Service Segment Revenue Growth of 18% for Fiscal 2020 Second Quarter
2019-10-18,"Did Transcat, Inc. (NASDAQ:TRNS) Use Debt To Deliver Its ROE Of 12%?"
2019-10-09,Transcat Announces Second Quarter Fiscal Year 2020 Conference Call and Webcast
2019-10-03,"Is There Now An Opportunity In Transcat, Inc. (NASDAQ:TRNS)?"
2019-09-17,"Did Transcat, Inc. (NASDAQ:TRNS) Insiders Sell Shares?"
2019-09-12,"Transcat, Inc. to Present at Sidoti & Company Fall 2019 Conference"
2019-09-02,Do Transcat's (NASDAQ:TRNS) Earnings Warrant Your Attention?
2019-08-13,"Transcat, Inc. (NASDAQ:TRNS) Earns Among The Best Returns In Its Industry"
2019-08-06,"Transcat Strengthens Team with Addition of Vice President, Service Operations"
2019-07-26,Edited Transcript of TRNS earnings conference call or presentation 24-Jul-19 3:00pm GMT
2019-07-23,Transcat Reports Nearly 16% Revenue Growth for Fiscal 2020 First Quarter
2019-07-23,"How Much Did Transcat, Inc.'s (NASDAQ:TRNS) CEO Pocket Last Year?"
2019-07-22,"Transcat, Inc. Accelerates Operational Excellence Initiatives with Acquisition of Calibration Software Company"
2019-07-19,"The Zacks Analyst Blog Highlights: Fly Leasing, Hibbett Sports, Oasis Midstream, Quanex Building Products and Transcat"
2019-07-19,Badger Meter (BMI) Q2 Earnings &amp; Revenues Lag Estimates
2019-07-18,5 Top Small-Cap Stocks Beating the Russell 2000 in 2019
2019-07-10,Transcat Announces First Quarter Fiscal Year 2020 Conference Call and Webcast
2019-07-03,"Despite Its High P/E Ratio, Is Transcat, Inc. (NASDAQ:TRNS) Still Undervalued?"
2019-07-01,"Transcat, Inc. Added to the Russell 2000® and 3000® Indexes"
2019-06-29,"Hedge Funds Have Never Been This Bullish On Transcat, Inc. (TRNS)"
2019-06-28,New Strong Buy Stocks for June 28th
2019-06-26,Edited Transcript of TRNS earnings conference call or presentation 22-May-19 3:00pm GMT
2019-06-13,New Strong Buy Stocks for Jun 13th
2019-06-07,"Transcat Inc (TRNS) Files 10-K for the Fiscal Year Ended on March 31, 2019"
2019-06-06,"Was Transcat, Inc.'s (NASDAQ:TRNS) Earnings Growth Better Than The Industry's?"
2019-05-31,New Strong Buy Stocks for May 31st
2019-05-29,"Transcat, Inc. to Present at Stifel 2019 Cross Sector Insight Conference"
2019-05-24,Looking for a Growth Stock? 3 Reasons Why Transcat (TRNS) is a Solid Choice
2019-05-22,"Transcat, Inc. to Host Earnings Call"
2019-05-21,Transcat Reports Operating Income Up 13% on Record Revenue for Fiscal 2019
2019-05-21,If You Had Bought Transcat (NASDAQ:TRNS) Shares Five Years Ago You'd Have Made 166%
2019-05-14,Analysts Estimate Transcat (TRNS) to Report a Decline in Earnings: What to Look Out for
2019-05-08,Transcat Announces Fourth Quarter and Full Fiscal Year 2019 Conference Call and Webcast
2019-05-06,"Do Insiders Own Shares In Transcat, Inc. (NASDAQ:TRNS)?"
2019-04-18,"A Look At The Fair Value Of Transcat, Inc. (NASDAQ:TRNS)"
2019-04-01,Transcat Expands Its Southern California Presence with Acquisition of Gauge Repair Service
2019-04-01,"What Transcat, Inc.'s (NASDAQ:TRNS) ROE Can Tell Us"
2019-03-12,"Have Insiders Been Selling Transcat, Inc. (NASDAQ:TRNS) Shares This Year?"
2019-02-23,"What Does Transcat, Inc.s (NASDAQ:TRNS) Share Price Indicate?"
2019-02-07,Edited Transcript of TRNS earnings conference call or presentation 5-Feb-19 4:00pm GMT
2019-02-05,"Is Transcat, Inc. (NASDAQ:TRNS) A Volatile Stock?"
2019-02-04,Transcat Reports Record Third Quarter Revenue in Fiscal 2019
