2021-01-06,Leap Therapeutics to Present at H.C. Wainwright BioConnect 2021 Conference
2021-01-04,Leap Therapeutics to Present at 39th Annual J.P. Morgan Healthcare Conference
2020-12-22,Leap Therapeutics Announces Publication of DKN-01 Mechanism of Action Data in Molecular Cancer Research
2020-12-11,Is LPTX A Good Stock To Buy Now?
2020-11-23,Leap Therapeutics to Participate at Piper Sandler 32nd Annual Virtual Healthcare Conference
2020-11-17,"Brokers Are Upgrading Their Views On Leap Therapeutics, Inc. (NASDAQ:LPTX) With These New Forecasts"
2020-11-12,Leap Therapeutics Reports Third Quarter 2020 Financial Results
2020-11-10,Leap Therapeutics to Present at Stifel 2020 Healthcare Conference
2020-11-09,Leap Therapeutics Presents DKN-01 Monotherapy Data at AACR Virtual Special Endometrial Cancer Conference
2020-11-09,Leap Therapeutics Presents Updated Data for DKN-01 in Esophagogastric Cancer Patients at SITC 2020 35th Annual Meeting
2020-10-15,Leap Therapeutics to Present Esophagogastric Cancer Data at SITC 2020 Annual Meeting
2020-09-24,Leap Therapeutics Announces FDA Fast Track Designation Granted to DKN-01 for the Treatment of Gastric and Gastroesophageal Junction Cancer
2020-09-21,Leap Therapeutics and BeiGene Announce First Patient Dosed in Study of DKN-01 in Combination with Tislelizumab for the Treatment of Metastatic Gastric or Gastroesophageal Junction Cancer
2020-09-09,Leap Therapeutics to Present at H.C. Wainwright 22nd Annual Global Investment Conference
2020-08-24,Leap Therapeutics Expands Leadership Team with Addition of Two Industry Veterans
2020-08-20,We're Hopeful That Leap Therapeutics (NASDAQ:LPTX) Will Use Its Cash Wisely
2020-08-13,Leap Therapeutics Reports Second Quarter 2020 Financial Results
2020-07-20,3 Strong Buy Healthcare Stocks Under $5 That Could Double (Or More)
2020-06-29,"Benzinga's Top Upgrades, Downgrades For June 29, 2020"
2020-06-25,Leap Therapeutics Announces Full Exercise of Underwriters' Option to Purchase Additional Shares
2020-06-22,Leap Therapeutics Announces Closing of Public Offering of Common Stock and Pre-Funded Warrants
2020-06-18,Leap Therapeutics Announces Pricing of $45 Million of Common Stock and Pre-Funded Warrants
2020-06-17,Leap Therapeutics Announces Proposed Public Offering of Common Stock and Pre-Funded Warrants
2020-06-15,"Company News for Jun 15, 2020"
2020-06-15,Leap Therapeutics (LPTX) Soars: Stock Adds 8.3% in Session
2020-06-12,"Hedge Funds Have Never Been This Bullish On LEAP THERAPEUTICS, INC. (LPTX)"
2020-06-11,Leap Therapeutics Announces Oprhan Drug Designation of DKN-01 for the Treatment of Gastric and Gastroesophageal Junction Cancer
2020-06-11,Leap Therapeutics Announces Changes to Virtual Format and Time for 2020 Annual Meeting of Stockholders
2020-05-16,"Analyst Estimates: Here's What Brokers Think Of Leap Therapeutics, Inc. (NASDAQ:LPTX) After Its First-Quarter Report"
2020-05-14,Leap Therapeutics Reports First Quarter 2020 Financial Results
2020-04-23,Leap Therapeutics to Present Updated Data for DKN-01 Monotherapy and Paclitaxel Combination In Gynecologic Cancers
2020-04-07,"One Thing To Remember About The Leap Therapeutics, Inc. (NASDAQ:LPTX) Share Price"
2020-03-18,Leap Therapeutics Announces Executive Leadership Changes
2020-03-16,Leap Therapeutics Reports Fourth Quarter and Full Year 2019 Financial Results
2020-01-23,Leap Therapeutics Presents Updated Data at the ASCO 2020 Gastrointestinal Cancers Symposium (ASCO GI) Global Meeting
2020-01-07,Leap Therapeutics Announces Closing of Previously Announced Equity Financing
2020-01-06,Leap Therapeutics Surges on License Agreement With BieGene
2020-01-03,Cash-strapped biotech signs deal with Chinese drugmaker BeiGene
2020-01-03,Leap Therapeutics and BeiGene Announce Exclusive Option and License Agreement for DKN-01 and Leap Announces $27 Million Equity Financing
2019-11-15,"The Daily Biotech Pulse: Amarin Gets Unanimous Backing For Vascepa Expansion, BeiGene's Blood Cancer Drug Gets Approval"
2019-11-14,Leap Therapeutics Reports Third Quarter 2019 Financial Results
2019-09-27,"Zacks.com featured highlights include: Columbia Sportswear, American Woodmark, DICK'S Sporting, Alder and Leap"
2019-09-26,Use Rising P/E Strategy to Grab 5 Winning Stocks
2019-09-19,"Do Directors Own Leap Therapeutics, Inc. (NASDAQ:LPTX) Shares?"
2019-09-17,Leap Therapeutics to Present Updated Data for DKN-01 Monotherapy and Paclitaxel Combination at the 2019 International Gynecologic Cancer Society Annual Global Meeting
2019-09-04,Leap Therapeutics to Present at Upcoming Investor Conferences
2019-08-09,Leap Therapeutics Reports Second Quarter 2019 Financial Results
2019-08-06,Leap Presents Positive Clinical Results for the Combination of DKN-01 plus Keytruda® and Provides DKN-01 Program Update
2019-07-25,Leap Therapeutics to Host Conference Call to Provide DKN-01 Program Update
2019-07-11,Leap Therapeutics Announces Common Stock Purchase Agreements For Up to $21 Million with Lincoln Park Capital
2019-06-11,Leap Therapeutics to Present at the 2019 Raymond James Life Sciences and MedTech Conference
2019-05-26,Investors Who Bought Leap Therapeutics (NASDAQ:LPTX) Shares A Year Ago Are Now Down 82%
2019-05-15,Leap Therapeutics Reports First Quarter 2019 Financial Results
2019-04-03,Leap Therapeutics to Present at the 2019 Needham & Company 18th Annual Healthcare Conference
2019-04-01,Leap Therapeutics Reports Clinical Update and 2018 Financial Results
2019-03-18,Leap Therapeutics Presents at Society of Gynecologic Oncology 50th Annual Meeting on Women's Cancer
2019-03-11,Four Tech Stocks Setting The Pace On Monday
2019-03-08,Leap Therapeutics to Present at the Society of Gynecologic Oncology 2019 Annual Meeting on Women's Cancer
2019-02-05,"Leap Therapeutics Inc (LPTX) CEO, President, Chairman Christopher Mirabelli Bought $999,999 of ..."
2019-02-05,Leap Therapeutics Announces Closing of Public Offering and Full Exercise of Underwriters' Option to Purchase Additional Securities
2019-02-01,Leap Therapeutics Announces Pricing of $11.5 Million Public Offering of Common Stock and Warrants
2019-01-31,Leap Therapeutics Announces Proposed Public Offering of Common Stock and Warrants
2019-01-30,2 Small-Cap Biotech Stocks That Are on My Radar
2019-01-29,"Report: Developing Opportunities within Match Group, Antero Resources, Boyd Gaming, Gorman-Rupp, Leap Therapeutics, and BioPharmX  Future Expectations, Projections Moving into 2019"
2019-01-14,Leap Therapeutics Announces an Investigator-Initiated Study of DKN-01 in Patients with DKK1+ Advanced Prostate Cancer
2018-12-14,Leap Therapeutics Presents TRX518 Data at ESMO Immuno-Oncology Congress 2018 and Updated Data from DKN-01 Study in Biliary Tract Cancer
2018-11-09,Leap Therapeutics Reports Third Quarter 2018 Business Update and Financial Results
2018-11-09,Leap Therapeutics Presents Esophagogastric Cancer Data at SITC 2018 Annual Meeting
2018-10-21,Leap Therapeutics Presents Esophagogastric Cancer Data at ESMO 2018 Annual Congress
2018-10-17,"Market Trends Toward New Normal in Halozyme Therapeutics, Fitbit, Iconix Brand Group, Leap Therapeutics, LightPath Technologies, and Capricor Therapeutics  Emerging Consolidated Expectations, Analyst Ratings"
2018-10-08,Leap Therapeutics to Present Data from Study Evaluating DKN-01 in Combination with KEYTRUDA® (pembrolizumab) at the European Society of Medical Oncology 2018 Congress
2018-09-25,Leap Therapeutics to Present at Two October Conferences
2018-08-30,Leap Therapeutics to Participate in the H.C. Wainwright 20th Annual Global Investment Conference
2018-08-22,"Recent Analysis Shows Leap Therapeutics, Gardner Denver, Medical Transcription Billing, CarGurus, Liberty Media, and Quorum Health Market Influences  Renewed Outlook, Key Drivers of Growth"
2018-08-08,Leap Therapeutics Reports Second Quarter 2018 Business Update and Financial Results
2018-07-23,"Leap Therapeutics Announces Collaboration with Merck KGaA, Darmstadt, Germany, and Pfizer to Evaluate Combination of TRX518, Avelumab, and Chemotherapy in Advanced Solid Tumors"
2018-06-13,"Analysis: Positioning to Benefit within Ruth's Hospitality Group, S&P Global, Shaw Communications, Leap Therapeutics, Red Hat, and Welltower  Research Highlights Growth, Revenue, and Consolidated Results"
2018-06-13,Leap Therapeutics to Present at the 2018 JMP Securities Life Sciences Conference
2018-05-11,Leap Therapeutics Reports First Quarter 2018 Financial Results
2018-05-10,Why Leap Therapeutics (LPTX) Might Surprise This Earnings Season
2018-04-16,Leap Therapeutics Presents Nonclinical and Clinical Data on DKN-01 at AACR 2018 Annual Meeting
2018-03-28,"New Research Coverage Highlights Holly Energy Partners, Liberty Property Trust, Fair Isaac, 58, Cousins Properties, and Leap Therapeutics  Consolidated Revenues, Company Growth, and Expectations for 2018"
2018-03-27,Leap Therapeutics Announces Closing of Public Offering of Common Stock and Full Exercise of Underwriters Option to Purchase Additional Shares
2018-03-23,Leap Therapeutics Announces Pricing of $14 Million Public Offering of Common Stock
2018-03-22,Leap Therapeutics Announces Proposed Public Offering of Common Stock
2018-03-21,Leap Therapeutics to Present at the 2018 Needham & Company 17th Annual Healthcare Conference
2018-03-14,Leap Therapeutics Provides DKN-01 Program Update and Announces Scientific Presentations at AACR Annual Meeting
2018-03-07,Leap Therapeutics to Present at 2018 Barclays Global Healthcare Conference
2018-02-06,Leap Therapeutics to Present at the 20th Annual BIO CEO & Investor Conference
2018-01-16,Leap Therapeutics Announces First Patient Dosed with TRX518 Combination Therapy in Advanced Solid Tumors Trial
2017-11-15,Whats Installed For Leap Therapeutics Inc (LPTX)?
2017-11-15,Leap Therapeutics Announces $18 Million Private Placement Offering
2017-11-13,Leap Therapeutics Reports Third Quarter 2017 Financial Results and Announces First Patient Dosed with DKN-01 and KEYTRUDA® (pembrolizumab) in Esophagogastric Cancer Trial
2017-09-19,Leap Therapeutics to Present at the 2017 Ladenburg Thalmann Healthcare Conference
2017-09-08,Leap Therapeutics Announces Collaboration With EORTC to Evaluate DKN-01 in Combination with PD-L1 Cancer Immunotherapy and Chemotherapy In Esophagogastric and Biliary Tract Cancers
2017-08-11,Leap Therapeutics Reports Second Quarter 2017 Financial Results
2017-06-26,Leap Therapeutics Added to Russell Microcap® Index
2017-06-24,Could Merck and Leap Union Be the One for Keytruda?
2017-06-21,Leap Therapeutics Announces Collaboration with Merck to Evaluate KEYTRUDA® (pembrolizumab) in Combination with DKN-01 in Esophagogastric Cancer
2017-06-01,Leap Therapeutics to Present at Two Investor Conferences in June
