2021-01-08,Credit Suisse to Post Fourth-Quarter Loss
2021-01-07,Credit Suisse Raised Its S&P 500 Target. Thank the Blue Wave.
2021-01-07,Credit Suisse (CS) Severs Ties With Some Clients in Venezuela
2021-01-07,"Credit Suisse Announces Coupon Payments and Expected Coupon Payments on Credit Suisse X-Links® Exchange Traded Notes (the ""ETNs"")"
2021-01-07,"Credit Suisse Announces Coupon Amount on its Credit Suisse S&P MLP Index ETN (ticker symbol ""MLPO"")"
2021-01-06,"Oatly, Backed by Oprah Winfrey, Is Expected to Launch an IPO"
2021-01-06,Credit Suisse Cuts Ties With Some Venezuelan Wealth Clients
2021-01-06,Commodities Billionaire Came Within Weeks of a Debt Crunch
2021-01-05,"Conagras Good Times Cant Last, Says Credit Suisse"
2020-12-30,"Dow Climbs on Gains in Energy, Industrials"
2020-12-23,Fed Enforces Credit Suisse (CS) to Improve AML Practices
2020-12-21,Nike Rides High as Good Times Expected to Continue
2020-12-17,Credit Suisse Charged Over Money Laundering in Cocaine Ring
2020-12-17,Credit Suisse (CS) Likely to Record Q4 Loss; Updates Outlook
2020-12-14,Credit Suisse Blow-Ups Give Gottstein a Crash Course in Risk
2020-12-13,Is CS A Good Stock To Buy Now?
2020-12-07,"UBS Europe SE -- Moody's upgrades Credit Suisse's ratings with a stable outlook, affirms UBS"
2020-12-07,Credit Suisse's (CS) 2020 Bonus Level Might Decline Y/Y
2020-12-04,Credit Suisse chairman hints at lower bonus payouts - newspaper
2020-12-03,"Mortgage Repurchase Agreement Financing Trust Notes, Series 2020-5 -- Moody's upgrades 8 securities issued by Mortgage Repurchase Agreement Financing Trust (MRAFT)"
2020-12-03,Credit Suisse (CS) Might Pay $680M in Penalty for RMBS Suit
2020-12-03,"Credit Suisse Announces Coupon Payments and Expected Coupon Payments on Credit Suisse X-Links® Exchange Traded Notes (the ""ETNs"")"
2020-12-02,"Alpine Securitization Ltd/ Alpine Securitization LLC -- Moody's upgrades the rating of the Term Notes issued by Alpine Securitization Ltd/ Alpine Securitization LLC (""Alpine"")"
2020-12-02,Moody's Upgrades Credit Suisse and Affirms UBS Group Ratings
2020-12-01,Credit Suisse Taps Horta-Osorio in Surprising Chairman Pick
2020-12-01,Credit Suisse Proposes Outgoing Lloyds Chief Horta-Osório As Chairman
2020-12-01,"Credit Suisse AG (Nassau) Branch -- Moody's upgrades Credit Suisse's ratings with a stable outlook, affirms UBS"
2020-12-01,Credit Suisse breaks with tradition with Lloyds chairman pick
2020-11-30,Credit Suisse (CS) Shareholders Approve Second 2019 Dividend
2020-11-27,Credit Suisse shareholders approve final 2019 dividend payment
2020-11-26,Credit Suisse (CS) to Face $450M Charge on York Capital Stake
2020-11-26,StockBeat: Europcar Survives by the Skin of its Teeth
2020-11-24,Credit Suisse Woes Deepen With $450 Million York Hedge Fund Hit
2020-11-24,Credit Suisse flags $450 million impairment on York Capital Management stake
2020-11-19,UBS becomes first major European bank to pay out full 2019 dividend
2020-11-11,Deutsche Bank Sees Hurdles to Consolidation: Future of Finance
2020-11-04,Credit Suisse Wealth Veterans to Start Hedge Fund Firm in Brazil
2020-11-04,"Credit Suisse Announces Coupon Payments and Expected Coupon Payments on Credit Suisse X-Links® Exchange Traded Notes (the ""ETNs"")"
2020-11-04,"Mortgage Repurchase Agreement Financing Trust Notes, Series 2020-5 -- Moody's assigns definitive ratings to structured notes issued by Mortgage Repurchase Agreement Financing Trust Notes, Series 2020-5"
2020-10-30,"Mortgage Repurchase Agreement Financing Trust Notes, Series 2020-5 -- Moody's assigns provisional ratings to structured notes issued by Mortgage Repurchase Agreement Financing Trust, Series 2020-5"
2020-10-29,Credit Suisse Shutters Funds in Asset Management Review
2020-10-29,Credit Suisse Trails Peers as Key Businesses Miss Estimates
2020-10-29,Credit Suisse Group AG to Host Earnings Call
2020-10-29,Credit Suisse profit slides as wealth management fees fall
2020-10-28,Dow Ends Below 27K as Virus Spike Triggers Biggest Selloff  Since July
2020-10-28,Dow Bleeds on Growing Lockdown Fears
2020-10-06,"Credit Suisse Announces Coupon Payments and Expected Coupon Payments on Credit Suisse X-Links® Exchange Traded Notes (the ""ETNs"")"
2020-10-06,"Credit Suisse Announces Coupon Amount on its Credit Suisse S&P MLP Index ETN (ticker symbol ""MLPO"")"
2020-10-06,Credit Suisse apologises over black performer at party
2020-10-05,MOVES-Credit Suisse rehiring investment banker Williams from Perella - memo
2020-10-03,"These 3 Investment Banks Will Pay for Your MBA (GS, CS)"
2020-09-30,"Credit Suisse Is More Optimistic on Steel, so It Has Upgraded Iron Ore Producers BHP and Rio Tinto"
2020-09-30,Understanding Credit Suisse Group's Unusual Options Activity
2020-09-28,Credit Suisse Fund Lent to Billionaire Greensills Neighbor
2020-09-23,"Credit Suisse, UBS held tie-up talks backed by both chairmen - Bilanz"
2020-09-23,"Credit Suisse, UBS held tie-up talks backed by both chairmen: Bilanz"
2020-09-22,"Credit Suisse, UBS Fight for China Bankers in Talent War"
2020-09-18,Weeks Best: A UBS-Credit Suisse Merger?
2020-09-17,"Gold Dips, Lost For Direction as Dollar Stubbornly Strong Post-Fed"
2020-09-17,Credit Suisse teams up with Qatar fund on multi-billion credit business
2020-09-14,UBS and Credit Suisse Reportedly Contemplating Merger
2020-09-14,"UBS, Credit Suisse Reportedly Explore Merger"
2020-09-14,UBS Chairman Studies Feasibility of Credit Suisse Deal
2020-09-12,Credit Suisse CEO urges end of cantonal banks' privileges
2020-09-10,Credit Suisse launches Switzerland's first major digital banking rival
2020-09-10,Credit Suisse to launch fintech rival digital banking app in October
2020-09-09,Why Virgin Galactic Stock Gained 7.5% This Morning -- Then Lost It All
2020-09-09,Credit Suisse Wins Bid to Keep Fraud Report Secret
2020-09-06,Evidence of further surveillance at Credit Suisse mounts up - SonntagsZeitung
2020-09-03,"Credit Suisse Announces Coupon Payments and Expected Coupon Payments on Credit Suisse X-Links® Exchange Traded Notes (the ""ETNs"")"
2020-09-02,Switzerland Steps Up Spying Probe Into Its No. 2 Bank
2020-09-02,Switzerland raises the stakes for Credit Suisse in spy affair
2020-09-02,Swiss open enforcement case against Credit Suisse in spy affair
2020-08-27,Credit Suisse Witnesses Loan Growth in Brazil Amid Pandemic
2020-08-27,"Credit Suisse (CS) to Shut Branches, Slash Jobs in Swiss Unit (Revised)"
2020-08-26,"Credit Suisse (CS) to Shut Branches, Slash Jobs in Swiss Unit"
2020-08-26,Credit Suisses Loan Portfolio in Brazil Doubles During Pandemic
2020-08-25,Credit Suisse (CS) Under Belgium Regulators' Investigations
2020-08-25,Credit Suisse to cut up to 500 jobs as its closes Swiss branches
2020-08-13,DGAZF Disaster Strikes As Dying ETN Blows Out Past Real Net Asset Value
2020-08-13,"A 6,150% Surge in OTC Trading Sparks Liquidation of Delisted ETN"
2020-08-12,Credit Suisse to Liquidate Natural Gas ETN That Went Parabolic
2020-08-12,Credit Suisse AG Announces the Acceleration at Its Option of its Previously Delisted VelocitySharesTM 3x Inverse Natural Gas ETNs
2020-08-09,Credit Suisse eyes cooperation with insurers: Rohner
2020-08-06,How To Invest In the Saudi Arabia Stock Exchange
2020-08-05,Dow Jumps as Lawmakers Step Up Efforts to Get Stimulus Bill Over the Line
2020-08-05,"Credit Suisse Announces Coupon Payments and Expected Coupon Payments on Credit Suisse X-Links® Exchange Traded Notes (the ""ETNs"")"
2020-08-01,Credit Suisse targeting savings of 2% to 3% per year
2020-07-31,Credit Suisse Group AG (CS) Q2 2020 Earnings Call Transcript
2020-07-30,Credit Suisse's Asian business has highest level of credit provisions
2020-07-30,Credit Suisse earmarks more than $300 billion for sustainable finance
2020-07-30,Credit Suisse Reports Q2 Earnings Beat
2020-07-30,Credit Suisse to merge investment banking units; second-quarter profit beats
2020-07-30,Credit Suisse wealth management revamp aims for 10% profit boost: memo
2020-07-29,Credit Suisse Hiring Morgan Stanley Dubai Banker Luthra
2020-07-29,Credit Suisse Boss Rewrites the Bank's Master Plan
2020-07-29,Credit Suisse to Merge Investment Bank and Trading in Revamp
2020-07-27,"Credit Suisse Invested $100 Million in Ant, Expects Windfall"
2020-07-27,"Credit Suisse Silently Invested $100M In Alibaba Subsidiary Ant Financial, Set To Benefit Immensely In Public Debut"
2020-07-24,"Mortgage Repurchase Agreement Financing Trust Notes, Series 2020-4 -- Moody's assigns definitive ratings to structured notes issued by Mortgage Repurchase Agreement Financing Trust, Series 2020-4"
