2020-11-20,Huize Announces 2020 Third Quarter Results
2020-11-19,Huize Holding Limited (HUIZ) Q3 2020 Earnings Call Transcript
2020-11-19,Huize Holding Limited Reports Third Quarter 2020 Unaudited Financial Results
2020-11-13,HUIZE: Rapid rise of China's insurance aggregator
2020-11-09,"Huize Holding Limited to Report Third Quarter 2020 Financial Results on November 19, 2020"
2020-11-02,"Huize Holding Limited to Hold Annual General Meeting on December 10, 2020"
2020-09-17,Huize Holding Limited Ranked Fourth in Hurun China Digital Insurance Agencies 2020 List
2020-08-20,Huize Holding Limited (HUIZ) Q2 2020 Earnings Call Transcript
2020-08-20,Huize Holding Limited Reports Second Quarter 2020 Unaudited Financial Results
2020-08-12,"Huize Holding Limited to Report Second Quarter 2020 Financial Results on August 20, 2020"
2020-07-24,Here's What Huize Holding Limited's (NASDAQ:HUIZ) Shareholder Ownership Structure Looks Like
2020-05-29,Huize Holding Limited (HUIZ) Q1 2020 Earnings Call Transcript
2020-05-29,Huize Holding Limited Reports First Quarter 2020 Unaudited Financial Results
2020-05-20,"Huize Holding Limited to Report First Quarter 2020 Financial Results on May 29, 2020"
2020-04-24,Huize Holding Limited Files Its Annual Report on Form 20-F
2020-04-15,Huize Holding Limited Announces Share Repurchase Program
2020-03-31,Huize Holding Limited Reports Fourth Quarter and Full Year 2019 Unaudited Financial Results
2020-03-27,"Huize Holding Limited to Report Fourth Quarter and Full Year 2019 Financial Results on March 31, 2020"
2020-03-10,Huize Holding Limited Announces Partial Exercise of Over-Allotment Option in Initial Public Offering
