2020-12-16,Where Do Hedge Funds Stand On StepStone Group Inc. (STEP)?
2020-12-08,L Catterton-led Consortium to Acquire Truck Hero
2020-12-01,StepStone Real Estate Adds Margaret McKnight as Partner
2020-11-10,StepStone Group Reports Second Quarter Fiscal 2021 Results
2020-11-10,StepStone Group Inc - Ordinary Shares - Class A to Host Earnings Call
2020-10-29,"StepStone to Announce Second Quarter Fiscal 2021 Results and Webcast on November 10, 2020"
2020-10-28,Conversus StepStone Private Markets Holds First Closing
2020-09-29,StepStone Real Estate Closes Fund IV With $1.4 Billion in Capital Commitments
2020-09-18,StepStone Announces Closing of Initial Public Offering
2020-09-16,StepStone Announces Pricing of Initial Public Offering
