2021-01-08,Evergy Chief Financial Officer Tony Somma to Leave the Company
2020-12-30,Todays Dirty Utilities May Be Tomorrows ESG Winners
2020-12-28,"What You Need To Know About Evergy, Inc.'s (NYSE:EVRG) Investor Composition"
2020-12-21,Is EVRG A Good Stock To Buy According To Hedge Funds?
2020-12-08,"Evergy Appoints David A. Campbell as President, Chief Executive Officer and Board Member"
2020-12-05,Why Is Evergy (EVRG) Down 0.5% Since Last Earnings Report?
2020-11-25,NextEra Energy Is On a Path to Acquire Another Utility With Its Shares
2020-11-14,Here's Why We're Wary Of Buying Evergy's (NYSE:EVRG) For Its Upcoming Dividend
2020-11-10,Elliott Management Prods Evergy to Resume NextEra Merger Talks
2020-11-10,Evergy Issues Statement
2020-11-10,Elliott calls on Evergy to reengage with NextEra Energy after bid report
2020-11-09,NextEra Makes $15 Billion Bid to Acquire Midwestern Utility Evergy
2020-11-09,Exclusive: NextEra Energy in $15 billion bid for Evergy - sources
2020-11-08,"With A 7.3% Return On Equity, Is Evergy, Inc. (NYSE:EVRG) A Quality Stock?"
2020-11-05,"Evergy, Inc. (EVRG) Q3 2020 Earnings Call Transcript"
2020-11-05,"Evergy (EVRG) Beats Q3 Earnings Estimates, Narrows 2020 View"
2020-11-05,Evergy Announces 2020 Third Quarter Results
2020-11-02,"Were These Hedge Funds Wrong About Loading Up On Evergy, Inc. (EVRG)?"
2020-11-02,Evergy (EVRG) to Report Q3 Earnings: What's in the Offing?
2020-10-22,Plug and Play Partners with Evergy to Foster New Relationships and Innovation in Topeka
2020-10-15,Evergy Schedules Conference Call to Discuss 3rd Quarter Results
2020-10-11,Why Someone Took Aim at Disneys Dividend
2020-10-02,"Calculating The Fair Value Of Evergy, Inc. (NYSE:EVRG)"
2020-09-08,"Hedge Funds Never Been This Bullish On Evergy, Inc. (EVRG)"
2020-09-04,Why Is Evergy (EVRG) Down 4.2% Since Last Earnings Report?
2020-08-30,3 Proposals for Growth-Focused Investors
2020-08-27,Evergy Announces Chief Executive Officer Terry Bassham to Retire
2020-08-25,Did You Participate In Any Of Evergy's (NYSE:EVRG) Respectable 69% Return?
2020-08-24,"Paragould, Evergy Announce Solar Energy Agreement"
2020-08-07,Evergy Says No to Elliotts Demand for M&A. The Utility Stock Slumps.
2020-08-05,"Evergy, Inc. (EVRG) Q2 2020 Earnings Call Transcript"
2020-08-05,"Evergy's (EVRG) Q2 Earnings Miss Estimates, Increase Y/Y"
2020-08-05,CORRECTING and REPLACING Evergy Announces Sustainability Transformation Plan
2020-08-05,Evergy Announces 2020 Second Quarter Results
2020-08-04,Why Evergy Stock Fell as Much as 13% on Aug. 4
2020-07-31,Evergy (EVRG) to Report Q2 Earnings: What's in the Cards?
2020-07-29,Evergy Schedules Conference Call to Discuss 2nd Quarter Results
2020-07-20,"What Kind Of Investors Own Most Of Evergy, Inc. (NYSE:EVRG)?"
2020-07-13,"Did Hedge Funds Make The Right Call On Evergy, Inc. (EVRG) ?"
2020-07-03,What Activist Elliott Management Looks for in a Utility Stock  and How Investors Can Take Advantage
2020-06-22,6 Utilities Boosting Earnings
2020-06-12,"Hedge Funds Have Never Been This Bullish On Evergy, Inc. (EVRG)"
2020-06-05,Why Is Evergy (EVRG) Up 11.7% Since Last Earnings Report?
2020-05-19,Evergy Pledges $2.2 Million to Local COVID-19 Relief in Historic Commitment
2020-05-14,"Here's Why We're Wary Of Buying Evergy, Inc.'s (NYSE:EVRG) For Its Upcoming Dividend"
2020-05-12,Evergy to Prepare Sale Process After Push From Elliott
2020-05-12,"A Note On Evergy, Inc.'s (NYSE:EVRG) ROE and Debt To Equity"
2020-05-11,Increasing Capital Investment Estimate After Evergy Reports No Supply Chain Impact From Coronavirus
2020-05-07,"Evergy, Inc. (EVRG) Q1 2020 Earnings Call Transcript"
2020-05-07,"Evergy (EVRG) Q1 Earnings Beat Estimates, Revenues Miss"
2020-05-06,Evergy Announces 2020 First Quarter Results
2020-05-04,Evergy (EVRG) to Report Q1 Earnings: What's in the Offing?
2020-04-29,"Know These 3 Facts to Avoid Paying Half Your Retirement Income to the IRS - April 29, 2020"
2020-04-21,Evergy to conduct 2020 shareholder meeting online
2020-04-16,Evergy Schedules Conference Call to Discuss 1st Quarter Results
2020-04-16,"An Intrinsic Calculation For Evergy, Inc. (NYSE:EVRG) Suggests It's 30% Undervalued"
2020-04-14,"The Zacks Analyst Blog Highlights: Evergy, MarketAxess, Newmont Goldcorp, Paycom Software and Centene"
2020-04-06,"These 60 large U.S. companies are susceptible to a dividend cut, according to Jefferies"
2020-04-01,Evergy (EVRG) Down 20% Since Last Earnings Report: Can It Rebound?
2020-03-26,Process of plotting Evergy's future gets a new deadline
2020-03-23,Evergy's Near-Term Investment Plan Likely to Be Scaled Back With COVID-19 Costs
2020-03-18,"Hedge Funds Were Dumping Evergy, Inc. (EVRG) Before The Coronavirus"
2020-03-17,Bright Near-Term Outlook for Alternative Energy Industry
2020-03-17,"How Does Evergy's (NYSE:EVRG) P/E Compare To Its Industry, After The Share Price Drop?"
2020-03-06,4 Reasons to Add Evergy (EVRG) to Your Portfolio Right Now
2020-03-05,"Know These 3 Facts to Avoid Paying Half Your Retirement Income to the IRS - March 05, 2020"
2020-03-02,Who are Evergy's new board members?
2020-03-02,"Evergy's (EVRG) Q4 Earnings Rise Y/Y, Sales Miss Estimates"
2020-03-02,"Evergy cuts deal with activist that requires study of operations, possible sale"
2020-03-02,Elliott Reaches Deal With Evergy to Add Two Seats to Board
2020-03-02,Evergy Announces Agreement with Elliott Management
2020-03-02,"Evergy Announces 2019 Results, Declares Quarterly Dividend and Announces Updates to Capital Plan"
2020-02-27,Elliott Nears Deal for Two Evergy Board Seats
2020-02-26,Update: Evergy (NYSE:EVRG) Stock Gained 84% In The Last Five Years
2020-02-24,Evergy Inc (EVRG) Earnings Expected to Grow: Should You Buy?
2020-02-19,Evergy Schedules Conference Call to Discuss 4th Quarter Results
2020-02-18,Exclusive: U.S. utility Evergy close to board deal with Elliott - sources
2020-02-17,Evergy (EVRG) to Report Q4 Earnings: What's in the Cards?
2020-02-14,"Retirees Should Know These 3 Facts About Required Minimum Distributions - February 14, 2020"
2020-02-13,Evergy Inc (EVRG) Earnings Expected to Grow: Should You Buy?
2020-02-07,Evergy Looks Like a Way to Go Green and Make Some Green
2020-02-07,5 Companies Hit 52-Week Highs
2020-02-04,Evergy activist investor plays for keeps
2020-01-30,Evergy pledges to increase wind power  as activist investor has pushed
2020-01-30,"Evergy announces plan to reduce carbon emissions 80 percent, adds 660 megawatts of wind energy to its portfolio"
2020-01-29,Evergy's activist investor has chamber CEO Reardon 'deeply concerned'
2020-01-26,"Editor's Briefing: A raider targets a KC company, but the community sleeps"
2020-01-21,Elliott Takes $760 Million Evergy Stake in Push for Overhaul
2020-01-21,Evergy Affirms Board and Managements Focus on Delivering Long-Term Value Creation and Serving Stakeholders Best Interests
2020-01-21,Activist investor issues Evergy an ultimatum
2020-01-21,"Dont Buy Evergy, Inc. (NYSE:EVRG) Until You Understand Its ROCE"
2020-01-21,Evergy Is Urged by Activist Firm Elliott to Take Steps to Lift Stock Price
2019-12-24,Evergy Ventures winds down its first 5 years with 21st investment
2019-12-22,"How Does Evergy, Inc. (NYSE:EVRG) Fare As A Dividend Stock?"
2019-12-11,Renewable Stocks in Focus on Decarbonization Urgency
2019-12-06,"Evergy, Inc. (EVRG): Hedge Funds In Wait-and-See Mode"
2019-12-06,Why Is Evergy (EVRG) Up 1.1% Since Last Earnings Report?
2019-11-22,"Only 3 Days Left To Cash In On Evergy, Inc. (NYSE:EVRG) Dividend"
2019-11-21,Should You Invest in the Invesco DWA Utilities Momentum ETF (PUI)?
2019-11-18,Near-Term Bright Prospects for Alternative Energy Stocks
