Dec-30-20,05:11AM,10 Biggest Solar Companies In The World
Jan-05-21,06:55AM,Brookfield Asset Management Announces Appointment of Hutham Olayan to Board of Directors
Jan-04-21,03:24PM,Brookfield Bids to Take Brookfield Property Partners Private
Jan-04-21,01:40PM,"Why Digital Realty Rose 16% in 2020, but W.P. Carey and Brookfield Property Fell Sharply"
Jan-04-21,01:00PM,Brookfield Wants to Buy Out Real Estate Arm. It May Have to Raise Its Offer.
Jan-04-21,12:37PM,Brookfield Asset Management Offers to Buy the Rest of Brookfield REIT for $5.9 Billion
Jan-04-21,11:16AM,Brookfield Moves to Buy Property Arm in Changing Mall Landscape
Jan-04-21,10:51AM,Why Brookfield Property Partners and Brookfield Property REIT Rocketed Higher at the Open Today
Jan-04-21,09:59AM,Why 2021 could be a record year for M&A
Jan-04-21,07:30AM,Brookfield Property Partners Acknowledges Brookfield Asset Managements Privatization Proposal and Establishes a Committee of Independent Directors
Jan-04-21,07:28AM,Brookfield Asset Management offers to buy limited partnership units of Brookfield Property for $5.9 billion
Jan-04-21,07:15AM,Brookfield Asset Management and Institutional Partners Propose to Acquire 100% of the Units of Brookfield Property Partners Not Owned by Brookfield for $5.9 Billion
