2021-01-11,"Ahead of inauguration, Airbnb pledges bans for anyone involved in Capitol riot"
2021-01-11,Repealing Section 230 Portion of Internet Law Would Be Terrible For Airbnb. Heres Why.
2021-01-11,"Stock in ContextLogic, Wish.coms Parent, Falls as Analysts Weigh In"
2021-01-11,Boot-maker Dr. Martens kick-starts plan for $4 billion IPO
2021-01-10,Airbnb Hosts Skirt Rules To Book Guests Outside Platform: Financial Times
2021-01-08,Airbnb Shares Are Overpriced But a Dip Seems Unlikely
2021-01-08,Pershing Square SPACs Unrequited Love Will Be Rewarded
2021-01-08,The Best Consumer Goods Stocks to Buy in 2021
2021-01-08,Pershing Square Tontine Stock Could Be Setting SPAC Investors Up for Disappointment
2021-01-08,Why I'm Watching Airbnb Stock
2021-01-07,"Want Robinhood Shares? If You're A Customer, You Could Get Them First"
2021-01-07,Goldman Banker Nick Giovanni to Join Instacart as CFO Ahead of IPO
2021-01-06,Why theres a lot to like from Airbnbs story
2021-01-06,Could Airbnb Be a Millionaire-Maker Stock?
2021-01-06,"The IPO Market Is Getting Weird, and We've Been Here Before"
2021-01-06,Timeshare king Wyndham Destination buys Travel + Leisure for $100 million
2021-01-05,"Affirm sets IPO terms, could rake in up to $935 million"
2021-01-05,The opportunities outweigh the risks with Airbnb: Analyst
2021-01-05,Trade Airbnb Stock for Uber and Expedia to Play Vacations After Vaccinations
2021-01-05,Morning Bell With Jim Cramer: Any Concern for Alibaba?
2021-01-05,Analyzing Airbnb's Unusual Options Activity
2021-01-05,Georgia Senate runoff: $600 billion more in stimulus money and higher taxes are on the line
2021-01-05,3 Hot Stocks to Buy in January
2021-01-04,Wall Street weighs in on Airbnb and DoorDash
2021-01-04,'Trading Nation' Analysts Weigh In On Airbnb And DoorDash
2021-01-04,Airbnb stock sinks as analysts mostly avoid calling shares a buy
2021-01-04,Airbnb Shares Slide as Some Analysts Express Valuation Concerns
2021-01-04,"Airbnb Gets Plaudits, Caution on Valuation From Analysts"
2021-01-04,Analysts Initiate Coverage Of Airbnb: 'Best-In-Class Travel Company With A Premium Valuation'
2021-01-04,Wall Street Initiates Airbnb Coverage
2021-01-04,Evaluating Airbnbs future
2021-01-04,"Benzinga's Top Upgrades, Downgrades For January 4, 2021"
2021-01-02,About to Buy Penny Stocks? Look at These 3 Companies First
2021-01-02,3 Top Tech IPOs to Buy for 2021
2020-12-31,How Airbnb Is Worth $68 or $232 Heading Into 2021
2020-12-31,"This New Way of Taking a Company Public Has Little Pop, and Thats a Good Thing for Investors"
2020-12-31,Airbnb and DoorDash Set for Flurry of Analyst Coverage Next Week
2020-12-31,Why 2021 Offers New Hope
2020-12-31,"Airbnb Is a Great Investment, But Shares Need to Cool Off"
2020-12-30,What to expect from the tech sector in 2021
2020-12-30,3 Robinhood Stocks Investors Can't Get Enough Of
2020-12-30,The chart that explains 2020's crazy stock market: Morning Brief
2020-12-29,The Real Reason Big Tech Dominated The Market In 2020
2020-12-29,"As Cloud IPOs Soar, Qualtrics Hopes to Be Next"
2020-12-29,Heres what has to happen for Tesla to grow into its valuation
2020-12-29,This Was the Busiest Year for IPOs Since the Dot-Com Bubble. Expect Another Busy Year in 2021.
2020-12-28,"IPOs in 2021: After a year of impressive pandemic offerings, these tech companies expect to keep it rolling"
2020-12-28,IBM Announces Settlement With Airbnb for Patent Lawsuit
2020-12-28,5 Top Performers of an IPO-Packed 2020
2020-12-27,3 Stocks to Avoid This Week
2020-12-26,"Benzinga's Bulls And Bears Of Christmas Week: Airbnb, Apple, Netflix, Nike, Tesla And More"
2020-12-25,A New Way for Companies to Go Public Wont Necessarily Bring More IPOs
2020-12-24,IPOs Will Remain Robust in 2021 Because Investors Want the Stocks
2020-12-23,IBM and Airbnb Announce Settlement in Patent Litigation
2020-12-23,Here's what Airbnb is doing to discourage large gatherings over the holidays
2020-12-23,IPOs to watch in 2021: The 5 most anticipated debuts
2020-12-23,2021's most anticipated IPOs
2020-12-23,DoorDash Is Being Delivered On a Plate to Bears
2020-12-23,"IPO Stocks to Trade: 2 to Buy, 1 to Sell"
2020-12-23,What Can We Expect From Airbnb Stock in 2021?
2020-12-23,Why Airbnb Can Outrun Booking Holdings
2020-12-23,"Paul Meeks Bearish On Airbnb, Calls Short On DoorDash"
2020-12-22,"Market Recap: Tuesday, December 22nd"
2020-12-22,C3.ai Now Rivals Snowflake for Title of Priciest Tech Stock
2020-12-22,Tokyo Stock Exchange Is Set for One of Its Biggest IPOs of the Year
2020-12-22,SoftBank Files for SPAC to Raise Over $500 Million
2020-12-21,What to Make of Starbucks' Optimism
2020-12-21,"Dow Jones Turns Higher After 400-Point Intraday Plunge; JPMorgan Flashes Buy Signal, Airbnb Soars To New High"
2020-12-21,3 Stocks to Avoid This Week
2020-12-20,3 Top Breakout Stocks to Watch in 2021
2020-12-20,Why I Didn't Go All In On the Airbnb IPO
2020-12-20,These Were the 3 Best Travel Stocks of 2020
2020-12-19,Human Capital: Ex-Pinterest employees who alleged discrimination say 'no progress has been made'
2020-12-19,"Wish (and Airbnb, and Palantir) investor Justin Fishner-Wolfson doesn't care about first-day pops"
2020-12-18,2021 Could Be Challenging for Tech Stocks. Heres Why.
2020-12-18,Airbnb and DoorDash Get Some Positive Attention after Wall Street Knocks Them Back to Earth
2020-12-18,"Airbnb, DoorDash Rally After New Bull Touts Market Dominance"
2020-12-18,"Airbnb, DoorDash Price Targets Set at Wall-Street Highs by Susquehanna"
2020-12-18,ABNB Stock: Why AirBNB Shares Are Surging Friday
2020-12-18,7 hard lessons for investors from the DoorDash and Airbnb IPOs
2020-12-18,How 2020 transformed the grocery business: Morning Brief
2020-12-17,Cryptocurrency Exchange Coinbase Says It Filed to Go Public
2020-12-17,MetaProp Co-Founder on VC space: Theres a lot of evidence of mispriced IPOs
2020-12-16,Retailer Wish Drops in Trading Debut After IPO Spree
2020-12-16,Wish Stock Falls Below Its $24 IPO Price
2020-12-16,Wish Raises $1.1 Billion As E-Commerce IPO Slides
2020-12-16,China Web Retailer Soars 400% on Second Day After IPO in U.S.
2020-12-16,5 Trends the Pandemic Accelerated
2020-12-16,Aphria and Tilrays Merger Could Create the Largest Cannabis Company in the World
2020-12-16,It Has Definitely Been a Big Year for IPOs. It Just Might Be Tech Bubble 2.0.
2020-12-15,Wish IPO Could Be The Last Billion-Dollar Deal Of 2020
2020-12-15,Airbnb's (NasdaqGS:ABNB) Path To Profitability Isn't Mapped Out Yet
2020-12-15,DoorDash Puts Are All the Rage After IPO Mania Stoked 54% Surge
2020-12-15,Twitter Will Use Amazon Web Services to Power User Feeds
2020-12-15,"Wish, the Online Dollar Store, Is Losing Momentum Before IPO"
2020-12-15,The stock market flashes a major new sell signal: BofA survey
2020-12-15,Comic: IPOs Are All Pumped Up
2020-12-15,Is a massive bubble in US tech stocks comingor is it already here?
2020-12-14,"DJIA, S&P 500 Stall on Lockdown Fears Despite Positive Vaccine News"
2020-12-14,"Dow Jones Futures: Shutdown Fears Blunt Stock Market Rally Coronavirus Vaccine Hopes; AMD, PayPal, Peloton Are In Buy Zones"
