2021-01-04,"Provident Financial Services, Inc. Schedules Fourth Quarter and Year-Ended Earnings Conference Call"
2020-12-24,"What Type Of Shareholders Make Up Provident Financial Services, Inc.'s (NYSE:PFS) Share Registry?"
2020-12-10,Is PFS A Good Stock To Buy Now?
2020-12-03,Provident Strengthens Retail Banking Leadership Team  with Key Appointments
2020-12-02,New Provident Bank Research Demonstrates a  Shift in Consumer Spending and Saving Habits
2020-11-24,Why Provident Financial (PFS) Stock Might be a Great Pick
2020-11-09,"Should Income Investors Look At Provident Financial Services, Inc. (NYSE:PFS) Before Its Ex-Dividend?"
2020-10-30,Provident Financial Services Inc (PFS) Q3 2020 Earnings Call Transcript
2020-10-30,Provident Financial (PFS) Beats Q3 Earnings and Revenue Estimates
2020-10-30,Recap: Provident Financial Q3 Earnings
2020-10-30,"Provident Financial Services, Inc. to Host Earnings Call"
2020-10-30,"Provident Financial Services, Inc. Announces Third Quarter Earnings and Declares Quarterly Cash Dividend"
2020-10-23,Analysts Estimate Provident Financial (PFS) to Report a Decline in Earnings: What to Look Out for
2020-10-02,"Provident Financial Services, Inc. Schedules Third Quarter Earnings Conference Call"
2020-09-23,"Need To Know: Provident Financial Services, Inc. (NYSE:PFS) Insiders Have Been Buying Shares"
2020-09-14,Weekly CEO Buys Highlight
2020-08-20,Provident Strengthens Leadership Team with Key Appointments
2020-08-09,"Income Investors Should Know That Provident Financial Services, Inc. (NYSE:PFS) Goes Ex-Dividend Soon"
2020-08-09,"Income Investors Should Know That Provident Financial Services, Inc. (NYSE:PFS) Goes Ex-Dividend Soon"
2020-08-03,"Provident Financial Services, Inc. Completes Merger with SB One Bancorp"
2020-07-31,Provident Financial Services Inc (PFS) Q2 2020 Earnings Call Transcript
2020-07-30,Provident Financial (PFS) Q2 Earnings Top Estimates
2020-07-30,"Provident Financial Services, Inc. Announces Second Quarter Earnings and Declares Quarterly Cash Dividend"
2020-07-23,Analysts Estimate Provident Financial (PFS) to Report a Decline in Earnings: What to Look Out for
2020-07-05,"Were Hedge Funds Right About Dumping Provident Financial Services, Inc. (PFS)?"
2020-07-03,"SHAREHOLDER ALERT: Pomerantz Law Firm Investigates Claims on Behalf of Investors of Provident Financial Services, Inc.  PFS"
2020-07-01,"Provident Financial Services, Inc. Schedules Second Quarter Earnings Conference Call"
2020-06-24,"SHAREHOLDER ALERT: Pomerantz Law Firm Investigates Claims On Behalf of Investors of Provident Financial Services, Inc. - PFS"
2020-06-24,"Provident Financial Services, Inc. and SB One Bancorp Announce the Receipt of SB One Bancorp Shareholder Approval and the Anticipated Closing Date in Connection with Proposed Merger"
2020-06-23,Edited Transcript of PFS earnings conference call or presentation 30-Apr-20 2:00pm GMT
2020-06-22,"SHAREHOLDER ALERT: Pomerantz Law Firm Investigates Claims on Behalf of Investors of Provident Financial Services, Inc. - PFS"
2020-06-16,"SHAREHOLDER ALERT: Pomerantz Law Firm Investigates Claims On Behalf of Investors of Provident Financial Services, Inc. - PFS"
2020-06-08,"SHAREHOLDER ALERT: Pomerantz Law Firm Investigates Claims On Behalf of Investors of Provident Financial Services, Inc. - PFS"
2020-06-03,"SHAREHOLDER ALERT: Pomerantz Law Firm Investigates Claims On Behalf of Investors of Provident Financial Services, Inc. - PFS"
2020-05-29,"Provident Financial Services, Inc. and SB One Bancorp Announce the Receipt of FDIC and New Jersey Approvals in Connection with Proposed Merger"
2020-05-28,"Lifshitz Law Firm, P.C. Announces Investigation of Advance Auto Parts, Inc., (AAP), Apyx Medical Corporation (APYX), Dycom Industries, Inc. (DY), Qumu Corporation (QUMU), Provident Financial Services, Inc. (PFS), SB One Bancorp (SBBX), and Zuora, Inc. (ZUO)"
2020-05-27,"Lifshitz Law Firm, P.C. Announces Investigation of Advance Auto Parts, Inc., (AAP), Apyx Medical Corporation (APYX), Dycom Industries, Inc. (DY), Qumu Corporation (QUMU), Provident Financial Services, Inc. (PFS), SB One Bancorp (SBBX), and Zuora, Inc. (ZUO)"
2020-05-27,"SHAREHOLDER ALERT: Pomerantz Law Firm Investigates Claims On Behalf of Investors of Provident Financial Services, Inc. - PFS"
2020-05-25,"SHAREHOLDER ALERT: Pomerantz Law Firm Investigates Claims On Behalf of Investors of Provident Financial Services, Inc. - PFS"
2020-05-15,"Provident Financial Services, Inc. Earnings Missed Analyst Estimates: Here's What Analysts Are Forecasting Now"
2020-05-05,"SHAREHOLDER ALERT: Pomerantz Law Firm Investigates Claims On Behalf of Investors of Provident Financial Services, Inc. - PFS"
2020-05-01,"PFS Investor Alert: Bronstein, Gewirtz & Grossman, LLC Announces Investigation of Provident Financial Services, Inc. and Encourages Investors to Contact the Firm"
2020-04-30,"PFS Investor Alert: Bronstein, Gewirtz & Grossman, LLC Announces Investigation of Provident Financial Services, Inc. and Encourages Investors to Contact the Firm"
2020-04-30,Provident Financial Services Inc (PFS) Q1 2020 Earnings Call Transcript
2020-04-30,Provident Financial (PFS) Misses Q1 Earnings Estimates
2020-04-30,Provident Financial: Q1 Earnings Insights
2020-04-30,"Provident Financial Services, Inc. Announces First Quarter Earnings and Declares Quarterly Cash Dividend"
2020-04-23,Analysts Estimate Provident Financial (PFS) to Report a Decline in Earnings: What to Look Out for
2020-04-22,"Does Provident Financial Services, Inc.'s (NYSE:PFS) CEO Pay Matter?"
2020-04-18,"Were Hedge Funds Right About Provident Financial Services, Inc. (PFS)?"
2020-04-16,"Provident Promotes Sierotko to EVP, Chief Lending Officer"
2020-04-10,"PROVIDENT FINANCIAL SERVICES, INC. SCHEDULES FIRST QUARTER EARNINGS CONFERENCE CALL"
2020-04-02,"Provident Financial Services, Inc. Announces Change in Location of 2020 Annual Meeting of Stockholders"
2020-03-27,"How Does Provident Financial Services's (NYSE:PFS) P/E Compare To Its Industry, After The Share Price Drop?"
2020-03-23,"INVESTOR ALERT: Tostrud Law Group, PC Announces Investigation of Provident Financial Services (PFS) on Behalf of Investors"
2020-03-19,"Powell Joins Provident Bank as EVP, Chief Human Resources Officer"
2020-03-17,"SHAREHOLDER ALERT: Levi & Korsinsky, LLP Notifies Investors of an Investigation Regarding Whether the Merger of SB One Bancorp with Provident Financial Services, Inc. is Fair to SBBX Shareholders"
2020-03-13,SHAREHOLDER ALERT: WeissLaw LLP Investigates SB One Bancorp
2020-03-13,"How Does Provident Financial Services's (NYSE:PFS) P/E Compare To Its Industry, After The Share Price Drop?"
2020-03-12,ALERT: Rowley Law PLLC is Investigating Proposed Acquisition of SB One Bancorp
2020-03-12,New Jersey bank agrees to buy competitor for $209M
2020-03-12,SB One (SBBX) Alert: Johnson Fistel Investigates Proposed Sale of SB One Bancorp; Are Shareholders Getting a Fair Deal?
2020-03-12,"Provident Financial Services, Inc. Announces Merger with SB One Bancorp"
2020-03-09,"ROSEN, A LEADING LAW FIRM, Continues Its Investigation of Securities Claims Against Provident Financial Services, Inc.  PFS"
2020-02-28,"SHAREHOLDER ALERT: Pomerantz Law Firm Investigates Claims On Behalf of Investors of Provident Financial Services, Inc. - PFS"
2020-02-24,INVESTOR ALERT: BCOR BDX PFS PRA: Kirby McInerney LLP Continues Investigation of Shareholder Claims
2020-02-17,"ROSEN, A LEADING INVESTOR FIRM, Continues Its Investigation of Securities Claims Against Provident Financial Services, Inc.  PFS"
2020-02-15,The Law Offices of Frank R. Cruz Continues Its Investigation on Behalf of Provident Financial Services Inc. Investors (PFS)
2020-02-14,"SHAREHOLDER ALERT: Pomerantz Law Firm Investigates Claims On Behalf of Investors of Provident Financial Services, Inc. - PFS"
2020-02-11,"PROVIDENT FINANCIAL ALERT: Bragar Eagel & Squire, P.C. is Investigating Provident Financial Services, Inc. on Behalf of Stockholders and Encourages Investors to Contact the Firm"
2020-02-10,"INVESTOR ALERT: Kirby McInerney LLP Continues Investigation of Shareholder Claims Against Provident Financial Services, Inc."
2020-02-10,"SHAREHOLDER ALERT: Pomerantz Law Firm Investigates Claims On Behalf of Investors of Provident Financial Services, Inc. - PFS"
2020-02-08,"Is It Worth Considering Provident Financial Services, Inc. (NYSE:PFS) For Its Upcoming Dividend?"
2020-02-07,Edited Transcript of PFS earnings conference call or presentation 31-Jan-20 3:00pm GMT
2020-02-07,"SHAREHOLDER ACTION NOTICE: The Schall Law Firm Announces it is Investigating Claims Against Provident Financial Services, Inc. and Encourages Investors with Losses to Contact the Firm"
2020-02-06,"PFS LOSSES ALERT: Bernstein Liebhard LLP Announces its Investigation into Provident Financial Services, Inc."
2020-02-03,"IMPORTANT INVESTOR ALERT: The Schall Law Firm Announces it is Investigating Claims Against Provident Financial Services, Inc. and Encourages Investors with Losses to Contact the Firm"
2020-02-03,"EQUITY ALERT: ROSEN, A TOP RANKED LAW FIRM, Announces Investigation of Securities Claims Against Provident Financial Services, Inc.  PFS"
2020-02-03,"SHAREHOLDER ALERT: Pomerantz Law Firm Investigates Claims On Behalf of Investors of Provident Financial Services, Inc. - PFS"
2020-02-03,"Glancy Prongay & Murray LLP Continues Its Investigation on Behalf of Provident Financial Services, Inc. Investors"
2020-01-31,Provident Financial (PFS) Misses Q4 Earnings Estimates
2020-01-31,"Provident Financial Services, Inc. Announces Fourth Quarter and Full Year Earnings and Declares Quarterly Cash Dividend"
2020-01-30,"INVESTOR ALERT: Law Offices of Howard G. Smith Continues Investigation on Behalf of Provident Financial Services, Inc. Investors"
2020-01-29,"SHAREHOLDER ALERT: Pomerantz Law Firm Investigates Claims On Behalf of Investors of Provident Financial Services, Inc. - PFS"
2020-01-28,"PFS LOSSES ALERT: Bernstein Liebhard LLP Announces its Investigation into Provident Financial Services, Inc., and Encourages Investors with Losses to Contact the Firm"
2020-01-27,"SHAREHOLDER ALERT: Pomerantz Law Firm Investigates Claims On Behalf of Investors of Provident Financial Services, Inc. - PFS"
2020-01-24,"SHAREHOLDER ALERT: Pomerantz Law Firm Investigates Claims On Behalf of Investors of Provident Financial Services, Inc. - PFS"
2020-01-24,Earnings Preview: Provident Financial (PFS) Q4 Earnings Expected to Decline
2020-01-24,"Does Provident Financial Services, Inc.'s (NYSE:PFS) P/E Ratio Signal A Buying Opportunity?"
2020-01-21,"SHAREHOLDER ALERT: Pomerantz Law Firm Investigates Claims On Behalf of Investors of Provident Financial Services, Inc. - PFS"
2020-01-16,"SHAREHOLDER ALERT: Pomerantz Law Firm Investigates Claims On Behalf of Investors of Provident Financial Services, Inc. - PFS"
2020-01-14,"SHAREHOLDER ACTION NOTICE: The Schall Law Firm Announces it is Investigating Claims Against Provident Financial Services, Inc. and Encourages Investors with Losses to Contact the Firm"
2020-01-13,"PROVIDENT FINANCIAL ALERT: Bragar Eagel & Squire, P.C. is Investigating Provident Financial Services, Inc. on Behalf of Stockholders and Encourages Investors to Contact the Firm"
2020-01-13,"Glancy Prongay & Murray LLP Continues Its Investigation on Behalf of Provident Financial Services, Inc. Investors"
2020-01-10,"INVESTOR ALERT: Kirby McInerney LLP Announces an Investigation of Shareholder Claims Against Provident Financial Services, Inc."
2020-01-10,"INVESTOR ALERT: Law Offices of Howard G. Smith Continues Investigation on Behalf of Provident Financial Services, Inc. Investors"
2020-01-09,"INVESTIGATION REMINDER: The Schall Law Firm Announces it is Investigating Claims Against Provident Financial Services, Inc. and Encourages Investors with Losses to Contact the Firm"
2020-01-09,"Bronstein, Gewirtz & Grossman, LLC Announces Investigation of Provident Financial Services, Inc. (PFS)"
2020-01-09,"The Law Offices of Frank R. Cruz Announces Investigation on Behalf of Provident Financial Services, Inc. Investors (PFS)"
2020-01-08,"INVESTIGATION ALERT: The Schall Law Firm Announces it is Investigating Claims Against Provident Financial Services, Inc. and Encourages Investors with Losses to Contact the Firm"
