2020-12-23,"How Much Of Hope Bancorp, Inc. (NASDAQ:HOPE) Do Institutions Own?"
2020-12-16,"Where Do Hedge Funds Stand On Hope Bancorp, Inc. (HOPE)?"
2020-11-05,Hope Bancorp to Participate in the BofA Securities Future of Financial Services Conference 2020
2020-10-24,"Don't Race Out To Buy Hope Bancorp, Inc. (NASDAQ:HOPE) Just Because It's Going Ex-Dividend"
2020-10-23,"Results: Hope Bancorp, Inc. Beat Earnings Expectations And Analysts Now Have New Forecasts"
2020-10-21,"Hope Bancorp, Inc. (HOPE) Q3 2020 Earnings Call Transcript"
2020-10-21,"Hope Bancorp, Inc. to Host Earnings Call"
2020-10-20,Hope Bancorp Reports 2020 Third Quarter Financial Results
2020-10-20,Hope Bancorp (HOPE) Q3 Earnings and Revenues Surpass Estimates
2020-10-20,Hope Bancorp Declares Quarterly Cash Dividend of $0.14 Per Share
2020-10-20,Hope Bancorp Reports 2020 Third Quarter Financial Results
2020-10-13,"Hedge Funds Are Coming Back To Hope Bancorp, Inc. (HOPE)"
2020-10-13,Hope Bancorp (HOPE) Expected to Beat Earnings Estimates: Can the Stock Move Higher?
2020-10-06,"Hope Bancorp to Report 2020 Third Quarter Financial Results on Tuesday, October 20, 2020"
2020-08-10,"Did Hedge Funds Make The Right Call On Hope Bancorp, Inc. (HOPE) ?"
2020-08-03,"Do These 3 Checks Before Buying Hope Bancorp, Inc. (NASDAQ:HOPE) For Its Upcoming Dividend"
2020-07-31,"Hope Bancorp, Inc. (HOPE) Q2 2020 Earnings Call Transcript"
2020-07-30,Hope Bancorp (HOPE) Beats Q2 Earnings Estimates
2020-07-30,Hope Bancorp Declares Quarterly Cash Dividend of $0.14 Per Share
2020-07-30,Hope Bancorp Reports 2020 Second Quarter Financial Results
2020-07-29,A Look At Hope Bancorp's (NASDAQ:HOPE) Share Price Returns
2020-07-23,Analysts Estimate Hope Bancorp (HOPE) to Report a Decline in Earnings: What to Look Out for
2020-07-20,Hope Bancorp Announces New Dates for 2020 Second Quarter Financial Results and Conference Call
2020-07-14,Earnings Preview: Hope Bancorp (HOPE) Q2 Earnings Expected to Decline
2020-07-08,"Hope Bancorp to Report 2020 Second Quarter Financial Results on Tuesday, July 21, 2020"
2020-06-23,"Hope Bancorp, Inc. (HOPE): Are Hedge Funds Right About This Stock?"
2020-06-17,Edited Transcript of HOPE.OQ earnings conference call or presentation 29-Apr-20 4:30pm GMT
2020-06-03,Edited Transcript of HOPE earnings conference call or presentation 23-Jan-20 5:30pm GMT
2020-04-29,"Hope Bancorp, Inc. (HOPE) Q1 2020 Earnings Call Transcript"
2020-04-28,Hope Bancorp (HOPE) Q1 Earnings Lag Estimates
2020-04-28,Hope Bancorp Declares Quarterly Cash Dividend of $0.14 Per Share
2020-04-28,Hope Bancorp Reports 2020 First Quarter Financial Results
2020-04-25,"Is Hope Bancorp, Inc. (NASDAQ:HOPE) A Great Dividend Stock?"
2020-04-14,"Hope Bancorp to Report 2020 First Quarter Financial Results on Tuesday, April 28, 2020"
2020-04-14,Earnings Preview: Hope Bancorp (HOPE) Q1 Earnings Expected to Decline
2020-04-07,"Hedge Funds Have Never Been This Bullish On Hope Bancorp, Inc. (HOPE)"
2020-03-26,"How Does Hope Bancorp's (NASDAQ:HOPE) P/E Compare To Its Industry, After The Share Price Drop?"
2020-03-12,What Is Hope Bancorp's (NASDAQ:HOPE) P/E Ratio After Its Share Price Tanked?
2020-03-02,"How Does Hope Bancorp, Inc. (NASDAQ:HOPE) Affect Your Portfolio Volatility?"
2020-02-10,"Hope Bancorp to Participate in the 2020 Keefe, Bruyette & Woods Winter Financial Services Symposium"
2020-02-06,Hope Well Capital Corp. Enters into Letter of Intent for Qualifying Transaction with Loc8 Corp.
2020-02-01,"Hope Bancorp, Inc. (NASDAQ:HOPE) Looks Like A Good Stock, And It's Going Ex-Dividend Soon"
2020-01-31,"Is Hope Bancorp, Inc. (NASDAQ:HOPE) Excessively Paying Its CEO?"
2020-01-22,Hope Bancorp (HOPE) Q4 Earnings Surpass Estimates
2020-01-22,Hope Bancorp Declares Quarterly Cash Dividend of $0.14 Per Share
2020-01-22,Hope Bancorp Reports 2019 Fourth Quarter Financial Results
2020-01-15,Analysts Estimate Hope Bancorp (HOPE) to Report a Decline in Earnings: What to Look Out for
2020-01-01,"What Is Hope Bancorp, Inc.'s (NASDAQ:HOPE) Share Price Doing?"
2019-12-23,"Hope Bancorp to Announce 2019 Fourth Quarter Financial Results on Wednesday, January 22, 2020"
2019-12-12,"Is Hope Bancorp, Inc. (HOPE) A Good Stock To Buy?"
2019-12-05,Is Now The Time To Put Hope Bancorp (NASDAQ:HOPE) On Your Watchlist?
2019-12-03,Hope Bancorp Announces 10b5-1 Share Repurchase Plan
2019-11-18,Hope Bancorp to Participate in KBW West Coast Field Trip
2019-11-13,Is Hope Bancorp (HOPE) a Profitable Pick for Value Investors?
2019-11-06,"Do You Like Hope Bancorp, Inc. (NASDAQ:HOPE) At This P/E Ratio?"
2019-10-30,Hope Bancorp Announces Participation in Upcoming Investor Conferences
2019-10-28,"Is Hope Bancorp, Inc. (HOPE) A Good Stock To Buy?"
2019-10-25,Edited Transcript of HOPE earnings conference call or presentation 22-Oct-19 4:30pm GMT
2019-10-21,Hope Bancorp (HOPE) Tops Q3 Earnings and Revenue Estimates
2019-10-15,Hope Bancorp Declares Quarterly Cash Dividend of $0.14 Per Share
2019-10-14,Analysts Estimate Hope Bancorp (HOPE) to Report a Decline in Earnings: What to Look Out for
2019-10-07,"Should Hope Bancorp, Inc. (NASDAQ:HOPE) Be Part Of Your Dividend Portfolio?"
2019-10-01,"Hope Bancorp to Announce 2019 Third Quarter Financial Results on Monday, October 21, 2019"
2019-09-24,Hope Bancorp Appoints Retiring KPMG National Partner Joon K. Kim to Board of Directors
2019-09-11,"Does Hope Bancorp, Inc. (NASDAQ:HOPE) Have A High Beta?"
2019-08-28,Hope Bancorp to Participate in the Raymond James 2019 U.S. Bank Conference in Chicago
2019-08-16,"How Much Did Hope Bancorp, Inc.'s (NASDAQ:HOPE) CEO Pocket Last Year?"
2019-07-25,Edited Transcript of HOPE earnings conference call or presentation 17-Jul-19 4:30pm GMT
2019-07-20,"Read This Before Buying Hope Bancorp, Inc. (NASDAQ:HOPE) Shares"
2019-07-17,"Hope Bancorp, Inc. (HOPE) Q2 2019 Earnings Call Transcript"
2019-07-17,"Hope Bancorp, Inc. to Host Earnings Call"
2019-07-16,Hope Bancorp Announces $50 Million Stock Repurchase Program
2019-07-16,Hope Bancorp (HOPE) Lags Q2 Earnings and Revenue Estimates
2019-07-16,Hope Bancorp Reports 2019 Second Quarter Financial Results
2019-07-16,Hope Bancorp Declares Quarterly Cash Dividend of $0.14 Per Share
2019-07-09,Analysts Estimate Hope Bancorp (HOPE) to Report a Decline in Earnings: What to Look Out for
2019-06-26,"Hope Bancorp to Announce 2019 Second Quarter Financial Results on Tuesday, July 16, 2019"
2019-06-25,"Heres What Hedge Funds Think About Hope Bancorp, Inc. (HOPE)"
2019-06-24,"What Does Hope Bancorp, Inc.'s (NASDAQ:HOPE) Share Price Indicate?"
2019-06-24,"When Should You Buy Hope Bancorp, Inc. (NASDAQ:HOPE)?"
2019-06-12,Hope Well announces settlement with Payfare and provides update
2019-05-29,Hope Bancorp to Participate in the 2019 KBW U.S. Regional Leaders Bank Conference in London
2019-05-29,Volatility 101: Should Hope Bancorp (NASDAQ:HOPE) Shares Have Dropped 27%?
2019-05-27,Can Value Investors Consider Hope Bancorp (HOPE) Stock Now?
2019-05-23,Hope Bancorp Appoints Kevin S. Kim Chairman of the Board and Scott Yoon-Suk Whang as Lead Independent Director
2019-05-01,"Heres What Hedge Funds Think About Hope Bancorp, Inc. (HOPE)"
2019-04-19,Edited Transcript of HOPE earnings conference call or presentation 17-Apr-19 4:30pm GMT
2019-04-17,HOPE BANCORP INC (HOPE) Q1 2019 Earnings Call Transcript
2019-04-16,Hope Bancorp (HOPE) Q1 Earnings Match Estimates
2019-04-16,Hope Bancorp: 1Q Earnings Snapshot
2019-04-16,Hope Bancorp Declares Quarterly Cash Dividend of $0.14 Per Share
2019-04-16,Hope Bancorp Reports 2019 First Quarter Financial Results
2019-04-09,Analysts Estimate Hope Bancorp (HOPE) to Report a Decline in Earnings: What to Look Out for
2019-04-08,Hope Well to Resume Trading and Commences Action Against Payfare Inc.
2019-04-08,IIROC Trading Resumption - HOPE.P
2019-03-29,"Hope Bancorp to Announce 2019 First Quarter Financial Results on Tuesday, April 16, 2019"
2019-03-28,Hope Well Receives Termination Notice From Payfare
2019-03-22,Hope Well Provides Update on its Qualifying Transaction with Payfare
2019-03-12,This is Why Hope Bancorp (HOPE) is a Great Dividend Stock
2019-03-07,Top Ranked Income Stocks to Buy for March 7th
