2020-12-31,Better Buy: Welltower vs. Healthpeak Properties
2020-12-21,Healthpeak Properties (NYSE:PEAK) Long Term Shareholders are 13% In The Black
2020-12-19,"Where Do Hedge Funds Stand On Healthpeak Properties, Inc. (PEAK)?"
2020-12-18,Here's Why Healthpeak Properties Is Worth a Look Now
2020-12-13,3 REITs You Need in Your Real Estate Portfolio
2020-12-04,The Top New Health Care Buys of Larry Robbins' Firm
2020-12-02,Healthpeak (PEAK) Up 4% Since Last Earnings Report: Can It Continue?
2020-11-30,Healthpeak Properties Is Outmaneuvering Its REIT Peers
2020-11-16,Seth Klarman's Top 5 Buys of the Third Quarter
2020-11-13,Cohen & Steers Announces Changes to Realty Indexes
2020-11-04,"Healthpeak Properties, Inc. Just Missed Earnings With A Surprise Loss - Here Are Analysts Latest Forecasts"
2020-11-03,"Healthpeak Properties, Inc. (PEAK) Q3 2020 Earnings Call Transcript"
2020-11-03,"Healthpeak Properties, Inc. to Host Earnings Call"
2020-11-03,"Healthpeak (PEAK) Q3 FFO & Revenues Miss Estimates, NOI Down"
2020-11-02,Healthpeak (PEAK) Tops Q3 FFO Estimates
2020-11-02,Healthpeak Properties Reports Third Quarter 2020 Results
2020-10-30,"REITs to Watch for Q3 Earnings on Nov 2: SBAC, O, PEAK, VNO"
2020-10-30,What's in the Offing for Healthpeak (PEAK) in Q3 Earnings?
2020-10-12,DHC vs. PEAK: Which Stock Is the Better Value Option?
2020-10-10,3 Stocks to Buy With Dividends Yielding More Than 5%
2020-10-07,"Hedge Funds Losing Confidence In Healthpeak Properties, Inc. (PEAK)"
2020-10-02,3 Growth Stocks to Buy and Hold for the Next 50 Years
2020-09-28,Here's Why You Should Hold on to Healthpeak (PEAK) Stock Now
2020-09-25,"Need To Know: Healthpeak Properties, Inc. (NYSE:PEAK) Insiders Have Been Buying Shares"
2020-09-22,Healthpeak Properties to Report Third Quarter 2020 Financial Results and Host Conference Call/Webcast
2020-09-21,Healthpeak Properties (PEAK) Set for Additional Losses
2020-09-21,Healthpeak Properties (PEAK) Set for Additional Losses
2020-09-08,Healthpeak Properties to Present at BofA Securities 2020 Global Real Estate Virtual Conference
2020-09-03,Why Is Healthpeak (PEAK) Up 5.1% Since Last Earnings Report?
2020-08-25,Top Real Estate Stocks for September 2020
2020-08-21,Prognosis & Q2 Earnings Headlines of 3 Big Healthcare REITs
2020-08-11,"Healthpeak Properties, Inc.'s (NYSE:PEAK) Stock Is Rallying But Financials Look Ambiguous: Will The Momentum Continue?"
2020-08-11,"Healthpeak Properties, Inc.'s (NYSE:PEAK) Financials Are Too Obscure To Link With Current Share Price Momentum: What's In Store For the Stock?"
2020-08-05,"Healthpeak Properties, Inc. (PEAK) Q2 2020 Earnings Call Transcript"
2020-08-05,"Healthpeak (PEAK) Q2 FFO Meets Estimates, Revenues Miss"
2020-08-04,Healthpeak (PEAK) Q2 FFO Match Estimates
2020-08-04,Healthpeak Properties Reports Second Quarter 2020 Results
2020-08-04,Healthpeak Properties Declares Quarterly Cash Dividend on Common Stock
2020-07-29,Will Seniors Housing Woes Mar Healthpeak (PEAK) Q2 Earnings?
2020-07-25,Is Healthpeak Properties a Buy?
2020-07-14,Healthpeak Properties to Report Second Quarter 2020 Financial Results and Host Conference Call/Webcast
2020-07-13,"Did Hedge Funds Make The Right Call On Healthpeak Properties, Inc. (PEAK) ?"
2020-07-06,Healthpeak Properties Publishes its 9th Annual ESG Report
2020-06-23,Healthpeak Properties Announces Pricing of Tender Offer
2020-06-23,Healthpeak Properties Announces Early Tender Results of Tender Offer for Outstanding Notes
2020-06-10,Healthpeak Properties Floating $600 Million in Fresh Debt
2020-06-10,Healthpeak Prices $600M Senior Unsecured Notes at 99.125%
2020-06-09,Healthpeak Properties Announces Increase in Aggregate Maximum Tender Amount of Tender Offer for Outstanding Notes
2020-06-09,Healthpeak Properties Prices $600 Million of 2.875% Senior Unsecured Notes due 2031
2020-06-09,Healthpeak Properties Announces Tender Offer for Outstanding Notes
2020-06-08,"Healthpeak Properties, Inc. (PEAK): Hedge Funds Are Sticking Around"
2020-06-04,Why Is Healthpeak (PEAK) Up 14.9% Since Last Earnings Report?
2020-05-27,Healthpeak Properties to Present at Nareit's REITweek 2020 Investor Conference
2020-04-30,Healthpeak Properties Declares Quarterly Cash Dividend on Common Stock
2020-04-20,"Is Healthpeak Properties, Inc.'s (NYSE:PEAK) CEO Salary Justified?"
2020-04-13,Healthpeak Properties to Report First Quarter 2020 Financial Results and Host Conference Call/Webcast
2020-04-07,Healthpeak Properties COVID-19 Update
2020-03-24,Healthpeak Properties COVID-19 Update
2020-03-19,"Here is What Hedge Funds Think About Healthpeak Properties, Inc. (PEAK)"
2020-03-16,Healthpeak Properties COVID-19 Update
2020-03-05,Healthcare REITs: A Dose of Durable Dividends
2020-02-24,Healthpeak Properties to Present at Citi's 2020 Global Property CEO Conference
2020-02-11,Healthpeak Properties Reports Fourth Quarter and Year Ended 2019 Results
2020-02-11,Healthpeak Properties Updates SHOP Same-Store Policies
2020-01-28,"Is Healthpeak Properties, Inc.'s (NYSE:PEAK) 13% ROE Better Than Average?"
2020-01-20,"Barrow, Hanley, Mewhinney & Strauss Cuts Ties With MGM Growth Properties"
2020-01-15,Healthpeak Properties Announces Tax Treatment of 2019 Distributions
2020-01-14,Healthpeak Properties to Report Fourth Quarter and Year-End 2019 Financial Results and Host Conference Call/Webcast
2020-01-13,Healthpeak Announces Lease with Johnson & Johnson Subsidiary at The Shore at Sierra Point
2020-01-06,Justin Hill to Join Healthpeak as Senior Vice President - Medical Office Properties
2019-12-18,Healthpeak Announces Transactions Enhancing the Growth of its Three Core Businesses
2019-12-13,6 Guru Stocks Expanding Earnings
2019-12-12,"If You Had Bought Healthpeak Properties (NYSE:PEAK) Stock Five Years Ago, You'd Be Sitting On A 26% Loss, Today"
2019-12-11,Davis Cos. sells Alewife lab for $332.5M
2019-12-09,Healthpeak Announces Lease Amendment and Extension with Amgen in South San Francisco
2019-11-21,Healthpeak Properties Named a Top 50 ESG Company by Investor's Business Daily
2019-11-15,This REIT Could Hit New Highs in December
2019-11-06,Healthpeak Prices $750 Million of 3.000% Senior Unsecured Notes due 2030
2019-11-05,Healthpeak Appoints Sara Grootwassink Lewis to its Board of Directors
2019-11-04,"Healthpeak Prices Public Offering of 15,000,000 Shares of Common Stock on a Forward Basis"
2019-11-04,Healthpeak Announces Public Offering of Common Stock on a Forward Basis
2019-11-01,Edited Transcript of HCP earnings conference call or presentation 31-Oct-19 4:00pm GMT
2019-10-31,"HCP Tops Q3 FFO Estimate, Changes Name to Healthpeak Properties"
2019-10-31,MGP vs. HCP: Which Stock Is the Better Value Option?
2019-10-30,HCP (HCP) Q3 FFO and Revenues Surpass Estimates
2019-10-30,Healthpeak Reports Third Quarter 2019 Results
2019-10-30,HCP Changes Name to Healthpeak Properties and Announces Promotion of Scott Brinker to President and Chief Investment Officer Along with Other Leadership Promotions
2019-10-29,"Alexandria (ARE) Q3 FFO Meets Estimates, Rental Rate Grows"
2019-10-29,Will Growth in Seniors Housing Market Aid HCP's Q3 Earnings?
2019-10-28,"Does HCP, Inc.'s (NYSE:HCP) CEO Pay Compare Well With Peers?"
2019-10-23,HCP Declares Quarterly Cash Dividend on Common Stock
2019-10-15,"HCP, Inc. (HCP): Hedge Fund Sentiment Unchanged"
2019-10-11,Millennials Are Making Babies. These Stocks Could Bounce.
2019-10-08,JPMorgan: REITs 'Set Up Well In This Environment'
2019-10-03,HCP to Report Third Quarter 2019 Financial Results and Host Conference Call/Webcast
2019-10-03,5 REIT Stocks for Your Short-Term Watchlist
2019-10-03,HCP Announces Strategic Portfolio Trades With Brookdale
2019-10-01,HCP Upgraded by Fitch Ratings to BBB+ with Stable Outlook
2019-10-01,HCP Announces Series of Mutually Beneficial Transactions with Brookdale
2019-09-26,Should You Be Adding HCP (NYSE:HCP) To Your Watchlist Today?
