2020-12-18,How Much Did Carter's' (NYSE:CRI) CEO Pocket Last Year?
2020-11-22,"When Should You Buy Carter's, Inc. (NYSE:CRI)?"
2020-11-11,"Carters Sparks Holiday Cheer With a Countdown to the Holidays Featuring Leslie Odom, Jr., Nicolette Robinson and Whitney Port"
2020-11-10,"Was The Smart Money Right About Piling Into Carters, Inc. (CRI)?"
2020-10-27,"Earnings Beat: Carter's, Inc. Just Beat Analyst Forecasts, And Analysts Have Been Updating Their Models"
2020-10-26,"Carter's (CRI) Q3 Earnings Surpass Estimates, Sales Miss"
2020-10-25,"A Closer Look At Carter's, Inc.'s (NYSE:CRI) Impressive ROE"
2020-10-23,Recap: Carter's Q3 Earnings
2020-10-23,"Carters, Inc. Reports Third Quarter Fiscal 2020 Results"
2020-10-22,Carter's Earnings: A Preview
2020-10-20,Here's How Carter's (CRI) Looks Just Ahead of Q3 Earnings
2020-10-19,"Carters, Inc. to Report Third Quarter Fiscal 2020 Results on Friday, October 23, 2020"
2020-10-16,"Carters Launches From Santa with Love, a First-of-Its-Kind Virtual Experience with Cameo to Bring Holiday Magic Directly to Families"
2020-09-23,5 Retail Companies Trading Below the GF Value Line
2020-09-22,Should Value Investors Consider Carter's (CRI) Stock Now?
2020-09-14,"Hedge Funds Are Coming Back To Carters, Inc. (CRI)"
2020-09-07,"These 3 Strong Buy Retail Stocks Look Compelling, Say Analysts"
2020-09-02,"Carters, Inc. Announces Participation at the Goldman Sachs 27th Annual Global Retailing Conference"
2020-07-27,Edited Transcript of CRI earnings conference call or presentation 24-Jul-20 12:30pm GMT
2020-07-27,Top 2nd-Quarter Buys of the Smead Value Fund
2020-07-24,Recap: Carter's Q2 Earnings
2020-07-24,"Carters, Inc. Reports Second Quarter Fiscal 2020 Results"
2020-07-23,Will Carter's (NYSE:CRI) Multiply In Value Going Forward?
2020-07-17,"Did Hedge Funds Make The Right Call On Carters, Inc. (CRI) ?"
2020-07-16,"Carters, Inc. to Report Second Quarter Fiscal 2020 Results on Friday, July 24, 2020"
2020-07-15,2Q 2020: To Hell and Back
2020-06-27,"A Look At The Fair Value Of Carter's, Inc. (NYSE:CRI)"
2020-06-16,"Hedge Funds Are Buying Carters, Inc. (CRI)"
2020-05-20,Carters and Kelly Clarkson to Host the Ultimate Virtual Baby Shower to Celebrate Expectant Moms During Unexpected Times
2020-05-19,Carters (CRI) Will Emerge Stronger From the COVID-19 Crisis
2020-05-06,"Carters, Inc. Announces Change to a Virtual Meeting Format for 2020 Annual Meeting of Shareholders on May 14, 2020"
2020-05-06,"Carters, Inc. Announces Upsize and Pricing of Senior Notes Offering"
2020-05-06,William Carter Company (The) -- Moody's assigns Ba2 to Carter's proposed notes; affirms Ba1 CFR with stable outlook
2020-05-06,"Carter's (CRI) Stock Down on Q1 Loss, Sales Surpass Estimates"
2020-05-06,"Carters, Inc. Announces Proposed Senior Notes Offering"
2020-05-06,Edited Transcript of CRI earnings conference call or presentation 5-May-20 12:30pm GMT
2020-05-05,Carter's Inc (CRI) Q1 2020 Earnings Call Transcript
2020-05-05,Key Takeaways From Carter's 1st-Quarter Results
2020-05-05,Recap: Carter's Q1 Earnings
2020-05-05,"Carters, Inc. Reports First Quarter Fiscal 2020 Results"
2020-05-02,Highlights From Palm Valley Capital Funds 2020 Investor Letter
2020-05-01,"Carters, Inc. to Report First Quarter Fiscal 2020 Results on Tuesday, May 5, 2020"
2020-04-28,Earnings Preview: Carter's (CRI) Q1 Earnings Expected to Decline
2020-04-16,Carter's is a Wells Fargo 'top idea' as baby apparel has proven to fare well in an economic downturn
2020-04-14,These companies have laid off or furloughed employees in Tampa Bay because of coronavirus
2020-04-14,U.S. funds that beat market plunge seek recession-proof stocks
2020-04-09,These companies have laid off or furloughed employees in Tampa Bay because of coronavirus
2020-04-07,Carter's (CRI) Extends Store Closure on Coronavirus Concerns
2020-04-06,"Children's clothing chain Carter's furloughs all store employees, takes additional steps due to COVID-19"
2020-04-06,Carter's furloughed all store employees as temporary closures were extended
2020-04-06,"Carters, Inc. Updates Actions Taken to Address COVID-19 Pandemic"
2020-04-05,"Is Carters, Inc. (CRI) Going to Burn These Hedge Funds?"
2020-03-31,"Atlanta investment firm founder: 'Well look back on this as a 1,000-year flood'"
2020-03-26,Atlanta children's clothing maker borrows $750 million due to coronavirus disruptions
2020-03-26,"Carters, Inc. Announces Actions Taken to Address COVID-19 Outbreak"
2020-03-24,5 Predictable Stocks With a Margin of Safety
2020-03-16,52-Week Company Lows
2020-03-15,"Boasting A 30% Return On Equity, Is Carter's, Inc. (NYSE:CRI) A Top Quality Stock?"
2020-03-10,"Coca-Cola, Newell Brands among Georgia companies reporting COVID-19 impact"
2020-03-09,"Carters, Inc. Announces Participation at the Bank of America Consumer & Retail Technology Conference"
2020-02-26,Top Emory biotech expert on coronavirus: 'Efforts should be made to keep business on track'
2020-02-26,The Top 5 4th-Quarter Buys of Philippe Laffont
2020-02-26,Why Carter's Has Growth Potential
2020-02-26,"Carter's, Inc. Yearly Results: Here's What Analysts Are Forecasting For Next Year"
2020-02-25,"Company News for Feb 25, 2020"
2020-02-25,"Carter's (CRI) Q4 Earnings &amp; Sales Miss Estimates, Stock Down"
2020-02-24,Edited Transcript of CRI earnings conference call or presentation 24-Feb-20 1:30pm GMT
2020-02-24,Carter's (CRI) Lags Q4 Earnings Estimates
2020-02-24,Carter's stock falls as profit miss offsets in-line sales and 20% dividend hike
2020-02-24,"Carter's, Inc. to Host Earnings Call"
2020-02-24,"Carters, Inc. Reports Fourth Quarter and Fiscal 2019 Results"
2020-02-20,Here's How Carter's (CRI) is Placed Ahead of Q4 Earnings
2020-02-19,"How Much Did Carter's, Inc.'s (NYSE:CRI) CEO Pocket Last Year?"
2020-02-14,"Carters, Inc. to Report Fourth Quarter and Fiscal Year 2019 Results on Monday, February 24, 2020"
2020-01-28,If You Had Bought Carter's (NYSE:CRI) Shares Five Years Ago You'd Have Made 29%
2020-01-09,Here's Why Carter's (CRI) Offers a Balanced Risk-Reward Now
2020-01-06,"What Does Carter's, Inc.'s (NYSE:CRI) Share Price Indicate?"
2019-12-18,Skechers will benefit from the U.S.-China trade deal: UBS
2019-12-15,"Is Carter's, Inc. (NYSE:CRI) A Smart Choice For Dividend Investors?"
2019-12-07,"Should You Avoid Carters, Inc. (CRI)?"
2019-11-27,"Carter's, Inc. (NYSE:CRI) Passed Our Checks, And It's About To Pay A US$0.50 Dividend"
2019-11-26,Carter's: The Nike of Children's Apparel
2019-11-22,2 High-Yield Stocks Declare Dividends
2019-11-21,"Carters, Inc. Announces Quarterly Dividend"
2019-11-19,Carter's (CRI) Up 17% in 6 Months: Will the Momentum Prevail?
2019-11-14,Carters Expands Preemie Collection
2019-11-08,"Estimating The Intrinsic Value Of Carter's, Inc. (NYSE:CRI)"
2019-10-31,Edited Transcript of CRI earnings conference call or presentation 24-Oct-19 12:30pm GMT
2019-10-25,"Hedge Funds Started Buying Carters, Inc. (CRI) Again"
2019-10-24,"Carter's (CRI) Beats on Q3 Earnings &amp; Sales, Ups 2019 View"
2019-10-24,Carter's (CRI) Q3 Earnings and Revenues Surpass Estimates
2019-10-24,"Need To Know: Carter's, Inc. (NYSE:CRI) Insiders Have Been Selling Shares"
2019-10-24,"Carters, Inc. Reports Third Quarter Fiscal 2019 Results"
2019-10-22,Royal Caribbean (RCL) to Report Q3 Earnings: What's in Store?
2019-10-22,Can Carter's (CRI) Retain Its Positive Earnings Trend in Q3?
2019-10-21,Things to Know Ahead of Steven Madden's (SHOO) Q3 Earnings
2019-10-18,"Carters, Inc. to Report Third Quarter Fiscal 2019 Results on Thursday, October 24, 2019"
2019-10-18,Things You Need to Know Before Crocs' (CROX) Q3 Earnings
2019-10-17,Carter's (CRI) to Report Q3 Results: Wall Street Expects Earnings Growth
2019-10-15,Robust Base Business to Drive Pool Corp's (POOL) Q3 Earnings
