2021-01-04,"OReilly Automotive, Inc. Announces Dates for Its Fourth Quarter and Full-Year 2020 Earnings Release and Conference Call"
2021-01-03,10 Best Auto-Part Stocks To Buy For 2021
2020-12-28,How Much Does O'Reilly Automotive's (NASDAQ:ORLY) CEO Make?
2020-12-10,"Best Buys Winning Streak Is Ending and Its Stock Is Now a Sell, Says Goldman"
2020-12-08,AutoZone Had Double-Digit Same-Store Sales Growth. Why Its Stock Is Dropping Anyway.
2020-12-07,Is ORLY A Good Stock To Buy Now?
2020-12-02,"Is It Time To Consider Buying O'Reilly Automotive, Inc. (NASDAQ:ORLY)?"
2020-11-29,1 Stock I'm Never Selling
2020-11-06,"What Kind Of Shareholders Hold The Majority In O'Reilly Automotive, Inc.'s (NASDAQ:ORLY) Shares?"
2020-10-30,CarParts.com vs OReilly: Which Auto Retailer Is Poised To Rally Ahead?
2020-10-30,O'Reilly Automotive Inc (ORLY) Q3 2020 Earnings Call Transcript
2020-10-29,"O'Reilly Automotive, Inc. to Host Earnings Call"
2020-10-29,OReilly Bumps Up Share Buyback Plan By $1B After  3Q Profit Beat
2020-10-28,O'Reilly Automotive (ORLY) Tops Q3 Earnings and Revenue Estimates
2020-10-28,"OReilly Automotive, Inc. Reports Third Quarter 2020 Results and Announces Additional $1.0 Billion Share Repurchase Authorization"
2020-10-27,O'Reilly Automotive Earnings Preview
2020-10-27,Why O'Reilly (ORLY) Might Surprise This Earnings Season
2020-10-27,O'Reilly (ORLY) to Report Q3 Earnings: What's in the Cards?
2020-10-22,Were Hedge Funds Right About OReilly Automotive Inc (ORLY)?
2020-10-21,O'Reilly Automotive (ORLY) Earnings Expected to Grow: What to Know Ahead of Next Week's Release
2020-10-21,Everythings Coming Up Roses for Auto Stocks
2020-10-20,Analysts Press the Buy Button on These 3 Under-the-Radar Stocks
2020-10-19,"20 stocks to help you play a big restocking of consumer goods, according to Jefferies"
2020-10-19,Raymond James Upgrades O'Reilly Automotive On Bright Prospects
2020-10-14,Auto Parts Retailer O'Reilly Automotive Benefits From Rising Demand Of Preowned Cars
2020-10-12,The Election Is Coming. Here Are Four Retailers to Buy.
2020-10-07,Can O'Reilly Automotive (ORLY) Keep the Earnings Surprise Streak Alive?
2020-10-06,G.research 44th Annual Auto Symposium - Virtual
2020-10-06,"Buy Advance Auto Parts Stock, J.P. Morgan Says. Heres Why."
2020-10-01,"Auto Parts Retailer AutoZone Shows Rising Relative Strength, Nears 52-Week High"
2020-10-01,"OReilly Automotive, Inc. Announces Dates for Its  Third Quarter 2020 Earnings Release and Conference Call"
2020-09-29,3 Top Stocks to Recession-Proof Your Portfolio
2020-09-22,AutoZone Earnings Race Past Views As Coronavirus Fuels Auto Parts Demand
2020-09-19,These Are The 5 Best Stocks To Buy And Watch Now
2020-09-17,3 Reasons Why Growth Investors Shouldn't Overlook O'Reilly Automotive (ORLY)
2020-09-14,Stocks With Rising Relative Strength: AutoZone
2020-09-09,What Makes O'Reilly Automotive (ORLY) a Strong Momentum Stock: Buy Now?
2020-09-08,"O'Reilly Automotive, IBD Stock Of The Day, Nears Buy Point As Covid Upends Car Market"
2020-09-08,O'reilly Doesn't Need Repairs
2020-08-31,O'Reilly Automotive (ORLY) is an Incredible Growth Stock: 3 Reasons Why
2020-08-28,Should I Buy OReilly Automotive Inc (ORLY)?
2020-08-28,O'Reilly Automotive (ORLY) Down 3.7% Since Last Earnings Report: Can It Rebound?
2020-08-25,Why OReilly Automotive (ORLY) Stock is a Compelling Investment Case
2020-08-13,3 Reasons Why Growth Investors Shouldn't Overlook O'Reilly Automotive (ORLY)
2020-07-31,Can O'Reilly Automotive Continue to Fire on All Cylinders?
2020-07-30,O'Reilly Automotive Inc (ORLY) Q2 2020 Earnings Call Transcript
2020-07-30,ROCE Insights For O'Reilly Automotive
2020-07-29,Recap: O'Reilly Automotive Q2 Earnings
2020-07-29,O'Reilly Automotive (ORLY) Beats Q2 Earnings and Revenue Estimates
2020-07-29,"OReilly Automotive, Inc. Reports Second Quarter 2020 Results"
2020-07-28,O'Reilly Automotive Earnings Preview
2020-07-23,O'Reilly (ORLY) to Report Q2 Earnings: What's in the Offing?
2020-07-22,O'Reilly Automotive (ORLY) Expected to Beat Earnings Estimates: What to Know Ahead of Q2 Release
2020-07-20,Used-Car Prices Are Rising. Its Good News for Lots of Stocks.
2020-07-08,Were Hedge Funds Right About Piling Into OReilly Automotive Inc (ORLY)?
2020-07-06,Auto retail stocks taking off amid COVID-19 pandemic
2020-07-06,These 5 Stocks Sport Impressive Interest Coverage Ratio
2020-07-01,"OReilly Automotive, Inc. Announces Dates for its Second Quarter 2020 Earnings Release and Conference Call"
2020-06-18,3 Growing Retailers With Cash to Spare That Arent Amazon
2020-06-11,Edited Transcript of ORLY earnings conference call or presentation 23-Apr-20 3:00pm GMT
2020-06-05,5 Profitable Companies With a Margin of Safety
2020-06-02,Why This Key Indicator Bodes Well for OReilly Automotive
2020-06-02,Expansion Efforts to Aid O'Reilly (ORLY) Amid Coronavirus Scare
2020-05-28,O'Reilly Automotive Shows Rising Relative Strength
2020-05-26,Hedge Funds Started Cashing Out Of OReilly Automotive Inc (ORLY)
2020-05-22,"David Abrams Sells O'Reilly Automotive, Buys TransDigm and Energy Transfer"
2020-05-22,Why Is O'Reilly Automotive (ORLY) Up 7.9% Since Last Earnings Report?
2020-05-15,Abrams Capital Management Buys Moats in March Selloff
2020-05-06,"Why Shares of O'Reilly Automotive, AutoZone, and LKQ Surged in April"
2020-04-29,Why Polen Global Growth is Bearish on  OReilly Automotive (ORLY) Stock?
2020-04-28,"Polen Capital is Bullish on Autodesk (ADSK), Bearish on OReilly Automotive (ORLY)"
2020-04-23,Were Hedge Funds Right About Piling Into OReilly Automotive Inc (ORLY)?
2020-04-23,"O'Reilly (ORLY) Tops Q1 Earnings Estimates, Scraps '20 View"
2020-04-23,"O'Reilly's Quarterly Results Do Not Surprise, Suggesting Its Considerable Strengths Remain"
2020-04-23,"O'Reilly Automotive, Inc. to Host Earnings Call"
2020-04-23,OReilly Auto Reports Better-Than-Feared Q1 Earnings; Shares Up 3%
2020-04-22,O'Reilly Automotive (ORLY) Q1 Earnings and Revenues Top Estimates
2020-04-22,O'Reilly Automotive Inc -- Moody's announces completion of a periodic review of ratings of O'Reilly Automotive Inc
2020-04-22,"OReilly Automotive, Inc. Reports First Quarter 2020 Results and Provides Business Update in Response to COVID-19"
2020-04-21,"Delta, AT&T earnings: What to know in markets Wednesday"
2020-04-20,6 Undervalued Cyclical Companies Growing Earnings
2020-04-20,"OReilly Automotive, Inc. Announces Virtual-Only Format for 2020 Annual Meeting of Shareholders"
2020-04-20,O'Reilly (ORLY) to Post Q1 Earnings: What's in the Offing?
2020-04-20,Ave Maria Growth Fund Excels With Do-Good Stocks
2020-04-19,What Is O'Reilly Automotive's (NASDAQ:ORLY) P/E Ratio After Its Share Price Rocketed?
2020-04-16,"At US$354, Is It Time To Put O'Reilly Automotive, Inc. (NASDAQ:ORLY) On Your Watch List?"
2020-04-15,Earnings Preview: O'Reilly Automotive (ORLY) Q1 Earnings Expected to Decline
2020-04-08,Morgan Stanley: 2 Stocks to Consider Buying (And 1 to Forget)
2020-04-06,AZO and ORLY: Which one is a better buy?
2020-04-03,When Low Book Value Can Be Misleading
2020-04-01,"OREILLY AUTOMOTIVE, INC. ANNOUNCES DATES FOR ITS FIRST QUARTER 2020 EARNINGS RELEASE AND CONFERENCE CALL"
2020-03-31,5 Predictable Retailers With a Margin of Safety
2020-03-17,Is Now The Time To Put O'Reilly Automotive (NASDAQ:ORLY) On Your Watchlist?
2020-03-09,"These 3 stocks are rising during a 2,000-point Dow drubbing"
2020-03-09,"Just 10 S&P 500 stocks are higher, including Cabot Oil, Walmart and AutoZone"
2020-03-06,Hedge Funds Have Never Been This Bullish On OReilly Automotive Inc (ORLY)
2020-03-06,Why Is O'Reilly Automotive (ORLY) Down 9.2% Since Last Earnings Report?
2020-02-13,Auto Parts Stocks Could Have a Brighter Road Ahead
2020-02-12,"Despite Trump trade deal, many S&P 500 firms are still concerned about tariffs, economic slowdown"
2020-02-11,Edited Transcript of ORLY earnings conference call or presentation 6-Feb-20 4:00pm GMT
