2021-01-07,CVGI vs. NIU: Which Stock Is the Better Value Option?
2021-01-05,Here's Why Momentum Investors Will Love Commercial Vehicle Group (CVGI)
2021-01-05,New Strong Buy Stocks for January 5th
2021-01-05,CVG Announces Participation In The Sidoti Winter 2021 Virtual Conference
2020-12-28,"Is There An Opportunity With Commercial Vehicle Group, Inc.'s (NASDAQ:CVGI) 21% Undervaluation?"
2020-12-22,"The Zacks Analyst Blog Highlights: RYAM, CVGI, Apergy, Adient and Michaels"
2020-12-21,Vaccines to Fuel Santa Claus Rally: 5 Stock Picks
2020-12-11,Is CVGI A Good Stock To Buy Now?
2020-12-09,What Makes Commercial Vehicle Group (CVGI) a Strong Momentum Stock: Buy Now?
2020-11-19,Sidoti Virtual Microcap Investor Conference
2020-11-18,CVG Announces Participation In The Bank Of America Leveraged Finance Virtual Conference
2020-11-13,"Commercial Vehicle Group, Inc. Beat Analyst Profit Forecasts, And Analysts Have New Estimates"
2020-11-09,Commercial Vehicle Group Inc (CVGI) Q3 2020 Earnings Call Transcript
2020-11-09,"Commercial Vehicle Group, Inc. to Host Earnings Call"
2020-11-09,Commercial Vehicle Group (CVGI) Q3 Earnings and Revenues Top Estimates
2020-11-09,Commercial Vehicle Group: Q3 Earnings Insights
2020-11-09,CVG Reports Third Quarter 2020 Results
2020-11-05,CVG Announces Participation In The Sidoti Microcap Virtual Investor Conference
2020-11-02,Analysts Estimate Commercial Vehicle Group (CVGI) to Report a Decline in Earnings: What to Look Out for
2020-10-26,CVG Announces Third Quarter 2020 Conference Call
2020-10-17,Can You Imagine How Commercial Vehicle Group's (NASDAQ:CVGI) Shareholders Feel About The 49% Share Price Increase?
2020-10-13,Velodyne Lidar (VLDR) in Focus: Stock Moves 5.4% Higher
2020-10-05,CVG Announces the Appointment of Christopher H. Bohnert as Chief Financial Officer and Chief Accounting Officer
2020-09-23,"Commercial Vehicle Group's Shares March Higher, Can It Continue?"
2020-09-22,CVG Reports 2020 Update and Progress
2020-09-08,"ROSEN, TRUSTED AND LEADING INVESTOR COUNSEL, Continues to Investigate Securities Claims Against Commercial Vehicle Group, Inc. - CVGI"
2020-09-04,What Makes Commercial Vehicle Group (CVGI) a New Strong Buy Stock
2020-08-10,Commercial Vehicle Group Inc (CVGI) Q2 2020 Earnings Call Transcript
2020-08-10,"Commercial Vehicle Group (CVGI) Reports Q2 Loss, Tops Revenue Estimates"
2020-08-10,Recap: Commercial Vehicle Group Q2 Earnings
2020-08-10,Commercial Vehicle Group Announces Second Quarter 2020 Results
2020-08-03,Analysts Estimate Commercial Vehicle Group (CVGI) to Report a Decline in Earnings: What to Look Out for
2020-07-29,Commercial Vehicle Group Announces Second Quarter 2020 Conference Call
2020-07-19,"SHAREHOLDER REMINDER for CVGI, TCMD, and BLU: Block & Leviton LLP Reminds Investors of Investigations for Potential Violations of the Federal Securities Laws"
2020-07-15,Commercial Vehicle Group Announces Plant Consolidation to Optimize Cost Structure and Enhance Aftermarket Growth
2020-07-13,"Commercial Vehicle Group, Inc. Investors Who Have Suffered Losses Encouraged To Contact Kehoe Law Firm, P.C."
2020-07-10,"ROSEN, A TOP RANKED FIRM, Continues to Investigate Securities Claims Against Commercial Vehicle Group, Inc.  CVGI"
2020-07-06,"Commercial Vehicle Group, Inc. -- Moody's announces completion of a periodic review of ratings of Commercial Vehicle Group, Inc."
2020-06-25,Commercial Vehicle Group Adopts A Limited Duration Stockholder Rights Plan
2020-06-25,"Hedge Funds Arent Crazy About Commercial Vehicle Group, Inc. (CVGI) Anymore"
2020-06-23,"SHAREHOLDER REMINDER for CVGI, TSQ, and TCMD: Block & Leviton LLP Reminds Investors of Investigations for Potential Violations of the Federal Securities Laws"
2020-06-19,"Glancy Prongay & Murray LLP, a Leading Securities Fraud Law Firm, Continues Investigation of Commercial Vehicle Group, Inc. (CVGI) on Behalf of Investors"
2020-06-08,"REMINDER: Block & Leviton Investigating Commercial Vehicle Group, Inc. for Possible Securities Laws Violations; Investors Who Lost Money Should Contact the Firm"
2020-05-29,"Glancy Prongay & Murray LLP, a National Class Action Law Firm, Continues Investigation of Commercial Vehicle Group, Inc. (CVGI) on Behalf of Investors"
2020-05-29,"ROSEN, NATIONALLY REGARDED INVESTOR COUNSEL, Continues to Investigate Securities Claims Against Commercial Vehicle Group, Inc.  CVGI"
2020-05-29,"The Law Offices of Frank R. Cruz Continues Its Investigation on Behalf of Commercial Vehicle Group, Inc. Investors (CVGI)"
2020-05-29,Edited Transcript of CVGI earnings conference call or presentation 19-May-20 12:00pm GMT
2020-05-28,"INVESTOR ALERT: Law Offices of Howard G. Smith Continues Its Investigation of Commercial Vehicle Group, Inc. (CVGI) on Behalf of Investors"
2020-05-28,Commercial Vehicle Group Announces Participation In UBS Global Industrials And Transportation Virtual Conference
2020-05-19,Commercial Vehicle Group Inc (CVGI) Q1 2020 Earnings Call Transcript
2020-05-18,Commercial Vehicle Group (CVGI) Q1 Earnings Beat Estimates
2020-05-18,Commercial Vehicle Group Announces First Quarter 2020 Results
2020-05-18,Commercial Vehicle Group Announces First Quarter 2020 Conference Call
2020-05-15,"Commercial Vehicle Group, Inc. -- Moody's confirms Commercial Vehicle Group's ratings, including B2 senior secured rating; outlook negative"
2020-05-12,"REMINDER: Block & Leviton Investigating Commercial Vehicle Group, Inc. for Possible Securities Laws Violations; Investors Who Lost Money Should Contact the Firm"
2020-05-11,Commercial Vehicle Group Amends Credit Agreements To Provide Increased Flexibility
2020-05-05,"INVESTOR ALERT: Law Offices of Howard G. Smith Continues Its Investigation of Commercial Vehicle Group, Inc. (CVGI) on Behalf of Investors"
2020-05-04,"Glancy Prongay & Murray LLP, a Leading Securities Fraud Law Firm, Continues Investigation of Commercial Vehicle Group, Inc. (CVGI) on Behalf of Investors"
2020-05-04,Those Who Purchased Commercial Vehicle Group (NASDAQ:CVGI) Shares A Year Ago Have A 76% Loss To Show For It
2020-04-30,"REMINDER: Block & Leviton Investigating Commercial Vehicle Group, Inc. for Possible Securities Laws Violations; Investors Who Lost Money Should Contact the Firm"
2020-04-28,Commercial Vehicle Group Announces Preliminary Financial Results For First Quarter 2020 And Provides A COVID-19 Business Update
2020-04-27,Earnings Preview: Commercial Vehicle Group (CVGI) Q1 Earnings Expected to Decline
2020-04-17,"Block & Leviton Investigates Commercial Vehicle Group, Inc. for Possible Securities Laws Violations; Investors Who Lost Money Should Contact the Firm"
2020-04-16,"ROSEN, A RANKED AND LEADING LAW FIRM, Continues to Investigate Securities Claims Against Commercial Vehicle Group, Inc.  CVGI"
2020-04-13,Commercial Vehicle Group Announces Actions In Response To COVID-19 Pandemic
2020-04-10,"CVGI LOSS NOTICE: ROSEN, A TOP FIRM, Continues to Investigate Securities Claims Against Commercial Vehicle Group, Inc.; Encourages Investors With Large Losses to Contact Firm  CVGI"
2020-04-03,Edited Transcript of CVGI earnings conference call or presentation 17-Mar-20 12:00pm GMT
2020-03-31,"ONGOING INVESTIGATION NOTICE: The Schall Law Firm Announces it is Investigating Claims Against Commercial Vehicle Group, Inc. and Encourages Investors with Losses to Contact the Firm"
2020-03-31,"CVGI LOSS NOTICE: ROSEN, A TOP RANKED FIRM, Continues to Investigate Securities Claims Against Commercial Vehicle Group, Inc.; Encourages Investors with Large Losses to Contact Firm - CVGI"
2020-03-27,"IMPORTANT INVESTOR ALERT: The Schall Law Firm Announces it is Investigating Claims Against Commercial Vehicle Group, Inc. and Encourages Investors with Losses to Contact the Firm"
2020-03-26,"TI Group Automotive Systems L.L.C. -- Moody's places ratings of 25 US auto and commercial vehicle parts suppliers, and certain logistics providers under review for downgrade"
2020-03-26,The Law Offices of Frank R. Cruz Continues Its Investigation on Behalf of Commercial Vehicle Group Inc. Investors (CVGI)
2020-03-25,"ROSEN, NATIONAL INVESTOR COUNSEL, Continues to Investigate Securities Claims Against Commercial Vehicle Group, Inc.  CVGI"
2020-03-25,"INVESTOR ALERT: Law Offices of Howard G. Smith Continues Investigation of Commercial Vehicle Group, Inc. (CVGI) on Behalf of Investors"
2020-03-25,"SHAREHOLDER ACTION NOTICE: The Schall Law Firm Announces it is Investigating Claims Against Commercial Vehicle Group, Inc. and Encourages Investors with Losses to Contact the Firm"
2020-03-25,"CVGI Shareholder Alert: Bronstein, Gewirtz & Grossman, LLC Notifies Shareholders of Investigation of Commercial Vehicle Group, Inc. and Encourages Investors to Contact the Firm"
2020-03-25,"Commercial Vehicle Group Announces The Appointment of James R. Ray, Jr. To Board of Directors"
2020-03-24,"Glancy Prongay & Murray LLP, a Leading Securities Fraud Law Firm, Continues Investigation of Commercial Vehicle Group, Inc. (CVGI) on Behalf of Investors"
2020-03-24,"CVGI Shareholder Alert: Bronstein, Gewirtz & Grossman, LLC Notifies Shareholders of Investigation of Commercial Vehicle Group, Inc. and Encourages Investors to Contact the Firm"
2020-03-23,Commercial Vehicle Group Announces CEO Transition
2020-03-20,"INVESTIGATION REMINDER: The Schall Law Firm Announces it is Investigating Claims Against Commercial Vehicle Group, Inc. and Encourages Investors with Losses to Contact the Firm"
2020-03-20,"ROSEN, A LEADING LAW FIRM, Continues to Investigate Securities Claims Against Commercial Vehicle Group, Inc.  CVGI"
2020-03-20,"How Does Commercial Vehicle Group's (NASDAQ:CVGI) P/E Compare To Its Industry, After The Share Price Drop?"
2020-03-20,"IMPORTANT INVESTOR ALERT: The Schall Law Firm Announces it is Investigating Claims Against Commercial Vehicle Group, Inc. and Encourages Investors with Losses to Contact the Firm"
2020-03-19,"COMMERCIAL VEHICLE GROUP ALERT: Bragar Eagel & Squire, P.C. is Investigating Commercial Vehicle Group, Inc. on Behalf of Stockholders and Encourages Investors to Contact the Firm"
2020-03-18,"IMPORTANT SHAREHOLDER NOTICE: The Schall Law Firm Announces it is Investigating Claims Against Commercial Vehicle Group, Inc. and Encourages Investors with Losses to Contact the Firm"
2020-03-18,"ROSEN, A GLOBALLY RECOGNIZED LAW FIRM, Continues to Investigate of Securities Claims Against Commercial Vehicle Group, Inc.  CVGI"
2020-03-18,"INVESTIGATION ALERT: The Schall Law Firm Announces it is Investigating Claims Against Commercial Vehicle Group, Inc. and Encourages Investors with Losses to Contact the Firm"
2020-03-18,"EQUITY ALERT: Rosen Law Firm Announces Investigation of Securities Claims Against Commercial Vehicle Group, Inc.  CVGI"
2020-03-17,The Law Offices of Frank R. Cruz Announces Investigation on Behalf of Commercial Vehicle Group Inc. Investors (CVGI)
2020-03-17,"INVESTOR ALERT: Law Offices of Howard G. Smith Announces Investigation of Commercial Vehicle Group, Inc. (CVGI) on Behalf of Investors"
2020-03-17,"SHAREHOLDER ALERT: Pomerantz Law Firm Investigates Claims on Behalf of Investors of Commercial Vehicle Group, Inc.  CVGI"
2020-03-17,"Glancy Prongay & Murray LLP, a Leading Securities Fraud Law Firm, Announces Investigation of Commercial Vehicle Group, Inc. (CVGI) on Behalf of Investors"
2020-03-17,"Commercial Vehicle Group, Inc. to Host Earnings Call"
2020-03-16,Commercial Vehicle Group Announces Fourth Quarter and Fiscal Year 2019 Results
2020-03-10,Chuck Royce's Firm Sails Away With OneWater Marine
2020-03-06,Commercial Vehicle Group Announces Fourth Quarter And Fiscal Year 2019 Conference Call
2020-03-04,Commercial Vehicle Group Announces Participation In Triennial CONEXPO-CON/AGG Show
2020-03-02,"Does Commercial Vehicle Group, Inc.'s (NASDAQ:CVGI) P/E Ratio Signal A Buying Opportunity?"
2020-01-24,"Is Commercial Vehicle Group, Inc.'s (NASDAQ:CVGI) CEO Being Overpaid?"
