2021-01-07,"Buy Raymond James Ahead of Earnings, 56% Upside to Stock in Bull Case: Morgan Stanley"
2020-12-30,"Raymond James Financial, Inc. (NYSE:RJF) Passed Our Checks, And It's About To Pay A US$0.39 Dividend"
2020-12-30,Can Raymond James Manage Pricing Pressures?
2020-12-23,3 Brokerage Stocks Set to Soar Even in the Zero-Commission Era
2020-12-21,Raymond James European Investment Banking appointment of new Managing Director marks continued growth in Consumer & Retail Investment Banking
2020-12-18,Raymond James Buys Financo
2020-12-18,Raymond James (RJF) to Buy Boutique Investment Bank Financo
2020-12-17,Raymond James Is Buying Consumer-Focused Investment Bank Financo
2020-12-17,Raymond James Financial To Acquire Consumer-focused Boutique Investment Bank Financo
2020-12-11,"Raymond James (RJF) to Buy NWPS Holdings, Enhance Offerings"
2020-12-10,Raymond James to Buy $35 Billion Retirement Plan Administrator
2020-12-09,Concurrent Adds Seven New Teams Worth Over $1.1 Billion in Assets Under Management
2020-12-09,Rick Gaston Joins Steward Partners Global Advisory as Mid-Atlantic Divisional President
2020-12-03,Raymond James Deploys Additional COVID-19 Aid
2020-11-24,Should Raymond James Financial (NYSE:RJF) Be Disappointed With Their 54% Profit?
2020-11-10,"Were Hedge Funds Right About Loading Up On Raymond James Financial, Inc. (RJF)?"
2020-11-05,Fed Stays in Holding Pattern With Rates and Asset Purchases Unchanged
2020-10-30,"Raymond James Financial, Inc. (RJF) Q4 2020 Earnings Call Transcript"
2020-10-29,"Raymond James' (RJF) Q4 Earnings Beat, Revenues Rise Y/Y"
2020-10-27,Factors Shaping Raymond James (RJF) Fate Ahead of Q4 Earnings
2020-10-17,"Raymond James Financial, Inc. -- Moody's announces completion of a periodic review of ratings of Raymond James Financial, Inc."
2020-10-12,"Allworth Financial Sale Coming Soon, Following Private Equity Bids"
2020-10-06,Steward Partners Global Advisory Welcomes Praetorian Private Wealth as Newest Partners
2020-09-28,Steward Partners Expands into Pacific Northwest with Acquisition of Umpqua Investments
2020-09-25,"Raymond James Financial, Inc. (NYSE:RJF) Looks Like A Good Stock, And It's Going Ex-Dividend Soon"
2020-09-16,Concurrent Continues Explosive Growth with Eight New Advisor Teams Managing More Than $900 Million in Assets
2020-09-10,Raymond James Financial (RJF): Hedge Fund Interest Inching Up
2020-08-27,"Why Investors Shouldn't Be Surprised By Raymond James Financial, Inc.'s (NYSE:RJF) Low P/E"
2020-08-25,Edited Transcript of RJF.N earnings conference call or presentation 24-Oct-19 12:15pm GMT
2020-08-07,Lisa Detanna Named to Barrons 2020 Top 100 Women Financial Advisors
2020-08-06,Steward Partners Named to Financial Times Top 300 RIAs List
2020-08-04,"Raymond James European Investment Banking appoints new Managing Director and Director to Industrial Technology team, further strengthening its German offices"
2020-07-31,Raymond James Financial Inc (RJF) Q3 2020 Earnings Call Transcript
2020-07-30,"Raymond James (RJF) Q3 Earnings Beat, Revenues Decline Y/Y"
2020-07-28,US direct lenders modify fee structures as private lending loses luster
2020-07-28,"Investment Managers' Earnings Due on Jul 29: RJF, AMP & More"
2020-07-28,Factors Setting the Tone for Raymond James (RJF) Q3 Earnings
2020-07-20,Steward Partners' Casey Snyder Named to InvestmentNews' 2020 40 Under 40 List
2020-07-16,Can Value Investors Consider Raymond James (RJF) Stock?
2020-07-16,Why Raymond James Is Poised for a Comeback
2020-07-13,"Were Hedge Funds Right About Shunning Raymond James Financial, Inc. (RJF)?"
2020-07-09,Steward Partners Welcomes Michael Drumm as Divisional President for Tri-State Region
2020-07-08,Steward Partners Welcomes New Advisor Team in Clearwater
2020-07-06,The Perfect 10 Portfolio Rides Again
2020-07-05,3 Stocks With Market-Beating Valuations and Yields
2020-06-22,6 Reasons to Add Raymond James (RJF) Stock to Your Portfolio
2020-06-18,Steward Partners Welcomes New Advisory Team in New York
2020-06-17,Steward Partners Welcomes its First Billion Dollar Plus Team into their 1099 Model in St. Louis
2020-06-17,Edited Transcript of RJF.N earnings conference call or presentation 30-Apr-20 12:15pm GMT
2020-06-15,Raymond James fires employee who confronted Black Lives Matter demonstrator
2020-06-15,Raymond James Fires Employee Over Black Lives Matter Clash
2020-06-05,"Do Hedge Funds Love Raymond James Financial, Inc. (RJF)?"
2020-06-04,Raymond James downgrades Planet Fitness to market perform from outperform
2020-05-19,Concurrent Acquires WealthEngage in Latest Manifestation of Long-Term Growth Strategy
2020-05-13,"Steward Partners Welcomes Two Advisor Teams, Opens New Office in Virginia"
2020-05-11,"Is Raymond James Financial, Inc. (NYSE:RJF) Overpaying Its CEO?"
2020-05-04,"Tax-Cut Era Has Come to an End, Guggenheims Millstein Says"
2020-05-04,Steward Partners' Anka Vidacic Receives Raymond James Financial Services' Outstanding Branch Professional Award
2020-04-30,"Raymond James Financial, Inc. (RJF) Q2 2020 Earnings Call Transcript"
2020-04-30,Steward Partners' Keith Barberis Appointed to Certified Financial Planner Board's Disciplinary and Ethics Commission
2020-04-29,SIMON Markets LLC and Raymond James Launch New Strategic Partnership for Annuities
2020-04-28,What's in Store for Raymond James (RJF) in Q2 Earnings?
2020-04-28,Raymond James Ltd. Announces Agreement to Acquire Oak Trust to Add Trust Services To Its Full Service Offering for Clients
2020-04-24,Liana Poodiack Named to Forbes 2020 Top Women Wealth Advisors List
2020-04-24,Eric Beiley Named to Financial Times 400 Top Financial Advisors
2020-04-21,"Publix, Tampa General executives named to Florida governor's economic task force"
2020-04-16,Top 1st-Quarter Buys of the T Rowe Price Equity Income Fund
2020-04-09,NOTICE TO RAYMOND JAMES FINANCIAL CUSTOMERS WITH MARGIN ACCOUNTS: KlaymanToskes Commences Investigation into Damages Sustained by Investors Who were Forced to Sell Securities Due to Margin Calls
2020-04-09,Raymond James European Investment Banking Appoints Alastair Rogers as Managing Director of Diversified Industrials
2020-04-06,Raymond James Enhances Diversified Financials Coverage With Addition of Stephen Boland to the Canadian Equity Research Team
2020-04-03,Get to know the 2020 Top Corporate Counsel honorees
2020-03-27,"Raymond James Ratings Affirmed by Moody's, Outlook Stable"
2020-03-27,A Timely Portfolio of Blue Chip Dividend Paying Stocks
2020-03-26,"Raymond James Financial, Inc. -- Moody's assigns Baa1 rating to Raymond James's new senior unsecured notes, affirms all other ratings with stable outlook"
2020-03-26,"Why You Might Be Interested In Raymond James Financial, Inc. (NYSE:RJF) For Its Upcoming Dividend"
2020-03-25,Steward Partners Announces New England Divisional President
2020-03-24,Raymond James Adjusts Recruiting Amid Pandemic
2020-03-19,Concurrent Continues Dynamic First Quarter Growth Trajectory
2020-03-17,"Hedge Funds Were Selling Raymond James Financial, Inc. (RJF) Before The Coronavirus"
2020-03-05,"FedEx, Varsity Spirit, Raymond James deals drive office real estate market"
2020-03-04,Carl Gravina Named To Forbes' List of Best-In-State Wealth Advisors
2020-02-28,See how Tampa Bays stocks are faring in this historic drop
2020-02-28,"Sleepy no more: Pascos bedroom community label is fading, but don't call it an employment supercenter just yet"
2020-02-26,"What Does Raymond James Financial, Inc.'s (NYSE:RJF) Share Price Indicate?"
2020-02-13,"Eric Beiley, Timothy Davis, Carl Gravina, Todd Hoffman And Randy Price Named To Forbes' List Of Best-In-State Wealth Advisors"
2020-02-11,Raymond James Guns for Advisors Who Custody at TD Ameritrade
2020-02-10,MOVES-Moelis hires Herrington from Raymond James for activism defense
2020-01-28,Financial firm names Midwest regional director
2020-01-27,"Here's What Analysts Are Forecasting For Raymond James Financial, Inc. After Its First-Quarter Results"
2020-01-24,Edited Transcript of RJF earnings conference call or presentation 23-Jan-20 1:15pm GMT
2020-01-23,"Raymond James (RJF) Q1 Earnings Miss, Revenues Increase Y/Y"
2020-01-22,These Tampa Bay companies received perfect scores on the Human Rights Campaigns equality index
2020-01-21,"Publix, three other Tampa Bay companies make Fortunes 'Most Admired' list"
2020-01-21,What's in Store for Raymond James (RJF) in Q1 Earnings?
2020-01-16,Schwab (SCHW) Q4 Earnings Miss Estimates as Revenues Fall
2020-01-16,TA Associates to Seek Nearly $2 Billion for Orion Advisor Solutions
2020-01-15,"Raymond James Holiday Celebration & Year-End Market Review in Beverly Hills, December 2019; Video Available on Business Wire's Website"
2020-01-14,"Raymond James Financial, Inc.'s (NYSE:RJF) Attractive Combination: Does It Earn A Place In Your Dividend Portfolio?"
2020-01-10,Raymond James increased CEO's pay just over 7 percent in 2019
2020-01-09,"How Did Raymond James Financial, Inc. (RJF) Compare Against Hedge Fund Darlings in 2019?"
