2021-01-11,Fortune Brands Sets Date for Fourth Quarter and Full-Year 2020 Earnings Announcement and Investor Conference Call
2021-01-11,Moen Launches Industry-First Smart Water Network to Provide Convenience and Security; Experience it at CES 2021
2021-01-08,"Allegion (ALLE) Buys Yonomi, Strengthens Product Offerings"
2020-12-30,"Fortune Brands (FBHS) Displays Solid Prospects, Risks Persist"
2020-12-28,5 Industrial Stocks That Braved the Coronavirus-Induced Mayhem
2020-12-21,Is FBHS A Good Stock To Buy According To Hedge Funds?
2020-12-21,Fortune Brands Appoints Susan Saltzbart Kilsby as Non-Executive Chair of the Board
2020-12-21,Fiberon Announces 2021 Virtual Experience Launching in February
2020-12-21,Will The ROCE Trend At Fortune Brands Home & Security (NYSE:FBHS) Continue?
2020-12-15,Alarm.com (ALRM) Completes Buyout of Shooter Detection Systems
2020-12-15,Fortune Brands (FBHS) Boosts Outdoor Business With LARSON Buyout
2020-12-14,Fortune Brands Completes Acquisition of LARSON as Part of Outdoors & Security Segment
2020-12-11,Here's Why You Should Consider Betting on Fortune Brands (FBHS)
2020-12-09,Fortune Brands (FBHS) Announces Quarterly Dividend Hike of 8%
2020-12-08,Fortune Brands Elects Jeffery Perry to Board of Directors
2020-12-08,Fortune Brands Increases Quarterly Dividend for 8th Consecutive Year
2020-12-07,ADT's Subsidiaries to Buy Back $300M Worth Senior Notes
2020-11-25,Here's Why You Should Invest in Allegion (ALLE) Stock Now
2020-11-20,Resideo (REZI) Looks Good: Stock Adds 8.1% in Session
2020-11-19,"Moody's says acquisition of Larson is credit negative, but has no immediate impact on ratings"
2020-11-18,"Fortune Brands (FBHS) to Acquire LARSON, Renames Segment"
2020-11-17,CORRECTING and REPLACING Fortune Brands Expands Further Into Outdoor Living; Renames Segment Outdoors & Security and Signs Agreement to Acquire LARSON
2020-11-17,Fortune Brands Home & Security (FBHS) is an Incredible Growth Stock: 3 Reasons Why
2020-11-13,Alpha Pro (APT) Surges: Stock Moves 7.6% Higher
2020-11-09,Were Hedge Funds Right About Buying Fortune Brands Home & Security Inc (FBHS)?
2020-11-06,4 Security Service Stocks Gain Despite Coronavirus Mayhem
2020-11-02,Fiberon and Wolf Home Products Expand Partnership
2020-10-30,3 Reasons Why Fortune Brands Home & Security (FBHS) Is a Great Growth Stock
2020-10-30,"Fortune Brands Home & Security, Inc. Just Beat EPS By 11%: Here's What Analysts Think Will Happen Next"
2020-10-29,Fortune Brands (FBHS) Q3 Earnings & Revenues Beat Estimates
2020-10-28,Fortune Brands Home & Security Inc (FBHS) Q3 2020 Earnings Call Transcript
2020-10-28,Fortune Brands Home & Security (FBHS) Beats Q3 Earnings and Revenue Estimates
2020-10-28,Recap: Fortune Brands Home Q3 Earnings
2020-10-28,Fortune Brands Reports Strong 3Q Sales and Profit Growth
2020-10-27,Home Industry Giants to Expand Smart Water Technology to More Homes
2020-10-27,Fiberon Launches Interactive Deck Visualization Tool
2020-10-26,Fortune Brands (FBHS) to Post Q3 Earnings: Beat in Store?
2020-10-22,Allegion (ALLE) Earnings & Revenues Surpass Estimates in Q3
2020-10-22,"Grainger's (GWW) Q3 Earnings & Sales Beat Estimates, Up Y/Y"
2020-10-21,Fortune Brands Home & Security (FBHS) Earnings Expected to Grow: Should You Buy?
2020-10-21,Avery Dennison (AVY) Q3 Earnings & Revenues Beat Estimates
2020-10-20,"Zacks.com featured highlights include: DKS, ATVI, TMO, FBHS and TSM"
2020-10-20,Are You Looking for a Top Momentum Pick? Why Fortune Brands Home & Security (FBHS) is a Great Choice
2020-10-20,"Pentair (PNR) Beats on Q3 Earnings & Sales, Ups '20 View"
2020-10-16,"Fortune Brands Home & Security, Inc. -- Moody's announces completion of a periodic review of ratings of Fortune Brands Home & Security, Inc."
2020-10-16,Can Fortune Brands Home & Security (FBHS) Keep the Earnings Surprise Streak Alive?
2020-10-13,Silgan (SLGN) Hits 52-Week High: What's Driving the Upside?
2020-10-09,4 Top Industrial Stocks to Bet on as U.S Manufacturing Expands
2020-10-08,Sonoco (SON) Hikes Prices for Corrugating Medium Grades
2020-10-07,Fortune Brands Sets Date for Third Quarter 2020 Earnings Announcement and Investor Conference Call
2020-10-07,Grainger (GWW) Hits 52-Week High: What's Driving the Upside?
2020-10-06,"Apogee (APOG) to Resume Share-Buyback Program, Reduce Costs"
2020-10-06,Fortune Brands Gains 39.4% in 3 Months: What's Driving it?
2020-10-01,"Zacks Industry Outlook Highlights: Astec Industries, Sealed Air Corp, Berry Global and Fortune Brands Home & Security"
2020-09-30,4 Promising Industrial Stocks to Play the Sector's Rebound
2020-09-22,3 Strong Dividend Growth Stocks Announce Distributions
2020-09-22,Fortune Brands Rewards Shareholders With Dividend & Buyback
2020-09-21,Fortune Brands Announces Planned Retirement of Christopher Klein From Board of Directors
2020-09-21,Fortune Brands Announces $500 Million Share Repurchase Authorization and Declares Quarterly Dividend
2020-09-21,3 Reasons Why Fortune Brands Home & Security (FBHS) Is a Great Growth Stock
2020-09-14,Hedge Funds Are Buying Fortune Brands Home & Security Inc (FBHS)
2020-09-14,"The Zacks Analyst Blog Highlights: Etsy, Generac, Catalent, Fortune Brands Home & Security and Wayfair"
2020-09-10,"Benzinga's Top Upgrades, Downgrades For September 10, 2020"
2020-09-01,Fortune Brands Rises 28.7% YTD: What's Driving the Rally?
2020-08-31,Fortune Brands Home & Security (FBHS) Is Up 2.59% in One Week: What You Should Know
2020-08-28,Why Is Fortune Brands Home & Security (FBHS) Up 10.2% Since Last Earnings Report?
2020-08-27,"Forget Barnes Group, Buy These 4 Industrial Stocks Instead"
2020-08-10,Here's Why it is Worth Investing in Fortune Brands (FBHS) Now
2020-08-04,Fortune Brands Home & Security (FBHS) is an Incredible Growth Stock: 3 Reasons Why
2020-07-31,"Are Robust Financials Driving The Recent Rally In Fortune Brands Home & Security, Inc.'s (NYSE:FBHS) Stock?"
2020-07-30,Fortune Brands (FBHS) Q2 Earnings & Revenues Beat Estimates
2020-07-30,Fortune Brands Home & Security Inc (FBHS) Q2 2020 Earnings Call Transcript
2020-07-29,Fortune Brands Home & Security (FBHS) Beats Q2 Earnings and Revenue Estimates
2020-07-29,Fortune Brands Reports Strong 2Q Results Amid COVID-19 Environment
2020-07-28,Earnings Preview: Fortune Brands Home
2020-07-28,"Fortune Brands Home & Security, Inc. (FBHS) Shares March Higher, Can It Continue?"
2020-07-27,Fortune Brands (FBHS) to Post Q2 Earnings: What's in Store?
2020-07-24,5 Industrial Stocks Poised for an Earnings Beat in Q2
2020-07-24,Why Fortune Brands (FBHS) Could Be Positioned for a Surge
2020-07-23,Fortune Brands Home & Security (FBHS) is a Great Momentum Stock: Should You Buy?
2020-07-22,Fortune Brands Home & Security (FBHS) Expected to Beat Earnings Estimates: Can the Stock Move Higher?
2020-07-22,Why the Earnings Surprise Streak Could Continue for Fortune Brands Home & Security (FBHS)
2020-07-17,"The Zacks Analyst Blog Highlights: AGCO Corporation, Fortune Brands Home & Security, Stanley Black & Decker, Rockwell Automation and Berry Global"
2020-07-13,Did Hedge Funds Make The Right Call On Fortune Brands Home & Security Inc (FBHS) ?
2020-07-13,Fortune Brands Elects Amit Banati to Board of Directors
2020-07-13,Fortune Brands Declares Quarterly Dividend
2020-07-08,Fortune Brands Sets Date for Second Quarter 2020 Earnings Announcement and Investor Conference Call
2020-06-24,Edited Transcript of FBHS earnings conference call or presentation 30-Apr-20 8:30pm GMT
2020-06-22,Moen Takes a Stand to Ensure All Americans Have Access to Water During Pandemic
2020-06-16,Fiberon Launches Promenade PVC Decking
2020-06-08,Here's Why You Should Avoid Betting on Fortune Brands (FBHS)
2020-06-05,Most Hedge Funds Stuck With Fortune Brands Home & Security Inc (FBHS) During The Crash
2020-05-30,Why Is Fortune Brands Home & Security (FBHS) Up 26.5% Since Last Earnings Report?
2020-05-19,"Moen Names Robert Kibbe President, Moen Americas"
2020-05-12,"Master Lock announces product donation to help protect frontline healthcare, first responder and small business workers amid pandemic"
2020-05-12,"Fortune Brands Has Leading Brands Across Plumbing Fixtures, Cabinets, and Doors and Security"
2020-05-01,Fortune Brands Stock Pops 12% After a Strong Q1
2020-05-01,Fortune Brands Home Security (FBHS) Q1 2020 Earnings Call Transcript
2020-04-30,Fortune Brands Home & Security (FBHS) Surpasses Q1 Earnings and Revenue Estimates
2020-04-30,Fortune Brands Reports Strong Sales and EPS Growth in Q1 2020; Enhances Liquidity and Balance Sheet and Suspends Financial Guidance
