2021-01-04,Cyclerion to Participate in the 39th Annual J.P. Morgan Healthcare Conference and H.C. Wainwright BioConnect Conference
2020-12-21,Cyclerion Announces Leadership Transitions
2020-12-02,"Is Cyclerion Therapeutics, Inc. (CYCN) A Good Stock To Buy?"
2020-11-15,"Andreas Busch Is The Chief Innovation Officer of Cyclerion Therapeutics, Inc. (NASDAQ:CYCN) And They Just Picked Up 96% More Shares"
2020-11-05,Cyclerion Therapeutics Reports Third Quarter 2020 Financial Results and Recent Corporate Updates
2020-10-14,Why Cyclerion Therapeutics Is Crashing Today
2020-10-14,Cyclerion Sinks As Biopharma Shelves Sickle Cell Disease Study
2020-10-14,Cyclerion Announces Positive Data from IW-6463 CNS Translational Pharmacology Study in Healthy Elderly Subjects
2020-10-14,Cyclerion Announces Phase 2 STRONG-SCD Study Results in Patients with Sickle Cell Disease
2020-10-04,Health Check: How Prudently Does Cyclerion Therapeutics (NASDAQ:CYCN) Use Debt?
2020-10-04,Health Check: How Prudently Does Cyclerion Therapeutics (NASDAQ:CYCN) Use Debt?
2020-09-04,Cyclerion to Participate at Upcoming September 2020 Investor Conferences
2020-08-25,Cyclerion Announces Translational Research Award from the Alzheimers Association Part the Cloud-Gates Partnership Grant Program
2020-08-20,"Is Cyclerion Therapeutics, Inc. (NASDAQ:CYCN) Popular Amongst Institutions?"
2020-08-03,Cyclerion Therapeutics Reports Second Quarter 2020 Financial Results and Recent Corporate Highlights
2020-07-30,Cyclerion Therapeutics Completes $24 Million Private Placement
2020-07-17,Cyclerion Therapeutics Presentation at Biomarkers in Alzheimers Disease Summit
2020-07-06,We're A Little Worried About Cyclerion Therapeutics's (NASDAQ:CYCN) Cash Burn Rate
2020-07-05,"Should You Buy Cyclerion Therapeutics, Inc. (CYCN)?"
2020-06-18,"Cyclerion to Host Webcast Investor Event on July 9, 2020"
2020-05-22,The Cyclerion Therapeutics (NASDAQ:CYCN) Share Price Is Down 72% So Some Shareholders Are Rather Upset
2020-04-10,Cyclerion Updates Corporate Progress
2020-03-23,"Are Insiders Buying Cyclerion Therapeutics, Inc. (NASDAQ:CYCN) Stock?"
2020-01-13,Cyclerion announces IW-6463 phase 1 healthy volunteer study results that support further development for neurodegenerative diseases
2020-01-12,"The Week Ahead In Biotech: JPMorgan Healthcare Conference, FDA Panel Reviews Opioid Pain Drugs, I-Mab's IPO"
2019-12-24,Can Cyclerion Therapeutics (NASDAQ:CYCN) Afford To Invest In Growth?
2019-12-23,Cyclerion to Present at the J.P. Morgan Healthcare Conference
2019-12-12,"Cyclerion Therapeutics, Inc. (CYCN) Is Burning These Hedge Funds"
2019-11-27,Cyclerion to Present at the Evercore ISI 2nd Annual HealthCONx Conference
2019-11-01,"Ironwood (IRWD) Beats on Q3 Earnings & Revenues, Ups '19 View"
2019-10-31,"The Daily Biotech Pulse: Agile Receives Favorable Adcom Verdict, Merit Medical Tumbles On Earnings, 2 Biotechs To Debut"
2019-10-30,Cyclerion's stock plummets to pace premarket losers after diabetes treatment study missed primary endpoint
2019-10-30,Ironwood spinout Cyclerion plans 30 layoffs after drug fails mid-stage trial
2019-10-30,Cyclerion Therapeutics Announces Praliciguat Topline Phase 2 Results in Diabetic Nephropathy
2019-10-30,Cyclerion Therapeutics Announces Topline Phase 2 Results for sGC Stimulator Praliciguat in Heart Failure with Preserved Ejection Fraction (HFpEF)
2019-10-08,Cyclerion Therapeutics and Collaborators to Present New Research on the Sickle Cell Disease Patient Journey at Upcoming Medical Meetings
2019-09-25,"Read This Before Selling Cyclerion Therapeutics, Inc. (NASDAQ:CYCN) Shares"
2019-09-10,Cyclerion to Host Webcast Investor Event on Cardiometabolic Programs on September 17
2019-08-12,Cyclerion Therapeutics Reports Second Quarter 2019 Financial Results and Progress on Four Clinical Studies with Data Readouts Anticipated in the Next 12 Months
2019-07-31,Ironwood (IRWD) Q2 Earnings and Revenues Beat Estimates
2019-07-24,"What Kind Of Shareholders Own Cyclerion Therapeutics, Inc. (NASDAQ:CYCN)?"
2019-06-11,Cyclerion Therapeutics to Present Preclinical Data on its Clinical-Stage sGC Stimulators for Neurodegenerative and Cardiometabolic Diseases at the 9th International Conference on cGMP
2019-06-05,Ironwood Initiates Dosing in Mid-Stage Study for MD-7246
2019-06-04,3 Spinoff Stocks Worth Your Attention
2019-06-04,Cyclerion Therapeutics to Present Data on its Sickle Cell Disease Program at Upcoming Medical and Scientific Meetings
2019-05-13,Cyclerion Therapeutics Provides a Corporate and Pipeline Overview as a Newly Launched Public Biopharmaceutical Company
2019-04-25,"Cyclerion to Host Corporate Overview Call on May 13, 2019"
2019-04-09,Cyclerion taps ex-Shire exec as chief innovation officer
2019-04-02,Cyclerion Launches as Clinical-Stage Biopharmaceutical Company Harnessing the Power of Soluble Guanylate Cyclase (sGC) Pharmacology for Treatment of Serious and Orphan Diseases
