2021-01-05,RealNetworks Announces Completion of the Sale of Napster to MelodyVR
2020-12-24,RealNetworks Announces Inducement Awards Pursuant to NASDAQ Listing Rule 5635(c)(4)
2020-12-15,"RealNetworks introduces MaskCheck, a free face mask compliance app, service, and data platform to help communities operate and reopen safely"
2020-12-15,COVID-19 International Research Team partners with RealNetworks to make the free MaskCheck app available on Android and iOS platforms
2020-12-13,SAFR® from RealNetworks and EPM Joint Touchless Access Control Solution is Implemented by UAE Federal Agency
2020-12-02,Setelsa Security Selects SAFR® from RealNetworks to Provide Face-Based Biometrics for Secure Access
2020-11-29,Should I Avoid RealNetworks Inc (RNWK)?
2020-11-16,"SAFR® from RealNetworks is chosen to provide features, including mask detection and face recognition, for G2K Groups video analytics platform"
2020-11-12,"SHAREHOLDER ALERT: Levi & Korsinsky, LLP Reminds Shareholders of an Investigation Concerning Possible Breaches of Fiduciary Duty by Certain Officers and Directors of RealNetworks, Inc. - RNWK"
2020-11-11,Does RealNetworks (NASDAQ:RNWK) Have A Healthy Balance Sheet?
2020-11-03,RealNetworks Announces Third Quarter 2020 Financial Results
2020-11-03,"RealNetworks, Inc. to Host Earnings Call"
2020-11-01,"SHAREHOLDER ALERT: Levi & Korsinsky, LLP Notifies Shareholders of an Investigation Concerning Possible Breaches of Fiduciary Duty by Certain Officers and Directors of RealNetworks, Inc. - RNWK"
2020-10-28,SAFR® from RealNetworks Launches Version 3.0 Featuring Enhanced COVID-19 Response Features and a New High Sensitivity Face Detector
2020-10-14,CBX Chooses SAFR® from RealNetworks To Enhance Terminal Efficiency
2020-10-13,RealNetworks to Release Third Quarter 2020 Results on November 3rd
2020-09-18,"RealNetworks Strengthens SAFR's Leadership Team with Appointment of Brad Donaldson as Vice President, Computer Vision"
2020-08-25,"RealNetworks Announces Support for Acquisition of Rhapsody International, Inc. by MelodyVR Group PLC"
2020-08-05,SAFR from RealNetworks Awarded $1.9M in Phase II Small Business Innovation Research (SBIR) Contracts from the United States Air Force (USAF)
2020-08-05,RealNetworks Announces Second Quarter 2020 Financial Results
2020-08-04,"RealNetworks Appoints Mike Ensing President and Chief Operating Officer, Succeeding Max Pellegrini"
2020-07-15,RealNetworks to Release Second Quarter 2020 Results on August 5th
2020-07-08,Walter Candelu Joins SAFR From RealNetworks As Area Vice President For The Middle East
2020-06-18,SAFR Facial Recognition Now Runs On The AXIS Camera Application Platform (ACAP)
2020-06-10,Hedge Funds Cashing Out Of RealNetworks Inc (RNWK)
2020-06-03,"Commemorating the 25th Anniversary of Streaming, RealNetworks introduces 2 new AI-based innovative consumer PC software products: StarSearch by Real® and RealPlayer® 20/20"
2020-05-14,Edited Transcript of RNWK earnings conference call or presentation 6-May-20 8:30pm GMT
2020-04-29,RealNetworks Takes Steps To Address Commercial Impact of COVID-19
2020-04-17,RealNetworks to Release First Quarter 2020 Results on May 6th
2020-03-30,"One Thing To Remember About The RealNetworks, Inc. (NASDAQ:RNWK) Share Price"
2020-03-25,RealNetworks Names Judd Lee as Chief Financial Officer
2020-02-26,Edited Transcript of RNWK earnings conference call or presentation 5-Feb-20 9:30pm GMT
2020-02-20,RealNetworks expands application-to-person texting platform through deal with Syniverse
2020-02-12,"CEO Glaser invests $10M in RealNetworks, bullish on facial recognition software, gaming"
2020-02-10,RealNetworks CEO Rob Glaser to Invest $10 Million into the Company
2020-01-30,Is RealNetworks (NASDAQ:RNWK) A Risky Investment?
2020-01-09,"RealNetworks CFO leaves for Impinj, interim named"
2020-01-09,"RealNetworks Appoints Mike Ensing as Interim CFO, Succeeding Cary Baker"
2019-12-20,Is RealNetworks Inc (RNWK) A Good Stock To Buy?
2019-12-17,"SAFR® and Katai, Inc. Usher in Next Generation of Huddle Room Video Conferencing"
2019-12-16,"How Should Investors Feel About RealNetworks, Inc.'s (NASDAQ:RNWK) CEO Pay?"
2019-12-09,Former RealNetworks exec among two added to company's board of directors
2019-12-09,RealNetworks Appoints Tim Wan and Erik Prusch to its Board of Directors
2019-11-10,Edited Transcript of RNWK earnings conference call or presentation 30-Oct-19 8:30pm GMT
2019-10-30,RealNetworks Announces Third Quarter 2019 Financial Results
2019-10-30,Did You Manage To Avoid RealNetworks's (NASDAQ:RNWK) Devastating 77% Share Price Drop?
2019-10-30,SAFR Transforms Global Cities to Be Smarter and More Secure with AI-Based Video Intelligence Powered by NVIDIA
2019-10-09,RealNetworks to Release Third Quarter 2019 Results October 30
2019-09-24,"Do Insiders Own Shares In RealNetworks, Inc. (NASDAQ:RNWK)?"
2019-09-12,Director of the year: Dawn Lepore's best advice came from Walmart's Rob Walton
2019-09-03,Edited Transcript of RNWK earnings conference call or presentation 1-Aug-19 8:30pm GMT
2019-08-19,Does RealNetworks (NASDAQ:RNWK) Have A Healthy Balance Sheet?
2019-08-01,RealNetworks Announces Second Quarter 2019 Financial Results
2019-07-28,"Need to know: Why investors target Washington banks, the soul of South Lake Union and the Trump Island mansion burns down"
2019-07-12,"How Does RealNetworks, Inc. (NASDAQ:RNWK) Affect Your Portfolio Volatility?"
2019-07-11,RealNetworks to Release Second Quarter 2019 Results August 1
2019-06-28,Here is What Hedge Funds Think About RealNetworks Inc (RNWK)
2019-05-10,Edited Transcript of RNWK earnings conference call or presentation 2-May-19 8:30pm GMT
2019-05-02,RealNetworks: 1Q Earnings Snapshot
2019-05-02,RealNetworks Announces First Quarter 2019 Financial Results
2019-05-01,RealNetworks Appoints Jay Burrell as Chief Revenue Officer for Computer Vision
2019-04-23,"Should You Worry About RealNetworks, Inc.'s (NASDAQ:RNWK) CEO Pay?"
2019-04-11,RealNetworks to Release First Quarter 2019 Results May 2
2019-04-09,SAFR for Security Enables Genetec Inc. Customers to Benefit from Facial Recognition
2019-04-09,RealNetworks Partners with Milestone to Provide Integrated SAFR for Security Video Management Solution
2019-04-09,RealNetworks Launches SAFR for Security to Help Security Professionals Better Protect People and Valuable Assets
2019-03-14,RealNetworks and Digifort Partner to Offer SAFR Facial Recognition Worldwide
2019-03-12,RealNetworks Announces Participation in the 31st Annual ROTH Conference
2019-03-08,"RealNetworks Inc (RNWK) Files 10-K for the Fiscal Year Ended on December 31, 2018"
2019-02-13,"Report: Developing Opportunities within Dunkin' Brands Group, Murphy Oil, NII, Audentes Therapeutics, RealNetworks, and MDC Partners  Future Expectations, Projections Moving into 2019"
2019-02-07,Edited Transcript of RNWK earnings conference call or presentation 6-Feb-19 9:30pm GMT
2019-02-07,"Can We See Significant Insider Ownership On The RealNetworks, Inc. (NASDAQ:RNWK) Share Register?"
2019-02-06,RealNetworks: 4Q Earnings Snapshot
2019-02-06,RealNetworks Announces Fourth Quarter And Full Year 2018 Results
2019-01-22,RealNetworks doubles stake in Napster in a deal that could be valued up to $40 million
2019-01-22,RealNetworks Doubles Its Stake in Rhapsody International to Become 84% Owner of Napster
2019-01-15,RealNetworks to Release Fourth Quarter and Full Year 2018 Results February 6
2019-01-02,"Have Insiders Been Buying RealNetworks, Inc. (NASDAQ:RNWK) Shares This Year?"
2018-12-02,"SAFR, Advanced Facial Recognition Technology from RealNetworks, Enters the China Market Through Homtar Corporation"
2018-11-27,OpenMarket and RealNetworks Join Forces to Combat Messaging Fraud
2018-11-19,Edited Transcript of RNWK earnings conference call or presentation 7-Nov-18 9:30pm GMT
2018-11-13,Does RealNetworks Incs (NASDAQ:RNWK) CEO Salary Reflect Performance?
2018-11-07,RealNetworks: 3Q Earnings Snapshot
2018-11-07,RealNetworks Announces Third Quarter 2018 Results
2018-10-23,RealNetworks Adds Windows Support for its SAFR Facial Recognition Platform and Releases Best Practices Guide for Facial Recognition in Schools
2018-10-17,RealNetworks to Release Third Quarter 2018 Results November 7
2018-10-17,"Report: Exploring Fundamental Drivers Behind Infinity Pharmaceuticals, AxoGen, MUELLER WATER PRODUCTS, MYR Group, RealNetworks, and Odonate Therapeutics  New Horizons, Emerging Trends, and Upcoming Developments"
2018-10-16,RealNetworks and Seventh Introduce SAFR Facial Recognition to Latin America
2018-09-30,Facial recognition tech at schools fuels privacy debate
2018-09-11,RealNetworks to Attend the Lake Street Capital Markets 2nd Annual Best Ideas Growth Conference
2018-08-22,"Recent Analysis Shows STMicroelectronics N.V, Jagged Peak Energy, Inovalon, AC Immune SA, Repligen, and RealNetworks Market Influences  Renewed Outlook, Key Drivers of Growth"
2018-08-10,Edited Transcript of RNWK earnings conference call or presentation 1-Aug-18 8:30pm GMT
2018-08-06,Nordstrom names Expedia and RealNetworks veteran to top tech job
2018-08-01,RealNetworks: 2Q Earnings Snapshot
2018-08-01,RealNetworks Announces Second Quarter 2018 Results
2018-07-18,RealNetworks Provides SAFR Facial Recognition Solution for Free to Every K-12 School in the United States and Canada
2018-07-17,"RealNetworks Launches SAFR, a Best-In-Class Facial Recognition Platform"
2018-07-17,RealNetworks Provides SAFR Facial Recognition Solution for Free to Every K-12 School in the U.S. and Canada
2018-07-11,RealNetworks to Release Second Quarter 2018 Results August 1
2018-06-27,RealMedia HD Ecosystem Expands with Commercial Deployment on Top Chinese Mobile TV Network
