2020-12-29,What Can We Conclude About Casa Systems' (NASDAQ:CASA) CEO Pay?
2020-12-12,Is CASA A Good Stock To Buy?
2020-12-11,Casa Systems Advances Its vBNG Leadership by Joining the Telecom Infra Projects OpenBNG Initiative
2020-12-08,Casa Systems to accelerate and scale IoT deployments with Software AG Cumulocity IoT partnership
2020-12-04,"TIM, Ericsson and Qualcomm Set World Record for Long Distance Speed With 5G mmWave Applied to FWA"
2020-10-30,"Casa Systems, Inc. Beat Revenue Forecasts By 15%: Here's What Analysts Are Forecasting Next"
2020-10-28,Casa Systems (CASA) Q3 Earnings and Revenues Surpass Estimates
2020-10-28,Casa Systems Reports Third Quarter 2020 Financial Results
2020-10-28,"Casa Systems, Inc. to Host Earnings Call"
2020-10-27,Casa Systems's Earnings: A Preview
2020-10-21,Casa Systems (CASA) Earnings Expected to Grow: What to Know Ahead of Next Week's Release
2020-10-18,Casa Systems' (NASDAQ:CASA) Shareholders Are Down 36% On Their Shares
2020-10-15,"Casa Systems To Release Third Quarter 2020 Results on Wednesday, October 28, 2020"
2020-10-12,Casa Systems Previews Cables Gigabit Future with Cable-Tec Expo Demos
2020-09-17,Casa Systems Powers Distributed Access Architecture Momentum with New Gen 2 Nodes and Multiple Virtual CCAP Wins
2020-09-09,Casa Systems Unveils the First High-Power 5G mmWave CPE
2020-09-01,Casa Systems (CASA) in Focus: Stock Moves 6.6% Higher
2020-08-31,"Qualcomm, Casa Systems and Ericsson Achieve Worlds First Extended-Range 5G NR Data Call Over mmWave"
2020-08-27,Casa Systems Announces Appointment of CFO and Change of Public Accounting Firm
2020-07-30,Casa Systems (CASA) Tops Q2 Earnings and Revenue Estimates
2020-07-30,Casa Systems Reports Second Quarter 2020 Financial Results
2020-07-23,"Orange Demos Dynamic, Self-Healing 5G Network Slice Management with HPE and Casa Systems"
2020-07-23,Analysts Estimate Casa Systems (CASA) to Report a Decline in Earnings: What to Look Out for
2020-07-20,"Is There An Opportunity With Casa Systems, Inc.'s (NASDAQ:CASA) 24% Undervaluation?"
2020-07-16,"Casa Systems To Release Second Quarter 2020 Results on Thursday, July 30th, 2020"
2020-06-12,"Is Casa Systems, Inc. (CASA) A Good Stock To Buy?"
2020-06-01,Casa Systems To Virtually Present at the Stifel 2020 Cross Sector Insight Conference
2020-05-21,Has Casa Systems (CASA) Outpaced Other Consumer Discretionary Stocks This Year?
2020-05-19,Casa Systems (CASA) Upgraded to Buy: Here's Why
2020-05-10,"At US$4.06, Is Casa Systems, Inc. (NASDAQ:CASA) Worth Looking At Closely?"
2020-05-06,"Casa Systems To Virtually Present at the J.P. Morgan 48th Annual Global Technology, Media and Communications Conference"
2020-05-04,"Casa Systems, Inc. (CASA) Q1 2020 Earnings Call Transcript"
2020-04-30,Casa Systems Reports First Quarter 2020 Financial Results
2020-04-29,Should You Buy Casa Systems (CASA) Ahead of Earnings?
2020-04-23,Casa Systems (CASA) Expected to Beat Earnings Estimates: Should You Buy?
2020-04-22,J.P. Morgan Picks 2 Stocks to Buy (and 1 to Sell)
2020-04-17,"Casa Systems' Shares March Higher, Can It Continue?"
2020-04-16,Top Ranked Momentum Stocks to Buy for April 16th
2020-04-15,Buy 5 Top Stocks Set to Beat on Q1 Earnings This Month
2020-04-09,"Casa Systems To Release First Quarter 2020 Results on Thursday, April 30th, 2020"
2020-04-03,Casa Systems CEO Pays $15.3 Million for Striking La Jolla Mansion
2020-04-03,Casa Systems CEO Pays $15.3 Million for Striking La Jolla Mansion
2020-03-26,Did You Manage To Avoid Casa Systems's (NASDAQ:CASA) Painful 59% Share Price Drop?
2020-03-25,Casa Systems Currently Sees No Impact from COVID-19 on Operations
2020-03-10,Are Options Traders Betting on a Big Move in Casa Systems (CASA) Stock?
2020-02-24,"Casa Systems To Present at the Morgan Stanley Technology, Media & Telecom Conference"
2020-02-21,3 Tech Stocks That Will Thrive on the 5G Boom
2020-02-21,Factors Setting the Tone for WW International (WW) Q4 Earnings
2020-02-20,Casa Systems (CASA) Q4 Earnings and Revenues Surpass Estimates
2020-02-20,Casa Systems Reports Fourth Quarter and Full Year 2019 Financial Results
2020-02-19,Why Casa Systems (CASA) Might Surprise This Earnings Season
2020-02-13,Casa Systems (CASA) Expected to Beat Earnings Estimates: Can the Stock Move Higher?
2020-02-07,"Lionsgate (LGF.A) Q3 Earnings Lag Estimates, Revenues Up Y/Y"
2020-02-07,Activision's (ATVI) Q4 Earnings Decline Y/Y on Weak Revenues
2020-02-06,"Fox Corp (FOXA) Q2 Earnings Beat Estimates, Revenues Up Y/Y"
2020-02-05,Casa Systems to Host TechTalk on 5G Fixed Wireless Access
2020-01-28,EXL Appoints Maurizio Nicolelli as Executive Vice President and Chief Financial Officer
2020-01-24,Casa Systems Increases GAAP Revenue Guidance for Fiscal Year 2019 and Announces CFO Transition
2019-12-19,"Was Smart Money Right About Dumping Casa Systems, Inc. (CASA) in September?"
2019-12-02,Casa Systems To Present at the Credit Suisse Technology Conference
2019-11-11,Casa Systems Unveils CloudMesh(TM)
2019-11-01,"Casa Systems, Inc. Shareholder Alert  Kehoe Law Firm, P.C. Investigating Potential Securities Claims on Behalf of Investors of Casa Systems - CASA"
2019-10-31,"Casa Systems (CASA) Reports Q3 Loss, Lags Revenue Estimates"
2019-10-31,Casa Systems Reports Third Quarter 2019 Financial Results
2019-10-30,"Hedge Funds Arent Crazy About Casa Systems, Inc. (CASA) Anymore"
2019-10-24,Analysts Estimate Casa Systems (CASA) to Report a Decline in Earnings: What to Look Out for
2019-10-17,"Casa Systems To Release Third Quarter 2019 Results on Thursday, October 31st, 2019"
2019-10-17,Casa Systems and BT Win Best New 5G Technology at Broadband World Forum 2019
2019-10-09,"Glancy Prongay & Murray LLP Continues Its Investigation on Behalf of Casa Systems, Inc. Investors (CASA)"
2019-10-07,"INVESTOR ALERT: Law Offices of Howard G. Smith Continues Its Investigation on Behalf of Casa Systems, Inc. Investors (CASA)"
2019-10-02,"IPO CASA PURCHASER ALERT: The Schall Law Firm Announces it is Investigating Claims Against Casa Systems, Inc. and Encourages Investors with Losses to Contact the Firm"
2019-10-02,Casa Systems introduces latest innovations in multi-access technology for next generation broadband networks at Cable-Tec Expo 2019
2019-09-30,GoPro (GPRO) Looks Good: Stock Adds 7.4% in Session
2019-09-26,What Is Casa Systems's (NASDAQ:CASA) P/E Ratio After Its Share Price Rocketed?
2019-09-23,"EQUITY ALERT: Levi & Korsinsky, LLP Reminds Investors of an Investigation Involving Possible Securities Fraud Violations by Certain Officers and Directors of Casa Systems, Inc."
2019-09-13,"EQUITY ALERT: Levi & Korsinsky, LLP Reminds Investors of an Investigation Involving Possible Securities Fraud Violations by Certain Officers and Directors of Casa Systems, Inc."
2019-09-12,European software firm Akeneo to grow Boston headcount with $46M round
2019-08-29,"IMPORTANT INVESTOR NOTICE: The Schall Law Firm Announces it is Investigating Claims Against Casa Systems, Inc. and Encourages Investors with Losses to Contact the Firm"
2019-08-29,"Glancy Prongay & Murray LLP Continues Its Investigation on Behalf of Casa Systems, Inc. Investors (CASA)"
2019-08-29,"INVESTOR ALERT: Law Offices of Howard G. Smith Continues Its Investigation on Behalf of Casa Systems, Inc. Investors (CASA)"
2019-08-28,"SHAREHOLDER ALERT: The Schall Law Firm Announces it is Investigating Claims Against Casa Systems, Inc. and Encourages Investors with Losses to Contact the Firm"
2019-08-27,"Bragar Eagel & Squire, P.C. is Investigating Casa Systems, Greenlane Holdings, Surface Oncology, and Sunnova Energy on Behalf of Stockholders and Encourages Investors to Contact the Firm"
2019-08-22,"ONGOING INVESTIGATION REMINDER: The Schall Law Firm Announces it is Investigating Claims Against Casa Systems, Inc. and Encourages Investors with Losses in Excess of $100,000 to Contact the Firm"
2019-08-20,"Shareholder Alert: Robbins Arroyo LLP Announces Another Complaint Filed Against Casa Systems, Inc. (CASA)"
2019-08-20,"Do You Like Casa Systems, Inc. (NASDAQ:CASA) At This P/E Ratio?"
2019-08-20,"CASA LOSS NOTICE: ROSEN, A LEADING LAW FIRM, Continues to Investigate Securities Claims Against Casa Systems, Inc. - CASA"
2019-08-15,"Glancy Prongay & Murray LLP Continues Investigation on Behalf of Casa Systems, Inc. Investors (CASA)"
2019-08-15,"INVESTOR ALERT: Law Offices of Howard G. Smith Continues Investigation on Behalf of Casa Systems, Inc. Investors (CASA)"
2019-08-14,"Bragar Eagel & Squire, P.C. is Investigating Casa Systems, Greenlane Holdings, Surface Oncology, and Pintec Technology on Behalf of Stockholders and Encourages Investors to Contact the Firm"
2019-08-09,"IPO INVESTOR NOTICE: The Schall Law Firm Announces it is Investigating Claims Against Casa Systems, Inc. and Encourages Investors with Losses to Contact the Firm"
2019-08-07,Stocks Rebound and Finally Snap Week-Long Skid
2019-08-06,Surging Earnings Estimates Signal Upside for Casa Systems (CASA) Stock
2019-08-05,"INVESTOR ACTION ALERT: The Schall Law Firm Announces it is Investigating Claims Against Casa Systems, Inc. and Encourages Investors with Losses to Contact the Firm"
2019-08-05,Casa Systems Showcases Suite of Multi-Access Network Technology Solutions at CableLabs Summer Conference
2019-08-03,"IMPORTANT SHAREHOLDER NOTICE: The Schall Law Firm Announces it is Investigating Claims Against Casa Systems, Inc. and Encourages Investors with Losses to Contact the Firm"
2019-08-01,"ONGOING INVESTIGATION NOTICE: The Schall Law Firm Announces it is Investigating Claims Against Casa Systems, Inc. and Encourages Investors with Losses to Contact the Firm"
2019-08-01,"Casa Systems, Inc. (CASA) Q2 2019 Earnings Call Transcript"
2019-07-31,Casa Systems (CASA) Q2 Earnings and Revenues Beat Estimates
2019-07-31,Casa Systems Reports Second Quarter 2019 Financial Results
2019-07-31,"Casa Systems, Inc. to Host Earnings Call"
