2020-12-21,What Type Of Shareholders Make Up National Research Corporation's (NASDAQ:NRC) Share Registry?
2020-12-02,Is National Research Corporation (NRC) A Good Stock To Buy Now?
2020-11-23,Is National Research (NASDAQ:NRC) The Next Multi-Bagger?
2020-11-05,NRC Health Awards Annual Scholarship to UNL Students
2020-11-03,National Research Corporation Announces Third Quarter and Year-to-Date 2020 Results
2020-10-26,Does National Research (NASDAQ:NRC) Deserve A Spot On Your Watchlist?
2020-09-28,The Price Is Right For National Research Corporation (NASDAQ:NRC)
2020-08-31,Shareholders of National Research (NASDAQ:NRC) Must Be Delighted With Their 420% Total Return
2020-08-25,NRC Health Announces Winners of the 2020 Customer Approved and Employee Approved Awards Honoring Senior Living Organizations Across the Country
2020-08-24,NRC Health Announces Winner of First-Ever Excellence in Human Understanding Award
2020-08-24,NRC Health Announces Winners of 2020 Excellence Awards During First-Ever Virtual Symposium
2020-08-24,NRC Health Unveils Winners of Third-Annual Consumer Loyalty Awards
2020-08-05,Our View On National Research's (NASDAQ:NRC) CEO Pay
2020-08-04,National Research Corporation Announces Second Quarter and Year-To-Date 2020 Results
2020-07-28,NRC Health Transitions Annual Healthcare Symposium to Virtual Format
2020-07-22,National Research Corporation to Broadcast its 2020 Second Quarter Conference Call Live on the Internet
2020-06-22,Hedge Funds Are Selling National Research Corporation (NRC)
2020-05-08,If You Like EPS Growth Then Check Out National Research (NASDAQ:NRC) Before It's Too Late
2020-05-05,National Research Corporation Announces First Quarter 2020 Results
2020-04-21,National Research Corporation to Broadcast its 2020 First Quarter Conference Call Live on the Internet
2020-04-18,Were Hedge Funds Right About National Research Corporation (NRC)?
2020-04-15,"NRC Health Donates 10,000 Face Shields to US Hospitals and Senior Living Facilities"
2020-04-15,"How Does National Research's (NASDAQ:NRC) P/E Compare To Its Industry, After Its Big Share Price Gain?"
2020-03-26,Read This Before Considering National Research Corporation (NASDAQ:NRC) For Its Upcoming US$0.21 Dividend
2020-03-13,What Is National Research's (NASDAQ:NRC) P/E Ratio After Its Share Price Tanked?
2020-03-09,National Research Corporation Declares Quarterly Dividend
2020-02-20,Does National Research Corporation's (NASDAQ:NRC) Past Performance Indicate A Stronger Future?
2020-02-11,National Research Corporation Announces 2019 Fourth Quarter and Year-End Results
2020-02-07,NRC Health Releases Healthcare Consumer Trends Report: How Providers Can Get Closer to the Customer in 2020
2020-02-05,The Governance Institute Releases 2019 Biennial Survey Results Highlighting Governance Structure in Hospitals and Health Systems
2020-01-28,National Research Corporation to Broadcast its 2019 Fourth Quarter and Year-End Conference Call Live on the Internet
2020-01-28,How Does National Research Corporation (NASDAQ:NRC) Affect Your Portfolio Volatility?
2019-12-30,Announcing: National Research (NASDAQ:NRC) Stock Soared An Exciting 406% In The Last Five Years
2019-12-17,Hedge Funds Have Never Been More Bullish On National Research Corporation (NRC)
2019-12-16,NRC Health Awards Annual Scholarship to UNL Students
2019-12-09,National Research Corporation (NASDAQ:NRC) Earns A Nice Return On Capital Employed
2019-11-25,National Research Corporation Declares Quarterly Dividend
2019-11-18,NRC Health CEO Mike Hays Awards Annual Scholarship To UNL Students
2019-11-13,Is National Research Corporation's (NASDAQ:NRC) 1.2% Dividend Worth Your Time?
2019-11-05,National Research Corporation Announces Third Quarter 2019 Results
2019-10-28,Hedge Funds Have Never Been This Bullish On National Research Corporation (NRC)
2019-10-22,National Research Corporation to Broadcast its 2019 Third Quarter Conference Call Live on the Internet
2019-09-20,Largest Insider Trades of the Week
2019-09-13,5 Health Care Stocks Gurus Are Buying
2019-08-26,National Research Corporation Declares Quarterly Dividend
2019-08-15,NRC Health Names Winners of 2019 Excellence Awards
2019-08-14,NRC Health Announces Second-Annual Consumer Loyalty Awards Winners
2019-08-09,National Research Corporation (NRC) Q2 2019 Earnings Call Transcript
2019-08-06,National Research (NRC) Q2 Earnings and Revenues Surpass Estimates
2019-08-06,National Research Corporation Announces Second Quarter 2019 Results
2019-08-05,Dr. Gary Kaplan to Present Keynote at The Governance Institutes October Leadership Conference
2019-07-30,Earnings Preview: National Research (NRC) Q2 Earnings Expected to Decline
2019-07-23,National Research Corporation to Broadcast its 2019 Second Quarter Conference Call Live on the Internet
2019-06-04,NRC Health and Kansas Department for Aging and Disability Services Announce Sixth Annual Resident Satisfaction Survey and Star Ratings Results
2019-06-03,National Research Corporation Declares Quarterly Dividend
2019-05-30,NRC Health and Hackensack Meridian Health Partner for the First Patient Experience Summit
2019-05-14,UPDATE - NRC Health Announces Winners of the 2019 Customer and Employee Approved Awards Among Senior Living Communities
2019-05-13,NRC Health Announces Winners of the 2019 Customer and Employee Approved Awards Among Senior Living Communities
2019-05-08,National Research Corporation (NRC) Q1 2019 Earnings Call Transcript
2019-05-07,National Research: 1Q Earnings Snapshot
2019-05-07,National Research Corporation Announces First Quarter 2019 Results
2019-05-02,Is National Research Corporation (NRC) A Good Stock To Buy?
2019-04-22,National Research Corporation to Broadcast its 2019 First Quarter Conference Call Live on the Internet
2019-03-01,[$$] The appliance of science now centres on Luxembourgs domestic research
2019-02-26,NRC Health Hosts 2019 Pediatric Collaborative at Dayton Childrens Hospital
2019-02-13,National Research Corporation Declares Quarterly Dividend
2019-02-12,National Research: 4Q Earnings Snapshot
2019-02-12,National Research Corporation Announces Fourth Quarter and Year-End 2018 Results
2019-02-11,NRC Health Partners with Premier Senior-living Podcast
2019-01-29,National Research Corporation to Broadcast its 2018 Fourth Quarter and Year-End Conference Call Live on the Internet
2019-01-10,NRC Health Partners with TennCare to Improve Quality of Care and Resident Satisfaction in Medicaid Nursing Facilities Across Tennessee
2018-12-21,NRC Health Trends Report Uncovers the Forces Shaping Healthcare Consumerism
2018-12-17,The Governance Institute Announces Governance Technology Partnership with Nasdaq
2018-12-10,National Research Corporation Declares Special and Quarterly Dividend
2018-11-26,NRC Health Awards Annual Scholarship to UNL Students
2018-11-19,"Detailed Research: Economic Perspectives on Ark Restaurants, National Security Group, Geospace Technologies, NXT-ID, National Research, and Lifeway Foods  What Drives Growth in Today's Competitive Landscape"
2018-11-06,National Research: 3Q Earnings Snapshot
2018-11-06,National Research Corporation Announces Third Quarter 2018 Results
2018-10-22,National Research Corporation to Broadcast its 2018 Third Quarter Conference Call Live on the Internet
2018-10-17,The Governance Institute Releases Strategy Toolbook to Support Hospital Leaders in Managing Two-Sided Risk Contracts
2018-09-04,National Research Corporation Declares Quarterly Dividend
2018-08-28,Kaiser Permanente Woodland Hills Medical Center recognized for exceptional commitment to improving healthcare outcomes
2018-08-27,NRC Health Releases First Loyalty-Based U.S. Hospital Rankings
2018-08-13,"With Excellence in Action Awards, NRC Health recognizes outstanding service and engagement in long-term care and senior living"
2018-08-08,National Research (NRC) Surpasses Q2 Earnings Estimates
2018-08-08,National Research: 2Q Earnings Snapshot
2018-08-07,National Research Corporation Announces Second Quarter 2018 Results
2018-06-25,"Only 2 Days Left To Cash In On National Research Corporation (NASDAQ:NRC) Dividend, Is It Worth Buying?"
2018-06-14,New Research from NRC Health and MetroHealth: Patients Willing to Switch Providers for Ease
