2021-01-05,2020 Migration Trends: U-Haul Names Top 25 Canadian Growth Cities
2021-01-04,2020 Migration Trends: U-Haul Names Top 25 U.S. Growth Cities
2021-01-04,2020 Migration Trends: U-Haul Ranks 50 States by Migration Growth
2021-01-04,"2020 Migration Trends: People are Moving Again, Exiting New York City and the SF Bay Area"
2021-01-02,Billionaire David Abrams Top 10 Stock Picks
2021-01-01,Have Insiders Been Buying AMERCO (NASDAQ:UHAL) Shares?
2020-12-18,Big Investor in U-Haul Parent Amerco Buys More Stock
2020-12-17,Is UHAL A Good Stock To Buy Now?
2020-12-16,U-Haul a Two-Time Finalist for 2020 S&P Global Platts Energy Awards
2020-12-10,AMERCO Announces Special Cash Dividend
2020-11-25,Storm Relief: U-Haul Offers 30 Days Free Storage across Metro Dallas
2020-11-19,Now Open: U-Haul of North Nashua Has Self-Storage Rooms for Rent
2020-11-05,Amerco (UHAL) Q2 2021 Earnings Call Transcript
2020-11-04,Amerco Reports Second Quarter Fiscal 2021 Financial Results
2020-10-29,U-Haul Expands 30 Days Free Self-Storage Offer to Zeta Storm Victims
2020-10-22,Gift for Giving: Free Storage for Food Drive Donations at U-Haul
2020-10-21,AMERCO Schedules Second Quarter Fiscal Year 2021 Financial Results Release and Investor Webcast
2020-10-20,AMERCO (NASDAQ:UHAL) Is Going Strong But Fundamentals Appear To Be Mixed : Is There A Clear Direction For The Stock?
2020-10-12,U-Haul of Cooks Corner in Brunswick Closes after 34 Years
2020-10-12,Hedge Funds Slowly Warming Up To AMERCO (UHAL)
2020-10-06,Renewable Propane Arrives at U-Haul Autogas Locations in SoCal
2020-10-02,U-Haul at Gordon Hwy. in Augusta to Close after 43 Years
2020-10-02,U-Haul Named 2020 Business Journal Healthiest Employer Winner
2020-09-30,AMERCO Board Members John P. Brogan and James J. Grogan Recognized as NACD Directorship Certified
2020-09-22,Tropical Depression Beta: U-Haul Offers 30 Days Free Storage in Southeast Texas
2020-09-16,"Hurricane Sally: U-Haul Offers 30 Days Free Storage in Alabama, Georgia"
2020-09-16,The Trends At AMERCO (NASDAQ:UHAL) That You Should Know About
2020-09-16,Real Estate: New U-Haul Facility a Reflection of Keene's Growth
2020-09-16,U-Haul Shares Plans for New Self-Storage Center in Jacksonville
2020-09-09,"Wildfire Evacuees: U-Haul Offers 30 Days Free Self-Storage in Oregon, Washington"
2020-09-09,Achilles Nashville's 7th Hope & Possibility Race Goes Virtual
2020-09-09,Achilles New Jersey's Hope & Possibility Race Goes Virtual
2020-09-01,Virtual Unveiling: Pearl Harbor Presents a New View from Above
2020-08-24,U-Haul Closed Memphis Repair Shop after 47 Years
2020-08-21,AMERCO Announces Special Cash Dividend
2020-08-21,"California Wildfire Help: U-Haul Expands Free Storage Offer to Bay Area, Red Bluff"
2020-08-21,UHAL: Take-aways from the virtual Investor conference!
2020-08-20,Best for Vets 2020: U-Haul Named a Top Veteran-Friendly Employer
2020-08-20,Vacaville Fire Victims: U-Haul Offers 30 Days Free Self-Storage
2020-08-13,Derecho Recovery: U-Haul Offers 30 Days Free Self-Storage in Iowa
2020-08-12,U-Haul at Fulton Industrial in Atlanta to Close after 36 Years
2020-08-12,"12 Unconventional Ways to Earn a Real Return on Your Money When the Feds Made It Really, Really Hard"
2020-08-11,"Business Opening: U-Haul Offers Retail, Storage in West Atlanta"
2020-08-10,AMERCO Announces Fourteenth Annual Virtual Analyst and Investor Meeting
2020-08-06,UHAL: AMERCO beat the estimates
2020-08-05,AMERCO Reports First Quarter Fiscal 2021 Financial Results
2020-07-31,Hurricane Isaias: U-Haul Offers 30 Days Free Storage in 3 States
2020-07-30,AM Best Affirms Credit Ratings of Oxford Life Insurance Company and Its Subsidiaries
2020-07-22,AMERCO Schedules First Quarter Fiscal Year 2021 Financial Results Release and Investor Webcast
2020-07-20,Now Open: U-Haul at Manchester Airport Offers 979 Storage Rooms
2020-07-17,U-Haul of Sierra Vista to Close after 36 Years
2020-07-16,U-Haul Store Closing on West Ajo Way in Tucson after 44 Years
2020-07-15,U-Haul Opening New Self-Storage Facility on July 20 in Tucson
2020-07-15,2Q 2020: To Hell and Back
2020-06-30,Edited Transcript of UHAL earnings conference call or presentation 28-May-20 3:00pm GMT
2020-06-30,U-Haul Acquires Former Aladdin Self-Storage Facility in Louisville
2020-06-30,Moving Makeover: U-Haul of Rivergate Filling Vacant Building in Madison
2020-06-30,U-Haul Reuse of Former Kmart will Bring Benefits to Latrobe
2020-06-29,"U-Haul Land Acquisition Means New Facility, Jobs in Murfreesboro"
2020-06-29,Real Estate Update: U-Haul of Clarksville Shares Expansion Plans
2020-06-29,U-Haul Shares Plans for New Self-Storage Center in St. Augustine
2020-06-29,Moving to Campus Safely with Collegeboxes Early Delivery Service
2020-06-29,"WWII Veterans Remembered: U-Haul Honors First Employee and Cherished Pioneer W.E. ""Hap"" Carty"
2020-06-29,"WWII Veterans Remembered: U-Haul Honors Pennsylvania's William G. ""Bill"" Kreckman"
2020-06-26,U-Haul of West Allis Adding Self-Storage with Abutting Property
2020-06-26,Hedge Funds Are Cashing Out Of AMERCO (UHAL)
2020-06-26,U-Haul Reveals Plans for 600 Storage Rooms at Mansfield Facility
2020-06-26,Self-Storage Rooms Coming to U-Haul at Preston Hwy. in Louisville
2020-06-24,"Flooding in Jefferson, Orleans, Terrebonne Parishes: U-Haul Offers 30 Days Free Storage"
2020-06-23,Central Fire Victims: U-Haul Offers 30 Days Free Self-Storage
2020-06-22,WWII Veterans Remembered: U-Haul Honors Nebraska's Francis T. Wolfe
2020-06-22,WWII Veterans Remembered: U-Haul Honors Montana's Thomas W. Safford
2020-06-22,WWII Veterans Remembered: U-Haul Honors Nebraska's Warren D. Albers
2020-06-22,WWII Veterans Remembered: U-Haul Honors New York's Warren S. Craig
2020-06-22,WWII Veterans Remembered: U-Haul Honors Pennsylvania's Thomas E. Dudley
2020-06-22,WWII Veterans Remembered: U-Haul Honors Pennsylvania's Nelson M. Miller Jr.
2020-06-22,WWII Veterans Remembered: U-Haul Honors North Dakota's Kermit E. Shoen
2020-06-22,"WWII Veterans Remembered: U-Haul Honors Oklahoma's Briscoe Bennett ""B.B."" Smith Jr."
2020-06-22,WWII Veterans Remembered: U-Haul Honors Michigan's Aubrey K. Johnson
2020-06-22,"WWII Veterans Remembered: U-Haul Honors Idaho's Ansley James ""Jim"" Simer"
2020-06-19,Propane Safety: U-Haul Offers Free Tank Inspections All Summer
2020-06-17,Bush Fire Evacuees: U-Haul Offers 30 Days Free Self-Storage
2020-06-13,Collegeboxes Celebrates 10 Years Supporting Stanford Students
2020-06-11,Bighorn Fire Victims: U-Haul Offers 30 Days Free Self-Storage
2020-06-05,5 Profitable Companies With a Margin of Safety
2020-06-01,Now Open: U-Haul Facility in Memphis Boasts 700-Plus Storage Rooms
2020-06-01,AMERCO's (NASDAQ:UHAL) Analyst Just Slashed This Year's Estimates
2020-05-29,UHAL: Not expected to run out of cash! Fourth quarter numbers were much better than expected. Revenue is improving from the low in April 2020 and the relaxed restrictions should boost revenue from these levels. U-Box continues to grow and is profitable.
2020-05-28,Amerco (UHAL) Q4 2020 Earnings Call Transcript
2020-05-28,Now Open: U-Haul Storage of Downtown Dayton Offers 350 Rooms
2020-05-27,AMERCO Reports Fiscal 2020 Financial Results
2020-05-27,CD 2016-CD1 Mortgage Trust -- Moody's affirms eight classes of CD 2016-CD1 Mortgage Trust
2020-05-22,J.C. Penneys Bankruptcy: Its All About the Real Estate
2020-05-21,Moving Safely and Smartly during the COVID-19 Pandemic
2020-05-20,Midland County Flooding: U-Haul Offers 30 Days Free Self-Storage
2020-05-15,U-Haul Offers 30 Days Free Self-Storage to Southern Louisiana Flood Victims
2020-05-13,AMERCO Schedules Fourth Quarter Fiscal Year End 2020 Financial Results Release and Investor Webcast
2020-05-13,Now Open: U-Haul Facility in West Wichita Boasts 950 Storage Rooms
2020-05-07,Returning for Campus Move-Out is Problematic for Many Students
2020-05-04,V-E Day Remembered: U-Haul Celebrates WWII Veteran Homer Williamson
