2020-12-21,ICICI Bank Canada Visa* Debit Card launched
2020-12-07,Should You Bank On Icici Stock? It's Closing In On A Key Technical Measure
2020-11-02,"ICICI Bank's (IBN) Q2 Earnings Up Y/Y, Provisions Increase"
2020-10-31,ICICI Bank Posts Record Profit on Expected Dip in Bad Loans
2020-10-28,"ICICI Bank Limited, Bahrain Branch -- Moody's withdraws ratings of ICICI Bank's Bahrain Branch for business reasons"
2020-10-21,ICICI Bank UK PLC -- Moody's downgrades the long-term deposit and debt ratings of ICICI Bank UK PLC
2020-10-16,ICICI Bank UK PLC -- Moody's announces completion of a periodic review of ratings of ICICI Bank UK PLC
2020-10-15,"ICICI Bank Limited, Hong Kong Branch -- Moody's announces completion of a periodic review of ratings of ICICI Bank Limited"
2020-10-12,ICICI Bank Limited (IBN) Fell Out Of Favor With Hedge Funds
2020-09-03,Indian shares up after services activity survey
2020-08-26,ICICI Bank Makes Use of Satellite Data to Assess Farm Loans
2020-08-25,India's ICICI Bank uses space images for farm loans to cut costs
2020-08-25,ICICI Bank uses satellite images for farm loans to cut costs
2020-08-16,Indias ICICI Bank Raises $2 Billion Via Institutional Placement
2020-08-11,Worlds Most Favored Bank Stock Misses India Market Rebound
2020-08-11,"Sensex, Nifty end higher as private sector banks rally"
2020-07-31,ICICI Bank Limited Files Annual Report in Form 20-F
2020-07-27,"ICICI Bank's (IBN) Q1 Earnings Rise Y/Y, Provisions Surge"
2020-07-25,ICICI Bank quarterly profit misses estimates as provisions soar
2020-07-22,Facebook's WhatsApp to partner with more Indian banks in financial inclusion push
2020-07-17,Did Hedge Funds Make The Right Call On ICICI Bank Limited (IBN) ?
2020-06-24,Indias ICICI Bank Said to Weigh Up to $3 Billion Share Sale
2020-06-24,Indias ICICI Bank Weighs Share Sale of Up to $3 Billion
2020-06-15,Is ICICI Bank Limited (IBN) A Good Stock To Buy?
2020-06-11,Apollo Global Mulling to End Joint Venture With ICICI Bank
2020-06-10,Apollo Global Said to Plan to End Venture With Indias ICICI
2020-05-11,"ICICI Bank (IBN) Q4 Earnings Increase Y/Y, Provisions Jump"
2020-04-21,ICICI Bank confirms exposure to troubled oil trader Hin Leong
2020-04-20,"Sensex, Nifty give up gains as ICICI Bank drops"
2020-04-20,ICICI seeks impounding of ships operated by HLT unit Ocean Tankers - source
2020-04-10,Indias Plunging Stock Prices May Yield Bargains for Investors
2020-04-09,"ICICI Bank UK PLC -- Moody's affirms the deposits ratings of ICICI Bank UK PLC, outlook changed to negative"
2020-04-03,"ICICI Bank Ltd, Singapore Branch -- Moody's takes rating actions on four Indian financial institutions"
2020-03-12,Hedge Funds Started Betting On ICICI Bank Limited (IBN) At The Wrong Time
2020-02-07,Modis India Is Mired in a Slump. But There Are Still Stocks Worth Buying.
2020-01-27,"ICICI Bank (IBN) Q3 Earnings Increase Y/Y, Expenses Rise"
2020-01-25,ICICI Bank December-quarter net profit nearly trebles
2019-12-27,New Strong Sell Stocks for December 27th
2019-12-17,A Trio of Strong Performers Set to Move Higher
2019-12-13,"India Is Slumping, Which Means That Its Time to Shop for Stocks"
2019-12-05,Hedge Funds Cashing Out Of ICICI Bank Limited  (IBN)
2019-12-04,Top Performing Indian Bank Stock of 2019 Has More to Run
2019-12-02,"ICICI Bank Limited, Hong Kong Branch -- Moody's announces completion of a periodic review of ratings of ICICI Bank Limited"
2019-11-15,ICICI Bank UK PLC -- Moody's announces completion of a periodic review of ratings of ICICI Bank UK Plc.
2019-11-08,"HDFC Bank Limited, Hong Kong Branch -- Moody's takes rating actions on 11 Indian financial institutions, after change in sovereign outlook"
2019-10-28,"ICICI Bank's (IBN) Q2 Earnings Increase Y/Y, Expenses Rise"
2019-10-26,ICICI Bank quarterly profit falls 28%
2019-10-09,Hedge Funds Are Buying ICICI Bank Limited (IBN)
2019-09-24,An Asian Trio- Fintech and Finance
2019-09-23,ICICI Bank (IBN) Jumps: Stock Rises 9.8%
2019-09-20,"India Stocks, India ETFs Spike On This Unexpected Fiscal Boost"
2019-08-28,5 Stocks Outperforming the S&P 500
2019-08-05,"HSBC Q2 Pre-Tax Earnings Improve as Revenues Rise, Costs Fall"
2019-08-01,Mitsubishi UFJ (MUFG) Reports Impressive Earnings in Q1
2019-08-01,Barclays (BCS) Q2 Earnings &amp; Revenues Down Amid Brexit Woes
2019-07-30,ICICI Bank (IBN) Catches Eye: Stock Jumps 6.1%
2019-07-30,ICICI Bank (IBN) Stock Jumps 6.1% as Q1 Earnings Increase
2019-07-29,"Why Luckin Coffee, Tower Semiconductor, and ICICI Bank Jumped Today"
2019-07-27,Lower provisions help ICICI Bank swing to first-quarter profit
2019-07-27,ICICI Bank posts quarterly profit
2019-06-25,Top Indian Stocks Traded In The U.S
2019-06-19,Here is What Hedge Funds Think About ICICI Bank Limited (IBN)
2019-05-21,Banking on India with ICICI
2019-05-08,UBS Group to Face $93M Penalty for German Tax Evasion Case
2019-05-08,ICICI Bank (IBN) Stock Down 4.6% as Q4 Earnings Decline
2019-05-03,UBS Shareholders Retain Right to Legal Action Against Board
2019-05-02,Deutsche Bank's US Stress Test Worries European Regulators
2019-04-26,7 A-Rated Stocks That Are Under $10
2019-04-16,"Nifty, Sensex end at record close, financials lead"
2019-04-12,"Zacks.com featured expert Kevin Matras highlights: Walker &amp; Dunlop, Herc, ICICI Bank, HDFC Bank and resTORbio"
2019-04-11,Buy These 5 Stocks as New Analysts Initiate Coverage
2019-04-05,"The Zacks Analyst Blog Highlights: Amazon, 3M, Novartis, Schlumberger and ICICI"
2019-04-04,"Top Analyst Reports for Amazon, 3M & Novartis"
2019-04-02,Is India's 7.3% Growth Worth An Investment?
2019-04-01,7 Stocks From Around the World That Beat U.S. Stocks
2019-03-28,Here is What Hedge Funds Think About ICICI Bank Limited  (NYSE:IBN)
2019-03-25,Here's Why India ETFs Are Soaring
2019-01-31,ICICI Bank (IBN) Jumps: Stock Rises 9.2%
2019-01-31,ICICI Bank (IBN) Stock Up 9.2% Despite Lower Q3 Earnings
2019-01-31,ICICI Bank shares end lower over net interest margin concerns
2019-01-30,ICICI Bank third-quarter profit misses estimates
2019-01-14,Top Stock Picks for the Week of January 14th
2019-01-11,Here's Why Momentum Investors Will Love ICICI Bank (IBN)
2018-12-26,"RBS Braces for No-Deal Brexit, Seeks German Banking License"
2018-12-13,ICICI Bank Limited (IBN): Hedge Fund Sentiment Unchanged
2018-10-29,"ICICI Bank (IBN) Reports Lower Q2 Profit, Stock Rallies 4.8%"
2018-10-28,"Morning News Call - India, October 29"
2018-10-26,"ICICI Bank second-quarter profit halves, but asset quality improves"
2018-10-04,ICICI Bank Surges as CEO Kochhar Steps Down Amid Probe
2018-10-04,"ICICI's scandal-hit Chanda Kochhar quits as CEO, Sandeep Bakhshi gets top job"
2018-09-13,Should You Be Tempted To Sell ICICI Bank Limited (NSE:ICICIBANK) Because Of Its PE Ratio?
2018-08-23,Time to buy emerging markets  and seven stocks and funds to consider
2018-08-14,Are Options Traders Betting on a Big Move in ICICI Bank (IBN) Stock?
2018-08-10,ICICI Bank (IBN) in Focus: Stock Moves 5.2% Higher
2018-08-01,ICICI Bank Limited Files Annual Report in Form 20-F
2018-07-30,"ICICI Bank (IBN) Reports Loss in Q1, Stock Rallies 4.4%"
2018-07-30,"Sensex, Nifty hit record closing highs; ICICI Bank, Reliance lead"
2018-07-27,Bad loans and bond provisions tip ICICI Bank into loss
2018-07-27,ICICI Bank Limited Sponsored ADR to Host Earnings Call
2018-07-26,"SEC Queries India's ICICI on Governance, Accounting"
