2021-01-06,Gracenote Powers New Live Sports Experiences for Smart TV and Auto Platforms
2021-01-05,Nielsen Renews Multi-Year Agreement With TEGNA For Local TV Ratings And Insights Services
2020-12-26,STOCK ALERT: Monteverde & Associates Launches Legal Investigation for the Following Transaction
2020-12-22,The Conference Board Consumer Confidence Index速 Declined in December
2020-12-21,Is NLSN A Good Stock To Buy According To Hedge Funds?
2020-12-21,Nielsen Holdings' (NYSE:NLSN) Shareholders Are Down 57% On Their Shares
2020-12-18,You continue to worry that many companies are not living their values: Ariel Investments founder John Rogers
2020-12-16,Nielsen Global Connect Displays Impressive E-Commerce Measurement Strength And Power For U.S. Online Grocery Industry
2020-12-14,AdLarge Media And Nielsen Sign Renewal Agreement For Network Audio Measurement Of The ALM ROI Network
2020-12-10,WeWork Rides 5G to the Work-From-Anywhere Future
2020-12-09,Nielsen Rallies After Vowing to Overhaul Way It Tracks Audiences
2020-12-09,"""New Nielsen"" Debuts at Investor Day 2020"
2020-12-08,Cross-Media Currency Becomes Reality With Nielsen ONE
2020-12-07,"SHAREHOLDER ALERT: Rigrodsky & Long, P.A. Announces Investigation of Nielsen Holdings plc"
2020-12-03,Streaming Platforms Leading The Way In On-screen Diverse Representation
2020-11-30,Nielsen Names Jamie Moldafsky As Chief Marketing And Communications Officer
2020-11-26,Media Advisory: Infrastructure Announcement in Yukon
2020-11-24,The Conference Board Consumer Confidence Index速 Decreased in November
2020-11-23,Nielsen to Host Virtual 2020 Investor Day
2020-11-19,Nielsen Advances The Next Frontier Of Measurement And Technology
2020-11-17,Analyzing Nielsen Holdings's Ex-Dividend Date
2020-11-16,FMCG Brands Capitalize On Innovation Trends To Drive Business Growth In The New Normal
2020-11-16,Nielsen To Present At Virtual J.P. Morgan Ultimate Services Investor Conference
2020-11-13,Don't Race Out To Buy Nielsen Holdings plc (NYSE:NLSN) Just Because It's Going Ex-Dividend
2020-11-10,"Nielsen Doubles Down On Advanced TV Measurement, Helps Advertisers Unlock & Monetize Addressable"
2020-11-05,Nielsen Holdings PLC (NLSN) Q3 2020 Earnings Call Transcript
2020-11-03,Nielsen Holding and Finance B.V. -- Moody's says Nielsen's pending sale of Connect business to Advent is credit positive; Ba3 CFR and negative outlook not immediately impacted
2020-11-03,Dealmakers in Record $143 Billion M&A Rush Before Election
2020-11-03,"Company News for Nov 3, 2020"
2020-11-03,Nielsen (NLSN) Q3 Earnings and Revenues Surpass Estimates
2020-11-02,Nielsen to Sell Consumer-Data Unit to PE Firm Advent for $2.7B
2020-11-02,Nielsen Offloads Its Global Connect Business To Private Equity For $2.7B
2020-11-02,Nielsen (NLSN) to Report Q3 Earnings: What's in the Offing?
2020-11-02,"Nielsen shares jump 10% premarket as earnings top estimates, company unveils $2.7 billion deal"
2020-11-02,Nielsen Reports 3rd Quarter 2020 Results
2020-11-02,Nielsen To Spin Off Consumer Data Unit In $2.7B Deal
2020-11-01,Nielsen to sell consumer goods data arm to Advent for $2.7 billion
2020-11-01,Nielsen Announces Sale of Global Connect Business to Advent International for $2.7 Billion
2020-11-01,Nielsen Announces Sale of Global Connect Business to Advent International for $2.7 Billion
2020-10-30,"Survey: Despite Shaky Economy, Holiday Shoppers Plan to Spend Same Amount on Gifts as in 2019"
2020-10-29,ZAGENO Acclaimed by Frost & Sullivan for Simplifying the Biotech Purchasing Process with Its Intuitive eCommerce Platform
2020-10-28,Nielsen To Report Third Quarter 2020 Results
2020-10-27,Nielsen Declares Quarterly Dividend
2020-10-27,Nielsen's Global Consumer Business Reinvents Itself For The Future Of Consumer Intelligence
2020-10-27,The Conference Board Consumer Confidence Index速 Decreased Slightly in October
2020-10-23,Nielsen Holdings plc (NYSE:NLSN) Insiders Increased Their Holdings
2020-10-21,Nielsen's 10th-Year African American Consumer Report Explores The Power Of The Black Community From Moment To Movement
2020-10-21,Nielsen Reaches Agreement With NPR For Podcast Buying Power Service
2020-10-17,Nielsen Holdings plc -- Moody's assigns B2 rating to Nielsen's new senior unsecured notes
2020-10-01,Nielsen Supercharges Ad Intelligence Platform With Richer Advertising Spend Data
2020-10-01,Capitalizing on Innovation Trends Today Will Drive Business Growth in the New Normal
2020-09-29,The Conference Board Consumer Confidence Index Increased in September
2020-09-29,Nielsen's Global Consumer Business Reinforces Commitment To Chicago As Site Of Global Headquarters
2020-09-18,Is Nielsen Holdings (NLSN) a Good Value Investor Stock Now?
2020-09-17,AVOD Is Starting to Take a Bite Out of Subscription Services Like Netflix and Disney's Hulu
2020-09-17,Are Investors Undervaluing Nielsen Holdings plc (NYSE:NLSN) By 27%?
2020-09-17,Launching Nielsen Compass: A World Leading And Powerful Campaign Outcomes Database
2020-09-16,Gracenote Enables Cross-Platform Search and Discovery of Sports Content Across Walled Gardens
2020-09-15,Is Nielsen Holdings plc (NLSN) Going to Burn These Hedge Funds?
2020-09-14,IBM Joins Forces With Nielsen Global Consumer Business To Expand Data Targeting Offerings For Marketers
2020-09-10,Nielsen Prices $1 Billion of 5.625% Senior Notes Due 2028 and $750 Million of 5.875% Senior Notes Due 2030
2020-09-10,Nielsen's (NLSN) Subsidiaries Price $1 Billion Senior Notes
2020-09-09,Nielsen to offer $500 million of 8-year bonds and $500 million of 10-year bonds
2020-09-09,Nielsen Announces $1 Billion Debt Offering and Delivery of Conditional Notice of Partial Redemption of its 5.500% Senior Notes due 2021 and its 5.000% Senior Notes due 2022
2020-09-08,Nielsen To Present At Three Upcoming Investor Conferences
2020-09-03,13 Cheap Stocks That Could Be Traps for Value Investors
2020-09-02,"Nielsen Fan Insights Expands Coverage in Asia, Makes Fan Behavior Data Available for 26 Markets Worldwide"
2020-08-26,Nielsen Appoints Scott Brown as Head of Audience Measurement to Lead the Company's Cross-Media Strategy
2020-08-25,The Conference Board Consumer Confidence Index Decreased in August
2020-08-25,Nielsen and Aperity Collaborate to Enhance Open Data Landscape for Beverage Supply Chain Participants
2020-08-24,2 Stocks That Warren Buffett Might Like Right Now
2020-08-18,Democratic National Convention viewing audience shrinks 28% opening night
2020-08-12,Should You Think About Buying Nielsen Holdings plc (NYSE:NLSN) Now?
2020-08-12,Veritone One Subscribes To Nielsen's Podcast Buying Power Service
2020-08-06,"Nielsen Company (Luxembourg) S.a.r.l., The -- Moody's announces completion of a periodic review of ratings of Nielsen Holdings plc"
2020-08-06,New Study Reveals Latinos Are Transforming Cultural Connections During COVID-19
2020-08-05,Nielsen's (NLSN) Q2 Earnings and Revenues Beat Estimates
2020-08-05,Nielsen Holdings: Debt Overview
2020-08-05,Recap: Nielsen Holdings Q2 Earnings
2020-08-05,Nielsen Reports 2nd Quarter 2020 Results
2020-08-04,Why Nielsen (NLSN) Might Surprise This Earnings Season
2020-07-31,Nielsen (NLSN) to Report Q2 Earnings: What's in the Offing?
2020-07-29,Nielsen: Virtual Banks to Become a Real Game Changer to Banking Industry Landscape
2020-07-28,The Conference Board Consumer Confidence Index Decreased in July
2020-07-28,Nielsen Report Finds that Driving Connections with Multicultural Consumers is Key for Auto Industry
2020-07-24,Invest in Streamlytics: A Better Way to Gather Streaming Media Data
2020-07-21,Nielsen Launches Next Gen Methodology For Its Flagship Digital Measurement Products
2020-07-21,Nielsen To Report Second Quarter 2020 Results
2020-07-17,Nielsen Declares Quarterly Dividend
2020-07-13,Nielsen Holding and Finance B.V. -- Moody's says Nielsen's incremental Euro term loan will not impact the Ba3 CFR
2020-07-10,Did Hedge Funds Make The Right Call On Nielsen Holdings plc (NLSN)?
2020-07-09,Nielsen And SKU Ninja + WhyteSpyder Combine Tools To Empower Walmart Suppliers To Optimize Online Content And Performance
2020-07-09,Nielsen Launches Audience Planner Solution For Efficient Integration of First-Party Data
2020-07-07,How Much Did Nielsen Holdings'(NYSE:NLSN) Shareholders Earn From Share Price Movements Over The Last Five Years?
2020-07-07,"Nielsen accelerates transformation plan, to shed 3,500 jobs"
2020-07-07,Nielsen Announces Broad-Based Optimization Plan To Accelerate Transformation
2020-06-30,The Conference Board Consumer Confidence Index Increased in June
2020-06-23,Media Rating Council (MRC) Accreditation Granted To Nielsen's National And Enhanced Local TV Ratings Services
2020-06-18,Nielsen Brandbank And SKU Ninja速 + WhyteSpyder Team Up To Bolster Rich Media Capabilities For Walmart Suppliers
2020-06-17,Edited Transcript of NLSN earnings conference call or presentation 30-Apr-20 12:00pm GMT
