2021-01-11,Dwayne The Rock Johnson partners with Molson Coors for nonalcoholic energy drink
2021-01-11,Molson Coors Beverage Company to Webcast 2020 Fourth Quarter Earnings Conference Call
2021-01-08,TAP or BUD: Which Is the Better Value Stock Right Now?
2021-01-05,10 Best Beverage Stocks To Buy Now
2021-01-04,Here's Why Molson Coors (TAP) is an Attractive Investment for 2021
2021-01-04,Consumers may embrace alcohol abstinence in January as brands help consumers 'dry' out
2020-12-23,TAP vs. BUD: Which Stock Should Value Investors Buy Now?
2020-12-21,Is TAP A Good Stock To Buy According To Hedge Funds?
2020-12-18,Molson Coors International LP -- Moody's announces completion of a periodic review of ratings of Molson Coors Beverage Company
2020-12-16,Court Denies Molson Coors Motion to Dismiss Future Proof Federal Infringement Claim
2020-12-15,Molson Coors Beverage Company Donates Nearly 3 Million Meals to Families Across U.S. And Canada
2020-12-10,15 Largest Beer Companies in the World
2020-12-10,Moving Average Crossover Alert: Molson Coors Beverage (TAP)
2020-12-09,Molson Coors Beverage Company -- Moody's affirms Molson Coors' Baa3/P-3 ratings; outlook stable
2020-12-09,Future Proof Makes Headway with Federal Infringement Claim Against Molson Coors
2020-12-08,Should You Investigate Molson Coors Beverage Company (NYSE:TAP) At US$47.66?
2020-12-07,TAP vs. BUD: Which Stock Should Value Investors Buy Now?
2020-12-07,Molson Coors' Big Bet on Hard Seltzers Is the Right One to Make
2020-12-04,Molson Coors just launched its first CBD drinks in the US
2020-12-04,Molson Coors CEO on beer trends amid the pandemic
2020-12-03,Top Beer Stocks for Q1 2021
2020-12-01,Molson Coors Invests in Boosting Its Seltzer and Hard Seltzer Output by 400%
2020-12-01,Molson Coors Beverage Company Increases Production Capacity for Seltzers and Popular Innovations by More Than 400% to Keep Up With Demand
2020-11-25,Molson CEO: 'We Know How To Operate In The Middle Of A Pandemic'
2020-11-24,Bacardi Limited CFO on alcohol sales during COVID-19
2020-11-19,TAP or BUD: Which Is the Better Value Stock Right Now?
2020-11-11,Earnings Estimates Rising for Molson Coors (TAP): Will It Gain?
2020-11-06,"Alcohol sales soared 68% on Election Day, with Democratic states buying the most: Drizly"
2020-11-06,Molson Coors Divests Irwindale Brewery to Boost Efficiency
2020-11-06,"For Hexo Stock, In God We Truss Might Be Its Best Bet"
2020-11-05,Molson Coors Completes Sale of Irwindale Brewery
2020-11-04,"Canadian cannabis company agrees to buy U.S. craft-beer maker Sweetwater, known for its 420-branded brews"
2020-11-03,Was The Smart Money Right About Molson Coors Beverage Company (TAP)?
2020-11-03,Should Value Investors Buy Molson Coors Brewing (TAP) Stock?
2020-11-03,TAP or DEO: Which Is the Better Value Stock Right Now?
2020-11-02,Molson Coors Beverage Company Just Beat Earnings Expectations: Here's What Analysts Think Will Happen Next
2020-10-30,"Molson Coors CEO says revitalization is about more than just seltzer, though thats a big part of the beyond beer approach"
2020-10-30,Molson Coors Brewing Co (TAP) Q3 2020 Earnings Call Transcript
2020-10-29,Molson Coors (TAP) Rises as Q3 Earnings & Sales Beat Estimates
2020-10-29,Is Molson Coors Stock a Buy?
2020-10-29,Molson Coors Stock Chugs Along After Big Q3 Beat
2020-10-29,Molson Coors Brewing (TAP) Beats Q3 Earnings and Revenue Estimates
2020-10-29,Molson Coors stock shoots up after big profit beat
2020-10-29,Molson Coors Reports 2020 Third Quarter Results and Provides Revitalization Plan Update
2020-10-26,Walmart CEO: Consumers are stocking up again as coronavirus rages on
2020-10-26,Molson Coors (TAP) to Post Q3 Earnings: What's in the Offing?
2020-10-22,Earnings Preview: Molson Coors Brewing (TAP) Q3 Earnings Expected to Decline
2020-10-16,Why Molson Coors Beverage (TAP) Stock is a Compelling Investment Case
2020-10-13,Vizzy Hard Seltzer Donates $1MM to the Human Rights Campaign
2020-10-13,Heady Rebound on 'TAP' for Molson Coors
2020-10-09,Molson Coors Beverage Company to Webcast 2020 Third Quarter Earnings Conference Call
2020-10-05,Corona Hard Seltzer maker takes aim at White Claw's dominance
2020-10-04,Constellation Brands vs Molson Coors: Which Beverage Stock Is The Street Favoring?
2020-10-02,"Patterns are changing, but people are still buying alcohol: Constellation Brands CEO"
2020-10-01,Molson Coors CEO Talks New Coca-Cola Partnership: 'A Really Strong Portfolio'
2020-10-01,"Molson Coors Beverage (TAP) Has Fallen 41% in Last One Year, Underperforms Market"
2020-09-30,Molson Coors Adds Coca-Cola's Topo Chico to Its Seltzer Game
2020-09-30,"Winemakers are 'being tested' as wildfires spread, here's why the fine wine consumer will not experience the smoke-effected grapes"
2020-09-30,"Coca-Cola, Molson Coors Team Up For US Topo Chico Alcoholic Drink"
2020-09-29,"Molson Coors, Coca-Cola partner for U.S. hard seltzer launch"
2020-09-29,Molson Coors to Produce Coke's Topo Chico Hard Seltzer in U.S.
2020-09-29,Molson Coors to Bring Cokes Alcoholic Topo Chico to U.S.
2020-09-29,Molson Coors Continues Hard Seltzer Push With Coca-Cola Topo Chico Deal
2020-09-29,Coca-Cola to enter U.S. alcoholic drinks market with Molson Coors tie-up
2020-09-29,Molson Coors to launch Coca-Cola's first alcoholic beverage in the U.S.
2020-09-29,Molson Coors Enters Exclusive Agreement with The Coca-Cola Company to Bring Topo Chico Hard Seltzer to the U.S.
2020-09-28,Molson Coors (TAP) Upgraded to Strong Buy: Here's What You Should Know
2020-09-28,Should Value Investors Buy Molson Coors Brewing (TAP) Stock?
2020-09-28,TAP vs. DEO: Which Stock Should Value Investors Buy Now?
2020-09-28,52-Week Company Lows
2020-09-20,52-Week Company Lows
2020-09-19,Top Insider Buys Highlight for the Week of Sept. 18
2020-09-16,"Molson Coors (TAP) Fortifies Brands, Signs JV With Yuengling"
2020-09-15,Molson Coors enters joint venture to brew and distribute Yuengling beers
2020-09-15,Yuengling and Molson Coors Form Joint Venture to Expand Geographic Footprint of Yuengling Beers
2020-09-14,Pepsi to launch sleep-aid drink Driftwell as beverage companies expand into new health and wellness categories
2020-09-14,Boston Beer to Join Near-Beer Push With Non-Alcoholic IPA
2020-09-12,10 Countries That Consume the Most Beer in 2020
2020-09-10,Do Hedge Funds Love Molson Coors Beverage Company (TAP)?
2020-09-10,Molson Coors to Expand Non-Alcohol Line With 4 New Brands
2020-09-09,"Molson Coors Expands Beyond the Beer Aisle With New Slate of Non-alcoholic Products, in Partnership With L.A. Libations"
2020-09-06,Story Behind The Ticker: Molson Coors Beverage
2020-09-05,11 Largest Beer Companies in The World in 2020
2020-09-03,Jack Daniels owner reveals the biggest alcohol trend in 2020 so far
2020-09-03,13 Cheap Stocks That Could Be Traps for Value Investors
2020-09-01,Molson Coors Is a Steal
2020-08-31,Molson Coors Has More than Coronavirus Issues
2020-08-29,Molson Coors (TAP) Up 1.2% Since Last Earnings Report: Can It Continue?
2020-08-28,Coors Light Wants To Send You to the Video Chat Background You've Been Staring At For Months
2020-08-27,"Molson Coors Donates 200,000 Cans Of Water To The Red Cross For Communities Hardest Hit By Hurricane Laura"
2020-08-18,How COVID-19 Has Flattened Molson Coors' Business
2020-08-12,"Blue Ribbon, LLC -- Moody's assigns Caa1 rating to Blue Ribbon's extended revolver; outlook remains negative"
2020-08-11,Is Molson Coors Stock Recession-Proof?
2020-08-03,Coca-Cola launching Topo Chico Hard Seltzer as brands from Sam Adams parent and Molson Coors soar
2020-07-31,The Weird Quirks of Covid-Era Shopping
2020-07-31,Molson Coors Delivers Q2 Earnings Beat Despite Covid-19 Fallout
2020-07-30,Molson Coors Brewing Co (TAP) Q2 2020 Earnings Call Transcript
2020-07-30,Molson Coors and AB InBev Stocks Are Rising Because Beer Sales Are Rebounding
2020-07-30,Molson Coors (TAP) Stock Up on Q2 Earnings & Sales Beat
2020-07-30,Beverage industry sees uptick in demand amid COVID-19
