2020-12-28,CVR Energy (CVI) to Continue Working on $110M Conversion Project
2020-12-21,CVR Energy Announces Full Board Approval for Wynnewood Renewable Diesel Unit Project
2020-12-16,Is CVI A Good Stock To Buy Now?
2020-11-24,CVR Energy to Participate in Bank of America 2020 Leveraged Finance Virtual Conference
2020-11-05,"Earnings Release: Here's Why Analysts Cut Their CVR Energy, Inc. (NYSE:CVI) Price Target To US$14.00"
2020-11-03,CVR Energy Inc (CVI) Q3 2020 Earnings Call Transcript
2020-11-03,"CVR Energy, Inc. to Host Earnings Call"
2020-11-02,CVR Energy Reports Third Quarter 2020 Results
2020-10-30,CVR Energy's Earnings Outlook
2020-10-20,CVR Energy to Release Third Quarter 2020 Earnings
2020-10-19,52-Week Company Lows
2020-10-14,"Hedge Funds Arent Crazy About CVR Energy, Inc. (CVI) Anymore"
2020-10-07,"CVR Partners, LP -- Moody's announces completion of a periodic review of ratings of CVR Partners, LP"
2020-09-14,Would Shareholders Who Purchased CVR Energy's (NYSE:CVI) Stock Year Be Happy With The Share price Today?
2020-09-03,CVR Energy to Participate in Barclays CEO Energy-Power Conference
2020-08-12,Phillips 66 to reconfigure California refinery for renewable fuels
2020-08-10,CVR Energy Inc. -- Moody's announces completion of a periodic review of ratings of CVR Energy Inc.
2020-08-10,"Carl Icahn Boosts Stakes in Xerox, Occidental"
2020-08-05,CVR Energy Inc (CVI) Q2 2020 Earnings Call Transcript
2020-08-04,"Did Hedge Funds Make The Right Call On CVR Energy, Inc. (CVI) ?"
2020-08-03,CVR Energy Reports Second Quarter 2020 Results
2020-08-03,ROCE Insights For CVR Energy
2020-07-31,Preview: CVR Energy's Earnings
2020-07-21,CVR Energy to Release Second Quarter 2020 Earnings
2020-07-16,"How Good Is CVR Energy, Inc. (NYSE:CVI), When It Comes To ROE?"
2020-06-24,"Refiners start to add renewable diesel capacity, seen as cost-cutting move"
2020-06-23,"Hedge Funds Are Dumping CVR Energy, Inc. (CVI)"
2020-06-23,5 Oil & Gas Stocks That Have Shown They Can Grow Safely
2020-06-12,Edited Transcript of CVI earnings conference call or presentation 7-May-20 5:00pm GMT
2020-06-08,6 Energy Stocks Trading With Low Price-Sales Ratios
2020-05-28,Carl Icahn Takes Over $1.6 Billion Loss on Embattled Hertz
2020-05-26,"CVR Partners, LP -- Moody's revises CVR Partners' outlook to negative, ratings affirmed"
2020-05-26,"SHAREHOLDER ALERT: Levi & Korsinsky, LLP Reminds Investors in CVR Refining, LP of a Class Action Lawsuit and a Lead Plaintiff Deadline of June 5, 2020 - CVRR"
2020-05-09,Icahn Enterprises L.P. (IEP) Q1 2020 Earnings Call Transcript
2020-05-08,CVR Energy Inc (CVI) Q1 2020 Earnings Call Transcript
2020-05-07,CVR Energy to explore converting refining units for renewable diesel production
2020-05-06,CVR Energy Reports First Quarter 2020 Results and Announces Cash Dividend of 40 Cents
2020-04-30,Who Can Beat Warren Buffett And Carl Icahn? The Average Fund Manager.
2020-04-29,"How Does CVR Energy's (NYSE:CVI) P/E Compare To Its Industry, After Its Big Share Price Gain?"
2020-04-28,U.S. refiners face prolonged troubles as fuel use slumps
2020-04-25,"Icahn Says Stocks Are Overvalued, Virus May Cause Downdrafts"
2020-04-25,"What Kind Of Share Price Volatility Should You Expect For CVR Energy, Inc. (NYSE:CVI)?"
2020-04-24,Icahn Bought Cheap Oil in Mondays Plummet to Historic Lows
2020-04-24,Icahn sees opportunities but warns of more 'downdrafts' ahead: Bloomberg
2020-04-24,Icahn sees opportunities but warns of more 'downdrafts' ahead -Bloomberg
2020-04-23,CVR Energy to Release First Quarter 2020 Earnings
2020-04-15,Icahn Enterprises L.P. -- Moody's affirms IEP's ratings; outlook changed to negative
2020-04-09,3 Financially Strong Oil Companies to Consider as Price War Ends
2020-04-08,"CLASS ACTION UPDATE for CRON and CVRR: Levi & Korsinsky, LLP Reminds Investors of Class Actions on Behalf of Shareholders"
2020-03-28,"Hedge Funds Have Never Been This Bullish On CVR Energy, Inc. (CVI)"
2020-03-20,What Is CVR Energy's (NYSE:CVI) P/E Ratio After Its Share Price Tanked?
2020-02-26,U.S. renewable fuel prices climb 25% after report on small refinery waiver program
2020-02-25,Edited Transcript of CVI earnings conference call or presentation 20-Feb-20 6:00pm GMT
2020-02-24,"There's A Lot To Like About CVR Energy, Inc.'s (NYSE:CVI) Upcoming US$0.80 Dividend"
2020-02-22,"Earnings Release: Here's Why Analysts Cut Their CVR Energy, Inc. Price Target To US$40.80"
2020-02-19,CVR Energy Reports Fourth Quarter and Full-Year 2019 Results and Announces Cash Dividend of 80 Cents
2020-02-07,U.S. renewable fuel credits double since court decision on refinery waivers
2020-02-06,CVR Energy to Release Fourth Quarter 2019 Earnings
2020-02-05,"Does CVR Energy, Inc. (NYSE:CVI) Have A Good P/E Ratio?"
2020-01-28,Court decision casts doubt on dozens of U.S. refinery biofuel waivers
2020-01-25,Court forces U.S. EPA to reconsider three refinery biofuel waivers
2020-01-14,Houston-area refiner to raise $1 billion
2020-01-11,"How Did CVR Energy, Inc. (CVI) Perform In Comparison to Hedge Fund Favorites in 2019?"
2020-01-10,CVR Energy Announces Pricing of $1.0 Billion Private Placement of 5.250% Senior Notes due 2025 and 5.750% Senior Notes due 2028
2020-01-10,"An Intrinsic Calculation For CVR Energy, Inc. (NYSE:CVI) Suggests It's 37% Undervalued"
2020-01-07,CVR Energy Inc. -- Moody's rates CVR Energy's bonds B1
2020-01-07,CVR Energy Announces $1.1 Billion Private Placement of Senior Notes and Notice of Conditional Redemption for its 6.500% Second Lien Senior Secured Notes due 2022
2019-12-18,Crude Oil Outlook for 2020 and 3 Energy Companies Gurus Agree On
2019-12-15,The CVR Energy (NYSE:CVI) Share Price Is Up 96% And Shareholders Are Holding On
2019-12-05,"Hedge Funds Have Never Been This Bullish On CVR Energy, Inc. (CVI)"
2019-11-19,"How Does CVR Energy, Inc. (NYSE:CVI) Fare As A Dividend Stock?"
2019-11-08,"CVR Partners, LP -- Moody's announces completion of a periodic review of ratings of CVR Partners, LP"
2019-10-27,"How CVR Energy, Inc. (NYSE:CVI) Can Impact Your Portfolio Volatility"
2019-10-25,Edited Transcript of CVI earnings conference call or presentation 24-Oct-19 5:00pm GMT
2019-10-23,CVR Energy Reports Third Quarter 2019 Results and Announces Cash Dividend of 80 Cents
2019-10-14,"Are Hedge Funds Going To Get Burned By CVR Energy, Inc. (CVI) ?"
2019-10-10,CVR Energy to Release Third Quarter 2019 Earnings
2019-10-07,"Here's What CVR Energy, Inc.'s (NYSE:CVI) ROCE Can Tell Us"
2019-09-23,"Cash Machine Invests with an ""Ichan"""
2019-09-13,Carl Icahn's Top 6 Holdings
2019-09-12,Does CVR Energy (NYSE:CVI) Deserve A Spot On Your Watchlist?
2019-08-30,CVR Energy to Participate in Barclays CEO Energy-Power Conference
2019-08-20,These 4 Measures Indicate That CVR Energy (NYSE:CVI) Is Using Debt Reasonably Well
2019-08-01,Edited Transcript of CVI earnings conference call or presentation 25-Jul-19 5:00pm GMT
2019-07-31,CVR Energy Inc (CVI) Q2 2019 Earnings Call Transcript
2019-07-29,"Interested In CVR Energy, Inc. (NYSE:CVI)s Upcoming 1.4% Dividend? You Have 3 Days Left"
2019-07-24,CVR Energy Reports Second Quarter 2019 Results and Announces Cash Dividend of 75 Cents
2019-07-24,"Don't Sell CVR Energy, Inc. (NYSE:CVI) Before You Read This"
2019-07-15,Carl Icahn Drives Further Into Hertz Global Holdings
2019-07-11,CVR Energy to Release Second Quarter 2019 Earnings
2019-06-28,10 Top-Rated Mid-Cap Stocks to Buy Now
2019-06-26,"CVR Refining, LLC -- Moody's affirms CVR Refining's notes at B1 with stable outlook"
2019-06-26,"The CVR Energy (NYSE:CVI) Share Price Has Gained 207%, So Why Not Pay It Some Attention?"
2019-06-18,"A Look At The Fair Value Of CVR Energy, Inc. (NYSE:CVI)"
2019-06-18,Perry's Picks for an Energy Portfolio
2019-06-14,"Hedge Funds Have Never Been More Bullish On CVR Energy, Inc. (CVI)"
2019-05-31,"Here's What You Should Know About CVR Energy, Inc.'s (NYSE:CVI) 6.8% Dividend Yield"
2019-05-22,Icahn-Backed Oil Refiner CVR Energy Considers Options
2019-05-22,"Sugar Land-based refiner backed by Icahn evaluating strategic options, sells terminal"
2019-05-22,Why These Stocks Are On The Move
