2020-12-31,The CarMax (NYSE:KMX) Share Price Has Gained 96% And Shareholders Are Hoping For More
2020-12-28,Should You Buy CarMax After Pullback?
2020-12-28,"Lithia Motors, IBD Stock Of The Day, Is Back In Buy Zone After Close Call"
2020-12-28,"Auto Stock Roundup: THO's Tiffin Motorhomes Buyout, MGA-LG JV & More"
2020-12-24,CarMax Earnings: Growth Downshifts
2020-12-23,Used-Car Retailer CarMax Shares Plunge Over 8% as COVID-19 Hurts Store Sales
2020-12-23,"CarMax's (KMX) Q3 Earnings & Sales Beat Estimates, Up Y/Y"
2020-12-22,CarMax (KMX) Q3 2021 Earnings Call Transcript
2020-12-22,CarMax Falls as Earnings Beat Fails to Offset Lack of Guidance
2020-12-22,"Peloton, Apple, Tesla, CarMax - Tuesday's Premarket Movers"
2020-12-22,CarMax (KMX) Q3 Earnings and Revenues Top Estimates
2020-12-22,"CarMax, Inc. to Host Earnings Call"
2020-12-22,"CarMax's stock falls, as profit and revenue beat but same-store sales surprisingly declines"
2020-12-22,Recap: CarMax Q3 Earnings
2020-12-22,CarMax Reports Third Quarter Fiscal 2021 Results
2020-12-22,"Apple, Peloton Rise in Premarket, CarMax Falls on Weak Sales"
2020-12-21,CarMax Earnings Preview
2020-12-21,Idling in Carmax Could Be a Buying Opportunity
2020-12-21,"FedEx, Oracle, CarMax, Paychex and JPMorgan are part of Zacks Earnings Preview"
2020-12-21,"Tesla, CarMax, FactSet, and Other Stocks to Watch This Week"
2020-12-21,3 Things to Watch in the Stock Market This Week
2020-12-20,Earnings Reports for the Week of Dec. 21-25
2020-12-20,"Earnings to Watch in Holiday-Shortened Week: Heico, Carnival, CarMax, Cintas and Weibo in Focus"
2020-12-17,CarMax Named Official Auto Retailer of the NBA and WNBA
2020-12-15,CarMax (KMX) Earnings Expected to Grow: What to Know Ahead of Next Week's Release
2020-12-08,CarMax Announces Third Quarter Conference Call
2020-12-07,Is KMX A Good Stock To Buy Now?
2020-11-30,"The CarMax Foundation to Donate up to $650,000  in Support of #GivingTuesday Campaign"
2020-11-22,"Is CarMax, Inc.'s (NYSE:KMX) ROE Of 17% Impressive?"
2020-11-20,Cars that hold their value the best - and the worst
2020-11-16,Akre Capital Management's Top 3rd-Quarter Trades
2020-10-27,"CarMax is Hiring for More Than 3,500 Positions by End of 2020"
2020-10-27,Used car retailer Carlotz goes public
2020-10-26,CarMax Inc (KMX): Are Hedge Funds Right About This Stock?
2020-10-26,Is CarMax (KMX) a Smart Long-term Buy?
2020-10-23,"At US$91.42, Is CarMax, Inc. (NYSE:KMX) Worth Looking At Closely?"
2020-10-14,Mostly everyone is buying a new car during COVID-19: Shift.com co-CEO
2020-10-09,Earnings Season Is About to Start. It Could Be Better Than You Think.
2020-10-04,"Notable Insider Buys Last Week: Blackstone, CarMax And More"
2020-10-03,Top Insider Buys Highlight for the Week of Oct. 2
2020-10-02,"Buy CarMax Stock Because Used Cars Are Hot, Says Morgan Stanley"
2020-10-02,Why CarMax Stock Fell 14% in September
2020-10-02,Professional investors have their eye on these eight stocks as the used-car market in the U.S. moves online
2020-10-01,Carvana's stock is up more than 160% this year  its founder remains bullish
2020-09-30,Why CarMax (KMX) Stock Might be a Great Pick
2020-09-29,How Restaurants Are Starting to Come Back
2020-09-29,5 Top Stocks to Buy in October
2020-09-29,"The Zacks Analyst Blog Highlights: Tesla, AutoZone, CarMax, Nikola Corp and Volkswagen"
2020-09-28,CarMax Restarts Share Buyback After 5 Months
2020-09-28,"Auto Stock Roundup: TSLA Battery Day, AZO & KMX Earnings Beat and More"
2020-09-28,CarMax resumes share buybacks after suspending program in April due to pandemic
2020-09-25,Carlotz Offers Unique Take on Used Car Play Beyond Pandemic
2020-09-24,CarMax (KMX) Q2 2021 Earnings Call Transcript
2020-09-24,"S&P 500 Worries Its Way Higher on More Record Jobless Claims: Darden's New Dividend, Carmax Crash, United COVID Testing"
2020-09-24,CarMax Earnings Jump Unexpectedly As Used-Car Demand Revives In 'Seamless' Shopping
2020-09-24,CarMax Posts 2nd-Quarter Earnings and Revenue Beat
2020-09-24,CarMax Stock Drops 13% Despite Beating Q2 Estimates
2020-09-24,"Stock Markets Gain Despite Economic Data; CarMax Cracks, Darden Delivers as Earnings Season Approaches"
2020-09-24,California moves to ban gas-powered cars
2020-09-24,"CarMax beats on profit, revenue expectations"
2020-09-24,"CarMax's (KMX) Q2 Earnings & Sales Beat Estimates, Up Y/Y"
2020-09-24,CarMax Stock Dented After Results Beat Estimates
2020-09-24,CarMax (KMX) Q2 Earnings and Revenues Surpass Estimates
2020-09-24,Largest Used Car Retailer Completes Roll Out of Online Car Buying Nationwide
2020-09-24,CarMax: Q2 Earnings Insights
2020-09-24,"CarMax, Inc. to Host Earnings Call"
2020-09-24,CarMax Reports Record Second Quarter Fiscal 2021 Results
2020-09-23,CarMax (KMX) to Report Q2 Earnings: What's in the Cards?
2020-09-23,Earnings Outlook for CarMax
2020-09-23,A Look At CarMax's (NYSE:KMX) CEO Remuneration
2020-09-22,Carvana Stock Soars Because No One Knew Demand for Used Cars Would Be So Good
2020-09-21,CarMax Looks Vulnerable on the Charts
2020-09-20,"Tesla's Battery Day, Powell appears before Congress: What to know in the week ahead"
2020-09-20,"Nike, Costco, General Mills, and Other Stocks for Investors to Watch This Week"
2020-09-17,CarMax (KMX) Expected to Beat Earnings Estimates: Can the Stock Move Higher?
2020-09-15,CarMax Hits Key Rating Benchmark After Stock Nearly Triples
2020-09-14,Technical Assessment: Bullish in the Intermediate-Term
2020-09-11,How to Get the Best Trade-in Value for Your Old Car
2020-09-10,CarMax Announces Second Quarter Conference Call
2020-09-09,Seeking Direction After Hot Summer
2020-09-09,Daily Spotlight: Argus Adjusts Sector Ratings
2020-09-09,Why CarMax Stock Rose 10% in August
2020-09-08,CarMax Inc (KMX): Hedge Funds Are Snapping Up
2020-09-03,Why You Need to Pay Attention to the Exxon Mobil Stock Selloff
2020-08-24,Returns On Capital At CarMax (NYSE:KMX) Paint An Interesting Picture
2020-08-13,"Akre Capital Management Cuts Markel, Primo Water"
2020-08-05,"Markel Gayner Exits CarMax, Marriott International"
2020-08-04,Tom Gayner's Top 5 Sells in the 2nd Quarter
2020-08-03,Pandemic revs up race for U.S. online car sales
2020-08-03,Pandemic revs up race for U.S. online car sales
2020-08-03,CORRECTED-FOCUS-Pandemic revs up race for U.S. online car sales
2020-07-31,Park These 3 Car Dealer Stocks In Your Portfolio
2020-07-24,If You Had Bought CarMax (NYSE:KMX) Shares Five Years Ago You'd Have Earned52% Returns
2020-07-23,AutoNation Is Pressing the Gas on Used-Car Sales
2020-07-22,Why CarMax (KMX) Stock is a Compelling Investment Case
2020-07-20,Used-Car Prices Are Rising. Its Good News for Lots of Stocks.
2020-07-19,Why Is CarMax (KMX) Down 3% Since Last Earnings Report?
2020-07-18,Why Carvana and CarMax Stocks Could Be Poised to Soar
2020-07-14,Edited Transcript of KMX earnings conference call or presentation 19-Jun-20 1:00pm GMT
2020-07-14,Were Hedge Funds Right About Piling Into CarMax Inc (KMX)?
