2020-12-15,"Capital Market Laboratories (CMLviz) Interviews Talend CEO  If anyones going to evolve the data pipe, well be the ones to do it"
2020-12-15,Talend Opens Second Cloud Data Center in Europe to Support Stitch Customer Growth
2020-12-07,Talend (NASDAQ:TLND) Has Debt But No Earnings; Should You Worry?
2020-12-03,Talend Expands Snowflake Partnership to Deliver Data Clarity to Joint Customers
2020-11-30,Talend to Participate in Upcoming Investor Conferences
2020-11-30,Talend Achieves AWS Migration Competency Status and AWS Outposts Ready Designation
2020-11-18,"Elissa Fink, Ryan Kearny Join Talend Board, Bringing Tech Industry Marketing and Product Expertise"
2020-11-10,Why more employers are looking to digitize their businesses amid pandemic
2020-11-10,Talend S.A. (TLND) Q3 2020 Earnings Call Transcript
2020-11-09,Talend: Q3 Earnings Insights
2020-11-09,Talend Reports Third Quarter 2020 Financial Results
2020-11-09,Talend SA to Host Earnings Call
2020-11-05,"Talend to Host Virtual Investor Day on November 18, 2020"
2020-10-28,Talend Data Masters 2020 Winners Announced at Talend Connect
2020-10-21,What Kind Of Investors Own Most Of Talend S.A. (NASDAQ:TLND)?
2020-10-13,"Talend to Report Third Quarter Fiscal Year 2020 Financial Results on November 9, 2020"
2020-10-07,Covanta Selects Talend to Achieve Data Clarity from Industrial IoT Data
2020-10-05,Talend Appoints Jamie Kiser to Expanded Role of Chief Operating Officer and Chief Customer Officer
2020-09-28,Do Hedge Funds Like Talend S.A. (TLND)?
2020-09-28,Talend names Krishna Tammana Chief Technology Officer
2020-09-24,Talend recognized as a Challenger in 2020 Gartner Magic Quadrant for Enterprise Integration Platform as a Service
2020-09-15,Is Now The Time To Look At Buying Talend S.A. (NASDAQ:TLND)?
2020-09-14,Capital Market Laboratories (CMLviz) Interviews Talend CEO  Moving to data trustworthiness is going to boost the value of the business
2020-09-14,Talend Introduces Industry-First Measure of Data Health to Bring Clarity and Confidence to Every Business Decision
2020-09-01,Why Enterprise Software Stocks Are Soaring Today
2020-08-20,Talend Named a Leader in 2020 Gartner Magic Quadrant for Data Integration Tools
2020-08-18,Talend Extends Collaboration with Cloudera
2020-08-17,Talend to Participate in Upcoming Investor Conference
2020-08-07,Talend CEO weighs in on earnings beat and guidance
2020-08-06,Talend Reports Second Quarter 2020 Financial Results
2020-07-30,Talend Named a Leader in Gartner Magic Quadrant for Data Quality Solutions
2020-07-16,"Talend to Report Second Quarter Fiscal Year 2020 Financial Results on August 6, 2020"
2020-07-13,Did Hedge Funds Make The Right Call On Talend S.A. (TLND) ?
2020-07-08,Talend Honors Canadian Financial Institution SSQ Insurance with Talend Data Masters Award
2020-07-08,Talend Donates Nearly $3 Million in Data Skills Courses and Technologies to Higher Education
2020-06-18,Talend Achieves Elite Status and Technology Ready Validation in the Snowflake Partner Network
2020-06-12,Talend Announces 2020 Annual Combined General Meeting of Shareholders To Be Held In Camera
2020-06-11,Talend Names Todd Pelletier as new General Manager and Senior Vice President of NORAM Sales
2020-06-10,Talend Recognized as a Leader in Enterprise Data Fabric Evaluation by Independent Research Firm
2020-06-08,Here is What Hedge Funds Think About Talend S.A. (TLND)
2020-05-26,Capital Market Laboratories (CMLviz) Interviews Talend (TLND) CEO and CFO managing quality of data is a market set to explode
2020-05-19,Talend Receives Recognition from G2 and Leading Technology Journal
2020-05-18,Edited Transcript of TLND earnings conference call or presentation 6-May-20 8:30pm GMT
2020-05-15,Talend Announces Speaker Lineup for Talend Connect Virtual Summit 2020
2020-05-07,Talend to Participate in Upcoming Investor Conference
2020-05-07,Why Talend Stock Jumped Today
2020-05-07,Talend S.A. (TLND) Q1 2020 Earnings Call Transcript
2020-05-06,Talend Reports First Quarter 2020 Financial Results
2020-05-05,Were Hedge Funds Right About Talend S.A. (TLND)?
2020-04-09,"Talend to Report First Quarter Fiscal Year 2020 Financial Results on May 6, 2020"
2020-04-08,Talend Accelerates the Journey to Lakehouse Paradigm with Expanded Databricks Partnership
2020-03-10,Talend Cloud Now Available in Microsoft Azure Marketplace
2020-03-02,Talend's U.S. stock falls on having to restate financials
2020-02-27,Talend Accelerates Path to Revealing the Intelligence in Data
2020-02-26,Edited Transcript of TLND earnings conference call or presentation 13-Feb-20 9:30pm GMT
2020-02-24,"Capital Market Laboratories (CMLviz) Interviews Talend (TLND) CEO and CFO  The opportunity is massive, and we want to get it right"
2020-02-18,Talend to Participate in Upcoming Investor Conference
2020-02-13,Talend Reports Fourth Quarter and Fiscal Year 2019 Financial Results
2020-02-13,3 Stock Picks From the Analysts Who Consistently Get It Right
2020-02-12,Investors Who Bought Talend (NASDAQ:TLND) Shares Three Years Ago Are Now Up 39%
2020-02-11,Talend Achieves Major Security and Compliance Requirements for Enterprise Cloud Environments
2020-02-06,Talend Recognizes Leaders in Cloud and Big Data Innovation with 2020 Partner of the Year Awards
2020-01-22,Talend Names Anne Hardy as its Chief Information Security Officer
2020-01-21,"Talend to Report Fourth Quarter and Fiscal Year 2019 Financial Results on February 13, 2020"
2020-01-20,"These 3 Software Stocks Can Climb Higher in 2020, Says Top Investing Firm"
2020-01-09,The CEO at Software Firm Talend Is Stepping Down. 3 Women Are Taking Over.
2020-01-09,Talend Names Cloud Industry Leader Christal Bemont CEO
2020-01-09,"Three former SAP Concur execs join Talend's C-suite, including new CEO"
2020-01-07,Talend to Participate in Upcoming Investor Conference
2020-01-06,Talend Names Technology Industry Veteran Elizabeth Fetter to Board of Directors
2019-12-27,Hedge Fund Darlings vs. Talend S.A. (TLND) In 2019
2019-12-11,5 questions with CFO who jumped from one $4B unicorn to another
2019-12-10,Innovative European Customers Honored with 2019 Talend Data Masters Awards
2019-12-05,Edited Transcript of TLND earnings conference call or presentation 6-Nov-19 9:30pm GMT
2019-12-04,Is Talend S.A. (TLND) A Good Stock To Buy?
2019-12-04,Talend Achieves Amazon Redshift Ready Designation
2019-12-04,Talend Achieves AWS Retail Competency Status
2019-12-03,TALEND ANNOUNCES AVAILABILITY OF TALEND CLOUD IN AWS MARKETPLACE
2019-12-03,GDPR Compliance Rate Remains Low According to New Talend Research
2019-11-19,Clothing Retailer Popken Fashion Group Selects Talend and QuinScape to Support Omni-channel Distribution Strategy
2019-11-18,"Capital Market Laboratories (CMLviz) One-on-One CEO Interview with Talend S.A. CEO - The cloud business is exploding; Someday, all of Talends New Recurring Revenue will be from the Cloud"
2019-11-14,CEdMA Honors Talend as Leader in Customer Education Services with 2019 Innovation Award
2019-11-07,Talend to Participate in Upcoming Investor Conference
2019-11-06,Talend Reports Third Quarter 2019 Financial Results
2019-10-30,Talend Helps L'Oréal Turn Data into Cosmetic Innovation
2019-10-27,Heres What Hedge Funds Think About Talend S.A. (TLND)
2019-10-10,Talend Cloud Now Available on Microsoft Azure
2019-10-07,"Talend to Report Third Quarter Fiscal Year 2019 Financial Results on November 6, 2019"
2019-10-02,Does Talend S.A.'s (NASDAQ:TLND) CEO Salary Compare Well With Others?
2019-10-01,Talend Automates Snowflake Cloud Data Warehouse Migrations to Achieve Faster Time to Value
2019-09-24,ALDO Group Selects Talend to Engage Millennials Across Channels
2019-09-17,Talend Launches New Cloud Accreditation Program for Partners
2019-09-08,Al Gore Loves These 3 Stocks
2019-09-06,Talend S.A. Announces Pricing of 125 Million Convertible Notes Offering
2019-09-04,Talend S.A. Announces 125 Million Convertible Notes Offering
2019-08-29,Talend to Share Its Open Source Data Expertise at ApacheCon Las Vegas
2019-08-21,Did You Miss Talend's (NASDAQ:TLND) 38% Share Price Gain?
2019-08-16,Edited Transcript of TLND earnings conference call or presentation 7-Aug-19 8:30pm GMT
2019-08-13,Capital Market Laboratories (CMLviz) Interviews Talend CEO  Cloud business is a 'freight train'
2019-08-12,3 Top Tech Stocks to Buy in August
