2020-12-28,"Park-Ohio's (PKOH) Shares March Higher, Can It Continue?"
2020-12-24,Are Investors Undervaluing Park-Ohio Holdings Corp. (NASDAQ:PKOH) By 43%?
2020-12-08,How Park-Ohio (PKOH) Stock Stands Out in a Strong Industry
2020-12-02,Where Do Hedge Funds Stand On Park-Ohio Holdings Corp. (PKOH)?
2020-11-27,New Strong Buy Stocks for November 27th
2020-11-18,Moving Average Crossover Alert: Park-Ohio Holdings (PKOH)
2020-11-12,New Strong Buy Stocks For November 12th
2020-11-09,Why It Might Not Make Sense To Buy Park-Ohio Holdings Corp. (NASDAQ:PKOH) For Its Upcoming Dividend
2020-11-06,Results: Park-Ohio Holdings Corp. Beat Earnings Expectations And Analysts Now Have New Forecasts
2020-11-03,Park-Ohio (PKOH) Tops Q3 Earnings and Revenue Estimates
2020-11-03,ParkOhio Announces Third Quarter 2020 Results; Declares Quarterly Dividend
2020-10-28,ParkOhio Announces Third Quarter 2020 Results Conference Call
2020-10-26,Earnings Preview: Park-Ohio (PKOH) Q3 Earnings Expected to Decline
2020-10-12,Should We Be Excited About The Trends Of Returns At Park-Ohio Holdings (NASDAQ:PKOH)?
2020-08-12,Park-Ohio Holdings' (NASDAQ:PKOH) Shareholders Are Down 53% On Their Shares
2020-08-12,Is It Too Late To Consider Buying Park-Ohio Holdings Corp. (NASDAQ:PKOH)?
2020-08-04,"Park-Ohio (PKOH) Reports Q2 Loss, Lags Revenue Estimates"
2020-08-04,ParkOhio Announces Second Quarter 2020 Results
2020-07-29,Earnings Preview: Park-Ohio (PKOH) Q2 Earnings Expected to Decline
2020-07-23,ParkOhio Announces Second Quarter 2020 Results Conference Call
2020-07-06,Park-Ohio Industries Incorporated -- Moody's announces completion of a periodic review of ratings of Park-Ohio Industries Incorporated
2020-06-12,Look Who Is Selling Park-Ohio Holdings Corp. (PKOH)
2020-06-11,Edited Transcript of PKOH earnings conference call or presentation 7-May-20 5:00pm GMT
2020-05-15,"Park-Ohio Industries Incorporated -- Moody's downgrades Park-Ohio's ratings with CFR to B2, unsecured to Caa1; outlook stable"
2020-05-11,Park-Ohio Holdings Corp. Just Missed Earnings And Its EPS Looked Sad - But Analysts Have Updated Their Models
2020-05-09,Park-Ohio Holdings (PKOH) Q1 2020 Earnings Call Transcript
2020-05-06,Park-Ohio (PKOH) Q1 Earnings and Revenues Lag Estimates
2020-05-06,ParkOhio Announces First Quarter 2020 Results
2020-04-29,ParkOhio Announces First Quarter 2020 Results Conference Call
2020-04-27,Earnings Preview: Park-Ohio (PKOH) Q1 Earnings Expected to Decline
2020-04-20,What Is Park-Ohio Holdings's (NASDAQ:PKOH) P/E Ratio After Its Share Price Rocketed?
2020-03-25,What Is Park-Ohio Holdings's (NASDAQ:PKOH) P/E Ratio After Its Share Price Tanked?
2020-03-18,"The Chief Legal Officer of Park-Ohio Holdings Corp. (NASDAQ:PKOH), Robert Vilsack, Just Bought 5.4% More Shares"
2020-03-17,Edited Transcript of PKOH earnings conference call or presentation 12-Mar-20 2:00pm GMT
2020-03-16,Moving Average Crossover Alert: Park-Ohio
2020-03-11,Park-Ohio (PKOH) Lags Q4 Earnings and Revenue Estimates
2020-03-11,ParkOhio Announces 2019 Results and Share Repurchase Program
2020-03-04,Earnings Preview: Park-Ohio (PKOH) Q4 Earnings Expected to Decline
2020-03-02,ParkOhio Announces Fourth Quarter and Full Year 2019 Results Conference Call
2020-02-24,Analysts Estimate Park-Ohio (PKOH) to Report a Decline in Earnings: What to Look Out for
2020-02-08,"Park-Ohio Holdings Corp. (NASDAQ:PKOH) Passed Our Checks, And It's About To Pay A US$0.13 Dividend"
2020-01-31,ParkOhio Announces Quarterly Dividend
2020-01-09,Do You Know What Park-Ohio Holdings Corp.'s (NASDAQ:PKOH) P/E Ratio Means?
2019-12-17,Is Park-Ohio Holdings Corp. (PKOH) A Good Stock To Buy?
2019-12-10,Did Changing Sentiment Drive Park-Ohio Holdings's (NASDAQ:PKOH) Share Price Down By 47%?
2019-11-10,Edited Transcript of PKOH earnings conference call or presentation 5-Nov-19 3:00pm GMT
2019-11-06,Park-Ohio Holdings Corp. (PKOH): Hedge Funds Still Distant
2019-11-04,Park-Ohio (PKOH) Misses Q3 Earnings and Revenue Estimates
2019-11-04,ParkOhio Announces Third Quarter 2019 Results
2019-10-31,"How Many Park-Ohio Holdings Corp. (NASDAQ:PKOH) Shares Did Insiders Buy, In The Last Year?"
2019-10-30,ParkOhio Announces Quarterly Dividend
2019-10-28,Park-Ohio (PKOH) Earnings Expected to Grow: Should You Buy?
2019-10-24,ParkOhio Announces Third Quarter 2019 Results Conference Call
2019-10-16,Park-Ohio Holdings: An Under-the-Radar Opportunity
2019-10-08,These 4 Measures Indicate That Park-Ohio Holdings (NASDAQ:PKOH) Is Using Debt Extensively
2019-09-17,Do Institutions Own Park-Ohio Holdings Corp. (NASDAQ:PKOH) Shares?
2019-09-11,Edited Transcript of PKOH earnings conference call or presentation 8-Aug-19 2:00pm GMT
2019-08-28,Is Park-Ohio Holdings Corp.'s (NASDAQ:PKOH) 15% ROE Better Than Average?
2019-08-09,Park-Ohio Holdings (PKOH) Q2 2019 Earnings Call Transcript
2019-08-08,"Park-Ohio Holdings Corp. (NASDAQ:PKOH) Passed Our Checks, And It's About To Pay A 0.5% Dividend"
2019-08-05,Park-Ohio (PKOH) Misses Q2 Earnings and Revenue Estimates
2019-08-05,ParkOhio Announces Second Quarter 2019 Results
2019-07-30,ParkOhio Announces Second Quarter 2019 Results Conference Call
2019-07-29,Should You Be Adding Park-Ohio Holdings (NASDAQ:PKOH) To Your Watchlist Today?
2019-07-26,ParkOhio Announces Quarterly Dividend
2019-07-08,Park-Ohio Holdings Corp. (NASDAQ:PKOH) Is Yielding 1.5% - But Is It A Buy?
2019-06-18,ParkOhio Announcement
2019-06-18,Did You Manage To Avoid Park-Ohio Holdings's (NASDAQ:PKOH) 45% Share Price Drop?
2019-06-04,ParkOhio Completes Acquisition of Erie Press Systems
2019-05-31,Here's How P/E Ratios Can Help Us Understand Park-Ohio Holdings Corp. (NASDAQ:PKOH)
2019-05-21,ParkOhio Reaches Agreement in Principal to Acquire Erie Press Systems
2019-05-14,Edited Transcript of PKOH earnings conference call or presentation 7-May-19 2:00pm GMT
2019-05-13,Should You Consider Park-Ohio Holdings Corp. (NASDAQ:PKOH)?
2019-05-08,Park-Ohio Holdings (PKOH) Q1 2019 Earnings Call Transcript
2019-05-06,Park-Ohio (PKOH) Beats Q1 Earnings and Revenue Estimates
2019-05-06,Park-Ohio: 1Q Earnings Snapshot
2019-05-06,ParkOhio Announces First Quarter 2019 Results
2019-04-30,ParkOhio Announces First Quarter 2019 Results Conference Call
2019-04-26,ParkOhio Announces Quarterly Dividend
2019-04-11,Has Park-Ohio Holdings Corp. (NASDAQ:PKOH) Been Employing Capital Shrewdly?
2019-03-12,Edited Transcript of PKOH earnings conference call or presentation 5-Mar-19 3:00pm GMT
2019-03-11,Who Has Been Selling Park-Ohio Holdings Corp. (NASDAQ:PKOH) Shares?
2019-03-07,New Strong Buy Stocks for March 7th
2019-03-05,Park-Ohio Holdings Corp (PKOH) Q4 2018 Earnings Conference Call Transcript
2019-03-04,ParkOhio Announces Record 2018 Sales and EPS and Provides 2019 EPS Guidance
2019-02-26,ParkOhio Announces Fourth Quarter 2018 Results Conference Call
2019-02-25,Park-Ohio (PKOH) Earnings Expected to Grow: What to Know Ahead of Q4 Release
2019-02-09,Park-Ohio Holdings Corp. (NASDAQ:PKOH): Ex-Dividend Is In 4 Days
2019-01-31,ParkOhio Announces Quarterly Dividend
2019-01-24,"Recent Analysis Shows Dana, Western Asset Mortgage Capital, KKR & Co., Hawkins, INTL FCStone, and Park-Ohio Market Influences  Renewed Outlook, Key Drivers of Growth"
2019-01-16,Is There An Opportunity With Park-Ohio Holdings Corp.s (NASDAQ:PKOH) 34.19% Undervaluation?
2018-12-17,Do You Know What Park-Ohio Holdings Corp.s (NASDAQ:PKOH) P/E Ratio Means?
2018-11-14,Edited Transcript of PKOH earnings conference call or presentation 6-Nov-18 3:00pm GMT
2018-11-06,What Park-Ohio Holdings Corps (NASDAQ:PKOH) ROE Can Tell Us
2018-11-05,Park-Ohio (PKOH) Q3 Earnings and Revenues Surpass Estimates
2018-11-05,Park-Ohio: 3Q Earnings Snapshot
2018-11-05,ParkOhio Announces Strong Third Quarter 2018 Results and Completes Acquisition of Hydrapower Dynamics Limited
2018-10-31,ParkOhio Announces Third Quarter 2018 Results Conference Call
2018-10-31,ParkOhio Announces Quarterly Dividend
2018-10-29,Park-Ohio (PKOH) Q3 Earnings Preview: What to Look Out For
