2021-01-11,"As the Focus on Psychedelic Stocks Increases, So Do the Valuations"
2021-01-08,5 Groovy Psychedelic Stocks to Buy
2021-01-08,Correction: COMPASS Pathways establishes Centre of Excellence with Sheppard Pratt to accelerate research and improve patient experience in mental health care
2021-01-08,COMPASS Pathways establishes Centre of Excellence with Sheppard Pratt to accelerate research and improve patient experience in mental health care
2021-01-08,COMPASS Pathways establishes Centre of Excellence with Sheppard Pratt to accelerate research and improve patient experience in mental health care
2021-01-06,COMPASS Pathways plc to participate in HC Wainwright and ICR investor conferences
2021-01-04,Four Top Psychedelic Stock Picks for 2021
2020-12-28,2020 Was The Year of Psychedelics  Here's Why
2020-12-26,Is Compass Pathways Stock a Buy?
2020-12-21,The Next Leg in the Bull Market for Psychedelic Stocks
2020-12-18,Is COMPASS Pathways plc (NASDAQ:CMPS) Popular Amongst Insiders?
2020-12-16,Is CMPS A Good Stock To Buy Now?
2020-11-25,Snowflake On Fire: Are These IPO Stocks Ready To Buy?
2020-11-24,Another Bet on Psychedelic Drugs: Atai Raises $125 Million
2020-11-23,Psychedelic Drug Stock's Biggest Investor Closes $125 Million Funding Round
2020-11-15,The psychedelic drug industry is 'the new cannabis' for investors
2020-11-12,Psychedelic Drug IPO Explains Why It's Cautious On Oregon's Legalization
2020-11-12,COMPASS Pathways plc announces financial results for third quarter 2020
2020-11-10,25 States that have the Highest Rates of Depression in America
2020-11-09,A Handful of Start-Ups Is Developing Psychedelic Drugs for Mental Illnesses. It Could Be a Bad Trip for Investors.
2020-11-09,COMPASS Pathways joins the Psychiatry Consortium in a collaboration  to accelerate drug discovery in mental health care
2020-11-05,COMPASS Pathways plc to announce third quarter 2020 financial results on 12 November 2020
2020-11-04,Psychedelic Drug Stock Jumps After State Ballot Legalizes Therapy
2020-11-04,COMPASS Pathways plc to participate in Berenberg and Evercore investor conferences
2020-10-26,COMPASS Pathways plc to ring Nasdaq Stock Exchange opening bell in celebration of its successful $146.6 million IPO
2020-10-16,UPDATE - Trends in Psychedelic Drugs Research and Four Stocks You Should Know About
2020-09-22,COMPASS Pathways announces closing of initial public offering of American Depositary Shares and full exercise of underwriters option to purchase additional American Depositary Shares
2020-09-18,First Psychedelic Drug Stock Hits $1 Billion In Debut After Upsized IPO
2020-09-18,"Compass Pathways' stock debuts with a rally, as the first trade was 38% above the IPO price"
2020-09-17,COMPASS Pathways announces pricing of upsized initial public offering
