2021-01-08,Are Options Traders Betting on a Big Move in Clear Channel Outdoor (CCO) Stock?
2021-01-07,"Clear Channel Outdoor Holdings, Inc. Announces Date For 2020 Fourth Quarter And Full Year Earnings Release And Conference Call"
2020-12-20,Is CCO A Good Stock To Buy Now?
2020-12-17,"Clear Channel Outdoor Dials in New B2B Audience Planning, Measurement Solution Connecting Brands with Business Decision-Makers"
2020-11-23,"Clear Channel Outdoor, No Kid Hungry Launch National Holiday Campaign to Help Connect Kids to Free Meals"
2020-11-23,"Clear Channel Outdoor Holdings, Inc. To Participate In The Wells Fargo TMT Summit"
2020-11-18,Clear Channel Outdoor Powers Business Rebuilding During COVID with Market-Ready Solutions
2020-11-11,"Earnings Update: Here's Why Analysts Just Lifted Their Clear Channel Outdoor Holdings, Inc. (NYSE:CCO) Price Target To US$1.69"
2020-11-09,Clear Channel Outdoor Holdings Inc (CCO) Q3 2020 Earnings Call Transcript
2020-11-09,"Clear Channel Outdoor (CCO) Reports Q3 Loss, Tops Revenue Estimates"
2020-11-09,"Clear Channel Outdoor Holdings, Inc. Reports Results For 2020 Third Quarter"
2020-11-02,Earnings Preview: Clear Channel Outdoor (CCO) Q3 Earnings Expected to Decline
2020-10-30,7 Penny Stocks With a Strong Buy Rating
2020-10-29,"Clear Channel Airports Wins Largest U.S. Airport Advertising Contract with Port Authority of New York & New Jersey to Transform its Airports into World-Class Digital Media Platforms for Next Gen Passenger, Brand Experience"
2020-10-23,Advertisers in U.S. Airports Gain New Consumer Insights as Clear Channel Airports Integrates Validated Audience Impressions Methodology Across Media Displays
2020-10-14,"City Leaders, Afterschool Supporters Light Up Billboards Around the Country to Illuminate the Work of Afterschool Programs During the Pandemic"
2020-10-12,Would Shareholders Who Purchased Clear Channel Outdoor Holdings' (NYSE:CCO) Stock Five Years Be Happy With The Share price Today?
2020-10-08,"Clear Channel Outdoor Holdings, Inc. Announces Date For 2020 Third Quarter Earnings Release And Conference Call"
2020-10-06,"Clear Channel Outdoor Holdings, Inc. -- Moody's announces completion of a periodic review of ratings of Clear Channel Outdoor Holdings, Inc."
2020-09-28,"Hedge Funds Continue Selling Clear Channel Outdoor Holdings, Inc. (CCO)"
2020-09-11,"Clear Channel Outdoor Holdings, Inc. To Participate In The Goldman Sachs Communacopia Conference"
2020-09-02,"Clear Channel Outdoor Holdings, Inc. Regains Compliance With NYSE Minimum Price Listing Standard"
2020-08-27,Clear Channel Outdoor Integrates Outdoor Ads with All-Screen Video Solution
2020-08-25,Column: Billboards that follow you? It's not sci-fi. They're already here
2020-08-13,Tourism Recovery Solution Drives 66% Uptick in Theme Park Visits
2020-08-07,"Clear Channel Outdoor (CCO) Reports Q2 Loss, Misses Revenue Estimates"
2020-08-07,Clear Channel Outdoor: Q2 Earnings Insights
2020-08-07,"Clear Channel Outdoor Holdings, Inc. Reports Results For 2020 Second Quarter"
2020-08-06,"Clear Channel Outdoor Holdings, Inc. Receives Continued Listing Standard Notice from NYSE"
2020-08-06,A Preview Of Clear Channel Outdoor's Earnings
2020-08-05,Why Clear Channel Outdoor (CCO) Might Surprise This Earnings Season
2020-07-31,Clear Channel Outdoor (CCO) Expected to Beat Earnings Estimates: What to Know Ahead of Q2 Release
2020-07-27,"Clear Channel Outdoor Ignites New Automotive Recovery Resource, Spikes Dealer Brand Sales 15%"
2020-07-21,"Clear Channel Outdoor Holdings, Inc. Announces Upsize And Pricing Of Its Subsidiary Clear Channel International B.V.'s Private Offering Of Senior Secured Notes"
2020-07-21,"Clear Channel Worldwide Holdings, Inc. -- Moody's affirms Clear Channel 's B3 CFR and assigns B2 rating to affiliate's proposed senior secured note; outlook negative"
2020-07-21,Clear Channel to offer $350 million in five-year bonds
2020-07-21,"Clear Channel Outdoor Holdings, Inc. Announces Proposed Private Offering Of Senior Secured Notes By Its Subsidiary Clear Channel International B.V."
2020-07-21,"Clear Channel Outdoor Integrates its Digital Displays with Place Exchange Offering Programmatic Buyers Brand Safety, Attribution & Transparency"
2020-07-16,More Companies Than Ever Are Close to Defaulting. Market Performance Has Been Strong Anyway.
2020-07-14,Is Clear Channel Outdoor Holdings (NYSE:CCO) Using Capital Effectively?
2020-07-10,3 Strong Buy Penny Stocks That Could See Outsized Gains
2020-07-09,Were Hedge Funds Right About Still Being Bullish On Clear Channel Outdoor Holdings (CCO)?
2020-07-08,"iHeartCommunications, Inc. -- Moody's assigns B1 rating to iHeart's incremental term loan"
2020-07-08,"Clear Channel Outdoor Holdings, Inc. Sets Date For 2020 Second Quarter Earnings Teleconference"
2020-07-02,"Clear Channel Outdoor Holdings, Inc. Regains Compliance With NYSE Minimum Price Listing Standard"
2020-06-25,"Clear Channel Outdoor Americas Joins the National Center for Missing and Exploited Children, Texas Center for the Missing in Statewide Campaign to Find Missing Children in Texas"
2020-06-16,Why Clear Channel Outdoor Holdings Stock Was Rising Today
2020-06-15,"Clear Channel Outdoor Holdings, Inc. Announces Amendment To Credit Agreement"
2020-06-03,"Do Hedge Funds Love Clear Channel Outdoor Holdings, Inc. (CCO)?"
2020-05-27,"Clear Channel Worldwide Holdings, Inc. -- Moody's affirms Clear Channel's B3 CFR; outlook changed to negative"
2020-05-26,Are Options Traders Betting on a Big Move in Clear Channel Outdoor (CCO) Stock?
2020-05-21,COVID-era junk bond deals begin to go sour
2020-05-19,"Clear Channel Outdoor Holdings, Inc. Adopts Limited Duration Shareholder Rights Plan"
2020-05-13,Sandra Bergeron Joins Sumo Logic Board of Directors
2020-05-13,Aimia Acquires Stake in Clear Media Limited
2020-05-06,Clear Channel Outdoor Holdings Inc (CCO) Q1 2020 Earnings Call Transcript
2020-05-06,"Clear Channel Outdoor (CCO) Reports Q1 Loss, Tops Revenue Estimates"
2020-05-06,Clear Channel Outdoor: Q1 Earnings Insights
2020-05-06,"Clear Channel Outdoor Holdings, Inc. Reports Results For 2020 First Quarter"
2020-04-28,"Clear Channel Outdoor Holdings, Inc. Tenders its Clear Media Limited Shares"
2020-04-24,"iHeartCommunications, Inc. -- Moody's affirms iHeart's B2 CFR; outlook changed to negative"
2020-04-21,Clear Channel receives delisting notice from NYSE
2020-04-16,"Clear Channel Outdoor Holdings, Inc. Receives Continued Listing Standard Notice from NYSE"
2020-04-05,Coronavirus deals severe blow to outdoor advertising groups
2020-03-30,"Clear Channel Outdoor Holdings, Inc. to Sell Investment in Clear Media Limited for US$253 Million"
2020-03-30,4 Advertising & Marketing Stocks to Gain Amid Coronavirus Scare
2020-03-25,Clear Channel Outdoor draws down $150 million from revolving credit facility
2020-03-25,"Clear Channel Outdoor Holdings, Inc. Provides Financial Update"
2020-03-11,"Hedge Funds Arent Crazy About Clear Channel Outdoor Holdings, Inc. (CCO) Anymore"
2020-03-11,Clear Channel Airports to Transform Advertising Programs for Signature Flight Support's Network of Private Aviation Terminals
2020-03-09,How local stocks fared as stock markets post massive declines
2020-03-06,Clear Channel Outdoor & The Female Quotient Honor International Women's Day on Digital Billboards Nationwide
2020-03-01,"Clear Channel Outdoor Holdings, Inc. Yearly Results Just Came Out: Here's What Analysts Are Forecasting For Next Year"
2020-02-27,Clear Channel Outdoor (CCO) Tops Q4 Earnings and Revenue Estimates
2020-02-27,"Clear Channel Outdoor Holdings, Inc. Reports Results For 2019 Fourth Quarter And Full Year"
2020-02-25,"Biglari survives coronavirus stock market scare, other SA public companies plunge"
2020-02-20,Earnings Preview: Clear Channel Outdoor (CCO) Q4 Earnings Expected to Decline
2020-02-12,"When Should You Buy Clear Channel Outdoor Holdings, Inc. (NYSE:CCO)?"
2020-02-10,"VISIT PHILADELPHIA® Taps Digital Billboards in Times Square to Kick-Off Year Long Celebration of Women, Streams Live Reveal to Stakeholders at The Met in Philly"
2020-01-29,"Clear Channel Outdoor Transforms 1,000s of Outdoor Displays into Larger, High-Impact, Pedestrian Level Media"
2020-01-13,"Are Investors Undervaluing Clear Channel Outdoor Holdings, Inc. (NYSE:CCO) By 34%?"
2020-01-09,"Clear Channel Outdoor Holdings, Inc. Sets Date For 2019 Fourth Quarter And Full Year Earnings Teleconference"
2019-12-25,"Clear Channel Outdoor Holdings, Inc. (CCO) vs. Top 20 Hedge Fund Stocks in 2019"
2019-12-14,"Are Insiders Buying Clear Channel Outdoor Holdings, Inc. (NYSE:CCO) Stock?"
2019-12-11,First-Ever Digital Media Network at Jackson-Medgar Wiley Evers Int. Airport Will Reach 1M Travelers Annually
2019-12-03,Clear Channel Airports Renews Contract with Aruba Airport to Innovate Terminal-Wide Media Network
2019-12-03,Clear Channel Outdoor (CCO) Surges: Stock Moves 5.2% Higher
2019-11-28,"Hedge Funds Have Never Been This Bullish On Clear Channel Outdoor Holdings, Inc. (CCO)"
2019-11-21,Digital Advertising Performance Reporting Touches Down in Web App for Airport Media Programs
2019-11-20,"Clear Channel Outdoor Holdings, Inc. CFO, Brian Coleman And Clear Channel Outdoor Americas CEO, Scott Wells To Present At The Wells Fargo TMT Summit"
2019-11-18,"iHeartCommunications, Inc. -- Moody's assigns B1 rating to iHeartCommunications' proposed senior secured notes"
2019-11-15,New Strong Sell Stocks for November 15th
2019-11-13,"Clear Channel Worldwide Holdings, Inc. -- Moody's announces completion of a periodic review of ratings of Clear Channel Outdoor Holdings, Inc."
2019-11-12,Clear Channel Airports Wins 5-Year Renewal with Trinidad and Tobago International Airports
2019-11-11,Edited Transcript of CCO.N earnings conference call or presentation 6-Nov-19 1:30pm GMT
2019-11-11,Did Changing Sentiment Drive Clear Channel Outdoor Holdings's (NYSE:CCO) Share Price Down A Worrying 65%?
2019-11-07,Barbados' Airport Grants Five-Year Media Contract to Clear Channel Airports
2019-11-06,"Clear Channel Outdoor (CCO) Reports Q3 Loss, Lags Revenue Estimates"
2019-11-06,"Clear Channel Outdoor Holdings, Inc. Reports Results For 2019 Third Quarter"
2019-11-05,"Clear Channel Outdoor, Broadsign Partnership Expands Access to U.S. Programmatic Digital Out-of-Home Inventory"
