2021-01-10,Constellation Brands CEO: 'We're Going To Take A Significant Share' Of Seltzer Market
2021-01-10,Constellation Brands' 3rd Quarter Was a Barnburner
2021-01-10,Constellation Brands Earnings: Faster Growth and Expanding Cash Flow
2021-01-08,7 Short-Term Stocks to Move Quickly On
2021-01-08,Constellation Brands CEO on stellar Q3 results
2021-01-08,Better Buy: Starbucks vs. Constellation Brands
2021-01-08,"How Constellations Earnings Won the Stock an Upgrade, but Not a Fan"
2021-01-08,"Company News for Jan 8, 2021"
2021-01-08,Constellation Brands Makes a Major Upside Breakout
2021-01-08,Corona Beer Maker Constellations Shares Hit Record High on Strong Earnings; More Upside Likely
2021-01-07,Constellation Brands (STZ) Q3 2021 Earnings Call Transcript
2021-01-07,CGC Stock A Buy? The Biggest Marijuana Stock Soars On Georgia Results
2021-01-07,Constellation Brands Stock Is Climbing After It Posted Strong Earnings
2021-01-07,Constellation Brands (STZ) Beats Q3 Earnings & Sales Estimates
2021-01-07,"Constellation Brands, Inc. to Host Earnings Call"
2021-01-07,Constellation Brands (STZ) Beats Q3 Earnings and Revenue Estimates
2021-01-07,"Constellation Brands Tops Estimates, Provides Strong Guidance"
2021-01-07,"Plug Power, Bed Bath & Beyond, Walgreens, Twitter - Thursday's Premarket Movers"
2021-01-07,Constellation Brands shares up 3.5% premarket after earnings beat
2021-01-07,Constellation Brands: Q3 Earnings Insights
2021-01-07,Constellation Brands Reports Third Quarter Fiscal 2021 Results
2021-01-06,Its Reefer Madness as Weed Stocks Jump on Election News
2021-01-06,Earnings Preview for Constellation Brands
2021-01-06,Constellation's (STZ) Brand Sale to Aid Wine & Spirits Business
2021-01-05,Gallo completes $810 million wine megadeal with Constellation
2021-01-05,Constellation Brands Announces Full Redemption of 3.75% Senior Notes Due 2021
2021-01-05,Constellation Brands Completes Wine and Spirits Transactions With E. & J. Gallo to Focus Portfolio on Consumer Premiumization Trends
2021-01-05,Why Earnings Season Could Be Great for Constellation Brands (STZ)
2021-01-05,Constellation Brands Earnings: What to Watch
2021-01-04,"Costco, Walgreens, Constellation, and Other Stocks to Watch This Week"
2021-01-04,"Constellation Brands, Inc.'s (NYSE:STZ) Stock Is Rallying But Financials Look Ambiguous: Will The Momentum Continue?"
2021-01-03,Futures Nearly Flat as Nancy Pelosi Re-Elected Speaker of the House
2021-01-03,"Earnings to Watch Next Week: Carnival, RPM, Constellation Brands and Walgreens Boots Alliance in Focus"
2021-01-02,3 Things to Watch in the Stock Market This Week
2020-12-31,"The State of Holiday Retail: A Little Good, a Little Bad"
2020-12-31,Constellation Brands (STZ) Earnings Expected to Grow: Should You Buy?
2020-12-31,Constellation Brands Stock Is a Buy Ahead of Earnings. Thank Beer.
2020-12-31,6 Cannabis Stocks to Buy as the U.S. Softens Its Stance
2020-12-31,Is Constellation Brands (STZ) Likely to Beat on Q3 Earnings?
2020-12-31,"3 Reasons to Buy Canopy Growth, And 1 Reason to Sell"
2020-12-31,Beer Maker Constellation Brands Fiscal Q3 Earnings To Be Solid; Shares To Rally Further In 2021
2020-12-30,Is Canopy Growth Stock a Buy?
2020-12-29,"The Zacks Analyst Blog Highlights: IIPR, CRON, CGC and STZ"
2020-12-28,Why You Should Own Canopy Growth in 2021
2020-12-28,Constellation Stock Can Still Rocket Higher. Heres Why.
2020-12-28,4 Stocks to Ride the Wave of Cannabis Legalization
2020-12-28,Constellation Brands (STZ) Receives FTC Approval for Gallo Deal
2020-12-28,4 Stocks to Ride the Wave of Cannabis Legalization
2020-12-24,Constellation Brands Receives Clearance From the U.S. Federal Trade Commission to Close Wine and Spirits Transaction With E. & J. Gallo
2020-12-22,Corona Beer Sales Reportedly Unaffected By Unfortunate Name Association
2020-12-21,Canopy Growth Stock: Is The Biggest Marijuana Stock A Buy As Top Rivals Merge?
2020-12-18,"Constellation Brands, Inc. -- Moody's announces completion of a periodic review of ratings of Constellation Brands, Inc."
2020-12-18,Better Buy: McDonald's vs. Constellation Brands
2020-12-16,Here's Why Constellation Brands (STZ) is Poised for Growth in 2021
2020-12-15,This elite Israeli army squad member is behind a startup going public in a $1.4 billion SPAC deal
2020-12-12,Where Will Constellation Brands Be in 1 Year?
2020-12-11,Canopy Growth Stock Is a Bet on a U.S. Market Which May Not Arrive
2020-12-10,15 Largest Beer Companies in the World
2020-12-09,lululemon (LULU) to Report Q3 Earnings: Is a Beat in Store?
2020-12-08,Why the Earnings Surprise Streak Could Continue for Constellation Brands (STZ)
2020-12-07,Is STZ A Good Stock To Buy Now?
2020-12-04,Stick With Canopy Growth Stock Below $30
2020-12-04,Molson Coors just launched its first CBD drinks in the US
2020-12-04,Molson Coors CEO on beer trends amid the pandemic
2020-12-04,Is Constellation Brands a Buy?
2020-12-03,"Constellation Brands to Report Third Quarter Fiscal 2021 Financial Results; Host Conference Call January 7, 2021"
2020-12-03,Top Beer Stocks for Q1 2021
2020-12-03,Could Aurora Cannabis Be a Millionaire-Maker Stock?
2020-12-03,1 Marijuana Stock That Could Double Your Money
2020-12-02,America's Tallest Digital Holiday Tree Returns to Denver for Second Year
2020-12-01,"Up 38% in 2020, Is Canopy Growth Still a Buy?"
2020-11-25,"The Zacks Analyst Blog Highlights: Brinker, Constellation Brands, Travelzoo, Kraft Heinz and ODP"
2020-11-25,"Canopy Growth Is Turning Around, Leaving CGC Stock a Huge Upside"
2020-11-24,Bacardi Limited CFO on alcohol sales during COVID-19
2020-11-17,"Constellation Brands to Present Virtually at the Morgan Stanley Conference on December 2, 2020"
2020-11-12,Can Marijuana Help Biden Heal a Divided Nation?
2020-11-09,"As pot stocks boom on hopes for U.S. legalization, Canadian cannabis companies struggle for growth"
2020-11-09,Constellation Brands and E. & J. Gallo Sign Agreement With Federal Trade Commission Staff Relating to Consent Order on Pending Transaction; Constellation Provides Business Update for Fiscal 2021
2020-11-08,Why This 1 Marijuana Stock Could Bring Life-Changing Returns
2020-11-06,"Alcohol sales soared 68% on Election Day, with Democratic states buying the most: Drizly"
2020-11-06,"With Mixed Election Results, Hold Tight With Canopy Stock"
2020-11-05,3 Pot Stocks to Avoid Like the Plague in November
2020-11-05,Pot producer Canopy launches CBD-infused beverage line in Canada
2020-11-05,Pot producer Canopy launches CBD-infused beverage line in Canada
2020-11-04,"Canadian cannabis company agrees to buy U.S. craft-beer maker Sweetwater, known for its 420-branded brews"
2020-11-03,Why This Constellation Brands Analyst Sees Beer Rebound Ahead
2020-11-03,"Benzinga's Top Upgrades, Downgrades For November 3, 2020"
2020-10-31,Why Is Constellation Brands (STZ) Down 10.5% Since Last Earnings Report?
2020-10-30,Constellation Brands Announces Full Redemption of Senior Floating Rate Notes Due 2021
2020-10-28,Boston Beer is Set for a Strong Close to 2020
2020-10-27,2 Cannabis Stocks That Could Be Millionaire Makers
2020-10-26,Walmart CEO: Consumers are stocking up again as coronavirus rages on
2020-10-26,"Was The Smart Money Right About Constellation Brands, Inc. (STZ)?"
2020-10-21,Forget AB InBev: Constellation Brands Is a Better Growth Stock
2020-10-20,Boston Beer Earnings: What to Watch
2020-10-20,"P&G raises annual sales outlook, CFO says consumers' buying 'habits will last beyond COVID'"
2020-10-19,5 Top Alcohol Stocks to Watch As Innovation Drives the Industry
2020-10-17,The Best Pot Stock for the Next 10 Years
2020-10-16,3 Marijuana Stocks to Buy With Decriminalization on the Table
2020-10-15,"Zacks Market Edge Highlights: Aurora Cannabis, Canopy Growth, Cronos Group, Innovative Industrial Properties and Constellation Brands"
