2021-01-06,Implied Volatility Surging for Bloomin' Brands (BLMN) Stock Options
2021-01-03,"Is Now An Opportune Moment To Examine Bloomin' Brands, Inc. (NASDAQ:BLMN)?"
2020-12-27,Barry Rosenstein and Jana Partners: Top 10 Stock Picks
2020-12-21,Is BLMN A Good Stock To Buy According To Hedge Funds?
2020-12-04,"BioLife Solutions, Nikola See Activist Action"
2020-11-29,"Should You Take Comfort From Insider Transactions At Bloomin' Brands, Inc. (NASDAQ:BLMN)?"
2020-11-27,15 Largest Fast Food Companies in the World
2020-11-20,"GameStop, Atea Pharmaceuticals See Activist Action"
2020-11-16,"Bloomin' Brands Has 40% Upside Potential, BMO Says"
2020-10-26,"Why Dave & Buster's, Bloomin' Brands, and The Chefs' Warehouse Stocks Dropped 10% Monday"
2020-10-26,Bloomin Brands Tops 3Q Results As Restaurant Sales Improve
2020-10-24,"Is There An Opportunity With Bloomin' Brands, Inc.'s (NASDAQ:BLMN) 34% Undervaluation?"
2020-10-23,Bloomin' Brands (BLMN) Q3 2020 Earnings Call Transcript
2020-10-23,"Outback Steakhouse parent shares sink, presenting a 'buying opportunity,' analysts say"
2020-10-23,Why Bloomin' Brands Is Sagging 10% Today
2020-10-23,"American Express, Bloomin Brands and Intel earnings are out: here are the numbers"
2020-10-23,Recap: Bloomin Brands Q3 Earnings
2020-10-23,"Bloomin', Outback Parent, Posts Narrower-Than-Expected Adjusted Loss"
2020-10-23,"Bloomin' Brands (BLMN) Reports Q3 Loss, Tops Revenue Estimates"
2020-10-23,Bloomin Brands Reports Strengthening Sales Trends
2020-10-22,Earnings Outlook for Bloomin Brands
2020-10-22,Why Earnings Season Could Be Great for Bloomin' Brands (BLMN)
2020-10-20,What's in Store for Bloomin' Brands' (BLMN) Q3 Earnings?
2020-10-16,Bloomin' Brands (BLMN) Expected to Beat Earnings Estimates: What to Know Ahead of Q3 Release
2020-10-12,"The next big market mover, according to Wall St."
2020-10-09,"Danny Meyer: Lawmakers need to pass a stimulus, 'were losing restaurants across the country'"
2020-10-07,Are Hedge Funds Still Bullish On Bloomin Brands Inc (BLMN)?
2020-10-02,"Bloomin Brands, Inc. to Host Fiscal 2020 Third Quarter Earnings Conference Call at 8:30 AM EDT on October 23, 2020"
2020-09-18,"Now Is the Time to Invest Outside the U.S., Managers Say. Heres What Theyre Buying."
2020-09-16,Bloomin' Brands' (NASDAQ:BLMN) Stock Price Has Reduced 20% In The Past Year
2020-09-14,Bed Bath & Beyond shares rise after new supply chain chief appointed
2020-09-11,Tivity Health and Bloomin Brands See Activist Activity
2020-09-01,Bloomin' Brands (BLMN) Jumps After Double Analyst Upgrade
2020-09-01,Here's Why Bloomin' Brands Stock Is Going Up Today
2020-09-01,Is Bloomin' Brands About to Shoot 40% Higher?
2020-09-01,Bloomin Brands: Debt Overview
2020-08-28,"Coronavirus Testing Hopes Lift Shares of BJ's, Dave & Buster's, and Bloomin' Brands"
2020-08-19,8 Cheap Restaurant Stocks That Are Worth the Risk
2020-08-11,U.S. bankruptcies on pace to hit 10-year high: RPT
2020-08-10,What Bloomin' Brands' (NASDAQ:BLMN) Returns On Capital Can Tell Us
2020-08-06,10 Biggest Restaurant Companies
2020-08-06,"Bloomin Brands Announces Group Vice President, Diversity & Inclusion"
2020-07-24,Bloomin' Brands (BLMN) Q2 2020 Earnings Call Transcript
2020-07-24,Here's Why Bloomin' Brands Stock Popped on Friday
2020-07-24,"Why Bloomin Brands Stock Is Gaining After Q2 Report, Interim Business Update"
2020-07-24,"Bloomin' Brands (BLMN) Reports Q2 Loss, Misses Revenue Estimates"
2020-07-24,Shares of Outback parent Bloomin' Brands rise after better-than-expected earnings
2020-07-24,Recap: Bloomin Brands Q2 Earnings
2020-07-24,Bloomin Brands Provides Interim Business Update Related to COVID-19
2020-07-17,Did Hedge Funds Make The Right Call On Bloomin Brands Inc (BLMN) ?
2020-07-17,Bloomin' Brands (BLMN) Expected to Beat Earnings Estimates: Should You Buy?
2020-07-15,Why Casual Dining Restaurant Stocks Were Gaining Today
2020-07-08,Amazon drops online retailer Boohoos products amid allegations of poor working conditions and no COVID-19 protection
2020-07-06,"Bloomin Brands, Inc. to Host Fiscal 2020 Second Quarter Earnings Conference Call at 8:30 AM EDT on July 24, 2020"
2020-07-02,Bloomin Brands Announces Board of Directors Changes
2020-07-01,How Bloomin' Brands (BLMN) Stock Stands Out in a Strong Industry?
2020-07-01,Better Buy: McDonald's vs. Bloomin' Brands
2020-06-15,Hedge Funds See Opportunity In Bloomin Brands Inc (BLMN)
2020-06-11,Coronavirus update: U.S. case tally passes 2 million mark and 21 states are still seeing increases in infections
2020-06-11,Bloomin' Brands stock sinks as Outback Steakhouse same-store sales slowly regain momentum
2020-06-11,Bloomin Brands Provides Business Update Related to the COVID-19 Pandemic
2020-06-10,"Restaurants begin to reopen, here's what your contactless dining experience may look like"
2020-06-03,Edited Transcript of BLMN earnings conference call or presentation 8-May-20 12:30pm GMT
2020-05-28,"What Reopening Momentum Means for Cheescake Factory, Brinker and Bloomin"
2020-05-28,Is Bloomin' Brands Stock a Buy?
2020-05-26,Better Buy: Starbucks vs. Bloomin' Brands
2020-05-22,"Bloomin' Brands, Inc. -- Moody's downgrades Bloomin' Brand's CFR to B1; bank credit facilities to Ba3; outlook negative"
2020-05-20,Probability of US restaurants defaulting soars amid COVID-19 pandemic: Report
2020-05-20,5 Restaurant Stocks That an Analyst Says Are Still Worth Buying
2020-05-19,A Trio of Stocks Growing Earnings Fast
2020-05-15,S&P downgrades Bloomin' Brands further into junk as pandemic hurts sales and credit metrics
2020-05-09,Coronavirus update: U.S. economy sheds record-setting 20.5 million jobs and New York child dies of condition linked to virus
2020-05-09,Bloomin' Brands (BLMN) Q1 2020 Earnings Call Transcript
2020-05-08,Bloomin' Brands (BLMN) Q1 Earnings Meet Estimates
2020-05-08,Recap: Bloomin Brands Q1 Earnings
2020-05-08,Outback parent stock rises after 'promising' early results from reopened dining rooms
2020-05-08,Bloomin Brands Announces 2020 Q1 Financial Results
2020-05-06,"Bloomin Brands, Inc. Announces Pricing of $200 Million Private Offering of Convertible Senior Notes Due 2025"
2020-05-05,"Coronavirus update: Death tally tops 250,000; reports say internal projections show government expects surge in COVID-19 cases"
2020-05-05,"Outback parent issues profit warning, expects hundreds of restaurants to reopen Tuesday"
2020-05-05,Bloomin Brands Announces Proposed Private Offering of Convertible Senior Notes Due 2025
2020-05-05,Bloomin Brands Provides Business Update Related to the COVID-19 Pandemic
2020-05-04,"Bloomin' Brands, Inc. -- Moody's announces completion of a periodic review of ratings of Bloomin' Brands, Inc."
2020-05-01,Analysts Estimate Bloomin' Brands (BLMN) to Report a Decline in Earnings: What to Look Out for
2020-04-30,Jana Partners Takes a Slice Off Conagra Brands Stake
2020-04-29,"Why Wendy's, Shake Shack, and Bloomin' Brands Jumped Today"
2020-04-20,"Exclusive: Tampa's Bloomin' Brands, parent company of Outback Steakhouse, finds silver linings in the darkness of the coronavirus pandemic"
2020-04-17,Outback Steakhouse Parent and Commvault See Activist Actions
2020-04-17,Analysts Estimate Bloomin' Brands (BLMN) to Report a Decline in Earnings: What to Look Out for
2020-04-16,"Coronavirus update: 2.08 million cases worldwide, 138,487 deaths; Trump to unveil guidelines reopening of economy"
2020-04-16,Outback Steakhouse parent says it has $304 million cash on hand
2020-04-16,Outback Steakhouse parent Bloomin' Brands says it has not furloughed or laid off any staff during COVID-19
2020-04-16,Bloomin Brands Provides Business Update Related to the COVID-19 Pandemic
2020-04-15,One Tampa Bay executive named to Trumps economic revival group
2020-04-13,Bloomin' Brands in Uncharted Territory
2020-04-09,"Bloomin' Brands, Jana Partners agree to nominate two new directors"
2020-04-09,"Bloomin Brands, Inc. and JANA Partners Announce Settlement"
2020-04-07,Is Bloomin Brands Inc (BLMN) A Good Stock To Buy?
2020-04-05,"Coronavirus update: 1.22 million diagnosed cases worldwide, 65,884 deaths; glimmer of hope for Spain as death rate slows"
2020-04-03,Stocks end lower as worst jobs report in 11 years shows coronavirus already hurting U.S. economy
