2020-12-10,Immunome Provides Organizational Update: Appoints Richard Baron to its Board of Directors and Sandra Stoneman as Chief Legal Officer and Corporate Secretary
2020-11-17,Immunome Reports Third Quarter 2020 Financial Results and Significant Progress
2020-10-13,Immunome Announces Exercise in Full and Closing of Over-Allotment Option in Initial Public Offering
2020-10-02,Academy Sports Stock Falls Below $13 IPO Price in First Day of Trading
2020-10-02,3 Biotech Companies Are Making Their Market Debuts
2020-10-01,Immunome Announces Pricing of Upsized Initial Public Offering
