2021-01-08,Carvana Launches Internal Tuition and Education Assistance Program
2021-01-04,Billionaire Daniel Sundheims Top 10 Stock Picks
2020-12-30,3 Stocks Poised for Huge Growth Over the Next Decade
2020-12-29,Which Automotive E-Retailers Could be the Carvana of 2021?
2020-12-28,"Lithia Motors, IBD Stock Of The Day, Is Back In Buy Zone After Close Call"
2020-12-28,"Dow Jones Jumps 200 Points To New High, Led By Apple, Disney; Amazon Flashes Buy Signal"
2020-12-28,"Stock Markets Soar, but Investors Are Fleeing These 2020 High-Flyer Stocks"
2020-12-24,A Look Into Carvana's Debt
2020-12-21,Understanding Carvana's Unusual Options Activity
2020-12-21,E-Commerce Company Parts iD is Racing Ahead as a Chewy for Gearheads
2020-12-21,Carvana Welcomes 2021 by Giving Vehicles to 21 Employees
2020-12-20,2 Stocks I Can't Wait to Buy When the Market Crashes Again
2020-12-18,Questor: this digital disrupter is turning Americas second-hand car market on its head
2020-12-15,Carvana (CVNA) Could Extend Rally on Bullish Initiation
2020-12-11,"Carvana Continues Arkansas Growth, Bringing Pine Bluff The New Way to Buy a Car®"
2020-12-10,Carvana Launches The New Way to Buy a Car® in Hot Springs
2020-12-09,Carvana Brings The New Way to Buy a Car® to Arkansas
2020-12-09,Carvana or Vroom: Which Online Car Retailer is Primed to Race Ahead?
2020-12-07,Why Carvana Jumped 35% in November
2020-12-07,"Dow Jones Falls 200 Points, Weighed Down By Intel; Nasdaq Led By Apple, Facebook, Adobe; 3 Marijuana Stocks To Watch"
2020-12-07,Asbury Automotive stock gets upgrade from Morgan Stanley
2020-12-07,Is CVNA A Good Stock To Buy Now?
2020-12-07,Carvana Clears Alternate Entry
2020-12-07,Unusual Options Activity Insight: Carvana
2020-12-04,An Early Entry In Carvana Stock Made Selling For Profit Easier
2020-12-04,Carvana Vs. Vroom: Jefferies Picks A Winner
2020-12-04,Carvana Up on Initial Buy Rating Tied to Growth Opportunity
2020-12-04,Carvana: Debt Overview
2020-12-01,Shares of Carvana Are Ready to Trade Higher
2020-11-23,Carvana Launches in Harrisonburg with As-Soon-As-Next Day Delivery
2020-11-20,Cars that hold their value the best - and the worst
2020-11-20,The 7 Deadly Sin Stocks to Buy Before the Holidays
2020-11-18,Carvana. (CVNA) Moves to Buy: Rationale Behind the Upgrade
2020-11-18,Carvana Debuts Flagship Car Vending Machine in Atlanta
2020-11-14,"Used Car Disruptor Joining Carvana, Vroom in Bid to Move Industry Online"
2020-11-13,'If people can buy shoes and clothes online they'll definitely want to do it with cars:' Shift Co-CEO
2020-11-13,Were seeing incredible demand: Shift CEO on first public earnings
2020-11-13,Carvana Rallies Consumers to Live Feelessly
2020-11-12,Carvana to Present at Upcoming Investor Conferences
2020-11-12,"Carvana, IBD Stock Of the Day, Is Disrupting Old Ways Of Buying A Car"
2020-11-12,Buy these 5 consumer stocks as investment alternatives to Amazon
2020-11-12,Carvana Gives Early Entry
2020-11-12,Carvana Grows Reach in California Central Coast
2020-11-10,"The Zacks Analyst Blog Highlights: Best Buy, Carvana, Target and Kroger"
2020-11-09,E-commerce Set to Rule Holiday Sales: 4 Winners
2020-11-05,Return On Capital Employed Overview: Carvana
2020-11-05,"Carvana's (CVNA) Q3 Loss Narrows Y/Y, Sales Beat Estimates"
2020-11-04,3 of the Highest Growth Stocks in the Market Today
2020-11-03,Why Carvana Stock Fell 17% Last Month
2020-11-01,Carvana Co. (NYSE:CVNA) Just Reported Third-Quarter Earnings: Have Analysts Changed Their Mind On The Stock?
2020-10-30,Carvana Co. (CVNA) Q3 2020 Earnings Call Transcript
2020-10-30,Why Carvana Shares Are Up 4% Today
2020-10-29,"Carvana. (CVNA) Reports Q3 Loss, Tops Revenue Estimates"
2020-10-29,Carvana Announces Third Quarter 2020 Financial Results
2020-10-28,Top Consumer Discretionary Stocks for November 2020
2020-10-28,Carvana's Earnings: A Preview
2020-10-28,Why Carvana (CVNA) Might Surprise This Earnings Season
2020-10-27,E-commerce to Drive Holiday Retail Sales: 5 Winners
2020-10-27,Carvana (CVNA) Gears Up for Q3 Earnings: What's in the Cards?
2020-10-24,Carvana Partners with 7-Time NASCAR Cup Series Champion Jimmie Johnson and Chip Ganassi Racing in INDYCAR
2020-10-23,"Carlotz Going Public Via SPAC Joining Market With CarMax, Carvana, Vroom And Shift"
2020-10-22,Carvana. (CVNA) Expected to Beat Earnings Estimates: Should You Buy?
2020-10-21,"Jim Cramer And Lithia Motors CEO Talk Plans, Competition"
2020-10-21,Were Hedge Funds Right About Crowding Into Carvana Co. (CVNA)?
2020-10-20,E-commerce to Hit Record High This Year: 5 Stocks to Buy
2020-10-20,Cars.com vs Carvana: Which Online Car Stock Is A Better Pick?
2020-10-16,4 Biggest Consumer Goods Trends in 2020
2020-10-15,Covid and a Crowd of Startups Are Forever Changing How Americans Buy Cars
2020-10-12,Here's Why Momentum Investors Will Love Carvana Co. (CVNA)
2020-10-08,Here's Why Carvana Warrants a Bullish Stance at the Moment
2020-10-07,Goldman Lifts Carvanas PT To $270 On 3Q Outlook
2020-10-07,3 Top-Ranked Auto Retailers Poised for Robust Q3 Results
2020-10-04,"Carvanas Price Target Raised to $215 with Equal-weight Rating, $250 in Best Case: Morgan Stanley"
2020-10-02,These Stocks Would Have More Than Doubled Your Money Last Year
2020-10-02,"Buy CarMax Stock Because Used Cars Are Hot, Says Morgan Stanley"
2020-10-02,Return On Capital Employed Overview: Carvana
2020-10-02,5 Reasons You Could Regret Not Buying Carvana Stock
2020-10-02,Professional investors have their eye on these eight stocks as the used-car market in the U.S. moves online
2020-10-01,Carvana to Report Third Quarter 2020 Results and Host Quarterly Conference Call on October 29
2020-10-01,Carvana's stock is up more than 160% this year  its founder remains bullish
2020-10-01,"Carvana opens 26th car vending machine in the U.S., CEO weighs in"
2020-10-01,Carvana Revs up Car Buying in the Motor City with Countrys Newest Car Vending Machine
2020-09-30,Carvana (CVNA) Could Hit New Highs
2020-09-29,"Ally Increases Carvana Loan Purchase Commitment by $1 Billion, Increases Floor Plan Commitment to $1.25 Billion"
2020-09-25,Carlotz Offers Unique Take on Used Car Play Beyond Pandemic
2020-09-24,CarMax Earnings Jump Unexpectedly As Used-Car Demand Revives In 'Seamless' Shopping
2020-09-23,Carvana Co. Announces Upsize and Pricing of Senior Notes Offering
2020-09-23,Carvana Soars 31% On Record 3Q Business Prediction
2020-09-22,"Father, Son Used-Car Sellers Get $5 Billion Richer in a Day"
2020-09-22,Carvana Stock Soars As Online Auto Seller Expects Record Results
2020-09-22,Carvana Stock Soars Because No One Knew Demand for Used Cars Would Be So Good
2020-09-22,Why Carvana Stock Is Soaring Today
2020-09-22,Carvana Shares Jump Over 30% as Company Eyes Record Q3 Sales and Revenue
2020-09-22,These 2 Unlikely Winners Are Up 20%-Plus on a Gloomy Stock Market Day
2020-09-22,Why Vroom Stock Is Zooming 15% Higher Tuesday Morning
2020-09-22,Carvana Co. -- Moody's changes Carvana's outlook to stable; affirms ratings
2020-09-22,"Dow Jones Today, Stocks Flatten As Amazon Leads FANGs, Nike Up Ahead Of Earnings"
2020-09-22,Return On Capital Employed Overview: Carvana
2020-09-22,Carvana Sees Record Results for Several Earnings Categories
2020-09-22,Online used-car retailer Carvana sees record third quarter as vehicle demand rebounds
