2020-11-30,Penny Stocks to Buy Using Technical Analysis for December 2020
2020-11-27,Hedge Funds Are Dumping Banco BBVA Argentina S.A. (BBAR)
2020-11-25,Banco BBVA Argentina SA to Host Earnings Call
2020-11-24,Banco BBVA Argentina S.A. announces Third Quarter 2020 results
2020-11-11,BBVA Argentina Announces Third Quarter 2020 Financial Results Schedule
2020-08-25,Banco BBVA Argentina S.A. announces Second Quarter 2020 results
2020-08-10,BBVA Argentina Announces Second Quarter 2020 Financial Results Schedule
2020-06-22,Here is What Hedge Funds Think About Banco BBVA Argentina S.A. (BBAR)
2020-05-29,10 Penny Stocks to Buy Under $5 That Might Be Worth the Risk
2020-05-22,BBVA Argentina Announces First Quarter 2020 Financial Results Schedule
2020-05-06,Were Hedge Funds Right About BBVA Banco Frances S.A. (BBAR)?
2020-04-27,Banco BBVA Argentina has filed its Annual Report on Form 20-F for the fiscal year 2019
2020-04-13,These are the Houston-area lenders that have approved the most PPP loans
2020-02-03,BBVA in Argentina Announces Fourth Quarter 2019 Financial Results Schedule
2019-12-19,Should You Buy Banco BBVA Argentina S.A. (BBAR)?
2019-11-07,Banco BBVA Argentina S.A announces results for the third quarter of 2019
2019-11-07,BBVA discusses investment in San Antonio
2019-10-25,BBVA in Argentina Announces Third Quarter 2019 Financial Results Schedule
