2021-01-04,Gladstone Investment Corporation Exits its Investment in Frontier Packaging
2020-12-21,Gladstone Investment Corporation Recapitalizes its Investment in Old World Christmas
2020-11-27,Should I Avoid Gladstone Investment Corporation (GAIN)?
2020-11-04,Gladstone Investment Corp (GAIN) Q2 2021 Earnings Call Transcript
2020-11-04,Gladstone Investment Corp. to Host Earnings Call
2020-11-03,Gladstone Investment: Q2 Earnings Insights
2020-11-03,"Gladstone Investment Corporation Reports Financial Results for its Second Quarter Ended September 30, 2020"
2020-11-02,Gladstone Investment Corporation Earnings Call and Webcast Information
2020-10-30,6 of the Best Monthly Dividend Stocks to Fortify Your Portfolio
2020-10-26,Gladstone Investment Appoints Executive Vice Presidents
2020-10-26,Analysts Estimate Gladstone Investment (GAIN) to Report a Decline in Earnings: What to Look Out for
2020-10-13,"Gladstone Investment Announces Monthly Cash Distributions for October, November and December 2020 and Second Fiscal Quarter Earnings Release and Conference Call Dates"
2020-08-06,Gladstone Investment Corporation Announces Adjournment of 2020 Annual Meeting of Stockholders
2020-08-05,Gladstone Investment Corporation Launches Public Offering of 6.00% Notes
2020-07-29,Gladstone Investment Corp (GAIN) Q1 2021 Earnings Call Transcript
2020-07-28,Gladstone Investment (GAIN) Misses Q1 Earnings and Revenue Estimates
2020-07-28,"Gladstone Investment Corporation Reports Financial Results for its First Quarter Ended June 30, 2020"
2020-07-27,Gladstone Investment Corporation Earnings Call and Webcast Information
2020-07-22,Analysts Estimate Gladstone Investment (GAIN) to Report a Decline in Earnings: What to Look Out for
2020-07-14,"Gladstone Investment Announces Monthly Cash Distributions for July, August and September 2020 and First Fiscal Quarter Earnings Release and Conference Call Dates"
2020-07-09,Gladstone Investment Corporation and KCM Capital Partners Acquire Mason West
2020-06-22,Is Gladstone Investment Corporation (GAIN) A Good Stock To Buy?
2020-05-26,Gladstone Investment Announces Clarification of Seeking Alpha Article Pertaining to an Unrelated Company
2020-05-22,Edited Transcript of GAIN earnings conference call or presentation 13-May-20 12:30pm GMT
2020-05-13,Gladstone Investment Corp (GAIN) Q4 2020 Earnings Call Transcript
2020-05-12,Gladstone Investment (GAIN) Q4 Earnings and Revenues Miss Estimates
2020-05-12,"Gladstone Investment Corporation Reports Financial Results for its Fourth Quarter and Fiscal Year Ended March 31, 2020"
2020-05-12,Gladstone (GAIN) to Report Q4 Earnings: What's in the Offing?
2020-05-11,Gladstone Investment Corporation Earnings Call and Webcast Information
2020-04-14,"Gladstone Investment Announces Monthly Cash Distributions for April, May, and June 2020, and Supplemental and Deemed Distributions to Common Stockholders"
2020-04-10,Time to Bet on BDCs
2020-04-06,Gladstone Investment Provides Update on Impact of Coronavirus
2020-04-03,Here's Why You Should Add Gladstone (GAIN) to Your Portfolio
2020-04-01,New Strong Buy Stocks for April 1st
2020-03-10,"D.A. Davidson Serves as Financial Advisor to The Maids International, LLC in Sale to Gladstone Investment Corporation"
2020-03-09,3 Reasons Why Growth Investors Shouldn't Overlook Gladstone Investment (GAIN)
2020-03-09,Gladstone Investment Corporation Acquires The Maids International
2020-02-25,"The Zacks Analyst Blog Highlights: Rite Aid, RCI Hospitality, Universal Technical Institute, Earthstone Energy and Gladstone Investment"
2020-02-21,3 Reasons Growth Investors Will Love Gladstone Investment (GAIN)
2020-02-10,Edited Transcript of GAIN earnings conference call or presentation 5-Feb-20 1:30pm GMT
2020-02-10,Restaurant Brands (QSR) Q4 Earnings and Revenues Surpass Estimates
2020-02-10,Prospects Look Gloomy for SBIC & Commercial Finance Industry
2020-02-05,Gladstone Investment Corp. to Host Earnings Call
2020-02-04,Gladstone Investment (GAIN) Q3 Earnings Meet Estimates
2020-02-04,"Gladstone Investment Corporation Reports Financial Results for its Third Quarter Ended December 31, 2019"
2020-02-03,Gladstone Investment Corporation Earnings Call and Webcast Information
2020-01-28,Earnings Preview: Gladstone Investment (GAIN) Q3 Earnings Expected to Decline
2020-01-14,"Gladstone Investment Announces Increase in Cash Distributions to Common Stockholders, Monthly Cash Distributions for January, February, and March 2020, and Third Fiscal Quarter Earnings Release and Conference Call Dates"
2020-01-13,MSouth adds another Atlanta company to its portfolio
2019-12-12,Capitala Group Announces Significant Realization in its Credit Strategy
2019-12-11,Gladstone Investment Corporation Exits its Investment in Nth Degree
2019-11-20,Edited Transcript of GAIN earnings conference call or presentation 5-Nov-19 1:30pm GMT
2019-11-07,Forget Recession  Here's Why We Could See A 20-Year Bull Market
2019-11-06,Do Hedge Funds Love Gladstone Investment Corporation (GAIN)?
2019-11-04,Gladstone Investment (GAIN) Q2 Earnings and Revenues Top Estimates
2019-11-04,"Gladstone Investment Corporation Reports Financial Results for its Second Quarter Ended September 30, 2019"
2019-11-01,Gladstone Investment Corporation Earnings Call and Webcast Information
2019-10-29,7 Investments for Monthly Income
2019-10-28,Gladstone Investment (GAIN) Earnings Expected to Grow: What to Know Ahead of Next Week's Release
2019-10-08,"Gladstone Investment Announces Monthly Cash Distributions for October, November and December 2019, a Supplemental Distribution to Common Stockholders, and Second Fiscal Quarter Earnings Release and Conference Call Dates"
2019-10-06,Top 5 Monthly Dividend Stocks for 2018
2019-10-01,Prospects Look Bleak for SBIC & Commercial Finance Industry
2019-09-27,Adrian Day Banks on BDCs for Attractive Yields
2019-09-11,"Gladstone Investment Corp (GAIN) CEO David Gladstone Bought $246,766 of Shares"
2019-08-29,Edited Transcript of GAIN earnings conference call or presentation 1-Aug-19 12:30pm GMT
2019-08-26,Gladstone Investment Corporation Exits its Investment in Alloy Die Casting Corporation
2019-08-21,"Retail Loan Growth, Solid Balance Sheet Aid Ally Financial"
2019-08-21,4 Reasons to Add Encore Capital (ECPG) Stock to Your Portfolio
2019-08-20,"Capital One (COF) to Acquire KippsDeSanto, Enter M&amp;A Market"
2019-08-20,"Margin Pressure, High Costs to Hurt East West Bancorp (EWBC)"
2019-08-16,4 Reasons to Buy Och-Ziff Capital Management (OZM) Stock Now
2019-08-08,4 Reasons to Add Ares Capital (ARCC) Stock to Your Portfolio
2019-08-01,Gladstone Investment Corp (GAIN) Q1 2020 Earnings Call Transcript
2019-08-01,Gladstone Investment Corporation Announces Adjournment of 2019 Annual Meeting of Stockholders
2019-07-31,"Gladstone Investment Corporation Reports Financial Results for its First Quarter Ended June 30, 2019"
2019-07-30,Gladstone Investment Corporation Earnings Call and Webcast Information
2019-07-24,Gladstone Investment (GAIN) Reports Next Week: What Awaits?
2019-07-09,"Gladstone Investment Announces Monthly Cash Distributions for July, August and September 2019 and Supplemental Distribution to Common Stockholders and First Fiscal Quarter Earnings Release and Conference Call Dates"
2019-05-27,Edited Transcript of GAIN earnings conference call or presentation 14-May-19 12:30pm GMT
2019-05-16,Gladstone Investment Corp (GAIN) Q4 2018 Earnings Call Transcript
2019-05-14,Gladstone Investment Corp. to Host Earnings Call
2019-05-13,Gladstone Investment (GAIN) Q4 Earnings and Revenues Beat Estimates
2019-05-13,Gladstone Investment: Fiscal 4Q Earnings Snapshot
2019-05-13,"Gladstone Investment Corporation Reports Financial Results for its Fourth Quarter and Fiscal Year Ended March 31, 2019"
2019-05-13,Gladstone Investment's Q4 Earnings Preview
2019-05-10,What to Expect From Gladstone Investment (GAIN) Q4 Earnings?
2019-05-09,Gladstone Investment Corporation Earnings Call and Webcast Information
2019-05-06,Analysts Estimate Gladstone Investment (GAIN) to Report a Decline in Earnings: What to Look Out for
2019-05-02,Gladstone Investment Corporation Exits its Investment in Jackrabbit
2019-04-25,Piplovic's Picks- 7 Monthly Dividend Payers
2019-04-23,Gladstone Investment Corporation Announces Fourth Quarter and Year End Earnings Release and Conference Call Dates
2019-04-10,Edited Transcript of GAIN earnings conference call or presentation 6-Feb-19 1:30pm GMT
2019-04-09,"Gladstone Investment Announces Monthly Cash Distributions for April, May, and June 2019 and Supplemental and Deemed Distributions to Common Stockholders"
2019-03-22,Gladstone Investment (GAIN) Upgraded to Strong Buy: What Does It Mean for the Stock?
2019-03-13,Asset Growth Aids SEI Investments (SEIC) Despite High Costs
2019-03-11,4 Reasons to Invest in Civista Bancshares (CIVB) Stock Now
2019-03-08,4 Reasons to Invest in Credit Acceptance (CACC) Stock Now
2019-02-27,4 Reasons to Add Ares Capital (ARCC) Stock to Your Portfolio
2019-02-25,"Consolidated Research: 2019 Summary Expectations for NetApp, Gladstone Investment, Interpublic Group of Companies, CBRE Group, Insight Enterprises, and Ryanair  Fundamental Analysis, Key Performance Indications"
2019-02-13,"Zacks.com featured highlights include: Ready Capital, Gladstone, NeoGenomics, Digi and Paramount"
