2021-01-11,"Hemisphere Media Group, Inc. (NASDAQ:HMTV) Is About To Turn The Corner"
2020-12-12,"What Kind Of Shareholders Hold The Majority In Hemisphere Media Group, Inc.'s (NASDAQ:HMTV) Shares?"
2020-12-02,Is Hemisphere Media Group (HMTV) A Good Stock To Buy Now?
2020-11-18,Hemisphere Media Group Announces New $20 Million Share Repurchase Plan
2020-11-12,"Is Hemisphere Media Group, Inc. (NASDAQ:HMTV) Worth US$11.0 Based On Its Intrinsic Value?"
2020-11-09,Hemisphere Media Group Inc (HMTV) Q3 2020 Earnings Call Transcript
2020-11-09,Recap: Hemisphere Media Q3 Earnings
2020-11-09,"Hemisphere Media Group, Inc. to Host Earnings Call"
2020-11-09,Hemisphere Media Group Announces Third Quarter 2020 Financial Results
2020-11-02,Hemisphere Media Group to Host Third Quarter 2020 Financial Results Conference Call
2020-10-13,"At US$9.02, Is Hemisphere Media Group, Inc. (NASDAQ:HMTV) Worth Looking At Closely?"
2020-09-07,How Much Did Hemisphere Media Group's(NASDAQ:HMTV) Shareholders Earn From Share Price Movements Over The Last Five Years?
2020-08-10,Hemisphere Media Group Inc (HMTV) Q2 2020 Earnings Call Transcript
2020-08-10,Hemisphere Media Group Announces Second Quarter 2020 Financial Results
2020-08-03,Hemisphere Media Group to Host Second Quarter 2020 Financial Results Conference Call
2020-07-31,What Do The Returns At Hemisphere Media Group (NASDAQ:HMTV) Mean Going Forward?
2020-07-01,"Analysts Expect Breakeven For Hemisphere Media Group, Inc. (NASDAQ:HMTV)"
2020-06-25,Do Hedge Funds Love Hemisphere Media Group Inc (HMTV)?
2020-05-22,Anterix and Bausch Holding See Activist Action
2020-05-18,Edited Transcript of HMTV earnings conference call or presentation 11-May-20 2:00pm GMT
2020-05-11,Hemisphere Media Group Inc (HMTV) Q1 2020 Earnings Call Transcript
2020-05-11,Hemisphere Media Group Announces First Quarter 2020 Financial Results
2020-05-05,Hemisphere Media Group to Host First Quarter 2020 Financial Results Conference Call
2020-03-30,Hemisphere Media Group Provides Update Related to COVID-19 Impact
2020-03-27,Edited Transcript of HMTV earnings conference call or presentation 3-Mar-20 3:00pm GMT
2020-03-03,Hemisphere Media Group Announces Fourth Quarter and Full Year 2019 Financial Results
2020-02-28,Hemisphere Media Group to Host Fourth Quarter and Full Year 2019 Financial Results Conference Call
2020-01-31,Univision Bidder Hemisphere Media Walks Away From Auction
2020-01-22,Liberty Global Working With Hemisphere Media on a Bid for Univision
2020-01-07,Hemisphere Media Group (NASDAQ:HMTV) Shareholders Have Enjoyed A 30% Share Price Gain
2019-12-23,Is Hemisphere Media Group Inc (HMTV) A Good Stock To Buy?
2019-12-18,Hemisphere Media Group Reaches Multi-Year Distribution Agreement with DISH Network to Restore WAPA Televisión in Puerto Rico and WAPA América in the U.S.
2019-12-02,Hemisphere Media Group Announces Participation at the Wells Fargo TMT Summit
2019-11-22,Edited Transcript of HMTV earnings conference call or presentation 5-Nov-19 3:00pm GMT
2019-11-08,"Should You Worry About Hemisphere Media Group, Inc.'s (NASDAQ:HMTV) CEO Pay?"
2019-11-05,Hemisphere Media Group Announces Third Quarter 2019 Financial Results
2019-11-01,Hemisphere Media Group to Host Third Quarter 2019 Financial Results Conference Call
2019-10-30,Heres What Hedge Funds Think About Hemisphere Media Group Inc (HMTV)
2019-10-03,Fastest Growing Colombian Broadcast Network Canal 1 Reaches Content and Commercial Partnership Deal with Discovery Colombia
2019-10-02,"How Much Of Hemisphere Media Group, Inc. (NASDAQ:HMTV) Do Insiders Own?"
2019-09-16,"JOIN EUGENIO DERBEZ AND HIS ENTIRE FAMILY ON AN EXOTIC AND EXCITING ADVENTURE IN ""DE VIAJE CON LOS DERBEZ"" LAUNCHING EXCLUSIVELY IN THE U.S. ON PANTAYA"
2019-08-27,These 4 Measures Indicate That Hemisphere Media Group (NASDAQ:HMTV) Is Using Debt Reasonably Well
2019-08-27,Edited Transcript of HMTV earnings conference call or presentation 2-Aug-19 2:00pm GMT
2019-08-05,Hemisphere Media Group Inc (HMTV) Q2 2019 Earnings Call Transcript
2019-08-02,Hemisphere Media Group Announces Second Quarter 2019 Financial Results
2019-07-29,Hemisphere Media Group Announces 10-Year Extension of Concession License for Canal 1 in Colombia at No Additional Cost
2019-07-24,Hemisphere Media Group to Host Second Quarter 2019 Financial Results Conference Call
2019-07-22,"Calculating The Fair Value Of Hemisphere Media Group, Inc. (NASDAQ:HMTV)"
2019-06-07,Investors Who Bought Hemisphere Media Group (NASDAQ:HMTV) Shares Three Years Ago Are Now Up 12%
2019-05-28,Hemisphere Media Group Appoints Sonia Dulá to its Board of Directors
2019-05-13,Edited Transcript of HMTV earnings conference call or presentation 7-May-19 2:00pm GMT
2019-05-09,Heres What Hedge Funds Think AboutHemisphere Media Group Inc (HMTV)
2019-05-07,Hemisphere Media Group Inc (HMTV) Q1 2019 Earnings Call Transcript
2019-05-07,Hemisphere Media Group Announces First Quarter 2019 Financial Results
2019-05-07,"Hemisphere Media Group, Inc. to Host Earnings Call"
2019-05-01,Hemisphere Media Group to Host First Quarter 2019 Financial Results Conference Call
2019-04-25,"Is Hemisphere Media Group, Inc.'s (NASDAQ:HMTV) CEO Paid Enough Relative To Peers?"
2019-04-22,Cinelatino Reaches a Multi-Year Carriage Renewal Agreement with DISH Network
2019-03-09,Edited Transcript of HMTV earnings conference call or presentation 5-Mar-19 1:30pm GMT
2019-03-05,Hemisphere Media Group Inc (HMTV) Q4 2018 Earnings Conference Call Transcript
2019-03-05,Hemisphere Media Group Announces Fourth Quarter and Full Year 2018 Financial Results
2019-03-05,"Hemisphere Media Group, Inc. Class A to Host Earnings Call"
2019-03-04,Hemisphere Media Group's Cable Network Pasiones to Launch Nationally on Spectrum
2019-02-27,Hemisphere Media Group to Host Fourth Quarter and Full Year 2018 Financial Results Conference Call
2019-02-12,"Recent Analysis Shows Oasis Petroleum, MasTec, Voya Financial, Everi, Harmonic, and Hemisphere Media Group Market Influences  Renewed Outlook, Key Drivers of Growth"
2019-01-04,"Do Directors Own Hemisphere Media Group, Inc. (NASDAQ:HMTV) Shares?"
2018-11-27,Hemisphere Media Group Finalizes Acquisition of 75% Equity Interest in Spanish-Language Content Distribution Company Snap TV
2018-11-20,Edited Transcript of HMTV earnings conference call or presentation 5-Nov-18 10:00pm GMT
2018-11-16,Should You Worry About Hemisphere Media Group Incs (NASDAQ:HMTV) CEO Pay?
2018-11-09,"New Research Coverage Highlights American Public Education, Protagonist Therapeutics, TravelCenters of America, Five Prime Therapeutics, Red Robin Gourmet Burgers, and Hemisphere Media Group  Consolidated Revenues, Company Growth, and Expectations for 2018"
2018-11-07,Hemisphere Media: 3Q Earnings Snapshot
2018-11-05,Hemisphere Media Group Announces Third Quarter 2018 Financial Results
2018-10-31,Hemisphere Media Group to Host Third Quarter 2018 Financial Results Conference Call
2018-10-16,"Factors of Influence in 2018, Key Indicators and Opportunity within Iamgold, Mazor Robotics, Flexion Therapeutics, Hemisphere Media Group, Criteo S.A, and EP Energy  New Research Emphasizes Economic Growth"
2018-09-25,Is Hemisphere Media Group Inc (NASDAQ:HMTV) A Financially Sound Company?
2018-08-15,Edited Transcript of HMTV earnings conference call or presentation 3-Aug-18 2:00pm GMT
2018-08-15,Hemisphere Media Group Announces New $25 Million Share Repurchase Plan
2018-08-03,Hemisphere Media Group Announces Second Quarter 2018 Financial Results
2018-08-03,"Hemisphere Media Group, Inc. Class A to Host Earnings Call"
2018-08-02,Televisión Dominicana Renews Rights to Air the Dominican Professional Baseball Winter League (LIDOM)
2018-07-26,Hemisphere Media Group to Host Second Quarter 2018 Financial Results Conference Call
2018-06-26,"At US$013.85, Is Hemisphere Media Group Inc (NASDAQ:HMTV) A Buy?"
2018-06-21,Four of Hemisphere's Leading Hispanic Networks Available on DIRECTV NOW
2018-06-15,Puerto Rico's WAPA Television and WAPA Deportes Reach Multi-Year Retransmission Consent Agreement with DIRECTV in Puerto Rico
2018-05-30,"Report: Exploring Fundamental Drivers Behind Ducommun, Redfin, Hemisphere Media Group, General Electric, Snap-On, and Veritex  New Horizons, Emerging Trends, and Upcoming Developments"
2018-05-08,Edited Transcript of HMTV earnings conference call or presentation 4-May-18 2:00pm GMT
2018-05-04,Hemisphere Media Group Announces First Quarter 2018 Financial Results
2018-04-27,Hemisphere Media Group to Host First Quarter 2018 Financial Results Conference Call
2018-04-05,Hemisphere Media Group Announces Expiration of Warrants
2018-04-05,"Consolidated Research: 2018 Summary Expectations for Bank of Hawaii, Stericycle, Avnet, Hemisphere Media Group, H. B. Fuller, and Cresud S.A.C.I.F. y A  Fundamental Analysis, Key Performance Indications"
2018-03-28,Calculating The Fair Value Of Hemisphere Media Group Inc (NASDAQ:HMTV)
2018-03-20,Is There Now An Opportunity In Hemisphere Media Group Inc (NASDAQ:HMTV)?
2018-03-12,"Cinelatino Launches on Cox Communications in New Orleans and Other Southeast Markets, Giving the Network Full Distribution Throughout Cox National Footprint"
2018-03-06,Hemisphere Media Group (HMTV) Q4 2017 Earnings Conference Call Transcript
2018-03-06,Edited Transcript of HMTV earnings conference call or presentation 5-Mar-18 3:00pm GMT
2018-03-05,Hemisphere Media Group Announces Fourth Quarter and Full Year 2017 Financial Results
2018-03-05,"Hemisphere Media Group, Inc. Class A to Host Earnings Call"
2018-03-01,Does Hemisphere Media Group Incs (NASDAQ:HMTV) PE Ratio Warrant A Sell?
2018-02-23,Hemisphere Media Group to Host Fourth Quarter and Full Year 2017 Financial Results Conference Call
2018-02-08,"Report: Exploring Fundamental Drivers Behind Stericycle, Hemisphere Media Group, Expedia, Olin, Aimmune Therapeutics, and Waste Management  New Horizons, Emerging Trends, and Upcoming Developments"
