2021-01-06,"Calyxt, Inc. (NASDAQ:CLXT): When Will It Breakeven?"
2020-12-14,"Alexion, Calyxt, Arvinas: 5 Top Stock Gainers for Monday"
2020-12-14,Calyxt Announces Sale of Entire 2020 Grain Production to ADM
2020-11-29,"Where Do Hedge Funds Stand On Calyxt, Inc. (CLXT)?"
2020-11-19,What Makes Calyxt (CLXT) a New Strong Buy Stock
2020-11-11,Calyxt Announces Collaboration with NRGene® to Advance its Product Pipeline
2020-11-07,"Analysts Have Been Trimming Their Calyxt, Inc. (NASDAQ:CLXT) Price Target After Its Latest Report"
2020-11-05,Calyxt Reports Third Quarter 2020 Financial Results
2020-11-05,"Calyxt, Inc. to Host Earnings Call"
2020-11-02,S&W Seed Company Announces Commercial Agreement with Calyxt Inc. to Deliver Improved Quality Alfalfa
2020-10-29,Calyxt Announces Commercial Agreement with S&W Seed Company to Deliver Improved Quality Alfalfa
2020-10-27,"Calyxt to Host Virtual Analyst Day on Tuesday, November 17, 2020 at 4:00 p.m. Eastern Time"
2020-10-24,"What Type Of Shareholders Make Up Calyxt, Inc.'s (NASDAQ:CLXT) Share Registry?"
2020-10-20,Calyxt Announces Closing of Registered Direct Offering of Common Stock
2020-10-16,Calyxt Announces $15 Million Registered Direct Offering
2020-10-14,Calyxt Appoints Sarah Reiter as Vice President of Business Development
2020-10-13,"Calyxt to Host Third Quarter 2020 Financial Results Conference Call on Thursday, November 5, 2020 at 4:30 p.m. Eastern Time"
2020-08-25,Calyxt to Present at Upcoming September Investor Conferences
2020-08-10,Calyxt's (NASDAQ:CLXT) Stock Price Has Reduced53% In The Past Three Years
2020-08-10,Does Calyxt (NASDAQ:CLXT) Have A Healthy Balance Sheet?
2020-08-05,Calyxt Reports Second Quarter 2020 Financial Results
2020-08-05,LD Micro - Announces Preliminary List of Presenters for the LD-500
2020-08-03,"Calyxt to Present at the Canaccord Genuity 40th Annual Growth Conference on Thursday, August 13, 2020"
2020-07-20,"Calyxt to Host Second Quarter 2020 Financial Results Conference Call on Thursday, August 6, 2020 at 8:00 a.m. Eastern Time"
2020-07-06,Calyxt Announces Board Changes
2020-06-04,"Is Calyxt, Inc. (CLXT) A Good Stock To Buy?"
2020-06-03,Calyxts High Oleic Low Linolenic Soybean Oil Deemed Non-Regulated by USDA
2020-05-18,Calyxt (CLXT) Moves to Strong Buy: Rationale Behind the Upgrade
2020-05-09,"US$6.33: That's What Analysts Think Calyxt, Inc. (NASDAQ:CLXT) Is Worth After Its Latest Results"
2020-05-07,Calyxt: Q1 Earnings Insights
2020-05-07,Calyxt Reports First Quarter 2020 Financial Results
2020-04-30,Calyxt Launches Consumer E-Commerce Channel for Calyno® Premium Cooking Oil
2020-04-14,"Calyxt to Host First Quarter 2020 Financial Results Conference Call on Thursday, May 7, 2020 at 8:30 a.m. Eastern Time"
2020-04-07,Calyxt Licenses New Enabling Technology from University of Minnesota for Greater Efficiency in Gene Edited Plants
2020-03-24,Calyxt Launches New Website Showcasing the Power and Possibilities of Plants
2020-03-05,Calyxt Reports Record Fourth Quarter and Full Year 2019 Financial Results
2020-02-10,"Calyxt to Host Fourth Quarter and Full Year 2019 Financial Results Conference Call on Thursday, March 5, 2020 at 8:30 a.m. Eastern Time"
2020-02-10,Those Who Purchased Calyxt (NASDAQ:CLXT) Shares A Year Ago Have A 52% Loss To Show For It
2020-02-07,"Calyxt Achieves 2020 Soybean Contracted Acreage Goal of 100,000 Acres"
2020-01-23,Calyxt Appoints Bobby Williams as Gene Editing Director to Expand Innovation and Product Pipeline
2020-01-21,Calyxt Issues Stockholder Letter
2019-12-20,"Hedge Funds Have Never Been More Bullish On Calyxt, Inc. (CLXT)"
2019-12-16,Calyxt Announces Collaboration with Central Valley Ag to Expand Grower Network
2019-12-03,Calyxt Appoints Vince Restucci as Vice President of Agronomy Services to Accelerate Expansion
2019-11-17,Analysts Recommend These 2 Falling Knives
2019-11-12,Calyxt to Participate at Upcoming Investor Conferences
2019-11-10,"When Will Calyxt, Inc. (NASDAQ:CLXT) Turn A Profit?"
2019-11-06,Calyxt Reports Record Third Quarter 2019 Financial Results
2019-10-30,"Calyxt to Host Third Quarter 2019 Results Conference Call on Wednesday, November 6, 2019 at 4:30 p.m. Eastern Time"
2019-09-26,Calyxt Provides Business and R&D Pipeline Update at Wells Fargo Consumer Conference
2019-09-20,Companies Like Calyxt (NASDAQ:CLXT) Are In A Position To Invest In Growth
2019-09-19,Calyxt® Announces Seed Agreement with Landus Cooperative
2019-09-11,"Calyxt® to Present at the Fall Investor Summit on September 17, 2019"
2019-09-03,Calyxt Strengthens its Leadership Team to Support Commercial Growth Opportunities
2019-08-28,Trial by fryer: Calyxt's gene-edited oil gets its Minnesota State Fair debut
2019-08-19,Agriculture Operations Outlook: Tariffs to Mar Organic Gains
2019-08-15,Tractor Supply's Robust Omni-Channel Efforts to Drive Growth
2019-08-08,"Calyxt, Inc. (CLXT) Q2 2019 Earnings Call Transcript"
2019-08-06,Calyxt Reports 2nd Quarter Financial Results
2019-07-31,Calyxt (CLXT) Expected to Beat Earnings Estimates: Should You Buy?
2019-07-22,"Calyxt to Hold Second Quarter Investor Conference Call on Wednesday, August 7, at 8:30 a.m. EDT  7:30 a.m. CDT"
2019-07-22,"Calyxt, Inc. (NASDAQ:CLXT) Insiders Have Been Selling"
2019-06-25,Calyxt® Reiterates 2019 Guidance and Gives Business Update During June 25 Investor Day
2019-06-24,Calyxt® Enters Commercial Soybean Crushing Agreement with Landus Cooperative
2019-06-11,"Calyxt to Host Investor & Analyst Day on June 25, 2019"
2019-06-05,Tractor Supply (TSCO) Rides on Robust Omni-Channel Strategy
2019-05-15,Calyxt Appoints Dr. Travis Frey as Chief Technology Officer
2019-05-09,"Calyxt, Inc. (CLXT) Q1 2019 Earnings Call Transcript"
2019-05-08,"Calyxt, Inc. to Host Earnings Call"
2019-05-08,Calyxt: 1Q Earnings Snapshot
2019-05-07,Calyxt Reports 1st Quarter Financial Results
2019-05-06,"Dr. Dan Voytas, Co-Founder & Chief Science Officer of Calyxt, Elected to the National Academy of Sciences"
2019-05-01,Earnings Preview: Calyxt (CLXT) Q1 Earnings Expected to Decline
2019-04-29,"Calyxt to Hold First Quarter Investor Conference Call on Wednesday, May 8, at 8:30 a.m. EDT  7:30 a.m. CDT"
2019-04-29,Earnings Preview: Calyxt (CLXT) Q1 Earnings Expected to Decline
2019-04-12,US-China Trade Talks to Influence Agriculture Operations Outlook
2019-03-21,Archer Daniels' Cost Savings &amp; Project Readiness Bode Well
2019-03-12,Gene-edited food quietly arrives in restaurant cooking oil
2019-03-12,Gene-edited food quietly arrives in restaurant cooking oil
2019-03-11,"Calyxt (CLXT) Reports Q4 Loss, Lags Revenue Estimates"
2019-03-11,Calyxt Reports 4th Quarter and Full Year 2018 Financial Results
2019-03-05,"Calyxt to Hold Fourth Quarter and Full-Year 2018 Investor Conference Call on Tuesday, March 12, at 8:30 a.m. EDT  7:30 a.m. CDT"
2019-02-26,First Commercial Sale of Calyxt High Oleic Soybean Oil on the U.S. Market
2019-02-19,Calyxt and Agtegra Cooperative Announce Strategic Collaboration to Distribute Calyxt High Oleic Soybean
2019-02-11,"Consolidated Research: 2019 Summary Expectations for Granite Point Mortgage Trust, Brandywine Realty Trust, Kraton, Century Aluminum, Rudolph Technologies, and Calyxt  Fundamental Analysis, Key Performance Indications"
2019-02-10,[$$] Gene editing: how agritech is fighting to shape the food we eat
2019-01-28,Calyxt Names Debra Frimerman as General Counsel
2019-01-23,Kimberly Nelson Appointed to Calyxt Board of Directors
2019-01-22,Calyxt Doubles 2018 High Oleic Soybean Acres
2019-01-22,Can Clorox's Strategic Growth Efforts Offset Margin Issues?
2019-01-22,Archer Daniels Rides on Solid Cost Saving &amp; Readiness Efforts
2019-01-03,"Calyxt Appoints Veteran Finance Executive, William F. Koschak, as Chief Financial Officer"
2018-12-21,"When Can We Expect A Profit From Calyxt, Inc. (NASDAQ:CLXT)?"
2018-12-17,Calyxt Receives EU Patent on Use of CRISPR/Cas9 for Genome Editing in Plants
2018-12-17,"The Zacks Analyst Blog Highlights: Archer-Daniels, Monster Beverage, Blue Apron, Calyxt and Ollie's"
2018-12-14,5 Top Consumer Staples to Buy Stocks Amid a Volatile Market
2018-12-12,[$$] U.S. Soybean Farmers Work to Loosen Chinas Grip
2018-11-26,"Report: Exploring Fundamental Drivers Behind Reata Pharmaceuticals, Calyxt, SIFCO Industries, EchoStar, Tel-Instrument Electronics, and United States Antimony  New Horizons, Emerging Trends, and Upcoming Developments"
2018-11-13,"Calyxt (CLXT) Reports Q3 Loss, Misses Revenue Estimates"
2018-11-13,Calyxt: 3Q Earnings Snapshot
