2021-01-08,"Is WW International, Inc. (NASDAQ:WW) Trading At A 32% Discount?"
2021-01-06,"Medifast, IBD Stock Of The Day, Jumps Past Buy Point As Growth Accelerates"
2021-01-05,"WW CEO, The Vitamin Shoppe CEO on new partnership, product rollout"
2021-01-05,A Look Into WW International's Debt
2021-01-05,The Vitamin Shoppe and WW Announce Strategic Partnership to Support Healthy Living
2021-01-05,The Vitamin Shoppe and WW International Become Partners in Health
2021-01-04,WW Launches Digital 360 -A New App-Based Membership Plan Powered by a Lineup of Dynamic Coaches with LIVE and On-Demand Wellness Experiences
2021-01-01,James Corden Joins WW in a Multi-Year Global Partnership to Positively Shift Conversation Around Personal Health
2020-12-22,What Peloton's $420M acquisition of Precor means for the fitness industry
2020-12-11,"Exclusive: Blue Apron's CEO On Management Turnover, COVID-19 Safety, Standing Out Among Meal Kit Rivals"
2020-12-03,If You Had Bought WW International's (NASDAQ:WW) Shares Three Years Ago You Would Be Down 32%
2020-11-30,WW Announces Participation in Upcoming Investor Conferences
2020-11-24,Is This Weight Loss Company Coming for WW And Noom's Market Share?
2020-11-23,WW International CEO on myWW+ launch: Users are having 'greater weight loss success'
2020-11-16,WW Launches New myWW+ with Major Enhancements to its Award-Winning App Designed to Help Make Losing Weight Easier
2020-11-09,WW to Present at Morgan Stanleys Life After Covid Thematic Conference
2020-10-30,WW CEO on earnings beat: People are 'reappraising' their health during COVID-19
2020-10-29,WW International (WW) Beats Q3 Earnings Estimates
2020-10-29,WW CEO on earnings beat: People are 'reappraising' their health during COVID-19
2020-10-29,"WW's stock surges after profit rises above expectations, while revenue falls shy"
2020-10-29,WW Announces Strong Third Quarter 2020 Results and Continued Subscriber Momentum
2020-10-29,"WW International, Inc. to Host Earnings Call"
2020-10-28,"Is WW International, Inc. (NASDAQ:WW) Popular Amongst Insiders?"
2020-10-22,WW International (WW) Expected to Beat Earnings Estimates: Should You Buy?
2020-10-16,"WW International partners with Bank of America, Beyond Meat to close the nutrition gap"
2020-10-16,The Healthy Living Coalition Launches to Unite Business Leadership and Accelerate Solutions That Address Global Nutrition and Food Insecurity
2020-10-15,WW Schedules Third Quarter 2020 Earnings Conference Call
2020-10-14,WW Collaborates with Zoom For the Launch of New Experiences OnZoom and Zoom's Application Marketplace
2020-09-28,"Hedge Funds Are Coming Back To WW International, Inc. (WW)"
2020-09-28,"Take Care Before Jumping Onto WW International, Inc. (NASDAQ:WW) Even Though It's 27% Cheaper"
2020-09-23,WW Introduces Ciara as New Global Ambassador
2020-09-18,A Look Into WW International's (NASDAQ:WW) Impressive Returns On Capital
2020-09-17,WW Announces Participation in Upcoming Investor Conferences
2020-09-14,"WW Launches First Ready-to-Drink, Canned Coffee Lattes"
2020-09-14,Yahoo Finance Presents: Peloton CEO & Co-founder John Foley
2020-09-03,WW to Present at KeyBanc Capital Markets' Future of Technology Series
2020-09-02,Michael Jordan Is Betting on DraftKings. What Oprah and Shaq Teach Us About How Celebrities Can Help Stocks.
2020-08-29,4 Investing Lessons From Oprah Winfrey
2020-08-27,"WW Collaborates with Amazon For the Launch of Amazon Halo, Amazon's New Service Dedicated to Helping Customers Improve Their Personal Health and Wellness"
2020-08-26,"The Zacks Analyst Blog Highlights: Peloton, Planet Fitness, Facebook, Alphabet and Weight Watchers"
2020-08-17,WW CEO on succeeding: Surround yourself with 'incredible talent' and make others successful
2020-08-17,WW CEO Mindy Grossman: 'We can have productive discomfort' to drive change in the workplace
2020-08-14,"What Sells in a Pandemic? Weight Watchers, Pools and Cereal"
2020-08-06,WW International Tumbles on Slim Earnings Miss
2020-08-05,WW Stock Slides 8% After Quarterly Earnings Miss. But Digital Subscribers Are Up.
2020-08-05,WW Stock Off as Results Are Hurt by Pandemic Closures
2020-08-04,WW International (WW) Q2 Earnings and Revenues Lag Estimates
2020-08-04,WW stock falls more than 7% after company's Q2 earnings miss
2020-08-04,WW Announces Second Quarter 2020 Results with Record Digital Subscribers
2020-07-31,2 Top Stocks You Can Buy on Sale
2020-07-29,"A Look At The Intrinsic Value Of WW International, Inc. (NASDAQ:WW)"
2020-07-29,CVS Health Adds WW (formerly Weight Watchers) Digital Weight Management and Wellness Offerings to their Health Point Solutions Management Platform
2020-07-29,2 Digital Health and Fitness Stocks to Buy in 2020
2020-07-28,Analysts Estimate WW International (WW) to Report a Decline in Earnings: What to Look Out for
2020-07-21,WW Schedules Second Quarter 2020 Earnings Conference Call
2020-07-18,"Did Hedge Funds Make The Right Call On WW International, Inc. (WW) ?"
2020-06-22,Oprah Winfrey Sells Millions of Dollars More of Weight Watchers Stock
2020-06-19,WW to Present at Jefferies Virtual Consumer Conference
2020-06-17,"Hedge Funds Are Dumping WW International, Inc. (WW)"
2020-06-16,"Dow ends 526 points higher, extending win streak to three days, but  Powell says more Congressional spending may be needed"
2020-06-16,Coronavirus update: Global case tally tops 8 million and states reopen businesses even as infections and hospitalizations rise
2020-06-16,Weight Watchers sees digital subscriptions jump amid coronavirus
2020-06-16,WW Shares Spike on Digital-Subscriber Growth
2020-06-16,Why WW International Stock Jumped Today
2020-06-16,P/E Ratio Insights for WW International
2020-06-16,"WW International's Digital Memberships Surge, Studios Reopen"
2020-06-15,"CORRECTION - WW International Provides Update on Strong Momentum in Digital Trends, Studio Reopening Plans, and Amended Revolving Credit Facility"
2020-06-15,Weight Watchers stock rallies as digital subscriptions get coronavirus boost
2020-06-15,"WW International Provides Update on Strong Momentum in Digital Trends, Studio Reopening Plans, and Amended Revolving Credit Facility"
2020-06-13,Oprah Winfrey Sells Millions of Dollars of Slumping Weight Watchers Stock
2020-06-12,WW to Present at Oppenheimer 20th Annual Consumer Growth Conference
2020-06-03,Is WW International Stock a Buy?
2020-06-02,Mental health challenge amid coronavirus is 'a crisis on top of a crisis': American Medical Association President
2020-05-28,WW International Still Leads the Pack in Weight Loss
2020-05-25,Weight Watchers Fires Thousands Over Zoom
2020-05-23,"Some wellness products growing over 1,000% during pandemic: Ro CEO"
2020-05-15,Weight Watchers plans layoffs to save costs amid pandemic
2020-05-14,WW to Present at Goldman Sachs Global Staples Forum
2020-05-13,Could Weight Watchers Fatten Up Another 33%?
2020-05-13,Why WW International Popped 14% Today
2020-05-13,Weight Watchers Stock Extends Rally After Upgrade
2020-05-13,"WW International Has $300B Addressable Market, Jefferies Says In Bullish Initiation"
2020-05-13,Weight Watchers Strategy Shift Makes Shares a Buy at Jefferies
2020-05-12,Oprah Winfrey And WW Announce 'Oprah's Your Life In Focus: A Vision Forward' Live Virtual Experience
2020-04-30,"A Rising Share Price Has Us Looking Closely At WW International, Inc.'s (NASDAQ:WW) P/E Ratio"
2020-04-29,Health and wellness will no longer be a luxury post COVID-19: WW International CEO
2020-04-29,WW CEO Mindy Grossman: MyWW & Oprah's '2020 Vision' Tour fueled subscriber growth
2020-04-28,"WW International (WW) Reports Q1 Loss, Lags Revenue Estimates"
2020-04-28,"Weight Watchers stock rallies as company posts narrower Q1 loss, grows subscriber base"
2020-04-28,WW Announces First Quarter 2020 Results and Accelerates Digital Transformation
2020-04-28,Solid Rally Kicks Off Tech Week
2020-04-21,WW Schedules First Quarter 2020 Earnings Conference Call
2020-04-17,Dr. Phils argument for reopening the economy: We dont shut down the country for car accidents and swimming pool deaths
2020-04-14,WW Pledges $2 Million to support those most affected by COVID-19
2020-03-28,"Hedge Funds Have Never Been This Bullish On Weight Watchers International, Inc. (WW)"
2020-03-27,"Former Weight Watchers WW stock upgraded at Morgan Stanley, sees upside after 'cocoon' phase of COVID-19 ends"
2020-03-27,Is WW International (WW) a Great Value Stock Right Now?
2020-03-27,Diet Company WW May Get Lift From Stress Eating During Lockdown
2020-03-27,WW International Upgraded by Morgan Stanley Which Sees Strength After Coronavirus
2020-03-20,"A Sliding Share Price Has Us Looking At WW International, Inc.'s (NASDAQ:WW) P/E Ratio"
