2021-01-01,Ingevity Corporation (NYSE:NGVT) Delivered A Better ROE Than Its Industry
2020-12-04,Ingevity (NGVT) Stock Up 15% in 3 Months: What's Driving It?
2020-12-02,Read This Before Selling Ingevity Corporation (NYSE:NGVT) Shares
2020-12-01,Venator (VNTR) Surges: Stock Moves 6.9% Higher
2020-11-24,4 Chemical Specialty Stocks to Escape Industry Challenges
2020-11-19,Ingevity (NGVT) Up 12% Since Last Earnings Report: Can It Continue?
2020-11-18,Why You Should Add Ingevity (NGVT) Stock to Your Portfolio
2020-11-18,Ingevity to challenge U.S. court ruling on emission control patent and expects limited impact on commercial operations or financial results through patent expiration in March 2022
2020-11-02,Ingevity Corporation Just Recorded A 64% EPS Beat: Here's What Analysts Are Forecasting Next
2020-10-30,Ingevity Corp (NGVT) Q3 2020 Earnings Call Transcript
2020-10-29,Ingevity Corp. to Host Earnings Call
2020-10-20,Ingevity prices $550 million senior notes offering
2020-10-20,Ingevity Corporation -- Moody's assigns Ba3 to Ingevity's new senior unsecured notes
2020-10-20,Ingevity (NGVT) Q3 Earnings and Revenues Beat Estimates
2020-10-20,Ingevity announces proposed private offering of senior unsecured notes
2020-10-20,Ingevity reports selected preliminary third quarter 2020 financial results
2020-10-12,Ingevity (NGVT) Up 44% in 6 Months: What's Behind the Rally?
2020-10-07,Ingevity Corporation -- Moody's announces completion of a periodic review of ratings of Ingevity Corporation
2020-10-07,Ingevity names Erik Ripple as chief growth and innovation officer
2020-10-05,What Do The Returns On Capital At Ingevity (NYSE:NGVT) Tell Us?
2020-10-02,Ingevity Gains on Cost Actions Amid Weak Industrial Demand
2020-10-01,Ingevity announces dates for third quarter earnings release and webcast
2020-09-15,Hedge Funds Keep Buying Ingevity Corporation (NGVT)
2020-09-15,Why You Should Keep Ingevity (NGVT) Stock in Your Portfolio
2020-09-07,Ingevity (NGVT) Up 57% in 6 Months: What's Driving the Stock?
2020-09-04,If You Had Bought Ingevity's (NYSE:NGVT) Shares A Year Ago You Would Be Down 27%
2020-08-28,Why Is Ingevity Corporation (NGVT) Up 1.4% Since Last Earnings Report?
2020-08-24,"Ingevity names John C. Fortson as president, CEO and director"
2020-08-18,"Ingevity continues to purify, protect and enhance the world through sustainability initiatives, publishes 2019 report"
2020-08-14,Here's Why You Should Hold Onto Ingevity (NGVT) Stock for Now
2020-08-05,Are Investors Undervaluing Ingevity Corporation (NYSE:NGVT) By 20%?
2020-07-30,Ingevity Corp (NGVT) Q2 2020 Earnings Call Transcript
2020-07-30,"Ingevity (NGVT) Earnings Meet, Sales Beat Estimates in Q2"
2020-07-29,Ingevity Corporation (NGVT) Matches Q2 Earnings Estimates
2020-07-29,Ingevity: Q2 Earnings Insights
2020-07-29,Ingevity reports second quarter 2020 financial results
2020-07-22,Earnings Preview: Ingevity Corporation (NGVT) Q2 Earnings Expected to Decline
2020-07-17,Ingevity Has the Right Mix for an Upside Breakout
2020-07-16,Study shows use of Ingevitys Evotherm M1 warm mix asphalt additive in paving applications offsets greenhouse gases generated in its manufacture by up to 23 times
2020-07-12,Did Hedge Funds Make The Right Call On Ingevity Corporation (NGVT) ?
2020-07-09,Study shows use of Ingevitys Nuchar activated carbon in automotive applications and canisters offsets greenhouse gases generated in their manufacture by 10 times
2020-07-02,Ingevity announces dates for second quarter earnings release and webcast
2020-07-01,Why You Should Retain Ingevity (NGVT) Stock in Your Portfolio
2020-06-25,Ingevity announces new date and details for upcoming sustainability webinar
2020-06-22,"Katherine Pryor Burgeson elects to retire as executive vice president, general counsel and secretary of Ingevity"
2020-06-15,Ingevity announces details for upcoming Performance Materials webinar
2020-06-08,Hedge Funds Have Never Been This Bullish On Ingevity Corporation (NGVT)
2020-06-03,Ingevity to Lower Costs in Response to Coronavirus Outbreak
2020-06-02,"Ingevity to reduce costs, staffing in response to coronavirus"
2020-05-29,Ingevity Corporation (NGVT) Up 3.1% Since Last Earnings Report: Can It Continue?
2020-05-29,Ingevity Gains on Capa Buyout Amid Weak Industrial Demand
2020-05-28,Ingevity announces details for upcoming Industrial Specialties and Oilfield Technologies webinar
2020-05-22,Edited Transcript of NGVT earnings conference call or presentation 30-Apr-20 2:00pm GMT
2020-05-21,A Rising Share Price Has Us Looking Closely At Ingevity Corporation's (NYSE:NGVT) P/E Ratio
2020-05-14,Ingevity announces details for upcoming Engineered Polymers webinar
2020-05-13,Ingevitys Evotherm® technology simplifies remote island paving
2020-05-04,Ozinga Energy and Ingevity announce adsorbed natural gas vehicle partnership
2020-05-04,"How Does Ingevity's (NYSE:NGVT) P/E Compare To Its Industry, After Its Big Share Price Gain?"
2020-05-01,Ingevity Corp (NGVT) Q1 2020 Earnings Call Transcript
2020-05-01,Ingevity Corporation Just Beat Earnings Expectations: Here's What Analysts Think Will Happen Next
2020-04-30,Ingevity (NGVT) Earnings & Revenues Surpass Estimates in Q1
2020-04-29,Ingevity Corporation (NGVT) Beats Q1 Earnings and Revenue Estimates
2020-04-29,Ingevity reports first quarter 2020 financial results
2020-04-22,Earnings Preview: Ingevity Corporation (NGVT) Q1 Earnings Expected to Decline
2020-04-19,What Is Ingevity's (NYSE:NGVT) P/E Ratio After Its Share Price Rocketed?
2020-04-08,Ingevity to Gain From Capa Buyout & Regulation-driven Demand
2020-04-03,Ingevity announces change of location for 2020 Annual Meeting of Stockholders
2020-04-02,Here's Why You Should Hold Onto Ingevity (NGVT) Stock Now
2020-04-02,Ingevity announces details for upcoming Pavement Technologies webinar
2020-04-01,Ingevity announces dates for first quarter 2020 earnings release and webcast
2020-03-27,Hedge Funds Were Getting Burned By Ingevity Corporation (NGVT) Before The Coronavirus
2020-03-25,Ingevity Provides Update in Response to Coronavirus Outbreak
2020-03-24,Ingevity announces webinar series on businesses and sustainability
2020-03-23,Ingevity provides update in light of coronavirus (COVID-19)
2020-03-20,"How Does Ingevity's (NYSE:NGVT) P/E Compare To Its Industry, After The Share Price Drop?"
2020-03-11,Ingevity Corporation -- Moody's changed Ingevity's outlook to stable from negative and affirmed its Ba2 CFR
2020-03-04,Why Is Ingevity Corporation (NGVT) Down 23.9% Since Last Earnings Report?
2020-03-03,Ingevity (NGVT) Authorizes Share Repurchase Worth $500M
2020-03-02,Ingevity authorizes $500 million in share repurchases
2020-02-26,A Sliding Share Price Has Us Looking At Ingevity Corporation's (NYSE:NGVT) P/E Ratio
2020-02-20,Ingevity CEO steps down because of 'personal conduct'
2020-02-20,D. Michael Wilson Resigns as CEO of Ingevity; Chairman Richard Kelson Appointed Interim CEO
2020-02-19,Edited Transcript of NGVT earnings conference call or presentation 3-Feb-20 4:00pm GMT
2020-02-10,"Ingevity to present at Loop Capital 2020 Markets Transportation, Logistics and Materials Conference on February 13, 2020"
2020-02-09,Weekly CEO Buys Highlight
2020-02-06,New Strong Sell Stocks for February 6th
2020-02-05,"Ingevity Corporation Just Reported, And Analysts Assigned A US$94.90 Price Target"
2020-02-04,"Ingevity (NGVT) Q4 Earnings Surpass Estimates, Sales Miss"
2020-02-03,Ingevity Corporation (NGVT) Q4 Earnings Beat Estimates
2020-02-03,Ingevity reports preliminary fourth quarter and full year 2019 financial results
2020-01-31,Ingevity reschedules dates for fourth quarter and full year earnings release and webcast
2020-01-29,Ingevity to petition U.S. International Trade Commission to review Administrative Law Judges Initial Determination; intends to pursue case against MAHLE for infringing gasoline vapor emission control technology patent
2020-01-23,Ingevity announces dates for fourth quarter and full year earnings release and webcast
2020-01-07,An Intrinsic Calculation For Ingevity Corporation (NYSE:NGVT) Suggests It's 28% Undervalued
2020-01-06,"Ingevitys Michael Wilson to present at CJS Securities Investor Conference on January 8, 2020"
2019-12-09,Investors Who Bought Ingevity (NYSE:NGVT) Shares Three Years Ago Are Now Up 70%
2019-12-08,Heres What Hedge Funds Think About Ingevity Corporation (NGVT)
2019-12-03,Ingevitys pine chemistry means heavy-duty tools used to cut steel can last longer
2019-11-22,Ingevity Corporation (NGVT) Up 2.7% Since Last Earnings Report: Can It Continue?
2019-11-13,Here's Why I Think Ingevity (NYSE:NGVT) Is An Interesting Stock
