2021-01-06,'National Security' Designation For $700M YRC Loan 'Amiss'
2021-01-04,Reddaway Honored as 2020 Regional Freight Carrier of the Year by Johnson Controls
2020-12-22,YRC Freight Driver George Brown Achieves Five Million-Mile Safety Milestone
2020-12-17,UPDATE  YRC Freight Driver James Banner Achieves Five Million-Mile Safety Milestone
2020-12-17,YRC Freight Driver James Banner Achieves Five Million-Mile Safety Milestone
2020-12-10,Is YRCW A Good Stock To Buy Now?
2020-12-10,Mnuchin Would Not Have Made $700M Loan To YRC
2020-12-10,Mnuchin Questioned on Treasury Loan to Apollo-Backed Firm
2020-12-07,YRC Worldwide Provides Quarter-To-Date Operating Data for Fourth Quarter 2020
2020-12-02,$700M YRC Loan To Get Attention At Congressional Hearing
2020-11-18,Why YRC Worldwide Stock Popped 12% This Morning
2020-11-11,YRC Worldwide to Present at Stephens Annual Investment Conference 2020
2020-11-03,YRC Narrows 3rd-Quarter Loss; CFO Resigns
2020-11-02,YRC Worldwide: Q3 Earnings Insights
2020-11-02,YRC Worldwide Reports Third Quarter 2020 Results
2020-10-27,YRC Worldwide Schedules Third Quarter 2020 Earnings Conference Call
2020-10-23,"YRC Worldwide's (YRCW) Shares March Higher, Can It Continue?"
2020-10-08,YRC Freight Employee Named 2020 Tennessee Maintenance Professional of the Year
2020-10-05,YRC Worldwide Companies Named Top Company for Women to Work for in Transportation
2020-09-23,Is YRC Worldwide (NASDAQ:YRCW) Set To Make A Turnaround?
2020-09-21,YRC Worldwide Inc. -- Moody's announces completion of a periodic review of ratings of YRC Worldwide Inc.
2020-09-18,YRC Worldwide Companies Recognized as 2020 SmartWay High Performers
2020-09-11,10 Biggest Trucking Companies
2020-09-09,YRC Worldwide Provides Quarter-To-Date Operating Data for Third Quarter 2020
2020-08-25,Why YRC Worldwide Stock Just Crashed 16%
2020-08-24,Treasury's First Explanation Of YRC Loan Not Enough
2020-08-21,Fed Has Used Only a Fraction of Main Street Lending Facility
2020-08-16,Edited Transcript of YRCW.OQ earnings conference call or presentation 9-Aug-19 1:30pm GMT
2020-08-13,Holland Earns Two 2020 Logistics Management Quest for Quality Awards
2020-08-12,HNRY Logistics Launches Freight Shipment Solution for American Merchandise Conglomerate
2020-08-05,"YRC Freight Expands Regional Next-Day Service in the Mid-South and Waco, Texas"
2020-08-03,YRC Worldwide Reports Second Quarter 2020 Results
2020-07-30,YRC Freight Honored as FreightCenters 2019 Diamond Partner of the Year
2020-07-23,YRC Worldwide Schedules Second Quarter 2020 Earnings Conference Call
2020-07-22,Holland Recognized with Uline 2019 Exceptional Performance Award
2020-07-20,U.S. congressional body questions $700 mln loan to YRC Worldwide
2020-07-20,"Two Fed Programs Have Bought Only One Loan Each, Watchdog Says"
2020-07-20,YRC Worldwide's stock drops after report congressional panel decides company isn't essential to national security
2020-07-12,The U.S. Government Is Picking Winners and Losers. Investors Shouldnt Follow the Money.
2020-07-10,S&P Says The YRCW Situation Is Good Enough For An Increase In The Company's Debt Rating
2020-07-09,Most YRCW's Debt Ratings Held Steady By Moody's After Treasury Action
2020-07-09,YRCW Won't Face Loan Maturity Payments For 4+ Years Under New Deal
2020-07-09,Holland Recognized with 2019 Regional LTL Carriers Platinum Award by Echo Global Logistics
2020-07-08,"YRC Worldwide Inc. -- Moody's confirms the ratings of YRC Worldwide, CFR at Caa1, senior secured at B1; outlook stable"
2020-07-02,Trying To Make Sense Of The YRC Bailout
2020-07-02,"Coronavirus update: U.S. case tally climbs above 2.6 million, and top Republicans now call on Americans to wear face masks"
2020-07-01,YRC Gives Government 30% Stake In Latest Bailout
2020-07-01,Trucker YRC Gives U.S. 29.6% Stake for $700M Cares Act Loan
2020-07-01,YRC To Receive $700 Million CARES Act loan
2020-07-01,A Trucking Company You Never Heard of Just Borrowed Money From the Government. Why Its Stock Has Doubled.
2020-07-01,U.S. to take stake in troubled trucking company YRC Worldwide
2020-07-01,"Trucking company YRC to get $700 million CARES Act loan, stock rockets 75% premarket"
2020-07-01,U.S. to loan military hauler YRC Worldwide $700 mln for nearly 30% stake
2020-07-01,YRC Worldwide Expects To Receive $700 Million CARES Act Loan from U.S. Treasury
2020-07-01,"Stocks - FedEx, Beyond Meat Soar Premarket; Boeing Drops"
2020-07-01,US Treasury/YRC: good luck for the trucks
2020-06-30,Penny Stocks to Buy Using Technical Analysis for July 2020
2020-06-25,Holland Recognized as 2019 Preferred LTL Carrier of the Year by Total Quality Logistics
2020-06-18,YRC Freight Recognized Again as NASSTRAC National Carrier of the Year
2020-06-12,Old Dominion Freight Lines: It's About the Price
2020-06-11,Holland Recognized as 2019 Regional Carrier of the Year by CaseStack
2020-06-10,Holland Driver Herschel Evans Receives TravelCenters of America 2020 Citizen Driver Award
2020-06-10,Near-Term Trucking Outlook Marred by Coronavirus-Led Freight Woes
2020-06-09,YRC Worldwide Provides Quarter-To-Date Operating Data for Second Quarter 2020
2020-06-05,"Hedge Funds Never Been Less Bullish On YRC Worldwide, Inc. (YRCW)"
2020-06-04,ArcBest Sees Trends Rebound During May
2020-06-04,YRC Freight Recognized as 2019 Carrier of the Year by GlobalTranz
2020-05-29,YRC Worldwide Companies Recognized as 2020 BEST Award Winner by the Association for Talent Development
2020-05-21,YRC Freight Recognized as 2019 LTL Carrier of the Year by Dicks Sporting Goods
2020-05-13,Speculation On YRC's Survival Ramps Up
2020-05-13,"Company News for May 13, 2020"
2020-05-12,YRCW Women Leaders Dominate Women in Truckings Top Women to Watch List
2020-05-12,SHAREHOLDER ALERT: Purcell Julie & Lefkowitz LLP Is Investigating YRC Worldwide Inc. for Potential Breaches of Fiduciary Duty By Its Board of Directors
2020-05-11,"YRC Worldwide (YRCW) Reports Q1 Loss, Tops Revenue Estimates"
2020-05-11,YRC Worldwide Reports First Quarter 2020 Results
2020-05-04,YRC Worldwide Schedules First Quarter 2020 Earnings Conference Call
2020-04-30,Banks seek to limit revolver usage as companies race for cash
2020-04-29,YRC Worldwide Schedules First Quarter 2020 Earnings Conference Call
2020-04-21,YRC Worldwide Inc. -- Moody's appends limited default to Caa1-PD of YRC on partial PIK of interest
2020-04-20,"Teamsters allow YRC to defer health, welfare, pension payments"
2020-04-17,YRC Receives Grace Period For Union Benefits Amid 'Sharp Decline'
2020-04-17,Coronavirus has hit the trucking industry like a brick wall
2020-04-17,CLO issuance falls 48% as rush of loan downgrades threatens investor distributions
2020-04-15,Trump taps two Kansas City CEOs for economic revival groups
2020-04-09,YRC becomes latest KC company targeted by activist shareholder
2020-04-09,Activist Investor Seeks Changes To YRC Board
2020-04-09,YRC Worldwide Rebounds After Activist Involvement
2020-03-31,"YRC Worldwide Inc. -- Moody's downgrades YRC ratings, Corporate Family Rating to Caa1; all ratings on review for further downgrade"
2020-03-27,Stericycle settles with Saddle Point for two board seats-sources
2020-03-13,YRC Worldwide Provides Quarter-To-Date Operating Data for First Quarter 2020
2020-03-11,YRC Freight Expands Regional Next-Day Services in Texas to Fort Worth and Garland
2020-02-21,Edited Transcript of YRCW earnings conference call or presentation 4-Feb-20 10:00pm GMT
2020-02-18,YRC Worldwide Launches New Industry-centric Sales Verticals
2020-02-06,YRC Worldwide to Present at Stifel 2020 Transportation & Logistics Conference
2020-02-06,"YRC Worldwide to Present at Loop Capital Markets Transportation, Logistics & Materials Conference"
2020-02-05,YRC's Fourth Quarter EPS Less Bad Than Forecast; Rest Of Picture Looks Dark
2020-02-04,"YRC Worldwide (YRCW) Reports Q4 Loss, Misses Revenue Estimates"
2020-02-04,YRC Worldwide Reports Unaudited Fourth Quarter and Full Year 2019 Results
2020-01-30,YRC Worldwide Schedules Fourth Quarter and Full Year 2019 Earnings Conference Call
2020-01-28,New Penn Requests Additional Headcount
