2021-01-06,"Is It Too Late To Consider Buying Atlas Air Worldwide Holdings, Inc. (NASDAQ:AAWW)?"
2021-01-05,Is Atlas Air Worldwide (AAWW) a Great Value Stock Right Now?
2021-01-05,Atlas Air Worldwide Sees Relative Strength Rating Rise To 82
2020-12-29,"Zacks Industry Outlook Highlights: UPS, FDX, KNX, AAWW and ARCB"
2020-12-28,4 Transportation Stocks Likely to Keep Flying High in 2021
2020-12-28,"The American Shipper Top 10: Containers Overboard, Stock Selloffs, And An Air Rebound"
2020-12-28,New Strong Buy Stocks for December 28th
2020-12-25,All You Need to Know About Atlas Air (AAWW) Rating Upgrade to Strong Buy
2020-12-23,Atlas Air Partners with Fuel Supplier on Sustainable Aviation Fuel Test Flight from Spains Zaragoza Airport
2020-12-22,Top Ranked Value Stocks to Buy for December 22nd
2020-12-14,Should Value Investors Buy Atlas Air Worldwide (AAWW) Stock?
2020-11-17,Air Transport Services Stock Flies Past Relative Strength Benchmark But Not Beyond Buy Range
2020-11-13,These 5 Small Stocks Could Benefit From an Economic Rebound
2020-11-13,Atlas Air Refuses To Repay US Bailout Funds
2020-11-12,Return On Capital Employed Overview: Atlas Air Worldwide Hldgs
2020-11-12,Airlines will play 'key role in the distribution' of COVID-19 vaccines: analyst
2020-11-08,"Estimating The Intrinsic Value Of Atlas Air Worldwide Holdings, Inc. (NASDAQ:AAWW)"
2020-11-08,"Atlas Air Worldwide Holdings, Inc. Just Beat Earnings Expectations: Here's What Analysts Think Will Happen Next"
2020-11-05,Atlas Air Worldwide Holdings Inc (AAWW) Q3 2020 Earnings Call Transcript
2020-11-05,"Atlas Air Worldwide and Titan Aviation Holdings Announce Financing Facilities with CDPQ, BNP Paribas, and volofin"
2020-11-05,Atlas Air Worldwide Reports Third-Quarter 2020 Results
2020-11-03,Atlas Air (AAWW) to Report Q3 Earnings: What's in Store?
2020-10-29,Atlas Air Worldwide (AAWW) Earnings Expected to Grow: Should You Buy?
2020-10-29,"Zacks Industry Outlook Highlights: United Parcel Service, FedEx, Air Transport Services Group and Atlas Air Worldwide"
2020-10-28,Is Atlas Air Worldwide Holdings (AAWW) Outperforming Other Transportation Stocks This Year?
2020-10-28,4 Top Stocks From the Thriving Air Freight & Cargo Space
2020-10-27,Atlas Air Worldwide (AAWW) Stock Moves -0.29%: What You Should Know
2020-10-27,5 Top Momentum Picks Screened on Driehaus Strategy
2020-10-21,Atlas Air Worldwide (AAWW) Dips More Than Broader Markets: What You Should Know
2020-10-15,"Atlas Air Worldwide to Report Third-Quarter 2020 Results On Thursday, November 5"
2020-10-13,Alibaba Taps Atlas Air For Parcel Airlift To South America
2020-10-12,Cainiao Partners with Atlas Air To Launch Asia to South America Charter Program
2020-10-07,Should Value Investors Buy Atlas Air Worldwide (AAWW) Stock?
2020-09-28,"Hedge Funds Never Been This Bullish On Atlas Air Worldwide Holdings, Inc. (AAWW)"
2020-09-24,"How Much Are Atlas Air Worldwide Holdings, Inc. (NASDAQ:AAWW) Insiders Spending On Buying Shares?"
2020-09-23,Is Atlas Air Worldwide Holdings (AAWW) Stock Outpacing Its Transportation Peers This Year?
2020-09-21,Top Ranked Value Stocks to Buy for September 21st
2020-09-18,Atlas Air Worldwide (AAWW) Gains As Market Dips: What You Should Know
2020-09-17,"The Zacks Analyst Blog Highlights: Atlas Air Worldwide, BMC Stock, Central Garden & Pet Company, Comfort Systems USA and DICK'S Sporting Goods"
2020-09-15,Top Ranked Value Stocks to Buy for September 15th
2020-09-11,Top Ranked Value Stocks to Buy for September 11th
2020-09-09,Top Ranked Value Stocks to Buy for September 9th
2020-09-07,Is Atlas Air Worldwide Holdings (AAWW) Stock Outpacing Its Transportation Peers This Year?
2020-09-03,Top Ranked Value Stocks to Buy for September 3rd
2020-09-02,"The Zacks Analyst Blog Highlights: Stamps.com, Etsy, Daqo New Energy, Emergent BioSolutions and Atlas Air Worldwide"
2020-09-01,David Einhorns Hedge Funds Gain 0.5% in August With Markets Rallying
2020-09-01,Top Ranked Value Stocks to Buy for September 1st
2020-08-28,Top Ranked Value Stocks to Buy for August 28th
2020-08-27,Should Value Investors Pick Atlas Air Worldwide (AAWW) Stock?
2020-08-26,Is Atlas Air Worldwide (AAWW) a Great Value Stock Right Now?
2020-08-26,Top Ranked Value Stocks to Buy for August 26th
2020-08-21,Has Atlas Air Worldwide Holdings (AAWW) Outpaced Other Transportation Stocks This Year?
2020-08-21,Top Ranked Value Stocks to Buy for August 21st
2020-08-19,Top Ranked Value Stocks to Buy for August 19th
2020-08-19,Is Atlas Air (AAWW) Stock a Solid Choice Right Now?
2020-08-18,"Atlas Air's Shares March Higher, Can It Continue?"
2020-08-17,Top Ranked Value Stocks to Buy for August 17th
2020-08-15,Einhorn Tells Investors: Tesla Is Gaming S&P 500 Index Committee
2020-08-13,Top Ranked Value Stocks to Buy for August 13th
2020-08-12,Atlas Air Worldwide (AAWW) is a Great Momentum Stock: Should You Buy?
2020-08-12,New Strong Buy Stocks For August 12th
2020-08-12,Insider Sells Atlas Air Worldwide's Stock
2020-08-12,"Did Hedge Funds Make The Right Call On Atlas Air Worldwide Holdings, Inc. (AAWW) ?"
2020-08-11,Insider Sells Atlas Air Worldwide's Stock
2020-08-10,Is Atlas Air Worldwide (AAWW) Stock Undervalued Right Now?
2020-08-10,Atlas Air Worldwide (AAWW) in Focus: Stock Moves 5.2% Higher
2020-08-10,Investors Who Bought Atlas Air Worldwide Holdings (NASDAQ:AAWW) Shares A Year Ago Are Now Up 111%
2020-08-06,Atlas Air Worldwide (AAWW) Surpasses Q2 Earnings and Revenue Estimates
2020-08-06,Top Ranked Value Stocks to Buy for August 6th
2020-08-06,Atlas Air Capitalizes On Transport Shortages For Big Q2 Profit Gain
2020-08-06,Atlas Air Worldwide Reports Second-Quarter 2020 Results
2020-08-05,Why Atlas Air Worldwide (AAWW) Stock is a Compelling Investment Case
2020-08-05,Is Atlas Air Worldwide Holdings (AAWW) Stock Outpacing Its Transportation Peers This Year?
2020-08-04,Greenlight's Einhorn bets on rising inflation with new positions -letter
2020-08-04,Top Ranked Value Stocks to Buy for August 4th
2020-08-03,Top Ranked Value Stocks to Buy for August 3rd
2020-07-31,Atlas Air (AAWW) to Report Q2 Earnings: Is a Beat in Store?
2020-07-30,Atlas Air Worldwide (AAWW) Earnings Expected to Grow: What to Know Ahead of Next Week's Release
2020-07-23,Top Ranked Value Stocks to Buy for July 23rd
2020-07-21,Last Qantas 747 prepares to depart Sydney for Mojave retirement
2020-07-20,All You Need to Know About Atlas Air (AAWW) Rating Upgrade to Strong Buy
2020-07-17,Is Atlas Air Worldwide Holdings (AAWW) Outperforming Other Transportation Stocks This Year?
2020-07-17,"Pilots Blame Atlas Air, FAA For 2019 Freighter Crash"
2020-07-16,"Atlas Air Worldwide to Report&#160;Second-Quarter 2020 Results On Thursday, August 6"
2020-07-16,Is Atlas Air Worldwide (AAWW) Stock Undervalued Right Now?
2020-07-14,U.S. safety board cites cockpit crew failures in Atlas Air  fatal crash
2020-07-07,"Atlas Air's Shares March Higher, Can It Continue?"
2020-07-02,FedEx (FDX) Catches Eye: Stock Jumps 11.7%
2020-06-26,Has Atlas Air Worldwide Holdings (AAWW) Outpaced Other Transportation Stocks This Year?
2020-06-25,Top Ranked Value Stocks to Buy for June 25th
2020-06-24,"Hedge Funds Are Buying Atlas Air Worldwide Holdings, Inc. (AAWW)"
2020-06-24,"Yes, You Can Time the Market. Find out How - June 24, 2020"
2020-06-24,Top Ranked Value Stocks to Buy for June 24th
2020-06-19,"Zacks Value Trader Highlights: Atlas Air Worldwide, Oasis Midstream Partners, Tutor Perini, Donnelley Financial Solutions and B&G Foods"
2020-06-18,Top Ranked Value Stocks to Buy for June 18th
2020-06-12,Top Ranked Value Stocks to Buy for June 12th
2020-06-11,NTSB Schedules Public Meeting On Fatal Atlas Air Flight
2020-06-10,Has Atlas Air Worldwide Holdings (AAWW) Outpaced Other Transportation Stocks This Year?
2020-06-10,"The Zacks Analyst Blog Highlights: Brighthouse Financial, Cheniere Energy, Atlantic Power and Atlas Air Worldwide"
2020-06-10,"The Zacks Analyst Blog Highlights: Atlas Air Worldwide, Dollar General, Murphy USA, Sprouts Farmers Market and Great Lakes Dredge & Dock"
