2021-01-08,Returns On Capital At Tucows (NASDAQ:TCX) Paint An Interesting Picture
2020-12-15,Insider Sells Tucows Shares
2020-12-09,Is TCX A Good Stock To Buy Now?
2020-12-03,Do Insiders Own Lots Of Shares In Tucows Inc. (NASDAQ:TCX)?
2020-11-30,Insider Sells Tucows Stock
2020-11-30,Former Google Fiber VP Jill Szuchmacher joins Ting Internet as Chief Strategy Officer and EVP Networks
2020-11-17,"Ting to bring Crazy Fast Fiber Internet® to Culver City, CA"
2020-11-07,Tucows Inc (TCX) Q3 2020 Earnings Call Transcript
2020-11-05,Tucows Reports Financial Results for Third Quarter 2020
2020-11-03,Tucows Inc. (NASDAQ:TCX) Insiders Increased Their Holdings
2020-10-22,"Tucows Announces Timing for Q3 2020 Financial Results News Release and Management Commentary: Thursday, November 5, 2020, at 5:05 PM ET"
2020-10-07,If You Had Bought Tucows (NASDAQ:TCX) Shares Five Years Ago You'd Have Earned 197% Returns
2020-09-09,A Note On Tucows Inc.'s (NASDAQ:TCX) ROE and Debt To Equity
2020-08-06,Tucows Reports Financial Results for Second Quarter 2020
2020-08-03,"DISH selects Tucows as technology partner, acquires Ting Mobile assets"
2020-07-27,"Tucows Announces Timing for Q2 2020 Financial Results News Release and Management Commentary: Thursday, August 6, 2020, at 5:05 P.M. ET"
2020-07-07,Were Hedge Funds Right About Tucows Inc. (TCX)?
2020-05-27,Does Tucows Inc.'s (NASDAQ:TCX) Past Performance Indicate A Weaker Future?
2020-05-26,"Tucows welcomes Corinne Schmid VP Marketing, Domains"
2020-05-11,Tucows to ramp up hiring amidst a global downturn
2020-05-08,Tucows Inc (TCX) Q1 2020 Earnings Call Transcript
2020-05-07,Tucows Reports Financial Results for First Quarter 2020
2020-05-04,Does Tucows Inc.'s (NASDAQ:TCX) CEO Pay Reflect Performance?
2020-04-30,Tucows (TCX) Reports Next Week: Wall Street Expects Earnings Growth
2020-04-27,"Tucows Announces Timing for Q1 2020 Financial Results News Release and Management Commentary: Thursday, May 7, 2020 at 5:05 P.M. ET"
2020-04-22,Comtech Receives Contract for Advanced Control Components
2020-04-21,Comtech Secures Re-Certification of Data Security Standard
2020-04-15,"Ting welcomes Monica Brown, former T-Mobile, AT&T, Sirius XM Pandora exec, to lead Ting Mobile product"
2020-04-14,Comtech Wins US Army Deal to Boost Satellite Communications
2020-04-14,"Ting Internet welcomes Neil Shah, former Venmo and Verizon exec, to lead Ting Internet and TV product"
2020-04-09,Is Tucows Inc. (NASDAQ:TCX) Investing Effectively In Its Business?
2020-03-08,3 Stocks Growing Capex Fast
2020-02-17,Tucows Inc. Yearly Results Just Came Out: Here's What Analysts Are Forecasting For Next Year
2020-02-12,Tucows Reports Financial Results for Fourth Quarter 2019
2020-02-12,Tucows Announces $40 Million Stock Buyback Program
2020-02-11,Investors Who Bought Tucows (NASDAQ:TCX) Shares Five Years Ago Are Now Up 226%
2020-01-31,"Tucows Announces Timing for Q4 2019 Financial Results News Release and Management Commentary: Wednesday, February 12, 2020 at 5:05 P.M. ET"
2020-01-16,How Does Investing In Tucows Inc. (NASDAQ:TCX) Impact The Volatility Of Your Portfolio?
2019-12-23,Here is What Hedge Funds Think About Tucows Inc. (TCX)
2019-12-13,Should You Investigate Tucows Inc. (NASDAQ:TCX) At US$60.37?
2019-11-14,How Much is Tucows Inc.'s (NASDAQ:TCX) CEO Getting Paid?
2019-11-06,Tucows (TCX) Surpasses Q3 Earnings and Revenue Estimates
2019-11-06,Tucows Reports Financial Results for Third Quarter 2019
2019-11-05,"Ting bringing crazy fast fiber Internet to Solana Beach, CA"
2019-11-01,Tucows Ting Fiber to Expand Colorado Presence With Acquisition of Cedar Holdings Group
2019-10-30,Heres What Hedge Funds Think About Tucows Inc. (TCX)
2019-10-30,Analysts Estimate Tucows (TCX) to Report a Decline in Earnings: What to Look Out for
2019-10-25,How Much Of Tucows Inc. (NASDAQ:TCX) Do Insiders Own?
2019-10-24,"Tucows Announces Timing for Q3 2019 Financial Results News Release and Management Commentary: Wednesday, November 6, 2019 at 5:05 P.M. ET"
2019-09-16,Edited Transcript of TC.TO earnings conference call or presentation 7-Aug-19 10:59am GMT
2019-08-26,3 High-Growth Stocks That Could Soar
2019-08-09,Tucows Inc (TCX) Q2 2019 Earnings Call Transcript
2019-08-07,Tucows Reports Financial Results for Second Quarter 2019
2019-08-07,PRESS DIGEST- Canada- Aug 7
2019-07-24,"Tucows Announces Timing for Q2 2019 Financial Results News Release and Management Commentary: Wednesday, August 7, 2019 at 5:05 P.M. ET"
2019-07-22,3 Small-Cap Stocks With Big-Cap Potential
2019-07-18,Moving Average Crossover Alert: Tucows
2019-07-12,A Closer Look At Tucows Inc.'s (NASDAQ:TCX) Impressive ROE
2019-07-09,Ting Mobile Announces New Network Service Provider Agreement and Provides Updated Financial Guidance
2019-07-08,EU Privacy Laws May Be Hampering Pursuit of Terrorists
2019-07-04,Heres What Hedge Funds Think About Tucows Inc. (TCX)
2019-06-28,3 Top Small-Cap Stocks to Buy Right Now
2019-06-24,"At US$60.29, Is Tucows Inc. (NASDAQ:TCX) Worth Looking At Closely?"
2019-06-24,How Does Investing In Tucows Inc. (NASDAQ:TCX) Impact The Volatility Of Your Portfolio?
2019-06-22,University of Notre Dame Bought Millions of Dollars of a Beaten-Down Internet Stock
2019-06-06,"If You Had Bought Tucows (NASDAQ:TCX) Stock Five Years Ago, You Could Pocket A 323% Gain Today"
2019-05-17,3 High-Growth Stocks That Are Just Getting Started
2019-05-14,Edited Transcript of TC.TO earnings conference call or presentation 8-May-19 10:59am GMT
2019-05-09,Tucows Inc (TCX) Q1 2019 Earnings Call Transcript
2019-05-08,Tucows: 1Q Earnings Snapshot
2019-05-08,Tucows Reports Financial Results for First Quarter 2019
2019-05-08,Did Hedge Funds Drop The Ball On Tucows Inc. (TCX) ?
2019-05-07,What Does Tucows Inc.'s (NASDAQ:TCX) P/E Ratio Tell You?
2019-05-07,5 Stocks With Low Price-Earnings Ratios
2019-04-29,Shutterfly (SFLY) Reports Narrower-Than-Expected Loss in Q1
2019-04-25,"Tucows Announces Timing for Q1 2019 Financial Results News Release and Investment Community Call: Wednesday, May 8, 2019 at 5:05 P.M. ET"
2019-04-16,3 Reasons Why Tucows (TCX) Is a Great Growth Stock
2019-04-08,6 Cheap Stocks With Low Price-Sales Ratios
2019-04-08,You Might Like Tucows Inc. (NASDAQ:TCX) But Do You Like Its Debt?
2019-04-08,"Ting to offer gigabit fiber Internet in Fullerton, CA"
2019-03-19,Tucows Inc. Acquires Wholesale Domain Registrar Ascio Technologies
2019-03-06,What Kind Of Shareholder Appears On The Tucows Inc.s (NASDAQ:TCX) Shareholder Register?
2019-02-28,3 Things Tucows' Management Wants You to Know
2019-02-25,Tucows Could Have a Lot of Pop Left Before Its Current Run Ends
2019-02-13,Edited Transcript of TC.TO earnings conference call or presentation 13-Feb-19 10:59am GMT
2019-02-13,Tucows Inc (TCX) Q4 2018 Earnings Conference Call Transcript
2019-02-13,Tucows: 4Q Earnings Snapshot
2019-02-13,Tucows Reports Continuing Strong Financial Results for Fourth Quarter and Full Year 2018
2019-02-13,Tucows Announces $40 Million Stock Buyback Program
2019-02-11,Who Has Been Selling Tucows Inc. (NASDAQ:TCX) Shares?
2019-02-05,Why officials say Wake Forest's new fiber internet rollout will be different this time
2019-02-05,"Ting Internet to bring gigabit fiber Internet to Wake Forest, NC"
2019-01-30,"Tucows Announces Timing for Q4 2018 Financial Results News Release and Investment Community Call: Wednesday, February 13, 2019 at 5:05 P.M. ET"
2019-01-16,Is Tucows Inc.s (NASDAQ:TCX) CEO Paid At A Competitive Rate?
2018-12-24,Can Tucows Inc. (NASDAQ:TCX) Maintain Its Strong Returns?
2018-11-19,"Factors of Influence in 2018, Key Indicators and Opportunity within U.S. Energy, Investors Title, ARC Group Worldwide, Turtle Beach, Tucows, and Nature's Sunshine Products  New Research Emphasizes Economic Growth"
2018-11-14,Edited Transcript of TC.TO earnings conference call or presentation 7-Nov-18 10:59am GMT
2018-11-12,Tucows CEO gives Fuquay-Varina fiber internet launch update
2018-11-08,Tucows: 3Q Earnings Snapshot
2018-11-07,Tucows Reports Continuing Strong Financial Results for Third Quarter 2018
