2020-12-07,Fuel Tech Regains Compliance with NASDAQ Minimum Bid Price Requirement
2020-11-28,6 Top Stocks Under $10 This Past Week: DPW Holdings Rises
2020-11-27,Should I Buy Fuel Tech Inc. (FTEK)?
2020-11-23,Are You Looking For ESG Stocks To Buy Right Now? Here's How 6 Small-Cap Stocks Have Performed In 2020 So Far
2020-11-10,Fuel Tech Reports 2020 Third Quarter Financial Results
2020-11-02,Fuel Tech Schedules Third Quarter 2020 Financial Results and Conference Call
2020-09-24,Bradley W. Johnson Appointed General Counsel of Fuel Tech
2020-09-22,Fuel Tech Announces Listing Transfer to NASDAQ Capital Market® and 180 Day Extension to Regain Compliance With Minimum Bid Requirement
2020-09-17,Fuel Tech Receives $2.6 Million Insurance Reimbursement
2020-09-11,Fuel Tech to Present at the 22nd Annual H.C. Wainwright Global Investment Conference
2020-08-18,How Is Fuel Tech's (NASDAQ:FTEK) CEO Paid Relative To Peers?
2020-08-11,Fuel Tech Reports 2020 Second Quarter Financial Results
2020-07-06,Fuel Tech Awarded Multiple Equipment Orders Totaling $2.2 Million
2020-06-05,Edited Transcript of FTEK earnings conference call or presentation 13-May-20 2:00pm GMT
2020-05-15,"Fuel Tech, Inc. (NASDAQ:FTEK) Just Released Its First-Quarter Earnings: Here's What Analysts Think"
2020-05-12,Fuel Tech Reports 2020 First Quarter Financial Results
2020-05-11,"Company News for May 11, 2020"
2020-05-07,Fuel Tech Announces FUEL CHEM® Demonstration Orders From Two New Industrial Power Customers
2020-05-05,"Fuel Tech Adjourns Annual Meeting of Stockholders to June 16, 2020"
2020-04-30,Fuel Tech Schedules First Quarter 2020 Financial Results and Conference Call
2020-04-29,Did You Manage To Avoid Fuel Tech's (NASDAQ:FTEK) Devastating 79% Share Price Drop?
2020-03-30,Edited Transcript of FTEK earnings conference call or presentation 12-Mar-20 2:00pm GMT
2020-03-15,"Fuel Tech, Inc. Consensus Forecasts Have Become A Little Darker Since Its Latest Report"
2020-03-12,"Fuel Tech, Inc. to Host Earnings Call"
2020-03-11,Fuel Tech Reports 2019 Fourth Quarter and Full Year Financial Results
2020-03-04,"Should You Worry About Fuel Tech, Inc.'s (NASDAQ:FTEK) CEO Salary Level?"
2020-03-03,Fuel Tech Schedules 2019 Fourth Quarter and Full Year Financial Results and Conference Call
2020-01-07,Edited Transcript of FTEK earnings conference call or presentation 14-Nov-19 3:00pm GMT
2020-01-04,"Should You Be Concerned About Fuel Tech, Inc.'s (NASDAQ:FTEK) Historical Volatility?"
2019-12-09,Fuel Tech Awarded Air Pollution Control Orders Totaling $2.6 Million
2019-11-13,Fuel Tech Reports 2019 Third Quarter Financial Results
2019-11-05,Bright Near-Term Outlook for Pollution Control Industry
2019-11-04,Fuel Tech Awarded Air Pollution Control Orders Totaling $2.1 Million
2019-10-28,Fuel Tech Schedules 2019 Third Quarter Financial Results and Conference Call
2019-09-30,Penny Stocks to Watch for October 2019
2019-09-30,"Introducing Fuel Tech (NASDAQ:FTEK), The Stock That Tanked 77%"
2019-09-19,Edited Transcript of FTEK earnings conference call or presentation 14-Aug-19 2:00pm GMT
2019-08-30,"Why Fuel Tech, Inc.'s (NASDAQ:FTEK) CEO Pay Matters To You"
2019-08-13,Fuel Tech Reports 2019 Second Quarter Financial Results
2019-08-13,Fuel Tech's Earnings Preview
2019-07-31,"Does The Data Make Fuel Tech, Inc. (NASDAQ:FTEK) An Attractive Investment?"
2019-07-29,Fuel Tech Schedules 2019 Second Quarter Financial Results and Conference Call
2019-07-01,Fuel Tech Joins Russell Microcap® Index
2019-06-25,"Before You Buy Fuel Tech, Inc. (NASDAQ:FTEK), Consider Its Volatility"
2019-06-25,"Does The Fuel Tech, Inc. (NASDAQ:FTEK) Share Price Tend To Follow The Market?"
2019-06-21,Fuel Tech (FTEK) Gains As Market Dips: What You Should Know
2019-06-13,"Could The Fuel Tech, Inc. (NASDAQ:FTEK) Ownership Structure Tell Us Something Useful?"
2019-05-27,Edited Transcript of FTEK earnings conference call or presentation 14-May-19 2:00pm GMT
2019-05-21,Hydrogen Fuel Tech Just Got A Major Boost
2019-05-15,Are Investors Undervaluing Fuel Tech (FTEK) Right Now?
2019-05-13,Fuel Tech Reports 2019 First Quarter Financial Results
2019-05-08,Will APC Segment Aid Fuel Tech (FTEK) This Earnings Season?
2019-05-08,What's in the Cards for Fuel Tech (FTEK) in Q1 Earnings?
2019-05-07,"Buy Small-Cap ETFs, Stocks on Solid Data, Renewed Trade Fear"
2019-05-07,"Should Fuel Tech, Inc. (NASDAQ:FTEK) Focus On Improving This Fundamental Metric?"
2019-05-06,Fuel Tech (FTEK) Gains As Market Dips: What You Should Know
2019-05-03,"The Zacks Analyst Blog Highlights: Sunworks, Limbach, Fuel Tech, Herc and Stifel"
2019-05-03,Is Fuel Tech (FTEK) Outperforming Other Industrial Products Stocks This Year?
2019-05-02,Wall Street Sees Best Four-Month Start in Decades: 5 Winners
2019-04-30,Fuel Tech Schedules 2019 First Quarter Financial Results and Conference Call
2019-04-25,Fuel Tech (FTEK) Dips More Than Broader Markets: What You Should Know
2019-04-16,Adding Efficiency to Cannabis' Growth
2019-04-15,Top Ranked Momentum Stocks to Buy for April 15th
2019-04-12,Fuel Tech (FTEK) Flat As Market Gains: What You Should Know
2019-04-11,Here's Why it is Worth Buying Fuel Tech (FTEK) Stock Now
2019-04-10,Fuel Tech (NASDAQ:FTEK) Shareholders Booked A 100% Gain In The Last Year
2019-04-10,Are You Looking for a Top Momentum Pick? Why Fuel Tech (FTEK) is a Great Choice
2019-04-05,Is Fuel Tech (FTEK) Stock Outpacing Its Industrial Products Peers This Year?
2019-03-27,Top Ranked Momentum Stocks to Buy for March 27th
2019-03-26,Fuel Tech Awarded Air Pollution Control Orders Totaling $2.7 Million
2019-03-25,Edited Transcript of FTEK earnings conference call or presentation 15-Mar-19 2:00pm GMT
2019-03-25,Top Ranked Momentum Stocks to Buy for March 25th
2019-03-22,Top Ranked Momentum Stocks to Buy for March 22nd
2019-03-15,Fuel Tech to Present at the Sidoti & Company Spring 2019 Conference
2019-03-14,Fuel Tech Awarded Air Pollution Control Orders Totaling $3.0 Million
2019-03-14,Fuel Tech Reports 2018 Fourth Quarter and Full Year Financial Results
2019-03-11,Fuel Tech Schedules 2018 Fourth Quarter and Full Year Financial Results and Conference Call
2019-01-18,"What Did Fuel Tech, Inc.s (NASDAQ:FTEK) CEO Take Home Last Year?"
2019-01-18,Fuel Tech to Suspend Pollution Control Operation in China Subsidiary as Part of Ongoing Operational Improvement Initiatives
2018-12-19,Edited Transcript of FTEK earnings conference call or presentation 13-Nov-18 3:00pm GMT
2018-11-23,"Report: Developing Opportunities within ReWalk Robotics, ImmuCell, SCYNEXIS, Fuel Tech, Garrison Capital, and AMREP  Future Expectations, Projections Moving into 2018"
2018-11-12,Fuel Tech Reports 2018 Third Quarter Financial Results
2018-11-09,Fuel Tech Inc (NASDAQ:FTEK): What Does Its Beta Value Mean For Your Portfolio?
2018-10-15,Fuel Tech Schedules Third Quarter 2018 Financial Results and Conference Call
2018-09-18,How Financially Strong Is Fuel Tech Inc (NASDAQ:FTEK)?
2018-09-10,Fuel Tech Awarded Air Pollution Control Orders Totaling $15.8 Million
2018-08-30,Edited Transcript of FTEK earnings conference call or presentation 14-Aug-18 2:00pm GMT
2018-08-20,Fuel Tech to Present at 2018 Midwest IDEAS Investor Conference
2018-08-14,"Fuel Tech, Inc. to Host Earnings Call"
2018-08-13,Fuel Tech Reports 2018 Second Quarter Financial Results
2018-07-19,Fuel Tech Schedules Second Quarter 2018 Financial Results and Conference Call
2018-07-09,Fuel Tech Awarded Air Pollution Control Orders Totaling $2.2 Million
2018-05-25,Does Fuel Tech Inc (NASDAQ:FTEK) Go Up With The Market?
2018-05-21,Fuel Tech to Present at 8th Annual LD Micro Invitational
2018-05-17,How Much is Fuel Tech Incs (NASDAQ:FTEK) CEO Getting Paid?
2018-05-13,Edited Transcript of FTEK earnings conference call or presentation 10-May-18 2:00pm GMT
2018-05-10,Who Are The Largest Shareholders In Fuel Tech Inc (NASDAQ:FTEK)?
2018-05-09,Fuel Tech Reports 2018 First Quarter Financial Results
2018-04-25,Fuel Tech Schedules First Quarter 2018 Financial Results and Conference Call
2018-03-20,Want To Invest In Fuel Tech Inc (NASDAQ:FTEK)? Heres How It Performed Lately
