2021-01-11,Bitcoin and Tesla Have Gotten the Fed's Attention
2021-01-11,Big donors are letting extremist Republicans off the hook
2021-01-11,GameStop Will Add Activist Investors to the Board. The Stock Shot Up.
2021-01-11,"Marriott, Blue Cross, and Shopify are among the companies cutting off Trump and GOP"
2021-01-11,Cathie Woods Ark Joins Top 10 ETFs With Tesla-Heavy Fund
2021-01-11,"JPMorgan, Wells Fargo, Citigroup and Delta Air Lines are part of Zacks Earnings Preview"
2021-01-11,GameStop's stock shoots up after reaching agreement with activist investor
2021-01-11,GameStop Reports 2020 Holiday Sales Results
2021-01-11,GameStop Announces Additional Board Refreshment to Accelerate Transformation
2021-01-11,Who Needs Tesla Analysts When There's Reddit?
2021-01-11,Is JPMorgan Chase Still a Warren Buffett Stock?
2021-01-10,Futures Mostly Flat as Impeachment Momentum Builds
2021-01-10,"JPMorgan Chase, Wells Fargo, Delta, TSMC, and Other Stocks to Watch This Week"
2021-01-10,Earnings Season Is About to Begin. What to Expect.
2021-01-10,GameStop Stock Cant Keep Defying the Reality in Videogames
2021-01-10,Earnings Reports for the Week of Jan. 11-15
2021-01-10,"Big banks kick off Q4 earnings season, retail sales: What to know in the week ahead"
2021-01-10,Top 5 Things to Watch in Markets in the Week Ahead
2021-01-09,The Week Ahead In Biotech (Jan 10-16): Expect Stocks To Move As J.P. Morgan Healthcare Conference Kicks Off
2021-01-09,15 Best Dividend Stocks with Upside Potential
2021-01-09,"Dow Jones Futures: Extended Stock Market Rally, Tesla Climax Run Are Volatile Mix; Nio Stock A Buy With New ET7 Sedan"
2021-01-08,Top 10 S&P 500 Stocks by Index Weight
2021-01-08,The Online Broker Race to Zero Fees
2021-01-08,Berkshire Hathaway Director Ronald Olson Bought Up Stock
2021-01-08,Platinum Equity Lines Up $3 Billion Debt for Ingram Micro Deal
2021-01-08,Dow Sets New Record Again on Hopes for Biden Bounce
2021-01-08,JPMorgan Chase (JPM) Testing 2020's All-Time High
2021-01-08,Dow Eases From Lows as Biden Restores Stimulus Hopes
2021-01-08,"Dow Jones Today, Stocks Jump Despite Payrolls Miss; Bitcoin Tops $41,000, Micron Earnings Beat"
2021-01-08,"Dow Jones Today, Futures Up, Payrolls Data Pending; Bitcoin Tops $41,0000, Micron Earnings Beat"
2021-01-08,"Bank Stock Roundup: USB, JPM, WFC & TFC in Focus on Restructuring Initiatives"
2021-01-08,Unity will come when people feel it in their pockets: Fmr Time Warner CEO
2021-01-07,JPMorgan Chase Gets Two Upgrades Before Earnings Next Week
2021-01-07,"Bitcoins Volatility Resumes After $40,000 Topped for First Time"
2021-01-07,Influencers with Andy Serwer: Dick Parsons
2021-01-07,Nasdaq Closes Above 13K for First Time Ever on Bets for Stronger Recovery
2021-01-07,Business Needs to Hit Election Deniers in the Wallet
2021-01-07,Fmr Citigroup Chairman: Shameful we have a President exhorting the mob
2021-01-06,Business leaders call for action on Trump after mob siege at Capitol
2021-01-06,Federally Chartered Banks Can Use Stablecoins: OCC
2021-01-06,Delivery Hero Raising Up to $1.6 Billion in War Chest for Deals
2021-01-06,Bank Stocks Are a Winner in the Georgia Vote
2021-01-06,"Dow Hits Record High, Shrugging Off Siege on Capitol as Democrats Take Senate"
2021-01-06,"Oatly, Backed by Oprah Winfrey, Is Expected to Launch an IPO"
2021-01-06,Billionaire Andreas Halvorsens Top 10 Stock Picks
2021-01-06,Dow Eases From Record High as Anarchy Breaks Out in D.C.
2021-01-06,JPMorgan fund tops 2020 global macro rankings-SharingAlpha
2021-01-05,Goldman Sachs Stock Nears a Record High. Why It Has More Room to Run.
2021-01-05,"Haven Is Shutting Down, 3 Years After It Terrified Health-Care Investors"
2021-01-05,Centene CEO on $2.2 billion Magellan acquisition
2021-01-05,"It's no surprise that Amazon, Berkshire, JPM health venture Haven is disbanding: Experts"
2021-01-05,JPMorgan (JPM) Acquires Global Loyalty Division of cxLoyalty
2021-01-05,JPMorgan (JPM) Seeks to Set Up Wealth Management JV in China
2021-01-05,"Dow Jones Today, Stocks Climb Amid U.K. Lockdown, Georgia Senate Race; China Stocks Rally On Delisting Reversal"
2021-01-05,"Amid Economic Uncertainty, Businesses Embrace Change, Strengthen Resolve, JPMorgan Chase Survey Finds"
2021-01-05,JPMorgan In Talks For Another Wealth Management Joint Venture In China: Report
2021-01-05,"Georgia Runoffs, Yuan High, OPEC+ Deadlock - What's up in Markets"
2021-01-04,JPMorgan in Talks With China Bank on Wealth Venture
2021-01-04,JPMorgan Chase to Host Fourth-Quarter and Full-Year 2020 Earnings Call
2021-01-04,"Buffett, Bezos and Dimon Part Ways on Health Care Joint Venture"
2021-01-04,Markets Expect GOP to Hold Senate in Georgia Runoff. Heres What Happens if They Dont.
2021-01-04,Bezos-Buffett-Dimon Dream Team Couldnt Fix Health Care
2021-01-04,AmazonBerkshireJ.P. Morgan joint health-care venture Haven is being disbanded
2021-01-04,"JPMorgan, Berkshire, Amazon To Wind Down Joint Health Care Venture"
2021-01-04,Amazon-Berkshire-JPMorgan Health Venture to Shut Next Month
2021-01-04,Joint Amazon-Berkshire-JPMorgan Health Care Venture Disbands
2021-01-04,Billionaire Daniel Sundheims Top 10 Stock Picks
2021-01-04,ETFs Big Three Struggle to Make Mark in 2020s Largest Launches
2021-01-04,4 Financial Stocks That Could Gain Big This Year
2021-01-04,Foxconn Seals Manufacturing Deal With Chinese EV Startup Byton
2021-01-03,"Asian Stocks Up, But Gains Capped By Prospect of a New Japanese State of Emergency"
2021-01-02,4 Things to Expect from JPMorgan Chase in 2021
2021-01-01,Barrons Best Income Investments for 2021
2020-12-31,cxLoyalty Group Holdings Inc. Completes Sale of its Global Loyalty Division to JPMorgan Chase
2020-12-31,Apple Gains After JPMorgan Sees Signs of Robust iPhone Demand
2020-12-31,5 Reasons to Pick JPMorgan (JPM) Over Bank of America (BAC)
2020-12-31,"The Fed Is Powerful, Except in Fighting Wealth Inequality"
2020-12-31,The Best Stock Picker of 2020 Wins With Disruptive DNA
2020-12-31,Goldman Sachs Is One of Barrons Top Stock Picks for the New Year. Heres Why.
2020-12-30,"JPMorgan, Playa Hotels & Resorts, SolarEdge, Canadian Solar and Clearway Energy highlighted as Zacks Bull and Bear of the Day"
2020-12-30,Bull of the Day: JPMorgan Chase (JPM)
2020-12-29,Dow Jones Falls 100 Points As McConnell Says No To Schumer; 8 Blue-Chip Stocks Near Buy Points
2020-12-29,JPMorgan (JPM) to Acquire Global Loyalty Business of cxLoyalty
2020-12-29,Qualtrics Files for U.S. IPO Two Years After Sale to SAP
2020-12-28,JPMorgan Chase Acquiring Customer Loyalty Division of cxLoyalty Group
2020-12-28,"Dow Jones Futures: Stock Market Rally Hits Highs On Apple, Amazon, These Giants, But Growth Has Bad Day"
2020-12-28,Heres How Billionaire Lee Cooperman Is Preparing For Massive Inflation
2020-12-28,cxLoyalty Group Holdings Inc. Announces Sale of its Global Loyalty Division to JPMorgan Chase
2020-12-28,JPMorgan Chase Acquiring a Leading Travel and Loyalty Business
2020-12-28,Dow Notches Record High as $900B Stimulus Package Stokes Recovery Hopes
2020-12-27,"Investors Rethink Role of Bonds, Tech and ESG After Chaotic Year"
2020-12-27,3 Dividend Stocks That Pay You More Than Pepsi Does
2020-12-25,"Brexit Trade Deal Sets Up EU, U.K. to Avoid Chaotic Rupture"
2020-12-24,"Make Room for Teslaand Less Room for Energy, Financials, and Materials"
2020-12-24,Large GameStop Investor Ryan Cohen Buys More Stock
2020-12-24,"Zacks Industry Outlook Highlights: JPMorgan, Bank of America and Citigroup"
2020-12-24,5 Bank Stocks Set to Rebound With Vaccine-Driven Economic Recovery
2020-12-23,SHAREHOLDER ALERT: Pomerantz Law Firm Reminds Shareholders with Losses on their Investment in JPMorgan Chase & Co. of Class Action Lawsuit and Upcoming Deadline  JPM
2020-12-23,"JPM Final Deadline: Bronstein, Gewirtz & Grossman, LLC Reminds JPMorgan Chase & Co. Shareholders of Class Action and Lead Plaintiff Deadline: December 23, 2020"
2020-12-23,Dow Rises As Trump Demands Higher Stimulus Checks; Jobs Data Beats Views; Tesla Rises
