2021-01-07,"MadeiraMadeira, Brazil's answer to Wayfair and Ikea, is now worth over $1 billion"
2021-01-07,Wayfair raises U.S. employee pay to $15 per hour
2021-01-07,Wayfair to Pay All U.S. Employees a Minimum of $15 Per Hour
2021-01-05,3 Reasons Wayfair Will Keep Growing in 2021
2021-01-04,Shoppers Spend Widely to Aid Holiday Retail Sales & E-Commerce
2020-12-31,Pinduoduo (PDD) Jumps: Stock Rises 7.8%
2020-12-29,The economic chart of the year: Morning Brief
2020-12-28,Shopify vs Wayfair: Which E-Commerce Stock Could Continue to Rise in 2021?
2020-12-26,15 Best E-Commerce Stocks to Buy Now
2020-12-23,The Technology Sector's 2020 and What It Means for 2021
2020-12-23,These Were the 5 Best Stay-At-Home Stocks of 2020
2020-12-23,Wayfair Donates Over $12 Million in 2020 to Social Impact Initiatives Globally
2020-12-22,"The Zacks Analyst Blog Highlights: TTD, Zscaler, CrowdStrike, Pinterest and Wayfair"
2020-12-21,E-Commerce Company Parts iD is Racing Ahead as a Chewy for Gearheads
2020-12-17,4 E-Commerce Stocks to Bet On With Above 100% YTD Gains in 2020
2020-12-17,"Where to Invest $5,000 Right Now"
2020-12-15,Where Do Hedge Funds Stand On Wayfair Inc (W)?
2020-12-14,"The Zacks Analyst Blog Highlights: Wayfair, Qorvo, Williams-Sonoma, Deere & Co and Hologic"
2020-12-11,5 Breakthrough Stocks Doubling S&P 500 Gains in 2020
2020-12-11,7 Retail Stocks Getting Coal This Year
2020-12-10,4 E-commerce Stocks Set to Gain From Rising Coronavirus Cases
2020-12-04,A Plunge and a Recovery Drives a Top-Performing Year in Convertibles
2020-12-04,Wayfair May Be in for A Merry Holiday Season
2020-12-04,"The Zacks Analyst Blog Highlights: ArcBest Corp, Entravision Communications Corp, Tesla, Wayfair and Party City Holdco"
2020-12-04,"The Zacks Analyst Blog Highlights: PulteGroup, The Boston Beer Co, Lennar Corp, Wayfair and Dynatrace"
2020-12-04,Wayfair Stock Is a Great Buy Amid Recent Covid-19 Vaccine Weakness
2020-12-03,Wayfair (W) Down 10.2% Since Last Earnings Report: Can It Rebound?
2020-12-03,6 Top-Ranked Internet Stocks to Snap Up Heading Into 2021
2020-12-01,"The Zacks Analyst Blog Highlights: Mattel, Sony, Apple, Wayfair and Home Depot"
2020-12-01,"The Zacks Analyst Blog Highlights: The Trade Desk, Wayfair, Shopify, Boston Beer Co. and NVIDIA"
2020-12-01,1 Warning Sign for E-commerce Stocks
2020-11-30,Ruane Cunniff's Top 5 Trades of the 3rd Quarter
2020-11-30,Buy 5 Stocks With 125% Plus YTD Returns and More Upside Left
2020-11-30,3 Pandemic Rallying Stocks I'd Buy Right Now
2020-11-27,These 2 Retailers Are Black Friday's Stock Market Winners
2020-11-27,Calculating The Fair Value Of Wayfair Inc. (NYSE:W)
2020-11-25,"The Zacks Analyst Blog Highlights: Wayfair, Target, Crocs and Overstock.com"
2020-11-24,Better Buy: Shopify vs. Wayfair
2020-11-23,3 Monster Growth Stocks That Still Have Room to Run
2020-11-23,Vaccines Are Coming Soon. Is It Time to Sell Stay-at-Home Stocks?
2020-11-20,Williams-Sonoma Stock Is Soaring After Earnings. Everyone Is Still Spending Money on Their Homes.
2020-11-17,Trump Lashes Voting Tech Firm With Barrage of Debunked Claims
2020-11-16,"The Zacks Analyst Blog Highlights: AbbVie, Square, Honda Motor, Canadian Pacific Railway and Wayfair"
2020-11-16,"Zoom, DocuSign, Teladoc, Wayfair, and Peloton Will Also Win in 2021"
2020-11-16,The Most Important Metric Behind Wayfair's 10-Bagger Returns Since March
2020-11-16,15 Largest Ecommerce Companies in the World
2020-11-13,Wayfair Names Michael E. Sneed to its Board of Directors
2020-11-13,Home Depot Earnings: What to Watch
2020-11-12,"Forget Wayfair, Stitch Fix Is a Better E-Commerce Stock"
2020-11-11,Why Wayfair Stock Is Up
2020-11-11,Wayfair Makes the Case for a Persistent Sales Lift and Rising Profitability Into 2021
2020-11-10,Why Wayfair Is Attractive At Current Levels
2020-11-10,Wayfair Stocks Rally Doesnt Have to End When the Pandemic Does
2020-11-10,ROCE Insights For Wayfair
2020-11-10,"Wayfair Honors Military Veterans, Commits to Creating Accessible Homes and Career Opportunities for the Military Community"
2020-11-09,The Benefits and Risks of Wayfair's Hypergrowth Strategy
2020-11-09,"5 at 5: Your Daily Digest for Real Estate Investing, 11/9/2020"
2020-11-09,"Why Shares of Chewy, Wayfair, and Etsy Are Tumbling Today"
2020-11-09,Wayfair Earnings Skyrocket: Impacts on House Flipping and Staging
2020-11-09,Wayfair stock slumps after COVID-19 vaccine trial announcement
2020-11-06,KKR Stock Looks Like a Bargain
2020-11-06,Amazon a friend to department store giant Kohls: Michelle Gass
2020-11-06,Chewy or Wayfair: Which Online Retailer Is A Better Buy?
2020-11-05,Here's Why Wayfair Stock Is Soaring Today
2020-11-05,Wayfair Is Set Up for a Big Holiday Season
2020-11-05,Here's What Analysts Think of Wayfair After Earnings
2020-11-05,"Wayfair Is a Screaming Buy With 33% Upside, According to an Analyst"
2020-11-05,Coronavirus dramatically accelerated e-commerce by 5+ years: Kohl's CEO
2020-11-04,3 E-Commerce Stocks Trying To Retain Pandemic Customers
2020-11-04,Wayfair is confident that sales momentum will outlast the pandemic but some analysts arent so sure
2020-11-04,"Company News for Nov 4, 2020"
2020-11-04,Wayfair Surges Post Earnings: ETFs to Play
2020-11-04,Here's the Bullish Wayfair Argument Investors Shouldn't Ignore
2020-11-04,Wayfair (W) Surpasses Q3 Earnings and Revenue Estimates
2020-11-04,"Wayfair Soars 7%, 3Q Earnings Crush Estimates On Online Demand"
2020-11-03,Here's Why Wayfair Stock Dropped Nearly 15% in October
2020-11-03,Wayfair Earnings Crush Views; Stock Jumps
2020-11-03,"Wayfair, Home Furnishings Sector Looks Past COVID Winter"
2020-11-03,COVID-19 economy: America's furniture-buying binge rages on
2020-11-03,PreMarket Prep Stock Of The Day: Wayfair
2020-11-03,Why Wayfair Stock Jumped Today
2020-11-03,Wayfair Inc (W) Q3 2020 Earnings Call Transcript
2020-11-03,Wayfair Gains Amid Pandemic-Driven Third-Quarter Earnings Boost
2020-11-03,Wayfair Almost Doubles Net Revenue to Nearly $4 Billion
2020-11-03,"After Q3 Beat, Wayfair CEO Says E-Commerce Site Poised For Growth Beyond Pandemic"
2020-11-03,"Earnings Roundup: Wayfair, Paypal beat estimates"
2020-11-03,Wayfair Beats Estimates on Covid Home-Improvement Trend
2020-11-03,Dow Jones Today Jumps 550 Points In Election Day Rally; Cirrus Paces Small Cap Rally
2020-11-03,Wayfair (W) Surpasses Q3 Earnings and Revenue Estimates
2020-11-03,Wayfair stock soars 13% after results swing to a profit
2020-11-03,Wayfair Announces Third Quarter 2020 Results
2020-11-02,Earnings Outlook For Wayfair
2020-11-02,Tony Zhang's Wayfair Options Trade
2020-11-02,Bed Bath & Beyond: A Home Makeover Show Worth Watching
2020-11-02,3 Things to Watch in the Stock Market This Week
2020-11-02,Wayfair (W) to Report Q3 Earnings: What's in the Cards? (Revised)
2020-11-01,Wayfair Earnings: What to Watch
2020-10-30,Understanding Wayfair's Unusual Options Activity
2020-10-30,Wayfair (W) to Report Q3 Earnings: What's in the Cards?
2020-10-29,Overstock Doubles Its Sales Thanks to Furniture Push
