2020-12-10,Top Steel Stocks for Q1 2021
2020-12-07,Is SID A Good Stock To Buy Now?
2020-12-04,"Why U.S. Steel, Alcoa, and Companhia Siderurgica Stocks Are Surging Today"
2020-11-13,Ken Heebner's Top 5 Trades in the 3rd Quarter
2020-11-10,Companhia Siderurgica Nacional (CSN) -- Moody's says CSN's B2 ratings and stable outlook unaffected by proposed 2028 notes add-on
2020-10-29,CSN Islands XII Corporation -- Moody's affirms CSN's B2 ratings; changes outlook to stable
2020-10-29,Companhia Siderurgica Nacional (CSN) -- Moody's affirms CSN's B2 ratings; changes outlook to stable
2020-10-16,Companhia Siderúrgica Nacional (SID) Q3 2020 Earnings Call Transcript
2020-09-30,Why Companhia Siderurgica Nacional Stock Just Popped 9%
2020-09-22,4 Steel Producer Stocks Set to Ride the Industry's Upturn
2020-09-11,Why Siderurgica Nacional (SID) Could Be Positioned for a Surge
2020-09-07,Moving Average Crossover Alert: Companhia Siderurgica Nacional
2020-08-25,REFILE-Brazil's steelmaker CSN hires banks for IPO of mining unit -report
2020-07-29,Companhia Siderúrgica Nacional (SID) Q2 2020 Earnings Call Transcript
2020-07-29,Brazil's CSN expects to meet iron ore sales forecast despite crisis
2020-06-29,Siderurgica Nacional (SID) Upgraded to Strong Buy: Here's Why
2020-06-10,Hedge Funds Losing Interest In Companhia Siderurgica Nacional (SID)
2020-06-03,CSN Islands XII Corporation -- Moody's affirms CSN's B2 ratings; changes outlook to negative
2020-06-03,Companhia Siderurgica Nacional (CSN) -- Moody's affirms CSN's B2 ratings; changes outlook to negative
2020-05-29,Brazil's CSN to paralyze blast furnace 2 in Rio - filing
2020-04-24,Are Investors Undervaluing Siderurgica Nacional (SID) Right Now?
2020-04-06,Is Companhia Siderurgica Nacional (SID) A Good Stock To Buy?
2020-04-03,Brazil steelmakers shut down blast furnaces as coronavirus hurts demand
2020-03-23,Brazil's XP founder calls for a Marshall Plan amid coronavirus - report
2020-03-10,Employee of Brazil steelmaker CSN diagnosed with coronavirus -source
2020-03-05,Brazil steelmaker CSN says it has yet to see impact from coronavirus
2020-01-23,CSN Islands XI Corporation -- Moody's assigns B2 rating to CSN's proposed notes; stable outlook
2020-01-22,6 Guru Stocks Trading Below Peter Lynch Value
2020-01-17,Companhia Siderurgica Nacional (CSN) -- Moody's assigns B2 rating to CSN's proposed notes; stable outlook
2020-01-17,CSN Resources S.A. Announces Tender Offer for Any and All of its 2020 Notes
2020-01-08,6 Stocks With Low Price-Earnings Ratios
2019-12-24,Here is What Hedge Funds Think About Companhia Siderurgica Nacional (SID)
2019-12-24,New Strong Sell Stocks for December 24th
2019-12-03,Hedge Funds Love Assured Guaranty (AGO) Way More Than These 4 Stocks
2019-12-02,"Brazil in touch with U.S. officials on surprise steel, aluminum tariffs -source"
2019-12-02,"Brazil steel industry body ""perplexed"" by Trump tariff move"
2019-12-02,"UPDATE 9-Trump, citing U.S. farmers, slaps metal tariffs on Brazil, Argentina"
2019-11-20,The NASDAQ Needs No Break
2019-11-05,Has National Steel (SID) Outpaced Other Basic Materials Stocks This Year?
2019-11-05,Is Siderurgica Nacional (SID) Stock Undervalued Right Now?
2019-11-04,Siderurgica Nacional (SID) Outpaces Stock Market Gains: What You Should Know
2019-10-25,Companhia Siderurgica (SID) Reports Wider-Than-Expected Q3 Loss
2019-10-23,"UPDATE 1-Brazil's CSN posts loss, cuts guidance for 2019"
2019-10-23,"Brazil's CSN posts loss, cuts guidance for 2019"
2019-10-23,Late Selloff Pulls Stocks Lower
2019-10-17,Is Siderurgica Nacional (SID) a Great Value Stock Right Now?
2019-10-15,Hedge Funds Have Never Been This Bullish On Companhia Siderurgica Nacional (SID)
2019-10-04,Is National Steel (SID) Stock Outpacing Its Basic Materials Peers This Year?
2019-10-01,New Strong Buy Stocks for October 1st
2019-10-01,Top Ranked Value Stocks to Buy for October 1st
2019-10-01,Is Siderurgica Nacional (SID) Stock Undervalued Right Now?
2019-09-30,NOVAGOLD (NG) to Post Q3 Earnings: What's in the Cards?
2019-09-23,New Strong Buy Stocks for September 23rd
2019-09-18,Top Ranked Value Stocks to Buy for September 18th
2019-09-16,Strategic Value Investing: Income and Taxes
2019-09-12,Should Value Investors Buy Siderurgica Nacional (SID) Stock?
2019-09-11,Why Companhia Siderurgica (SID) is Such a Great Value Stock Pick Right Now
2019-08-29,Top Ranked Income Stocks to Buy for August 29th
2019-08-28,Siderurgica Nacional (SID) Upgraded to Buy: What Does It Mean for the Stock?
2019-08-12,"Ken Heebner's Firm Exits Zebra Technologies, Phillips 66"
2019-08-07,Companhia Siderurgica Nacional (SID) Q2 2019 Earnings Call Transcript
2019-08-01,Edited Transcript of CSNA3.SA earnings conference call or presentation 31-Jul-19 2:00pm GMT
2019-07-10,3 Cheap Stocks Hitting New Highs
2019-06-27,Companhia Siderurgica Nacional (CSN) -- Moody's says CSN's B2 ratings and stable outlook unaffected by proposed 2023 notes add-on
2019-06-04,Is National Steel (SID) Stock Outpacing Its Basic Materials Peers This Year?
2019-05-28,Will National Steel to Surge Higher?
2019-05-25,Edited Transcript of CSNA3.SA earnings conference call or presentation 9-May-19 2:00pm GMT
2019-05-23,"Companhia Sider??rgica Nacional (SID) Shares March Higher, Can It Continue?"
2019-05-21,Is Siderurgica Nacional (SID) Stock Undervalued Right Now?
2019-05-18,Stocks Fall Short of Weekly Comeback
2019-05-15,Brazil's CSN says spillage at Volta Redonda steelworks slows output
2019-05-15,Brazil's CSN says spillage at Volta Redonda steelworks slows output
2019-05-13,"Companhia Siderurgica (SID) Q1 Earnings Dips Y/Y, Sales Beat"
2019-05-13,Top Ranked Value Stocks to Buy for May 13th
2019-05-09,"Brazil's CSN nears German unit sale, in talks for ore streaming"
2019-05-08,Brazil steelmaker CSN reports significant net income drop to $22 million in Q1
2019-05-06,Expiration of Tender Offers for up to U.S.$1 billion of 2019 Notes and 2020 Notes by CSN Resources S.A.
2019-04-29,CSN Islands XII Corporation -- Moody's upgrades CSN's ratings to B2; stable outlook
2019-04-26,Did Hedge Fund Drop The Ball On Companhia Siderurgica Nacional  (SID) ?
2019-04-26,Early Results of Cash Tender Offers of 2019 Notes and 2020 Notes by CSN Resources S.A.
2019-04-11,Amendment to Terms of Cash Tender Offers by CSN Resources S.A.
2019-04-11,"Brazil steelmaker CSN expects 2019 to be ""huge"" -CEO"
2019-04-05,Companhia Siderurgica Nacional (CSN) -- Moody's assigns B3 ratings to CSN's $750 million proposed notes; stable outlook
2019-04-05,Announcement of Tender Offers for up to U.S.$750 million of 2019 Notes and 2020 Notes by CSN Resources S.A.
2019-02-26,Edited Transcript of CSNA3.SA earnings conference call or presentation 21-Feb-19 3:00pm GMT
2019-02-21,EMERGING MARKETS-Brazil stocks little changed as earnings boost offset by energy; Latam FX dips
2019-02-13,Brazil companies complain to watchdog about Vale acquisition
2019-01-31,Glencore nears $500 million deal to buy iron ore from Brazil's CSN - sources
2019-01-15,National Steel to Gain From Rising Demand Amid Cost Concerns
2019-01-02,"Why Companhia Siderurgica Nacional, SABESP, and Electrobras Stocks All Popped More Than 11% Today"
2018-12-04,Edited Transcript of CSNA3.SA earnings conference call or presentation 8-Nov-18 2:00pm GMT
2018-12-01,6 Undervalued Stocks With Rising Prices
2018-11-28,"EMERGING MARKETS-Brazil's real gains for second day on central bank support, peso firms too"
2018-11-28,Emerging Markets to Outpace US in 2019: 4 Gainers
2018-11-08,Brazil steelmaker CSN plans 27.5 pct price hike for automakers
2018-11-08,Brazil steelmaker CSN plans 27.5 pct price hike for automakers
2018-09-20,Siderurgica Nacional: 2Q Earnings Snapshot
2018-09-19,6 Undervalued Stocks With a Margin of Safety
2018-09-12,5 Reasons to Add Steel Dynamics (STLD) to Your Portfolio
2018-08-31,Steel Dynamics (STLD) Stock Up 31% in a Year: Here's Why
