2021-01-11,3 Stocks to Buy for a Biden Bear Market
2021-01-08,7 Short-Term Stocks to Move Quickly On
2021-01-08,"Dollar Tree Has a New Strategy, but the Stocks Still Not a Buy"
2021-01-07,Could Dollar General Be a Millionaire Maker Stock?
2021-01-06,Better Buy: Costco vs. Dollar General
2021-01-01,Dollar General (DG) Upgraded to Buy: Here's Why
2021-01-01,DG vs. ROST: Which Stock Should Value Investors Buy Now?
2021-01-01,Can Dollar Stores Save Shopping Centers?
2020-12-31,Calculating The Intrinsic Value Of Dollar General Corporation (NYSE:DG)
2020-12-29,"Retails Boom-and-Bust 2020, in 10 Charts"
2020-12-25,2 Top Value Stocks to Buy Right Now
2020-12-23,Top 10 Retail Stocks to Buy Now
2020-12-23,Know Accounts Receivable and Inventory Turnover
2020-12-21,4 Discount Retailers Set to Maintain Winning Streak in 2021
2020-12-16,Retailer Wish Drops in Trading Debut After IPO Spree
2020-12-16,These major retailers are spending millions of dollars to show employees appreciation
2020-12-16,Why Your 2021 Resolution Should Be to Buy More Retail-Apocalypse-Proof Stocks
2020-12-15,Dollar General (DG) Poised to Tap Rising Demand Amid COVID-19
2020-12-14,Dollar General and the Dollar General Literacy Foundation Announce Initial Racial Justice and Education Grant Recipients
2020-12-08,"5 at 5: Your Daily Digest for Real Estate Investing, 12/8/2020"
2020-12-08,Are Dollar General's Expansion Plans Good News for Retail REITs?
2020-12-08,"Dollar General Saw Improvement, but the Stock Dropped. What's Going On?"
2020-12-07,Is Dollar General (DG) A Good Stock To Buy Now?
2020-12-05,Dollar General Corporation Just Beat EPS By 18%: Here's What Analysts Think Will Happen Next
2020-12-04,Dollar General: Strong Fundamentals and Price Momentum
2020-12-04,"Forget Dollar General, Dollar Tree Is a Better Value Stock"
2020-12-04,Morning Bell With Jim Cramer: Watch Goldman Sachs Stock
2020-12-03,Ollie's Bargain Outlet Warns On Holiday Comps After Dollar General Beats
2020-12-03,Dollar General Corporation (DG) Q3 2020 Earnings Call Transcript
2020-12-03,Dollar General Stock Surges After a Strong Earnings Report
2020-12-03,"Dollar General's (DG) Q3 Earnings Beat Estimates, Comps Rise"
2020-12-03,Dollar General Earnings Beat Expectations. Why the Stock Is Falling.
2020-12-03,"Dollar General Tops Q3 Earnings Forecast, Holds Back on 2021 Profit Guidance"
2020-12-03,Looking Into Dollar General's Return On Capital Employed
2020-12-03,Dollar General Beats Earnings Estimates; Net Sales Surge Over 17%
2020-12-03,"Dollar stores thrive in pandemic, but hold back forecasts"
2020-12-03,Dollar General Corp. to Host Earnings Call
2020-12-03,Dollar General (DG) Surpasses Q3 Earnings and Revenue Estimates
2020-12-03,Recap: Dollar General Q3 Earnings
2020-12-03,Dollar General Corporation Reports Third Quarter 2020 Results
2020-12-03,"Stimulus Plan Gains Traction, Jobless Claims, OPEC+ Meets - What's up in Markets"
2020-12-02,Five Below Earnings Soar As Same-Store Sales Crush Views; FIVE Stock Dips
2020-12-02,How Dollar General Can Break Out to New Highs on Earnings
2020-12-02,2 Strategies To Trade Thursday's Dollar General Earnings Report Using Options
2020-12-02,Earnings Preview: Dollar General
2020-12-01,Dollar General Reports Earnings This Week and It Could Be Good News
2020-11-30,"Zacks.com featured highlights include: Rush, Laboratory Corporation, AGCO and Dollar General"
2020-11-30,Here's How Dollar General (DG) Looks Just Ahead of Q3 Earnings
2020-11-29,"Zoom, Salesforce, Kroger, Snowflake, and Other Stocks for Investors to Watch This Week"
2020-11-28,Our Take On Dollar General's (NYSE:DG) CEO Salary
2020-11-27,"Earnings Reports for the Week of Nov. 30-Dec. 4 (CRM, DG, KR, ULTA)"
2020-11-26,Dollar General (DG) Earnings Expected to Grow: What to Know Ahead of Next Week's Release
2020-11-26,How XOUT Capital Picks Retailers for Its Large-Cap Index Fund
2020-11-25,Dollar General (DG) Upgraded to Buy: Here's What You Should Know
2020-11-24,3 Stocks to Build Your Portfolio Around
2020-11-23,Discount Retailer Big Lots Near Buy Zone With EPS Due
2020-11-20,Ross Stores (ROST) Surges as Q3 Earnings & Sales Top Estimates
2020-11-19,Dollar General Stock is a Retail Star and a Buy After Target's Earnings
2020-11-19,Dollar General Extends its Mission through Annual Holiday Support
2020-11-19,Dollar General (DG) to Pay $50M More as Appreciation Bonus
2020-11-18,"The Zacks Analyst Blog Highlights: Macy's, Dollar General, DICK'S Sporting Goods and Lowe's"
2020-11-17,Dollar General Announces Approximately $50 Million in Additional Employee Appreciation Bonuses
2020-11-17,Macy's (M) to Report Q3 Earnings: What's in the Offing?
2020-11-17,Better Buy: Amazon vs. Dollar General
2020-11-17,Factors to Know Ahead of Children's Place (PLCE) Q3 Earnings
2020-11-16,Wells Fargo Commercial Mortgage Trust 2016-C36 -- Moody's affirms seven classes of WFCM 2016-C36
2020-11-16,Dollar General (DG) Stock Sinks As Market Gains: What You Should Know
2020-11-14,"Dollar General Announces 17,000th Store Opening"
2020-11-13,Target Is Booming During the Pandemic. Why the Stock Still Looks Undervalued.
2020-11-13,"Capital Growth Management Exits KB Home, Dollar Tree"
2020-11-13,Can JD.com (JD) Q3 Earnings Gain From Solid New Businesses?
2020-11-13,"Zacks.com featured highlights include: BJ's Wholesale Club, Dollar General, Repligen Corp, Hologic and Parker-Hannifin"
2020-11-13,Holiday Savings at Dollar General Deliver Continued Focus on Customer Needs
2020-11-12,5 Top Stocks to Buy on Earnings Beat Potential
2020-11-12,Dollar General Corporation Announces Webcast of its Third Quarter 2020 Earnings Conference Call
2020-11-10,Dollar General (DG) Gains As Market Dips: What You Should Know
2020-11-10,Scoop Up These 5 Stocks With Exciting Interest Coverage Ratio
2020-11-10,Dollar General Announces New Distribution Center in Nebraska
2020-11-08,5 Stocks That Could Massively Grow Their Dividends in 2021 and Beyond
2020-11-06,"Zacks Industry Outlook Highlights: Costco, Target, Dollar General, Big Lots and Dollar Tree"
2020-11-05,4 Retail-Discount Stores Worth a Look Amid the COVID-19 Crisis
2020-11-04,IBD 50 Stocks To Watch: Dollar General Sets Up New Buy Point As Coronavirus Fuels Sales
2020-11-03,Can Dollar General (DG) Keep the Earnings Surprise Streak Alive?
2020-11-03,Top Ranked Momentum Stocks to Buy for November 3rd
2020-11-03,"Vericel Corp, Nikola Corp, Lowe's, Dollar General and Best Buy highlighted as Zacks Bull and Bear of the Day"
2020-11-03,Here's the Election Scenario Most Likely to Cause a Stock Market Crash
2020-11-02,Dollar General (DG) Gains But Lags Market: What You Should Know
2020-11-01,These 3 Stocks Would Be Huge Winners From a Higher Minimum Wage
2020-10-30,Watch: Georgia debate gets heated as Sen. David Perdue is labeled a crook by rival Jon Ossoff
2020-10-30,Spooked by COVID-19? Track 3 ETFs & Stocks for Halloween Treats
2020-10-27,Dollar General (DG) Gains As Market Dips: What You Should Know
2020-10-27,Dollar General Announces One-Day-Only Early Holiday Savings on November 13
2020-10-27,"Market Crash 2.0: Where to Invest $1,000"
2020-10-21,Dollar General (DG) Gains As Market Dips: What You Should Know
2020-10-21,Is Dollar General Stock a Buy?
2020-10-20,Check Out Albertsons: The Grocer Is Booming and Its Stock Is Cheap
2020-10-20,Were Hedge Funds Right About Crowding Dollar General Corp. (DG)?
2020-10-20,These 3 Under-the-Radar Stocks Are Great Buys Right Now
2020-10-15,Dollar General (DG) Gains As Market Dips: What You Should Know
2020-10-14,"US Companies Reinstate, Raise Dividends for First Time in Months"
