2021-01-11,"Five Point Holdings, LLC Announces Sales of Homesites at Valencia in Los Angeles County"
2020-12-14,Is FPH A Good Stock To Buy Now?
2020-11-13,"Five Point Holdings, LLC Just Beat Earnings Expectations: Here's What Analysts Think Will Happen Next"
2020-11-11,"Five Point Holdings, LLC Class A (FPH) Q3 2020 Earnings Call Transcript"
2020-11-10,Recap: Five Point Holdings Q3 Earnings
2020-11-10,"Five Point Holdings, LLC Reports Third Quarter 2020 Results"
2020-11-10,Five Point Holdings LLC to Host Earnings Call
2020-11-03,"Five Point Holdings, LLC Sets Date for Third Quarter 2020 Earnings Announcement and Investor Conference Call"
2020-11-02,Reflecting on Five Point Holdings' (NYSE:FPH) Share Price Returns Over The Last Three Years
2020-08-14,"Five Point Holdings, LLC Class A (FPH) Q2 2020 Earnings Call Transcript"
2020-08-13,"Five Point Holdings, LLC Reports Second Quarter 2020 Results"
2020-08-12,6 REIT Stocks Third Avenue Loves The Most
2020-08-06,"Five Point Holdings, LLC Sets Date for Second Quarter 2020 Earnings Announcement and Investor Conference Call"
2020-08-04,Our View On Five Point Holdings' (NYSE:FPH) CEO Pay
2020-07-22,Australia shares fall as record virus cases dent investor sentiment
2020-06-30,"Were Hedge Funds Right About Souring On Five Point Holdings, LLC (FPH)?"
2020-05-28,"FivePoint and City of Hope Complete Building & Land Sale for a $1B World-Class Cancer Care Center at FivePoint Gateway in Irvine, Taking Next Step in Strategic Healthcare Partnership"
2020-05-22,"Five Point Holdings, LLC (FPH) Q1 2020 Earnings Call Transcript"
2020-05-21,"Five Point Holdings, LLC Reports First Quarter 2020 Results"
2020-05-21,Five Point Holdings LLC to Host Earnings Call
2020-05-13,"Was The Smart Money Right About Five Point Holdings, LLC (FPH)?"
2020-05-11,"Five Point Holdings, LLC Sets Date for First Quarter 2020 Investor Conference Call"
2020-05-06,"Is It Too Late To Consider Buying Five Point Holdings, LLC (NYSE:FPH)?"
2020-04-01,"Mexico scrambles to meet desperate U.S., European ventilator demand"
2020-03-16,"Five Point Holdings, LLC Reports Fourth Quarter and Year-End 2019 Results"
2020-03-16,Five Point Holdings LLC to Host Earnings Call
2020-03-16,"Is Five Point Holdings, LLC (NYSE:FPH) Trading At A 34% Discount?"
2020-03-10,"Five Point Holdings, LLC Sets Date for Fourth Quarter and Year-End 2019 Earnings Announcement and Investor Conference Call"
2020-02-20,S.F. shipyard developer brings in government consultant team featuring Willie Brown
2020-02-20,Five Point Retains Prominent San Francisco Advisory Group and Transitions San Francisco Operations
2020-01-23,"Before You Buy Five Point Holdings, LLC (NYSE:FPH), Consider Its Volatility"
2020-01-21,"Treasure Island residents sue to halt 8,000-home megaproject over contamination"
2020-01-13,"Five Point Holdings, LLC Announces the Sale of First Homesites at New Community in Los Angeles County"
2020-01-08,Concord City Council makes a rare move on contentious mega-project vote
2019-11-25,Edited Transcript of FPH.N earnings conference call or presentation 8-Nov-19 6:00pm GMT
2019-11-08,"Five Point Holdings, LLC Reports Third Quarter 2019 Results"
2019-11-05,"Five Point Operating Company, LP -- Moody's announces completion of a periodic review of ratings of Five Point Operating Company, LP"
2019-11-01,"Five Point Holdings, LLC Sets Date for Third Quarter 2019 Earnings Announcement and Investor Conference Call"
2019-10-27,"Is Five Point Holdings, LLC (FPH) A Good Stock To Buy?"
2019-10-25,"If You Had Bought Five Point Holdings (NYSE:FPH) Stock A Year Ago, You'd Be Sitting On A 10% Loss, Today"
2019-10-23,Five Point sheds two-thirds of Candlestick retail space in shift to mixed-use office plans
2019-08-16,Edited Transcript of FPH.N earnings conference call or presentation 8-Aug-19 9:00pm GMT
2019-08-16,Is Five Point Holdings (NYSE:FPH) A Risky Investment?
2019-08-09,"Five Point Holdings, LLC (FPH) Q2 2019 Earnings Call Transcript"
2019-08-08,"Five Point Holdings (FPH) Reports Q2 Loss, Lags Revenue Estimates"
2019-08-08,"Five Point Holdings, LLC Reports Second Quarter 2019 Results"
2019-08-01,Five Point Holdings (FPH) May Report Negative Earnings: Know the Trend Ahead of Next Week's Release
2019-07-31,Dr. Michael Burry of 'Big Short' Likes Asia Stocks
2019-07-31,"Five Point Holdings, LLC Sets Date for Second Quarter 2019 Earnings Announcement and Investor Conference Call"
2019-07-23,"Five Point Announces Pricing and Upsizing of an Additional $125 Million of 7.875% Senior Notes due 2025 by Five Point Operating Company, LP"
2019-07-23,"Five Point Announces Proposed Offering by Five Point Operating Company, LP of an Additional $100 Million of 7.875% Senior Notes due 2025"
2019-06-25,"How Does Investing In Five Point Holdings, LLC (NYSE:FPH) Impact The Volatility Of Your Portfolio?"
2019-06-25,City of Hope Reveals Its Bold Vision to Invest More Than $1B for World-Class Cancer Care at FivePoint Gateway in Orange County
2019-06-24,"Is Five Point Holdings, LLC (FPH) A Good Stock To Buy?"
2019-06-21,"Marathon Asset Managements Return, AUM, and Holdings"
2019-05-16,Did You Manage To Avoid Five Point Holdings's (NYSE:FPH) 31% Share Price Drop?
2019-05-15,Edited Transcript of FPH.N earnings conference call or presentation 7-May-19 9:00pm GMT
2019-05-07,"Five Point Holdings, LLC (FPH) Q1 2019 Earnings Call Transcript"
2019-05-07,Five Point Holdings (FPH) Reports Break-Even Earnings for Q1
2019-05-07,Five Point: 1Q Earnings Snapshot
2019-05-07,"Five Point Holdings, LLC Reports First Quarter 2019 Results"
2019-05-07,Five Point Holdings LLC to Host Earnings Call
2019-05-02,"Heres What Hedge Funds Think Of Five Point Holdings, LLC (FPH)"
2019-05-01,"Five Point Holdings, LLC Sets Date for First Quarter 2019 Earnings Announcement and Investor Conference Call"
2019-03-20,Edited Transcript of FPH.N earnings conference call or presentation 13-Mar-19 9:00pm GMT
2019-03-13,Five Point: 4Q Earnings Snapshot
2019-03-13,"Five Point Holdings, LLC Reports Fourth Quarter and Full-Year 2018 Results"
2019-03-13,Five Point Holdings LLC Class A to Host Earnings Call
2019-03-12,Developer pushes to transform former 49ers parking into condos at Candlestick Point
2019-03-12,Exclusive: Five Point kills plans for $1 billion shopping center at Candlestick Point and will build offices instead
2019-03-04,"Five Point Holdings, LLC Sets Date for Fourth Quarter and Full-Year 2018 Earnings Announcement and Investor Conference Call"
2019-02-27,Matador Resources Co (MTDR) Q4 2018 Earnings Conference Call Transcript
2019-02-26,[$$] Five Point Energy Forms Second Midstream Joint Venture with Matador Resources
2019-02-25,Lennar seeks approval for 600 more East Bay homes
2019-02-21,"Dr. Michael Burry of 'Big Short' Reveals Stakes in Google, Facebook"
2019-02-14,"Should We Be Cautious About Five Point Holdings, LLCs (NYSE:FPH) ROE Of 1.8%?"
2019-01-20,Australian shares edge up ahead of China data; NZ gains
2019-01-09,Five Point Sees Hammer Chart Pattern: Time to Buy?
2018-12-21,Edited Transcript of FPH.N earnings conference call or presentation 13-Nov-18 10:00pm GMT
2018-12-10,[$$] Greener route cuts through legal tangle
2018-12-09,Is Five Point Holdings (FPH) A Good Stock To Buy?
2018-11-20,"Recent Analysis Shows LiveRamp, Five Point, Corporate Capital Trust, Fresenius Medical Care AG & Co. KGaA, Lsb Industries, and Telefonica Brasil S.A Market Influences  Renewed Outlook, Key Drivers of Growth"
2018-11-13,Five Point: 3Q Earnings Snapshot
2018-11-13,"Five Point Holdings, LLC Announces Third Quarter 2018 Results"
2018-11-13,Are Five Point Holdings LLCs (NYSE:FPH) Interest Costs Too High?
2018-11-02,"Five Point Holdings, LLC Sets Date for Releasing Financial Results for the Third Quarter of 2018 and Investor Conference Call"
2018-10-26,"U.S. government plans to sue Hunters Point shipyard contractor, alleging fraud"
2018-09-06,Why Five Point Holdings LLC (NYSE:FPH) Is An Attractive Investment
2018-08-23,Edited Transcript of FPH.N earnings conference call or presentation 13-Aug-18 9:00pm GMT
2018-08-21,Developers sue Navy over $6 billion Concord Weapons Station redevelopment
2018-08-14,FivePoint's massive waterfront retail development remains on shaky ground
2018-08-13,"Five Point Holdings, LLC (FPH) Q2 2018 Earnings Conference Call Transcript"
2018-08-13,"Five Point Holdings, LLC Announces Second Quarter 2018 Results"
2018-08-13,Five Point Holdings LLC Class A to Host Earnings Call
2018-08-13,Should You Be Tempted To Sell Five Point Holdings LLC (NYSE:FPH) Because Of Its PE Ratio?
2018-08-07,"Five Point Holdings, LLC Sets Date for Releasing Financial Results for the Second Quarter of 2018 and Investor Conference Call"
2018-06-28,Five Points SF Shipyard and Candlestick Point Communities Achieve Major Milestone With Unanimous Approval of San Francisco Board of Supervisors
2018-06-15,Navy to test soil for radiation where housing was built at San Francisco Shipyard
2018-06-14,"Five Point Holdings, LLC Announces Filing of Resale Shelf Registration Statement"
2018-05-25,Free Research Report as American Tower's Q1 Top-Line Growth Met Forecasts
