2021-01-11,Signets Holiday Results Could Shine. The Stock Already Shows It.
2021-01-11,Signature Aviation climbs above value of agreed $4.6 billion buyout offer
2020-12-19,Is SIG A Good Stock To Buy Now According To Hedge Funds?
2020-12-18,"Blackstone swoops on private-jet company with $4 billion cash takeover offer, amid collapse in global business travel"
2020-12-14,Signet's (SIG) E-commerce Wing to Remain an Upside in 2021
2020-12-06,"Signet Jewelers Limited Surprised Analysts With A Profit, And Analysts Boosted Their EPS Forecasts"
2020-12-04,Signet Jewelers sees jump in pandemic engagement proposals ahead of holiday season
2020-12-04,"Signet (SIG) Q3 Earnings Top, Path-to-Brilliance Plan on Track"
2020-12-04,What These Trends Mean At Signet Jewelers (NYSE:SIG)
2020-12-03,Signet Jewelers (SIG) Q3 2021 Earnings Call Transcript
2020-12-03,Signet Rebounds Ahead of Holiday Season
2020-12-03,Signet Jewelers Rises After Beating Q3 Earnings Estimates
2020-12-03,Signet (SIG) Beats Q3 Earnings and Revenue Estimates
2020-12-03,Recap: Signet Jewelers Q3 Earnings
2020-12-03,Signet Jewelers stock shoots up after surprising with a profit and revenue growth
2020-12-03,Signet Jewelers Ltd. to Host Earnings Call
2020-12-02,Preview: Signet Jewelers's Earnings
2020-12-01,Signet (SIG) Q3 Earnings to Benefit From E-Commerce Strength
2020-11-27,Signet (SIG) to Report Q3 Earnings: What's in the Cards?
2020-11-26,Signet (SIG) Expected to Beat Earnings Estimates: Should You Buy?
2020-11-26,Factors Influencing Five Below's (FIVE) Fate in Q3 Earnings
2020-11-19,Struggling Retailers Rack Up $52 Billion in Missed Rent
2020-11-18,Is Signet (SIG) Stock Undervalued Right Now?
2020-11-10,"Nautilus' (NLS) Q3 Earnings Beat Estimates, Revenues Up Y/Y"
2020-11-04,Why Signet Jewelers (SIG) Stock is a Compelling Investment Case
2020-10-30,"At Jared, a Year of Transformation"
2020-10-20,Signet (SIG) Boosts Digital Offerings to Enrich Holiday Shopping
2020-10-19,Signet Jewelers Accelerates Path to Brilliance to Reinvent the Holiday Shopping Experience for Jewelry
2020-10-14,Signet Jewelers Pivots as Love and Life Move Online
2020-10-05,Zoom-worthy pieces like earrings and necklaces are selling though jewelry is expected to take a COVID-19 hit in 2020
2020-10-03,Signet (SIG) Up 9.2% Since Last Earnings Report: Can It Continue?
2020-09-24,"Signet Shines on Strong E-commerce, Stock Up More than 70%"
2020-09-09,Tiffany & Co. is in big trouble without LVMH's $16 billion takeover  here's the biggest reason why
2020-09-06,Signet CEO: Coronavirus sparking a 'focus on relationships' and boosting Internet sales
2020-09-04,"Signet (SIG) Q2 Loss Narrower Than Expected, Sales Down Y/Y"
2020-09-03,Signet Jewelers (SIG) Q2 2021 Earnings Call Transcript
2020-09-03,Signet Jewelers CEO sees couples quarantining together fast-forwarding engagements
2020-09-03,Why Signet Jewelers Is Tumbling This Morning
2020-09-03,Signet Jewelers Results Beat Estimates - Shares Rise
2020-09-03,"Signet (SIG) Reports Q2 Loss, Tops Revenue Estimates"
2020-09-03,Recap: Signet Jewelers Q2 Earnings
2020-09-03,"Signet's stock surges after much narrower-than-expected loss, upbeat sales outlook"
2020-09-03,Signet Jewelers Reports Q2 Results And Accelerated Sales Momentum
2020-09-02,Signet Jewelers Earnings Preview
2020-08-31,How Signet (SIG) Is Poised Ahead of Q2 Earnings Release
2020-08-28,Stocks To Watch: Signet Jewelers Sees RS Rating Rise To 83
2020-08-27,Signet (SIG) Expected to Beat Earnings Estimates: Can the Stock Move Higher?
2020-08-18,Signet Jewelers Enables Safe Shopping with Debut of New Love Takes Care® Safety Program and Expanded eCommerce Options
2020-08-13,Is the Options Market Predicting a Spike in Signet Jewelers (SIG) Stock?
2020-08-06,Signet Jewelers Announces Timing Of Fiscal 2021 Second Quarter Earnings Release And Conference Call
2020-07-16,Were Hedge Funds Right About Signet Jewelers Limited (SIG)?
2020-06-15,Hedge Funds Coming Back To Signet Jewelers Limited (SIG)
2020-06-10,Edited Transcript of SIG earnings conference call or presentation 9-Jun-20 12:30pm GMT
2020-06-10,Why Signet Jewelers Stock Is Sinking Today
2020-06-10,"Signet Jewelers to Close 380 Zales, Jared, and Kay Stores in 2020"
2020-06-10,Signet (SIG) Falls 16% on Reporting Loss & Sales Miss in Q1
2020-06-09,Signet Jewelers Ltd (SIG) Q1 2021 Earnings Call Transcript
2020-06-09,Why Signet Jewelers Stock Is Down Today
2020-06-09,Signet Jewelers Loses Sparkle as Pandemic Pummels Sales
2020-06-09,Signet Jewelers Reported a Smaller-Than-Expected Loss. Heres Why Its Stock Is Getting Crushed.
2020-06-09,Signet Jewelers Permanently Closing About 400 Stores This Year
2020-06-09,"Signet (SIG) Reports Q1 Loss, Misses Revenue Estimates"
2020-06-09,Signet Jewelers: Q1 Earnings Insights
2020-06-09,"Signet Jewelers stock falls after less-than-expected loss, but total and same-store sales miss"
2020-06-09,Signet Jewelers Reimagines The Digital Jewelry Shopping Experience As Stores Begin To Safely Reopen
2020-06-09,Signet Jewelers Reports Q1 Results And Accelerated Digital Focus
2020-06-09,Signet Jewelers Ltd. to Host Earnings Call
2020-06-09,"Earnings Scheduled For June 9, 2020"
2020-06-08,Tiffany & Co. and Chewy earnings: What to know in markets Tuesday
2020-06-07,FOMC decision: What to know in the week ahead
2020-06-02,Analysts Estimate Signet (SIG) to Report a Decline in Earnings: What to Look Out for
2020-05-29,Are Options Traders Betting on a Big Move in Signet (SIG) Stock?
2020-05-28,"U.S. firms shield CEO pay as pandemic hits workers, investors"
2020-05-28,"INSIGHT-U.S. firms shield CEO pay as pandemic hits workers, investors"
2020-05-12,Signet Jewelers Announces Timing Of Fiscal 2021 First Quarter Earnings Release And Conference Call
2020-05-09,Why Did Signet Jewelers Stock Gain Over 26% On Friday?
2020-05-06,Were Hedge Funds Right About Signet Jewelers Limited (SIG)?
2020-05-04,Signet Jewelers Announces New SVP Investor Relations
2020-05-01,Why Signet Jewelers' Stock Was Down on Friday
2020-04-29,Why Signet Jewelers' Stock Was Up Again Today
2020-04-28,"Why Hawaiian Holdings, Signet Jewelers, and Meredith Jumped Over 15% Tuesday"
2020-04-25,Signet (SIG) Down 20.1% Since Last Earnings Report: Can It Rebound?
2020-04-06,"Nike, Signet Jewelers See Significant Insider Stock Purchases"
2020-04-02,"Meet the new fallen angels: Macys, Coach- and Michael Kors-parent credits cut to junk at Fitch"
2020-03-30,Signet UK Finance plc -- Moody's downgrades Signet's CFR to Ba3
2020-03-27,Edited Transcript of SIG earnings conference call or presentation 26-Mar-20 12:30pm GMT
2020-03-27,"Signet (SIG) Q4 Earnings and Sales Beat Estimates, Stock Up"
2020-03-27,"Company News for Mar 27, 2020"
2020-03-27,New Strong Sell Stocks for March 27th
2020-03-26,"Signet Jewelers in $240 million settlement over sexual harassment, loan portfolio"
2020-03-26,Signet Jewelers: Q4 Earnings Insights
2020-03-26,Signet (SIG) Surpasses Q4 Earnings and Revenue Estimates
2020-03-26,Signet Jewelers Reports Fourth Quarter and Fiscal 2020 Results
2020-03-26,Signet Jewelers Ltd. to Host Earnings Call
2020-03-25,Signet Jewelers Q4 Earnings Preview
2020-03-25,Here's How Signet (SIG) is Poised Just Ahead of Q4 Earnings
2020-03-24,NYSE: SIG Investor Notice: Update in Lawsuit against Signet Jewelers Ltd. announced by Shareholders Foundation
2020-03-23,"Coronavirus update: 367,457 cases, 16,113 deaths, NYCs outbreak comes into focus"
2020-03-23,Signet to close all North American stores temporarily over coronavirus
2020-03-23,Signet Jewelers Provides a COVID-19 Business Update
